id,title,selftext,score,created_utc,num_comments,subreddit,scraping_time_utc,created_datetime_utc,scraping_datetime_utc,top_comments
1m6q07y,I seriously feel like I’m being scammed. Advice?,"2018 Honda Accord Sport 1.5 148,XXX miles. So yesterday I went to go purchase new shoes since they are wearing out. I decided to take advantage of the buy three get one free and got my wheel alignment and all. They did recommend to me that my front struts are wearing out and to keep everything running smoothly. I should replace them in the future. I haven’t replaced the front struts and I know they should be replaced every 50,000to 100,000 miles. I asked the gentleman what would he quote me for the two front struts including labor and he told me $1600.. I really feel like this is an absurd amount. This post isn’t about my car shoes or anything like that mostly about what led to a quote of $1600 for labor and struts.  Is this normal? I need some advice? ",3,1753217992.0,14,MechanicAdvice,1753304285,2025-07-22 20:59:52,2025-07-23 20:58:05,"VeritasLuxMea (Score: 4): Is it an independent repair shop or a tire place? Under no circumstances should you have a tire place do your struts.

1600 is a little high for Quik Struts, but not exorbitant. Most cars usually come in around 1200 for Struts, sway bar links, and an alignment.

No-Land-7389 (Score: 1): Time to watch some YouTube videos and buy some quick struts if you’re even slightly mechanically inclined."
1m6pzcx,2015 Corolla alternator issue,"
Hey y’all, looking for advice for my next steps 

My Corolla started having some issues and I narrowed it down to alternator and battery 
Put a new battery in and changed the alternator. 
I noticed my battery was still dying occasionally so I took it to a local auto shop to have the alternator tested again. It’s still showing low output. 
Is there anything I should try before changing the alternator out again? ",1,1753217935.0,4,MechanicAdvice,1753304285,2025-07-22 20:58:55,2025-07-23 20:58:05,waynep712222 (Score: 2): https://i.redd.it/192cdpta3zdf1.jpeg. this test.
1m6piiv,Anyone know what this is?,Long story short. My sister drove over a small brink wall on my yard and the wheel liner ripped out along with this sensor but the clip broke. I’d like to replace. But I don’t know the part number to it. Any help is very much appreciated ,1,1753216834.0,11,MechanicAdvice,1753304285,2025-07-22 20:40:34,2025-07-23 20:58:05,"Heavenxhill (Score: 1): Could it be an ambient temperature sensor? I don’t see any other wires on the other end so it makes me feel like it could be. Does your car display the temp outside? Make/model etc could be helpful

FrenchOldMechanic (Score: 1): ***With just one photo it's imprecise. Maybe an ultrasonic sensor for parking.***"
1m6pguu,Noise help,Any help on this sound? Thank you so much ,1,1753216722.0,4,MechanicAdvice,1753304285,2025-07-22 20:38:42,2025-07-23 20:58:05,"None (Score: 1): Sounds like a heat shield rattling on the exhaust, if your in an area where they use salt on the roads that’s most likely what it is, I see it all the time"
1m6pf3b,Heelp,New front end struts lower ctrl arm sway bars everything ,1,1753216609.0,2,MechanicAdvice,1753304285,2025-07-22 20:36:49,2025-07-23 20:58:05,Nacho55f (Score: 1): It just happens with the wheel all the way down to right
1m6p9oy,"Need help diagnosing a sound. 2006 Subaru Outback, started today. Intermittent knocking, I think on back right. Speeds up when wheels rotate faster but not motor-dependent. Ignore wet sound in foreground, camera fell near milk jug. Thank you!",,1,1753216261.0,6,MechanicAdvice,1753304285,2025-07-22 20:31:01,2025-07-23 20:58:05,"Aprilsknight (Score: 1): Additional info: sound first detected when driving on bumpy asphalt around 30 mph. In video, I am only going 5-10 up and down a hill, and had driven for 3 mins before noise started, including up to 30 on flat, smooth pavement and 20 on bumpy pavement.  Noise starts around 10 seconds in vid, but was going up small incline for a few seconds before starting.

I believe rear struts and brake rotors need replacement if that could be contributing. Did not see anything dragging on underside. No engine codes—I know a fair amount about the engine due to many DIY repairs but still learning about the rest.

Really appreciate anybody who can help out. Thanks for your time.

BocaBeats (Score: 1): probably something intersecting with the wheel or rotor, sounds like a subaru."
1m6p8s4,Honda Dealership service - AC condenser issue,"Hey everyone, looking for some advice on a frustrating experience I just had at a Honda dealership regarding my 2019 Honda Civic’s air conditioning.

A while ago, I took my car in and they diagnosed it with a leaking AC condenser. They didn’t have the part in stock, so I was told to wait. While waiting, I recharged the AC myself using a can of R-1234yf—the correct refrigerant for my vehicle.

Fast forward to July 14, I brought the car back in and they suddenly tell me my AC system is “contaminated,” claiming it contains **84% hydrocarbon** and only **14.8% correct refrigerant**. I was confused since I only used the right product and followed instructions carefully.

When I asked how this contamination could’ve happened, they gave me zero clear answers. Instead, they insisted I pay **two hours of labour** for diagnostics. I pushed back, asking for an explanation or even a theory, but got nothing useful in return.

I ended up writing a formal email to them asking for:

* A proper explanation of how they got those results
* How this could happen despite using the right refrigerant

**So Reddit:**

* Has anyone else experienced something similar?
* Is it possible the shop made a mistake with the diagnostic?
* Was I right to push back and ask for my money back?
* What should I do next?

Any advice would be appreciated.",0,1753216203.0,14,MechanicAdvice,1753304285,2025-07-22 20:30:03,2025-07-23 20:58:05,"TranWreckin (Score: 3): Shop uses a machine with a built-in sensor to check quality and type to ensure it's correct. If it's not correct, the machine will NOT continue the evacuation process. Leaving whatever in car, still in the car. 

EPA laws do not allow us(or anyone) to open the freon to atmosphere. It's harmful. It's stupid. They're going to have to manually remove the old stuff out with an empty container and vacuum the system. 

The can you bought may have said for 1234YF system, doesn't mean it didn't have something else in the can. Like a stop leak additive. And you admitted to putting that in your car. That is where your contamination came from.

Just cause it's not the answer you want, does not mean it's wrong. Sounds like you played yourself.

Realistic-March-5679 (Score: 2): No they are right. Laws and regulations on licensed AC professionals is quite strict. And those cans are notoriously impure and things like stop leak are considered contamination. If you contaminated your own system that was not something the factory supplied and obviously was not a problem when they initially diagnosed the problem. 2 hours of labor and nothing else is quite fair all things considered. Take this as a lesson, those cans are cheap for a reason."
1m6p2lk,ACURA SHAWD light on but no codes,Got a 2011 Acura RDX 2.3L turbo with 170k miles. I had the steering rack and struts replaced by a shop and it now has the SHawd light on. It had no issues before. The shop ran multiple scans and can't find any issues or codes for any system. I replaced the battery as it was getting old but it also made no difference. Any suggestions? because Im completely stumped. ,1,1753215802.0,2,MechanicAdvice,1753304285,2025-07-22 20:23:22,2025-07-23 20:58:05,BigBen9994 (Score: 1): The shop also did an alignment to make sure it was good
1m6oy3v,Replacing shocks 76 ford ranger,I got new shocks for my old lady and I think replacing them will be fairly simple but I don’t have a ton of experience and just want to know if there’s anything I should look out for or any tools I might need that wouldn’t be expected. Any tips at all would be greatly appreciated! ,2,1753215520.0,4,MechanicAdvice,1753304285,2025-07-22 20:18:40,2025-07-23 20:58:05,bear-dens (Score: 2): I’d mine with 2 jack stands and a jack.  May need a pry bar but mostly just lining them up
1m6oxr2,How do I remove these wheels?,"Been at this for a few hours and all I’ve been able to do is unscrew the center cap. Nobody online seems to have the same wheels, any advice is appreciated, thanks! ",48,1753215499.0,35,MechanicAdvice,1753304285,2025-07-22 20:18:19,2025-07-23 20:58:05,"stevey83 (Score: 133): Put a hook in the small hole and pull that cap off. Wheel nuts will be behind it.

OldGoneMild89 (Score: 4): Those are some old school 90's wheels"
1m6owpb,2019 honda accord lx with 85k miles $12.5k,So I found this car and has a rebuilt title from hail damage from a dealership with a 4.9 rating. Any thoughts on it? I found others with rebuilt titles but this is the only one for hail damage so far.,1,1753215435.0,9,MechanicAdvice,1753304285,2025-07-22 20:17:15,2025-07-23 20:58:05,"WhereDidAllTheSnowGo (Score: 1): We know even less than you

Take it to, or bring along, a mechanic and check it out

WhereDidAllTheSnowGo (Score: 1): Getting it from salvage to rebuilt can be a pain.  Once it’s all legit, inspected, etc, ready to sale & title transfer it’s easy.  Your particular insurance company may have another opinion"
1m6ovjd,Head gasket?,2001 toyota tacoma 2.4L recently on start ups i get this or a huge cloud coming out and when it reaches operating temp it goes away. is this the beginning of a blown head gasket? when i drive its fine but sometimes i get a slight loss of power and shoots out smoke just like this. ,2,1753215362.0,11,MechanicAdvice,1753304285,2025-07-22 20:16:02,2025-07-23 20:58:05,"DylanTheGameGuy (Score: 2): Does it smell slightly sweet?

Educational_Sale5545 (Score: 1): Could be oil from leaky valve stem seals, they usually cause smoke on start ups. How's oil consumption?

If it's cold/humid outside, this is also pretty normal from condensation."
1m6osjg,"So, turned the key and nothing happened. It’s a chipped key, between push button and regular key, so it’s all electric. Half a day of investigating later, I found this little wire. Does anyone know what it does and why it stopped my entire car? It’s inside my WIN module",2010 Chrysler town and country 3.3l LX,1,1753215174.0,3,MechanicAdvice,1753304285,2025-07-22 20:12:54,2025-07-23 20:58:05,"_Onix_The_Protogen (Score: 2): I figured it out, it’s the antenna to read the key. Rewound it, now it’s working again."
1m6orwk,Could someone tell me what this needs to connect to?,I have a 2013 Chevy Cruze and noticed this while I was checking the coolant and pretty sure it should be plugged into something. TIA,1,1753215135.0,2,MechanicAdvice,1753304285,2025-07-22 20:12:15,2025-07-23 20:58:05,FerrariF420 (Score: 1): Look for anything within a 3” radius that’s missing a plug and is of the same size
1m6omss,I thought it was a Diddy joke,"I had bought a cheap smoke machine for my shop off amazon. It did not come with any fluid to make smoke. I called everywhere around me, and was unsuccessful to find any that I could get that day.

I called a dealership and spoke to a parts guy and asked him to ask his master techs if they had any, I’d be willing to pay cash for them to put a little in this machine so I could finish my diagnosis of a car I had in the shop.

He said put baby oil in it. It’s cheaper and it works. I thought he was just messing around and making a joke.

It 100 percent works, and works well. 7 bucks a bottle compared to 45 dollars for “smoke fluid”. 

Just wanted to share that with the community. I’ve been doing this for 10 years, it’s the first I’ve heard of it. ",324,1753214816.0,53,MechanicAdvice,1753304285,2025-07-22 20:06:56,2025-07-23 20:58:05,"Equal_War9095 (Score: 136): My shop has a whole case full of baby oil, the diddy jokes were non stop

NoPresence2436 (Score: 116): Oddly enough, I have a rather extensive background in the chemical composition of commercial and military grade smoke oil / fog oil (it’s a long story). 

It turns out that smoke fluid is basically just highly purified mineral oil. The reason it’s highly purified and controlled is so it won’t hurt you if you breathe it in when it’s in a gaseous state. So yes, baby oil when vaporized will look exactly the same and will ‘PROBABLY’ not have unintended consequences if you breathe a bunch of it in… but the reason the official smoke fluid costs more is because of what’s guaranteed to not be in it rather than anything that’s been added (like fragrance put in baby oil)."
1m6olpf,"Rod knock on Acura MDX, am I cooked?","Hello everyone,

I was driving my 2009 Acura MDX on the highway, and the engine got loud and I saw small smoke coming under the hood, I parked the car on side of the road when I open the hood, the coolant and engine was very hot but the temp gauge was reading normal, when I turned on the car again now the engine/connecting rod making a loud noise.
Still runs and drives but moves slow.
I think the oil pump went bad and dried up the connecting rod bearing. 
My only is question is how bad the engine got damaged, can I get a away by replacing the bearing from the bottom?",0,1753214745.0,7,MechanicAdvice,1753304285,2025-07-22 20:05:45,2025-07-23 20:58:05,"None (Score: 1): [deleted]

o5blue8 (Score: 0): Yes, you're cooked if it's rod bearings. You would have scoring and metal shavings floating around.  Only a matter of time before that metal makes it back into a place it shouldn't be.

Drain oil,  pull the oil filter, check for shavings and glitter."
1m6ofic,WHEELS LOCKED CAR WONT MOVE E350 08’ w211,,1,1753214362.0,2,MechanicAdvice,1753304285,2025-07-22 19:59:22,2025-07-23 20:58:05,"SadSadler (Score: 1): Seems like the fact that neither your abs nor esp work, might be preventing you from moving. I think the car is in emergency mode of sorts."
1m6odql,"Any guesses on the 2 leaks? Dark oil was suggested as axle grease, we took a look under and it looks like the transfer case is leaking. 2014 Toyota Highlander transmission and axle was recently replaced",,1,1753214247.0,2,MechanicAdvice,1753304285,2025-07-22 19:57:27,2025-07-23 20:58:05,beedoobeee (Score: 1): It’s back at the dealership now but we are curious.
1m6ocjg,Jeep 4.0 rebuild or replace,"Hello, I have a 4.0 out of a 99 Cherokee. 
This engine both overheated and ran very low on oil at the same time. I’m sure the one was because of the other. 

I am thinking that the repair it needs is beyond a “light refresh” and it is going to need machine work and over spec parts. 

Here are the measurements and some pictures. 


The first two pics are of the worst and best looking connecting rod bearings. Most are down to the copper. 

The caps and their half of the bearing look better across the board. None are down to the copper. 

Connecting rod journals 
Piston one, 2.0944 
Piston two 2.0944
Piston three 2.0944
Piston four 2.0945
Piston five 2.0944
Piston six 2.0945

Main journals 
First Main 2.4991
Second main 2.4993
Third main 2.4990
Fourth Main 2.4990
fifth main 2.4989
Sixth main 2.4991
Seventh Main 2.4985 


Piston wall diameter 
The worst one was ‎ = 3.885
With almost all being within .003 of that 
I measured six points on each piston but don’t want to overwhelm this post. 

I did not measure the piston ring gap. But I think this is enough info to get a good idea of what shape the engine is in. 

The block is not warped, but the head is. I didn’t write down how bad so I’ll have to check that again. 

I’ll add more pictures to the comments as needed. 

Anyone experienced in engine building I’d appreciate your advice and input! I did not find a definitive answer on what the specs and tolerances should be for this year. 

Thank you! 

",1,1753214173.0,9,MechanicAdvice,1753304285,2025-07-22 19:56:13,2025-07-23 20:58:05,"lampministrator (Score: 1): That block is 100% salvageable.  Save for a few tidbits -- Inspect the journal surfaces on the block.  Have any of them ""spun"".  You might be in trouble if so. If they and the caps look ok, I would hone and run with it.

Those journals are fucked.  You need the measurements on the crank, but if those surfaces on the crank are anything like the journals, just replace it.  

I would say the rods don't look bad .. But I haven't seen all of them ..  If that's the worse one, then I think you are OK.  I would be concerned if there was an indication that the bearing ""spun"".  

I think you need a bearing set, piston and ring set (some require an oversize bore -- Look into that -- You have the measurements, the dealer can help you out as most dealers sell stock and oversized pistons.), and a new crank.  That's my arm-chair analysis."
1m6o861,Head gasket sucked all the coolant dry; what else needs replacing,"Bought a 1992 fleetwood with a busted head gasket. THe gasket mustve been busted very badly or for a while because it drank ALL the coolant, in the radiator and reservoir. 

I'm doing the fix myself so im just replacing the whole engine to make my life easier from one in the scrapyard. But what other components might be damaged from running on no coolant? Im changing the radiator too since its already rusting without any coolant in it but what else?",3,1753213899.0,6,MechanicAdvice,1753304285,2025-07-22 19:51:39,2025-07-23 20:58:05,"Firm_Leave_4903 (Score: 3): Heater core and thermostat since you’re already replacing everything else

ThaPoopBandit (Score: 3): Don’t take anyone’s word for it, if it was ran with no coolant, need to do manual compression test to make sure it was not over heated or something crazy, also make sure crank does 360"
1m6o5fa,can i fix this issue???,"
there is smoke coming out of this area, checked oil and it’s low. my car has never had leaking issues before, so is it safe to fix? or better yet, worth it to fix?

2006 honda accord V6",4,1753213730.0,10,MechanicAdvice,1753304285,2025-07-22 19:48:50,2025-07-23 20:58:05,"BigPharmaEntranced (Score: 8): It looks like your valve cover gasket is leaking and getting on the catalytic converter. This is a fairly simple at home job! Gaskets and RTV gasket maker are fairly cheap. I recommend getting honda brand gaskets because they're about the same price (or a little more) as the parts store brands and they're high quality.

o5blue8 (Score: 5): The fact that you have that much buildup on the front side of your motor indicates you have had leaking issues for a long time from the valve cover, but you haven't addressed them (possibly for numerous reasons).  The leak is just now bad enough that you are seeing it on the cat.  It is very common.

You need to change the valve cover gasket.  Oil leaking on the catalytic converter can absolutely cause it to fail, which would lead to a much more expensive fix.  Side note - it can and will also kill your alternator if you don't address it.  Alternators don't like to be filled with oil.

You need to check the rear valve cover also.  I'm willing to bet it's worse.  The front is an easy-ish fix, the rear takes a lot longer.  You can check youtube.  Tons of videos out there for the how-to."
1m6nywa,5.7 Hemi Car over heating and not turning over,"So I just had the alternator and starter replaced on my 2013 Dodge Charger 5.7 and I’m thinking I may have drained the battery by driving so long without replacing it. In the video there’s the sound of it not turning over so any guesses? Now another concern is I have been having radiator/coolant issues since I got the dang thing and I plan to replace the coolant temp sensor (which I think is what’s causing issues not allowing coolant thru the system) what sucks is this keeps happening back to back. I’ll have issues, get it fixed, next morning over it’s not starting or overheats this is the second time it’s happened and I really just want to check all the boxes before driving this thing full time don’t want any damage done to it. I feel as if it’s not in a fatal spot yet but if I don’t check some of these boxes then it may be. Anything helps thank you!",1,1753213321.0,3,MechanicAdvice,1753304285,2025-07-22 19:42:01,2025-07-23 20:58:05,"lampministrator (Score: 1): Your coolant temp sensor displays temp on your dash and turns the cooling fans on and off ..  The thermostat controls your engine temp from cold->hot --  It feels like you are guessing here, and that's a bad idea when it comes to the actual fix, because you might throw good money at a good part that didn't need to be replaced.  If you feel confident in your diagnosis, great ... But if you feel you are out of your depth, sometimes just paying to have someone look at it can pay off, even if you end up doing the work yourself.

chromatones (Score: 1): Hopefully there isn’t coolant inside the engine, have you check your oil stick and see if it’s milky ?"
1m6njrt,OEM VS. Aftermarket Subaru Head Gasket,"Hi! I am going to replace my 2015 Subaru Impreza head gasket, but I am conflicted on what brand of gasket I should get. I’m leaning towards OEM because I need this car to last me, but I keep seeing threads online saying it’s not necessary. I would prefer to buy a head gasket kit on RockAuto, but I just want to get the best quality gasket!! Please drop your thoughts and suggestions!",1,1753212377.0,5,MechanicAdvice,1753304285,2025-07-22 19:26:17,2025-07-23 20:58:05,"lampministrator (Score: 3): Any MLS gasket will do .. OE or otherwise.  I do the Engine Tech kit when I do Subis ..  I have never had a comeback.  While you are there, do a full timing kit and water pump.  Send your heads out to be cleaned and warp checked / milled, and have the valve seals replaced.  Do it right and you'll get another 250k out of it no problem.

Vic_Pirelli (Score: 2): I've been pleased with the Mahle gaskets I've bought, but never used one of their head gaskets.  They make quality gaskets and seals. 

The Mahle multi layer steel head gasket kit on RockAuto looks like a nice deal.

Don't forget to hit r/RockAuto/ and grab a coupon code for 5% off your purchase."
1m6nh3q,2019 Audi RS5 Sportback - Persistent Cylinder 4 Misfire,"Hey all, I’ve got a 2019 RS5 Sportback (~64k mi, EA839 2.9TT) Stage 2+ tuned with 034 ECU/TCU, IE air-to-air intercooler, HPFP, downpipes, etc. Full build sheet in profile. Prior cyl 4 misfire was fixed with OEM plugs.

After filling up with 93 like usual, it suddenly threw a drivetrain malfunction, misfired, and idled rough—no sounds or smells.

Codes:
• P023B (cooler pump low – likely from intercooler swap)
• P0300, P0304 (confirmed misfires)
• P0363 (fueling disabled – not confirmed)

Coils, plugs, and compression all check out. Mechanic’s testing injectors and about to reflash ECU.

Anyone run into something similar on RS5s/S5s or tuned 2.9TTs?",1,1753212201.0,2,MechanicAdvice,1753304285,2025-07-22 19:23:21,2025-07-23 20:58:05,"lampministrator (Score: 1): Did you do a cold compression check as well as hot .. That can make a difference.  Also sometimes a sticky valve at speed during full boost can cause a misfire. But with a rough idle that. sounds implausible.  Before I sent those injectors out, I would have just swapped 3 and 4 to see if the code moved to a 303.  But all things being equal, you did all the right things .. swap coil from 3-4 .. Swap plug from 3-4 .. See if they moved.  You say they checked out ..  Injector is the last culprit without getting into mechanics and timing .. Like a flattened lobe or something like that on the cam --  Which will give you good compression, but lacks the air flow if it's an intake valve."
1m6ngox,Is this sounds normal? I can never tell if my engine sounds healthy I am paranoid sorry for being I knowledgeable,,5,1753212174.0,10,MechanicAdvice,1753304285,2025-07-22 19:22:54,2025-07-23 20:58:05,kyden (Score: 2): Sounds like the hydraulic timing belt tensioner has failed.
1m6mjcx,Can’t remove caliper due to bolt being stuck.,I drive a 2020 Corolla and I’m changing my break pad for the first time. I can’t get the caliper off because every time I turn either bolt the nut turns with it. I tried putting a wrench in there to hold the nut in place while I turn the bolt but I can’t seem to fit a wrench in there either. Every wrench I try is too wide to hold it down properly. At this point I’m looking for an alternative to removing the caliper and somehow replace the break pads without removing the caliper. ,1,1753210122.0,3,MechanicAdvice,1753304285,2025-07-22 18:48:42,2025-07-23 20:58:05,"tastytang (Score: 1): You can get narrow wrenches:

https://www.amazon.com/Erwachte-Super-Thin-8-Piece-Including-Spanner/dp/B09H7SHQT5/

Vic_Pirelli (Score: 1): https://preview.redd.it/rvyfiehe8hef1.jpeg?width=768&format=pjpg&auto=webp&s=cff7b172cabf175fd9d04008c29ec9ab3ce8c234

The nut is actually the head of the caliper pin, and will look like the above picture.  You're right, you can't get a standard wrench on it.  They make special flatter wrenches for it.  But you only have to get the bolt started, you won't have to hold the pin the whole time.  I've had good luck using needle nose pliers for this.  You also might be able to jam a screwdriver or small prying tool to hold the pin to get the bolt started.

whereisyourwaifunow (Score: 1): not mechanic, but when i needed a thinner wrench for situations like this, i used an angle grinder to make the jaws of an adjustable wrench thinner"
