id,title,selftext,score,created_utc,num_comments,subreddit,scraping_time_utc,created_datetime_utc,scraping_datetime_utc,top_comments
1m63pc2,Acdelco gold or moog tie rod ends?,"Hello what is better Acdelco gold or moog tie rod ends? The acdelco gold is like double the price 
And i got the acdelco gold but i see no 555 mark on it is that fine ? ",1,1753155325.0,5,MechanicAdvice,1753304285,2025-07-22 03:35:25,2025-07-23 20:58:05,"SantosHauper (Score: 1): Moog.  Delco gold is just the Chinese manufactured GM part, the label it so you think it's premium when it's just that GM has a Chinese supplier now."
1m63lgc,2013 grand Cherokee 3.6l,Thoughts of what this could be? The lady said the coolant light came on and she couldn’t pull overs,1,1753154984.0,2,MechanicAdvice,1753304285,2025-07-22 03:29:44,2025-07-23 20:58:05,lethalnd12345 (Score: 1): Is that coolant? Does it smell like coolant? That's a significant leak that needs to be diagnosed and repaired before you keep driving the vehicle
1m63ja9,I think I know why my car is having a hard time reversing but i’d like others opinions!,So late last month my back brakes started to sound like they were grinding. I drive a 2012ish chevy malibu. very old. lots of miles. I haven’t been able to afford getting my brakes fixed yet so i’ve been doing my best to baby them as much as possible. today on my way to work I had to stop at the gas station. when I tried backing out it felt like something was blocking my car or like I was trying to back over speed bumps.. if that makes sense 😅 it drives forward fine but backing up is not looking good. i’m assuming it’s because the brakes are just that bad? i’m really hoping it’s not a bigger issue!! i’m calling my body shop tomorrow to make an appt but im really worried it’s gonna be a huge issue and im out loads of money that I don’t have! ,3,1753154797.0,3,MechanicAdvice,1753304285,2025-07-22 03:26:37,2025-07-23 20:58:05,rekleiner33 (Score: 1): Brakes binding are independent of direction of travel
1m63ity,2019 HONDA CRV WONT START,"My 2019 Honda CRV wouldn’t start today when I tried to start. Jumped the car, let it run for a few min, turned it off and then tried to start again but failed. 

Later I jumped again went to autozone and battery health alternator health everything is good. I am 101% sure that there is no lights draining the battery or anything too because I always set everything to auto plus when I visually confirm that every lights are off too. 

What could be the issue? 

Please help!!",1,1753154760.0,3,MechanicAdvice,1753304285,2025-07-22 03:26:00,2025-07-23 20:58:05,"SanchitoBandito (Score: 1): Could be a draw, but could still be a shit battery. I've seen a few that pass battery tests but still got a bad cell. I work on Hondas and I swear its always the CRVs getting the parasitic draws. If you bought it new and it still somehow has the original battery I'd change it. Or if you know its been awhile since you last changed it."
1m63feq,Just Started Hearing Knocking,"I thought the issue was the active grill air shutter error I’ve been getting for 3 years after a little fender bender, but I was told it wasn’t a major problem. And I’ve never heard this before. 

The check engine light is on, but it has been coming on and off since the FB usually for a day or so and then will be off for months. 
The only things that has happened otherwise is that I filled the tank with gas from Sam’s Club yesterday. 
No idea what’s going on. 
2019 Chevy Equinox",2,1753154468.0,8,MechanicAdvice,1753304285,2025-07-22 03:21:08,2025-07-23 20:58:05,boafish (Score: 1): Your active shutters are in a bind. What you’re hearing are stripping gears skipping teeth.
1m63b1o,Is this VVTI Rattle ? ( 2012 Avalon/2GR FE),This is on a cold start. ,3,1753154110.0,2,MechanicAdvice,1753304285,2025-07-22 03:15:10,2025-07-23 20:58:05,kaiserdood (Score: 1): Yes
1m63ad4,2016 Nissan Altima or 2014 Hyundai Sonata?,"Already looking at the Sonata as a better choice people seem to be more happy and it’s a common and sleek car. I’m more of a low profile type of person but the Sonata is silver and the Altima is black

Altima has 86k and the Sonata has 90k engine replacement.

Any advice or knowledge on either vehicle and why one would be better than the other",1,1753154055.0,2,MechanicAdvice,1753304285,2025-07-22 03:14:15,2025-07-23 20:58:05,"lethalnd12345 (Score: 1): Neither is a very good choice. The reliability of both vehicles is suspect at best. As noted with the Hyundai, the engine has already been replaced once. 

Unless you have absolutely no other options, I would pass on both"
1m633da,1980s ish Dodge B250,"Realistically what’s the best fuel economy you could get on a 80s ish dodge b250 with a few mods? And which mods would actually be worth the cost? 

I don’t have a specific year or engine in mind yet. As I am still trying to determine what the most affordable option would be to convert into a camper van ",3,1753153483.0,3,MechanicAdvice,1753304285,2025-07-22 03:04:43,2025-07-23 20:58:05,"No_Week_8796 (Score: 1): I just realized I wasn’t very specific in the type of mods, and unfortunately it doesn’t look like I can edit the post…. 

Which mods to improve fuel economy would be worth the cost?

Or if nothing else, where would you suggest I go to find the answers? This whole project is going to be a huge learning curve for me

Findlaym (Score: 1): No mod will meaningfully improve fuel mileage. You drive slower and accelerate slower. Or you can shed weight or improve aerodynamics - both of which are antithetical to a camper van."
1m62wle,mk4 gti vr6 stalls when maf is plugged in,"hello, I have a 2002 24v vr6 gti that’s has a lot a problems but im trying to figure this one out. when the maf is unplugged it runs on the map setting from ecu but it runs very rough. whenever i plug in the maf though it stalls out after a couple seconds. the car also makes a whooshing sound from the intake whenever I quickly press the pedal. I have 3 different maf sensors and all of them aren’t faulty. im suspecting a vacuum leak",1,1753152925.0,2,MechanicAdvice,1753304285,2025-07-22 02:55:25,2025-07-23 20:58:05,TemkeF (Score: 1): u answered ur question boss man
1m62vru,Does this quote look correct?,"Took my car in for an oil leak, this is the quote they gave me. Why does it look like I’m being charged 3x for the same thing? Is this a fair quote? Asked the shop for an explanation and they weren’t super helpful. Thanks! ",1,1753152856.0,3,MechanicAdvice,1753304285,2025-07-22 02:54:16,2025-07-23 20:58:05,"Regular_Particular17 (Score: 1): Their quotes are weird, anything that says remove and replace is labor and the number is the number of hours, everything else is parts. I don’t like the charging for a multi point, most places it’s free, telling you what’s wrong with your car is how we make money."
1m62v10,What would be the flange inside diameter for this particular filter?,Anyone has any idea what would be the inside flange diameter for the Air Filter in this image? I’d like to buy this particular intake from eBay as well as a K&amp;N filter however I’m trying to figure out the exact dimensions as the one in this picture.,1,1753152795.0,3,MechanicAdvice,1753304285,2025-07-22 02:53:15,2025-07-23 20:58:05,"mechrisme (Score: 1): I would say 3 in by looking at that measurement in the photo, some filters are universal so they come with bushings

Regular_Particular17 (Score: 1): The inside of the filter would be 3 inches, since the outside of the pipe is 3"
1m62t6m,Engine codes,,1,1753152643.0,3,MechanicAdvice,1753304285,2025-07-22 02:50:43,2025-07-23 20:58:05,"Regular_Particular17 (Score: 2): Vaccum leak probably

NCsnubs (Score: 1): check for a leak between maf and throttle body.  my intake tube was brittle and a tiny crack was letting air in and got that code."
1m62suj,Cracked Steering Knuckle,"I was attempting to tighten the bolt, however I tightened it too much leading to it cracking. How dangerous is this? Do I drive it while I wait for the new knuckle?

",28,1753152616.0,42,MechanicAdvice,1753304285,2025-07-22 02:50:16,2025-07-23 20:58:05,"306metalhead (Score: 56): Do not drive it.

Foreign-Management36 (Score: 30): Noted, thank you all for your replies… I choose to live."
1m62shc,Transmission overfilled,"So i did a drain and refill on my toyota rav 4transmission with a friend of mine who worked at toyota for 5 years, he took a scan tool from somebody who i dont know its an autel619 scan tool. We did the procedure and during the level check my friend read the ect (coolant temp) instead of atf temp, i drove the car for 7 miles after that and quickly realised what had happened. I realised it cause i wanted to buy the same scan tool for my other toyota and got to know how he messed up, is my trans damaged or would it be fine?",1,1753152587.0,6,MechanicAdvice,1753304285,2025-07-22 02:49:47,2025-07-23 20:58:05,"Fluffy-Abies2937 (Score: 1): Why not check your transmission fluid level again?

FreeSquirkJuice (Score: 1): If you're positive it's overfilled just crack the drain pan bolt enough to where a small drip forms and let it slowly drip into a measuring container."
1m62rc0,5.7 Hemi Low Oil Pressure,"Picked up a 2012 dodge charger, with the 5.7 hemi. Car has 3 codes, P000B, P0522, P0520.

The car starts and runs great, smooth, and quiet. Just these codes won’t go away, there is some electrical stuff going on also, such as the windows working intermittently and the steering wheel buttons not working. 

Anybody ever had a similar experience? Any advice? I picked up a new oil pressure sensor as well as a new vct solenoid which I plan to change out soon as it was inexpensive.

Recent maintenance stated by previous owner is new thermostat, new waterpump, as well as serpentine belt.

Thanks to all in advance ",1,1753152491.0,2,MechanicAdvice,1753304285,2025-07-22 02:48:11,2025-07-23 20:58:05,Fluffy-Abies2937 (Score: 2): Change your oil and replace the oil pressure sensor
1m62i2a,Belt making this annoying noise. XUD9,"This belt has been making this noise lately. It sounds when it's just started, after a while it stops, but if the ambience is too wet, it will be making that noise no matter what.

The belt is new (I changed it at the end of the last year), and it started making that sounds progressively as we where getting close to winter.

I'm not a mechanic, but from what I see, I think the belt is loose. I've tried to tightening it following some youtube videos, but I haven't succeeded clearly :'( So, before I mess it up, I'm recurring to you guys. I found myself without the proper tools or maybe I'm simply not strong enough to loose some bolts to move the pulley that's supposedly not pulling enough. 

Thank you so much beforehand &lt;3",1,1753151738.0,4,MechanicAdvice,1753304285,2025-07-22 02:35:38,2025-07-23 20:58:05,"306metalhead (Score: 1): Does your power steering whine? Is your cooling deminished/engine running hot or hotter than usual? Your belt, unless you have an aux belt, will hit you water pump pulley , alternator pulley, condenser pulley, power steering pulley, and crankshaft pulley and a tensioner pulley. One of those is shot. My guess would be tensioner if there is no other issues other than the sound and loose belt.

xROFLSKATES (Score: 1): See that line forming on the back of the belt? (the smooth side)

You have a bad smooth pulley somewhere probably. Could be dragging against it. You may even have the belt too tight. Loosen the belt and spin the pulleys by hand, see if any of them feel crunchy or rough."
1m62b0d,Long story short - car starts and immediately dies,"Car will start but wont stay on.

When putting the negative terminal back on after a valve cover gasket, spark plugs + wires job, we broke the rusted nut on the negative terminal and the connector was shot. We put on a new connector but not sure if we did it right.

For context: Did accidentally try to start the car with cylinders 2 &amp; 4s spark plug wires switched. Also did not use torque wrench for spark plugs. Fixed that and then the car idled rough, but did not stutter at all upon idle acceleration. We think it may have idled rough because before we started the job we noticed the passenger PCV hose was disconnected from the back. We think it may have been running rough because the ECU was accustomed to not having it. After this happened was when we broke the nut for the battery and attempted to replace it, now the car starts but dies immediately. A couple months ago my car would not start and we figured out it was due to the aforementioned terminal connection

Timeline (if this helps):

Started valve cover job -&gt; noticed PCV hose was disconnected -&gt; replaced air filter, spark plugs + wires (plug wells for 2&amp;4 had oil in them), and valve cover gasket -&gt; started car with plug wires for 2&amp;4 mixed up -&gt; fixed that, ran with rough idle and i turned the car off after ~60 seconds -&gt; think the battery terminal may be messed up but we snap the negative connector nut trying to tighten it -&gt; put on new negative connector but are worried it’s not correct -&gt; car will now start but not idle, it does immediately",2,1753151167.0,41,MechanicAdvice,1753304285,2025-07-22 02:26:07,2025-07-23 20:58:05,"TemkeF (Score: 9): Sounds more like vacuum leak than battery. Take a multi meter and measure volts away from the battery. If you are getting proper voltage not a battery problem

Better_Move_7534 (Score: 4): Fuel sys issue"
1m622n1,Arctic Freeze A/C refill,"About a month ago my A/C stopped blowing cold air so I decided to do the quick fix and get the arctic freeze refill can from O'Reilly. I read the instructions and gave it the ole college try. After doing it per the instructions. I checked inside the cabin and voila cold air. 

However it wasn't till after the fact that I fear I may have made some crucial mistakes.

1st. I didn't have the A/c to circulate but instead had it pulling from outside air

And 2nd per the pictures I held the can upside down and moved it like a clock hand from the 12 o' clock to the 3 o'clock.

I found out later that they're not supposed to be held upside down as that introduces liquid to the system. 

How much damage may I have done to the system by doing these 2 things? And why would the pictures show the wrong way in doing it?",4,1753150499.0,5,MechanicAdvice,1753304285,2025-07-22 02:14:59,2025-07-23 20:58:05,"xROFLSKATES (Score: 7): You didn’t hurt it. It’s already hurt. You have a leak somewhere if using these cans fixed it for awhile. It’s gonna leak out again.

These cans should be illegal, but that isn’t your fault.

Unpopopinionprobs (Score: 1): You should be fine, chances are you’re fine at least bud"
1m6218z,2019 Toyota Highlander showing “brake power low”,Went down the road to get the mail and the car was fine. Got home parked in the drive way and realized I needed to go to store to get something. I tried to turn the car back on and the brake was almost stuck and didn’t want to compress. A message popped up on the dash that said brake power low and nothing happens when I try to turn the car on. Don’t really know where to start with it. ,9,1753150384.0,13,MechanicAdvice,1753304285,2025-07-22 02:13:04,2025-07-23 20:58:05,"tattedsushiroll (Score: 11): Check you battery looks like it’s not fully charged, more than likely you need a battery.

toyotasquad (Score: 6): Battery dead"
1m620in,Lower control arm bushings,"How do my lower front control arm bushings look? A little cracked, I just did upper and lower ball joints. ",1,1753150326.0,3,MechanicAdvice,1753304285,2025-07-22 02:12:06,2025-07-23 20:58:05,TheIronHerobrine (Score: 1): If you like the car change them. If it’s an absolute beater don’t bother until it gets worse. Just be ready to get an alignment after.
1m61spw,Rear of my G550. Area by the shocks - is this normal for 30k miles? Car has been FL owned the entire time!,Is this normal? My car is still under warranty so I am wondering if I should bring this to the dealer attention. 2022 G550 ,0,1753149711.0,9,MechanicAdvice,1753304285,2025-07-22 02:01:51,2025-07-23 20:58:05,"TheBigYellowCar (Score: 8): Need a little more help here to figure out what you’re asking.

Regular_Particular17 (Score: 1): Heyo Benz tech here, everything looks fine, the black crud in the second pic is an under coat that g wagons get coated in, it’s really awful so don’t touch it."
1m61smd,How do I bend back this ear,"Trying to mound my bracket and didn’t realize the ear is bent, any clue on how to bend it back",3,1753149703.0,33,MechanicAdvice,1753304285,2025-07-22 02:01:43,2025-07-23 20:58:05,"TC-Gladiator2024 (Score: 7): Not going to happen, you need to get a used part .you will never get it right and the caliper won’t fit correctly.

CM256 (Score: 3): B.F.H."
1m60xtl,Coolant Leak - 2005 Pontiac Grand Am GT,"I have been slowly losing coolant over the last few months with no visible signs on the ground of coolant (garage parked) and really started to notice when the car started getting hot while idling. I checked the reservoir tank and it was basically bone dry after filling it a bit. I noticed a small crack in the reservoir tank itself so I replaced it. Drove it a few times and no leaks and wasn’t overheating anymore.

 Last night I drove it about 20 minutes and parked it in the garage overnight. Next morning noticed coolant dripping from bottom of the car a good amount and coolant in the tank was lower. Traced the leak back to the above pictures on the driver side of the engine (opposite side of reservoir tank). Any idea what this could be? Pictures aren’t great because it was hard to get an angle of the pool of coolant under there.
 ",1,1753147263.0,2,MechanicAdvice,1753304285,2025-07-22 01:21:03,2025-07-23 20:58:05,"Fluffy-Abies2937 (Score: 2): Lower intake manifold on those normally leaks coolant in that exact spot.

No-Concentrate5893 (Score: 1): That makes a lot of sense and does seem to be the issue. I appreciate the help!"
1m61mko,BMW X3 suspension noise 2011 f25,When I turn(while driving) it feels rough and I hear a clunking and popping sound. It seems like it's coming from the rear but I also seem to hear noise up front over rough pavement. I replaced the thrust piece in the steering rack but it hasn't helped much of the upfront noise. So I jacked up the car. I am attaching a short video of me showing under the front and rear. My driver's side front has play in it but the passenger side is way more firm. Both rear CV axles move a lot in one direction and I don't know if that's normal. ,1,1753149239.0,8,MechanicAdvice,1753304285,2025-07-22 01:53:59,2025-07-23 20:58:05,"greengroundz15 (Score: 2): Obviously difficult to diagnose through video but I can see the excess play from your wheel shake tests. The fact that I'm seeing excess up n down play has me thinking wheel bearing/hub issues. Side 2 side play is usually tie rods, axles, control arm bushings. Excess up n down play points to wheel bearings and hub issues

Regular_Particular17 (Score: 1): Stick a pry bar under the wheel and pry upwards, this way you can visualize any play in the bottom two arms, tie rods you can feel left to right, if you can feel play rocking it, have some one else do it and grab the inner and outer tie rods, you can feel which one has play. The cv axle is normal, half axles have two joints the inner is a plunge joint c which is 3 roller bearings that move in and out, the outer is the cv. Gonna be hard to armchair diag that noise, would check the rear suspension with pry bars and big channel locks. Maybe surf some forums you’d be surprised how often people have ran into the same repair"
1m61m5q,Brand new rotor super hot and cracked what would be the cause ?,I just replaced rear pads and rotors went maybe 2 mins down the road and heard a loud thumping sound pulled over and rotor was cracked . Is it defective ?,345,1753149206.0,215,MechanicAdvice,1753304285,2025-07-22 01:53:26,2025-07-23 20:58:05,"DJesusSoG (Score: 561): 2 minutes has to be a record. Definitely a defective rotor or something very wrong with the installation

Grand-Swordfish6443 (Score: 118): I'd double check the part numbers on those rotors. They may have sold you the wrong ones. If that center hub isn't deep enough, the brakes may have been putting uneven pressure on it. Brakes would have fought you to get them in tho so prob unlikely but worth a check"
1m61ic2,changed my switch still fans wont come on even at this temp,"pretty much title changed my cooling fan switch but they dont come on? is there any specific temperature range they came on i bought standard stock one from NAPA, they do come on sometimes but i dont see em running pretty often at this temp 
",1,1753148896.0,9,MechanicAdvice,1753304285,2025-07-22 01:48:16,2025-07-23 20:58:05,"Sophias_dad (Score: 1): Did you change the fan relay? There's sometimes an identical relay in the same underhood box if you want to do a quick test.

After-Guarantee7836 (Score: 1): Maybe get a new fan? You also need to specify what vehicle this is."
1m61h5w,Which starter motor do I need?,"Mitsubishi mirage 2003, 8th VIN no. 2

My starter motor has gone and I'm trying to get a new one so a friend can install it for me. I put my rego in the website of the place im trying to buy from so it can match the parts to my specific car but the part it's telling me to get says it's for a manual (mine's an auto), while the one it told me to get for an auto the website said is not suited to my car. 

The one it wants me to get but says manual: OEX Starter Motor 12V 8Th CW Mitsubishi Style - MXS201

The one that says its for auto: OEX Starter Motor 12V 8Th CW Mitsubishi Style - MXS361

I figure the website just isn't matching it to the right one and I should get the bottom one but I know nothing about this, can anyone help? Thanks",1,1753148804.0,2,MechanicAdvice,1753304285,2025-07-22 01:46:44,2025-07-23 20:58:05,Equana (Score: 1): Try a different parts website and see what that says.
1m61gnd,Metallic Ringing sound on start up,I’ve got a 2015 Nissan armada. When I go to start it it makes a loud metallic ringing sound only on starting it but other than that I don’t hear anything else or see any signs of issues it’s been doing it   ever since I got the vehicle I’ve had it for about a year planning on taking it to a shop tomorrow morning to see if they can see the problem. mother in law brought it up really pressing the issue saying it’s some starter problem. nothings gotten worse since I’ve had it so I wasn’t worried about it. Has anyone seen this issue before or have any ideas? ,1,1753148766.0,4,MechanicAdvice,1753304285,2025-07-22 01:46:06,2025-07-23 20:58:05,Fluffy-Abies2937 (Score: 2): Needs a starter.  The starter solenoid isn’t fully retracting fast enough so what you’re hearing is the flexplate buzzing against the teeth of the starter.  I would recommend replacing it soon before the starter potentially grinds teeth off of the flex plate.
1m61d29,Loud noise when starting and accelerating,Car started to make a loud noise when starting and accelerating.  Any idea on what it could be? ,1,1753148485.0,2,MechanicAdvice,1753304285,2025-07-22 01:41:25,2025-07-23 20:58:05,"Lyquid_Venom (Score: 2): Bearings gone, find out which one and change it ."
1m61czw,2008 Focus SE Weird Issue,I have no frame of reference for this? can someone tell me what’s going on?,1,1753148480.0,3,MechanicAdvice,1753304285,2025-07-22 01:41:20,2025-07-23 20:58:05,"delslow419 (Score: 1): Some sort of coolant passage/ outlet/ housing is cracked and leaking.

NiceWeaknee (Score: 1): 2.0 Duratec??

That is the plastic(!) water outlet housing leaking and needs to be replaced

https://preview.redd.it/bn1zkqzxydef1.jpeg?width=1484&format=pjpg&auto=webp&s=df36a0223db6661dadbdd68332889650c2838ae0"
1m61c60,Chat am I cooked?,I don’t know much about cars and this is a new one for me ,0,1753148415.0,4,MechanicAdvice,1753304285,2025-07-22 01:40:15,2025-07-23 20:58:05,"agreeable-911 (Score: 2): Yeah that finished. Head gasket

Piicurrency (Score: 2): Oil in coolant? Headgasket gone"
1m619xt,What is this noise on my 2021 Ford Edge 2.0L,My dad thinks it might be the alternator ,1,1753148231.0,2,MechanicAdvice,1753304285,2025-07-22 01:37:11,2025-07-23 20:58:05,"lmZen (Score: 2): Start with checking your oil level. 

You could always remove the serpentine belt and start it up again. If the noise remains you have eliminated all your pulleys as the culprit."
1m60srl,"Used CRC intake valve cleaner, now have check engine light :(","Codes are P0304 and P061B. 
To apply the valve cleaner, I unscrewed the MAF sensor and shot it through the throttle body as instructed. 

I took it out after an hour of heat soaking. It runs a little rough on idle. It runs rough at low speeds. Doesn’t do too bad at highway speeds but a little shaky at 2,000 rpm’s. 

Car is a 2020 Kia optima. Any help is greatly appreciated. 

Thank you. ",2,1753146850.0,6,MechanicAdvice,1753304285,2025-07-22 01:14:10,2025-07-23 20:58:05,"PettyTyranny (Score: 1): Did you spray it in *before* your MAF (therefore getting it on your MAF) or *after* your MAF or into the MAF hole with it removed?

Did you handle the MAF gently and keep it protected/clean? They’re pretty dang delicate. Skin oils can throw it off or really any grime.

WatsProblemOssifer (Score: 1): UPTADE: Took out the MAF and put it back in. Took out the intake tubes again and put back in. Went ahead and checked out the spark plug in coil 4. It was burnt up at the tip. Replaced it, now no shaking and no more engine codes. I just replaced all my spark plugs less than 5,000 miles ago so idk what happened there. Maybe the cleaner made it burn up faster? I know GDI’s like to burn up oil. Been oil changing like once every month and a half."
