id,title,selftext,score,created_utc,num_comments,subreddit,scraping_time_utc,created_datetime_utc,scraping_datetime_utc,top_comments
1m5znf0,Attempting to replace multiple AC parts on my own,"I got a couple of quotes on the possible need to replace multiple AC parts on a 2007 Saturn Ion-2 2.2. I was thinking of attempting this job myself. I've done quite a few things myself and feel this wouldn't be so hard. I already purchased a compressor and will get a new condenser (drier/receiver affixed), expansion valve, and may a new suction &amp; discharge line assembly, if necessary.

I will have a professional at a shop, maybe diagnose it and discharge the system, if needed. He quoted me $1600 parts and labor. I've replaced the starter on this car and have also had to remove the serpentine belt a few times to do other things so I know what I'm dealing with as far as the compressor. Also, I replaced the radiator, which is literally right up against the condenser. The expansion valve might be challenging, but if the few videos I watched are somewhat accurate, I think I can do it. Don't think I have to remove the whole dashboard.

Any advice anyone here can give me or anyone with experience can share. Hopefully, someone here has taken on this same task on this same year make and model. Anything you wouldn't replace due to it not being necessary. All the parts I've found are pretty inexpensive, so far. Is it necessary to replace multiple parts when replacing the compressor? Or could evacuating/flushing play the same roll?

Would really appreciate some pointers. So desperately wanna knock this out myself. Am I in over my head?

Thanks",1,1753143595.0,4,automotive,1753304285,2025-07-22 00:19:55,2025-07-23 20:58:05,"Whack-a-Moole (Score: 1): When playing with AC, there's a cost associated with every attempt to repair it (in the form of correctly recovering the gas). This is in addition to the labor required to dg in deeply enough to replace the item.


So basically you want to reduce the risk of this increased expense by just doing everything easy while you're in there. 

EdC1101 (Score: 1): You want to arrange to have recharge & prep BEFORE you start this project. 

Regulations might require all work to be done by a licensed / professional/mechanic / technician.

atticus2132000 (Score: 1): If I'm understanding correctly...

You're going to drive your car to a mechanic and pay them to recover all the refrigerant from the system.

Then you're going to drive back home and do all this work yourself to replace the air conditioning system.

Then you're going to drive the car back to a mechanic and pay them to run a vacuum on your system hoping that your system is properly sealed so you don't have to drive back home and make additional repairs.

Then have the mechanic charge your system with new refrigerant.

And you believe all of this will be less expensive than just paying a mechanic to do all the work?

If you have all the equipment to do the work yourself including making the flared connections and vacuuming the system and you live in an area where you're allowed to buy the refrigerant without a license, then sure a/c work is no more complicated than any other repairs.

But you're also talking about a car that is nearly 20 years old.  From whom are you getting these quotes?  You don't need a fancy chain store mechanic with a nice office building.  You want to find some dude who has a shop in a sketchy part of town or who does repairs in his backyard to do this project.  If you're able to find that guy, then just paying him for a complete system replacement is probably going to be cheaper than the learning curve and tool investment for you to take this on yourself."
1m6eq67,Car Starting Issues - Varies between weak crank/no crank/full crank - 2012 Honda Civic,"Hello,

I have a weird situation with how my car is starting.  I got a new battery this past winter, so it is less than 7 months old.

Most of the time, when I start my car first thing in the morning I have starting issues.  

When I initially attempt to start it consistently does one of three things:

1. nothing happens at all (I do not recall hearing a click)
2. the car turns very weakly and doesn't start
3. the car turns very weakly and does start
4. Rarely, it will start with a strong start

Of course if the car starts, I just drive and don't do any other testing.

If it doesn't start, I will wait briefly (5-10 seconds) and try again.  Then it will typically progress through the list.  If it was doing #1 then it will typically do #2 or #3.  If it was #2 then it might do #3 (it rarely does #4).  It hasn't gone backwards through the list yet - I have not had it do #2 and then on the next attempt do #1.



I don't know if this is meaningful information but:

I'm thinking it might start better after the key its in the ignition on the ""on"" position for a bit.  When the car doesn't start, I don't take the key out, I wait to try again with the ignition on the ""on"" position.  Yesterday, I was working to a bluetooth MicroMechanic hooked up to my car and the instructions said that the ignition had to be on ""on"" position before connecting to bluetooth.  I did that and then connected to my phone's bluetooth.  It took about a minute of the car being on ""on"" position before I tried starting for the first time and it was a good strong start, despite the engine being cold for about 5 hours.  ",1,1753192481.0,1,CarHelp,1753304285,2025-07-22 13:54:41,2025-07-23 20:58:05,Kiplicious80 (Score: 1): Possibly the starter.  Our Accord kind of had the same thing happen with a very weak start but would strong start every once in a while.  It seemed like a power problem because the brushes in the starter were so worn.
1m665iu,2018 Nissan Versa stopping randomly,"Hi,

I have a 2018 Nissan versa (about 110k miles) and it has this ongoing issue. Recently my car keeps stopping and turning off while driving, or while stopped at a red light. I've taken it to a mechanic and at first they thought it was the mass air flow sensor so they replaced it, but that didn't fix it and a few days later it stopped again. Then next, they thought it was the MAF socket and replaced that and it drove okay for a few days and again started stopping while driving. What could the actual issue be?",1,1753163508.0,1,CarHelp,1753304285,2025-07-22 05:51:48,2025-07-23 20:58:05,mynameishuman42 (Score: 1): Probably the transmission. Cut your losses and buy a Corolla.
1m6g13q,"Should i change these struts and shocks as soon as possible or got more use of them (2018 dodge charger sxt 93,000)",,0,1753195588.0,4,CarHelp,1753304285,2025-07-22 14:46:28,2025-07-23 20:58:05,"Remnant_Echo (Score: 1): What exactly is the reason you're thinking of changing them? 

Did you run over a curb or damage the suspension or is the car just sitting kinda lopsided?

IncontestableClimb (Score: 1): If they are leaking change them. 
If they dont rebound, change them. 


Shops will recommend them every 50k miles just for comfort and its a easy upsell."
1m6fupy,Lexus GS300 1998 ECU problem,Someone stole the chip from my Lexus can I replace the ecu and program to a new chip or no?,1,1753195166.0,3,CarHelp,1753304285,2025-07-22 14:39:26,2025-07-23 20:58:05,"Bulky_Tap_168 (Score: 1): It's has 347000 miles on it and still sounds and runs amazing I have the metal key the fob was stole

Smooth_Professor_177 (Score: 1): Why don’t you just call someone to reprogram a new key? You have the metal key so it won’t be that hard, unless I’m understanding this wrong?"
1m6bvhu,2011 Hyundai i10 This fell out near my clutch,I put my foot on the clutch while driving and heard a snap. This came off and my clutch went straight to the floor. Does anyone know what it is?,1,1753184688.0,2,CarHelp,1753304285,2025-07-22 11:44:48,2025-07-23 20:58:05,"Total_Philosopher_89 (Score: 1): Did you have a look? I'd say that's important.

LogicalUpset (Score: 1): Looks like it's a connector between the pedal and the clutch cable. Pedal would have a hole that the little pin on the back goes to while the cable would go through the hole in that part. Let me see if I can find a part number for you. Looks like you're in a right hand drive car?

Edit: I can't seem to find just the bracket, but he's a link for [the whole cable](https://www.onlinecarparts.co.uk/abs-11544177.html#clutch-cable) with the bracket on the end (with the other end going to your transmission). Note: I don't know the engine or transmission in your car, so I can't guarantee this will fit (length being the main factor) but the bracket is likely the same between cables."
1m67gw7,2015 Subaru Forester starting up weird??,"Hi, I know absolutely nothing about cars but two times in the last week when I started my car, all of the dashboard icons lit up, and the car wouldn’t start. Then when I turned the car off and started it back up again it was fine and ran like normal. It’s never done this before. Should I get a new battery or something or am I fine? ",1,1753168482.0,1,CarHelp,1753304285,2025-07-22 07:14:42,2025-07-23 20:58:05,"Autoscope_SOS (Score: 1): Sounds like your Forester might be dealing with a weak or failing battery, especially if it’s the original one from 2015. When a battery is low on voltage, it can cause all the dash lights to flicker or come on at once, and even prevent the engine from cranking properly. It’s worth getting the battery and alternator tested at a local auto parts store most do it for free."
1m6569c,Anyone know what kind of transmission fluid i should put in a 2008 ford taurus?,,1,1753160059.0,2,CarHelp,1753304285,2025-07-22 04:54:19,2025-07-23 20:58:05,"BOOGER91004 (Score: 1): mercon v

throwaway007676 (Score: 1): The one that it says it requires in the owners manual. My guess would be mercon V but possibly dexron VI/mercon LV, that is why you need to look in the manual. Sometimes it is actually inscribed on the dipstick itself."
1m63v31,[2023 Elantra] Can I repair this small leather damage? Also - how to keep perforated leather clean?,"I was cleaning my seats and my fingernails - which are not long OR sharp, scratched across the seat. There's a fairly long line, but this is the most noticeable part. Is there a way to fix this?

Also, so the white gunk in the holes of the perforated leather I've learned are dried up product. What's the fix for that? Spraying it with water and working the brush on it?

Thank you!

This is a repost from [r/autodetailing](https://www.reddit.com/r/autodetailing/) because apparently they don't help anymore.",0,1753155807.0,7,CarHelp,1753304285,2025-07-22 03:43:27,2025-07-23 20:58:05,"Comunist_cow_69420 (Score: 3): You probably could fix it but it won’t affect anything other then how you see it

mucinexmonster (Score: 1): If I am supposed to get a leather repair kit, I don't know which one and I don't know if this even counts as ""leather""."
1m63jkq,"I love my car, but there are 2 small problems (2009 buick lucerne CXL)","Problem 1. Idk what this metal thingy is. 
Problem 2. The Bluetooth that the car supposedly came with dosent work. I push and hold the button like the manual says, and nothing happens.  I think the metal thingy has something to do with it. 

Any and all help is greatly appreciated! ",0,1753154821.0,4,CarHelp,1753304285,2025-07-22 03:27:01,2025-07-23 20:58:05,"Comunist_cow_69420 (Score: 1): Metal thing is where a mic for a cab radio/pa system would hang

MGtech1954 (Score: 1): looks like a mike holder for a CB radio.  Should not  be related to BlTooth

Skulkhan (Score: 1): 🤦🏻the “metal thingy” isn’t the issue, but there’s literally 2 screw to remove it & you’d know it is completely unrelated to the issue. This is an operator issue. Good luck! 👍🏽"
1m6076x,Nissan Versa 2024,"Idkk if yall can help it maybe tell me where I can possibly take it to fix the issue.

Basically my car stereo has been sounding weird. My car system is acting like it’s making a phone call, when I’m not. And when I try to play music the sound quality is TERRIBLE!! It sounds so low quality and like I’m listening from some random cheap speaker not the actual car system. 

I have not changed any setting in my phone or the car. I am connected via bluetooth to my car.  ",1,1753145148.0,1,CarHelp,1753304285,2025-07-22 00:45:48,2025-07-23 20:58:05,"Autoscope_SOS (Score: 1): Versa’s Bluetooth might be glitching or stuck in “call mode” audio, which usually uses a lower-quality mono signal. It’s a pretty common issue across various cars, not just Nissan. Try deleting the Bluetooth connection on both your phone and the car, then re-pairing from scratch that often resets things. If that doesn't help, have you tried plugging in directly with a USB cable to see if the sound improves?"
1m5zt7y,2001 toyota echo hubcap wheelcovers,"I'm trying to replace a missing hubcap for an old vehicle. It seems pretty impossible to find anywhere even with the part number. It would be easy to buy something new but im trying to keep them the same for sentimental reasons. Hope someone can help me out.

",1,1753144048.0,1,CarHelp,1753304285,2025-07-22 00:27:28,2025-07-23 20:58:05,"Gunner_862 (Score: 1): If you haven't already, you could check with your local auto salvage/junk yards. They sometimes have an abundance of wheel covers."
1m5uwch,What is this that fell off of my car and how can I fix it? 2006 Nissan Sentra,,101,1753131677.0,52,CarHelp,1753304285,2025-07-21 21:01:17,2025-07-23 20:58:05,"theinjin (Score: 11): It’s your charcoal filter  just strap back up there get a ratchet straps or zap straps What have you and put it back up.

camaroE (Score: 3): Oof. Evap box. Just tie it up to the chassis and replace it when you can. You will get an emissions light if the box or hoses get cut or damaged. Good luck.

dernert (Score: 3): This is a filter. Filter is a minor problem, that rust is the major problem."
1m6ob75,Car wont turn on,"Hii, I have a 2018 honda civic coupe, and lately I've been having issues with it. I had recently changed the bcm and has been fine for the last 2 weeks. I went to open my car today, and had to use the physical key cause it wouldn't unlock with the key fob, pressed the ignition button and the car wouldn't turn on. As i pop the hood, the car alarm starts, so i think to disconnect and connect the battery, when I tried reconnecting the battery the alarm goes off again. While the alarm is still going i went inside to see if I can turn on the engine and stop the alarm but it wont turn on and the brake is stiff. What could it be and what should i do? ",1,1753214088.0,1,carproblems,1753304285,2025-07-22 19:54:48,2025-07-23 20:58:05,"Odd-Concept-6505 (Score: 1): A voltmeter or a cool modern ""test light"" with a voltage display and electronics within the tester (as long as 3v or better is present) would be great to own but you're in a Need Something Now mode.

But you still want to know two things:

Battery voltage around 12v under the hood that your car battery currently has.

FOB battery status, probably 1.5v button battery that might need 1.3v to function.

I don't yet fully understand the failure modes of modern cars with weak fob batteries... or even weak cat battery. Reading so many problem descriptions on reddit....."
1m6nb2m,Trunk of car is getting scratched,,1,1753211823.0,2,carproblems,1753304285,2025-07-22 19:17:03,2025-07-23 20:58:05,"Tomytom99 (Score: 1): Shot in the dark- could be a bird or other critter perching?

DitchDigger330 (Score: 1): There's a squirrel or bird that loves your car."
1m6lvs4,What’s this?,,1,1753208690.0,1,carproblems,1753304285,2025-07-22 18:24:50,2025-07-23 20:58:05,Sonicblast52 (Score: 1): Can you take some better photos? I dont know what part of the car I'm looking at...
1m6iiq7,Battery,What are these called that’s suppose to connect to the battery ? ,1,1753201200.0,2,carproblems,1753304285,2025-07-22 16:20:00,2025-07-23 20:58:05,"Character-Session810 (Score: 1): Terminal connectors.

jquadro2 (Score: 1): Good question. How about the pic you didnt attatch?"
1m6f7c4,MAF sensor replacement for 2012 Lexus Ls460,"My 2012 Lexus Ls460 has been giving me issues. I got my oil changed at Walmart &amp; after about a week, I noticed a small leak. It wasn't that bad at first so I kust topped it off every couple of weeks, but the leak just got progressively worse. I tried replacing the gasket on the oil filter housing, where the leak was coming from, but ended up just needing to replace the entire oil filter housing cap. 

I was about to take it to a friend of mines shop to replace the housing cap &amp; when I went to crank up my car, it immediately stalled after it turned over &amp; the check engine &amp; traction control light were on. It cranked right up the 2nd time &amp; everytime I crank the engine it does this. When I tried to drive it, I immediately noticed that there was very little power going to the engine when I pressed the gas &amp; my car had put itself in limp mode. When I checked the check engine light code, it came back saying that it's the Maf sensor. I cleaned both Maf sensors with the right cleaner, but it's still giving me problems so I need to replace them.

Maf sensors vary greatly in price from $18 to $200 online. Auto zone has them for $80, but I know that they sometimes will charge a lot more than a part is really worth. **Will a cheaper MAF sensor from Walmart, Amazon, or Ebay be reliable? Is there a big difference in dependability between the more expensive ones or they all about the same? &amp; could it be anything other than the MAF sensor that could be an issue from the oil leak that could trigger a check engine code for the MAF sensor?**

*TLDR: My car had an oil leak &amp; I needed to replace the oil filter housing cap and before I could replace it, my car went into limp mode &amp; the check engine light came on the code came back saying that it was a MAF sensor issue. Is there a big difference between the cheaper replacement MAF sensors online &amp; the expensive one's from auto zone? Could anything with the oil filter leak cause a code that says it's the MAF sensor or is it just a coincidence that they both happened at the same time?*",1,1753193620.0,2,carproblems,1753304285,2025-07-22 14:13:40,2025-07-23 20:58:05,Material_Web202 (Score: 1): Just get the OEM one
1m6by04,Please help: is this motor issue urgent?,"Hi all,

Two times now, when starting my petrol car in the morning and letting it run stationary for a while, I notice 3 things:

\- my RPM meter is going somewhat up and down

\- I feel every 5 seconds or so, coinciding with the RPM meter going up again, a little ""shake"" or rattle in the car, and this is also visible under the bonnet. The engine block shakes. Just before it shakes, you can hear a little ""whispering"" squeak.

This can be seen in the video.

Also, once now, after a while, a more prominent loud whistle, squeak, sound became clear at the same pace intervals as the rest. 

Anyone have any idea what this might be and whether or not I can still drive it? Once you drive, even if you put your foot on the gas once, the whole thing is gone! Also, starting with warm engine also gives no troubles so far and during driving the engine acts completely normal!

Any ideas or advice?

THANK YOU!!!",0,1753184910.0,23,carproblems,1753304285,2025-07-22 11:48:30,2025-07-23 20:58:05,"evildead1985 (Score: 2): Honestly, you're going to need to go to a shop that can use a sophisticated scan tool that actually shows live data. You don't want to get caught up in the parts cannon game. Do you have any engine shops near you. It would be worth paying the diag to narrow down what the problem is..the shake could be from a bad spark plug to a motor mount..the data will absolutely point you in the right direction.

Chainsawsas70 (Score: 2): Squeal is coming from the cold accessory belt (might be time to change it) The surging on idle is because the engine is trying to get the fuel air blend correct... Probably need to clean the MAF sensor which can be done with a can of MAF Cleaner.... DO NOT use anything else on it or you can ruin the sensor.
Cleaning the sensor is Really easy and doesn't take much for tools. Usually just a flat blade screw driver or pliers to get it loose. The belt can be tricky especially if you haven't done one before... And it's best practice to replace the tensioner with the belt because they both wear out over time.

evildead1985 (Score: 1): Year, Make and model"
1m6ac2a,Opel insignia 1.8 2008 MPG more than a v8 suv.,Why is the MPG on my insignia so shit? It averages at around 14mpg. I don't drive alot in traffic and usually take the highway. the mpg is 5.8 when I try to slowly accelerate to 30mph...,1,1753179558.0,2,carproblems,1753304285,2025-07-22 10:19:18,2025-07-23 20:58:05,Glockamoli (Score: 1): Have you actually done a full to empty mpg test?
1m65y6i,Car overheating,"My 2002 ford mustang keeps overheating and i don't know why i changed the fan, thermostat, and thermostat sensor anyone have a possible solution",1,1753162774.0,3,carproblems,1753304285,2025-07-22 05:39:34,2025-07-23 20:58:05,"SR3711 (Score: 2): System bled correctly? Could be a bad thermostat that’s stuck closed.

Opposite-poopy (Score: 1): Water pump, clogged radiator, air bubble. Bad fan

arafat94 (Score: 1): Had the same issue once. Try bleeding the cooling system. Air pockets can cause overheating. Also check if the radiator’s clogged or if the water pump’s working right. Good luck!"
1m64f3j,Nissan cube,I have a 2011 Nissan cube.  Have an error code P0303.  I was diagnosing so I moved the coil from cylinder 3 to 2.  Then I got a code for cylinder 2 indicating a bad coil.  I changed the coil and the car is still misfiring.  Could it be a faulty coil from the factory?,0,1753157571.0,1,carproblems,1753304285,2025-07-22 04:12:51,2025-07-23 20:58:05,jquadro2 (Score: 1): Replace all coils and plugs quit cheaping out.
1m5y2r4,Sound coming from the area of my tires?,"Some random sound that seems to be coming from the passenger side tire/wheel well? My tires aren’t low and I cannot see a thing wrong in the area. If it’s not obvious, the sound is happening when my wheels are rotating or that’s what it seems. Any help would be appreciated! Oh also I’m driving a Tacoma with aftermarket wheels and tires if that’s of any use 🤷‍♂️",5,1753139368.0,15,carproblems,1753304285,2025-07-21 23:09:28,2025-07-23 20:58:05,"thistoistheyres (Score: 4): Sounds like you ran over a screw or something. It’s hard to check sometimes if it’s in the inner side.

McKittenMeat (Score: 1): Sounds like you're jerking it

WeenerDaddy (Score: 1): Probably a rock stuck in the tire tread. Did you look at the tire?"
1m5wjsa,NEED IDEAS,"Car making this noise bear rear passenger side of motor, what yall think it is",1,1753135574.0,1,carproblems,1753304285,2025-07-21 22:06:14,2025-07-23 20:58:05,"q1field (Score: 1): Pull the oil dipstick just for shits. I encountered an issue with a customer's Monte Carlo where it was hitting a crankshaft counterweight.

Other things: make sure the starter is bolted tight, check torque converter bolts, and look at flex plate for cracks."
1m6noxc,Radiator has alignment pins but Shroud doesn’t have grooves. Solution?,Just bought a radiator and engine cooling fan shroud separately. Realized the radiator comes with these pins but the shroud doesn’t have anywhere I can insert the pins. Is there a quick fix I can do like shaving off the pins or do I just have to buy the matching parts?,0,1753212694.0,2,autorepair,1753304285,2025-07-22 19:31:34,2025-07-23 20:58:05,ecleptik (Score: 2): Shave the locating dowels...you may get more help if you include the kind of vehicle you are working on. Most of the pins are for the assembly line so they can throw em up and zip everything down and not worry about having to align things
1m6mzv1,Car started leaking oil 2 weeks after Valvoline oil change,"We took my husband's car- a 2013 Jeep grand cherokee with 189k miles on it- to get an oil change at Valvoline 2 weeks ago. We have never been to Valvoline before, but we went bc we needed the oil changed ASAP (leaving for a trip) and it was the only place open on Sundays. 2 weeks later, my husband is otw to church, and all of the oil leaked out of the car on his way there. He made it to church, but ended up towing it to a mechanic. The mechanic told us that the oil cooler is bad &amp; is the reason for the leak, but they are unable to check the engine's state until the cooler is changed, which was going to be $1k to fix. We decided not to fix the oil cooler, and we're having it towed back to our house &amp; it will just be sitting until we decide what to do next.

Has anyone else had a similar experience with Valvoline? I can't help but think this isn't a coincidence. I've been researching and have seen that many people have had poor experiences with that company. I read that 90% of the time, bad oil coolers are caused by being screwed on too tightly by the oil changer. Any advice is appreciated. 

\*please no ""you should have \_\_\_"" or ""you shouldn't have \_\_\_\_."" none of that is helpful now",0,1753211119.0,31,autorepair,1753304285,2025-07-22 19:05:19,2025-07-23 20:58:05,"corrupt-politician_ (Score: 9): I can guarantee you that Valvoline doing an oil change did not cause a broken oil cooler on an old high mileage jeep.

Working-Budget4474 (Score: 3): at the end of the day, you’ll have no recourse and can’t prove anything. So it’s a waste to wonder how / why. The simplest explanation is that it’s a fairly common problem on a 200k mile grand Cherokee. You should be thankful it’s lasted this long honestly

Timendainum (Score: 5): 2 weeks later and you are blaming the oil change place? You have a 10 year old Jeep. Consider yourself lucky it even runs at all."
