id,title,selftext,score,created_utc,num_comments,subreddit,scraping_time_utc,created_datetime_utc,scraping_datetime_utc,top_comments
1m690tw,2015 Hyundai Tucson A/C Issue,"Hi all! I'm somewhat mechanically inclined (my own services and basic repairs) with the exception of A/C, so any direction would be greatly appreciated before I bring this in to a shop.

Wife's car is a 2015 Hyundai Tucson with 51k miles. Automatic, FWD, I think its the 2.4 but can't remember off hand. Her car is having a very intermittent A/C issue. Most of the time, it blows ice cold air. Very randomly and not often, and without changing any settings, it'll just start blowing ambient air. This is very intermittent as there are no real ways to replicate it. It doesn't matter if it's a drive down the road or down the highway, it will just randomly blow ambient air for about 3-5 minutes.

Now I noticed when the A/C would finally blow cold again, the engine will shudder/bog down for a moment. Then we're back in business of ice cold air. There have been times when we can drive 50 miles on the highway and no issues. But sometimes it'll act up just going to the grocery store.

I swung by a reputable shop by me that I trust. They were able to fit me in momentarily since they're overbooked and do a quick diagnosis. They had it for a few hours and could never replicate the issue both idling in the shop, and on a 5 mile test drive. No codes to pull up, and hooking up to gauges showed it was within spec (don't ask me numbers as I don't know). They reluctantly said to bring it back if its failing more often as they don't want to sell me on just parts and guessing.

Any ideas? Its my wife's car and we're here in Florida so working A/C definitely is something I want her to have. Simple online searches are all over the place from failing compressors, blend door actuators, to failing ambient air sensors. Any insight would be greatly appreciated.",1,1753174587.0,5,AskMechanics,1753304285,2025-07-22 08:56:27,2025-07-23 20:58:05,"MyselfIDK (Score: 1): Check the engine coolant temp.

I had experienced a Toyota hilux which was having AC issues like this, turns out the engine thermostat wasn't opening properly, therefore causing the car to start overheating. 

When the coolant temp had gotten too high, the AC compressor cut out. Worked again once the engine had cooled down again. Worked fine since replacing the thermostat no issues."
1m68m48,Few bits of old abs sensor dropped into hub - dangerous?,"This is a Safety Question - dropped a few busted abs sensor shards into hub - dangerous?

2008 Mitsubishi Outlander  - ""Special RustBelt Edition"" 230,000km Engine size: 3L, Auto

Messed up and got some abs sensor bits in the hub (rear wheel)...might have possibly hit abs ring too, unsure.

Was helping a friend (&amp; neighbor) with his very rusted out old Outlander.  ""Salt and Snow"" land.

Friend is a broke retired pensioner.  He doesn't have money, I do, so I help out when I can, e.g when he has vehicle issues I'll just buy and install the parts as needed.  (He assists me with things he is capable of doing too - great relationship)

Vehicle is old and rusted to hell - even frame is not good - jacking up needs to be done carefully etc.  ABS etc hasn't worked for years. He hit the brakes the other day, and one of the hard brake lines burst.  I replaced that for him, and the few other lines that looked bad, also did a complete overhaul on his brakes and various other things while it was up.  Also found broken wiring (rear, central) that looked to be part of the 4WD so I fixed that too.

Vehicle is (was) 2wd/4wd selectable, but that hasn't worked for years - I always assumed that was because of broken ABS sensors. (Code scan confirms).

Anyhow, thought it might be a nice gift to try get his 4wd working again for him (Lots of snow here).

Rear ABS sensor: Bolt head long gone, presumably snapped off by someone years ago.  (Will be fun trying to get that thread out later ;)  So, abs sensor was not sitting flush (at all..), lots of entry for the elements..  One wire already broken...

Went to remove the ""utterly seized"" abs sensor...tried the propane torch and screw...nothing would budge...even with a good lever setup.  First screw just broke in the end (#8 Decking Screw), went back with a #10 Steel screw...more heat etc...couldn't get it to budge (backing out the screw a bit...we were just able to get small bits out at a time...)

Was getting late...tired...ended up just trying to drill the rest out...was dumb/tired and didn't put a depth-stop on my drill...And pulling the (rusted hub assembly) off at that time didn't seem a reasonable option.

Got it out, but def some ""crud"" fell into the wheel hub, and saw some brown rust-dust at the end of the drill, as well as the plastic.   Can now look through the abs hole and see movement when I turn the wheel.

TLDR/TIFU: Some crap fell into the hub.  Fair chance I nicked the sensor ring/teeth or something in the hub too.

Wheel made a wee bit of a grinding noise when turning by hand, and when driving, for about 10 minutes only - then normal - no sound - I presume just because whatever fell it got ground to dust.

I immediately offered to buy him a new hub, I can afford it - he doesn't want me to spend that money on his old car - everything else on it is pretty f\*\*ked anyway. plus there is the question off what other cans of worms might we open by changing the hub on this old car - e.g potential snapped bolt heads or whatever.

\---

MAIN QUESTION: How dangerous is this?  Is there any chance of sudden catastrophic failure? Is there even a small chance this could e.g cause the wheel to seize while driving, without any prior warning/issues?  

(Because if that is a possibility, obv I will arrange a new hub installed. He is anti-that idea for now - but if this presents a real safety issue, that will change things...)

Or is it more of a just ""might slowly cause issues over time"" kinda thing? Not Urgent?

\----

Other question: For a ""supersiezed"" ABS sensor, thats basically had a broken off cap for years, far more seized than any thing I have seen on youtube, how else could I have got it out, without removing the hub? When screws and heat didn't work?  Just completely melted it and bit-by-bit with a pick?  There must be some non-plastic parts in the sensor? 

Thanks.",1,1753172940.0,3,AskMechanics,1753304285,2025-07-22 08:29:00,2025-07-23 20:58:05,"Disp5389 (Score: 1): Dangerous, no.  A problem or not is hard to say.  The rotating axle is going to pick the pieces of plastic up and eventually they’ll be ground to something small enough they won’t hurt anything.  During this process they may or may not damage the end of the new sensor or the ring on the axle/bearing.  If any ferrous metal bits are in there, then they’ll stick to the magnet and possibly interfere with the signal such that the ABS light will stay on. 

Generally, with seized ABS sensors you need to remove the CV shaft to give you a clear path to punch it out.  On some designs the bearing has to come out also."
1m67u8f,Scratches,"
Good afternoon! I received these pistons from the supplier, and there are small scratches on the surface. Can I install them?",1,1753169905.0,8,AskMechanics,1753304285,2025-07-22 07:38:25,2025-07-23 20:58:05,"Agreeable-Eagle-4150 (Score: 5): This is not a serious question

Karl_H_Kynstler (Score: 3): These are fine. No need to worry."
1m67sc6,"Engine smells burny, is it this open cap?","Noticed this open cap on this mornings inspection. engine suddenly smelt really bad yesterday while on a long drive, now smells immediately whenever I drive. Could this be it, also what is that?? ",1,1753169690.0,7,AskMechanics,1753304285,2025-07-22 07:34:50,2025-07-23 20:58:05,"waynep712222 (Score: 1): that is a vent for the clutch and remove it to see the timing markes..
 
your ground cable is getting corrosion into it..

 please print this and perform it.. https://imgur.com/SnzhDh0

 eyeball this gallery as to why.. https://imgur.com/a/2011-toyota-camry-4-cylinder-negative-battery-cable-replacement-SsXemcV

 that corroded ground cable in the images cause the alternator to burn out.."
1m678a8,What is this part called?,"I drive a 2007 toyota corolla, and saw the cover for the light on the side of my car fell off. Just wondering anyone know the name of the cover? Thanks in advance.",1,1753167597.0,5,AskMechanics,1753304285,2025-07-22 06:59:57,2025-07-23 20:58:05,"nispir7935 (Score: 4): Side marker light

Lavasioux (Score: 2): Running light."
1m66dmz,"~3,000 RPM idle after cleaning throttle body","I have a 2012 chevy malibu LT. It’s at around 193,000 miles and actually runs pretty well. Had some inconsistent idling (but not too bad, but I wanted to get ahead of future problems ) and decided to clean the throttle body.

I got CRC throttle body cleaner and used shop towels to wipe everything off. It was decently dirty. I turned the car on but not the engine and was able to press the accelerator to clean the inside of the throttle plate. The plate still moves while I press the pedal so I don’t think it’s broken. 

I start the car and it jumps to about ~3k idle. Surprisingly, I don’t get any codes. I tried to let it run for 3 minutes on and off with 60 seconds between, but nothing improved. Do you think I should do a throttle re-learn with a scanner? 

Thanks",2,1753164329.0,4,AskMechanics,1753304285,2025-07-22 06:05:29,2025-07-23 20:58:05,"Scorpi01234 (Score: 1): Not sure on Malibus specifically but in some drive by wire cars if there is enough buildup in the throttle body the ecu can compensate by adjusting the idle/home position of the throttle body to be more open and now with the build up gone it is open too far causing the 3k rpm idle. Could try unplugging the for 15mins or so to let ecu reset somewhat and allow it to relearn and perhaps double check everything is plugged in

vaporyzr (Score: 1): I'd recommend a throttle body relearn. If that doesn't fix it, it will go down on its own as its driven on these throttle by wire applications"
1m65zey,Do I have hemi tick?,Cammed 6.1 hemi challenger srt8… hearing clacking sound at idle but when I press the gas pedal the clacking noise went away :/,3,1753162897.0,2,AskMechanics,1753304285,2025-07-22 05:41:37,2025-07-23 20:58:05,03terminatorsvt (Score: 1): Dont sound like it yet
1m65h00,What could be causing this on my 00” accord f23a1,"This sputtering has been happening for a while and I suspect it’s a misfire but there aren’t any misfire codes just a o2 sensor heater code.
Also it only sputters between idle and 2000 rpm",3,1753161082.0,4,AskMechanics,1753304285,2025-07-22 05:11:22,2025-07-23 20:58:05,"Aggravating_Ad_3936 (Score: 1): If the O2 sensor heater core is going that means the sensor could be going as well causing the misfire/sputter (I am not a professional just experienced this issue with my 03 Tiburon)

q1field (Score: 1): This is definitely a misfire. Early OBD2 computers had lackluster misfire detection.

Mix up some dish soap, salt and water in a bottle and poke a small hole in the lid. Idle the engine and squirt water over the wires one by one, and the distributor cap. If a wire or the cap is leaking high voltage, the water will short it out, causing a misfire. Sometimes you'll see the light show if the surroundings are dark. 

If that fails to produce results, physically check the spark plugs and wires. Look for carbon tracking on the porcelain of the plug and inside the wire boot. Do the same for the cap and rotor. Also look at the business end of the plugs for excessive gap, cracked/missing porcelain or damaged ground straps."
1m659d0,Is a project car (non daily driver) a good way to learn mechanics and how a car works?,"I'm newer to the world of cars and have been wanting to learn car mechanics and actually see how a car works. I have a daily driver that I use for driving to school ('03 VW Jetta GLI), that I have learned basic and preventive maintenance on, but I want to go deeper into mechanics. I've always been a hands on learner. I've had this idea of buying a cheap and beat up old car and park it on an RV pad beside my house and taking apart and fixing it. If I can fix it, great! If not, the car isn't a main car so I just sell it to a junkyard, but I would have at least learned how to work on a car. Does anyone have thoughts/advice on this kind of thing?",3,1753160354.0,24,AskMechanics,1753304285,2025-07-22 04:59:14,2025-07-23 20:58:05,"shiftty (Score: 5): You got tools or a tool budget? You're going to need lots of different tools to even begin restoring a car, well above disassembling it and putting it back together

ChemistAdventurous84 (Score: 3): It seems like the other respondents didn’t read your full post. It sounds like you have a place to work on a car and at least some basic tools. If your daily is 22 years old, you’ve probably seen some things. Your goal is experience, not a restored classic car. 

I think this is a good idea for you. My suggestions for picking the right car: not rare or sought after, not too old (parts availability will be a problem), not too luxury (Mercedes parts are pricey but Lexus shares a lot of mechanical parts with Toyota), not too big (a full size truck is surprising large).  I’d recommend Japanese over Korean. In about 2005, the industry abandoned press-in wheel bearings in favor of bolt-on hubs with bearings - generally much easier to deal with.  No more than light rust on the underbody - if in the US rust belt, look southward. 

I’ve worked on my own Subarus and Toyotas; Subarus are cheap, easy to work on, parts (new, used and aftermarket) are relatively cheap and plentiful, they are solid and last but need regular repairs. You’ll get to know the on-line parts sources (Ebay, Amazon and Subaru dealers selling new-old-stock), pull-a-part junk yards and YouTube how-to videos."
1m653ef,Weird Rattle Around Wheel,"Hello all, I drive a 2014 Jeep Patriot, and this last week it's been making this rattling noise that has been getting worse as I drive it. The tires are balding which new ones will be here tomorrow. Everything looks fine under it in my eyes. The rattling goes away when I turn or accelerate. But when I go straight and let off the gas, it makes the noise. Any idea?",2,1753159795.0,3,AskMechanics,1753304285,2025-07-22 04:49:55,2025-07-23 20:58:05,"BuildingCareless482 (Score: 1): Here's some of the tire and underside

https://preview.redd.it/28ljwzbawcef1.jpeg?width=3024&format=pjpg&auto=webp&s=a3d7d5ace7a3a0d154718786e26edf251a0d85c4"
1m650rk,2023 Dodge Hornet GT Plus seat swap issue,"Hi all! I swapped the black vented/heated seats in my Hornet for a red interior, but now the comfort controls (heated/vented seats and heated steering wheel) are greyed out and don’t work. The steering wheel not working is especially odd since I didn’t touch it during the swap. In other cars, seat swaps were plug-and-play and all functions worked.

Do the new seats need programming? Any advice to get these functions working again?",1,1753159547.0,3,AskMechanics,1753304285,2025-07-22 04:45:47,2025-07-23 20:58:05,"RichardSober (Score: 1): If you swapped OE seats with OE seats from another trim, you should be able to edit the config (likely, BCM). If you installed aftermarket seats, you are on your own."
1m64n1h,Any tips on how to fix my engine problem in my Cavalier?,"Hello, im having problems with my 86 Cavalier Z24. It seems like the problems it’s having are pointing to the timing being off on the engine. I’ve never done timing on an engine before. Any tips on how to do it specifically for this car? The engine is a 3.1l v6 with 2.8 heads. It’s a rebuilt engine. Thanks!",1,1753158290.0,3,AskMechanics,1753304285,2025-07-22 04:24:50,2025-07-23 20:58:05,"mlw35405 (Score: 1): Charm.li has the service manual online for free.

Typical-Decision-273 (Score: 1): I mean if I can get an engine to start running 180 out you should be able to get that to start with whatever fuel air problem that you have it sounds like you have compression but it's probably down to fuel air spark"
1m64my0,Trying to understand symptoms of failed torque converter…,"I have a 2000 Honda Accord that has slipped shifting from 1st to 2nd since 2017 @ 137k miles. I drove it through COVID as my commuter and just feathered the throttle from 1st to 2nd with no issues. 

I gifted it to a relative to use while they were in-between cars and they drove it to 178k miles. I just got it back the other day and the car hesitates to accelerate in all gears, sort of like small bucking no matter what RPM when getting on the gas. This is pretty much under all conditions, especially so when you’re trying to get up to speed on a main road.

I’ve been thinking about what it could be and I am inclined to think it’s a failing torque converter. The relative replaced the transmission fluid against my advice, so I think that could’ve been the catalyst for any friction material the transmission may have had left. I was thinking that it could be a spark/fuel or clogged throttle body issue, but if I put the car in neutral and rev it up, it climbs through the revs smoothly. 

Can a failing torque converter cause this bucking/stumbling type of acceleration in every gear? ",1,1753158282.0,6,AskMechanics,1753304285,2025-07-22 04:24:42,2025-07-23 20:58:05,"Realistic-March-5679 (Score: 1): Changing fluid won’t cause any harm. It could highlight damage and wear that’s already there though. Torque converters can cause a bucking sensation but it tends to be more noticeable as a slip or a chatter. Regardless a failed torque converters tend to send metal throughout the transmission damage quite a few other components so it could have started with a torque converter and is now several things. My best advice is to stop driving it as soon as it’s noticeable and bring it to a mechanic or transmission specialist, the longer you drive it the more likely it is you’ll need a whole transmission.

FallNice3836 (Score: 1): It’s failing shift circuits. Very common with those accords, I owned one and tried everything short of rebuilding it. Nothing fixes it expect a proper rebuild. Flushes and solenoids did nothing. 

I’ve had one apart and the clutch pack and circuit had lots of dirt build up that can’t be cleaned out with out a tear down. It’s a design flaw

Simply it’s not really worth fixing."
1m62x32,Umm...what might this be??,,12,1753152965.0,40,AskMechanics,1753304285,2025-07-22 02:56:05,2025-07-23 20:58:05,"star08273 (Score: 34): ground strap. you can just make a new one or buy a cheap short battery cable to replace it

Typical-Decision-273 (Score: 9): Either the engine or transmission ground strap You should probably replace it or else you'll have all sorts of problems down the road. And electrical Gremlins will piss you off to the point where you just want to set the vehicle on fire"
1m62rpj,5.7 Hemi Charger Again,"Picked up a 2012 dodge charger, with the 5.7 hemi. Car has 3 codes, P000B, P0522, P0520.

The car starts and runs great, smooth, and quiet. Just these codes won’t go away, there is some electrical stuff going on also, such as the windows working intermittently and the steering wheel buttons not working. 

Anybody ever had a similar experience? Any advice? I picked up a new oil pressure sensor as well as a new vct solenoid which I plan to change out soon as it was inexpensive.

Recent maintenance stated by previous owner is new thermostat, new waterpump, as well as serpentine belt.

Thanks to all in advance ",1,1753152523.0,3,AskMechanics,1753304285,2025-07-22 02:48:43,2025-07-23 20:58:05,"Purple-Parsnipples (Score: 2): It's never a bad idea to confirm the oil pressure with an accurate mechanical gauge. Check the harness for chafing and plugs for corrosion or pushed out pins. If you need to replace the sensors, make sure you replace them with OEM or equivalent. I have seen and had many dead on arrival aftermarket sensors."
1m62ehx,Sidewall puncture,"Tires going to be replaced just wondering if I can drive it still?
",1,1753151445.0,3,AskMechanics,1753304285,2025-07-22 02:30:45,2025-07-23 20:58:05,"BiggestArbysFan (Score: 1): Tires are looking rough as-is. I wouldn't drive more than a week or two. That chunk missing doesn't seem to be leaking air but it could cause the sidewall to bubble out over time. I'd get to it as soon as you can

Hewitt_Mairaro (Score: 1): Thank you for the response you’re a legend 🤙🏿"
1m629nd,Long story short - need help keeping car started,"Car will start but wont stay on. 

When putting the negative terminal back on after a valve cover gasket, spark plugs + wires job, we broke the rusted nut on the negative terminal and the connector was shot. We put on a new connector but not sure if we did it right. 

For context: 
Did accidentally try to start the car with cylinders 2 &amp; 4s spark plug wires switched. Also did not use torque wrench for spark plugs.
Fixed that and then the car idled rough, but did not stutter at all upon idle acceleration. 
We think it may have idled rough because before we started the job we noticed the passenger PCV hose was disconnected from the back. We think it may have been running rough because the ECU was accustomed to not having it. 
After this happened was when we broke the nut for the battery and attempted to replace it, now the car starts but dies immediately. A couple months ago my car would not start and we figured out it was due to the aforementioned terminal connection 

Timeline (if this helps):

Started valve cover job -&gt; noticed PCV hose was disconnected -&gt; replaced air filter, spark plugs + wires (plug wells for 2&amp;4 had oil in them), and valve cover gasket -&gt; started car with plug wires for 2&amp;4 mixed up -&gt; fixed that, ran with rough idle and i turned the car off after ~60 seconds -&gt; think the battery terminal may be messed up but we snap the negative connector nut trying to tighten it -&gt; put on new negative connector but are worried it’s not correct -&gt; car will now start but not idle, it does immediately 
 ",2,1753151053.0,11,AskMechanics,1753304285,2025-07-22 02:24:13,2025-07-23 20:58:05,"Typical-Decision-273 (Score: 3): Did ya ever reconnect the PCV to where it's supposed to go?

Typical-Decision-273 (Score: 2): To add to my previous comment it sounds like you have a vacuum leak somewhere and something wasn't reconnected or there's a gap on something somewhere sucking air where it shouldn't be."
1m62970,Mechanic Mystery - My Dad is Skeptical Reddit Can Help Him! Please Prove him Wrong!,"My dad knows a decent amount about cars, but not so much about the internet or technology.  He told me that he was having issues with my brother's car and he went to the mechanic who wasn't any help.  I told him that the r/askmechanic subreddit would be a good place to get advice but he was skeptical.  I told him to take a video and write up a little description of the issue.  

Please internet friends, help my dad!



**His Description:**

I think my son's 2017 Mazda CX-5 with 73K miles has a serious issue with its automatic transmission. The symptoms, which only start after the car has been driven for at least 15 minutes and after hitting speeds of at least 40-45 mph are (1) a brief ""thunk"" when starting from a full stop, (2) a delay shifting into higher gear as you accelerate and (3) most commonly, a rhythmic thumping sound as you drive, which in its most extreme version will cause the car to shake violently.  This video includes a moderate example of all 3 symptoms but they don't always occur at the same time and it is hard to predict when they will occur and sometimes they start and stop mid-drive. The local mechanic drained and filled the transmission fluid and the Mazda dealer said they couldn't recreate the problems and nothing appeared to be wrong, meaning there were no trouble codes or visible leaks - I didn't have this video before taking it to the dealer so I couldn't share it with them. One thing that is confusing to me is during symptom # 3 (rhythmic thump), I put the car into neutral while driving downhill and it had no effect on the [thump.Am](http://thump.Am) I right about the transmission?  If so, can it be repaired and/or is it worthwhile to replace or rebuild? Any input on who or what type of shop could handle this and the estimated costs involved would be appreciated. My son lives in the eastern part of Nassau County, NY. ",3,1753151016.0,17,AskMechanics,1753304285,2025-07-22 02:23:36,2025-07-23 20:58:05,"xROFLSKATES (Score: 3): Could have sloppy CV axle joints or splines. Is the noise worse when turning? 

Could also be a dragging brake caliper that has led to a warped brake rotor. The thunk could be the rotor breaking loose from the pads as it turns, the delay in shifting could be caused by a wheel having its brakes used halfway and slowing everything down, and the vibrating would be the warped rotor banging into the pads.

Could be a list of other things, it’s possible wheel bearings or even motor mounts can cause this. Hard to tell without the car in front of me, but Id feel pretty confident that most competent mechanics could figure it out. Sounds like he just had bad luck with those other shops

ThyPickleOfThyRicks (Score: 2): I would check the drives shafts, front and rear differentials, transfer case, and any bearings. If everything looks fine then id say the transmission for the thunk and rattle at the very beginning. The wobble I don’t think that has anything to do with the transmission but I think that’s a wheel hub that got damaged. Ask your son if he hit any major pot holes or a pot hole before he started to hear the wobble. If he says yes that confirms the wheel hub."
