id,title,selftext,score,created_utc,num_comments,subreddit,scraping_time_utc,created_datetime_utc,scraping_datetime_utc,top_comments
1m9cswt,Help identifying whistling sound from engine bay. Alternator bearing?,"Hello! Ive got a 1969 327 sbc. I recently changed the battery and belts outs and discovered this whistling noise. It’s more prominent when I accelerate. I’ve sprayed break clean around tbr carb and intake, but observed no changes. The belts aren’t over tight, they have about 1/4” or more of play. Could this be a failing alternator? Thank you in advance!",2,1753482235.0,5,AskMechanics,1753643892,2025-07-25 22:23:55,2025-07-27 19:18:12,"Remote-Koala1215 (Score: 2): Remove the alternator belt and see if the noise goes away. If it doesn't, it is the air conditioner

SubiWan (Score: 1): First don't search for intake leaks with Brakeleen. It is flammable for shit's sake. Water is just as effective with no danger. All you want to do is alter the speed enough so you can hear it.

As for locating the noise, use a stethoscope or a long screwdriver (put the blade on a surface and your ear on the handle). You'll have better luck hearing the source."
1m9cq5k,"Smoke from the front passenger-side Catalytic Converter; the exhaust sounds funny. The Catalytic converter is a hot coil in the clip that I posted. It's a BMW 528i xDrive 2016, f10, n20",,1,1753482039.0,2,AskMechanics,1753643892,2025-07-25 22:20:39,2025-07-27 19:18:12,giantamericanretard (Score: 1): You need a new one of those
1m9ck8t,How much should these scratches cost to fix?,,1,1753481629.0,6,AskMechanics,1753643892,2025-07-25 22:13:49,2025-07-27 19:18:12,"FallNice3836 (Score: 1): Any detailer can buff that out. I’ve done worse and had it fixed

Ravenblack67 (Score: 1): r/Autobody"
1m9cahv,Is my car totaled??,2024 integra car accident ,1,1753480947.0,17,AskMechanics,1753643892,2025-07-25 22:02:27,2025-07-27 19:18:12,"Sienile (Score: 9): Possibly. That's a lot of damage.

drfishdaddy (Score: 5): That’s a goner. If you need help getting fair value let me know, that’s what we do."
1m9cadp,Is my car totaled??,2024 integra car accident ,1,1753480940.0,4,AskMechanics,1753643892,2025-07-25 22:02:20,2025-07-27 19:18:12,"Historical_Figure_46 (Score: 2): Unless you have a body repair shop, then yes

NoResolve2022 (Score: 2): Definitely"
1m9c9qr,Camber adjustment,"I got a when alignment today and the right cambers need adjustment. Is this an immediate concern I need to address right away or can it wait a few months? I’ve spent thousands on car repairs already from ball joints, control arms, tie rods, brakes, struts, and sway bar links this past week. After getting all that stuff done, my mechanic said an alignment would be the last thing I needed to get. But surprise… After the alignment, the tire shop tells me the person who did the control arms has to adjust the camber. My mechanic who did my struts is not answering my texts, and I’m too exhausted to call around shops. I don’t have any more money to give to these overpriced shops right now, and I don’t know any mechanics who can help me or answer this question. I just want this “car repair every other week” nightmare to be over.",1,1753480894.0,3,AskMechanics,1753643892,2025-07-25 22:01:34,2025-07-27 19:18:12,"FallNice3836 (Score: 2): Typically rear negative camber is caused by sagging springs. 

We need model of the car to help further, these long stories never really help with mechanical advice."
1m9bqc8,Is my car totaled?,"So my fiancée got in an accident on Wednesday night trying to pick me up from work (she was found not at fault by both my insurance adjuster and the police plus the guy that caused the accident. We needed to get a car and quick so we got another one but my adjuster hasn’t had the time to verify if the car will be totaled or not. We wanted to get a rental car in the meantime but the other guys insurance adjuster will not pick up the phone no matter what so that’s why we just had to get another car (plus we both work and can’t afford to miss any work at all). Anyways, the adjuster said based on his experience with cars that it looks to be totaled but he can’t say 100% until his guy looks at it. Just wanted some other opinions on it. 

For added information it’s a 2011 Honda accord with 264,000 ish miles on it. It had an accident in December that was also no fault but that was pure cosmetic damage so other insurance didn’t cover anything. My fiancée said she could turn the wheel but she could not move the vehicle at all, even with applying full gas and when she did move the wheel there was terrible scraping. The passenger door also sounds like metal crunching whenever you open it. Also she said something was leaking when they moved it but I couldn’t really tell what honestly. ",15,1753479554.0,41,AskMechanics,1753643892,2025-07-25 21:39:14,2025-07-27 19:18:12,"NoResolve2022 (Score: 9): Totaled. They’re not gonna give you very much for it unfortunately.

Slow-Sound2390 (Score: 3): Well you know already Honda and Toyota are the way to go judging by the miles you got on it"
1m9bmtu,noise coming from front left wheel,what could this be? have some zip ties holding panels up but i don’t think it’s that. 30 down to 15mph in this clip,1,1753479308.0,2,AskMechanics,1753643892,2025-07-25 21:35:08,2025-07-27 19:18:12,"mshaferr (Score: 1): 2021 toyota chr if that helps, 59,000 miles. about to buy new tires as well(not that that’s the issue)"
1m9biqw,Help with shudder under load,"
Edited to add that the only codes I pulled from the OBD was P2015 for intake manifold. 

Recently replaced the battery on a 2015 Audi A4 and shortly after, I started experiencing a shudder/shaking under hard acceleration. Almost like the ABS/traction control was activated or the tires were slipping? The car is a manual transmission and I did notice that the rpms would spike when the car shuddered. Aside from that I haven’t experienced any issues getting it into gear or pulling away from red lights. If I go easy on the acceleration, I don’t have any issues. I can grab some new plugs/coil packs to see if it’s a spark issue but it makes me think it’s a clutch issue since I saw the rpms spike when the car begins to shake.

Question: would bad plugs cause the car to shake under load and cause the rpms to spike or is this a sure sign the clutch is shot?",1,1753479026.0,5,AskMechanics,1753643892,2025-07-25 21:30:26,2025-07-27 19:18:12,"RealT0nySopran0 (Score: 1): Clutch

RealT0nySopran0 (Score: 1): When you accelerate easily the clutch can hold the power but when you gas it it’s prolly slipping"
1m9bcqr,What’s this metallic sound?,"I cross posted this video here from a diff subreddit  but i don’t think anybody saw it? 

Anyway there is this metallic sound or pop that can be heard when reversing or forward from stop. Gone when cruising or driving. 

Sound is mainly from front drivers side but can also hear same sound front passenger side. 

Any input is appreciated. Thank you! 

",1,1753478616.0,2,AskMechanics,1753643892,2025-07-25 21:23:36,2025-07-27 19:18:12,Aerielo_ (Score: 1): maybe the axle
1m9b6k4,Someone tell me why this is happening and how to i address it?,"It just started doing this. Whenever you touch the selector, the horn honks. A buddy said I have a short, but why does it only happen when I move the shifter? I dont want to tear my column down if I dont need to",5,1753478183.0,27,AskMechanics,1753643892,2025-07-25 21:16:23,2025-07-27 19:18:12,"Ravenblack67 (Score: 15): You will need to remove the steering wheel to get to the selector.  Something from the horn circuit is touching the PRN21 handle.

Low_Honeydew_7428 (Score: 4): Oh man, that's a good one. Yep, the horn circuit in the column is either shorting or falling apart. \*honk\*"
1m9b0s4,Is this quote fair or should i ask around?,Tow truck guy said he knew someone who could take care of everything at his shop,1,1753477798.0,10,AskMechanics,1753643892,2025-07-25 21:09:58,2025-07-27 19:18:12,"Mushroomed_clouds (Score: 4): Looks to me that all parts and items are clearly listed , idk what car u have but for the parts listed im guessing a attempted car theft

FoxElectrical1401 (Score: 5): I'd rather have a mechanic who can spell the names of the parts they will be working with.. but that's just me."
1m9ay5z,Bubble in tire,"So my mechanic replaced my lower ball joints in my car and said my tire had a small bubble. You can't see it but if you rub it you can feel it, its very minor. Should I just replace the tire,will it swell up more?",1,1753477620.0,4,AskMechanics,1753643892,2025-07-25 21:07:00,2025-07-27 19:18:12,"NoResolve2022 (Score: 2): Replace it

Ravenblack67 (Score: 2): It will get bigger and it will burst someday.  You should replace the tire."
1m9tqol,Need advice,I have a 2012 Honda civic coupe I want to get brakes for it. I’ve been thinking about getting drums with cooling fins on it but I don’t know if they are worth it or should I stick to oem ,2,1753537543.0,1,AutoMechanics,1753643892,2025-07-26 13:45:43,2025-07-27 19:18:12,Icy_East_2162 (Score: 1): Unless your carrying extra load or towing - Standard drums are adequate for normal conditions
1m9natj,09 VE Holden Berlina auto,"Looking for some guidance with my car.

Had the car for about 4 years at this point and running relatively fine until now .

Had a battery die so replaced with a new one which also died. Cool new alternator it is. Now the car is all but undriveable.

Checked codes. It's only throwing one for the oil pressure sensor which was existing. Plenty of oil and other fluids.

Idles fine for the first little while about 10 minutes or so then the revs drop to 500rpm and the car starts to really struggle. Any attempt to drive it sees check engine and alternator light come up but only when driving not parked or on start up and the car cuts out completely no limp mode straight dead . Car then restarts fine until it happens again 20meters later.

I have a few ideas such as faulty alternator from factory or the maf sensor but with no codes and limited knowledge on the subject I have no idea where to start.

Help",2,1753514923.0,3,AutoMechanics,1753643892,2025-07-26 07:28:43,2025-07-27 19:18:12,"Icy_East_2162 (Score: 1): Going by the fault code you get , It ""may"" be the ECU it's self , Ve Belina are known to have ECU issues ,
Misinterpreting fault codes , 
and you may experience ,no start ,stalling ,lack of power ,etc 
Related to a few faults ,like fuel supply ,ignition system/ immobilizer, crank angle sensor , symptoms start / stop ,etc"
1m9j1jc,Brake lights not activating even after fuse switch and brake light switch replacement,I have a 2012 Honda Accord sedan. Today I tried changing both the fuse that’s under my hood that is connected to the stop and the horn. I also tried replacing the brake light switch. I turned on my car. It seems like my back lights still work. Just my brake lights are not activating.,2,1753500150.0,4,AutoMechanics,1753643892,2025-07-26 03:22:30,2025-07-27 19:18:12,"NightKnown405 (Score: 1): Do you have the schematic for the brake lights?

ChemistAdventurous84 (Score: 1): Does the horn work? Is there a relay?

Sqweee173 (Score: 1): Did you adjust the switch properly when you installed it?"
1ma4423,What should I do? Can I lease a new car while on finance?,"Can I lease a new car while still paying off a car on finance?

Hey everyone, I’d really appreciate some advice on this. 

I currently have a car on HP finance that I got through Carmoola at 18.8% APR. At the time, it was my only option since I had just moved to the UK from Australia and didn’t have much credit history. I drive a lot for work, so I needed something fairly new and reliable.

Fast forward over 3 years, I have now paid off nearly half of the total finance amount, and my contract says I can return the car and end the agreement early once I hit 50%, which I’ll reach by October 25.

Now I’m looking to lease a new car for work. My wife works from home but would use it on weekends with the kids, so something newer and more practical makes sense.

So should I end the current HP agreement first before applying for the lease? Or is it okay to apply for the lease while still having the HP agreement active, and then return the old car once the new one arrives?

I’m a bit unsure because I’ve heard it can take a while for settled accounts to show up on your credit file, and I don’t want my score to dip or be left without a car while waiting. My current Experian score is 977, and I’m considering a 6+48 lease deal looking at the Kia sportage. I earn about 2k after tax.

Any advice or personal experiences would be super helpful. Thanks in advance.

",1,1753563420.0,2,CartalkUK,1753643892,2025-07-26 20:57:00,2025-07-27 19:18:12,"Chris_the_dood (Score: 1): From a credit file PoV, there is absolutely nothing wrong with doing this.

From a general advice PoV, make sure you explore all of the credit avenues available and carefully consider how long you want to keep the car. For your previous agreement, 18.8% is horrendous and HP is a financially bad way to keep a car for two years.

Also, get an updated 'finance settlement figure' from your HP. Walk into WeBuyAnyCar and ask how much they can give you. If you're lucky you may have some equity, WBAC will clear the finance, take the car, and give you the equity.

Leasing generally is not the most frugal way to get a car unless you 1) need a brand new car. And 2) have some kind of tax benefit from doing so.

Also, I only just read the last line. You earn 2k after tax. This doesn't sound like 'having two expensively financed cars at the same time' sort of money."
1ma431m,"ID on this car please, wonderful people? The Gold on BBC",,30,1753563348.0,7,CartalkUK,1753643892,2025-07-26 20:55:48,2025-07-27 19:18:12,"Rick_but_short (Score: 15): Mk1 Toyota celica

T5-R (Score: 5): 70's Toyota Celica

L21JP (Score: 5): First generation Toyota Celica"
1ma3n7y,I’ve put petrol in my wife’s diesel car because I’m an idiot.,"As title suggests I’ve put £20 petrol in my wife’s car &amp; then drove it off the forecourt for about 2 miles. Car cut out &amp; as I was thinking what it could be my mistake occurred to me. 

I drive a petrol is the only reason I think I could be so stupid. 

Car clunked out, no missfires, engine doesn’t sound seized ( tried starting it again before I realised my mistake) 

My thinking is syphon all the remaining fuel out &amp; stick £20 of diesel back in to see if it fires back up. 

Car is 2008 Touran 220k on the clock, if I can’t fix it by the roadside I’ll probably scrap it as due an MOT soon &amp; further investment seems futile. Any tips or tricks anyone can suggest ",195,1753562222.0,122,CartalkUK,1753643892,2025-07-26 20:37:02,2025-07-27 19:18:12,"hobdal (Score: 214): Done loads of fuel drains over the years at work. I can't remember any that weren't absolutely fine. Drain it, change the fuel filter, put some diesel in and she'll be fine.

If you really want to stick a fuel system treatment through it as well.

OutrageousCourse4172 (Score: 87): Diesely done.

xet2020 (Score: 13): Might need to put more than £20 worth to dilute it down more than that, if you are lucky it might work but i wouldn't be putting just £20 worth on that chance.."
1ma37fi,Reliable workhorse for 5k or under for occasional family use?,"Hi all,

I was wondering what you guys thought the best option here will be (don't care if manual or automatic or what year) would ideally like it to:

* **Be reliable.**
* Be £5k or under, the cheaper the better as it will only see max 2k miles per year of use.
* Have moderate boot size (400L+).
* Have decent mpg.
* Have a decently sized engine as may be towing a boat with it (1.4+ will do).
* Be safe as will have young child in.
* Generally just be comfortable to use.

Any suggestions are greatly appreciated!",1,1753561095.0,4,CartalkUK,1753643892,2025-07-26 20:18:15,2025-07-27 19:18:12,"cars-r6s-etc (Score: 3): I feel like Saab and Volvo kind of fit this category pretty well, especially on the safety front

tepidfuzz (Score: 1): Honda jazz or civic"
1ma36l2,Looking for a new daily...,"Sadly my much loved '19 Mazda 6 2.5 petrol (192bhp) been in an accident today and I need to find a new daily pretty soon.
It had everything I need in a car spec wise like cooled and heated seats, heads up, sunroof, 360 camera, carplay, adaptive cruise and leds, bose sound, etc.
Pretty comfortable, realible and good to drive.

I drive 75 miles a day 4 times a week to work plus around 200 miles every month and a half to visit friends. My average used to be 38mpg spirited driving and 44-6mpg with regular driving.

Single 30M, rarely have passengers with me, £16k top budget, enjoy driving. Unsure if I should switch to diesel as my last 5 cars were petrols and I do love them but with this milage might be worth doing it.

It was on a HP finance, have gap insurance on it and just waiting for things to get sorted.

I would really appreciate some help with my options.",42,1753561037.0,43,CartalkUK,1753643892,2025-07-26 20:17:17,2025-07-27 19:18:12,"totallysenseless (Score: 64): Why not just get another Mazda?

Ziemniok_UwU (Score: 18): Hmm this is an awkward one because no other car will give you as much spec for the money but for your use case a diesel is definitely the best option and Mazda diesels are terrible and should be avoided like the plague.

I guess you either get another petrol Mazda or get a diesel of some sort, probably something with the VAG 2.0 TDI is your best bet or if you want more power than something with the BMW 3L Diesel.

CalligrapherNo7337 (Score: 7): I'm sorry for your loss, brother. I'd just replace it like-for-like but I'm biased."
1ma2z5t,Door not inline,I got this used mini f57 and I have the driver side door not inline with the car as shown. I try to move the striker inwards but doesn't change much. The door lock normally. Is this just a tolerance or something is wrong with any of the door parts?,1,1753560511.0,8,CartalkUK,1753643892,2025-07-26 20:08:31,2025-07-27 19:18:12,"TheMostyRoastyToasty (Score: 3): Possibly a bent hinge?

danblez (Score: 2): My f56 is like that on both sides and is all original. I’ve looked at lots and there’s plenty likes this. I wonder if they were bui in different factories

Dry_Database_6720 (Score: 1): Maybe it’s been punched too many times"
1ma2oum,Do new alloys need to be balanced?,"Long version: I recently purchased a car (VW Id3) that, to my delight, came with brand new Michelin Cross climate all season tyres on the stock 18"" steelies. I do about 25k miles a year on rural A and B roads so it occurred to me that I'd be best off rotating these out for Summer tyres until late November and getting the benefit through winter. I found a brand new set of VW Id3 alloys with new continental summer tyres for £800. They've arrived and are clearly brand new. Do I need to have them balanced before I put them on? I have a torque wrench and know the specs so expected to do this myself. 

TLDR: have brand new alloys and tyres via mail order, do they need to be balanced? Google inconclusive. ",1,1753559790.0,18,CartalkUK,1753643892,2025-07-26 19:56:30,2025-07-27 19:18:12,"spike_2112 (Score: 4): Have a look, if they have balance weights on them then they’ve already been balanced. If not then it’s best to get it done.

HonestEngineering (Score: 5): They should have been balanced when the tyres were fitted, can you not see any wheel weights on them at all inside the barrel?

81optimus (Score: 5): Is there any weights on the back of the wheel already? I'd take them to the shop and have them balanced if not. Cheaper option is throw them on and go for a blast, you'll soon enough find out"
1ma237v,Do you call Diesel petrol or call it Diesel?,"Purchased a diesel  car few weeks ago, my first ever one, me and the Mrs have a debate each time. Do you say ""I need to get some petrol"" or ""I need to get some diesel"" when you need to fill up your diesel car?


My argument is that you fill up at the petrol station, not the diesel station as petrol can be a term for both petrol and diesel? Like fuel/gas etc


I feel like saying' I need some diesel' sounds awfully pretentious and I just hate saying it 


Thoughts ?",0,1753558260.0,25,CartalkUK,1753643892,2025-07-26 19:31:00,2025-07-27 19:18:12,"nosajn (Score: 13): Going to get petrol in your diesel car is a very slippery slope to putting petrol in your diesel car. 


Call it diesel, or fuel. 

Barry_Boggis (Score: 20): FUEL

That_Northern_bloke (Score: 8): I think you're overthinking this massively "
1ma1xbs,Best Octavia MK2/3 engine?,"Few years ago I had a MK2 Octavia 1.6 Greenline and it was the most unreliable car I’ve owned leaving me stranded twice in 12 months. Both times it was an injector and I was told both times that greenline injectors are special and therefore quite expensive. WBAC’ed it after signs another injector was going and moved on. 

Wanting an estate car again and the Octavia still looks good value for money but this previous experience has put me off, the petrols any better? Or did I just get unlucky?",1,1753557845.0,3,CartalkUK,1753643892,2025-07-26 19:24:05,2025-07-27 19:18:12,"Albigularis (Score: 1): The best engine from every available option is the euro 6 150bhp 2.0 TDI. Mega reliable, good on fuel, 195bhp with a remap. 

There are more economical and faster, but this is the best compromise by far. 

Ziemniok_UwU (Score: 1): For Mk2 the2.0 TDI and for Mk3 the 1.8/2.0 TSI from 2013 onwards.

Worst would be the 1.6 TDI and the pre 2012/13 2.0 TSI.

Forsaken-Original-28 (Score: 1): Get the petrol vrs"
1ma1pps,Buying a BMW 3 Series 2013 316d,"Hi everyone, I am looking to buy a BMW 3 Series 316d 2013. Is there anything I should look out for. The car is being sold for £4,500 and the insurance group is 20E. 

Any suggestions? ",1,1753557310.0,4,CartalkUK,1753643892,2025-07-26 19:15:10,2025-07-27 19:18:12,"tune-happy (Score: 1): Listen for timing chain rattle on start up.

Klutzy_Insurance_432 (Score: 1): I’d get a 320d they are same price 

Still £35 a year tax and same insurance

Ziemniok_UwU (Score: 1): Listen for rattles and also make sure service history is good. BMW petrols of that era were quite problematic."
1ma1mez,Got this little scent gadget just under £10,"It claims that the scent lasts up to 45 days and the battery lasts a whole month who you can charge via usb.


",0,1753557082.0,17,CartalkUK,1753643892,2025-07-26 19:11:22,2025-07-27 19:18:12,"Soggy_Cabbage (Score: 11): It's just a repackaged vape on a timer lol.

Lxium (Score: 10): Landfill tat

Live-Cut-5991 (Score: 6): Let’s just fire chemicals directly into where you’re sat, sure it smells nice though."
1ma193m,Driving Emotions: Examining How Car Manufacturers Use Emotional Appeals in Advertisements,"Hey everyone! 🙌
I'm conducting a survey for my college research project titled:
""Driving Emotions: Examining How Car Manufacturers Use Emotional Appeals in Advertisements.""

I need around 200 responses, and it would really help me out if you could spare just 2 minutes to fill it out!
It’s short, anonymous, and purely for academic purposes.

Thanks in advance! 🚗🙏",1,1753556181.0,2,CartalkUK,1753643892,2025-07-26 18:56:21,2025-07-27 19:18:12,tune-happy (Score: 2): Completed. The questions at the end seemed a bit strange tbh and overall the questions led me to think that I'm not the target person that this questionnaire is trying to target.
1ma16ao,Land Cruiser (LC150),"I'm replacing my Subaru Outback due to too many issues with oil dilution (diesel) and parts getting slowly more expensive. 7 seats is also a bonus, and I go camping a lot so extra space is desired.

I was initially looking at the Mitsubishi Shogun from around 2010-2015ish, then I spotted a 2013 LC150 LC4 spec diesel with 144,000 miles on the clock which appears to be fully undersealed and the dealer was tossing in an 18 month warranty too. Pricing would turn to be £14,000 with the Subaru traded in.

The sensible part of me realises that swapping a car with 146,000 miles for one with 144,000 miles and slapping down £14,000 for the privilege thinks that it is foolish, when a Shogun could be got with nearly half the miles for nearly half the cost, but does anyone have any experience with Land Cruisers of that generation here?

Part of me wants to, but it's also a shitload of money for a risk like that.",4,1753555984.0,1,CartalkUK,1753643892,2025-07-26 18:53:04,2025-07-27 19:18:12,"EUskeptik (Score: 1): If it’s a 3.0 D4-D auto it will be heavy on fuel, typically 26-28 mpg.

Of course you might have been getting little better than that with the Subaru.

Fuel consumption with the Shogun 2.9 diesel auto will be even worse."
1ma0oah,Recommendations for undoing a questionable rattle can job?,"Hey everyone. Got a scratch and seeing is was in a fairly hidden spot I thought I'd spray paint it. Despite trying to a decent job: sanding &amp; priming before painting, it still looks pretty shit. 
There's too much overspray and I'd be better off removing about 50% of it.
What would be a good product / process for this please? Some kind of thinner? Would need something that takes off the spray paint and primer but not the decent original paint underneath. 
Thanks ",1,1753554746.0,2,CartalkUK,1753643892,2025-07-26 18:32:26,2025-07-27 19:18:12,Appropriate_Kiwi653 (Score: 1): Go to a professional.
