id,title,selftext,score,created_utc,num_comments,subreddit,scraping_time_utc,created_datetime_utc,scraping_datetime_utc,top_comments
1ma43dy,Coolant leak?,I was driving my car home from work and right as I get home the red coolant light pops up. When I shut it off and got out I noticed the steam and this sound coming from the engine. I was wondering if the steam in the video is coming from where the leak is or if it’s just bc the engine was overheating or something else. (Coolant was empty so I’m pretty sure it’s a leak) ,1,1753563372.0,2,MechanicAdvice,1753643892,2025-07-26 20:56:12,2025-07-27 19:18:12,Playful_Highway9306 (Score: 1): Forgot to mention it’s a 2012 Mazda 3
1ma4382,What’s your opinion on early to mid 2000’s Toyota Siennas?,I really love my Suzuki SX4 but it’s just tiny and gutless. Could use more space for some carpentry jobs too. Looking at getting a new daily and these have been coming up pretty cheap in my area. How do you guys feel about them? I’ve never heard anything “bad” per se except some of the spark plugs are a booger to get to. also never heard anyone brag on them much either. ,1,1753563360.0,7,MechanicAdvice,1753643892,2025-07-26 20:56:00,2025-07-27 19:18:12,"hudgeba778 (Score: 2): I love my Gen 2 Sienna, plenty of seating for a whole lot of people and I can easily take out the seats to convert to a cargo van when needed"
1ma42yk,How bad is this oil leak in a Toyota corolla 2017?,What type of oil leak is this? ,1,1753563342.0,4,MechanicAdvice,1753643892,2025-07-26 20:55:42,2025-07-27 19:18:12,"YaBoiSupernova (Score: 1): Timing cover. Not the worst I’ve seen but I imagine that is forming droplets which is when I typically have them in my bay to reseal. See if it’s under warranty

AppalachianHB30533 (Score: 1): More of a ""seep"" than a leak.  Not bad at all in my opinion/experience."
1ma3yi1,Does a serpentine belt tool make a difference?,"Hi. Me again, lol. 

I just replaced the alternator on my 2010 Kia Forte and I am having the hardest time getting the belt back on. Literally the last thing I need to do and it’s driving me crazy. 

When I replaced the belt in my pickup awhile back I was able to use a breaker bar from below  but I didn’t have enough room this time. Offset wrench was a no-go. I finally released the tension with a wrench after losing two in the engine bay (I found them) but it is not working to put it back on. I’m thinking of just going back to Harbor Freight again for a serpentine belt tool kit or a longer 17mm wrench for more leverage. 

Side note…this would be my third trip to Harbor Freight for this project. Is that normal or am I just really bad at this?",1,1753563024.0,7,MechanicAdvice,1753643892,2025-07-26 20:50:24,2025-07-27 19:18:12,"Trollygag (Score: 2): You are goi g to HF a lot because you don't have enough tools already. It will stoo when you build out your tool set.

Ironic_Papaya (Score: 2): Gearwrench makes a great serpentine belt tool set for like $40. You get 7 sockets and a ratcheting wrench. The one at harbor freight that is similar is like $60-70 I think."
1ma3vja,3.6 pentasutar Chrysler 200 (p0174 code bank 2 running lean),I just purchased this 3.6 Chrysler 200 for my first car. The car has Been sitting for a while. Everything was decently maintained but it is running a lean code. What’s a good place to start in diagnosing what it is?I feel like I can hear a air leak but I’m not sure I need a trained ear to lmk ,1,1753562811.0,2,MechanicAdvice,1753643892,2025-07-26 20:46:51,2025-07-27 19:18:12,"RichardSober (Score: 1): >What’s a good place to start in diagnosing what it is?

You need to check what short/long fuel trims you have now and figure out if you can arrange a smoke test."
1ma3v83,I have 2 low pressure a/c ports,,1,1753562789.0,8,MechanicAdvice,1753643892,2025-07-26 20:46:29,2025-07-27 19:18:12,"AppalachianHB30533 (Score: 1): You probably have a liquid port, followed by an orifice, followed by the suction side (low pressure) port.  You can verify by watching how it sweats when it is running."
1ma3uv0,Control arm damage found at dealership am I being ripped off?,Went to toyota dealership for an oil change and wheel alignmnet. The service tech found control arm damage and was quoted this repair but I decligned for today because I do not have that much money to get it fixed today. How serious is this and does it look like it needs repair or were they trying to rip me off? ,0,1753562765.0,24,MechanicAdvice,1753643892,2025-07-26 20:46:05,2025-07-27 19:18:12,"ktoyijmokjop (Score: 6): Thats definitely one of those things where it should be taken care of at some point soon, but realistically you can drive safely on that for quite a while. Ive driven on far worse. Its ok for the next few months, but plan on getting the bushings replaced in the near future

Parodyphile (Score: 4): Get it done at a non dealership and it will be way cheaper.

I actually just had my control arm break off at the sub frame(2011 Benz c300) but the nice part is that this is a known issue, so for a bunch of models and years Benz is giving us 20 year warranty and unlimited miles, so I lucked out."
1ma3ubd,Need help identifying this differential,"Hello fellow mechanics, I need assistance on identifying the vehicle this came out of. It currently sits on a 1988 Silverado but the owner tells me it came from a ford. We’re trying to install a brake convertion kit so we need to make sure we get the right kit for it; mostly concerning the bracket that will go behind the hub. Thanks in advance. ",1,1753562724.0,3,MechanicAdvice,1753643892,2025-07-26 20:45:24,2025-07-27 19:18:12,mechrisme (Score: 2): Looks like a Chevy 10 bolt according to that part number on the housing
1ma3ouh,2021 Toyota Camry parking brake,Did the rear brakes and had to change a caliber. Now the parking brake light on the dash and the button are blinking. The dash also says “parking brake malfunction” and when I try to use the parking brake is says “parking brake unavailable “,1,1753562341.0,3,MechanicAdvice,1753643892,2025-07-26 20:39:01,2025-07-27 19:18:12,"BBanks94 (Score: 1): When you service the rear brakes on modern vehicles with an electronic parking brake, it must be put into a ""Maintenance mode"". Some manufacturers have procedures for doing that without a scan tool, while others require a scan tool. I haven't attempted to do rear brakes without putting the car into Maintenance mode, but I'm assuming the caliper and/or parking brake actuator would get damaged if you didn't do it."
1ma3lql,Help,"Any idea what this could be? I flushed out and changed transmission fluid, still same issues accelerating.",1,1753562117.0,3,MechanicAdvice,1753643892,2025-07-26 20:35:17,2025-07-27 19:18:12,"03terminatorsvt (Score: 1): Describe your symptoms well. Why did suspect the transmission was the culprit?

Plane_Hovercraft_198 (Score: 1): Check engine light, along with not accelerating properly"
1ma3l9f,MX-5 NC Airbag warning light,"Car is a 2007 1.8L Mazda MX-5

Have just completed a full engine rebuild. Runs great now, only problem is there is an airbag warning light.

One long flash followed by 9 quicker flashes. I think this translates to a “code 19”

Scanning the OBD2 port with FORScan viewer I get the DTCs in the picture. One saying circuit resistance low, one saying circuit open, one saying the passenger airbag disabled light is faulty (it isn’t) and one saying low battery (it’s just been fully charged).

Anyone got any suggestions? I’ve tried going through all the connectors with contact cleaner to no avail. ",1,1753562083.0,3,MechanicAdvice,1753643892,2025-07-26 20:34:43,2025-07-27 19:18:12,"greengroundz15 (Score: 1): I'd start by charging your battery then clearing the codes. After, drive around and then plug scanner back in and see what comes back"
1ma3jj8,"Need HELP, Won’t start‼️",Originally posted in the Mini forum. ,1,1753561962.0,2,MechanicAdvice,1753643892,2025-07-26 20:32:42,2025-07-27 19:18:12,"Adventurous-Duty6162 (Score: 1): There has been a few people lending advice on the original Mini Reddit page and I wanted to also share the computer read here too:

ENGINE CODES
PRIMARY DTC:
P053A Positive Crankcase Ventilation Heater Control Circuit /Open
An ASE Certified Technician has seen this problem on your type of vehicle before and has performed the
following repair(s) to fix the problem:
PRIMARY FIX:
Replace Positive Crankcase Ventilation (PCV) Heater Relay
Multi Purpose Relay $25.00 x 1
OTHER FIXES:
OTHER DTCS:
PENDING P053A, P0300, P0304, P0302
STORED P053A
PERMANENT P053A, P0442, P0456"
1ma3e90,What is this metal hose?,"2012 Honda CR-V EX-L 2WD 4 Cylinders 2.4L

The hose is leaking from the connection in the middle of the circle.",3,1753561591.0,6,MechanicAdvice,1753643892,2025-07-26 20:26:31,2025-07-27 19:18:12,"SimilarTranslator264 (Score: 7): Low pressure air conditioner line or “suction” line.  Gonna get hot inside your car soon.

GIMPSUITCHARLIE (Score: 2): This is your ac refrigerant line the low pressure side. If you have actual liquid leaking from it and not just condensation you could have a few different issues cause the low side has small amounts of liquid and is mostly liquid vapor and the high pressure side has the liquid. It just swaps between the 2 in your ac system. You could have something wrong with your evaporator but you should just take it to a shop if it’s not water dripping.

Also that’s just one solid line there aren’t connectors there, that’s just a mounting bracket wrapped around it. So if it was leaking it would come from that nut to the right or the hose to the left"
1ma3d9i,Installing trailer hitch and last bolt just spun once it was in. What did I do wrong?,2016 CR-V. The bolt hole had corrosion and took some work to get it in. Was over the muffler so couldn't get to easily. Will a new bolt do the same thing? Any other options? Using it mostly for my bike rack. ,1,1753561519.0,12,MechanicAdvice,1753643892,2025-07-26 20:25:19,2025-07-27 19:18:12,"motoresponsible2025 (Score: 2): It's not just the bolt that's ruined. The threads on the insert on your car are also in bad shape.

brankovie (Score: 2): I wonder if you tightened all the other bolts too much before inserting this one, and it didn't go in straight."
1ma2yt4,O2 sensor is stuck FOR REAL,Was able to crack it loose and turn it little bit and this thing is stuck. Ive gone thru about half a can of pb blaster went to autozone picked me up a torch been heating it a couple times with no luck the bolt is just getting worse ans worse someone pls help me get this off,1,1753560486.0,8,MechanicAdvice,1753643892,2025-07-26 20:08:06,2025-07-27 19:18:12,"Vic_Pirelli (Score: 3): When it turns and then sticks, try turning it the other way.  You can go back and forth a little each time and it will help keep the threads from stripping.

It looks like you've already cut the wires.  What are you using for a tool?  The best thing right now would be a deep 6 point socket.  7/8"" or 22 mm either one will work.  The points on the  hex are starting to round, so if it keeps slipping the next best tool is a small pipe wrench.  The back and forth as you loosen it is the key.

RollingCoalBlack (Score: 1): Get some old engine oil the blacker the better heat the sensor nut nicely and brush some of that engine oil on it, let it cool for 10-15 minutes do it again try and crack it, if it moves and stops, repeat reheat. Don’t try to force it too much. It’s slow but it’s better than stripping the thread. Works for exhaust manifolds and any other hot shit that won’t come undone"
1ma2vt9,2011 silverado engine click?,"2011 Silverado 1500 LT 8 cylinder 5.3L 4WD
201,000 miles.
Noticed a click while pulling into a parking garage and shortly after engine light came on. 
Autozone pulled a fuel injector code and a local mechanic said it’s a faulty piston and wants $2,500 to work on it?
Just need some advice on what this click could be? ",1,1753560272.0,3,MechanicAdvice,1753643892,2025-07-26 20:04:32,2025-07-27 19:18:12,"Beginning_Ad8663 (Score: 1): Check your lifters

Monstah727 (Score: 1): It’s pretty common to see cam and lifter problems in that engine, and that’s what it sounds like to me."
1ma2vg9,Starter stuck on after start,My key got stuck in the start position and the starter kept going for a while while running. Now it won't start in gives a little clunk but no crank. It's toast eh? ,1,1753560246.0,4,MechanicAdvice,1753643892,2025-07-26 20:04:06,2025-07-27 19:18:12,"No-Concern3297 (Score: 2): Check voltage drop in battery cables and battery state of charge first.. they would have gotten hot too.   Starter Solenoid or brushes will burn up if it cranks too long or the little gears in it will strip off,  It’s possible to repair starter itself if you have other junk starters laying round to take parts from but quicker to get a new one."
1ma2uwg,Jack stands on asphalt,"I’ve had the front of my car up on stands on both sides for two days, parts I am waiting on are still about 3 days out. How concerning is this ? I have removed my cv axel and have hand threaded tie rod / control arm bolts. Suspension fork is removed. I mean can I drop it on the wheels like that and or my car is lowered so a regular jack won’t fit under it at lowest setting..Should I drop it on one for the time being and remove the stands ?",395,1753560206.0,75,MechanicAdvice,1753643892,2025-07-26 20:03:26,2025-07-27 19:18:12,"eagleace21 (Score: 485): At this point just let it ride

Crypt0-n00b (Score: 250): I typically use plywood to prevent this especially in the summer it can save your driveway."
1ma2uch,Denso or NGK SPARKPLUGS?,I’ve got a 2014 Accord with 3.5L v6. Roughly 190k miles. Just today I replaced my plugs with Denso Irridium long life’s. Previously I’d installed NGK’s. No complaints with the NGK’s but I got curious as to which is the preferred brand? Assuming equal ‘grades’ of each. Has anyone seen a difference? My prime focus is fuel economy. ,1,1753560168.0,2,MechanicAdvice,1753643892,2025-07-26 20:02:48,2025-07-27 19:18:12,Monstah727 (Score: 2): They both offer a quality spark plug.  NGK makes the factory plug for that car.
1ma2u0e,2018 Dodge Challenger GT coolant missing,"My mother's car overheated yesterday, and after examine and noticing her hot air was indeed cold and not getting got I replaced the thermostat, it got hot and tempature regulated, added 3/4s of orange OAT coolant, bled it from the thermostat for a minute then drove home just fine. I did notice that it sucked nearly all of the coolant out of the resivior and then came back, then gone again until I topped it off. After driving home noticed most of it was gone from resivior, sitting overnight it filled the resivior back up, no there is no white residue anywhere, or leaks to be seen or puddles other than a little bit on some metal from bleeding. (It got on the plastic but did Not leave any residue. 

Also, when taking the thermostat off to replace I did not drain, but none came out. I chalked this up the the thermo being stuck closed or something and not letting it move through the system until I replaced it. 

I'm lost at this point. No white smoke from exaught or sweet smell, nothing of the sort to explain where coolant is going or why (if it is) low. 

Could it simply be the cap? Could that much evaporate if the resivior cap isn't seeler 100%?",1,1753560144.0,3,MechanicAdvice,1753643892,2025-07-26 20:02:24,2025-07-27 19:18:12,"RichardSober (Score: 2): Inspect your oil cooler housing base in between engine heads. If you see a pinky swamp there, that's your answer.

Aceopsog (Score: 0): Top the coolant up and trade that pos fiat for a Toyota or literally anything else."
1ma2oe9,R.I.P 2005 dodge Dakota,As the title says my truck died today . 195k miles . Yesterday I replaced the catalytic converters on it they 90 and 50% clogged . Drove great yesterday . Now the engine light is flashing and a little red light flashing. It won’t even start now . It did for a second this morning now nothing . I don’t have really have money to throw at it . I threw a code reader in it and a whole bunch of red flashing . I don’t know if it’s something simple of that engine is just toast ,1,1753559757.0,3,MechanicAdvice,1753643892,2025-07-26 19:55:57,2025-07-27 19:18:12,hudgeba778 (Score: 1): Code reader should give you a good idea of what’s wrong with the vehicle
1ma2do7,Mechanic sent me this video— what am I looking at please?,"2016 chevy Malibu 34,000 miles 4cyl 1.5L

Forgive me, I know very little about how cars work, but want to learn. 

Had my car in a shop for a week now, as I had an engine misfire. The shop said I have low compression in cylinders 1, and informed me I would need a $3500 engine rebuild to replace the valve on cyl 1. 

Today they told me there is low compression in cyl 2 as well, and it is likely from carbon buildup, and I probably need the whole top/head(?) replaced. They also said to prevent it from occurring again in the future, I would need to have an induction cleaning every other oil change. 

They also sent me this video, of the oil, but I’m really not sure what it shows. I did have my oil changed there about 1,000 miles ago. What should the oil look like after 1k miles, and what is wrong with mine/ what does my oil show? Thanks",8290,1753558990.0,2073,MechanicAdvice,1753643892,2025-07-26 19:43:10,2025-07-27 19:18:12,"MechanicAdvice-ModTeam (Score: 1): Thanks to everyone who made an objective attempt to answer OP's question *""Mechanic sent me this video— what am I looking at please?.""*

Thread locked.

karmaredemption (Score: 2789): That is a whole lot of glitter , definitely internal wear , not a lot of life left in this one

Misteryman2260 (Score: 630): That's a lot of metal in the oil. For 34k miles that seems absurd to me, how are your oil change intervals?"
1ma2bee,Can anyone identify what this sound is? Dodge nitro 08,,1,1753558834.0,5,MechanicAdvice,1753643892,2025-07-26 19:40:34,2025-07-27 19:18:12,"RoseColoredMistress (Score: 1): The weird clicking sound that increases with rpm

BBanks94 (Score: 1): It sounds like a bad lifter to me. I'd take it to a shop and have it looked at. They may need to remove the valve cover to figure it out for sure."
1ma2a76,rattling sound in second gear,"Hello everyone, I have a 1992 Lexus SC400. Today, on my way to a fishing trip, I hit a nice stretch of road and got up to 130 mph (not bragging, just mentioning anything that might be relevant). Everything was running smoothly. I parked my car and went on my trip.

When I came back and started leaving the parking lot, I noticed that between 1,400–2,200 RPM, there was a bizarre rattling sound. It seems to be coming from the backside of the engine or right around the front wheels area but towards the engine. The sound is like shaking a Coke can with a few metal BBs in it, and rattling it at random intervals.

So I began investigating, and here’s what I’ve noted:

* It only makes the noise in 2nd gear, and not in any other gears (or at least I can’t hear it in other gears due to wind noise).
* It does not make the noise in park, neutral, or reverse.
* The sound only really happens around 18–30 mph, which makes me think it could be 2nd gear-related.
* I’m also wondering if maybe one of the metal brake shields (the thin metal covers behind the brake rotors) is rubbing or loose.
* I recently switched to a more premium oil (Royal Purple), though I’m not sure if that would cause this.
* It might also be due to me putting off a transmission flush—maybe it’s catching up to me now.

ask me any more questions that can help shed some light on the issue.  
thanks all for your time",1,1753558747.0,3,MechanicAdvice,1753643892,2025-07-26 19:39:07,2025-07-27 19:18:12,"zeltacilveks97 (Score: 2): Sounds like a loose heat shield or brake dust shield, especially if it sounds like BBs in a can."
1ma299t,"Give it to me straight, Doc",,1,1753558682.0,4,MechanicAdvice,1753643892,2025-07-26 19:38:02,2025-07-27 19:18:12,"JeremiahWellington (Score: 1): Am I right in thinking it goes away or is it because you moved the camera? It sounds like a squeaky belt which is minor.

Yer_Arugula (Score: 1): 2012 s60, I bought used with 124k on the odo. I’ve already taken it in at 126k to replace the spark plugs, o2 and fuel sensors. On the 19th, I replaced the cabin o2 filter myself, and since then, the car’s had a rough idle and I can feel the engine shaking in the cabin when accelerating or going uphill.

I have service scheduled for this coming Tuesday, but I do need to use the car until then, think I can get away with it? Cost-wise, what am I in for at my trusted indie shop.

Thanks in advance for any help and advice. Drive safe out there"
1ma24h0,Brake rotor wear on outer edge only on one side. What to do ? Help,"Have recently replaced the brake rotors and pads on the rear of a 2009 Mazda 6. The wheel bearing is new on the rear right as well.

Have driven about 200 miles and the rear right rotor has only worn only towards the outside on both side of the disc. This is the side with the new bearing/hub

I have checked and rechecked 5 times. Brake slides are new and well lubricated but not excessive and put on the right location. Have swapped caliper bracket with the other side but no difference. New rotor and pads. Have tried different pads but no difference. The pads seem to sit at an angle in the caliper bracket when brakes arent applied. The pads are the same with no inner and outer pads like some other cars

The left side is perfect with no uneven wear.

Running out of options as have had everything dismantled multiple times.

Could this be a caliper issue ? It's single piston caliper and curious how both sides of rotors are only worn on the outer edge.

",1,1753558345.0,23,MechanicAdvice,1753643892,2025-07-26 19:32:25,2025-07-27 19:18:12,"Protholl (Score: 4): The caliper is sticking or the slide pins are sticking (or both).

SatansWarrior69 (Score: 2): The caliper bracket wouldnt make a difference so waste of time. The most likely cause is the caliper is bad. The calipers are under a lot of heat and the piston in the caliper can go bad. When that happens the caliper stays shut. 

Hopefully you are bleeding the brakes every time you work on brakes. You didnt state that you are and that is essential. If you havent been bleeding brakes you definitely have air in the brakes and that may be your problem. If the brakes arent bled the caliper isnt going to work and eventually you will ruin the caliper piston because it gets stuck in one place eventually because it isnt moving with air in the brakes. Not to mention its also dangerous not bleeding the brakes.
Also that rotor looks like it needs changed. So buy a new caliper and rotor."
1ma1yu1,New alternator failing and stereo stopped working,"I got a new battery and then went to Brake Masters and got a new alternator. My stereo stopped working entirely after glitching out, showing errors, turning on/off by itself, ect. I went to autozone and tested the new alternator and it said “Charging Current: Fail”. I went back to BM and they said the alternator was 100% good, no issues but I didn’t get to see any paperwork or anything and they said it was showing old codes so that’s why the alt failed. I went to a diff autozone the same day and tested the alternator again and it said it failed. Where can I go to test and truly ensure that my alternator isn’t affecting my stereo and know that my alternator is 100% good? I also went to a 3rd autozone and they gave me some paper and said the car wasn’t showing any codes but I don’t understand it really because I thought that was something only for when the check engine light is on. ",1,1753557954.0,2,MechanicAdvice,1753643892,2025-07-26 19:25:54,2025-07-27 19:18:12,"Rebeldesuave (Score: 1): You can buy a battery tester inexpensively, read the directions ( most have an alternator/charging test) and see for yourself what's going on with your alternator."
1ma1y0y,EA888 2.0TFSI 190 AUDI A5 2018,"I’m slowly losing coolant on my car, any idea on what it could be. its not a great amount at all if i fill it to max itll take 2-3 months to get min.",3,1753557896.0,2,MechanicAdvice,1753643892,2025-07-26 19:24:56,2025-07-27 19:18:12,Redit_sucky (Score: 1): these engines had a extended warranty for the water pumps leaking. I have it on a 2017 gti and 1 2019 tiguan. They leak just a small amount so that it boils on the engine as it runs down it which is why you wont see any drops on the ground.
1ma1wgs,Getting a gasket off this,"This is a phenolic spacer for my 1989 Corolla, I'm replacing the carburetor as the old one is junk and I don't want to rebuild it as I've heard that's hard for that specific carb.

I should've taken a picture of the lower side but it has its complete gasket on the underside and it's absolutely STUCK on it. I've tried plastic and metal razors (carefully of course), goo gone, brake cleaner, alcohol, nothing seems to be able to dissolve that thing. It's felt I think but very thick. Outside of acetone which I'm scared will dissolve the spacer itself, what can I do here? I'm trying really hard to get it off without gouging the actual material cause I have no idea how ""clean"" it needs to be to the mounting surface",2,1753557782.0,5,MechanicAdvice,1753643892,2025-07-26 19:23:02,2025-07-27 19:18:12,"Savings_Sentence_442 (Score: 3): Had one like that on a Ford truck. Used a belt sander. Was afraid I'd damage it but I managed not too. Maybe you could try boiling water and soap? It's like a homemade hot tank. It softens up other things, but IDK if it would work on gaskets. 

asakadelis (Score: 1): you only need to make the surface flat, it will still seal with a small amount of gasket material in the valleys"
