id,title,selftext,score,created_utc,num_comments,subreddit,scraping_time_utc,created_datetime_utc,scraping_datetime_utc,top_comments
1m9jjfs,2011 BMW 3 series 328i 3.0L 24V Diagnostic Inquiry,"I am looking at this 2011 BMW 3 series 328i on Marketplace and it seems good but I don't know enough about this model to determine how bad these diagnostic codes would be to fix. Is there anyone here familiar with this one that can steer me in the right direction?   
  
  
\+1 diagnostic code:   578E  Gearbox Oil Wear  


Quoting a bit from the market post:

""This is a running and driving 2011 BMW 328i. The transmission is slipping. Car was sitting for a couple months and the battery died; electrical codes are due to loss of main power. They were not there before the car sat.""",3,1753501768.0,4,MechanicAdvice,1753643892,2025-07-26 03:49:28,2025-07-27 19:18:12,"SkyChickensBeak (Score: 1): I think the transmission slipping is more costly than all of these codes

RudbeckiaIS (Score: 1): 6HP19 transmission. Given the symptoms likely the transmission itself is sound but it's leaking badly from the mechatronics sleeve and/or adapter seal. They are usually replaced at the same time. It's not a big deal but be advised the mechatronics need to be removed and after reinstall you will need to reset adaptive values, otherwise the transmission will keep on slipping on gear changes until the adaptive values have corrected themselves (it may take weeks). Plenty of people who threw money at the problem when they should have just invested in a good diagnostic tool/software. Far cheaper than a reman transmission LOL.

2A15 and EVAP leak are either a worn gas cap seal or the the leak detection pump on its way out. 

2ACC I bet has been there for some time: it's the DME main relay, which on E90LCI is integrated in the junction box. The junction box needs to be replaced as a whole (even if you can do advanced repairs such as this the relays are hard to find) and this is usually done when the car starts having issues starting. 

Throttle pedal module needs diagnostics but I wouldn't be too surprised it was waterlogged at some point and now the bill has arrived. 

In short: if this isn't one of the many 3-series around that were clapped out, driven within an inch of their lives, ""tuned for power"", poorly maintained etc. it's not difficult to put back in good running conditions, just make a lowball offer because parts are cheaper than Toyota but not cheap. If it's the typical 3-series we see posted on this sub it's worth only as a spare hulk."
1m9jbck,Replaced alternator and still will not start,I drive an 05 Nissan altima and my alternator gave out recently and now after replacing it and putting everything back as I believe it should be when I go to start it it never turns over. Could this still be an alternator issue or could this be something else? not a car person just trying to save money so please share all you know,32,1753501034.0,91,MechanicAdvice,1753643892,2025-07-26 03:37:14,2025-07-27 19:18:12,"ViolentEyelidMovies (Score: 54): I hate to be the (possible) bearer of bad news, but that ""gallop"" sounds like a broken timing belt/chain. Hopefully, I'll turn out to be incorrect, but in my experience, that sound is nearly always the timing belt (or chain, depending on your car).  
  
It's turning over with enough speed to start the engine, so I can confidently tell you neither the battery or the alternator is causing the no-start.  
  
You need to get a peek behind the timing cover or borrow a code reader from a parts store.

jackthewack13 (Score: 14): Alternator will not make a car not start. The alternator charges the battery while the engine is running. The engine spinning over means that the charging system is most likley not the issue. You need to check if your getting fuel, spark, and air."
1m9iwfs,How bad is it?,,2,1753499709.0,2,MechanicAdvice,1753643892,2025-07-26 03:15:09,2025-07-27 19:18:12,NellyMcfly (Score: 1): Send it on the water
1m9iojf,Help Item Fell Into Center Console,"My 2024 subaru forester my microsd card holder fell into where the center console gear shift is. It is below the plastic, I cant find online how to open this thing to get it out! If I leave it in there is it going to get into my gearbox or something and ruin something? Is the gear shifter now going to get stuck? I Havent bothered to turn on the car or anything just searching online how to get this open and worried hoping its an easy open and it wont break anything! Photo of what mine looks like circled red is where im refering to as where it fell into.",1,1753499014.0,4,MechanicAdvice,1753643892,2025-07-26 03:03:34,2025-07-27 19:18:12,"Chippy569 (Score: 3): First you need to take off the shift knob. The chrome-ish trim at the bottom shoves straight down, and then the shifter is clipped in. Remove the clip (it's called the Jesus clip because when it flies off you'll be saying oh Jesus where did it go) and then lift the shifter straight up.

Shifter out the way now we can remove the top plate. Open the center console lid. I find it easiest to start at the cupholder, grab really tight to the top of the cupholder outer edge and lift straight up. The entire top of the console is one piece, clipped in real tight. There are some electrical connectors at the rear, don't pull too hard once loose without undoing them.

https://preview.redd.it/xdof5fv9k5ff1.png?width=1008&format=png&auto=webp&s=d4aff062beca820bdcaa3b2b1a219aaf0b55e3d9

Once the top plate is free you should be able to find what you lost.

SatansWarrior69 (Score: 1): Long story short is every car is different and its not impossible but highly unlikely. People have dropped coins in their center consoles for decades. Im only guessing on percentages but my opinion is its likely under a 1% chance your shifter being blocked by anything. More of a chance of coins being an issue than a plastic sd card. Sd card would basically just break apart if it got in the way.

Unless the sd card is important to you just forget it unless you notice a problem. If you want to retrieve the sd card you might have to remove the center console."
1m9inun,2020 M340i x drive,"Hey, this is a dumb question. Can I install an air intake without tuning my car? 

I have extended warranty and don’t want to tune my car. ",1,1753498956.0,1,MechanicAdvice,1753643892,2025-07-26 03:02:36,2025-07-27 19:18:12,RudbeckiaIS (Score: 1): What's wrong with the car that requires that thing?
1m9igc2,Help! Elantra GT stalling and long restarts,"My 2017 Hyundai Elantra GT stalls when I slow down or come to a stop, usually after a few minutes of driving it. After it stalls it cranks for a long time before restarting, and it doesn’t show any codes on my OBD scanner. What could be causing this?

I just did an oil change and cleaned the throttle body. I’m wondering if it could be the crankshaft position sensor. I’d love recommendations/tips, it’s getting really annoying and dangerous",1,1753498298.0,3,MechanicAdvice,1753643892,2025-07-26 02:51:38,2025-07-27 19:18:12,"Autoraiders_Reddit (Score: 1): It definitely sounds like a failing crankshaft position sensor. Those symptoms (stalling when slowing down, long cranks, no codes) are classic. It’s a common issue on Hyundais and usually gets worse with heat. Fuel delivery or a small vacuum leak could also be the culprit, but the crank sensor is a good starting point and not too expensive to replace. You’re not alone, lots of owners have dealt with the same thing."
1m9imvy,Am I able to replace the wheel cylinder in drum brakes without removing the bleeder valve?,"I got the front calipers and hoses on my 2007 ford focus replaced and when bleeding the brakes I realized the rear passenger bleeder screw was completely rusted/corroded on. After many attempts with multiple methods and people I ended up with a stripped bleeder screw. My friends stepbrother told me to replace the whole back plate, however, it seems fine and I think it may just be the wheel cylinder that needs to be replaced. Can I take the drum apart and remove the wheel cylinder without taking out the bleeder valve? If not, I need some suggestions on how to get it off. ",5,1753498873.0,9,MechanicAdvice,1753643892,2025-07-26 03:01:13,2025-07-27 19:18:12,"swanspank (Score: 2): Yes you can replace the wheel cylinder without opening the bleeder screw. 

Typically a wheel cylinder is held on by 2 bolts into the backing plate. You also need to remove the brake line as it is attached to the wheel cylinder.  Don’t need to open the old bleed screw. Use a tubing wrench instead of a regular open end wrench so you don’t round the nut of the flare fitting. 

Take pictures because you will more than likely have to disconnect the brake shoes and springs. 

Wheel cylinders are about $10-$15 and there are LEFT and RIGHT sides sometimes. The bleed screw has to be on top or the upper side.

Edit: I doubt you can even purchase a backing plate with a wheel cylinder already attached and it is not necessary to replace the backing plate.

FerrariTech69 (Score: 1): I have no experience with that model vehicle, but generally speaking, you should be able to remove it without taking the bleeder out.

The big question would be if the brake line will come out from the wheel cylinder easily."
1m9igwl,Costco oil any good? It’s super cheap.,,451,1753498346.0,238,MechanicAdvice,1753643892,2025-07-26 02:52:26,2025-07-27 19:18:12,"Autoraiders_Reddit (Score: 553): Yes, Costco’s Kirkland motor oil is actually really good, especially for the price. If it matches your car’s oil specs, it’s a smart and budget-friendly choice.

lewtus72 (Score: 149): Anytime you ask about oil, you're going to get a million opinions based on gut feeling. 
The oil is fine. Has the dexos approval. It's made by a company that makes oil for a lot of other companies. Whether it's better than Red Line,  Royal purple amsoil or whatever and spend so many people that have done tests online, you can look them up pretty easily. 
My car has 225,000 mi on it. I've been running it forever. I pulled off the valve covers and it looks super clean. No wear on the cam lobes ."
1m9i6vy,Oil leak found 2nd gen Crv,"was checking out the bottom of my 06 Crv for suspension parts that needed to be replaced and I noticed a small amount of oil.

Sorry if I sound like an idiot I’m not super familiar with engine part locations. but from my very shallow research this seems to be the rear main seal? I could be wrong but I would like to get this resolved asap so if you guys have any knowledge of where and how I could go about fixing this I’d appreciate it! less",1,1753497481.0,3,MechanicAdvice,1753643892,2025-07-26 02:38:01,2025-07-27 19:18:12,TryImaginingDragons (Score: 1): What does the top look like
1m9i5il,Speed sensor metal spacer?,"Hello!

I have a 2008 Nissan Titan. My partner was replacing the speed sensors and a metal spacer ended up breaking. We can't find the spacer online anywhere so we think we're calling it by the wrong name?

I can't find a single thing on a spacer so I'll attach a picture of his drawing of it and I hope maybe someone will know what it so we can buy a replacement.

Thank you in advance and sorry for a drawing and not a real picture.
",1,1753497360.0,3,MechanicAdvice,1753643892,2025-07-26 02:36:00,2025-07-27 19:18:12,"da_bubs (Score: 1): I don't see a spacer, but the wheel speed sensors appear to have a metal sleeve in them.  The link below has a picture of the sensor and sleeve.  Note that this link is the right side only. There's a similar part for the left side.

https://www.z1offroad.com/rear-differential/nissan/oem-04-15-nissan-titan-rear-wheel-speed-sensor-vss-rh-p-16105.html

Hope this helps!"
1m9i3tq,Unplugged cords?,My check engine light came on in my Nissan verssa 2017 and my obd2 port wasn’t working. so I was looking up in the jungle of cords under my steering wheel and I found these two cords that seem like they should be connected. Should I connect them? Idk much about cars and I’m afraid to just start plugging stuff In without asking someone first. ,2,1753497211.0,6,MechanicAdvice,1753643892,2025-07-26 02:33:31,2025-07-27 19:18:12,"TurboXMR79 (Score: 2): That looks like a GPS or something was piggy backed into your OBD port.

TC-Gladiator2024 (Score: 2): That was for a gps tracker , go ahead and disconnect the plug with the rainbow colors from the grey plug and you conect your obd2 scanner to the grey plug,"
1m9hf9s,Replaced Engine Now Have Very Low Compression,"2003 infiniti G35. I bought a ""JDM"" engine that is supposed to have around 50,000 miles. I don't have an engine stand so I just did a compression test after I got it installed, and the numbers are very low. I just got a second gauge to confirm. The battery is fully charged. 

I have a leakdown tester but haven't used it yet. My previous engine with over 200,000 miles had 150-160 PSI, so this has me really worried. I haven't messed with the timing at all. I'm waiting for a response from the seller.

Could an engine with this low mileage have bad piston rings, and is that the most likely explanation? It was incredibly clean under the valve covers, and looks good on the outside too, but there seems to be a lot of carbon on the pistons. Just looking for opinions or suggestions. Someone totaled my daily driver a couple weeks ago by running a red light, so I was looking forward to making this car reliable, and now I feel defeated. 

1 - 90

2 - 40

3 - 50

4 - 70

5 - 70

6 - 30



",2,1753495135.0,2,MechanicAdvice,1753643892,2025-07-26 01:58:55,2025-07-27 19:18:12,Alpinab9 (Score: 2): A little squirt of oil in each cylinder and test again. Make sure it is cranking at a reasonable speed and make sure the throttle is wide open.
1m9hpw4,2019 Jeep Cherokee Rear Differential,"My rear differential broke recently and it cost me $4,500. I read online that this is a common problem in my car and boy is it a pricey problem to have. The replacement comes with a 2 year warranty but they seem to break pretty fast (mine broke at 85,000 and I read someone else's broke around 65,000). Should I replace it towards the 2 year mark even if it's not broken yet? Should I consider getting a new car? I've had it for a year and I've already had two expensive repairs. Mine is currently paid off and I really don't want to start all over with car payments.",2,1753496033.0,4,MechanicAdvice,1753643892,2025-07-26 02:13:53,2025-07-27 19:18:12,"WG41 (Score: 1): So what broke in the Rear Diff? If it ain't broke dont fix it. Id say run it till it blows again then trade it in or fix it

Potential_Shape_2153 (Score: 0): Jeep is a stellantis product. Stellantis = PeePeePooPoo"
1m9hoc9,Weirddd Hyundai Elantra Noises,Any advise at all would be super helpful! ,3,1753495904.0,2,MechanicAdvice,1753643892,2025-07-26 02:11:44,2025-07-27 19:18:12,"arizonafleshraisin (Score: 1): Its something from trans or farther out, could be wheels, axles, brakes, maybe wheel bearing?"
1m9hm3i,New flywheel from RockAuto,"I bought this flywheel brand new, and it’s covered in some tape reside and looks like there’s a crack in the metal. Is this normal? ",4,1753495718.0,7,MechanicAdvice,1753643892,2025-07-26 02:08:38,2025-07-27 19:18:12,"Mr_Lumbergh (Score: 4): I see a surface scratch but not a deep crack. Looks fine to me but I'm happy to be corrected.

nsf14 (Score: 3): Anti rust coating, clean it off with brake clean or solvent.  Looks like a small dent, maybe something hit it or was dropped on it.  Wont affect anything, well out of the main contact surface.  Send it"
1m9hk6t,Chat is this legit?,"2012 mazda 3, 253,000km garage wants 6,200 is this legit or crazy overcharge?",1,1753495554.0,10,MechanicAdvice,1753643892,2025-07-26 02:05:54,2025-07-27 19:18:12,"RedditFU43V3R (Score: 4): This is “We don’t want to work on your vehicle” price. I used to know of a mechanic when he gave out ridiculous prices because he didn’t want to work on the vehicle.

chiefincome (Score: 3): Why are they charging you “caliper no core charge” for just doing brakes. Fuuuuuuuuuuuuuuuuu no this isnt legit. Unless your car is sliding when braking, or your calipers are completely siezed, thats a 100% inflated charge."
1m9hfpd,brake caliper piston,"so, my brake caliper piston is clean, lubricated with DOT 3, and with a replaced o ring. why will my piston not push in as I apply even force to the top of it? the piston gets stuck and will not budge after it inserts a couple of centimeters into the bore. I've injured my hands trying to do this shit...",1,1753495174.0,4,MechanicAdvice,1753643892,2025-07-26 01:59:34,2025-07-27 19:18:12,"ProfessionalDirect50 (Score: 2): You could try taking the o ring back out turning it around reinstalling and see if that helps.

whenthemogus (Score: 1): i need to buy a c clamp and try this tomorrow. though, the piston should be able to slide in a bit with only hand strength. also, the caliper is disconnected from the car. it's a 2003 Buick LeSabre"
1m9hd37,Gabriel struts any good?,"2010 civic LX, tried searching the sub but didn't see any posts about this brand. Should I try it or is it worth spending another $60 for KYB? ",2,1753494942.0,4,MechanicAdvice,1753643892,2025-07-26 01:55:42,2025-07-27 19:18:12,"Hrothgar_Nilsson (Score: 1): It's worth the extra for KYB.

RickMN (Score: 1): KYB"
1m9hcbp,Oil change / fuel after extended vacation,"I had done a synthetic oil change on my vehicle but then went away for long time and vehicle sat (with fresh full fuel too!)

Total kms on the fresh oil was 4,000 kms before being stored. 

Vehicle sat for 6 months. 

Total time from last oil change until now is 11 months. 

Question is: is time the most critical factor here or only the 4,000kms on the oil? Do I need to do another oil change? I’m fine to do it, just want to know if I’m wasting my time/effort or not. 

Cheers 

EDIT - I live in Toronto Canada and the vehicle was stored inside a garage from Feb - July ",1,1753494876.0,5,MechanicAdvice,1753643892,2025-07-26 01:54:36,2025-07-27 19:18:12,"Big-Tubbz (Score: 1): If you live in a cold climate I’d say change it

If it’s been warm where you live you can probably let it slide another 1-2k but always better just to change it and start fresh

wormwormo (Score: 1): Change oil according to miles or once a year."
1m9h9xj,can anyone tell me whats wrong with my car/ wheel??,"My car has been sitting for a month or two, and during that time we removed the front wheels a couple of times to replace the fenders. They’re back on now, and this is my first time driving it, but it’s making this vibrating noise (sound gets louder at end of video). I thought it might be flat spots, so I aired them up properly, but the sound is still there. I even removed and reinstalled the wheels carefully to see if that would help, but it made no difference. I’m not sure what else to do.

This is an audi A4 2009 2.0T",0,1753494669.0,5,MechanicAdvice,1753643892,2025-07-26 01:51:09,2025-07-27 19:18:12,"Low_Recognition5789 (Score: 1): I'd I could throw my 2 cents in, maybe a bad wheelbearing/ hub assembly.

chiefincome (Score: 1): Im going to assume that noise wasn’t present before you let the car sit, *right?!?* If not then, it is your tires. Flat spots, bubbles dont just go away when you air up the tires. Sound like you might potentially have a serious bubble on one of your tires. Video doesn’t really help. A visual of the tires would help a lot more."
1m9h543,What are the odds that an overheated engine (dead) also ruined a transmission beyond repair?,"For anyone who saw my previous post, my engine is a cast iron ingot now because my car apparently didnt like the idea of popping any lights on indicating it was overheating mid road trip.

Anyways, I’m considering getting the engine replaced. But what are the odds that the transmission was drastically affected by the overheated engine? How does that work ?

The transmission was working great on the roadtrip. I didn’t notice any sort of rough shifting or random movements regarding the trans. It’s brand new trans oil as well if that means anything.

Just trying to see if I should replace the transmission 100% before I replace the engine only to find out it needs the trans replaced too.",1,1753494256.0,17,MechanicAdvice,1753643892,2025-07-26 01:44:16,2025-07-27 19:18:12,"Dazzling-Past6270 (Score: 3): Two completely different systems bolted together so it should be fine. Check the condition of the trans fluid. If it’s not burnt then it likely didn’t get too hot and should be fine.

Thinkfastr11 (Score: 2): The transmission is a separate component. By you overheating the engine should not have effected the transmission at all."
1m9h243,2800 to Replace Whole AC System in a 2009 Honda CR-V,"Sorry, this is kind of a long story. I'd been having a problem with my AC blowing hot air after extended idling for about a month, but I honestly thought I was just low on refrigerant. When I went and bought a replacement kit and tried to refill the lines, I found out that my compressor clutch wasn't spinning. I took it to a shop, hoping that it was maybe just the thermal switch or something electrical causing the issue, but the shop called me back and told me they needed to replace the whole system because the clutch was shot. Now, from what I know about car AC systems, you can replace just the clutch, or at the very least just the compressor and fix and issue like that. Is there any reason why they would tell me they need to replace the whole system? And if not, I plan on trying to replace the compressor myself.",2,1753494001.0,11,MechanicAdvice,1753643892,2025-07-26 01:40:01,2025-07-27 19:18:12,"RainbowDarter (Score: 3): Was this just a clutch failure or was it a compressor black death failure?

If it's just the clutch and the rest of the compressor is fine, you can replace just the clutch.  There are kits readily available and you shouldn't even have to evacuate the system 

If the compressor died and spread contamination throughout the system (black death) you need to replace everything.

i_am_jordan_b (Score: 2): Get a second opinion."
1m9gkz7,1975 Chevy C10 Won't Start,"I was changing the water outlet that sits on top of the engine. When I was tightening one of the bolts, my ratchet touched the wiring harness from the alternator. It ended up sparking because it had an exposed wire, and nothing has been able to turn on ever since. So far, I have replaced the alternator, the wiring harness, and the wiring junction block. I've checked all the fuses, and they were all good. I would appreciate any suggestions",1,1753492576.0,2,MechanicAdvice,1753643892,2025-07-26 01:16:16,2025-07-27 19:18:12,"Greenlight0321 (Score: 1): Does that year/model have a ""fusible link"" wire on the positive battery cable, at the location of the battery terminal?"
1m9gxyu,Scratched on New Rotors – Okay to Use?,"Received two new front rotors with coatings from RockAuto. They arrived in very beat up boxes, but they seem okay except for two small scratches in the coatings (see pictures). 

I'm new to brake work, and I just want to make sure these would be safe to use? ",0,1753493652.0,14,MechanicAdvice,1753643892,2025-07-26 01:34:12,2025-07-27 19:18:12,"Vic_Pirelli (Score: 6): They look fine.  Good luck with your project.

classicvincent (Score: 4): They will be worn off by the time you finish Powerstop’s “bedding in” procedure.

agravain (Score: 2): the chunks of metal in the semi metalic pads will do more scratches than that."
1m9gzjk,2013 kia soul main leak? And crank shaft position sensor oil leak?,Just changed my wife's 2013 kia soul engine oil at 160k miles. I thought it was burning oil so we check it every few weeks and top it up. But I found this and now think it's just leaking. Any experience with these or advice? She's talking about wanting a new car in a year or two anyways. Should I just keep topping it up rather than fix it? Thanks in advanced!,1,1753493785.0,2,MechanicAdvice,1753643892,2025-07-26 01:36:25,2025-07-27 19:18:12,W123lukeof (Score: 1): Oh it's the 1.6l as well if that makes a difference.
1m9gzdr,Dodge ticking sound,"2015 Dodge Journey, 98,000 miles. No CEL

My car has always had a ticking engine noise at idle since I bought it about 5 years ago. A few friends have mentioned it over the years and said it was a bad lifter. 

I took my car in to a mechanic today for a squeaky sound when I go over speed bumps and they mentioned the ticking noise. They want to replace upper intake and valve cover gaskets for about $700. Then they said they will inspect the cams and see if they are bad. And if they are bad it might cost an additional $3k to replace them.

What is weird is that about 6 months ago I had taken my car to a different mechanic because it was leaking oil and they said it was my valve cover gasket. I then took it to this new mechanic (same one from today) for a second opinion and they said the first mechanic was wrong-it was my oil cooler (which I paid them to replace and no more leaks on the driveway).

Does this sound right? She made it sound very catastrophic for my car.

https://imgur.com/a/YJBdeKC

Thank you!",1,1753493772.0,3,MechanicAdvice,1753643892,2025-07-26 01:36:12,2025-07-27 19:18:12,"Potential_Shape_2153 (Score: 2): Definitely a roller failure, I’ve done over 100 of them. Every single one got at least one of the four camshafts.

RichardSober (Score: 2): >And if they are bad it might cost an additional $3k to replace them.

That's too much. If they drop valve covers for another repair, the cam/rocker arm replacement won't take more than a few hours on top of that. Parts are cheap, your engine doesn't have VVL cams."
