id,title,selftext,score,created_utc,num_comments,subreddit,scraping_time_utc,created_datetime_utc,scraping_datetime_utc,top_comments
1n41b7w,Ford focus 1.6 automatic," just brought a car to get me around temporarily and  I’ve had a few issues. The man I brought it off has said there as a new engine fitted recently & has given me the paperwork to back this up. The coolant was fine and I drove for 20 mins yesterday and it emptied. He has told me that i need to put more in as it’s a new engine so it will take a lot to fill but it was holding fine before hand and i had driven the car longer the day before. I know it’s an old car but it’s just temporary and im not sure why he wouldn’t of mentioned this or done this himself before selling it Or why the mechanic didn’t do it?

He had said he will take it back to the garage and pay for anything needed to be fixed if it empties again but it’s not the point. I knew a few minor things needed doing but it was general service of the vehicle. Which are booked in for the coming week. Was Still okay to drive for now.

I’m just so scared to drive it with my baby so I was wondering has anyone had a new engine fitted and needed to put a lot of coolant? Or is he just lying to me. The engine was fitted due to a head gasket issue so luckily if it’s anything like that it will be covered under warranty. did have a little bit of smoke yesterday when driving which is what made me check the coolant but not thick white smoke it was more like condensation kind of after idling at a round about and hard acceleration. I could only see it when infront of another car with lights on. I pulled over got out and it had stopped after about a minute if that. Oil is fine and not milky or chocolate milky it looks like good oil, had a head gasket issue before and it’s nothing like that. Smoke or oil can’t see a leak. I had a similar issue with a previous car and it was a radiator hose but I realised too late and it blew. I am a woman and can not tell what I am looking at  so I’m not sure. Sorry for the ramble just looking for some advice as to wether I should go to the garage myself or let this man deal with it. I don’t have funds to buy another car so I really need to try and get this sorted or get my money back - the only thing giving me hope is the man being so willing to help and fix the issue.",2,1756559563.0,8,AskMechanics,1756668666,2025-08-30 13:12:43,2025-08-31 19:31:06,"CaptainPGums (Score: 3): If the system hasn't been refilled and bled properly, you can have a marked drop in coolant level caused by an airlock in the system.

When I had my cambelt and waterpump done, I needed an additional 2l of coolant adding, as I had a really bad airlock.

This was at a main dealer as well, so they should have known better, but this is the same place that put a cracked, work-out serpentine belt back on, even when it was (a) obviously crap (b) due for replacement and (c) I'd told them explicitly that I wanted it replaced.

Places to watch out for coolant leaks on this car are the heater matrix - you'll possibly see the left hand of the car (looking at the front from outside) front floor carpets getting wet. The other one is there's (depending on the engine) a plastic housing (probably thermostat) which get brittle with age and start seeping (but if you've lost it all in that sort of distance, that's ""pouring"" not ""seeping"").

I'd be tempted to get some compatible coolant, fill the header tank on the left of the engine **when the engine is cold**. Fill it to the max line, then go for a drive with the heater on full, and let the engine come up to temperature. I think you've effectively bled it already, but this will just confirm it.

Then keep an eye on the level while you take it back to the mechanic to be checked.

Hope this helps."
1n40l7n,"Any advice both ABS and traction control light are on? 2012 Volkswagen eos , price estimate ?","I’ve googled and researched what it could be the issue and what could solve it but , would want advice from mechanics , I feel mechanics take advantage of customers lack of knowledge . Also how far as months go can I drive until I have enough to take it to a shop or find a mobile mechanics .",2,1756557505.0,7,AskMechanics,1756668666,2025-08-30 12:38:25,2025-08-31 19:31:06,"Ravenblack67 (Score: 2): Wheel speed sensor. I own a 2008 EOS. do not go to a dealer.  Find a German car shop.

ChikkiParm (Score: 1): wheel speed sensor?  
low brake fluid level - probably  just need new brakes  
  
could be that easy"
1n40as6,Crossposting for more answers,,1,1756556641.0,3,AskMechanics,1756668666,2025-08-30 12:24:01,2025-08-31 19:31:06,"Total_Philosopher_89 (Score: 2): 4.55 is the diff ratio for an LN167R.

SolarCyber19 (Score: 1): The axle code is a ""A07B"", which states that it's a 3.90:1 ratio according to google. I'm so confused though since google also says that the most common ratios for a LN167R is 4.55:1 or 4.30:1"
1n3zuba,What the odds are thrown rod would have damaged the transaxle with it?,"04 tt 225(bea) quattro 6 spd(02m)with a blown motor. Claim was previous owner was just driving along ""like normal"" and it died. I feel that the odds of the trans being fine is better than half but I'm curious if anyone ever had a engine failure like this also contribute to the failure of the trans. Looks like I clean failure through side of the block and pan. I have the parts to replace the whole drivetrain(and the some) but limited space for non running vehicle has disappeared and I really should get this on the road ASAP. Also I'm aware that audi/vw had constant parts updates and slight design changes so I'm aware some of my available spare parts are not fully compatible since my parts are coming from several 02s and this is an 04.",14,1756555244.0,9,AskMechanics,1756668666,2025-08-30 12:00:44,2025-08-31 19:31:06,"tikkikinky (Score: 5): Retired mechanic here. I’ve swapped a few engines that have come in with holes in the block from a thrown rod. None of them needed a transmission. Dropped in replacement engine, topped off fluids and drove them out.

Human_Grass_9803 (Score: 1): Sorry about the crappy writing. The question I'm trying to ask is ven though I'm gonna be able to do the swap it would add time and extra work I don't want to add to this car since I would potentially involve changing the transaxle/angle gear and rear diff on a possible hunch that when the rod went, it somehow damaged the transmission. Ive personally never seen an engine take out a trans with it but it might be worth it to see what others have to say about it."
1n3zsh1,Is that undercarriage good?,"First of sorry for the bad pic but its the only one i have. Its my grandmas car, a 1992 opel vectra A. I took this photo during an oil change. Is there any red flags? Something that looks off? Also about rust/rot. In my untrained eye I don’t immediately see something bad. 
Should i have my mind at ease?",1,1756555098.0,4,AskMechanics,1756668666,2025-08-30 11:58:18,2025-08-31 19:31:06,"ShamrockUSA (Score: 2): Looks fine to me, for preventative maintenance. Repaint the fuel tank straps from them scraping over a bump or something. Just get some decent black enamel paint or any generic automotive underbody paint. Mask off the straps and do a few light coats.

Every-Caramel1552 (Score: 2): Yes"
1n3yx5e,HELP: Car won’t start when jumped,"Hi everyone, I saw some other people ask this question but I felt like mine needed some more context to diagnose the problem. I left my car parked over the summer at my school and it went about 3 months and a half without being started once. When I came back the battery was dead so I jumped it successfully, I drove around for about 30 minutes and then parked it again. However about a day later I went to start it and the dashboard lights tarted flashing then they went off and the battery died. I tried to jump it again(left the cables connected for like 5 minutes) and once the lights flickered a bit but the rest of the attempts were unsuccessful. I already bought a new battery and I’m planning on replacing it but I’m not sure if this could be a bigger issue. Any help appreciated, thank you! 

Edit: Honda HRV 2023",1,1756552187.0,7,AskMechanics,1756668666,2025-08-30 11:09:47,2025-08-31 19:31:06,"R2-Scotia (Score: 1): If it wouldn't jump the most likely cause is a poor connection, starters draw 500A or more. It's possible the starter is dead.

Was the car charging during the 30 min? No battery light, 14V+ at the terminals. If so battery is likely dead, most parts places can test.

ValuableShoulder5059 (Score: 1): Definitely possible the battery is shot or at least needs a long desulfanation charge/cycle. Heavy duty jumper cables can start a vehicle without a battery. Light duty ones are just charging cables. If the battery won't charge quickly due to damage, you might just need a good charging to fix it, or a new battery. Possibly you have a power draw somewhere too which will drain the next battery."
1n3xmuw,Car idling rough with maf sensor in and fine without it,"So recently i changed the spark plugs and thought that was the culprit to a rough idle but after further investigation whenever i plugged the maf sensor in the car would immediately begin to idle rough but as soon as i unplugged everything smoothed out. Cleaned the sensor mulitple times with maf cleaner and let it dry overnight but it still continued to idle rough when plugged. After a chat with chatgpt they pointed me towards a faulty pcv as when i opened the oil cap (while car running) it would have little suction and rough idling (this is without the maf sensor in) 

I drive a 2006 mk5 gti and its fairly stock.

If anyone could help me with this on whether its the maf sensor or likely the pcv so i know which one to buy that would be great thanks! ",1,1756547358.0,9,AskMechanics,1756668666,2025-08-30 09:49:18,2025-08-31 19:31:06,"I_-AM-ARNAV (Score: 3): Man, how much is a new sensor on it? Do you  have a obd2?

Tommynwn (Score: 1): Something similar happened to the maf sensor of my mom merc, just removed the filter cover, changed oil, put it back and idles bad  
End replacing the maf sensor, 170€ and going fine since, looks like maf can broke just unplugging it"
1n3xabd,My Honda Accord 2013 is going crazy,"I have been facing this issue lately, sometimes when I try to turn the steering wheel the radio goes off and the steering lags for a second then goes back to normal. Sometimes the light of power steering shows. 

I have checked battery health and it shows as good.",1,1756545950.0,4,AskMechanics,1756668666,2025-08-30 09:25:50,2025-08-31 19:31:06,Astro_Hobby (Score: 5): My guess would be on the clock spring of the steering. It either has a loose connector or bad internals which is shorting and causing the radio to go off and on.
1n3wyl0,Another 3.6L Tick,,1,1756544641.0,4,AskMechanics,1756668666,2025-08-30 09:04:01,2025-08-31 19:31:06,"RichardSober (Score: 2): The correct way to diagnose failed rocker arms is to drop valve covers and inspect lobes and rocker arms. Also, you got bad DIY repair advice in your previous post.

callsignmario (Score: 1): Just crossposting from another sub I posted...    

Looking for community feedback on the issue or two garages take on the problem.    

Garage 1 - listens to the noise, says it rocker arms. Provides parts list to include rocker arms, valve lifters, amd laundry list of related gaskets to replace at the same time. Estimate- $2500-3000.    

Garage 2 - listens, then performs some diagnostic checks, mentions low oil pressure. Recommends getting an oil additive, giving it a week to run, and then see if noise continues. Didn't mention a suspected issue to my spouse, but estimated sub $100 in parts if it continued. Did not mention rocker arms. 

I don't want to jump immediately o to $2500+ repair, appreciate garage 2 at least running some tests, but don't want to potentially mask a bigger issue. Appreciate any thoughts on the issue or garage estimates."
1n3w9pk,Curious: how do you usually handle estimate approvals with customers?,"I’ve been wondering about something and thought this might be a good place to ask.

The garages I take my car/bike to always calls me whenever they have an estimate for repair costs.

Problem is, with my work schedule I often miss those calls, and then it drags things out until we connect.

Got me thinking: is this the standard way garages handle approvals?

For the mechanics or shop owners here:
Do you normally call the customer to explain and get approval?

Do you sometimes email or text the estimate instead?

Anything you wish was easier about this process (for you or for customers)?

Not trying to sell anything, just curious how this usually works, and if it’s me being unlucky… or if I should be looking for a new garage 😜",1,1756541848.0,7,AskMechanics,1756668666,2025-08-30 08:17:28,2025-08-31 19:31:06,"Kmntna (Score: 4): We can't legally do any repair work without approval.  You typically ok an hour diagnostic when you drop it off. Anything further, including repair, needs authorization from the customer

FallNice3836 (Score: 2): If the customer can’t respond at all we just make a list and shoot for next visit.

To me return business is important, don’t pressure the customers do to everything at once, break down the items and if it is not critical,  do it next service."
1n3vvf0,Wobbling noise,"2013 focus st, drives straight and dont feel much vibration or anything,  but as I reach about 30mph and thereafter, I heard this strange wobbling noise, almost sounds like wah wah wah as the wheels go around. Can't tell where it's coming from. Wheel bearing is my first guess? Haven't jacked it up and spun the hub to assess that possibility yet tho ",1,1756540298.0,2,AskMechanics,1756668666,2025-08-30 07:51:38,2025-08-31 19:31:06,"EstrangedStrayed (Score: 1): A growling noise that gets louder with speed usually points to a wheel bearing, but its best to lift the car up and confirm"
1n3uff9,Best way to ethically sell car,"Basically, I was gifted an old used car in recent months which has progressively been getting less driveable. Brought it in to fix an engine oil leak and discovered everything is wrong with it; sub frame is fully rusted, the engine oil leak is so bad that everything is soaked in oil, needs a new catalytic converter; the works. I need a vehicle to get around for work and school, and I’m trying to figure out the best way to sell it for a good amount while making sure the buyer is aware of the issues with it. I’ve seen similar listings on Marketplace — I guess I’m just wondering how much of the issues I should detail in a listing versus offering them up when questioned about the vehicle. I do not want to scam anyone into thinking they’re getting a mint-condition vehicle, but I do not want to undersell it as I need money to replace it. What are some key words and phrases I could use in the listing to convey that it needs some hefty repairs but is still worth someone’s time and money? Also, given the state of the car, what would be an average price I should aim for to sell it? ",1,1756534799.0,5,AskMechanics,1756668666,2025-08-30 06:19:59,2025-08-31 19:31:06,"SailboatSamuel (Score: 2): The most important thing is to make sure that your description and contract say “VEHICLE SOLD AS-IS”

Do not forget that. 

In the description of the vehicle, state that the vehicle is not road worthy and must be towed. Buyer is responsible for the costs of the tow and is buying the vehicle AS-IS.

Don’t lie about anything, but also don’t be overly specific. If you become overly specific, this may prompt the buyer to try to contact you after the sale with a message saying “You didn’t mention that the car needed X”.

Just say things like: Mechanic special. Car not running. Must be towed. As is. Needs repair. Rust.

Basically, just be upfront about the unappealing things so that it can weed out buyers who will give you a hard time.

Honestly, if you can even sell it, you won’t make much, but selling a junk car for cheaper is better than selling it for slightly more to a buyer who is going to reach out to you a month later trying to get their money back.

It’s a tough position, but you may need to look into public transportation or a moped for the time being. Selling this car isn’t going to get you enough to replace it with a working vehicle. Honestly, I’d just throw it up and say “Best offer. Open to trade for a moped”

Mental_Theory225 (Score: 2): It sounds as though the car is on it's way out.  You're not going to get much more than scrap value for it.  I'd check and see what the scrapyard will give you for it.  Then add a couple hundred and put it on marketplace and see if you get any bites."
1n3tpor,Oil light after oil change,Hi! Yesterday I got a oil change. The car was running fine after oil change today. I was driving on the highway. The oil light came on and then I heard knocking and it didn’t accelerate. I shut the car off immediately and got it towed home. My oil light and everything else was fine beforehand. I’m just trying to see what could be the issue. I plan on taking it back to the shop Tuesday as it’s Labor Day weekend. Any ideas? Could this be due to the oil change and how fixable is this? ,1,1756532235.0,8,AskMechanics,1756668666,2025-08-30 05:37:15,2025-08-31 19:31:06,"djltoronto (Score: 4): You seem to have very calmly described catastrophic engine failure...

Hopefully that is not the case, but usually if you are driving and the oil pressure light turns on, and the engine begins to knock, that is usually indicative of complete engine failure, due to sudden loss of oil pressure.

CuddleFishHero (Score: 3): Look under the car and see if there is oil everywhere, also pop the hood and check for the dipstick and fil port cap. Report back your findings. 

Gonna go off on a hunch and say you ran out of oil due to lack of it being added, improper filter installation, drain plug not being put back properly, or fill cap not being put back.

Also to note that if you don’t get regular oil changes and have a lot of crap built up in the engine something could have been knocked loose and blocked a galley or the oil pickup.  
Thats extremely rare though and usually happens when people add shit to the oil like marvels or sea foam.  

How many miles and what type of car is it"
1n3tkid,Car dies when disconnecting battery. Headlights dimmed.,"I know the alternator is bad. A new alternator,  tensioner arm, extra pulleys, and a serpentine belt is on the way. I just got a low battery and my headlights dimed a couple of times but no noticeable loss of power. Do I try driving it or just wait for parts. Its only 5-10 minutes to work. 2003 town and country 3.3 by the way if there's anything else I should I should know ahead of time but its had a new cat, all new gaskets from head to intake exhaust included. Control arms/ ball joints, strut assemblies, sway bar links, axles, bearings, rotars, and a radiator with hoses all in last 10k miles except the axles and radiator. Ive been waiting for the alternator cause other than it and calipers. Everything new and the calipers are whenever I have money to get rid of the drums and go ceramic disk with drilled and slotted rotars. Also stainless brake lines so they're good and I have learned alot I just needed to vent and get some feedback.",0,1756531742.0,14,AskMechanics,1756668666,2025-08-30 05:29:02,2025-08-31 19:31:06,"SailboatSamuel (Score: 13): Don’t disconnect the battery to test the alternator. That’s bad advice that still circulates today. There are too many computers in modern vehicles, even in 2003 vehicles. This can fry electronics and cause issues.

Left4DayZGone (Score: 2): Modern cars cannot run, or at least run well without the battery and alternator working in tandem. 

The advice to disco the battery to test the alternator is from the era of cars where the battery existed just so you didn’t have to hand crank them to start up. 

All of the electronic on modern cars are too much for the alternator to handle alone, the battery acts as a buffer/reservoir for the electronics to draw from while the alternator maintains charge and powers a few other things."
1n3tbqw,CV axle replacement? Boot leaking grease,"I recently took my 2016 Toyota Highlander in for a front end alignment and when I went to pick it up, they suggested a replacement of the front right axle because the outer CV boot is leaking grease. I decided to not replace the axle at that time ($800+) because I wanted to look at it first. I did see a small amount of grease spattered above the boot, but when I cleaned it up I could not find any holes, tears, or compromised rubber. The video attached shows some grease after roughly 100 miles after cleaning the boot. Is this a major concern? And where could it be leaking?",3,1756530898.0,4,AskMechanics,1756668666,2025-08-30 05:14:58,2025-08-31 19:31:06,"Tool_Using_Animal (Score: 3): Dude. The axle is still good. Just replace the boot before your CV joint gets damaged. The OEM axle is the best one you'll ever have.

texxasmike94588 (Score: 1): The CV joint boot leaking grease is a bit concerning. However, I had driven with my CV boots ripped open for hundreds of miles before I noticed the problem. The noise it made while turning is what prompted me to look at it finally. 

I bought remanufactured CV axles and replaced the left and right sides. The left side still had grease inside the boot, but only a small amount, and the right side had only shreds of a boot. 

That was a long weekend because it was my first time working under the vehicle, and I had it jacked up, realizing I needed tools. This was before YouTube."
1n3sw41,What is the rear catalyst? Please help,,2,1756529403.0,2,AskMechanics,1756668666,2025-08-30 04:50:03,2025-08-31 19:31:06,PlatypusLow4219 (Score: 1): I bought from my little brothers friend who we trusted so we let our guard down and didn’t find out about this until we tried to get a smog check down and they couldn’t do it. Usually we would have done our due diligence but we thought he wouldn’t screw us over. 🤷‍♂️
1n3rxrq,Extremely quiet hissing noise when accelerating?,"Heyoo 
So we just got my car back from the mechanic for some steering/suspension work.
It's a 1999 VW Passat glx 2.8L v6. 

We put in a new used engine in it, changed all the hoses, lines, etc. Fixed some coolant lines and a few oil leaks over the year, always had an evap leak code though. 

But this sound is new. It's like a quiet hissing like air is escaping only when I step on the gas pedal. Somewhat dimmed engine performance. 

I'm guessing my first step is a smoke test? What could it be if we don't find any obvious leaks or that doesn't fix it. ",2,1756526208.0,3,AskMechanics,1756668666,2025-08-30 03:56:48,2025-08-31 19:31:06,Ravenblack67 (Score: 1): It sounds like a vacuum leak.  Knowing the code would help.  A smoke test is a good test to conduct.
1n3rxp2,What is this part 98 Toyota Tacoma,My check engine light came on when I was driving home and I was hearing a little chirping noise I found this broken hose. I think it’s a vacuum hose and the part that it attaches to seems to have broken off of its mounting bracket do I most likely just need to replace the broken hose or the part it’s connected to as well.,1,1756526201.0,3,AskMechanics,1756668666,2025-08-30 03:56:41,2025-08-31 19:31:06,"Jbolsa (Score: 6): Its a  evap purge valve. I zip tied mine in place, it makes a clicking sound,

Agitated_Key_1331 (Score: 2): If I had to guess, an evap purge valve"
1n3rrkk,Steering wheel completely locked 2012 Subaru Outback,"Key goes in but won’t turn.
Wheel is locked to the left.
Tried wiggling, rocking, lube. Nothing.
Key is fine (locksmith checked).
Any idea or tips?",1,1756525641.0,9,AskMechanics,1756668666,2025-08-30 03:47:21,2025-08-31 19:31:06,"Shot_Investigator735 (Score: 2): Wheel is hard against the lock. You'll need to turn the wheel hard *off* the lock, not just wiggle it.

One_Competition136 (Score: 1): Since the key is fine try taking it out and putting it back in while moving the wheel. I’ve had this happen twice in a Toyota Tacoma and that solved it. Slowly insert the key and twist but don’t turn it on, and try moving the wheel"
