id,title,selftext,score,created_utc,num_comments,subreddit,scraping_time_utc,created_datetime_utc,scraping_datetime_utc,top_comments
1n4awl3,Service Manual Question,"Have this guy for a while now and I wanted to do my own maintenance and repair to it.

Tried finding some manuals online but those manuals doesn't fit my Ranger's spec. It is a 2L WL-T diesel engine from the Mazda B-series and the ones listed is in the manual were 3.0L and 4.0L V6 engine. The closest is the 2.3L l4 engine.

Should I use the 2.3L l4 engine as my reference?",2,1756583623.0,6,StupidCarQuestions,1756668666,2025-08-30 19:53:43,2025-08-31 19:31:06,"atemypasta (Score: 1): What year?

atemypasta (Score: 1): Also check https://www.alldata.com/en

Agharinagh (Score: 1): Have one as a daily, another in the garden for parts. Has 400k km. Going strong 👍😬 Ask anything 😊"
1n47cs2,grinding/whirring,,0,1756574792.0,2,StupidCarQuestions,1756668666,2025-08-30 17:26:32,2025-08-31 19:31:06,"Nestle_Cream (Score: 1): Easy and cost effective first step is to get your brake disks skimmed and see if that solves the issue

Also get your brake pads checked to see if they’re still good"
1n41eqx,When to change car battery,"I have a 3 year old toyota urban cruiser. During servicing, the technician is recommending changing the car battery even though there is no trouble right now. The manual recommends 3-4 years of battery life. 

Should I get it changed now? Or ok to wait another year?",0,1756559839.0,75,StupidCarQuestions,1756668666,2025-08-30 13:17:19,2025-08-31 19:31:06,"grootgooch (Score: 15): I mean if it isn't causing you any issues, why change it?

thohean (Score: 3): Go to a auto parts store and have them test the battery. 

Every battery has a power rating and if the battery doesn't meet that rating, then it is on its way out, even if it's working fine. Eventually, you'll go to start the car and it'll not start. Also a weak battery puts more stress on the alternator, which can cause that part to fail, too.(Less common)

shrout1 (Score: 3): Keep a jump pack in your car just in case and then cruise til winter. Cold weather will reduce the capacity of the battery and that’s when it will actually die."
1n3zpx2,Should I do a transmission fluid change? 152k miles Audi unknown service history?,"Hello Reddit, I own a 2017 Audi A3 E-Tron 1.4tfsi with the DQ400 DCT. I purchased this car earlier this year with 140k miles and it runs like a champ in pristine condition. So I want to keep it running good I don’t know the full service history of the vehicle besides it was frequently serviced at Audi but I don’t know what was done or when. The general consensus on transmission fluid change is around 50-60k miles the thing is I don’t know when if at all it was done. Do I risk it? Is there things I should look out for when doing it? ",4,1756554875.0,40,StupidCarQuestions,1756668666,2025-08-30 11:54:35,2025-08-31 19:31:06,"RandyDeeds69 (Score: 6): Nah, just drive it until it won't go anymore

danukefl2 (Score: 2): It's either change it or it kills it (one day). 

Not an Audi but I changed the fluid in a 299k mile F150 I bought years ago with no service history other than faded contractor sign spots on the doors and never had an issue with it yet 7 years later. I'm not a fan of the power flushing but change the fluid and filters and call it a day.

blizzard7788 (Score: 2): It’s never bad to change ATF. Don’t believe old myths."
1n3ubrf,Would it be a bad idea to buy a car with a rebuilt title?,"Hey y’all. So I’ve recently stumbled upon a 2013 brz, 175k miles, and it’s fairly cheap, probably because it received the salvaged title then rebuilt. I received the carfax report on it and there was damage on the front and rear bumper, claiming there was minor damage but the car had to be towed and that’s where it was claimed a total loss. Looking deeply into the report, the last two owners literally only drove about 400 miles within the span of a year. I thought that was a little strange. I know the 2013 brz has issues like the engine starvation with the oil and probably some other stuff so I’m thinking it might be a engine issue, though the seller said the engine ran smoothly along with everything else. So I might have to replace that. Should I just get the vehicle inspected. I’m a little worried about issues that might be hidden. I know some salvage titles don’t have any real serious damage but I have yet to know what kind of accident this brz has been through. Any thoughts?",5,1756534423.0,24,StupidCarQuestions,1756668666,2025-08-30 06:13:43,2025-08-31 19:31:06,"Kresdja (Score: 16): If it's had 2 owners that got rid of it within 400 miles, it most likely has a lot of expensive issues.  The previous owners got rid of it for a reason.  Rebuilt titled vehicles are hit and miss.  Some will last a long time, others are money pits.

ForbesCars (Score: 6): 175k on an engine known for having issues is enough of a red flag for me, even ignoring the rebuild I would never recommend anyone buy that, but then with all the other issues you mentioned, yeah run away from that.

voltagx_ (Score: 4): Just about every single fact you listed about the car is a red flag. Steer clear"
1n3s2jd,Bulge in tire from hitting curb. Should I be concerned?,"Hi all,

Recently noticed this bulge. All of my tires pretty much keep the same pace of PSI, but this one seems to be 1 or 2 off. I am currently on a road trip, and a mechanic told me not to worry at all. I’m definitely worried about it popping. Any advice?",2,1756526629.0,33,StupidCarQuestions,1756668666,2025-08-30 04:03:49,2025-08-31 19:31:06,"Eskimo56 (Score: 4): These tires are assembled this way. Every tire has a low spot somewhere on the sidewall. Perfectly normal.

Edmsubguy (Score: 3): That is normal. It is where the rubber is joined. Hitting a curb would make a bulge. This tire is perfectly fine. If it is losing pressure have a garage reseat the tire. Cheap and a 10 minute job.

DatabaseCapable4193 (Score: 2): Not a bulge. Normal tire construction.  Seen it many times. It's an inny. Only outties  are bad."
1n3rl8j,Which Blow off valve,Which and what types of blow off valve will sound good on my 2012 ford kuga 2.5l turbo engine. ,1,1756525054.0,2,StupidCarQuestions,1756668666,2025-08-30 03:37:34,2025-08-31 19:31:06,"potatochip_pooper (Score: 1): The kuga doesn't have a 2.5 turbo. You either have a 1.5 turbo, or a 2.5 non turbo. "
1n3q0rz,Can I change tire on an incline.,"My tire’s been slashed and is parked on the street outside my house (which is on an incline). I’ve heard that it’s not good to change a tire on an incline, but I don’t think I can move my car because the tire is completely broken. The only other option is the driveway which I would have to turn right into and starts on an incline (gets flat at the top). What’s the best option for me? I’ve never changed a tire before and don’t want to get it wrong.",0,1756520077.0,37,StupidCarQuestions,1756668666,2025-08-30 02:14:37,2025-08-31 19:31:06,"mrinformal (Score: 14): Personally I'd move it. Go slow.

BS-75_actual (Score: 11): After you've chocked the wheels, release the park brake to make sure your car is fully resting on the chocks so it won't move when you jack it. Reapply the park brake and put your car in gear or P. Would be safer to use a trolley jack but you may not have one to hand. Proceed with caution...

wpmason (Score: 4): Depends on the slope.

The risk is that when you lift the car up, gravity makes the jack tip over and does all kinds of vehicular and human body damage.

A gentle slope is easy enough if you securely chock the wheels that are remaining on the ground. 

But if there’s any doubt, just pony up for a tow truck straight to a tire shop. 

It’s not worth risking more damage. It’s not worth risking injury. It’s not worth trying to drive on (which will also do more damage)."
1n3oh9z,Help identifying an old hood ornament,"My Dad found this at a garage sale and I can’t figure out what kind of vehicle it came from. It’s probably not worth anything, but I’d rather be sure before I just get rid of it. Any ideas?",4,1756515480.0,3,StupidCarQuestions,1756668666,2025-08-30 00:58:00,2025-08-31 19:31:06,"ALG2003YT (Score: 3): Mercury.

Separate-State-5806 (Score: 1): Mercury, 1950's.

V8ManAlways (Score: 1): 1958 1959 Mercury hood ornament"
1n4gard,I need some ideas for a kill switch.,"Hello, I am installing a kill switch in my 2015 Honda Accord, and I want it to be invisible. The only way to switch it on/off would be by using some sort of card or key fob (this is the part where I need your help). I was thinking about something like RFID or NFC, but what happens if my battery die? Will it forget the key, or will it still allow power to reach the fuel pump? If so, that would defeat the whole purpose of the kill switch. What technologies would you recommend using? I need it to be small so i will be able to hide it (i am no telling you wher xD) and it has to be on/off not somethink like hold to complete the circut. Currently, my car could easily be stolen via the OBD2 connector, which is why I need to install a kill switch.",1,1756598152.0,3,AskMechanics,1756668666,2025-08-30 23:55:52,2025-08-31 19:31:06,ChrisShiherlis- (Score: 1): What do you want this switch to kill the Alternator?
1n4g40a,Oil looking good?,Just did an oil change on my 2010 G37 ran for a min and turned off and checked ,1,1756597584.0,3,AskMechanics,1756668666,2025-08-30 23:46:24,2025-08-31 19:31:06,ChrisShiherlis- (Score: 1): sure why not
1n4fuig,Is this the culprit behind my finicky climate control fan knob?,"2012 Hyundai Tucson. I hate this car so much haha, but I'm stuck with it.

So, a few days ago, the fan control knob on my car stopped working on 4, then it got progressively worse. As of yesterday, it only worked on 3, and even then it was temperamental. I researched the problem, and learned that I might need to replace the panel. However, before I spent $120+ on that, I wanted to see if maybe just unplugging and replugging the whole thing might work, like maybe the connection itself was loose or something.

When I unplugged everything though, I noticed that the power connector in the car itself clearly has a pin that's noticeably burnt. Sorry if none of this is the right terms, I am an extreme novice trying to fix things without being nickel and dimed the whole way, haha.

So, in your opinion, is this burned connector the problem, and if so, is that something I could replace on my own? Or, will buying the new control panel fix everything?

I appreciate any and all help. Thanks! ",1,1756596807.0,5,AskMechanics,1756668666,2025-08-30 23:33:27,2025-08-31 19:31:06,"lewtus72 (Score: 1): You might want to ask the reason why it is burnt in the first place. That's the real problem 

For testing purposes, you might try electrical cleaner just to see if it helps. If it temporarily works that know you probably are on the right track. If it does work I would just leave it until it fails again and check it. You may still end up buying the panel. There may be something shorted in there that's causing the burnt connection

69edgy420 (Score: 1): I knew it was a Hyundai when I saw the question. Not a mechanic but I own a model where this is a known issue. 2016 Veloster. Anyway you have to remove the connector and replace it. Strip the wires and all that. And don’t turn your fan past 3.

According to the people in the Facebook group I was in when I had Facebook."
1n4fs8n,Question to Car people Engineers and Problem solvers...,"When diving down a steep hill or road in neutral your car can gain as much speed/momentum as possible but in auto  or drive the vehicles engine steadily tries to maintain its current mph while going down hill.

How much damage/stress is put on the engine having it fight downwards momentum? I've gained speeds up to 95mph in Neutral but regular Drive  is maybe 60mph.",1,1756596629.0,10,AskMechanics,1756668666,2025-08-30 23:30:29,2025-08-31 19:31:06,"wpmason (Score: 6): It’s called engine braking and there’s nothing really detrimental about it at all.

It’s actually very useful for maintaining control of a vehicle of steep slopes without overheating the brakes. 

The engine wants to go the speed the throttle dictates and very little else can actually change that. The combined forces of gravity and the mass of a vehicle certainly aren’t enough to overpower it. That’s why it doesn’t over-rev according the speed. The engine is strong enough to hold the vehicle at the slower speed. It’s not over-stressed at all.

Dean-KS (Score: 0): If you are in cruise control, some vehicles will engage the rear brakes to maintain/limit  speed"
1n4fqyh,What is this in my car,It's 2005 Tahoe I got but I'm not sure what this is for it's some as seen on TV product. Please help. ,3,1756596526.0,4,AskMechanics,1756668666,2025-08-30 23:28:46,2025-08-31 19:31:06,"ClonedBobaFett (Score: 5): Male end for a magnetic phone holder

https://www.google.com/aclk?sa=L&ai=DChsSEwjxl-3v2LOPAxWCNtQBHQl3D2AYACICCAEQARoCb2E&co=1&gclid=EAIaIQobChMI8Zft79izjwMVgjbUAR0Jdw9gEAQYASABEgKus_D_BwE&cce=1&sig=AOD64_3vQXbn-RSJ8oUcRJvtQaUu_cCvKA&ctype=70&q=&ved=2ahUKEwje6unv2LOPAxXA6ckDHQyZLkAQwg8oAHoECAYQDQ&nis=2&ch=1&adurl=

squad1alum (Score: 2): That's your Auto Panda"
1n4fpcd,Running an HOAT coolant on an OAT car,"I have a 2022 charger R/T V8, They are supposed to run at OAT coolant but the mechanic put HOAT on it.

He flushed it first so my car is now running at HOAT and not mixing both of them.

Is it fine? ",1,1756596397.0,6,AskMechanics,1756668666,2025-08-30 23:26:37,2025-08-31 19:31:06,"Top-Manufacturer1894 (Score: 2): Should not be a problem

scroopydog (Score: 2): Just stick with the HOAT, it’s better."
1n4fftd,Melted Brake Light Bulb?,"Went to change out my brake light and couldn’t get it out, i kept tugging at it and eventually the glass
part came off of the metal base. Tried using pliers to get it out and no luck it’s just mangling the metal. How should I go about this?",3,1756595650.0,11,AskMechanics,1756668666,2025-08-30 23:14:10,2025-08-31 19:31:06,"Verlin_Wayne (Score: 2): You can buy just a socket, I had to do that for my mom’s car a Hyundai but she’s rests her foot on the brake while driving, she can be doing 35 MPH with the brake lights in on.

-NOT_A_MECHANIC- (Score: 1): Because it doesn’t push in/pull out. Push in then twist CCW and pull out. Before that, crimp all the edges of the bulb base I towards the center so it isn’t wedged in the socket, or at least for the parts bent outwards. If it’s really stuck, then use needle nose pliers along the circumference of the bulb base for good leverage and to prevent the thin metal from just tearing."
1n4fdmj,"Is the this culprit behind why my climate control knobs is being finicky, and if so, how do I replace this?","2012 Hyundai Tucson. I hate this car so much haha, but I'm stuck with it.

So, a few days ago, the fan control knob on my car stopped working on 4, then it got progressively worse. As of yesterday, it only worked on 3, and even then it was temperamental. I researched the problem, and learned that I might need to replace the panel. However, before I spent $120+ on that, I wanted to see if maybe just unplugging and replugging the whole thing might work, like maybe the connection itself was loose or something.

When I unplugged everything though, I noticed that the power connector in the car itself clearly has a pin that's noticeably burnt. Sorry if none of this is the right terms, I am an extreme novice trying to fix things without being nickel and dimed the whole way, haha.

So, in your opinion, is this burned connector the problem, and if so, is that something I could replace on my own? Or, will buying the new control panel fix everything?

I appreciate any and all help. Thanks! ",2,1756595476.0,4,AskMechanics,1756668666,2025-08-30 23:11:16,2025-08-31 19:31:06,"scroopydog (Score: 1): Not a professional mechanic. 

When I see this it’s usually a resistor for the fan that’s the root cause. Gotta replace it and the fan switches, maybe fan too. Look it up maybe?

Probablysleeping- (Score: 1): Is the burnt one lose in the connector? If so you might be able to bend it a bit it might have a bad connection. Or the wire is loose in the spade connector which you can’t really fix. Did you check the fuse box?"
1n4fdhs,Battery question,I won't be driving my 2001 Ford Explorer Sport this winter (temps as low as single digits where I live).. It will be sitting outside all winter so plan on winterizing it.  Should I bring the battery inside or would it be safe to leave it in the car?,1,1756595465.0,4,AskMechanics,1756668666,2025-08-30 23:11:05,2025-08-31 19:31:06,"More_Assistant_3782 (Score: 2): I’d bring the battery inside.  It’s going to discharge and it can freeze if the charge gets too low.

waynep712222 (Score: 1): before winter. perhaps today or tomorrow.. this test.. print a copy..

 lets make sure the wiring is up to it..

 https://www.reddit.com/media?url=https%3A%2F%2Fi.redd.it%2F192cdpta3zdf1.jpeg

 if you can bring it inside as you won't be using it absolutely.. 

  you can get a marine battery box from many parts stores that you have to verify it will fit.. you likely have a group 35 battery.. 

  this also gives you the ability to keep your battery from pets.. keeps any acid from leaking onto stuff.. i usually set the battery in the kitchen sink and wash the top.. sides and tilt it up slightly and wash the bottom , DO NOT TURN ON ITS SIDE.. 

 dry with paper towels..  now you can store it in the marine battery box..

 if you happen to have a black out.. if you have an jump start box that has a lead acid battery and an inverter.. NOT A COMPACT Jump start box. .  you can hook the jump start clamps to the battery and turn the switch on..   this should keep the jump start box powered for many hours allowing you to charge your phones or run a lamp.. 

 my state went into black out about 15 years ago.. i am during the blackout sitting in my apartment living room watching TV with the lamp on next to me.. my neighbors came knocking.. why do you have power.. i realized if i told them i have an inverter.. they will. bring extension cords and my little inverter won't handle that.. so i told them.. when the power bills come.. i pay them the first day. they have no reason to ever shut off my power.  they left very confused.. 

 i have a lead acid battery jump start box right beside me.. once every 2 weeks i plug it in and hook it to my external car battery and recharge it for a few hours. .

 you can use an cheap styrofoam ice chest to store your battery during the winter too.."
1n4f6lk,So... what's the real story about Motor Mounts?,"The engine in my Toyota Corolla is starting to lean now: the drivers side is lower, and I guess that explains why the steering wheel isn't at 12 o'clock while the car is going straight.

This car is $2500 Blue Book, assuming it was clean, and I've spent well above that in the past 2 months doing DIY work. Hell, I had a luxury car for 3 years and spent less than I did on this car.

The mechanic I trust tells me that I absolutely should go with OEM for motor mounts, but these mounts are $300 a piece from Toyota, and it's safe to assume I need all 4.

The prior owner claims he had these mounts replaced for $1000 at his mechanic, one year ago. I'm assuming they didn't buy OEM at that price.

I'm looking at Rock Auto and Wally World. RA has Anchor and WW has Beck Arnley. The Becks are more expensive, where a whole set would run me about $250.

I don't want to pay BMW prices to keep this jalopy moving, so what's my best play here? Any other brands I can use to keep the car moving? My intention is to get this up to a level where I can use this car long enough to buy something else, cut my losses, and sell this car without feeling like an asshole.",0,1756594932.0,29,AskMechanics,1756668666,2025-08-30 23:02:12,2025-08-31 19:31:06,"DarienKane (Score: 10): I don't think your motor mounts are going to affect your steering wheel....I work more on HD and domestics so I could be wrong....

FallNice3836 (Score: 5): I work at Toyota, I haven’t changed motor mounts for Corolla yet. 

This is classic overt thinking. You need to actually figure out what’s wrong and what’s causing what."
1n4f4sr,Knock Sensor on Kia Soul,My engine light came on about a month ago and I had it checked with a diagnostic.  They said it’s the knock sensor. Now it’s making a funky noise. What does this mean for me car wise and financially?,1,1756594803.0,3,AskMechanics,1756668666,2025-08-30 23:00:03,2025-08-31 19:31:06,"T65301 (Score: 2): Don't know your year, but they are notorious for mechanical engine problems with oiling and rod bearings going out and such stuff.  Maybe the knock sensor picked up mechanical noise in the engine before you did.  But your options are engine replacement if under warranty or recall.  otherwise trade it for a better vehicle.

Asleep-Evidence-7141 (Score: 1): The year is the car is 2020"
1n4f3o5,Can someone tell me what I'm looking at?,"In back there are 4 plugs that plug into something, and in front (in front of the dip stick) there are also 4 plug-looking things. I assume one of these are the fuel injectors. Are u able to tell by looking at it if i have GDI injectors? Where the heck are the spark plugs?!  I took the cover off because i want to change the spark plugs. But i cant find them. I have a 2013 Kia Soul Plus with a 2.0 engine with 60k. I bought it new. Never donr anything except oil changed, battery, and tires. Oh had a transmission flush and brake fluid flush done at a tire shop. ",68,1756594718.0,72,AskMechanics,1756668666,2025-08-30 22:58:38,2025-08-31 19:31:06,"H00kd_ (Score: 85): To do your spark pugs remove the coils, the hold down bolts are 10mm, make sure you mark them 1-4 and do not accidentally swap 1&2  IV seen it done at shops all the time lol, and no it's not a GDI engine

https://preview.redd.it/1tnfegd7v8mf1.jpeg?width=4000&format=pjpg&auto=webp&s=f0c791454d1c25edc7d023e23be00eec12e981db

facts_my_guyy (Score: 16): Top are your plugs and coil packs, bottom is your fuel rail and injectors. I wouldn't bother doing the plugs without the wires in this case. The plugs are set deep (3"") within the coil tube so you'll need a spark plug socket set. Watch lots of tutorials, don't over tighten anything, if it feels like it's going it wrong it is"
1n4eyig,545R RFE filter change,New filter on the right. Is it the correct filter? Will it work in transmission? Spins on but is slightly taller and holes are clearly different. ,1,1756594308.0,5,AskMechanics,1756668666,2025-08-30 22:51:48,2025-08-31 19:31:06,"ChrisShiherlis- (Score: 1): Only you will know... nobody here will from a pic OP.... or such a specific transmission filter

Looks like the same diameter/circumference... maybe measure?

Best test is does it thread easily like an OEM Filter would?"
1n4eu02,"Heeelllppppp!!!!! I have cleaned or replaced damn near all sensors except the crankshaft, changed icm.... idk what to do next! It cranks and runs long enough to get warm, then cuts off! And the oil smells like gas. Even changed fuel pressure regulator..... cleaned throttle as well...",,1,1756593957.0,3,AskMechanics,1756668666,2025-08-30 22:45:57,2025-08-31 19:31:06,"Soft_Negotiation8763 (Score: 1): 04 Buick Lesabre 3800

Sqweee173 (Score: 1): Possibly a crank position sensor. Not sure if gm has the same issue but I'm familiar with that issue just on a different brand. If you have a scanner than can show live data, monitor cam/crank sync or crank position when you crank it after it stalls. The heat causes them to either short internally or go open internally which is why is stalls when hot. 
The gas smell is probably from washing down the cylinders from cranking it a lot."
1n4erwk,Bought BBS Chr for my e46,It will be going on a 330ci convertible. Stud pattern is 5x120 so will definitely bolt on but the ET is et40 18x8 and et44 18x9 what impact will that have to the car as most set ups iv seen are below et40 most the time. ,0,1756593797.0,3,AskMechanics,1756668666,2025-08-30 22:43:17,2025-08-31 19:31:06,ChrisShiherlis- (Score: 1): Google it.
1n4em2v,Is it good to change only rear tires?,,1,1756593344.0,3,AskMechanics,1756668666,2025-08-30 22:35:44,2025-08-31 19:31:06,"ChrisShiherlis- (Score: 2): You NEED 4 New Michelin Defender Tires OP.

Always let them wear together like Brothers.

what is front tires tread depth?

Gambit3le (Score: 1): Change all four at the same time."
1n4ecnf,Does this look right?,"Hi everyone. I recently bought a 2016 Lexus GS350 with the rear left grab handle missing. Is the left hole supposed to be aligned straight and have a metal clip similar to the right side? I ordered the OEM grab handle replacement but am concerned i may not be able to install it because of the possible misalignment and lack of a metal clip.

Any help is appreciated.",1,1756592606.0,2,AskMechanics,1756668666,2025-08-30 22:23:26,2025-08-31 19:31:06,"Coompa (Score: 1): Well you can find an exploded diagram.  You can go to a dealer and ask to see their exploded diagram.  

You can also take apart the passenger side and see."
