id,title,selftext,score,created_utc,num_comments,subreddit,scraping_time_utc,created_datetime_utc,scraping_datetime_utc,top_comments
1opa0iw,Totaled Car Please Help!,"My vehicle went into the shop after it was involved in an accident and repairs were initially estimated within ACV. After work began, the collision center determined the car had mechanical issues and sent it off to the dealer to diagnose. Once the dealer submitted their estimate, it put the car over ACV and it was deemed a total loss. 

I received the payout for the initial estimate and supplements for work that was completed prior to the car being sent to the dealer. The remaining payout (up to the ACV) was sent directly to the lienholder. I had gap insurance which covered the balance between the ACV and the total loan amount. However, I now still owe $8,500 to the lienholder because of the $8,500 that was paid to the collision center for the initial repairs. 

How is this even possible? As a consumer I had everything in place to protect me - or so I thought! How was car insurance and gap insurance not enough to protect me? Where do I go from here?",1,1762365446.0,1,carproblems,1762457787,2025-11-05 17:57:26,2025-11-06 19:36:27,LordAinzOoalGown1 (Score: 1): I would contact your insurance company and ask why I’m receiving this bill.
1op8cix,Running like shit after the tank was cleaned out?,"  Hello i dont have pictures or videos but my car is a 2006 VW jetta (1.9 i think) i had accidentally filled the tank up with gas like a dumbass, never started it had it towed to a shop right away, they took all the gas out and cleaned the tank, except now when im driving it, it will be fine for an hour then it will bog down and rapidly start downshifting until its going 20-40mph and will stay there for a few minutes, feels very fuel starved. Then it will jump back up to speed and pretend like nothing happened, It will repeat this if as long as im on the freeway, through town seems to drive fine. 

Before the gas was introduced the car had a code p2112 which is throttle body needs cleaning, i did clean it but the code hasnt gone away; that never seemed to effect the drivability of the car though. 

Does anyone know what it could be and how to fix it?! I need this car running right again.",2,1762361944.0,12,carproblems,1762457787,2025-11-05 16:59:04,2025-11-06 19:36:27,"RabbitGlass5578 (Score: 1): I wonder if the gas loosened up some gunk in the fuel line, and maybe the filter is getting partially clogged?  It would be interesting to see if maybe 4 or 5 tanks of diesel run through it will eventually start running normally again.

androidwithamnesia (Score: 1): Be extremely cautious how you proceed with this. 99% sure those had a high pressure fuel pump with a rep for fragmenting and destroying your entire fuel system. Gas and diesel have completely different lubricity characteristics. Fingers crossed for you!

Ok-Anteater-384 (Score: 1): How did they clean the tank, did they remove it or just pump it out?"
1op6x5h,Lug nut on stripped thread,"My lock nut is on a stud that is loose or has stripped thread so it’s just spinning and not actually loosening
Any help or advice on what to do to try and fix this is much appreciated thanks!",1,1762358823.0,3,carproblems,1762457787,2025-11-05 16:07:03,2025-11-06 19:36:27,AnythingSilent7005 (Score: 2): try removing all the other nuts and then using a long pry bar to pressure the wheel against the last remaining one from behind if that makes sense
1op6u1t,tire sensor issue? help a girl out,"i got all of my tires changed a week ago and noticed one tire was appearing as low on my sensor, when i went to put air in it the pressure was fine. as i went about going to work every other day it got lower and randomly hit 19 flashing a problem light. checked the tire and the pressure was fine. drove fine. today while i was going to work my car sent a warning to check my tire and could no longer detect that tire. i’m still at work currently but i was on the highway, am i good to drive on the highway to go to the tire place i visited a week ago or should i find any tire place near me immediately after work. 
dumb questions i know but i don’t have a male figure in my life who i could ask this to so i turned to reddit. ",1,1762358634.0,12,carproblems,1762457787,2025-11-05 16:03:54,2025-11-06 19:36:27,"yeahyoubetnot (Score: 4): Many have batteries in them and yours may have died. Some are replaceable, some you have to buy a whole new sensor. Go back to your tire shop, they'll fix it for you.

DistinctTheory9898 (Score: 2): The tire pressure sensors have a location that's matched to your computer. When you rotate ...
say the left front will be moved to the left rear which isn't going to be correct. 
You need to have the tire shop reset your TPMS for its new locations

RideAffectionate518 (Score: 2): You need a new sensor or it needs to be relearned to the vehicle. One of those."
1op07z7,can you help,Opel astra G 2004 1.7 cdti ,1,1762341671.0,2,carproblems,1762457787,2025-11-05 11:21:11,2025-11-06 19:36:27,"gamimgyt (Score: 1): This is most likely an electrical issue

A shared injector supply rail (power/relay/fuse) or wiring issue: maybe the supply voltage is higher than expected, or the wiring insulation is damaged causing the signal wires to float high.

Could also be A common ground problem or harness section for the injector driver bank, causing the ECU driver to see artificially high voltage and report “circuit high”.

Or A driver bank in the ECU (injectors 1-4) being damaged, so all those injectors’ circuits are reading as “high”. I think injectors themselves are most likely fine"
1ootvj2,"Why is my car making a low-pitched humming/squeaking noise, but only when the brake is NOT applied?","I drive a 2015 Honda CRV that just hit 100k miles after I took it on a 2k mile road trip. This noise began today and has been getting progressively louder. There is one loud humming pitch that pulsates, but also a quieter squeaking that accompanies it. It feels like it is related to friction with the steering wheel or wheels because it gets louder when I turn. The noise completely stops when I press the brake at all. My dashboard has no warning indications and my tires look fine. Please help!",1,1762318160.0,6,carproblems,1762457787,2025-11-05 04:49:20,2025-11-06 19:36:27,"Public-Marsupial6120 (Score: 1): Might be a wheel bearing going bad just a guess

Background-Fault-821 (Score: 1): It SOUNDS like brakes but is described as a bad wheel bearing. Either way I would take it in asap.

AutumnInTheScarlet (Score: 1): Update: called the mechanic this morning and he immediately told me it’s the brake pads going bad. Not dangerous right now just annoying"
1oonw6s,Electrical Issue,Any thoughts?,4,1762301279.0,13,carproblems,1762457787,2025-11-05 00:07:59,2025-11-06 19:36:27,"QuantifiablyMad (Score: 4): Battery is dead kid.

No-Dragonfruit498 (Score: 2): Battery.

dmorulez_77 (Score: 2): I'll always be amazed how someone's on reddit, on this sub, and still doesn't know what a dead battery is. SMH"
1opj07h,2013 Corolla with 149k miles on it and got quoted this for a back brake job.,"Pretty much clueless about cars, but this seems high. I drive a 2013 Corolla with 149k miles on it. I take pretty good care of it. Only drive about 40 min a day (20 min each way to work, mix of highway and city).

Am I getting waxed or is this reasonable. I’m located in a nice suburb outside of Philly. Can provide more info if needed. Thanks! ",21,1762385530.0,96,autorepair,1762457787,2025-11-05 23:32:10,2025-11-06 19:36:27,"BeerNES (Score: 20): Learn how to do brakes!

Ok-Confection2834 (Score: 7): With Wearever parts HELL NO. Find a local independent Toyota mechanic and you will get a better job and probably cheaper.

Ok-Anteater-384 (Score: 7): Gee, they forgot to charge you $50 for using a screw driver

Try another mechanic"
1opicb1,Passing an E-check with check engine light on...ADVICE NEEDED!!,"so i bought a car for $2500 a month ago. unfortunately the car has given me nothing but trouble since i bought it. took it to the shop today and im looking at $3200 worth of repairs. the transmission is gonna cost me $532 which I can hack, but the exhaust needs to be replaced entirely (system is welded together) and will cost $2615. 

i've had beaters before but usually dont get any major issues for at least 6 months. the owner i bought it from (literal angel) has offered to give me either $2000 back or sell it back to her, which are both great options that im soo grateful to have. 

the mechanic said the car would still be drive-able without getting the exhaust repaired, but the check engine light would still be on and that it will likely cause issues for me with passing e-checks. even if i accept the $2000, ill still be out $1200 for the repairs for the transmission and the exhaust. 

i already gave the shop the OK on fixing the transmission, so now im not sure how to proceed. i can accept the $2000 and use that money towards the transmission repair and just drive around with the check engine light on until its time to renew my registration (and i drive a 2008 honda so i unfortunately would have to get tested to renew in the upcoming year) and try to sell it when that time comes, or i can sell it back to the old owner for $2500, still have to pay the $762 (repair plus inspection fees) and search for a new car which would leave me with no reliable transportation for the time being and on a tight budget to find another one. 

so i guess my question is, would it be possible to pass my emissions test with my check engine light being on due to the exhaust issue? i know by the time by registration is up i will have enough saved for another car, but i was hoping my next car would be newer and more reliable instead of another beater so that kind of puts me on a shorter time limit/smaller budget.

im honestly just looking for any advice on the situation honestly. i know i could be in a way worse position but im not sure what the right move is here. ",3,1762383910.0,12,autorepair,1762457787,2025-11-05 23:05:10,2025-11-06 19:36:27,"Ashamed-Leading946 (Score: 2): This trick has worked for me in the past. Disconnect your battery to clear the check engine light. Then reset your trip mileage. Continue to drive and see how far you get before the check engine light goes back on.

If you can make it to about 50 miles or so you should be able to pass inspection. The trick is finding the sweet spot from when there is enough data to be read by inspection but not enough to trigger the check engine  light.

shanihb (Score: 1): Does the check engine light go on right away after you clear the codes?  If not, you can clear the code and get it inspected before the light comes on.  You have to check the local rules and procedures as to whether the vehicle gets hooked up to a computer or they just check the light.  Also if you have to have all sensors ready or if you can get away with not all ready.  A cheap obdii reader will do the trick here.

Solomon_knows (Score: 1): Everything that turns the check engine light on does not automatically fail an emissions test. Is it emissions related code? If so, state dependent … some have a waiver policy that if you spend X amount you can get a waiver for so ___ time..  some are fix or park"
1oph5wz,"2016 volvo s60 overheating, but not really","My 2016 volvo s60 inscription, that I bought recently, has now twice warned that it's overheating. I pull over, and there isn't any boiling or steam or any real heat from the engine compartment. I open the overflow and again, no steam or anything. The second time, the overflow burped a bit, but that wasn't hot or steamy either. Both times I got the car back on the road and it was fine.  I don't know much about cars, so I could use some guidance please. Thank you. ",0,1762381146.0,4,autorepair,1762457787,2025-11-05 22:19:06,2025-11-06 19:36:27,"Durcaz (Score: 1): Overheating doesn't always present itself as a steaming chaotic mess, it's tough to help without knowing the true coolant temp. Modern temp gauges are painfully vague. Does the coolant temp gauge climb toward the danger zone when it happens?"
1ooxns4,"I want to buy a scan tool, but there are so many and I don’t understand the differences between them","I have a 15 year old prius that sometimes throw dash lights, and so I thought it would be assistive to buy a scanner so I don’t have to rent one every time I need it. 

I to want to buy this one because it’s on sale at auto zone for $179 but I don’t understand what it offers more than one that is cheaper: 
https://www.autozone.com/test-scan-and-specialty-tools/code-reader/p/innova-obd2-diagnostic-scan-tool/1507115_0_0?intcmp=SRP:BAN:1:20251021:20251117:ENM:INV-Scan


Like these that are cheaper:

https://www.autozone.com/test-scan-and-specialty-tools/professional-code-reader/p/innova-3-5in-diagnostic-tablet/1377582_0_0?searchText=Innova+scanner

https://www.autozone.com/test-scan-and-specialty-tools/professional-code-reader/p/innova-2-8in-diagnostic-tablet/1377580_0_0?searchText=Innova+scanner


I don’t understand what the differences between these are, and I’ve called a few auto zones and no one, not even the managers, can give a clear answer on the differences or even offer any info on what they offer. 


Title: I want to buy a scan tool, but there are so many and I don’t understand the differences between them 
",3,1762332020.0,7,autorepair,1762457787,2025-11-05 08:40:20,2025-11-06 19:36:27,"VeryHairyGuy77 (Score: 3): If you have a smart phone, why not get a Bluetooth to OBD2 widget and spend $5 for the Torque Pro app?

Here's an example:
https://www.amazon.com/dp/B0B1DPG94C

andruszko (Score: 1): Veepeak OBDII Bluetooth from Amazon.

Use software from play/apple store. Dr. Prius works great for your vehicle. As it sounds, it's made specifically for your vehicle and will offer more diagnostics, especially hybrid system related, than even some $2000+ tools.

Car scanner pro may provide one or two extra features. In my experience, it's better than torque and is free. Although I do still have torque pro and haven't used it in years, I may download and try it again/see what updates have come.

awqsed10 (Score: 1): If you only drive a certain brand then get a launch careader scanner. They made specifically for the brand. Can activate abs pump for the price."
1oos9fa,Getting a 2005 Buick Rainier into neutral with  no power,"My family has a 2005 Buick Rainier that died a few years ago and we're finally junking  it, but it doesn't even have a battery in it anymore.  How do we get it in neutral to be pulled up on the traile",2,1762313214.0,4,autorepair,1762457787,2025-11-05 03:26:54,2025-11-06 19:36:27,"CBased64Olds (Score: 5): Most cars have a shift interlock release, often under a cover or cap near the shift lever. Pop open the cap, and insert a screwdriver or key into the hole to push the release mechanism

Abolish_Nukes (Score: 2): If your junking it just put air in the tires & pull it up on the trailer. 

If your dragging it across a paved driveway hose it down first and squirt some dawn in front where the tires will be dragged. 

You can put any battery in it if you want to, but I would just jump start it. Hook the cables up to the battery cables & jump it.

Embarrassed_Fun_7106 (Score: 1): Slide under unsnap shifter cable"
1oorcb7,Any advice appreciated,Hello everyone was a big idiot and back up into a wall any advice on sanding and filling in the deep scratch on my own? ,4,1762310587.0,7,autorepair,1762457787,2025-11-05 02:43:07,2025-11-06 19:36:27,"Queasy_Author_3810 (Score: 2): Can't fix that by sanding it, need to replace the panel.

Abolish_Nukes (Score: 2): Definitely not a big idiot. Everyone will back up into things at one point or another.  Pretty common. Relax. 


If it’s older than 7 yrs I wouldn’t fix it.  That’s character.

Mysterious_Home3946 (Score: 2): plastic flexi filler pretty decent on bumpers sand after prime spray"
1opjju9,Thinking of Entering the Automotive Trade. Any Advice or Warnings?,"I (19F) have always been very book smart. I graduated high school with an associates, am finishing up a bachelors in hca, and work at a local optometry clinic. I've always been working towards the medical field/PA school, but recently I've been toying with the idea of giving into my personal hobby -automotive mechanics. I have always loved cars + mechanics, and there isn't a doubt in my mind that I wouldn't be able to pick it up. The only issue would be completing training for a certificate is a good amount of time and money when I already have a full time job, and go to school full time. Is automotive school worth considering in the near future -after school ofc- or should I drop it? Any advice?",1,1762386929.0,22,mechanic,1762457787,2025-11-05 23:55:29,2025-11-06 19:36:27,"FBIVanNumber1543 (Score: 1): My recommendation- stop thinking about it. I've built a couple cool rods in the past. I'd love to do another one, since I'm kinda retired and have the time to do it. After decades of using impact guns, and everything else related, I can not physically do it any more. I'm in pain 24 hours a day. Just something that could happen. 🤷🏼‍♂️

Desmoaddict (Score: 1): I was a master certified technician and foreman for a luxury automotive brand and worked for dealerships for over a decade. I also ran technical training for a couple different manufacturers. Now I'm in the dreaded white collar program management role. 

I'll throw in a few things to give you some food for thought and direction. 

It is a male-dominated industry, but that doesn't mean that it's the same industry it was 20 years ago and that you won't find many places where you will be comfortable and respected. Do your job well, be knowledgeable, be a decent person, and if that's not good enough, there's wheels on the toolbox for a reason. 

People say that if you do a job you love you'll never work a day in your life. But when it comes to many trades, the quickest way to kill a passion is to do it for money. Fighting to get paid to fix a car that The owner doesn't care about does get old.  It's great to have hobbies, it's even better to have a great job that pays for your hobbies. 

If you want to work in the shop, go to a technical school and actually apply yourself. You will need to understand how the systems in a car work together, the basics of how things operate regardless of brand, and become absolutely top-notch at electrical. There are plenty of glorified lube text that just throw parts at cars because there was a code for it, but they don't understand how the system works and they rarely get the repair correct the first time. Understanding how everything works allows you to test to make sure that your repair is correct the first time every time. While building an engine is fun, no one is changing out main bearings in service, but they are tracing down amperage draws, so electrical is a must! And just because you understand something today, doesn't make you invincible. You need to be striving to continue to learn constantly. 

Buy quality tools, keep them clean and organized, and do not lend out electrical test equipment to anyone. And just like with your tools, as you disassemble things make sure the parts are clean and organized because, no you will not remember where everything goes. Follow the repair manual for at least the first time you do a job before you think about taking shortcuts. There is no shortcut worth skipping a torque wrench, a torque wrench will be your best friend.

Working a physical job that takes a toll on your body. You need a solid and regular exercise routine for flexibility and strength training. The moment you back off is the moment you start getting hurt and your body starts to fall apart. Don't take stupid risks, use a lifting device for anything heavy. Don't use your hand as a hammer, take the two seconds to pick up the mallet from your toolbox. Wear gloves, safety glasses, and hearing protection. I would also recommend continuing to go to college with night classes so that if you do end up injured, or just burnt out on it all, you have a backup strategy before you are totally SOL.

Working in a shop is not the only way to spend time in automotive. A great way to be involved in automotive is to get an engineering degree. You can design the vehicles and their systems, you can design how the systems integrate to each other, manage the testing for dimensional/electrical /or even crash, you can even design the manufacturing equipment that makes up the assembly line or even stamps the parts. There are plenty of groups within the engineering teams that all have their race car and motorcycle projects at home, and you track days on the weekend. But they work in CAD and with testing systems, not in a shop.

One last note about education. It doesn't matter what degree you get, it matters how you apply it and who you connect with. The reason ivy League schools are in such demand is not because the level of education is really any better. It is because the people that go there are the ones that you want to connect with to move up in this world. You still need to be good enough for them to be comfortable recommending you to their network, but you'll never get into the network without them. I have multiple degrees now, and my master's degree was a great experience for me, but I chose a private college with better classes rather than a college with higher notoriety, and that was my mistake. I will generally be regarded as an intelligent and successful person, but I won't be regarded that by the people that could have gotten me into positions making 2x to 10x as much money doing the same thing I do now because I didn't have the opportunity to meet them."
1opj9ti,2010 Chevy impala front passenger side creaking/clunking only on right turns. Struts/suspension issue?,"Noise happens during second half of video immediately after blinker turns off.

Last week my car started making a thunking/clunking sort of noise that 100% sounds like it’s coming from the front passenger side tyre, but it’s only happening during complete right turns (wheel turned mostly to the right). The sound can be replicated while parked, so speed isn’t a factor either. 

Over the weekend I had a family friend/out-of-practice mechanic take a look at it, they replaced all 4 wheel bearings. They suspected that the struts/suspension were failing because the car is bouncy when you press down on the front or back end of the body, the struts squeak when the car is pressed in the same way, and there was some visible wear on the bottom rung of a couple of the coils as if they were bottoming out.

After they replaced the bearings, the car now started making the creaking sound heard in the video during right hand turns onto bumpy roads. It’s still making a general thunk/clunk during other right hand turns. I’m suspecting it’s coming from the suspension/struts due to the creaking being similar to what we hear when pressing down on the car. 

Does anyone have any experience with this? Or recognize this sound? If the strut/suspension is failing badly enough to cause this noise, is there any chance that the car is unsafe to drive? ",1,1762386210.0,6,mechanic,1762457787,2025-11-05 23:43:30,2025-11-06 19:36:27,"Economy_Side9662 (Score: 1): Could be the CV axle or he didn't get something tight

Mammoth-Complaint937 (Score: 1): Check your sway bar links. If you can move them with 1 hand pretty easily that’s your issue. They should be pretty stiff. I had this issue with my left tire turning left."
1opgvsa,Loose wheel stud,"Got a free spinning lug stud. Shop can take her in 7 days from now(it's snow tire season). This is our daily driver and only vehicle and driven about 50km per day give or take. Wondering about the safety risks if we continue to drive it until then. A quick Google search says 'HELL NAW' but I want a real life advice.

Rear passenger wheel on a RWD Hyundai sedan.

Everything else is torqued good. Live in an area where rust is unavoidable so we already know why studs break lol",1,1762380507.0,9,mechanic,1762457787,2025-11-05 22:08:27,2025-11-06 19:36:27,"boi2160p (Score: 2): Just tighten it with the toolkit in the car until the mechanic can toque them down. If that’s missing get a socket and breaker bar from harbor freight or where-ever. The $25 you will spend on that is worth not taking the risk. Also if one came loose, chances are that none of them were properly torqued."
