id,title,selftext,score,created_utc,num_comments,subreddit,scraping_time_utc,created_datetime_utc,scraping_datetime_utc,top_comments
1oqwnul,Is this not a blatant scam?,"6L80E Transmission blew, we took it to a shop and they said they did a full rebuild. 70k km later it blew again. We took it back, and the guy was super sketchy, saying they honour their work, but that’s about it. He said he’ll have to open it up and it’ll either just need a new torque converter or they’ll have to rebuild the whole thing. They opened it up, and he said they have to do a full rebuild. Normally $4700 but he said he’d do $4k for us. We said go ahead, and now the bill says “The bill says,
Rebuilt 6L80E automatic transmission assembly with rebuilt torque converter
Synthetic transmission fluid
Line gard”
And labour.
Does this mean all they did was change the torque converter and lie to us that they did a full rebuild?
",0,1762527656.0,6,MechanicAdvice,1762630414,2025-11-07 15:00:56,2025-11-08 19:33:34,"connella08 (Score: 1): there are a lot of unknowns here.

what were the failure symptoms the first time?

what were the failure symptoms the second time?

the bill says ""rebuilt transmission assembly"" as well as ""with rebuilt torque converter"" meaning, they rebuilt the transmission and used a remanufactured torque converter. not sure why you think they lied about rebuilding it if it specified ""rebuilt transmission assembly"".

at this point in time, the only way to find out if they lied is to take the transmission apart and inspect everything to see if they did actually rebuild it. 

are you having problems with it now that you got it back from the shop?"
1oqwgq5,Does anyone have experience with this brand?,,2,1762527182.0,4,MechanicAdvice,1762630414,2025-11-07 14:53:02,2025-11-08 19:33:34,"TheTense (Score: 1): Rubberized undercoating can make a car rest because it traps water between the metal and the undercoat. Most professional professionals out there would suggest using a lanolin based product that you would apply yearly.

If you’re using a rubber coating just to protect the area from impact damage it may be more acceptable."
1oqwed2,I think someone put a tracker on my car. What is this?,"I got this old car back from the mechanic. It had been sitting for two years and wasn’t working well. They replaced alternator, valve cover gasket, power steering line, and clutch fluid (hydraulic).

After having the car for a while I wanted to scan the codes because its miss firing and realized the OBD2 port isn’t working. So I checked underneath and found this device I’d never seen before.  

Is this a tracker? What is it? Why was is installed? I don’t think I was charged for it either.

tldr: unknown device in my car. I think it might be a tracker. 

",171,1762527028.0,80,MechanicAdvice,1762630414,2025-11-07 14:50:28,2025-11-08 19:33:34,"X360NoScope420BlazeX (Score: 255): Looks like a super basic alarm system. The min/max setting could be for an internal shock sensor. The red wire that goes nowhere looks like an antenna.

EddieOtool2nd (Score: 106): If I'd put a tracker on someone's car, I'd hide it somewhere someone who needs to ask whether it's a tracker or not would never find it."
1oqw9xo,Failure to turn on occasionally w/ scraping sound,"Hey all I finally got a video of this weird thing my car is doing occasionally when turning it on. It is a Nissan Sentra 2006 1.8s. I have been unable to find any info about this or really accurately describe what is going on.. it started happening these last two days where sometimes when turning the key, it will make this metal scraping/screeching noise and doesn’t turn over or make any clicking sounds like it’s trying to turn over. Other times it works fine. I’ve had the starter replaced about 7 months ago along with spark plugs and it has had regular maintenance since then.",1,1762526731.0,3,MechanicAdvice,1762630414,2025-11-07 14:45:31,2025-11-08 19:33:34,"Glittering_Clue9920 (Score: 1): If you’re had the starter replaced, it might be the ring gear on the flex plate that needs replacing"
1oqw488,Kia Rio not starting,,1,1762526336.0,5,MechanicAdvice,1762630414,2025-11-07 14:38:56,2025-11-08 19:33:34,"EngineeringGlum5318 (Score: 1): Battery most likely, try charging it if it fixes the problem the battery itself might be going bad or the charging system"
1oqvxz1,2016 Ram 1500,So the parking brake on my Ram doesn’t feel like it engages well. I was under the truck the other day and checked the driver rear break where the parking brake cable leads and saw the spring looked like this. Could this cause the brake to not fully engage? How much of a pain in the ass is it to replace if it is this? Thanks in advance ,1,1762525912.0,2,MechanicAdvice,1762630414,2025-11-07 14:31:52,2025-11-08 19:33:34,Illustrious_Tea5569 (Score: 1): No it's like that to assist the cable in releasing..it's more likely your shoes are out of adjustment or in need of replacement
1oqv7bi,2005 EX-L transmission beginning to fail. 243k miles. How much longer do I have?,,1,1762524130.0,2,MechanicAdvice,1762630414,2025-11-07 14:02:10,2025-11-08 19:33:34,"Budpalumbo (Score: 2): Could be gone by the time you read this, could last until you finally get rid of it."
1oqv2my,Telluride needs a new transmission,"I need advice! I bought a used 2020 Kia Telluride with 77k miles on 10/30. I had done a lot of research on mid sized SUVs and test drove many. I test drove this car and it drove well, so I bought it. I noticed while going on my normal hilly route, it seemed to have a transmission issue. I found out yesterday it needs a new transmission. The transmission fluid was dirty and had metal flakes, almost like the car was never inspected. The dealership has a good reputation otherwise.

Thankfully I bought the extended powertrain warranty from the dealership, it is being covered and the dealership is paying the deductible. They’re also giving me a loaner car to drive while it’s repaired.

My question is, how far do I take this? At the moment I’m really pissed and am tempted for them to take this car back (even though I like it). Do I have them pull their service records to see if they knew about the issue? Do I get a lawyer? Do I make them reimburse me for the price I’m paying for their extended warranty? Or do I just accept their $100s for the deductible and loaner car that I told them I’d be picking up? 
",0,1762523820.0,7,MechanicAdvice,1762630414,2025-11-07 13:57:00,2025-11-08 19:33:34,"Rebeldesuave (Score: 9): The dealer is paying for the repair in full. 
The dealer is paying for your deductible. 
The dealer is providing you a loaner car. 
You cost in this situation is zero.

You have nothing to complain about. 

Anytime anyone buys a used car s@#$ can happen after the purchase. 

With all due respect the dealer is doing you right in this situation

TheBigRobsOddPod (Score: 3): You did “A TON OF RESEARCH”… then bought a fuckin KIA… then you’re shocked it had a powertrain issue? HAAAAAAA, this sub is funny asf

Rebeldesuave (Score: 2): For future reference... 

If you or anyone else buys a Kia they should get an extended powertrain warranty AT A MINIMUM. No matter what model or year. New or used.

Plenty of engine and powertrain issues with these cars."
1oquyvt,Is it “bad” to keep driving 2008 Escape Hybrid if hybrid battery is not keeping charge well?,,1,1762523549.0,3,MechanicAdvice,1762630414,2025-11-07 13:52:29,2025-11-08 19:33:34,"jtg199 (Score: 1): https://preview.redd.it/g0dyl88gs10g1.jpeg?width=4080&format=pjpg&auto=webp&s=d334f482d6b64a5b4f89ca05b2c8fe47e32e4ab2

Here's the DC power supply I used to charge my battery."
1oquwhw,Transverse V6 Tips/Tricks?,"2010 Lincoln MKS 3.7L

Anybody got some tips for working on this godforsaken engine configuration?
Just doing plugs is gonna be a pain in the ass, but I wanted to do my valve cover gaskets and color coat the covers while i’m at it.

I’m curious about the easiest/most efficient way to go about getting to that rear bank.
Obviously, pulling the engine will give me the most room but, as I’m sure you can imagine, i don’t really wanna do that to do fuckin rocker covers.
",1,1762523381.0,5,MechanicAdvice,1762630414,2025-11-07 13:49:41,2025-11-08 19:33:34,"RaccoonOnABender (Score: 2): As a Ford mechanic at a dealership these engines are cake to work on.. that intake is literally just 6-7 bolts after you take the air box piping off it comes right out and then you have access to absolutely everything. Make absolutely sure that when you replace the plugs, put dielectric grease on the coil boots or else when you go to do plugs again in the future it’s likely that the boots will tear and get stuck on the plug then you gotta fish them out and buy new boots and that’s not fun"
1oqutp8,Is this normal?,"2017 Nissan Sentra
I got my motor mounts fixed a month or so ago but my engine is still bouncing around. Is this amount of movement normal? This is me shifting from park to drive to reverse.

Going from a complete stop to acceleration, my gas peddle vibrates bad for a few seconds. Is this because of the movement in my engine or something else?",7,1762523182.0,6,MechanicAdvice,1762630414,2025-11-07 13:46:22,2025-11-08 19:33:34,"chumpyduck000 (Score: 3): Transmission mounts maybe? Get those inspected.

Straight-Refuse-4344 (Score: 1): Looks to be trans mounts"
1oquqy9,207k miles 2010 corolla,"What do you think, are we changing this oil? ",3,1762522983.0,13,MechanicAdvice,1762630414,2025-11-07 13:43:03,2025-11-08 19:33:34,"CrzyScrySpkyHilrius (Score: 5): My thoughts are oil is cheap and a new engine is not. I would change it and the filter given the mileage of the vehicle.

Saroxus (Score: 2): I don’t care the color, 6 months old? Change it. 5k miles on it? Change it."
1oquqli,What preventive maintenance should I do besides regular oil changes?,"I try to keep up with regular oil changes and basics, but what other preventive maintenance should I be doing to avoid big repair bills down the line?",37,1762522959.0,42,MechanicAdvice,1762630414,2025-11-07 13:42:39,2025-11-08 19:33:34,"baljeetd (Score: 30): Everything that's in your service schedule, limited only by your personal preferences.

Unfair-Oven8363 (Score: 27): No one mentioned changing the transmission fluid.  The engine and transmission are some of the most complex/expensive stuff in a car.  Everyone seems to neglect the transmission when I look at old used daily drivers.  The transmission fluid should be changed every 30k or 40k miles depending on the car."
1oquo7l,Drain and fill gear oil?,"09 Toyota Yaris, manual transmission, 230k miles, clutch replaced around 200k. Sometimes when parked out will be hard to shift into first or reverse. Previous owner kept all service receipts, and shops always just noted sealed transmission. Is a drain and fill possible? Is it more likely to help or hurt? Any other suggestions?",1,1762522788.0,3,MechanicAdvice,1762630414,2025-11-07 13:39:48,2025-11-08 19:33:34,"Realistic-March-5679 (Score: 2): A drain and fill is always possible but on a manual isn’t likely your problem. I would check the shift linkage, if a busing has worn or something is rusted it could cause resistance when trying to move the shifter.

softwud (Score: 1): Swap the trans fluid for redline MT 90 gl4 75w

Worked wonders for mine. That vintage Yaris gearbox can get sticky."
1oquo4j,2008 Buick enclave losing transmission fluid,We have a 2008 Buick enclave that is losing transmission fluid. It only happens on long distance drives and took it in yesterday and there are no leaks. The mechanics are baffled and have no idea where it is going. They checked all the rest of the fluids and it isn’t mixing with anything. We did a long drive from Iowa to Kansas in July and after turning off the engine for an hour and getting back on road it wouldn’t shift out of 3rd. Dipstick had no transmission fluid on it and husband put in 3 quarts. We got it home fine and the level hadn’t changed until we did the drive again 2 weeks ago and level was fine when we left but at minimum when we got there. Put a quart in and it’s been full since we got back. There is no residue and the engine and underneath are clean. No dripping or puddles and no leaks when they put it on the lift and ran it. It shows no signs of transmission issues. Anybody have an idea where the transmission fluid is going?  ,1,1762522781.0,3,MechanicAdvice,1762630414,2025-11-07 13:39:41,2025-11-08 19:33:34,auto_medics (Score: 1): Do you notice any smoke?
1oquk4o,Do I need new brakes or rotors?,Had to change a tire that went flat.  Figured would be a good idea to get in there and do anything else before mounting new tire.  Does anything look like it might need replacing? Thanks guys! 🙏 ,77,1762522491.0,79,MechanicAdvice,1762630414,2025-11-07 13:34:51,2025-11-08 19:33:34,"3rdgenerX (Score: 135): No, need to drive it and use the brakes, it’s from sitting, it’s normal

Nearby_Knowledge8014 (Score: 6): Meh.  If it was braking fine before, keep driving."
1oqugjw,Exhaust White smoke (MK6 Golf 2.5l 5cyl engine),"White smoke coming out of exhaust as shown in the video even when revving. Even after engine shutdown, white smoke comes out of the exhaust but goes away after a minute or 2. Its also alittle cold out abt 39F degrees. Is this normal? What could be the cause if this is an issue? ",1,1762522237.0,5,MechanicAdvice,1762630414,2025-11-07 13:30:37,2025-11-08 19:33:34,"TacosPussymancer (Score: 2): Normal

Flat_Structure328 (Score: 2): normal for 39f weather"
1oqtuhs,What is this part and why can't I find it??,"UK Hyundai i30. MY2016

This part is leaking brake fluid at the left side where it connects to the black plastic. It connects via the ABS pump through a flexi hose to this metal part. This part then connects to the slave cylinder plastic connector. 

I cannot, for the life of me, get this metal part. The local parts dealer insists I need to buy a slave cylinder but even online that part doesn't look like it comes with it. 

It appears aluminium, and looks like it has a bleed valve or nipple that's covered. Given the leak I've not messed about with the cover in case I make it worse. 

It's located on the front, right hand side as you look to the front, and the bottom of the engine. This video is from under the car looking up. 

Can someone please help me out and get me a part number so I can replace it and get the car back on the road?",1,1762520637.0,7,MechanicAdvice,1762630414,2025-11-07 13:03:57,2025-11-08 19:33:34,"madmax435 (Score: 1): is this a manual transmission?  looks like a bleeder screw for the clutch slave

Bluetex110 (Score: 1): That's your slave cylinder, i would try to tighten everything before replacing, maybe it works"
1oqtog1,2019 jeep compass sport,"In screen setup, I have it set to display the compass in the top right corner, but I only get those two lines. Has anybody dealt with this or know how to fix it? ",1,1762520187.0,2,MechanicAdvice,1762630414,2025-11-07 12:56:27,2025-11-08 19:33:34,Illustrious_Tea5569 (Score: 1): Pretty common for the compass modules to act up you can try disconnecting the battery for a bit and see if it reinitializes otherwise you have to replace the module in the dash above the passenger side airbag.
1oqthx7,Spark plug color,"How do these spark plugs look like?
Background: I’m getting misfire DTC’s, and there’s black smoke coming out from the exhaust under heavy load. (Alfa Romeo 1.75 tbi)",2,1762519672.0,3,MechanicAdvice,1762630414,2025-11-07 12:47:52,2025-11-08 19:33:34,"Bluetex110 (Score: 2): I would replace them, seems like they have different gap sizes which could probably cause your misfire.

Ales8201 (Score: 1): La candela mi pare che sia particolarmente cotta"
1oqtd7e,Car jerking in traffic,"My car seems to be jerking when I’m in stop and go traffic, doesn’t do it at other times. I think I might need to change the transmission fluid but I’m not sure if I should just take it to the dealer? Last time they had my car for four days with little communication so that gives me anxiety, can I take it to a local shop and have them change it? Does it even need to be changed? I need this car to last me so I need to keep up with anything that needs to be done ",2,1762519321.0,11,MechanicAdvice,1762630414,2025-11-07 12:42:01,2025-11-08 19:33:34,"IllTransporter (Score: 1): Is it a diesel? Notice any rumble or shudder, or  anything when turning the engine off?

ABDuckworth (Score: 1): Is it a hybrid? The car may be switching between battery and engine."
1oqt8qe,My Civic randomly stalled yesterday. The ignition switch also moved positions on its own. What’s happening here?,"Ive got a 2015 Honda Civic with 100k miles. 

Its been having acceleration issues that have been gradually getting worse. I took it into the shop to get the spark plugs and coils replaced about 6 months ago. While they saw that the ends were burned they said even after replacing them they had issues with misfires all day and seemed uncertain about how well they fixed it. Since I was $700 deep at that point, I left it alone. But they did remark to me that they used after market parts and that sometimes cars only get along with OEM items. 

Well the acceleration continued to get worse this month and just now my car started shaking really bad befor e stalling out completely. After it did this, the ignition dropped to the off position on its own. Its very odd. 

Any idea what could be going on? Im trying to figure out how much this is going to set me back. ",1,1762518962.0,2,MechanicAdvice,1762630414,2025-11-07 12:36:02,2025-11-08 19:33:34,"Flat_Structure328 (Score: 1): the ignition probably dropped due to the shaking...

shaking probably a dear cylinder for whatever reason it is dead"
1oqsl9j,drove 60km with fuel door open and fuel cap off,I just drove 60km with my fuel door open and the fuel cap off!  Obviously as soon as i realised i put the cap back on.  I then drove another 100km.  Is there anything i need to be aware of or do to my car?  Is this bad for my car in anyway?  Thanks in advance,1,1762517038.0,10,MechanicAdvice,1762630414,2025-11-07 12:03:58,2025-11-08 19:33:34,"dankmemelawrd (Score: 4): No.

Rough_Community_1439 (Score: 2): Might get a evap code from missing the gas cap. But since you put it back, you should be good."
1oqshqn,Noise when accelerating and shifting,,1,1762516752.0,3,MechanicAdvice,1762630414,2025-11-07 11:59:12,2025-11-08 19:33:34,Merkmane (Score: 1): Posting here as well! Thanks in advance
1oqs9lr,2015 Jeep Grand Cherokee (WK2) - 3.6l - overheating,"I've got a 2015 Jeep Grand Cherokee with the 3.6 Pentastar.  130K Miles.  (I know now, I will never buy Stellantis again.  This thing has seriously had 30K in work in the 50,000 miles since I bought it, most of it paid for by warranty company thankfully.)  I'm not the most experience backyard mechanic, but I'm not a total newb either. I've successfully replaced water pumps for example.  But I'm more familiar with older vehicles and Toyotas, and this one is a new experience for me.

Driving home from work on Wednesday and the car overheated suddenly.  I hadn't seen any previous indication of overheating.  Managed to limp to the next exit, and saw that the coolant was low.  Topped it off, but it was still over-heating, so I burped.  And burped.  And burped.  I have one of those ""spill proof"" burping funnels, and once it got to full temperature the funnel, which is probably at least a half gallon/2 liters, overflowed.  A LOT.  Got more antifreeze, did it again, same result except this time I kept it from overflowing.

Tentatively, I think it's a thermostat, but it could also be head gasket or water pump.  (Obviously, hoping for a thermostat!)  Here's why, can anybody check my thinking?

1. I don't think it's a bubble because I burped the crap out of it.
2. I don't think it's a head gasket because nothing happens until it gets to temperature, and then it starts backflow immediately, oils looks fine, and there aren't really any bubbles to speak of in the fluid (which there would be if there was exhaust gas leaking into fluid in head gasket), and there's no sign of running rough.
3. I tend to suspect that the thermostat is only partially opening, or maybe only opening sometimes, because it works fine until it gets to temperature and then suddenly the funnel starts filling up. It seems to be cyclical, with the backflow lasting maybe 10 seconds out of every 30. That to me is much more consistent with a thermostat than anything else.
4. There's also the question of why I was low on fluid.  Could it be that the thermostat stuck and it backflowed out the overflow tube?

Once I burped it again, I did drive it to the auto parts store and back to get a thermostat, which is about 5 miles.  The temperature was still not acting normal but it did manage to avoid overheating too much.  The gauge on the dash was pretty stable until I got home and revved it to 3000RPM for a couple of minutes, at which point it started to go up.  On the road, it was where I would expect it to be (right below the half mark).  In other words... acting like there was a bubble in the coolant system.

Obviously, a thermostat is 2 bolts and ten minutes and $20.  If it's a head gasket, it's probably totaled unless I do it myself.

Thoughts?  Ideas I haven't thought of?  Any diagnostic steps I should take?  I probably have some version of most any tool you can name or would be happy to buy it if I don't.  (I'm a tool whore, and have no problem buying any tool if I can afford it.)",1,1762516003.0,3,MechanicAdvice,1762630414,2025-11-07 11:46:43,2025-11-08 19:33:34,"whiplash-willie (Score: 2): Water pump gaskets are common failure points on these, causing internal flow issues, but I’m guessing head gasket.  Check your overflow tank to see if it smells like exhaust, and then get one of the color-change block tester kits."
1oqs6tb,How to remove snapped brake disc bolt from the wheel hub,"My Hyundai i30N 2020 2.0L uses two bolts (phillips-ish head) to attach the brake disc to the wheel hub.

One of those bolts snapped off when I was taking off the old disc.

I gave it a couple ugga duggas too many for just how stuck it was in the wheel hub (I tried to unscrew it by hand first, then with a manual impact screwdriver, finally resorting to the impact gun.. 😅).

Fortunately, it didn't deform in any weird way, so I could replace the brake disc. The bolt just turned into an indexing dowel.

However, it makes me cringe on the inside so I want to get that damn thing out of the wheel hub.

I'm essentially a newbie DIY mechanic with minimal tools (jack, impact, wrench/socket sets).

**How could I DIY this?**

The remains of the bolt protrude a bit from the wheel hub, maybe enough to get one nut on, but the end is a bit mangled.

*Apologies for no photos, I didn't think to take any when I had it apart, instead I went to grab a coffee and reconsider my life choices.*",2,1762515744.0,4,MechanicAdvice,1762630414,2025-11-07 11:42:24,2025-11-08 19:33:34,"Big_Introduction3968 (Score: 2): Those screws are for factory installation so the rotor doesn’t fall off on the assembly line. Completely unnecessary after that

Bluetex110 (Score: 1): You can drill it out but I would just cut it and Sand it down😁 you don't need them"
1oqruc6,Mechanic keeps saying they're waiting on a tool to fix my car after being payed.,"About a month and a half ago i got a timing chain job done on an opel corsa for about 1100 euro, when i got it back and the job was paid for there was a check engine light on, when read off the obd reader it said ""cam shaft allignment"". It was brought back to the garage and they said they have to order in a tool to fix it and would call me when they have it, i have called them twice since then and said they are still waiting. Am i being dismissed?",1,1762514592.0,12,MechanicAdvice,1762630414,2025-11-07 11:23:12,2025-11-08 19:33:34,"RudbeckiaIS (Score: 9): Unless you have some weird engine I have never heard about or you live in a country under sanctions this makes no sense: pretty much any (aftermarket) pre-Stellantis GM timing installation tool set can be had in three working days, but usually parts distributors have them in stock and you can have them the next working day. These are not rare or exotic cars, these are common tool sets that garages buy. 

of course if the ordered the tool set straight from Stellantis is another matter completely...

Jeffrey_Leeroy (Score: 4): What reputable mechanic does that job involving the cam shaft and doesn't set the timing?  Maybe he's a little inexperienced with that aspect.  I remember the days with the light gun back in the 80's!  They still use those??  Anyways - ask them what specifically the tool is and just get one yourself off Amazon and give them the receipt so they can pay you back."
1oqrj08,"Passenger side suspension knocking sound over small bumps, is this it?",,2,1762513546.0,2,MechanicAdvice,1762630414,2025-11-07 11:05:46,2025-11-08 19:33:34,"ccarr313 (Score: 1): Probably not. 

I would check the sway links and the struts themselves.

Edit - youve got that rack fully extended to one side. That isn't how it will be when in use, pretty much ever, and forces don't apply to it except from the side. Straighten it out some and see if the play is even on both sides. I suspect your rack is fine. The bushings on it look good as far as I can see. But that is the main thing you would check there. With wheels on the ground, watch the rack bushings as someone turns the wheel to see if they have play. 

I suspect a clunk over bumps is something more direct. Link or strut. Or a rusted out sway bar mount or strut mount, if you're severely cursed."
