id,title,selftext,score,created_utc,num_comments,subreddit,scraping_time_utc,created_datetime_utc,scraping_datetime_utc,top_comments
1mz2e69,Any definite test for cat ?,"Can't find my bluetooth rn (I know, I suck) but throwing codes again after replacing upstream and downstream 02s so.... I'm guessing this means it's time for an aftermarket cat (this car has over 200k on it so really don't want to drop OEM cat money).    Wondering if there's any definitive diags one can do to truly isolate the cat, or is it just a matter of ""we replaced both o2s, it must be the cat"". ",0,1756057876.0,4,CarTalk,1756150330,2025-08-24 17:51:16,2025-08-25 19:32:10,"Equana (Score: 1): Throwing a p0420 or p0430 codes with no other codes after changing the downstream O2 sensors is 90% likely indication of a bad cat. 420 bank 1, 430 bank 2.

cl_solutions (Score: 1): What kind of car? If it's a Toyota, they really like OE, many aftermarket cats just don't work with them.

More than likely it's the cat, with a P0420/P0430 code. You can do a temperature test, should be hotter after the cat than before. If they go bad (not clogged, just not doing the job) then the temperature will be close to the same or a little bit cooler after the cat. 

If your Bluetooth dongle has data, you can watch the data, and the post cat should be a slow switch, where pre cat should be a fast switch. If post is fast switch, then cat is probably bad."
1mz09tq,Distorted windshield glass?,"Watch the white lines.

Bought used, had to scrape off some old tint adhesive reside off the area in question. 

Used windex and a razor blade. 

Did I do this?",1,1756053134.0,20,CarTalk,1756150330,2025-08-24 16:32:14,2025-08-25 19:32:10,"Swamp_Donkey_7 (Score: 25): Common with shitty aftermarket windshields.  

I’ve looked over at cars in traffic and have seen windshields that look like funhouse mirrors with how distorted they are

RideAffectionate518 (Score: 12): ""we were somewhere around Barstow,on the edge of the desert, when the drugs began to take hold.""

acsmith (Score: 6): Southern Utah? 

As to the weird distortion, try isopropyl to get the old adhesive off."
1mz00tw,2011/2012 Jaguar xfr 5l V8 supercharged engine started making this noise,"Today I noticed my car was making a different noise than usually. Both on cold start and warm start. I’m going into the dealership tomorrow, but would appreciate any advice or more understanding of what could be causing this noise. It’s the not so subtle tin type noise. Like something is loose & tapping or something. Not noticed any other changes driving it ",1,1756052567.0,3,CarTalk,1756150330,2025-08-24 16:22:47,2025-08-25 19:32:10,"4TonnesofFury (Score: 2): Timing chains have left the chat, very common for JLR vehicles."
1myzsdc,Car Stereo,"Hi guys, I just a 2014 Ford F-150 and I want to put in a stereo. I have the dash kit but the last thing I need to put it in is wiring harness but I cant find one. The only one I found was in Autozone but the model says it specifically needs to have had a cd. Anyone know anything I can use?",0,1756052042.0,2,CarTalk,1756150330,2025-08-24 16:14:02,2025-08-25 19:32:10,"Equana (Score: 2): Go to Crutchfield.com. If they don't have it, it doesn't exist."
1myzjir,What is this noise?,"There is a squealing noise coming from (I think) the front right side of my car. This noise starts happening after driving my car for a while and braking frequently. So my thought was it was a brake issue and was seizing as they heated up. In the video you can hear the noise stopping and starting. When I brake, the noise stops and when I turn to the left it also stops. 

I brought the car to my mechanic who I told about this issue. He took it apart and said the brakes looked fine (He has not seen the video yet) and didn’t want to just start swapping parts without knowing exactly what the issue was so he just gave it back to me. I’m thinking of just changing the calipers/pads/rotors myself but the mechanic said they looked fine so I’m a bit torn on what to do. 
",1,1756051500.0,3,CarTalk,1756150330,2025-08-24 16:05:00,2025-08-25 19:32:10,MaleficentEscape4275 (Score: 1): It's a brake caliper that remains pinched. He is not releasing the disc enough.
1myyum6,2019 toyota tacoma,"I have a toyota tacoma with about 60k miles, the past few weeks I've had issues starting the truck. It either starts and sounds rough or sometimes its escalted to me having to turn the key and pump the gas to start it.. My friend said I should try fuel injector cleaner to start since its cheap, going forward to check fuel injectors, and fuel pump and filter... Is this accurate? Any other troubleshooting to look at? Also is it awful that im starting it this way in the meantime and driving????? its my only form of transporation..

",1,1756049920.0,4,CarTalk,1756150330,2025-08-24 15:38:40,2025-08-25 19:32:10,"abductee92 (Score: 1): Check spark plugs as well, and how old is your battery?"
1myyfrr,2020 CR-V Hybrid - Do I need to go through Neutral when shifting between Drive and Reverse?,"Hi chat, I drive a 2020 Honda CR-V Hybrid with the push-button shifter (P, R, N, D).   
  
The owner’s manual says to come to a complete stop and press the brake before switching between Drive and Reverse, but it doesn’t mention using Neutral in between.   
  
Here’s where I’m confused: Can I go straight from **D to R (and vice versa)** as long as I’m fully stopped with my foot on the brake, or do I really need to **press N** first?   
  
My dad always gets mad at me if I don’t press **N before going from Park/Reverse** to Drive, but I’m not sure if that’s actually required on this car or if it’s just an old habit. I just want to make sure I’m not doing anything that could hurt the transmission. Thanks!

Shifter looks like this:

https://preview.redd.it/bi6z8tplizkf1.png?width=900&format=png&auto=webp&s=044cb76807c3b60b3c3211b3abc7a1f07aa43e73",2,1756048968.0,6,CarTalk,1756150330,2025-08-24 15:22:48,2025-08-25 19:32:10,"XSrcing (Score: 13): Do not hit neutral when going from reverse to drive, or drive to reverse. It just makes your transmission do more work. It is 100% designed to get between the two seamlessly.

Donny_Z28 (Score: 6): Your dad is out of touch in regards to this

jasonsong86 (Score: 4): No. I have a 21 Passport and it’s the same shifter."
1myy3j3,Need help identifying these running boards.,"Hello everyone,
I was clearing out my storage and found these old running boards I got a few years ago. 
I could never figure out what truck they are for. 
Two sets. 
Anyone have any clue? Pictures attached. 
Thank you in advanced! 
",1,1756048199.0,6,CarTalk,1756150330,2025-08-24 15:09:59,2025-08-25 19:32:10,"Cadet1A (Score: 2): Left and Right. 😅

bbk2229 (Score: 2): I am thinking 1997-2003 3 door f 150 extra cab

e36freak92 (Score: 2): Yep, those are running boards.

Looks like whatever truck they go on only has a rear door on one side"
1myuc09,Water dripping from underneath ford focus,"We're about to drive 300 miles with 2 little children.
It's quite a fast drip that's pooling on the ground. It looks and smells like water and air con was running and engine idling and stationary.
I'm testing again now with Aircon off.
I need to be sure this isn't a problem before setting off!",0,1756038664.0,11,CarTalk,1756150330,2025-08-24 12:31:04,2025-08-25 19:32:10,"Tony-cums (Score: 25): It’s your air con. Seems nobody knows anymore how ac units work.

agravain (Score: 8): Bzzztt...the Automod Air Conditioning Bot has detected you have asked a question concerning the perfectly normal air conditioning condensate that drips out of your vehicle after running the air conditioning. if correct press yes.

daubs1974 (Score: 3): There are two places underneath your car that water drains by design.  One is from the heating and air conditioning drain, which is typically a rubber hose outlet at the firewall on the passenger side of the dashboard. The other is from holes designed into the lowest point of the muffler. My guess is that what you saw pooling is just water and that’s totally fine. That means the system is operating as designed."
1mytslo,How bad is this rust?,"Hey! 
My car started to rust where the engine bay and wheel well meet, kinda hard to explain but video should show. It started because the plastic wall in between chipped off, but I've only had the car for a year and it was already chipped when I bought it. Anyways the rust is making larger and larger holes. Do I need to worry? It's only sheet metal that's being rusted through. How long do I have before I HAVE to so something and has it gone too far to be diy?",0,1756037050.0,12,CarTalk,1756150330,2025-08-24 12:04:10,2025-08-25 19:32:10,"guitars_and_trains (Score: 4): Its pretty far gone already. All you can do is cut it all out and replace the metal.

Abject-Operation8187 (Score: 2): you should honestly do something with it before its to late, next think you know the whole side is rotted out"
1mytd0k,Removing rusted melted calipers off pickup truck,Cannot turn the two main bolts that calipers is joined to carriage im going to use saw to cut it off because new calipers have the frame as well is this okay,1,1756035682.0,1,CarTalk,1756150330,2025-08-24 11:41:22,2025-08-25 19:32:10,NotAPreppie (Score: 1): Alrighty then.
1myqea8,Can someone help me figure out which engine this is?   thank you,"My dad’s 1964 Pontiac Parisienne v8.   
I can’t forget out which v8 it has.  Can someone chime in?",61,1756024984.0,42,CarTalk,1756150330,2025-08-24 08:43:04,2025-08-25 19:32:10,"Dougb442 (Score: 59): Small block Chevy, check the cowl tag for engine code, it will tell you whether it’s the 283 or 327, both essentially the same block and heads.

Orcapa (Score: 20): I thought it was odd that this has a Chevy engine, but then I did a little research and the Parisienne at the time was a Canadian Pontiac, which used Chevy engines.

powerhaulic (Score: 5): Harmonic balancer is too thick for a 283"
1myqbil,What are your guys thoughts on this LOL,,61,1756024695.0,52,CarTalk,1756150330,2025-08-24 08:38:15,2025-08-25 19:32:10,"potato13254 (Score: 25): WHY IS BMW IN EVERYTHING

Capri280 (Score: 76): Better the B48 than the renault engines they're using right now

icemonsoon (Score: 13): Bmw got Toyota to teach them how to build engines and are now cashing in on it"
1mync8c,"Saw the post asking about the Moke yesterday, then today I was walking in town and saw this!","Maybe someone can spot 3 in one place next, lol",13,1756013531.0,2,CarTalk,1756150330,2025-08-24 05:32:11,2025-08-25 19:32:10,"thepukingdwarf (Score: 1): What sort of powerplant do these have? The first time I saw them I really thought it was a golf cart dressed up to look sort of like a jeep

Edit: looked it up for myself and they have both gas and electric version. The electric version will do 45mph top speed and the gas version has a 1.0L w/ 5MT and will do 68mph. Only the electric version is available in the USA apparently"
1mylx8m,What's this piece I melted?,"It is a mazda 3 2015. I was trying to take off a sway bar link but and melted this by accident. It just got disformed so it is still sealed when the hose connects. This is on the passenger rear side. Pretty sure that is an evap hose.

",2,1756008668.0,2,CarTalk,1756150330,2025-08-24 04:11:08,2025-08-25 19:32:10,B4DM4N12Z (Score: 3): Can you take another picture a little further from the part?
1myiwuw,Any tips for getting spiders out of the wing mirrors?,"I’ve got false widow spiders living in the space behind the mirror on my wing mirrors. I’ve tried to get rid of them countless times. 

Any tips to actually send them on their merry way for good? I am terrified of them!",5,1755999089.0,7,CarTalk,1756150330,2025-08-24 01:31:29,2025-08-25 19:32:10,"JungleBoyJeremy (Score: 2): When I’m going to wash my car I spray a spider killing spray in the gap between the mirror and housing. Then I blast it with water before it has a chance to fuck up my paint

jasonsong86 (Score: 1): Power washer.

RLBeau1964 (Score: 1): Being non-venomous, Windex actually chases it out. Keeping an essential oil/ginger solution sprayed in there should prevent reoccurrence. Note, have to keep web cleaned out to prevent spiders from establishing a home."
1myii0k,"My car was working fine except issues with acceleration but always started right up no issues. I noticed Corroded terminals, I cleaned them and now my car won’t start!","Just like in the title I’ve been having issues with my car’s acceleration, I had the spark plugs and my ignition coils replaced. My car worked great for a week then is having the same issue. That was 4 months ago. Today I noticed my car battery terminals were corroded, I removed the battery and cleaned the terminals. I placed the battery exactly how it was, put a small amount of battery lubricant I got from oreilly’s now my car won’t start. My car started fine prior. The lights come on but it seems like it has no juice. I tried giving it a jump with my F350 but nothing changed. Now what do I do?",0,1755997841.0,9,CarTalk,1756150330,2025-08-24 01:10:41,2025-08-25 19:32:10,"zerobomb (Score: 4): Nick the battery cable sheathing on each cable, about a half inch back from the end. If either are green or white powdered, replace.

Summer184 (Score: 3): You should buy a cheap battery/alternator tester, it will tell you if the battery needs to be charged or replaced (depending on how old it is).  Since the issue popped up after you cleaned the battery I'd double check the terminals and battery cables, you may have stripped one of the terminals or pulled something loose

Old-Goat (Score: 2): You need to use that ""battery dressing""  very sparingly. I don't care what the can says, that crap can interfere with the connection.  So maybe clean up the clean up a little bit.  I used to see cars where it looked like people actually dipped the cable ends in  Vaseline. Not a good idea.  A dab will do it..."
1myhgv2,2004 Odyssey Transmission busted,"Is it worth it to replace the transmission? my car has 230k miles and had the transmission replaced at 100k already but it busted again. I really want to keep the car but my dad wants to sell it to buy a used car, the problem is we can only afford something around $5k and all the listings ive seen arent worth it. If anyone can give me advice id really be grateful",1,1755994753.0,10,CarTalk,1756150330,2025-08-24 00:19:13,2025-08-25 19:32:10,"brundmc2k (Score: 2): 2004 is a bad year for those trannys. I’d go for the newer one. Maybe it’s that 2013 your dad found. Shop around you’ll find something good.

britdd (Score: 2): Its a 22yo vehicle with 230k miles. It lived a good life, but unless it's in prestine condition with OCD level maintainance, its ready for the junk yard.

jasonsong86 (Score: 1): Did you do any kind of transmission maintenance with in that 100k miles before the transmission “busted” again? And what is this “busted” mean? What’s it doing?"
1myhg2j,Is this rust repairable? And some other questions.,"I'm looking at this 2002 pathfinder (unibody), this is the worst of the rust. Could I have someone cut out that rust near the bolt (one on the right) and weld in new metal? And if I sanded and repainted the other rust in the picture, would the vehicle be good to go long term?

  
The vehicle is in good shape apart from an O2 sensor. Also are the manual transmissions in these reliable?",0,1755994689.0,2,CarTalk,1756150330,2025-08-24 00:18:09,2025-08-25 19:32:10,"Snazzy21 (Score: 1): I'm very diligent about taking care of rust as it appears, I'm fanatical about it. But I'd rather have a winter vehicle I care less about.

There is no information about these pathfinders. It has a 5spd (if you know the model please say), 216k miles, 4wd, and it needs an O2 sensor. Were these good vehicles and do they have any common issues?

None (Score: 1): [deleted]"
1myh9yc,2008 Ford Mustang Pedals Decide to Not Work,"For starters I myself know barely anything about cars (I’ve just started having to care). Me and my mother are on the way to Nashville, TN as we hit a part of a highway in Dickson, the pedals decide they don’t wanna go or break. My stepdad says this has happened once for him when he got the car. He says it has something to do with the transmission and he does know more about cars than I. So I’m on here asking for reasons why this could’ve happened. The car has no overdrive on it and has no cruise control. But he said to make sure it’s off and to not let off the gas super quick and it wont do it. Anyway, on the way back home from Nashville we got on a safe (fairly enough) back road to test it out to see if we can replicate it (to be able to avoid it easier) but we couldn’t replicate it even once. Any ideas??? ",1,1755994199.0,5,CarTalk,1756150330,2025-08-24 00:09:59,2025-08-25 19:32:10,"themigraineur (Score: 1): Stupid question but are there multiple floormats stacked on the driver's side that the pedals are getting stuck on?

britdd (Score: 1): Trying to replicate mechanical issues on the back roads of TN is the surest way to leave yourself stranded, far from home."
1mzbeay,what’s this noise? started suddenly,2009 Mitsubishi Express Manual Transmisson,3,1756079343.0,6,carquestions,1756150330,2025-08-24 23:49:03,2025-08-25 19:32:10,"Not-A-Throwaway789 (Score: 2): Sounds like a belt/pulley issue but it’s really hard to tell from this video

BigBrainBrad- (Score: 1): Belt/pulley."
1mz9zfm,What’s this squeaky noise when moving slowly? 2002 Toyota Celica vvti,,1,1756075658.0,3,carquestions,1756150330,2025-08-24 22:47:38,2025-08-25 19:32:10,funkystay (Score: 2): Brake wear indicators squeaky. Time to get new pads!
1mz8gr2,strange noise,"the car is a 2019 Toyota Corolla, about 50K miles.

I'm on an onramp at maybe 20 mph, and a knocking sound starts. It sounds like someone smacking a small gavel on the rear driverside roof, or maybe someone rapping with their knuckle. Not metallic, not superfast or slow, not thunderously loud, but quite audible, and irregular not mechanically precise. I speed up to join the interstate, the knocking continues at the same volume and speed. After about a half mile it stops.

I had nothing inside the car to explain it, and nothing hanging out the window, which was closed. I looked at the car today and saw no marks anywhere.

Anyone have an idea what happened?",1,1756071889.0,5,carquestions,1756150330,2025-08-24 21:44:49,2025-08-25 19:32:10,"Jack_Wolfskin19 (Score: 1): Have someone drive the car while you’re in backseat , window down. 
Hang your head out the window and you’ll hear/ see where the noise is coming from. 
Might be a piece of molding that came loose rattling around.

Fantastic_Inside4361 (Score: 1): Sounds like suspension mount issue. Or maybe transmission mounts. Heading down the onramp at a slight angle may apply pressure that occurs at no other time. Straighteng up on tbe higway may remove the harmonix that exaggerated the thump."
1mz76iu,What’s this noise?,I’m wondering what this noise is? Wheel bearing? Brakes? Something else? I’d figure if it was a bearing it would get worse when driving left or right but it sounds this terrible pretty consistently especially at very low speeds like 10-15 mph. You can’t really notice it anymore once you start going typical speeds like 40 or 50 mph. I drive a 2008 charger srt8 ,3,1756068805.0,6,carquestions,1756150330,2025-08-24 20:53:25,2025-08-25 19:32:10,"wildside187 (Score: 1): It sounds like the ware indicator clips on brake pads scraping the rotors.  You might need new brake pads and possibly rotors.  

jasonsong86 (Score: 1): I am gonna guess driveshaft center bearing is bad so it’s scraping on something."
1mz4vn1,My Hyundai Elantra HD SLX 2007 manual transmission has a problem,"when I took this car for a drive it would jerk and lose acceleration for 1-3 seconds before gaining power. 

I have spent $1200 on mobile mechanics to diagnose the problem but it hasn't been fixed.

yesterday while parked in my garage I decide to start the car without driving and attach a obdii scanner 

when I was pressing on the gas pedal I noticed it would do the same thing of having a stalling effect but it doesn't stall. the RPM dropped when I would step on the gas pedal and I'm not sure what this means but it isn't good 

please advise me of any advice. thank you ",0,1756063492.0,8,carquestions,1756150330,2025-08-24 19:24:52,2025-08-25 19:32:10,"OneEpicUserName (Score: 1): https://preview.redd.it/nwghp58or0lf1.jpeg?width=1920&format=pjpg&auto=webp&s=35002e77097054a8d16799a686e009babdb3cdf5

I see your first problem.

diarrhea_planet (Score: 1): please advise me of any advice. thank you

It's THink not Fink.

Untill next time"
1mz2xxb,1994 F150. Worth fixing up or no?,"I've got a '94 F150 that my gf uses as her daily. It's got close to 250k on the original engine and transmission. The truck runs well, but it revs a little high when shifting through gears. It also runs hot on long-ish trips. The radiator and thermostat seem to be good, so I don't know why it gets hot sometimes. When I bought the truck, the coolant was brown, so I changed it and it was fine for a long time. The transmission though, could be nearing the end of its life, and my gf is afraid she'll end up stranded somewhere. We've been debating on putting money into or just getting rid of it.",4,1756059086.0,24,carquestions,1756150330,2025-08-24 18:11:26,2025-08-25 19:32:10,"figsslave (Score: 2): If it’s her daily driver and she drives more than 20k miles a year,I’d replace it. Everything wears out eventually

diarrhea_planet (Score: 1): There's alot of factors to consider. What does the frame look like? How much rust? Do you work on it yourself because replacing parts could be cheaper than a car payment."
1myx977,What could be causing featuring on the tyres - front axle?,,0,1756046243.0,4,carquestions,1756150330,2025-08-24 14:37:23,2025-08-25 19:32:10,"jasonsong86 (Score: 1): Feathering in what direction? Saw-tooth wear is normal. It’s from tire rotating.

https://preview.redd.it/qbtg6hk3izkf1.jpeg?width=368&format=pjpg&auto=webp&s=4ed220c1a164916f5a050a8635c23cae92ba7f6d"
1myk50u,What's the worst financial mistake you've ever considered for a car?,"I swear, the love for cars is a constant battle between my heart and my wallet. I'll be scrolling through Craigslist or Facebook Marketplace, see a rusty but promising project, and the fantasy of getting it on the road takes over. Then reality hits and I remember my bank account is in a different universe.​Take, for instance, the notorious Maserati Biturbo. Beautiful on the outside, but an absolute nightmare under the hood with its twin-turbo V6 that loves to fail. It is a classic example of a ""car guy"" project where you see it for sale, think ""I can fix it,"" and then realize you are signedup for a lifetime of expensive headaches.​Who else feels this pain? What is the biggest ""lemon"" you have ever been tempted to buy?",5,1756002859.0,18,automotive,1756150330,2025-08-24 02:34:19,2025-08-25 19:32:10,"imgurcaptainclutch (Score: 1): Any Toyota with a rotten frame. Nothing you can do short of frame swapping

esuranme (Score: 1): I full well knew what I was in for and still bought a W8 Passat.

No_Mathematician3158 (Score: 1): Jeeps"
1myjwkr,"What's the one car you have always wanted to drive, and why?","I'm curious to hear what you all think. We all have that one car whether it's a hypercar, a classic muscle car, a rare JDM legend, or something completely off the wall.​What's your ultimate dream drive, and what's the story behind it? I'll start for me, it's a '69 Ford Mustang Boss 429. The raw power and iconic look are just unbeatable.",4,1756002134.0,22,automotive,1756150330,2025-08-24 02:22:14,2025-08-25 19:32:10,"zylpher (Score: 2): A Viper. Sorta kinda thought about buying one a few years ago. But it wouldn't have made a good Daily. And that's what I needed at the time.  

I've always wanted to drive one. Outside a video game. I just love the raw power these cars have.

imgurcaptainclutch (Score: 1): 70 series Land Cruiser down the Panamerican Highway. Deadhorse to Ushuaia

e-hud (Score: 1): McLaren F1, because 3 seat center driver..."
1mz0zja,2016 Nissan Frontier Not Starting,"I bought my truck in good condition last April and was really happy with it. I ended up using it more than expected when my 2010 Sentra started having trouble, and now suddenly the truck won't start. 

I have at least a quarter tank of gas, and my battery has enough charge to run the A/C and radio, but the engine isn't turning over at all. When I turn the key I only hear clicking, and the gauges on my dash begin jittering before settling down. Last oil change was a couple weeks ago.",1,1756054768.0,2,CarHelp,1756150330,2025-08-24 16:59:28,2025-08-25 19:32:10,"Gunner_862 (Score: 1): Hi,

It sounds like it could still be a discharged battery. I would try attempting to jump/boost the battery before attempting to start the engine. If it cranks over and starts, make sure to place the battery on a charger, as running the engine is usually not enough to recharge a weak battery.

 Also check to see if any inside/outside lights were left on accidentally. It is worth making sure that the alternator is charging the battery. 13.6V - 14.2V is normal output from the alternator. Anything less may cause the battery to drain over time. Hope this helps!"
