id,title,selftext,score,created_utc,num_comments,subreddit,scraping_time_utc,created_datetime_utc,scraping_datetime_utc,top_comments
1o6wrrr,98 wrangler died as I backed out now won't start,"Thoughts here? Video is of me trying to start the Jeep after it died. Wrangler has been driving just fine. Tonight i started it up like normal and as I backed out of the driveway and cut the wheel to the left like normal (sharp turn into the service alley), it just died. Tried to start it again and the starter seems normal/strong but the engine won't turn over.
Swapped the fuel pump relay out with a working one (horn and fuel pump use the same relay) and got the same thing (and the horn worked fine). 
What do I look at next, or thoughts based on the video? 
I'm a decently inclined mechanical guy, but don't know a lot about troubleshooting this. (Am reading up now but Reddit is usually light years better than googling anything these days).
Appreciate you, Reddit!",6,1760488549.0,20,AutoMechanics,1760643270,2025-10-15 00:35:49,2025-10-16 19:34:30,"HEXC_PNG (Score: 2): Sounds like fuel or spark. Have you tested fuel pressure or did you just throw a pump at it?

scuzzy987 (Score: 2): My first thought is fuel pump or distributer pickup coil. Crank it a few seconds and push on the Schrader valve on the fuel line to see if gas squirts out. Not sure if 98 has a distributor pickup coil like my 97 but that was the problem when mine had exact same symptoms. Could be coil too, check that by pulling a plug and have someone watch for spark while it's cranking over

Botto71 (Score: 1): 6 cylinder ( which I forgot to mention)"
1o7rbke,Are Jags really as unreliable as people make out?,"I’m asking specifically as I’m thinking of buying a used XF. Around 2012, probably with about 80k miles on it. Is this a terrible idea? ",1,1760572539.0,29,CartalkUK,1760643270,2025-10-15 23:55:39,2025-10-16 19:34:30,"adjective-nounOne234 (Score: 28): Is it a 2.0 Ingenium engine? If so, yes

Active_Outside (Score: 8): My current Jag has been one of my most reliable cars I’ve ever owned, my last car was a Porsche which was much, much worse. 

With modern cars, they are all reliable, until they are not. It’s luck of the draw imo.

ierrdunno (Score: 6): A lot of commentators haven’t read your post and just spouted the usual crap. Yes the ingenium engine was very bad and should be avoided but that wasn’t used until around 2016(?) in the XE originally. So with a 2012 engine it’s a different engine. I think you will be fine but at 80k timing chain not likely to have been done. I have a 2015 XF 2.2d sportbrake with about 115k mostly motorway in UK and France. Regular servicing and not missed a beat. Love it."
1o7poyl,Question,"I sold my car today, however I don't have the V5 as I'm waiting on it as I changed back to my original plates. 

They guy has bank transferred me the money, no issues. I gave him the keys and he has driven away. He said that when the V5 arrives, to forward it to him so he can sort the rest out. 

Noobie question here so apologies if it's stupid, should I be concerned or is there anything I need to do with the v5 before I post it on to him?

Many thanks",0,1760568425.0,3,CartalkUK,1760643270,2025-10-15 22:47:05,2025-10-16 19:34:30,"WeaponsGradeWeasel (Score: 10): Don't post him the v5. 

Do the transfer online and post the new keeper slip only.

Away_Associate4589 (Score: 5): As the other person has said, don't post him the V5, feel free to post the new keepers slip if you like.

Transferring a V5 is pretty straightforward, just head here:

https://www.gov.uk/sold-bought-vehicle

You just need the name and address of the new keeper, the reg number and the reference number on the V5. Takes all of two minutes to do.

no73 (Score: 1): Hope you got him to fill out a bill of sale and took down his name and address.




As it stands, the car is still your responsibility as you let him take it without transferring responsibility via the V5, and he could be driving round racking up tickets and fines left and right, and they'll all come back on you as the car is still in your name. You're also doing yourself out of a refund on whatever road tax remains on the car. 




If anything lands on your doormat in the coming weeks, unless you have proof to show who you sold the car to and when, you'll have a fun time fighting those off. 




Absolutely do not send him the whole V5, all he has to do is 'lose' it and all of these problems remain yours. Transfer the ownership online and send him the new keeper slip.  "
1o7pngd,Any views on a stage 2 upgraded Seat Leon Cupra 300 Estate?,,0,1760568323.0,8,CartalkUK,1760643270,2025-10-15 22:45:23,2025-10-16 19:34:30,"Doubleday5000 (Score: 6): Only that ""Stage 2"" has not agreed definition. Find out exactly what has been done and by whom.

Avionykx (Score: 3): I think that, generally, in my experience, anything that's listed as ""Stage"" anything has normally not been worked on properly.

There are far too many variables and unknown factors. Unless it came with an absolute stack of receipts from a reputable engineering company that shows the details of what was done I'd probably walk away.  
I've seen lots of cars listed as ""Stage"" something and then just had a bunch of eBay parts receipts and then a dyno tune, which left a lot of questions unanswered.

MrNezzy (Score: 2): Far too vague of a question do you want to elaborate at all?"
1o7pmkb,I'm in the market looking at a Stage 2 Revo modified car - does anyone know if I would be able to drive the car in Europe?,Revo stage 2 performance package ,0,1760568263.0,1,CartalkUK,1760643270,2025-10-15 22:44:23,2025-10-16 19:34:30,"BraveDude8_1 (Score: 2): Why do you think it'd be an issue? Has someone indicated it would be? Not an attack, just curious.

As long as it has a valid MOT in the UK it's legal to drive in Europe on a temporary basis as a tourist, and as long as it's not visibly defective enough to get pulled over for basic roadworthiness issues there'd be no reason for it to even come up.

I've seen UK drivers bring far worse to Germany than a Seat with a tune and an intake."
1o7ovib,Waze distance before speed cameras,"Has anyone else noticed that Waze now seems to wait until you're at most 300 yards from a camera before sounding an audible alert? I'm sure it used to be significantly further. 

I'm going to be real with you guys here and admit that I'm one of those guys in a big German V8 barrelling down the motorway around 120 and have been for 15 years, with only 3 points and 2 speed awareness courses (both for motorway about 7 years apart) and I genuinely don't think I can slow down in the time Waze allows now. 

It used to be way longer I'm sure, at least half a mile. 

Anyone got any recommendations, I've got a full Sygic subscription which works ok and seems to do ok on the cameras but can't quite beat the community of Waze.

Also I know some of you think speeding is wrong but this topic is specifically to discuss commonly used apps and products to avoid speed cameras so please save your comments for elsewhere. ",0,1760566352.0,11,CartalkUK,1760643270,2025-10-15 22:12:32,2025-10-16 19:34:30,"WeaponsGradeWeasel (Score: 9): If you can't slow down in 300 yards maybe you're going too fast?

ComparisonExpert2657 (Score: 9): Don't drive like a c*nt!

TrafficWeasel (Score: 2): 160 is mental, even on an empty motorway. You’re asking for trouble if you get caught going anywhere near that speed. 

You’ve got a higher risk tolerance than me, that’s for sure."
1o7olkw,Best brake disc brand for VW Golf Mk5?,"Just bought a Mk5 Golf 1.6L a few weeks ago and my brakes are squealing with longer stopping distances. Looks like it’s time to replace the discs and pads.

Which brands do you recommend for reliable, long-lasting discs for everyday driving? I’ve seen Zimmermann, ATE, Brembo, Bosch, any personal experience or advice would be great.

Also, is it safe to buy these parts from Autodoc, or should I stick to a local retailer like eurocarparts?

Thanks in advance!
",1,1760565644.0,3,CartalkUK,1760643270,2025-10-15 22:00:44,2025-10-16 19:34:30,"None (Score: 2): [removed]

Common_Turnover9226 (Score: 1): I always try to go with one of the big brands for almost any parts, or brands that supply manufacturers with original parts to begin with. 


Just had discs and pads all round earlier this year, all Bosch parts via Autodoc. "
1o7o7s0,What’s the legal requirement and can it be turned off permanently?,"It’s not a legal requirement on the A Class I’ve driven so can’t work out BMW’s claim here. What’s the requirement??

Also, I can turn off each drive but is there a hack to disable it?",0,1760564708.0,27,CartalkUK,1760643270,2025-10-15 21:45:08,2025-10-16 19:34:30,"oktimeforplanz (Score: 17): The ""legal requirement"" that it's referring to is that safety features like this reset to a default state of being on for ""safety reasons"". Euro NCAP etc will mark a car down if this doesn't happen. I believe it's also required for newer cars under GSR2 in the EU (but I am not 100% on that). It doesn't mean you're obligated to keep it switched on.

verone3784 (Score: 6): The UK partially adopted the EU's GSR2 Legislation when Brexit was finalized, but it's still currently a murky area that's really loosely covered under the Automated Vehicles Act (2024) and the eariler version from 2022.

The GSR2 is technically in force, but the UK's law overrides it and the Automated Vehicles Act in its current form doesn't outright stipulate that ADAS are a legal requirement in new cars.

So basically to cover their arses, pretty much every manufacturer is just selling cars with EU spec safety systems, which means all ADAS features are hard coded to switch on every time the car is started.

In some models you can set up driver profiles which will turn the features you want on or off with the push of a single button, but at this stage pretty much every manufacturer has them programmed to reset and turn on the next time the car is powered on, so it means using the button every time the car is started. They can't be permanently turned off.

Since Brexit there are a lot of weird legal quirks like this all over the place where post-Brexit UK legislation hasn't caught up to EU directives, so most companies are just following the latest version of whatever law covers their arses the most.

I'd imagine that UK law on ADAS will fall in line with the rest of the EU in the next few years, more than likely.

flobanob (Score: 8): There is likely some 12yo with a laptop that can. I'm about to look for someone to disable the lane detection shite on mine. 

I'm sick of being told how to drive by anything that isn't my wife! And that's saying something."
1o7nr5l,Changing Pads and Discs on a Q5 but I am stuck,"I have a 2010 Q5 2.0 TDI. I figured I would save some money and do the front pads myself. It's not a big job and I am fine doing this on my other smaller car. For the life of me though I cannot get the caliper back on with these pads on. The caliper is TRW and the discs are 320mm. I tried first of all with the existing discs.. couldn't get it back together. I saw the discs were lipped around the edged so probably needed a replacement which I then did but with the new discs.. exact same problem.

I get the pads in the caliper, piston completely withdrawn slip the caliper and pads over the disc but I am about 3mm off on the inward direction from being able to get the caliper back over its mounting points. Is this a normal issue or am I being an idiot in some way?

Worth mentioning too that this isn't a piston issue, there is plenty of room between the pad and the disc on the piston side of the caliper. The far side has no piston - just caliper against bracket - but it doesn't seem to have enough room to fit around the disc. I did search for thinner pads but every one I found was 18.9mm, which seems the standard for these calipers.

These are the pads and discs:

[Eicher-Prm Brake Pads 101444239 | Halfords UK](https://www.halfords.com/motoring/car-parts/brakes/brake-pads/eicher-prm-brake-pads-101444239-20270038000030.html)

[Eicher-Prm Brake Discs 104442089 | Halfords UK](https://www.halfords.com/motoring/car-parts/brakes/brake-discs/eicher-prm-brake-discs-104442089-20258007000030.html)

It's dark out so no pictures.",1,1760563610.0,2,CartalkUK,1760643270,2025-10-15 21:26:50,2025-10-16 19:34:30,"BosssNasss (Score: 1): It's possible the eicher pads and discs might be the issue. They are relatively low quality parts, and I've had to grind backing plates on brand new pads in the past for them to fit correctly. It's the same story with the ""brembo"" discs and pads that eurocarparts sell. They are technically genuine brembo, but they are just rebrands of the eicher parts under licence.

If you can I'd consider returning the discs and pads and trying a different brand. 3mm on 1 side sounds a bit too excessive to start grinding off.

Pagid are the better option if going for ECP or similar (the halfords parts you've ordered come from ECP).

Apprehensive_Shoe_39 (Score: 1): I'm not really following (pics may help) but if you've got plenty of clearance on one side but not the other then you just need to slide the caliper over, no?

I (not a mechanic) have done loads of brake changes on my A4's of that era (so almost definately the same brakes) and every time the tolerances are tight, but do-able. As the other poster says the most common problem is that the ""ears"" of the pads are too wide to fit into the carrier and need to be ground down.

If this is the problem then yes, the pads can stick out too much and prevent installation. ~~If you aren't sure then remove the anti-squeal shims and try that. If they fit fine without the shims then that's the problem. Regardless, if they need a lot of force to install into the carrier (due to the tolerances being too tight) then you'd be wise to grind them back regardless. They'll only get tighter over time until they potentially become stuck. Been there, done that.~~

~~Aside from that maybe check all the shims are correctly installed, free from corrosion and not bent or deformed. They are fragile and can be distorted if you aren't careful. ECP sell the shims.~~

Actually, think only the rears have shims."
1o7n60f,Admiral littlebox insurance,Hey everyone ive been insured with admiral for about 2 months now with a littlebox but have no way of checking my score and i dont recieve any emails regarding my blackbox results. Is this normal?,0,1760562234.0,1,CartalkUK,1760643270,2025-10-15 21:03:54,2025-10-16 19:34:30,Obese_Hooters (Score: 1): have you contacted admiral in this 2 monts? If not I suggest you do.
1o7msl6,Anyone remember this 'Austin Montego' song?,"Someone I know used to sing it to his mate who had a Montego. He said he heard it on Top Gear or another programme. The lyrics are something like this (to the tune of 'Ego' by the Saturdays):

The head gasket's done as far as it goes

He drives a rusty old Austin Montego

When everyone's gone and you are by yourself

You know that you're gonna call the AA for help

You'd be better off in a Yugo

He drives a rusty old Austin Montego",1,1760561393.0,4,CartalkUK,1760643270,2025-10-15 20:49:53,2025-10-16 19:34:30,"nosajn (Score: 2): Not familiar with this one, but I can recommend a relevant song by John Shuttleworth - Y Reg. 


I believe he sold his Ambassador earlier this year! "
1o7m86n,Where can I store cars permanently? Like some sort of self storage but for cars.,Any recommendations? ,0,1760560111.0,16,CartalkUK,1760643270,2025-10-15 20:28:31,2025-10-16 19:34:30,"PhoneFresh7595 (Score: 4): You can store in self storage, but that can be expensive.
A friend put his old cars in a tent to over winter

Free_PalletLine (Score: 3): you can rent private or council garages, self storage or dedicated car storage companies exist. Some companies even offer servicing and MoT's as well as keeping it on a battery tender and take it a drive now and then to keep it alive. My brother stored his old evo in a converted barn owned by one such company but it cost something like £100+ a week.

AccousticAnomaly (Score: 2): Indoors, not in a lot."
1o7lylm,SORNing vehicle - cancel insurance or keep it?,"Hi all, was just wondering what the most efficient thing to do in my situation. I'm a named driver on another vehicle, and I am a policyholder on another (a summer car, but it's the 1st time I am the main policyholder so I don't have any NCD). It's about time she goes away for the winter so I am going to SORN her.

I was wondering whether it would be worthwhile keeping the insurance going (it was £350 for the year) or whether to cancel it (refund would be £135, as admiral take £60 as a fee).

As far as I can tell, they don't offer a ""laid up"" option that I could change the policy to or anything like that, otherwise that would have been the best option.

So I think my only options are £135 cash, or keep the insurance going and start building the no claims discount, essentially costing me £135 for one year of NCD - I do know that the NCD isn't really impactful though, I checked a few times on different vehicles and 10 years NCD made a very small difference if any. On top of course if you do ever have to claim, you lose it, so I don't really think it's worth building the NCD in this costly way.

What do you guys advise, please? Any of you with a summer car, how do you handle this?

Thank you!",0,1760559501.0,7,CartalkUK,1760643270,2025-10-15 20:18:21,2025-10-16 19:34:30,"Chimp3h (Score: 1): Afaik you need to keep the vehicle insured while it’s SORN or it wouldn’t be insured in case of a breakin or theft

Famous_Tie8714 (Score: 1): I keep mine insured and taxed all year even though it's off the road for several months in the winter.  It's safer in case anything happens to it while I'm not using, it keeps the no claims running, and if we get a random few days of really nice weather I can take it out if I want to without a load of faffing around."
1o7ls1z,What thing are essential to keep in your car?,"Firstly, thanks to everyone who gave advice about what to look for when buying my first car!

I'm buying my first car next week and I'm trying to compile a list of other things I want to source for the car to keep in there, like essential repair things like spare tire, jack, jump cables etc etc. as well as other things that I want to have in the car like a first aid kit, blanket and water bottle for emergencies, dashcam for help with insurance/accidents.

Would appreciate any advice folks have! I'm especially interesetd in trying to distinguish between which things are absolutely essential to have in the car at all times, vs what things are helpful but can wait to go on my Christmas list.

Thank you! :)",16,1760559091.0,59,CartalkUK,1760643270,2025-10-15 20:11:31,2025-10-16 19:34:30,"BosssNasss (Score: 18): I've got a full workshop of tools and extensive experience working on cars and bikes. There's realistically no need to go overboard as you don't need it all.

I'd recommend:

1, Breakdown cover  
2. Mobile Phone  
3. Wallet

4. Spare wheel (a space saver is acceptable).  
5. Air compressor  
6. 1/2"" drive breaker bar (24"" long) and a 1/2"" drive socket of the correct size for your wheel nuts/bolts.  
7. A jack. The rubbish scissor jacks the car comes with is suitable for an emergency.  
8. Possibly a jumper pack/or long jump leads.

I'd also recommend that you get rid of any locking wheel nuts/bolts your car comes with and replace with the standard hex bolts/nuts. It's worth practicing changing a wheel too so you know what you're doing. It's not recommended to learn at the side of a potentially busy road.

If it snows then a small shovel is worthwhile. Toolstation do a nice one.

I pretty much only carry a 1/2"" breaker bar, socket, spare wheel, and air compressor. The exception is if I'm travelling long distances on a tight schedule to an event I can't miss.

MyKidsFoundMyOldUser (Score: 7): Ice scraper. It's getting colder and you're going to need it soon. And when you need it, you want it to hand so put it in your car.

Then when the spring comes around, leave it in your car.  Because when winter comes around again and you get the first icy morning, you will know where it is.

Duckdivejim (Score: 6): Hi Viz of some description is a good idea. I like a jacket but a £3.50 vest from Wicks will do.

Jumpstarter air compressor (£40-£60 off Amazon) most have a light as well and can act as phone chargers. 

Tools for changing a tyre. I have a big half inch ratchet. A wheel bolt set (£10 off eBay). Also important to have a spare.

I also have a folding axle stand. Don’t like them but better than nothing in an emergency and leaving the car only supported by a scissor jack.

A bottle jack as a back up to the crappy scissor jack.

These are a bit unnecessary but it came in handy the other day so I’m quite pleased with myself.

Edit just wanted to add a bootliner. Not an emergency item but it stops your boot getting marked up and scratched. Also useful if you fold your seats down to transport things you can use it to cover the back of the seats to protect the upholstery."
1o7kvdt,Will high rev motorway driving help to re-gen a petrol GPF?,"Had an engine light on today, diagnostic comes up with a p246300 fault code which says the GPF is blocked. 

With a diesel, blasting it on the motorway would sometimes help. 

Any tricks for a GPF on a Mercedes C200? ",4,1760557008.0,27,CartalkUK,1760643270,2025-10-15 19:36:48,2025-10-16 19:34:30,"Bongo2296 (Score: 9): Have a read about how a GPF regens, seems like they work a bit differently.

In the manual for my Skoda it says the regen happens when you get up to a decent speed and then come off throttle. Sort of after the engine has done some work but is then running lean whilst decelerating.

JensonCat (Score: 6): When I had to ""regen"" my gpfs normal high speed driving wouldn't do it. I needed to keep it in manual, accelerate to high revs then let off the throttle and let the overrun clean them out. That's the recommended method for petrol. 

Should clear out fairly quickly too.

WonderfulCamera5043 (Score: 7): Theoretically yes as it’s supposed to be triggered by heat"
1o7kjjk,Tesla wanting to change steering column.,"I recently (now 33 days ago) purchased a 2019 M3SR+ from a dealer in the uk.

At low speeds I am experiencing a creak/squeak from the steering wheel. I took this into be looked at by Tesla (I am having an issue with water ingress resolved at the same time.)

Tesla have reported the following and stated they would need to replace the full steering column as they do not replace parts of the column.

The dealership are refusing to have this rectified as the car is driving and isn't a ""required repair"" in their opinion.

Is this something anyone has had any experience with this, would know if this is going to cause bigger issues in the future and if they believe the dealer should rectify this under CRA?

Thanks",0,1760556245.0,3,CartalkUK,1760643270,2025-10-15 19:24:05,2025-10-16 19:34:30,"MrReadilyUnready (Score: 10): Needs to be rectified under CRA. If they refuse to repair it due to cost, then they should refund you and take the car back.

Startinezzz (Score: 4): Yeah they have two choices here - authorise the repair or you return the vehicle. They aren’t gonna outrank Tesla’s own diagnosis and the CRA 2015 is on your side.

Flowa-Powa (Score: 2): If the rubbers are visible when lying in the footwell, then spray them with teflon lube. Works on other cars"
1o7kijw,Anyone one here own a Maserati Levante?,"Used around 2020 seems alot of car for the money.

Potentially big bills, yes but if you want a nice car, just got to suck it up, right?",3,1760556183.0,36,CartalkUK,1760643270,2025-10-15 19:23:03,2025-10-16 19:34:30,"A_Bulky_boi (Score: 62): Someone’s gonna recommend you a Mazda  MX-5 or a Skoda Octavia and say it’s just as much fun.

Project40cars (Score: 7): I don’t own one, but I like them, especially in 3.8 GTS or trofeo versions. They are a good looking car and even the v6 petrol goes well.

cv_ham (Score: 5): I drove one and to me the interior felt cheap."
1o7kfsd,Should I buy this Cat S Suzuki 23 plate?,"Help me out!

my car has recently been written off and i’m looking for a new one. I found a Suzuki swift 23 plate (automatic) for around £8k. 

it has been repaired by the dealer but not sure whether i should consider it.

any advice?",0,1760556012.0,5,CartalkUK,1760643270,2025-10-15 19:20:12,2025-10-16 19:34:30,"tryM3B1tch (Score: 7): Does the dealer have a good record of it repairing things well? If they did everything properly, no bodges and all alignments checked, I'd consider it. But for 8k you can grab a non crash damaged albeit slightly older swift if you're unsure about a cat s car

Seymourdough (Score: 3): Short answer, Avoid! 

Im assuming you’re not mechanically minded so you wont know the full extent of the damage, what standard it’s been repaired to, if genuine parts have been used etc etc it’s not worth the risk.

Famous_Tie8714 (Score: 3): It might be fine, or it might be very much not fine and you may not find out until it's too late.  It will also be much harder to sell in the future."
