id,title,selftext,score,created_utc,num_comments,subreddit,scraping_time_utc,created_datetime_utc,scraping_datetime_utc,top_comments
1n4gbaf,Car has an oil leak …,"It is labor day weekend in the States & my regular mechanic won’t be open until Tuesday , does Firestone check & repair oil leaks ? ",1,1756598198.0,8,MechanicAdvice,1756668666,2025-08-30 23:56:38,2025-08-31 19:31:06,"davenobody (Score: 1): How big of a leak?  Is the dipstick dry?

Why would you use Firestone if you have a trusted mechanic?  Wait for the mechanic you trust to be available.  Your car and wallet will thank you for your patience.

lethalnd12345 (Score: 1): Slide some cardboard under the car and wait for your normal mechanic"
1n4g6vb,"Does this coolant hose appear to be where a leak may be occurring? (2010 BMW X3, N52 Engine)","I'm currently diagnosing a coolant leak for the first time and watching some videos for coolant leaks on the N52 engine, and this hose was mentioned as a potential source. I'm not sure what a properly working hose would look like exactly, but those bent rings (o-rings? not sure what it is exactly) appears bad to me. I have attached a photo of the other side of the hose, which in my opinion seems fine most likely.

I've seen pressure testers be used for diagnosing coolant leaks, but I don't have such a tool to use for testing and even after running my car for about 20 minutes with a drive to build pressure, I couldn't get the leak to happen again in that time.

I will continue with checking other potential leak sources, like the coolant tank or such, but I'm thinking this may be the leak source.


This car is a 2010 BMW X3 with an N52 engine.

Thanks!",1,1756597827.0,2,MechanicAdvice,1756668666,2025-08-30 23:50:27,2025-08-31 19:31:06,"Galopigos (Score: 2): Doesn't look like there is a leak there. The ""bent rings"" are the retainer clips. They are spring loaded and go through the fitting to lock in on the fitting. For a pressure tester, go to a parts store and get one of the loaner tools. Fill the system and pump it up to about 15-20 psi and see where it starts leaking. Another option is to add some UV dye to the system, then drive it around a couple days and then go hunting for the dye and the leak."
1n4g1dj,Sump leaking?,"Had an oil leak fixed about a month ago for £420 - they replaced the oil sump which they said was rusted and refilled the oil. Didn’t drive it for a few weeks and just noticed the leak continuing over the bank holiday, except this time it’s dripping from multiple places and not just leaving one puddle like before.

I’ve emailed them twice a few days apart asking if they could recheck it and they’ve not replied - as it was so expensive just for a sump replacement do I have any rights for them to have to fix it properly with no extra charges? Also nearing 100,000 miles on the gauge so worried it’s something more serious now too.",2,1756597372.0,4,MechanicAdvice,1756668666,2025-08-30 23:42:52,2025-08-31 19:31:06,"240x6 (Score: 3): definitely go back there and tell them what happened- they should definitely take a look at least for free. technically you don’t really have a right for a no charge service, but depending on how they are they’ll most likely either notice something they did wrong or say it’s something else unrelated. from what it looks it seems like it’s your drain plug that’s leaking- or possibly a faulty gasket/seal.

animationpals (Score: 1): 2013 Fiat 500!"
1n4fyf9,Engine seize - 2014 Hyundai Tucson,"2014 Tucson, 130k miles. Had just topped off oil (half quart) and it was on the interstate. Unfortunately my 18yo daughter was driving it so my questions to her weren’t fruitful but she said there was no loud noise just died, she was able to coast to the shoulder. I was following the car and noticed a small puff of white-ish smoke from under the car (not exhaust) a few seconds before the event, but it was quick and only one.
Would not crank after it got towed home.
Oil and coolant were full and fine. No overheat. I removed belt and crankshaft would not turn either direction. All accessories turn fine. I then removed plugs to rule out hydrolock, they were clean and still could not manually turn. Removed valve cover, timing chain seems fine and has tension. Nothing abnormal under the valve cover. 
My son had been driving it before this and he mentioned some slight persistent clicking in the days before (thanks for telling me kid).
So clearly it’s seized but I have no idea why or how. Are there any known failure modes of this engine like this? Is it dead for good, like junkyard or sell for parts dead?",1,1756597133.0,7,MechanicAdvice,1756668666,2025-08-30 23:38:53,2025-08-31 19:31:06,"heyu526 (Score: 1): That ticking sound might be a clue.  I’d be inclined to remove the timing chain cover and have a look.  I had a similar problem where a timing chain guide broke and wedged between the case and chain.

Humorouscrustacean (Score: 1): Is it the 2.4L theta II engine?

If so there's lots of reading available for what could have gone wrong with your engine."
1n4fx38,Why would my car be running like this?,"1991 Toyota Corolla 4AFE engine. Has been running like this for a while now. Light pops, smells like gas, but drives fine and still gets decent gas mileage. Just don’t know what this is and I’m getting concerned ",1,1756597024.0,4,MechanicAdvice,1756668666,2025-08-30 23:37:04,2025-08-31 19:31:06,Educational_Fig_2864 (Score: 2): It thinks its a gsxr 1000
1n4fvue,Is it Normal for a new serpentine install to sound like this?,,5,1756596918.0,12,MechanicAdvice,1756668666,2025-08-30 23:35:18,2025-08-31 19:31:06,"sabre420z (Score: 8): Not normal. Take the belt off and spin all the pulleys and see which one is making the noise.

patico_cr (Score: 5): That's not the sound of the belt. Any other pulley is about to kick the bucket."
1n4fo2a,Trying to figure out my electrical gremlin on my 04 Mazda 3s 2.3L,"So I feel like a lot has been out of wack with my car but I’ll start with the basics. It’s an 2004 Mazda 3s Hatchback 2.3L with 182,000miles. Just recently I was told my taillights weren’t working in which I tied it to my instrument cluster just not picking up I have my headlights on. With these vehicles it’s illuminates a light and dims the screen a bit because it’s in “night mode” but often times while I’m driving at night this doesn’t always dim or give me the “light” indicator. Ive checked the fuses with a multimeter out of the fuse box and changed them anyways even though the multimeter was beeping. The fuses I changed were both the Left and Right Taillights and also the one for the instrument cluster and shift lock. I knocked them out because they are cheap even though it didn’t fix my problem. Time to time my radio also likes to cut off out of no where, casually driving(no extra electrical input), when I’m turning my steering wheel, rolling windows down. I’ve had a previous cheap 2 Din stereo in there when I bought the car and it would NEVER stay on I’d see it flash on every now and then but always dead silence. I’ve installed a new Sony Ax3700 in which turns off quite often and sometimes not at all. ANOTHER thing is my shift lock barely works; I usually have to stick something in there. Only time it seems to not do it is when it’s first thing in the morning and turning my car on, and sometimes I don’t need to stick anything in there at all. With all this being said I’m not sure what’s going on and why it’s happening. I’ve thought possibly the BCM but I’d like to see what you guys have to say.",2,1756596298.0,3,MechanicAdvice,1756668666,2025-08-30 23:24:58,2025-08-31 19:31:06,"waynep712222 (Score: 1): https://i.redd.it/192cdpta3zdf1.jpeg starting point of every electrical diagnosis..

 why.. your multiple descriptions of stuff failing requires it.."
1n4fm7t,2019 Honda Civic. My rear bearing is basically welded on and it’s impossible to get off in order to replace I need help.,,2,1756596146.0,23,MechanicAdvice,1756668666,2025-08-30 23:22:26,2025-08-31 19:31:06,"kyden (Score: 4): Slide hammer. Heat.

mosesenjoyer (Score: 3): Hit it with your purse"
1n4flwo,Issue with 2003 Accord 2.4,,1,1756596119.0,3,MechanicAdvice,1756668666,2025-08-30 23:21:59,2025-08-31 19:31:06,"Vhs120lp (Score: 1): 19510-RTB-000


Coolant bypass pipe or coolant heater pipe.  It's not aluminum, and it's quite a pain to repair"
1n4fccp,Stuck valve stems,"I ran into stack valve stems on my car, I decided to put these aluminum stems on my car while living in MN. I’ve tried heat, pliers, socket and it won’t budge. I’ve been grinding it a bit but am nervous to go further. Do I go any further or think of other options?",1,1756595380.0,5,MechanicAdvice,1756668666,2025-08-30 23:09:40,2025-08-31 19:31:06,"ilikepotatoes888 (Score: 1): Soak in some corrosion X or similar quality penetrant, worst case you may need to have the stems replaced (can likely order and perform self if possible/able, will not require fully removing tire, break bead, just ensure no leaks on finish)

BobbyWizzard (Score: 1): Oh my"
1n4fb26,2021 Crosstrek Battery Issue??,"Hello, 

Going to keep this as simple as possible because I don’t know shit about cars.

My problem: About 12 days ago, my car randomly died while it was parked at work, the physical lock is barely functional so i couldnt open it or pop the hood. A few days later I went to go figure it out on the weekend, luckily the lock worked and I got in the car, popped the hood and was gonna jump it. I literally touched the battery with my hand and my car turned back on and I drove it home, had no changes in sounds or function etc. 

The next day, at home, same deal, my car died again, couldnt get in with the lock. 

Now today (a week later of sitting in my parking lot) It was working fine again. I think it’s a parasitic draw or an alternator issue. Does anyone have a fuckin clue??

RELEVANT INFO:

Subaru Crosstrek 2021

The built in subaru eyesight thing is barely working, often beeping on and off over and over.

The autoplay on the radio doesnt work consistently, like it doesnt always connect to my phone with the wire

75k miles

Last oil change about 20k miles ago

Bought it used, had to replace the battery a year ago

Had some stalling issues, and some starting issues since before the replacement and since then. I turn off the start-stop feature almost every ride.

I definitely idle with the car a good amount with it on, I eat in my car when im out so probably a few hours per week.

Have not gotten any diagnostic done with a mechanic

I did change the headlights a few months ago. 
",1,1756595283.0,3,MechanicAdvice,1756668666,2025-08-30 23:08:03,2025-08-31 19:31:06,keyflusher (Score: 1): Clean and tighten the connection of the battery cables to the battery posts.
1n4f37o,Cut Headlight Wire,"someone cut the wires on my drivers side headlight for 2016 Nissan Altima, any advice on how to fix?",2,1756594682.0,2,MechanicAdvice,1756668666,2025-08-30 22:58:02,2025-08-31 19:31:06,"TurkishSwag (Score: 1): You can buy the necessary pigtails and splice them in, if you don’t know what any of that means, bring it to someone who does."
1n4f22d,How much does the order of connections matter on negative terminals of semi-truck batteries in parallel?,"Pic of the setup. My instinct and quick google leads me to think that the negative should enter at the top left battery’s terminal and go through each battery in a straight shot. When I pointed this out to my not-in-a-good-mood-today dad, he replied “it’s just the Ground”. 

Am I overthinking things and the difference between this setup and a”proper” one is negligible, or should it really be corrected and have all those Negatives be consecutive like the Positives?

*Edit: For what it’s worth, this is on a 2007 International semi*

*Edit 2: I may have drawn an extra positive wire going off to the left to the engine while drawing from memory. It’s the situation with the Negatives that I’m questioning with this post.*",0,1756594586.0,10,MechanicAdvice,1756668666,2025-08-30 22:56:26,2025-08-31 19:31:06,"throfofnir (Score: 4): It's electrically irrelevant, so long as your connections and wire sizes are appropriate.

But also, where's that second positive lead going? You only need one going to load.

WarChallenger (Score: 3): Each one negative should be going to the frame.  The frame is the lowest resistance wire you’re ever going to get.

But general rule aside, do you have access to the vehicle’s service info?  It should have a diagram."
1n4eyyb,Literally what,I just did some bigger repairs on this car and got it back from the dealership so they could program a new pcm and now this is happening lol I’m going crazy,6,1756594341.0,12,MechanicAdvice,1756668666,2025-08-30 22:52:21,2025-08-31 19:31:06,"YzanA95 (Score: 8): Your engine is burning oil

Super-Ad-7098 (Score: 4): Go and tell them they probably overfilled the oil cuz that can happen in just a tech at walmart so don’t take that for granted."
1n4evxt,Can't put my car in park but every other gear is fine...,,1,1756594110.0,2,MechanicAdvice,1756668666,2025-08-30 22:48:30,2025-08-31 19:31:06,"Daohaus (Score: 0): I pulled up to Costco not too long ago in my LX470, tried to put it into park and i thought it was but i couldn’t take my keys out. Could not figure out why. When i finally looked down i noticed my phone’s charging cord was blocking the shifter from going all the way forward toin order for me to remove my key and put it into park. See if anything is in the way of your gear selector or if you can look at your shift linkage to see if anything’s obstructing it from going into park"
1n4eoj3,2013 impala makes weird ticking noise when door is opened,"I’m currently the high bidder on a 2013 impala. The listing says it makes a weird ticking noise when started. My assumption was the blend door was binding up but I was able to get some audio of it and the ticking started just from opening the drivers side door. Now im just really confused as to what might be causing it. Any ideas? 
vin 2G1WD5E33D1257882
",0,1756593535.0,12,MechanicAdvice,1756668666,2025-08-30 22:38:55,2025-08-31 19:31:06,"graal_10 (Score: 2): Sounds like a blend door.

Kronic_Repulse1 (Score: 2): It’s the blend door motor in the dash. Super common on this car."
1n4emxa,2008 Dodge Ram Making Strange Noises?,"my trucks at 250,000 miles and it’s been sitting and when i started it, it made this strange sound… is time to replace the ol’ hemi?",1,1756593412.0,2,MechanicAdvice,1756668666,2025-08-30 22:36:52,2025-08-31 19:31:06,"arizonafleshraisin (Score: 1): Take that belt off and start it again, see if its not an accessory first."
1n4ehun,Swaybar Link removal help,"Hey guys. Working on my 2015 Mazda 3. I noticed my swaybar link needed to be replaced. Problem is everything is so rustwelded together that when trying to remove the i stripped the 5mm hex thats inside the bolt. As you can see from the photos, what are my options to get this sway bar link off. 

Appreciate any insight. Thanks guys!",1,1756593012.0,2,MechanicAdvice,1756668666,2025-08-30 22:30:12,2025-08-31 19:31:06,Bantha_Fodder12 (Score: 1): Cut it off. Or use vice grips on the back and an impact on the nut
1n4ed65,MAF sensor cooked?,Recently got a check engine light and received an air fuel mix code. Pulled the MAF and it looks like this. Is it cooked?,1,1756592645.0,2,MechanicAdvice,1756668666,2025-08-30 22:24:05,2025-08-31 19:31:06,"waynep712222 (Score: 2): with SOME Scan tools.. you can get into live data mode.. set the scan tool to metric display first.. 

 get into the live data for the MAF sensor.. then get into the Graph.. 

 you should see 3 to 6 grams at idle.. and progressively more as you increase the engine speed."
1n4e40n,2020 Mazda cx5 loud ticking noise,How far do I need to tear down to find the source of this ticking noise?,1,1756591953.0,3,MechanicAdvice,1756668666,2025-08-30 22:12:33,2025-08-31 19:31:06,"2smart4u (Score: 1): Don't tear anything down, get an automotive stethoscope and try to pinpoint where it's at. I'm assuming it wasn't this loud before, maybe your oil level is low?  Other common cause of ticking is an exhaust leak which you can usually hear when you cold start the engine it would kind of roar.

EarthToBird (Score: 1): Skyactivs are known for loud ticking. They're high compression, direct injection plus all the emissions valves which tick."
1n4dzzl,emergency help please,"2005 toyota corolla ce. i drove it this morning it was running just fine. going on vacation very soon. replaced serpentine belt and tensioner. all of a sudden when i start it my 3rd cylinder is misfiring. p0303. i diagnosed the coil pack, spark plug, and injector by moving them to another cylinder individually and driving until code pops again. still cylinder 3. i dont have a spark tester so i just put the spark plug into the coil pack out of the cylinder and held it while the car was started and turned off and i got spark... what could it be??",1,1756591659.0,7,MechanicAdvice,1756668666,2025-08-30 22:07:39,2025-08-31 19:31:06,"Greenlight0321 (Score: 1): Low fuel pressure or a vacuum leak.

Are you sure you didn't accidentally create a vacuum leak while changing the belt?"
1n4dv2a,Car shows low range despite good Avg. MPG,"2010 Hyundai Santa Fe which I started driving recently. Dashboard says that full tank range is 260 miles, while Avg. MPG is 25 MPG (after resetting it and driving for 50 miles, the old Avg MPG was 17, as I assume that the car was idling a lot at the dealer).

Is this of any concern, or should the range go up as I drive it more, and it records better MPG?",1,1756591284.0,4,MechanicAdvice,1756668666,2025-08-30 22:01:24,2025-08-31 19:31:06,"Ambitious_Cook_3987 (Score: 1): It will adjust to your driving habits

Mikey3800 (Score: 1): How big is the fuel tank? That will determine your range at a specific mpg."
1n4dtf7,Can this boot be un-creased?,2013 Audi a7 tie rod boot. Bent it up getting the arm bolt in. Should I do something to fix it? Thanks,1,1756591177.0,4,MechanicAdvice,1756668666,2025-08-30 21:59:37,2025-08-31 19:31:06,"lethalnd12345 (Score: 2): It's probably fine

DevNov (Score: 1): It'll be fine as long as you don't have a tear, I replaced my lower control arms on my Allroad recently. Those bolts can be a pain in the ass. You can rotate the steering wheel to get a better angle to remove that bolt or install it. Also lithium grease on the boot to help it slide under"
1n4dsbt,Engine check light?,"Hi! My car's engine check light is on basically all the time when i park flat but as soon as i park at an incline i turns off?

I googled and it said it might be the EVAP system but i have no clue what that is and yeah, just wanted to check if its something i can fix myself or if i need to let a professional help!

I need to inspect my car in about 2 months or else its illegal to drive it lol

My car is an Hyundai Santa Fe V6 2,7 2003 if anyone's wondering",1,1756591100.0,3,MechanicAdvice,1756668666,2025-08-30 21:58:20,2025-08-31 19:31:06,keyflusher (Score: 1): No one here can tell you. Go get the stored code(s) read and let us know what they are. A very basic code reader that can do that costs like $15 in the US. Or find a place that will do it for you.
1n4dnnx,What piece in the control arm area am I looking at?,"Changed my front struts/suspensions today and I was looking at what I should be looking to replace next. This piece looks very worn out but I’m not sure what it’s called to start looking into repair costs.
Thanks for the advice!",2,1756590749.0,10,MechanicAdvice,1756668666,2025-08-30 21:52:29,2025-08-31 19:31:06,"alienassassin12 (Score: 11): Controle arm bushing just replace the whole controle arm and you might as well do both.

benr37 (Score: 4): lower control arm bushings. they are definitely shot but you need a press to install new ones. what i would do is buy a pair of new control arm assemblies and just put them on both sides as they’re more than likely both shot."
1n4dni6,"Car sat for a while, tried jump starting, but stalls after one second","My 2008 Ford Taurus sel had sat in my apartment complex waiting to get breaks. 

Our friend was able to get us break pads, and they offered to help. We also just moved out of that apartment complex and now must move it before it gets towed. The car was obviously dead, we had started it like twice in the past year, bad mistake to not just disconnect the battery, I don't think my boyfriend knew to do that, and I just assumed idk. 

In the times we started it, it took awhile for the car to start, but once started the alternator was able to keep it going. Drive it around the block just to try and charge the battery. Died right after the car is off, so I know the battery is just toast

Today we had put jumper cables on the car, it was getting jumped by an old versa, so I just assumed after a while we could get a little power. Maybe 20-30 minutes later we tried to start with no power whatsoever. Our jump cables are old so we hoped maybe another set would start, and we asked someone nearby if they had any. They brought their jumper battery thing, and after a while my boyfriend started it, where it started, but after a second stalled. 

I'm assuming a complete dead battery that just can't hold any power, or at least hope that's the case. 

What options do I have? If I need a new battery where can I find the cheapest one, currently homeless waiting to go back to work for the college here after summer break.what are the odds the car has something else major going on?


",1,1756590740.0,3,MechanicAdvice,1756668666,2025-08-30 21:52:20,2025-08-31 19:31:06,"ariararar (Score: 1): Update: we finally got the car started. Keeping it connected to another car by cables. If the car has started it's being powered by the alternator correct? So driving it to where we need to is possible? We need to somehow get this thing across town to where we can keep it for the time being


Front breaks are bad, front driver is scraping the rotor. I understand we need a tow, but not even close to being an option. How dangerous is driving it from with these problems? Obviously going back roads, taking it slow and breaking early and lightly. 

We just really need to go before we get a huge tow feel. Feel like this is our option but super scared of safety

Smiles_Per_Mile (Score: 1): It really just sounds like your battery is bad, to be honest. Once you replace it with a new one you should be good to go. Walmart is probably the cheapest place you can get a battery. 


As far as the brakes, I would advise against driving it anywhere. I can’t determine the extent of their condition from your post, but it’s not hard to go from an easy maintenance procedure to a hefty repair bill when it comes to brakes."
1n4dghk,Why would my fuel trims read -100 while monitoring but show up in freeze frame data? I’m thinking bad O2 sensors?,,1,1756590233.0,8,MechanicAdvice,1756668666,2025-08-30 21:43:53,2025-08-31 19:31:06,"2smart4u (Score: 3): Never underestimate the ability of the app developer to fuck up a calculation.  It seems like a math-related error, considering they're all working in freeze frames but specifically at -100%.  Deductive logic alone says the sensors work if you're getting values.

TwistedKestrel (Score: 1): What vehicle is it? Some cars, especially older ones, can give wacky OBD2 data unless you're using their exact super special favourite scanner"
1n4ddwi,Sprayed turbo cleaner into throttle body on my 2007 VW Jetta 2.5 — did I just ruin my engine?,,0,1756590039.0,4,MechanicAdvice,1756668666,2025-08-30 21:40:39,2025-08-31 19:31:06,JoeyBagADonuts27 (Score: 1): No
1n4dc3z,Knocking sound from bell housing,"So it’s a 1995 Volvo 960 manual. I’ve replaced the trans,clutch,pressure plate,trow out bearing and slavcylindee but the problem persists, semi slow knocking. What could be the cause?",1,1756589905.0,6,MechanicAdvice,1756668666,2025-08-30 21:38:25,2025-08-31 19:31:06,General_Doctor8802 (Score: 1): Does it have a dual mass flywheel
1n4db3m,Transmission Fluid Boiling?,"Just drove past up a mountain to a ski resort for a summer activity. It’s hot - 90+ degrees. I noticed quite a bit of red fluid leaking from near my front passenger. Popped the hood, and the fluid in here was BOILING and leaking out of the silver cap. How serious is this? My plan is to let the car cool down and coast down in low gear. Of course, I’d check the fluid level first.",0,1756589832.0,10,MechanicAdvice,1756668666,2025-08-30 21:37:12,2025-08-31 19:31:06,"blur911sc (Score: 4): Engine coolant, not transmission fluid.   Don't remove the cap until it's cooled down significantly or it'll boil over violently

Ravenblack67 (Score: 4): That is your coolant overflow container."
1n4d1dl,Tie rods “torn”,"I brought my 2016 Hyundai Santa Fe Sport in and the service advisor said that my tie rods need to be replaced because they’re “torn”. In the video the mechanic said they’re pinched. Quoted me at $1,450. Does that price seem a bit high?",5,1756589131.0,28,MechanicAdvice,1756668666,2025-08-30 21:25:31,2025-08-31 19:31:06,"mlw35405 (Score: 49): That's not a tie rod that's a sway bar link. Tie rods are the things with the red line painted on them .

fluffynerfherder78 (Score: 15): Get your car from that mechanic and drive it home. That guy showed you sway bar end links. And to me they look fine. Didn't even try and show the tie rods."
1n4ctcd,"Dropped a socket into my oil pan 2006 jeep 3.7, what do I do","Dropped a socket into my oil
Pan while trying to replace the timing chain of the 2006 jeep liberty 3.7L 

DO I NEED TO DROP TJE OIL PAN OR WHAT DO I EVEN DO",436,1756588546.0,276,MechanicAdvice,1756668666,2025-08-30 21:15:46,2025-08-31 19:31:06,"yeetlol (Score: 735): Drop the pan.

Additional_Gur7978 (Score: 81): Go magnet fishing"
