id,title,selftext,score,created_utc,num_comments,subreddit,scraping_time_utc,created_datetime_utc,scraping_datetime_utc,top_comments
1mypkif,2005 Nissan Navara 2.5L coolant or gasket issue,"Hello Reddit. After some advice on a Navara coolant or gasket issue please.

About 1.5 months ago, my 2005 Nissan Navara 2.5L (diesel, right-hand drive, single-cab) was showing hot on the guage. There were no visible leaks so I topped up the coolant and everything was good.

It recently showed hot again, but this time I could see coolant leaking. There was some dripping coming from the metal block that the bottom radiator hose plugs into. There is also some minor pooling higher up on the engine. (In the pictures)

I took it to a mechanic who said it was a head gasket issue. He doesn't have the time to fix it, so I thought I'd check Reddit's opinion before taking it elsewhere. 

Some other info - It still runs cool when topped up. The coolant and engine oil are not milky. There is no white smoke when starting or running. There is no bubbling out the radiator cap when running.

Not keen on spending big money if I don't need to, so please let me know if I need to start weeping. 

Thank you

",2,1756021790.0,4,AskMechanics,1756150330,2025-08-24 07:49:50,2025-08-25 19:32:10,"Fieroboom (Score: 1): That looks more like connection housing gaskets to me...


About how low does the coolant get when it starts registering hot?
Like how much do you usually need to add when that happens?

Striking_Brick4025 (Score: 1): More info: When the engine gets to normal operating temp, the bottom radiator hose is still cold. The heater still blows warm though.

Similar thing happened the first time I had to top it up, but was resolved by squeezing the hose with the cap off. The squeezing isn't making a difference this time."
1mypd6q,Lower Control Arm Snapped,,2,1756021001.0,4,AskMechanics,1756150330,2025-08-24 07:36:41,2025-08-25 19:32:10,"ChrisShiherlis- (Score: 1): Bro I'm trying to figure out the car but it looks like the Batmobile

Fieroboom (Score: 1): Correct.


It snapped. 💯"
1mypasb,Tool insurance,"Do you guys have your tools insured? If so, what kind of insurance is it? Ive been in the field about 3 years now and have spent $8,000+ on tools so far plus $1,500 on a box and i was just thinking if they were stolen or the shop burned down i wouldnt be able to replace them all quickly. ",2,1756020740.0,2,AskMechanics,1756150330,2025-08-24 07:32:20,2025-08-25 19:32:10,Negative_space__ (Score: 2): The shop has insurance
1myox71,On this episode of will I explode,I'm a DIY guy planning on using an angle grinder with a sanding attachment on a rusty kei truck that has it's gas tank right under the truck bed. Will I be safe from spontaneous combustion or should I go to monotonous sanding by hand?,16,1756019315.0,10,AskMechanics,1756150330,2025-08-24 07:08:35,2025-08-25 19:32:10,"rddtlcksdrtybtthls (Score: 3): Heh. Gonna go boom.

Tbh tho, I mounted a circular saw blade to an angle grinder one time... Lol

CounterSilly3999 (Score: 3): You can try to fill the tank with water or exhaust gases. But better by hand and not with a wired brush."
1myoox0,Is this normal?,,1,1756018456.0,11,AskMechanics,1756150330,2025-08-24 06:54:16,2025-08-25 19:32:10,"WWBully_1592 (Score: 2): A vacuum is a space where the air pressure is significantly lower than the Earth's normal atmospheric pressure, or a region that is essentially devoid of matter.

ChrisShiherlis- (Score: 3): it is normal for Redditors to think an Intake adds Horsepower, Yes."
1myogms,How bad is it? How much cost repair estimate?,,3,1756017618.0,7,AskMechanics,1756150330,2025-08-24 06:40:18,2025-08-25 19:32:10,"ChrisShiherlis- (Score: 3): about Tree Fiddy

Seriously OP ... you have wrong sub

try r/Autobody

Jazzlike_Wind_1 (Score: 1): Wrong sub but you're lucky the damage is only on one panel. If it's gone through the clear coat and paint the only actual way to fix it is to sand and repaint the whole door panel, which is probably (realistically, definitely) at least a few hundred bucks. Might be cheaper to throw a new door on it, or just ignore it up to you.

Give it a wipe down with a damp microfiber cloth to get a better idea of the damage btw"
1mynuim,2018 Jeep Wrangler JL Sahara Snapped Manifold Bolt,"I snapped the intake manifold mounting bolt on the passenger side while replacing spark plugs, will this be okay to drive around until replaced? There is still 7 of the 8 bolts holding it down I would assume it would be fine.",3,1756015349.0,3,AskMechanics,1756150330,2025-08-24 06:02:29,2025-08-25 19:32:10,"Fieroboom (Score: 1): If that's on the gasket mating surface, you will likely start getting lean condition codes, or at least really high fuel trims...

justinh2 (Score: 1): I know it's not a big deal, but I still sort of gawk at that backwards alternator."
1mynore,Neighbor put power steering fluid in brake system.,"Hello, my neighbor accidentally put power steering fluid in his brake system 3 months ago. He only brought this up now because recently his truck (2007 duramax 2500 i think?) was acting funny and he thought he had seized calipers.

We went on a test drive today and 5-10 min in the truck started vibrating like it had really badly warped rotors which im assuming was the seized calipers. After we were done, we checked the wheels and they were really hot with smoke coming out too, so probably the calipers seized during the drive?

I read up some posts about this and it seems like an expensive mistake, is ANYTHING salvagable? If not what needs to be replaced/done.",3,1756014777.0,45,AskMechanics,1756150330,2025-08-24 05:52:57,2025-08-25 19:32:10,"Trackmaggot (Score: 24): My ex-wife did that to a car she had, it required complete replacement of hoses and seals in the brake system, from the master cylinder to the calipers.

Patrol-007 (Score: 10): Everything that the fluid touched, especially if all the seals are damaged 

Google:

Putting power steering fluid into a brake system is a serious mistake that can lead to brake failure. Power steering fluid is oil-based and can cause rubber seals and other components in the brake system to swell and degrade, leading to leaks and potentially catastrophic brake failure. If this has happened, do not drive the vehicle and seek professional help immediately."
1mynjzn,2003 honda crv transmission issues,"I'll start by saying i feel defeated.  My sons car was a project (all stock) we put together. We put a rebuilt engine in it an a junk yard transmission.  Well the transmission didn't last long before it wouldn't move in any gear.  We decided to have the transmission rebuilt and just finished the install today. We have the exact same symptoms as before.  No go forward and no go backwards. 

I prefilled the TTC with about 1.5 quarts. Made  sure the TC was seated properly. Added 5 quarts before initial start up. It did kind of try to move under its own power but that was short lived.  I tested all the solenoids with a bidirectional scan tool and every one of them clicked so I at least know that the ECM is working. I have not taken the off to verify operation.  I even disconnected the cooler lines and blew air through the cooler to make sure it wasn't clogged.  

Any troubleshooting advice would be greatful. The guy that did the rebuild came highly recommended.  I have tried to reach out to him but he's not open until Monday.   I have a feeling he will not be super helpful so I want to come to him showing I've tried to resolve the issue. 

TIA",2,1756014301.0,8,AskMechanics,1756150330,2025-08-24 05:45:01,2025-08-25 19:32:10,"Fieroboom (Score: 1): That transmission should have pressure test ports for each clutch.


You'll need the correct pressure gauge, but it'll tell you more about what's happening & whether it might be a hydraulic or electrical issue."
1mync73,family of mice in blower,wondering if it’s just me or if this is an issue everywhere. have any other mechanics/ techs had to pull literal spun mice out of blower motors? non disturbing but exemplifying photo for reference ,22,1756013527.0,10,AskMechanics,1756150330,2025-08-24 05:32:07,2025-08-25 19:32:10,"-NOT_A_MECHANIC- (Score: 2): The worse the engine bay smells when you open the hood, the higher the odds..Seen a skeleton in the blower. Seen plenty of pancaked desiccated ones, particularly on skid plates/sandwiched by radiator/condenser.

uhmmmmplants (Score: 2): *sigh* I miss my miatas lol"
1mymr41,Pvt. McWrenchy reporting for duty!,"Someone asked if wearing the ASE badge was pretentious earlier…

in search of skit ideas for my new cartoon character 🤣",0,1756011487.0,2,AskMechanics,1756150330,2025-08-24 04:58:07,2025-08-25 19:32:10,"Fieroboom (Score: 1): Ah yes, the infamous Strap-On brand... 👀🤣"
1mymkvi,2008 Silverado weird noice,"Shocker!! My 2008 Chevy Silverado is making a weird noise. Haha I wouldn’t be so chipper if it were my daily. Anyways…

I drove my truck and when I put my foot on the gas (aka rev it up a bit even in park) it makes a weird whirring noise. When I parked the ol girl for the night I tried turning my wheels and it would make a similar noise. I know the belt needs to be changed,I’ve been pushing it off for obvious reasons as it’s not my daily, but I’m not sure what would be the problem. I appreciate any input anyone can provide as it’s a Saturday night.

Thanks

-blacksmith",2,1756010888.0,2,AskMechanics,1756150330,2025-08-24 04:48:08,2025-08-25 19:32:10,Fieroboom (Score: 1): Check your power steering fluid level & make sure there aren't any leaks in the system.
1mymgv4,Electric work,I was thinking Abt trading for a 1995 2dr civic hatch then I got messaged this (picture). Do you think it's an easy fix?,2,1756010510.0,2,AskMechanics,1756150330,2025-08-24 04:41:50,2025-08-25 19:32:10,"Fieroboom (Score: 1): That year should be a pretty simple setup of temp sensor switch -> relay -> fan, so I don't think it would be that difficult, but I don't know what your electrical skill level is..."
1mymecp,Can anyone tell me what this means?,"So my 2009 Toyota Prius started to slow down on my fiancé as he drove onto the interstate the other day and he pulled over and was stuck on the side of the road. We had it towed back home- Long story short, I thought it was the inverter coolant pump, replaced all of that, flushed the coolant and replaced it and the engine would kick on, sound like it ramped up on its own- no response from me pressing the gas pedal- and then shut off and not turn back on. So we’re back to square one and out $140 so far. We borrowed our neighbors OBD reader and here are some codes that popped up. If anyone could help me figure out what this means that would be amazing. ",2,1756010279.0,9,AskMechanics,1756150330,2025-08-24 04:37:59,2025-08-25 19:32:10,"LiqdPT (Score: 7): That's not codes. That's just the emission monitor readiness.

Fieroboom (Score: 2): Yeah, that parts cannon gets expensive pretty quickly... 😳


That screen is just the I/M Readiness screen, not fault codes. If you plug it back in & find the codes, we can help point you in the right direction.


The codes will look like ""P0171 - System too lean bank 1"" or something along those lines."
1mym7a5,Blown motor in a 328i,I have a 2014 328i needs new motor I have a rebuilt 2jz gte with transmission can I drop that or would it be easier to buy new bmw motor what do you guys recommend ,1,1756009619.0,6,AskMechanics,1756150330,2025-08-24 04:26:59,2025-08-25 19:32:10,"ChrisShiherlis- (Score: 1): BMW's  and German Cars in general are very Difficult to work on OP.

They are very well designed but not friendly to Mechanics... I don't think you would have much luck doing it yourself."
1mym03n,Advise needed,My Kia rio 2016 got hydrolocked and my connecting rod and cylinder head got damaged. I got it fixed. However it is making weird noise. Is it ok? ,3,1756008937.0,11,AskMechanics,1756150330,2025-08-24 04:15:37,2025-08-25 19:32:10,"ChrisShiherlis- (Score: 1): check your repair OP

aquapura89 (Score: 1): How did it get hydrolocked? Bad injector dumping fuel?"
1mylo4h,Tried AC recharge because ac was blowing hot and found out it was very overfilled. Could this be why the AC isn’t working?,I recently bought a car that had an AC that was blowing hot. I figured it needed a recharge so i bought a kit today and upon putting the hose on I noticed it was extremely overfilled already. What should I do next? Will letting out some refrigerant actually cause it work better?,0,1756007836.0,13,AskMechanics,1756150330,2025-08-24 03:57:16,2025-08-25 19:32:10,"samdtho (Score: 6): Yeah. Refrigeration systems work on very specific pressures and temperatures. Too much refrigerant, and your pressures are too high where it shouldn’t be, which means no room for evaporation.

Don’t vent it to atmosphere, however, you need to recover it properly.

Realistic-March-5679 (Score: 4): Do not let some refrigerant out, that is illegal and bad for the environment. Not to mention you can hurt yourself with how cold the gas is when it expands. Bring it to a shop and have it properly evacuated and filled by weight, that’s how the system is supposed to be filled. Over charging can prevent the refrigerant from going from a liquid to a gas which is part of how it can cool so well. And if liquid refrigerant gets to the compressor you can have compressor knock or even hydrolock the compressor causing damage."
1mylnja,Misfires at idle,"I have a 07 yukon with the 5.3 vortec with 176k miles on it, and she has run perfectly for the 60k miles I have had her. Recently, I’ve been noticing some missing at idle. No codes on the dash. OBDII reader picks up 2-4 misfires on cylinders 1,2,6,8 only at idle. 0 Misfires when I’m moving. Also sometimes takes a few extra seconds to crank, and that is becoming more consistent. Rarely, I notice it revving a bit and rpms going up around 500 or so when I’m not accelerating, and usually when I’m coming to a stop. I suspected a vacuum leak, but the fuel trim readings seem to be normal (fluctuating between -75 to 4.5). I’m hoping it’s just spark plugs or coils, but I’m concerned about it being multiple cylinders. I plan on swapping them to see if misfires follow but I wanted to get some ideas first.",1,1756007781.0,4,AskMechanics,1756150330,2025-08-24 03:56:21,2025-08-25 19:32:10,"Responsible_Gas_4060 (Score: 1): Don't forget to do a compression test.And get a scope to look at them cylinder walls,could be internal... Be safe,work safe and have a blessed day🕎🙏🏾

Far_Eggplant_6416 (Score: 1): Check for broken exhaust manifold bolts, very common on Ls engines and can cause misfires."
1mylmqi,Starter Problem?,"Currently driving a Honda Civic 2012 automatic, recently whenever I’ve started the car there would be a weird jump and kind of a grind before it starts. There’s still a cranking feel to it but it’s been worrying me. I finally got a video of it which I’m planning to show my mechanic since the last time I brought it in, it started fine the few times he did it. Does anyone have insight on what the problem could be? 

This would happen on a cold start and happens once in a while. ",1,1756007707.0,2,AskMechanics,1756150330,2025-08-24 03:55:07,2025-08-25 19:32:10,Responsible_Gas_4060 (Score: 1): Tune up time 👍👍
1myllwg,You ever just want to toss a match at a car and watch it burn?,"My kid drives a 2007 Nissan Altima 3.5L V6. His power steering went out. So YouTube said it was easy. An hour maybe 2 and I’ll be good to go. Apparently they don’t have this engine because you can’t fit 2 fingers in these holes let alone your hand. Can’t see a dang thing, everything had to be done by feel or a prayer. I felt like Stevie Wonder working on a car. I looked at the main high pressure line said thank goodness I don’t need to replace that. That fucker was a rusted piece of trash but wasn’t leaking. So I said screw it replaced the pump and a couple easier to reach hoses. A day later I get the dang thing finished and wouldn’t you know it. That piece of shit hose is leaking like a  faucet. So here I go trying to do what I’m pretty sure is an impossible task. Fish this dang tetanus infested metal tubing under and over than back under every fucking wire and hose on this car. Chunks falling off in my eyes, gravel in my ass crack and severe road rash from doing the worm under the car over and over again because apparently my tools have legs and walk away from me. I’m pretty sure I passed out a few times because I watched the sun come up this morning and when I emerged from hell today I didn’t see any sun. It was so dark out I was pretty sure I was actually blind. Now I’m here laying in bed wile my anxiety is eating me alive on if this bitch is going to leak when I fill it and burp it like a baby tomorrow. Ugh I swear if I see one drip that bitch is going over a cliff. Unfortunately I’ll be too stiff to jump out so I might go out with the car. So to all you Mechanics God Bless you. I’ve never cursed so much in my life. I’m pretty sure I’ll be getting a letter from my neighbors for some of the language that spewed from my mouth. In hindsight that quote from my mechanic would have been worth every penny. 🤦‍♂️",147,1756007629.0,42,AskMechanics,1756150330,2025-08-24 03:53:49,2025-08-25 19:32:10,"sexandliquor (Score: 81): I appreciate that your post started with “YouTube said it was easy” but after this horror story you ended “mechanics god bless you” because that’s just …honestly validating lol. 

You wouldn’t BELIEVE how many people think we’re all crooks and thieves and that everything on a car is easy to work on and shouldn’t be so expensive because “the guy on YouTube made it look easy”. 

I appreciate your honesty and seeing it from our side. Because a lot of people do this type of thing where they think we charge too much, and then they fuck around and find out how much work and aggravation this stuff really is sometimes.

hartbiker (Score: 31): Just another reason my personal vehicles are from the 50s and 60s.  Had a boss ask me one time why I did not buy something newer....my answer was because why the hell would I want to work on my own modern shit on my off time?"
1myl9jm,Super Rounded Lug Nut,"Plz help lol-10 min tire change turned to 3+ hour ordeal. 

Rounded lug nut, I tried hammering on a bigger socket but it just got more rounded. What could I do next to try and not affect the stud as much as possible? 

So far I’ve been hitting it with a hammer + chisel and it’s semi working. Any ideas anyone??!!",5,1756006447.0,16,AskMechanics,1756150330,2025-08-24 03:34:07,2025-08-25 19:32:10,"International-Hat636 (Score: 3): That thing is so bad to find someone with a proper torch to melt it off and replace the stud and lugnut. Then you find the person who caused this problem and take all their tools and tell them to find something else to do with themselves

Professional-Gur4357 (Score: 2): You could weld it to a metal rod or piece of metal, and spin it out, then get a new bolt?"
1mykqu7,"My 2020 Tiguan locks randomly lock and unlock, especially when I accelerate at low speed","Please take a look (and a listen) at the following video

[https://i.imgur.com/BeabRKM.mp4](https://i.imgur.com/BeabRKM.mp4)

2020 Volkswagen Tiguan SEL AWD (4 Cylinders B 2.0L FI Turbo DOHC 121 CID)  
100k miles  
Automatic transmission  
Power locks

The car locks (it may be just one of them tbh - it's hard to tell by listening) randomly lock and unlock as I'm driving. The clicks can be heard as I begin accelerating at a low speed, as I repeatedly demonstrate in the video.

What could this be?",1,1756004770.0,2,AskMechanics,1756150330,2025-08-24 03:06:10,2025-08-25 19:32:10,"Patrol-007 (Score: 1): Corrosion in wiring harness to lock ? Deoxit spray as a fix 

Need to use VCDS (diagnostics tool from Rosstech) to find the fault code - either intermittent connection with door actuator, faulty Comfort Control module, etc "
1myknnd,Issue with 2012 Nissan Altima S,"I have a 2012 Altima S that’s giving issues when interstate driving or driving distances (70-80mph). It will go fine for about 30 minutes or so then the RPM gauge will start moving back and forth. The car then slowly loses speed even with the gas pedal pressed to the floor. If I park and let it sit for a bit, then it will go back to normal until the issue starts up again. There aren’t any problems at city speeds (40mph and under) 

My brother ran the codes and got the two pictured. What’s our most likely issue/fix? ",1,1756004484.0,4,AskMechanics,1756150330,2025-08-24 03:01:24,2025-08-25 19:32:10,"ChrisShiherlis- (Score: 2): sounds like it's time for a new car OP

popcultureprincess32 (Score: 1): Forgot to add it’s an automatic with around 155k miles."
1myklhe,Battery recharge help,"Not sure if I have this set up right. There’s several options. Could someone kindly explain what each of the settings do? Recharging my battery, but I think I’ll have to replace it. Constantly needs a jump to get started.",4,1756004300.0,7,AskMechanics,1756150330,2025-08-24 02:58:20,2025-08-25 19:32:10,"Professional-Gur4357 (Score: 2): 
Voltage Display – The red number “12” on the display shows the battery voltage. For a standard car battery, it should read around 12–12.6V when fully charged.

Mode Selection – The buttons below let you choose the charging mode:

STD = Standard lead-acid battery

AGM = AGM battery (absorbed glass mat type)

Amperage Selection – The switches with “2A, 6A, 30A, 100A” let you choose the charging current. Use a lower current (2A or 6A) for slow, safe charging and maintenance, or a higher current (30A or 100A) for faster charging (but this is more aggressive).

ON Light – The yellow “ON” light shows that the charger is actively charging.

Connection – Make sure the clamps are connected correctly: red clamp to the positive (+) battery terminal, black clamp to the negative (–) terminal.

Automatic Functions – Many Schumacher chargers automatically detect the battery type and voltage, adjusting the charge accordingly. Always check the manual to avoid overcharging.

Quick tip: If your display shows “12V” and the battery is connected correctly, it means the battery is roughly at 12 volts, which is normal for a car battery that’s not fully charged. Choose the correct battery type (STD or AGM) and an appropriate current, then turn it on"
1mykig6,Save to drive when there's a leak like this?,"Im on the road and I see what seems to be something leaking underneath the center toward front pessanger side.  I took pics but can't seems to point out what is leaking. Without knowing what is it, but based on the approximate location + the fact that this is 08 Highlander what might be leaking and if it's save for me to keep driving?",2,1756004027.0,6,AskMechanics,1756150330,2025-08-24 02:53:47,2025-08-25 19:32:10,"ChrisShiherlis- (Score: 3): Most likely condensation or drain OP.... You're OK.

Responsible_Gas_4060 (Score: 1): Temporarily it is but get it dealt with as soon as your wallet allows 👍👍"
1mykc7w,Is this DIYable?,,1,1756003487.0,2,AskMechanics,1756150330,2025-08-24 02:44:47,2025-08-25 19:32:10,ConstantMango672 (Score: 2): Everything is DIYable... if you have the knowledge to do it is a different question
1myjywl,Adding internal LED to tell me when brakes are active,"Please bear with me, this makes more sense than you might think. 

I have a 2020 Hyundai Santa Fe with adaptive cruise control.  There are times when it's clear that the car is being braked by the cruise control, like when someone cuts in close in front of me.  Other times it's hard to tell if they're being applied or not.  But I'd like to know when the brakes are being applied. 

I'd like to mount a small LED on the inside of back hatch so I can glance in the rear view mirror and see when the brakes are being applied.  I'm assuming that the brake lights go on when the Cruise Control applies braking force. 

Is this practical?  Is it as simple as tapping into the brake lights on the rear, or is it more practical to run something off the fuse panel up front?   

Would appreciate any advice or tips. 
",1,1756002336.0,4,AskMechanics,1756150330,2025-08-24 02:25:36,2025-08-25 19:32:10,"crysisnotaverted (Score: 1): Sure. The brake lights run on 12v, just splice a 12v indicator LED off the same wire going straight into the brake lights.

I'd just use a 3 connection Wago connector. Not an expert, and I take no responsibility if you mess up one of your brake lights.

Patrol-007 (Score: 1): There are mirrors that attach to rear glass (meant for seeing if kids behind you) that should do the same thing. "
1myjxqh,Frame rust treatment?,I’m buying this 1996 f150 on Monday. It has some surface rust on the frame. I checked it out and nothing looks serious or thick/flaky by any means. But I’m curious about either A) how difficult would it be to remove the bed and treat the rust myself or B) how expensive would it be for someone to do this for me? ,5,1756002234.0,5,AskMechanics,1756150330,2025-08-24 02:23:54,2025-08-25 19:32:10,"Galopigos (Score: 2): Scuff off any heavy flakes and loose dirt, pressure wash it down, let it dry out and cover it with Krown, Fluid Film, NH Oil or similar. Cost wise it depends on the shop, around me a car runs about 150, trucks are about 200-300 depends on the truck size. The nice thing is the shops do it in a few hours and you don't end up covered in oil. Then generally you get them touched up yearly. That is because the oil types will wear off from rain/snow/dirt hitting those spots. I used a different wax formula for those spots on mine. Stay away from any of the tar types or ""rubberized"" coatings. Those tend to trap moisture and rot out the pieces faster than uncoated."
