id,title,selftext,score,created_utc,num_comments,subreddit,scraping_time_utc,created_datetime_utc,scraping_datetime_utc,top_comments
1offk15,2015 Chevy Cruze,"Hey guys I’m installing new cam gears on this Cruze but I have a question and I can’t find the info on google. 
Do the gears have to be aligned with marks on the cam ? The info I got just says to use the tool I have and trq and stretch the bolts 
Are there timing marks or something because the cams have no pin like a ls or other cars I’m a little worried since I’ve already stretched my bolts ",1,1761357077.0,3,AskMechanics,1761507151,2025-10-25 01:51:17,2025-10-26 19:32:31,"IslamicMadMan (Score: 1): Bro, on these Cruzes theres no pin or key on the cams like an LS, so the gears can spin freely until you tighten them. You cant just eyeball it or line it up by feel. Youve gotta lock the cams in place with the alignment tool. that’s what actually sets them where they need to be. Once thats locked, you line up the timing marks on the gears to the colored links on the chain. Then you torque the bolts down (and angle them) while the tool is still holding the cams. That’s what keeps everything in time and if youve already torqued or stretched those bolts once, toss them. They’re one time use stretch bolts, and reusing them can make the gear slip and wreck the engine.

Big-Brrrt (Score: 1): The cams are locked with the tool and the crank . I’m just confused on if the gears Need to be tightened down in a specific spot in correlation to the cam"
1offjxt,I can't wrap my head around a 3-cylinder's four-stroke cycle,"For 4-cylinders and above, it's easy to chart the cycles for each cylinder. I can't seem to understand how it works for a 3-cylinder engine. Is there a chart similar to these that can help?",1,1761357068.0,2,AskMechanics,1761507151,2025-10-25 01:51:08,2025-10-26 19:32:31,"Nada_Chance (Score: 1): Go to the 6 cylinder chart and blank out 4, 5, and 6."
1offhel,Noise from rear wheel,,1,1761356858.0,2,AskMechanics,1761507151,2025-10-25 01:47:38,2025-10-26 19:32:31,"IslamicMadMan (Score: 1): What the hell is that, sounds bubbly. Maybe the rubber boot on the jv joint?"
1off6y1,BIG BODY ESCALADE for 10k….,"Saw this 2022 Cadillac Escalade ESV Platinum for 10K, dude said all it needs is an eco program and keys. should i take the risk? 😭
don’t want to buy it and see ts was a flood damage car. he sent the vin and everything checks out in the carfax. i’m going to take my electrical mechanic to actually look at the car, but ts is 2 good 2 be true, right?",0,1761356000.0,15,AskMechanics,1761507151,2025-10-25 01:33:20,2025-10-26 19:32:31,"Much-Standard1732 (Score: 7): Smells stolen

Any-Progress-4673 (Score: 3): Blocked in. No Tags. Sketchy looking area. OP Bring a gun with you plz

EDIT: 100% stolen or something sketchy. He's asking 10k($9999) so he doesn't have to file form 8300. Bet its vin swapped. OP please be careful. Don't bring 10k with you."
1off5se,Question about putting wrong oil in diesel ford truck?,"Hello,

We have a 2018 Ford F150 3L power stroke diesel pickup. 

We brought it to get an oil change when we were on the other side of the country on vacation in July. Ford weirdly wants this truck to have 5W30 synthetic diesel oil put into it - which the place we brought it to didn’t make an issue out of it. Just changed the oil and we drove back home. 

We took it for an oil change locally again today and the counter guy said they don’t carry that oil and none of his suppliers carry that oil because it’s a weird oil to put into trucks. Normally they just put 5W40. I asked him to check what was done when we were away and he said they put a 5W30 gas engine oil without even saying anything to us. 

Could this have caused any damage we wouldn’t know about and would there be any recourse for this ?

Thank you! ",1,1761355903.0,2,AskMechanics,1761507151,2025-10-25 01:31:43,2025-10-26 19:32:31,Longjumping-Stage-41 (Score: 1): No! The only real difference between diesel oil and car oil is diesel has extra additive pack for cleaning. 1 oil change won’t effect your engine…
1oferov,Most ethical place to buy car parts?,"I know there were plenty of questions about buying parts, but I wonder which website or chain is the most ethical place to buy parts from? A place that cares about it's employees, doesn't sell fakes and doesn't have fake reviews. So the opposite of Amazon.

I own old Fords and Chevys. ",0,1761354703.0,14,AskMechanics,1761507151,2025-10-25 01:11:43,2025-10-26 19:32:31,"Ok-Maintenance-9538 (Score: 6): Independent NAPA stores. There are corporate stores and there are larger store groups, but a lot are still family owned mom and pop operated.

No-Big1920 (Score: 2): In Canada Princess Auto is a great chain. My buddy works for one of their stores and absolutely loves his work and the management."
1ofer4n,Nisan Juke Intake Manifold,"I’d like to gain experience trying to fix my own car. My intake manifold needs to be changed and I want to do it myself but unsure how to go about that. Should try to fix it myself or take it to a professional mechanic? 
",1,1761354658.0,2,AskMechanics,1761507151,2025-10-25 01:10:58,2025-10-26 19:32:31,Imaginary_Act_3956 (Score: 1): r/nissandrivers
1ofel04,Honda Certified Mechanics,"Looking for a Honda Certified engine mechanic in the south houston area. Have a 2007 honda accord 2.4 litres with a cylinder 2 misfire. Probably an electric issue i cannot figger out.
Took it to Gillman houston. Big mistake. Willing to pay reasonably.. TIA",1,1761354137.0,2,AskMechanics,1761507151,2025-10-25 01:02:17,2025-10-26 19:32:31,"persona_non_grata_1 (Score: 1): Not a Honda certified mechanic but could definitely handle your issue - albeit Im in Florida. Good luck and sorry you had a bad experience. Ive worked with many OEM certified techs that are fair, and worked with some that work at small shops that are amazing. When I tell someone who to look for when it comes to working on a vehicle- aptitude is everything. And trust me - nearly anyone can pass a test if coached."
1ofees7,Oil drain hole extra holes.,"Why, just why?
1987 Honda Accord LX
Seems like someone didn't like a previous owner. Three holes drilled into the oil drain threads into the oil pan. Yes, it was leaking oil.",1,1761353630.0,4,AskMechanics,1761507151,2025-10-25 00:53:50,2025-10-26 19:32:31,persona_non_grata_1 (Score: 1): I just had a VW brought to me that looked like this. Not sure if it was oem and somehow he got the wrong drain plug and gasket combo or what.
1ofeeq0,Honda pilot 2010,"Any ideas car had a corroded battery ground lead I replaced and now it does this
Remote locks work battery has plenty of juice
Does the same when jumped
",1,1761353623.0,2,AskMechanics,1761507151,2025-10-25 00:53:43,2025-10-26 19:32:31,MulberryMonk (Score: 1): To me the battery terminals are loose and/or need a charge
1ofednl,Minor rear end accident led to total loss. Is it worth trying to get work done?,"This question is coming from a super inexperienced and uneducated place. I have a 2018 Ford Edge (167k miles) and was recently rear ended at a red light. What presented itself as panel damage at first to me turned out to be structural damage to the rear passenger corner of the frame, leading insurance to issue a total loss. My question is: is this really enough for me to scrap the car? I recognize this picture is definitely not enough, I wasn’t able to really see what they meant. I guess what I’m saying is I don’t really care if the cosmetic damage is unfixable, I just wanna know if I’d really NEED to fix whatever frame damage is present to continue safely driving the car. It’s just crazy to me that something that presents this minor could be such an issue. Thanks for any insight you guys can offer.",3,1761353533.0,6,AskMechanics,1761507151,2025-10-25 00:52:13,2025-10-26 19:32:31,"AnonAsh17 (Score: 6): just take the total loss, hope you have full coverage or it wasn’t your fault

g2gfmx (Score: 3): Total loss totally depends on the value of the vehicle, minus the repair cost. The car is roughly worth $7k according to kelly blue book. $7k is not a lot of money for major structural repairs. Bumper and tailgate alone could cost close to that already"
1ofdxap,Could someone help me diagnose this?,"Hello,

My dad had a 1968 Camaro, it has been rebuilt.  He had to stop driving and now I have the car, but I don't know much about cars outside of YouTube videos and fixing things when I know what's wrong.

I took the car out for a little drive this afternoon and at the end of the drive it started making this noise...",1,1761352169.0,8,AskMechanics,1761507151,2025-10-25 00:29:29,2025-10-26 19:32:31,"savant99999 (Score: 1): Hard to tell from that, could be header gasket blown out.

CoolButterfly1108 (Score: 1): What year and model auto? Sounds like tappets/ lifters have too much gaps or maybe a spring broke/stuck."
1ofdtkx,Bent Rim,I blew a tire and bent the rim a little. Is this fixable? It’s aluminum. ,1,1761351853.0,2,AskMechanics,1761507151,2025-10-25 00:24:13,2025-10-26 19:32:31,g2gfmx (Score: 1): Find a wheel repair place locally. Looks like it can be fixed
1og563e,Does anyone know what part this is and how to fix it?,"A while ago a flood took the part that holds my front license plate. I’m not sure if the whole bumper needs to be replaced or if just that part will be enough. There’s a small crack in the middle and the alignment of the latch is weird. 

Any advice on what to do and how to do it is welcomed! Thanks!",1,1761433074.0,2,AutoMechanics,1761507151,2025-10-25 22:57:54,2025-10-26 19:32:31,"mastertinodog (Score: 1): I forgot to  mention I have a 2018 Toyota Tacoma SR5 Double Cab

Nacho_Tools (Score: 1): Lower front valance "
1ofuzpy,Hose clamp tool and/or correct way to open???,,2,1761407593.0,14,AutoMechanics,1761507151,2025-10-25 15:53:13,2025-10-26 19:32:31,Vfrnut (Score: 1): Remove both clamps and replace with worm /hose clamps
1ofoclz,What could this sound be happening at idle and low speed,,2,1761388631.0,5,AutoMechanics,1761507151,2025-10-25 10:37:11,2025-10-26 19:32:31,"ChiMiGoGo (Score: 2): I’m no mechanic, but are you referring to the hiss sound?

If so, it sounds like an air intake to me. 🤷‍♂️

Effective-Job8341 (Score: 1): Have you looked for any loose or broken parts? 
Ex: Radiator fan shaking? Motor mounts failing?

Legal_Business_8094 (Score: 1): Idk sounds like bubbling tap.no loss of power and i know it has exhaust leak"
1og6h3y,need help is this a good first car? how much would be a good offer?,"i need a cheap lil runaround for my first car to get me and my child around & seen this however it does have a dent as shown in second pic (i dunno if that is easily fixed i’m terrible with cars lol) and i’m not sure if the miles are bad?? i’ve been told by a friend to find something with under 100k miles but then another friend said as long as it’s been looked after miles don’t matter??? so i am confused 😅 i need something suitable for motorway driving at least once every two months and city driving …
is this worth buying? how much would be a good offer??

if this is not worth buying, what is a good first cheap car to get (doesn’t need to be fancy as stated i do have a child lol)",1,1761436796.0,5,CartalkUK,1761507151,2025-10-25 23:59:56,2025-10-26 19:32:31,"IconicB3M (Score: 3): The girl that lives over the road from me has had one of these for about 8 years so they must be alright. It has a rusty dent aswell but she did that herself I wouldn't buy one that already has one

redandbluedragoneyes (Score: 2): i would go for a car that has been looked after then a low millage car that has not been looked after.

that damage, if it is just a run-around, i would not even bother to fix it, i would use it to haggle to get the price reduced.

you can look up the mot history on the gov website, this can be used a s guide to see how well it has been looked after.

other thing to bear in mind, around 100k, if the car has a timing belt, that will need replacing, if it is chain, it should be fine.

RiceeeChrispies (Score: 1): Mileage doesn’t matter if it’s been serviced, and it’s cheap. Assuming not much rust, probably plenty of life left in it. It’s a first car, doesn’t have to be perfect.

The fez I bought at 100k miles has only just died, I added 55k miles."
1og6dck,Second hand car advice,"Hi, im  looking to buy a second hand VW Polo but it has 110k miles on it; is it worth it? There is another for a couple hundred more at 72k miles but I’m not sure which one to go for really, any help would be appreciated :)",1,1761436487.0,1,CartalkUK,1761507151,2025-10-25 23:54:47,2025-10-26 19:32:31,"l3wisp (Score: 2): Generally, service history is more important than mileage"
1og68ay,What is it? Fell off while driving my car,"I drive a Nissan Qashqai 2015 petrol and last night while driving the car I heard some metal part falling on the road. Thankfully it was in a residential area so I could stop the car and look for the fallen part. Found this. Carefully drove home 2 miles away. I could hear some noise on some humps and also while turning my steering wheel (sometimes). 

This happened around 11 pm so taking it to a garage was not an option. Also, tomorrow is Sunday so I’ll most probably take the car to a garage on Monday. 

Anyone had any idea what this part is and whether it is safe to drive to a garage with this damage?",0,1761436080.0,16,CartalkUK,1761507151,2025-10-25 23:48:00,2025-10-26 19:32:31,"Free_PalletLine (Score: 45): Looks suspiciously like you've snapped a coil spring from your suspension

Fq_Psyc (Score: 14): 100% snapped coil spring, take it to a garage as soon as possible as it can dislodge and puncture your tyre.

Gmc8538 (Score: 2): Defo snapped spring, likely from rear.

Have a look underneath and check both the springs look like they are in place still - if so should be fine to drive to the garage. Take it easy over the speed bumps!!"
1og60g8,New car options?,"Hi All,

Our Toyota Yaris has been damaged, and we assume that it will be written off. A boy racer drove into the Yaris and it has suffered extensive damage. We know our time with the courtesy car is limited and we need a new motor.

We are in the market for a new car, and we are thinking somewhere in the £15k-£18k range. We would be happy to go lower for something that fits the below however we don’t necessarily wish to go higher than £18k.

We are both auto drivers, and want something that has: (1) reliability, (2) infotainment/modcons; (3) decent MPG.

The daily commute is 15 minutes, but I work as a lawyer. I could be anywhere within a 2-hour radius 5 days per week.

As we have a growing family (5 and 2 year old), we knew that our time with the Yaris was limited.

We have looked at a VW Tiguan and Hyundai Tucson. We would be open to other cars, and unfortunately the better half isn’t a fan of Estate cars so that writes those off.

We know that getting something as great as our little Yaris will be impossible, as many in this sub will agree.

What would you recommend?

TIA,
A stressed out Dad without his Yaris. ",2,1761435456.0,1,CartalkUK,1761507151,2025-10-25 23:37:36,2025-10-26 19:32:31,"edcboye (Score: 2): If you like your Toyota Yaris. 

Toyota Corolla hatchback if you think you only need a little more space.

Toyota Rav4 if you want more space than a Corolla, but for this one you'll be getting either a lower mileage old body style, or a higher mileage new body style. Tech will be worse in the older ones so keep that in mind.

All of these will be automatic and get 50+mpg according to auto trader.

No clue what the tech is like but they all have screens in them so I imagine will have car play/android auto but might depend on the exact spec?

They're all Toyota so I guess probably reliable but do your own research on this part if you like these cars."
1og5zb6,Potential first car,"I’m thinking of getting an Audi a1 as my first car. I passed my test in auto a few months back and it’s been really hard finding a reliable, compact car. What do you guys think I should do

I don’t know if I should get a nice car as my first or a cheaper uglier one that’s gonna be £2000 less",0,1761435363.0,32,CartalkUK,1761507151,2025-10-25 23:36:03,2025-10-26 19:32:31,"Ordinary-League5554 (Score: 15): Only showing 1 MOT, and Mot has more miles then the listening. I think it is quite sus only showing one MOT.  Even if it had private plates before the car history stays with the car, not the plate if that makes sense. And even if it is legit, one MOT in 12 years is insane.

jackgrafik (Score: 4): These have the DQ200 DSG gearbox, which is best avoided. They’re a dry clutch unit, and have reliability issues. On top of this it’s a Japanese import which could have a shady history. At this kind of budget I’d look at a Honda Jazz with a CVT gearbox [like this one](http://www.autotrader.co.uk/car-details/202510107038850?utm_source=share&utm_medium=ios-app). Just make sure you avoid any with ‘corrosion’ mentioned in the recent MOT history and you should be fine.

iMatthew1990 (Score: 3): I think it’s an ok choice yes. I’ve definitely seen gearbox issues for these things though so as it is 12 years old I’d make sure it’s had the correct servicing done on it. (As well as the rest of the car of course)"
1og5wl3,Could someone explain car lease and hire purchase to me?,"I come from a priviledged background where both my parents were fortunate enough to be able to outright buy nice low mileage second hand cars. They also earnt enough to just pay the garage/petrol bills without really thinking, so we never talked about these things, and now I'm realising how ill-equipped for this I am!

I am now working for minimum wage and with more than £400 a month going out on a train season ticket, I am in no position to drop thousands on a reliable car.

I need to learn to drive and am very nervous about it, so am looking for an automatic gearbox to take out some of the stress. I can see the overall advantage of a hybrid monetarily but that does, of course, increase the price. Would a petrol hybrid (not a plug-in) make a massive difference to petrol costs? Again, I don't really have a sense of mileage/petrol use as I don't currently drive.

I don't understand the pros and cons of each agreement, particularly why you should choose one over the other? My partner has had a horrid run of luck with cars breaking down so we're also considering paying for a maintenance package for peace of mind, but is that really worth it considering how little I am earning?

I am looking to reduce my train season ticket outgoing, possibly to around £200 a month if I drive to work once a week, or I could reduce it to 0 if I drive to work every day. What would you recommend to a new driver? Is it good practice to do it every day or would that be too overwhelming?

Any insights you could give would be greatly appreciated!",0,1761435151.0,7,CartalkUK,1761507151,2025-10-25 23:32:31,2025-10-26 19:32:31,"Flowa-Powa (Score: 6): Buy a cheap little car for a couple of grand and learn how to fix it yourself

redandbluedragoneyes (Score: 3): Car lease - basically you do not own the car, you are sort of renting it, you take a lease out for a xx amount like 3 years and the end of the lease you can either hand it back and take a new lease or do a one of payment and keep the car.

hire purchase - you are basically buying the car, but split the payment over xx amount of months, with interest baying paid, say the car is worth 20k and you want to do it over 24 months, that will be 20k divided over 24 months plus interest, once paid off, you get to keep the car.

I would say, learn to drive a manual.  
If you have a manual licence, you can drive both auto and manual vs having a auto, you can only drive auto.  
Plus insurance are cheaper for people who hold a manual licence.

having a hybrid vs non hybrid saving, this comes down to how much driving you are doing and where.  
if you are doing mostly city and town driving and not really going to go above 40 miles plug in will be better as on a plug in tend to have about 40 millage on the electric motor when doing about 20/30 mph vs a non plug in hybrid is like a mile or 2. Also if you get a like a 1l small car like a Aygo, that will be better then a non-plug in hybrid as small engine and a light car.

my last car was a 1.4l turbo petrol and my current car is Auris hybrid 1.8l, the petrol car was better on fuel on the motorway but the hybrid is better when doing local driving.

if you plan to learn and get a car for work, you will need to look at the fuel cost, wear and tear, parking cost etc, which you find that the train is better. I need to go the office once a week i pay £6.10 for a tram ticket, if i was to drive, i will be driving in rush hour but the cost of parking will be around £8/9 per day.

Once you pass, drive to as much as you can, this you will build up experience.  
for me i would say do not bother with leasing or HP, spend like 3k but a small cheap car to build up experience then you can look at leasing / HP / PCP etc.

cougieuk (Score: 2): How far is your commute ?
What kind of roads ? 
Can you charge a hybrid or EV at home?
What's the longest trip you'd be making in this car?"
1og4yk4,Not wanting my adress given to every interested person when selling,"I was really surprised to see that not wanting to give out your adress to someone who's just asking for it when selling a car was so unpopular. For the sale itself they'd obviously get it from the V5C, and I'd be happy to finalise any sale at my house.

But with the absolute nutters who reach out to you through Facebook marketplace, Autotrader and Gumtree, I'm very surprised people think it's shady to not give out your adress to anyone asking. Sorry but I don't want to reject some whackjob's lowball offer only to find my sidemirrors gone the next day and the offer even lower. Am I just paranoid?

For the record I've never sold a car before, got full service history and it's MOT'd to next year. Not trying to offload a shitheap, just a genuine guy who dosent want every potential chav, traveler and ned to know where there lives a guy who's hoping to get rid of a car.

*** Edit***
I get it, I'm wrong. It's clear to me most people on this sub is experienced sellers and buyers. So just take this post as an insight into how a non-shady, nothing to hide, honest but cautious first time seller thinks. I've spoken to friends and family who have also not sold a car, and amongst first timers my opinion seems to be the norm. So maybe take that into consideration of buying from a first timer. Peace out! ",18,1761432481.0,68,CartalkUK,1761507151,2025-10-25 22:48:01,2025-10-26 19:32:31,"SirTrick6639 (Score: 51): You are paranoid. If I’m about to pay you thousands of pounds I at least want to see the car at the registered address. Any messing about with locations is an immediate red flag.

Yes there are nutters out there, but the risk of someone lowballing you, then secretly damaging your car at night and coming back to lowball you even further is very low. However the risk of a dodgy seller trying to meet you away from his house to sell you a dodgy car is quite high

Cool_Championship_74 (Score: 62): Yeah you possibly are a little paranoid, if I want to buy your car I want to look at it at your address, not some service station or random car park somewhere, how do I know you’re not some “whackjob” I want to see a private sale car at the address on the log book, how do I know you haven’t stolen the car you’re selling

lllDouglll (Score: 56): If a seller doesn’t want to meet at the registered keepers address, it’s an immediate red flag, that the sale is more than likely dodgy. 

You don’t have to let the person in the house, unless you feel comfortable after meeting them. 

I’ve sold a couple of cars, on autotrader, and have always invited them in to do the paperwork"
1og4t4v,Question that probs pops up many times on here,"Hey,
I’m 17 years old and I’m currently learning to drive. I’m looking for a cheap car with cheap insurance(I know learner driver insurance is cheap but I’d have the car through till I get my actual license anyway). 

I live in a very safe area with very low crime so my insurance quotes are around £1400-£1800.
I’m not willing to spend that much on insurance if a car is worth max £1000. What car can I get that is very cheap on insurance but also isn’t absolutely hideous and just a dread to drive. Obviously engine capacity isn’t that much of a problem as it would be around 1.0-1.4L anyway I live in a bit of a hilly area so would need it to have enough power to get up hills (No SUV needed). 

I’m just wanting some advice as the cars I’ve been looking at have mostly been £1.6K which I checked on compare the market.

Any advice would be very appreciated thank you!!!!",0,1761432082.0,8,CartalkUK,1761507151,2025-10-25 22:41:22,2025-10-26 19:32:31,"LUHG_HANI (Score: 1): I'm 33 and spend 1.3k on a 530d from 2010. I paid 1.5k when I was 17 so just suck it up.

OriginalQuackers (Score: 1): I usually recommend the Suzuki Swift. If you like cars and have a little extra spare to spend on them, get a Sport. They’re awesome cars, very reliable, very cheap and very easy to fix.

As for the insurance, it’s very rare for a young new driver to be under the £1000 mark. Most of us were paying £1500 plus a decade ago. Certainly almost all of us were paying more than the car value. You’ll likely have to let that mind block go."
