id,title,selftext,score,created_utc,num_comments,subreddit,scraping_time_utc,created_datetime_utc,scraping_datetime_utc,top_comments
1o5452t,What could be causing a thin layer of sticky stuff on my car?,I bought a car from the northern tip of my state where they get a large amount of snow. I brought it back down to where I live which is the southern end and we don’t get any snow really. Now i’m finding a thin layer of something sticky and I think baby moths really like it? Or I think they were moths. I’m genuinely just so fucking confused i’ve never heard of anything like this in my life. ,1,1760311810.0,10,AskMechanics,1760383989,2025-10-12 23:30:10,2025-10-13 19:33:09,"Cheapntacky (Score: 3): Tree sap?

None (Score: 2): It could be from the road chemicals they used up north to de- ice the roads. Does it wash away and come back? It sounds interesting"
1o5439h,Steering column moving around,Just got this 89 Daytona Shelby and the steering column just moves around. Never seen this before since I never owned a car with an adjustable column. What is this,2,1760311672.0,6,AskMechanics,1760383989,2025-10-12 23:27:52,2025-10-13 19:33:09,"petsrulepeoplesuck (Score: 5): Take it apart and see where it's coming from you dummy

MentalPatient97051 (Score: 1): She's broke, Jim."
1o53zu8,09 Corolla spark plug condition,"Hey this is out of a 1.8l Corolla. Spark plugs were changed about 50,000 km ago. I did take em out and they were white. Cleaned and stuck back in. No lean codes. Noticed the threads were black",1,1760311408.0,2,AskMechanics,1760383989,2025-10-12 23:23:28,2025-10-13 19:33:09,corndoghumper (Score: 1): Most likely just carbon/heat discoloration from combustion. As long as you have no codes and they function a cleaning will do.
1o53yqx,2021 Toyota Highlander Lean Fuel Code Diagnosis,"I have a 2021 Toyota Highlander with about 72k miles. It's the 3.5L V6. About 3 months ago, I stopped to get gas. When I went to turn the vehicle on, it kind of rumbled and then wouldn't start. I pushed the ignition again, and it started right up but was throwing codes P0174 and P0171. The auto parts store told me the most likely cause was the MAF sensor. The next day, I started it up and the codes were gone. I couldn't feel any difference while driving other than the hard start. I thought maybe it was a fluke and just went on with life.

A couple of days ago, I had the same issue. I went to get gas and when I tried to start it, it rumbled a bit and wouldn't start. I tried a few more times before letting it set for about 10 minutes. When I came back, it started on the second try and is now throwing the following codes:

P0174 - System Too Lean Bank 2,  
P0171 - System Too Lean Bank 1  
P0505 - Idle Control System  
P117B - Fuel Performance / Direct Injector

It still could be the MAF sensor, but the fact that it has happened immediately after getting gas makes me think it could possibly be the EVAP purge valve, but I would think it would be throwing codes specific to that, no? Would anyone have any thoughts or some quick ways to diagnose the real problem? I don't have a fancy code reader that I could use to check the EVAP system.",1,1760311325.0,2,AskMechanics,1760383989,2025-10-12 23:22:05,2025-10-13 19:33:09,"mode01 (Score: 1): You don't need a fancy scantool, but you do need something  to monitor evap pressure and purge command.  OBDII apps and wireless obdii dongle is all you need.  Don't replace the MAF for this.  The parts store doesn't take into account that it runs bad after a fill up, it is just a basic Google look up on their part.  Don't add fuel after the pump 1st kicks off."
1o53yjp,Battery Box Doesn’t line Up after Trans Mount Replacement,"Replaced my transmission mount which I had all sorts of problems lining up the holes. After reinstalling  everything  the rubber studs that the air box goes onto wouldn’t lineup. 

I removed everything and in order for the rubber studs to line up with the air box, the front bolt on the battery tray doesn’t line up with the transmission mount  hole. 

Not sure what to do. Do you think jacking up the transmission might line it up? Leave it just with two bolts installed? 

",1,1760311310.0,4,AskMechanics,1760383989,2025-10-12 23:21:50,2025-10-13 19:33:09,"Vuvuian (Score: 1): Did you compare the old mount to the new mount side by side to be sure the new is correct part?

I had this problem before on an older Mazda with that location mount being slightly different between 2WD & 4WD mount."
1o53l0z,Is this normal operating temperature for 2014 is250,,1,1760310274.0,2,AskMechanics,1760383989,2025-10-12 23:04:34,2025-10-13 19:33:09,Bruce65lv (Score: 1): Yes
1o53j10,Help! How bad is it really,,3,1760310117.0,13,AskMechanics,1760383989,2025-10-12 23:01:57,2025-10-13 19:33:09,"Loose_Internet_4420 (Score: 3): 1989 eunos roadster manual 87000 miles 1.6

r4x (Score: 3): He's dead Jim."
1o52o7g,Jeep question for expert,"I have a 2007 jeep wrangler. 3.8 jasper engine with 75,000 miles on it But the jeep itself has 218,000.

My radiator which is original has slight leaks so I just bought a new radiator. All my hoses & heater core are original. 
I'm definitely going to replace the thermostat & upper & lower radiator hoses also.  
My heater hoses feel a little soft.. but I know that is a difficult job.

My question is since I'm replacing my radiator & upper & lower hoses & thermostat should I also replace my water pump, heater hoses & heater core?
I realize this is a hard job but I am capable. 
My Jeep is in very good shape & I plan on keeping it for a very long time .

Is it advisable to preemptively replace water pump, heater hoses & heater core or would you wait until failure? Also is there anything else I should do at the same time?  
Thanks in advance for any info!",1,1760307883.0,2,AskMechanics,1760383989,2025-10-12 22:24:43,2025-10-13 19:33:09,"InnerDistribution450 (Score: 2): Do as you wish.  However I've never worked in a shop that would recommend everything you mentioned.  Radiator, thermostat, and hoses(all) would be the most that would save a customer money.  In the course of 35 yrs I worked in two shops that did hoses as a menu item. So customer would pay one labor for the Radiator and another rate for the hoses. Thermostat was also included on some vehicles."
1o52mfw,2006 Toyota Sienna,This “boot” is over the passenger front wheel “steering arm” and is kind of melted underneath. Nothing is in contact with it. Is this power steering fluid leaking or what? I’m not really a car person.,1,1760307761.0,5,AskMechanics,1760383989,2025-10-12 22:22:41,2025-10-13 19:33:09,TT_Xyooj8 (Score: 1): That’s your steering rack boot. Should not be leaking and boot being torn. You’ll need to replace the entire steering rack assy.
1o52cr8,"Looking at a car on fb marketplace, are these dents salvageable and if so about how much would it be to fix?",,1,1760307067.0,4,AskMechanics,1760383989,2025-10-12 22:11:07,2025-10-13 19:33:09,"Gambit3le (Score: 2): Anything is fixable... But this is a LOT of damage, with sharp creases.  Sure you could get new doors, but personally I wouldn't bother with it...    the damage to the rear unibody kills it for me.

EEL123 (Score: 1): R/autobody"
1o52c5v,How would this turbo being too big for the manifold be installed??,"As the title suggests... I think i may have gotten a bit too ambitious in purchasing a Turbo separate from a manifold in hopes that it would fit.  

Long story, short - grabbed a turbo from someone on the forums & purchased what i thought was the correct mating manifold for the engine/project.  Now the Cool side housing interferes with the manifold and would butt up against it.

[side view](https://imgur.com/gallery/still-prepping-turbo-install-09sep25-BOqESYv#aYBnOLB)

[Flange view ](https://imgur.com/gallery/still-prepping-turbo-install-09sep25-BOqESYv#17zrW11)

I'm considering a few solutions but unsure what would be the correct way to go about installation.
Sooo...  /r/AskMechanics , How would someone go about overcoming this challenge in what might be the most correct way?


EDIT for more info ...

DF KIT Car ; Goblin V1, L61 Ecotec with F23 Getrag Manual

Turbo is an Z54 they was bought ""a la carte"" from a forum member

I saw this one example where they trimmed the manifold, but I feel like there has to be another way.

This is the only thing I can find at the moment...
Youtube [video](https://youtu.be/s8z0D_lHv1A?si=a7oDYk9Byhh5VDNv&t=224)",1,1760307025.0,5,AskMechanics,1760383989,2025-10-12 22:10:25,2025-10-13 19:33:09,"SwerveMonkey (Score: 1): I saw this one example, which is the only thing I can find at the moment... 

Youtube [video](https://youtu.be/s8z0D_lHv1A?si=a7oDYk9Byhh5VDNv&t=224)

they trimmed the manifold, but I feel like there has to be another way.

kyden (Score: 1): Can you buy another flange and use it as a spacer? I assume it’s a t3 inlet."
1o527hn,Chirping sound from around belts. What does this indicate?,"https://reddit.com/link/1o527hn/video/nie7xjxc7ruf1/player

2007 Acura TL Automatic 3.6L 106k miles. What is this noise?",1,1760306699.0,2,AskMechanics,1760383989,2025-10-12 22:04:59,2025-10-13 19:33:09,TT_Xyooj8 (Score: 1): Spray some wd40 or lubricant on the belt to see if the chirping goes away. If it does then replace the belt. Sometimes the pulleys will develop rust and make the belt squeak also.
1o522wn,"Which service should I do first, rear shock or tire rotation?","My car needs a tire rotation but they also told me at the dealer that my car needs rear shock. I’m not taking my car to the same place to do both services at once. 
The tire rotation I’m doing it at Costco since I bought tires so it’s free. The rear shock will be done at the dealer with my extended guarantee that covers it. 
So which service should I do first before the other? Or it doesn’t matter. ",1,1760306383.0,6,AskMechanics,1760383989,2025-10-12 21:59:43,2025-10-13 19:33:09,"-NOT_A_MECHANIC- (Score: 2): Doesn’t matter

HalfBlindKing (Score: 1): The only way I can think it would matter is if the rears were getting chopped up by the bad shocks. You can get a tread depth gauge for cheap and measure them yourself and see if they even need to be rotated. I still bring mine to the dealer and they’re so chill, they’ll measure them first to see if it’s even needed and not do it/not charge me if it doesn’t."
1o51z0x,Did I order the wrong O2 sensor?,"I bought replacements for both my upstream and downstream O2 sensors for my 2008 Subaru Outback from Partsgeek.com. The downstream matched perfectly and is installed. The upstream, however, is a different length and has a different electrical connector (as shown in pictures), and it looks like the sensor heads almost match, but not quite (see first picture). Anyone else experience this? Are there multiple types of upstream O2 sensors for my car and I purchased the wrong one?",49,1760306110.0,53,AskMechanics,1760383989,2025-10-12 21:55:10,2025-10-13 19:33:09,"Known-Wrangler-6383 (Score: 195): Once you notice the connector is wrong its safe to say its the wrong part my guy

bigburneraccts (Score: 43): List your part number goober."
1o51wf4,Small Displacement Turbos,I see tons of cars 2.0 liter and smaller turbo engines and see lots of comments against them. Which brand (if any) has gotten it right?,1,1760305928.0,4,AskMechanics,1760383989,2025-10-12 21:52:08,2025-10-13 19:33:09,"wpmason (Score: 1): My personal take on them is that in the quest for efficiency automakers have simply over-complicated things to an absurd degree. (I know it’s not entirely their fault, the government is culpable too.)

Things that are over-complicated tend to be less reliable and more expensive to repair. Sometimes even more expensive to maintain. 

So sure, they’ll get better gas mileage while still feeling zippy… but they lack towing capacity on larger trucks and SUVs. But it doesn’t necessarily help the consumer if they require premium fuel to run properly and cost of ownership is higher than a more simple design. 

And I care about the environment. I just think tailpipe emissions are a drop in the bucket… there are much bigger fish to fry if we’re really trying to protect the earth. 

If a 2.0L Turbo in a pickup truck proves to be unreliable, just how much carbon is going into manufacturing more and more trucks to replace all the dead ones that get thrown away because of an unreliable engine? 

There’s no actual logic to it. It’s all just performative. 

Maybe they’re good, maybe they’re bad… But cars and trucks didn’t used to be this disposable. And that’s arguably worse than the tailpipe emissions.

Spare-Car-7866 (Score: 1): VW 1.8T"
1o51ttb,New tire puncture,Tire has less than 10k miles. Puncture with no nail. Any chance they cover on warranty ,1,1760305742.0,2,AskMechanics,1760383989,2025-10-12 21:49:02,2025-10-13 19:33:09,-NOT_A_MECHANIC- (Score: 1): If you have road hazard warranty
1o51gq2,How easy is it to destroy the parking pawl?,"Hello! I have a 2025 Cadillac escalade, which I parked at the top of this Incline at night to check something, with my friend behind me. I forgot that the car automatically applies hand brake, and I turned it off by clicking the button (I meant to enable it). The car's parking pawl took the weight. Could it cause massive damage? The car was stopped before letting go of the ebrake, it rolled about 10-15 cm. 


Disclaimer: This picture is from Google maps, and it's 3 years old. You can actually drive up this hill now, as it's not in construction anymore, and it's used to enter the McDonald's. I don't know much about this place, because it was a random road trip. ",1,1760304840.0,16,AskMechanics,1760383989,2025-10-12 21:34:00,2025-10-13 19:33:09,"dadof2foru (Score: 9): I've seen 1 parking pawl fail in my life, and that was because the car got hit and pushed 15 feet across a parking lot. 

You're fine.

Muntster (Score: 7): Very few people around where I live use the parking brake in an automatic. You will see their cars role a few cm as they let off the brake.

Your car is fine"
1o511uz,2009 Honda CRV - Leaky oil?,"2009 Honda CRV with about 225k give or take. New-to-me purchase with oil change right before I purchased. Silly me didn't inspect it, put 4500 miles on it, and noticed this today. Leak and residue in rear engine bay of Passenger Side. Engine Oil is a bit low. Car does have suspension noise. 

Any thoughts on what the possibilities are here? The boots on the struts are also blown so I'm not sure if it could be grease residue but looks like excessive oil to me. 

I'm having it looked at tomorrow but I'm going to drive myself nuts until then. ",1,1760303830.0,6,AskMechanics,1760383989,2025-10-12 21:17:10,2025-10-13 19:33:09,"Fun-Hawk2992 (Score: 2): Hard to tell exactly where it’s coming from. My 2007 civic had a leak that was in a similar area and it was the power steering fluid pump but I just had to replace two o-rings.

JustBerathianBear (Score: 1): I have found more leaking lol

https://preview.redd.it/baj0u8v92ruf1.jpeg?width=3000&format=pjpg&auto=webp&s=22b63e1ea3f96ed5af783e73b16594b99576c744"
1o511g8,what could be draining my car battery?,"i have a four door 2002 toyota echo and today we finally got the car started and running so we went to o riley’s and they did their diagnostic thingy but it didn’t say there was any issues (we thought it could be the alternator and battery but we went in last week with my battery fully charged and they said it was a good, functional battery) and drove the car for about two hours without any issues. this is my first car so i have no idea what it could possibly be. my uncle, grandpa and boyfriend have all been working on the mystery but now that my battery is fine and i was able to drive it for two hours without any issues, they’re unsure what it could be",1,1760303803.0,2,AskMechanics,1760383989,2025-10-12 21:16:43,2025-10-13 19:33:09,"InnerDistribution450 (Score: 1): Interior light. glove box light. Best way to find out is to do an amperage draw test. Gpops or your uncle may know how.  Otherwise,  I  would recommend you have a shop takes a look. Mainly because there are many ways for the vehicle to drain the battery."
1o50zor,2018 Silverado 1500 light issues,"Working on my brother in laws 2018 Silverado 1500 and running into some strange issues. His passenger side headlight got smashed by a chunk of ice a while back and he never fixed it. Eventually all of the passenger side lights stopped working. We replaced the assembly and found the connection was burnt up. Bought the pigtail to replace the plug (8 wires on the plug) and now the headlight works, turn signals work, brake lights work, reverse lights up but the problem is the running lights in the rear passenger side (same side we re-wired) aren’t functioning. Could this be a fuse or maybe an issue with one of the wires off of the new connection? We’re at a loss. 

Edit: we’ve double checked and tested all the connections on the new pigtail after we were told to double check that and lost the entire passenger side tail light after messing with it. Currently putting the wires back how they were when only the running light wasn’t working.",1,1760303683.0,12,AskMechanics,1760383989,2025-10-12 21:14:43,2025-10-13 19:33:09,sourestpatchkid (Score: 1): Additional info: 2018 Chevy Silverado LT 1500 5.3L V8 Gas automatic transmission and 118970 miles on the truck
1o50rdk,Dealership made a big mistake,"Hi all! Need some advice/information from anyone who is a mechanic (especially at a dealership) that knows more about this than me. So I have a brand new 2025 Nissan rogue that I bought from a Nissan dealership on July 1. I was lucky enough to get the 0% APR Cause I’m a broke college student that needs a dependable vehicle. I just hit 5000 miles earlier this week and had a scheduled appointment at the dealership for my first maintenance visit. Drove to the dealership and the car was in perfect condition, they did an inspection and everything passed. They did the oil change and as soon as I left the dealership and got on the interstate I noticed my car lurching a little bit. I figured maybe the oil hasn’t circulated through correctly yet so I pulled over,revved it a little bit,and turned it off and back on and it seemed to be fine. I drove 20 minutes home after that with no issues. Later that evening, I was driving to a friend’s house and I noticed that there was light gray smoke, bellowing from my exhaust (so much that I couldn’t see behind me). So I pulled over and popped the hood, checked out all my fluids, and they seemed fine including the oil but I couldn’t tell the exact reading on that, but there was definitely oil. I turned my car back on, and my power steering light flashed, and the car shook, that’s when my check engine light and oil light came on. I had the car towed to the dealership but am kinda worried about what the outcome would be long term. Wouldn’t be surprised if they claimed to fixed whatever it is but it leads to a long term issue that doesn’t pop up until my car isn’t under warranty anymore. I’ve been doing some research on what it possibly could’ve been and I’ve been hearing a lot about the oil being overfilled or being the wrong kind. Currently I’m leaning more on the side of the oil level being filled way too much just based on the symptoms. Anybody have a better guess on what it could be? Also does anyone have any experience with how dealerships would deal with something like this? This is a brand new car and Thus a brand new engine, even if they fix the issue there can’t be a guarantee that this won’t cause something further down the line, or maybe enough damage has already been done. I don’t know if I’ll just need a new car at that point or if I should request extending my warranty further? Open to advice! ",1,1760303130.0,7,AskMechanics,1760383989,2025-10-12 21:05:30,2025-10-13 19:33:09,"Bulldog78 (Score: 2): Have you rechecked the oil? The dipstick will tell you 100% if it’s been overfilled. If it is, have the dealership tow it back and fix whatever is wrong. If it’s not, it’s under warranty, so take it back and let the dealership fix it.

InnerDistribution450 (Score: 2): Personally,  if it were feasible, I would have it towed back to the dealership under warranty.  Since you're the consumer and not the technician,  it isn't up to you to know what is wrong or what happened, but it is up to them to find the issue(s) and repair them.
Good for you on stopping and checking.  Always a smart thing to do.   Hopefully this will resolve quickly and easily."
1o50iwf,What is going on with my car? So many different answers,"I've been told AC compressor, Serpentine belt, baring is off.",141,1760302584.0,90,AskMechanics,1760383989,2025-10-12 20:56:24,2025-10-13 19:33:09,"zardnarf (Score: 206): It's the AC compressor pully. The bearings in it are shot. If it fails completely it can and will cause spendy problems.

Individual_Wasabi_10 (Score: 43): That shouldn’t be wobbling like that…"
1o4zydh,Should I be concerned?,The car has always had quite a rattley engine but the noise has gotten a bit louder and I’m concerned that there may now be an issue or If this is just how it should sound. It had a full service last month and MOT with nothing negative to report.,7,1760301244.0,14,AskMechanics,1760383989,2025-10-12 20:34:04,2025-10-13 19:33:09,"TrashKingBob (Score: 11): Sounds great if its a diesel...

cheepcarz2 (Score: 8): What's the worst thing could happen??"
1o4zy9n,"2013 Chevy Cruze LS 1.8L automatic, 97000miles, brand new battery, died while stopped","Thinking this is an issue with the alternator. 

I had my Cruze sitting for a few months, after checking fluids and placing a new battery in (tried jumping it, no dice)… went to start it up, turned on but started to idle rough. Revved up to 3000rpm and stayed there for 10 seconds then went down to normal and violently shook, then shut off. Turned the car on again and it started right up without another issue.

Decided to take it up the street for a quick wash, while in line, all of my lights came on, power steering went, and the car shut off. Turned it on once again and was able to drive home. As soon as I pulled into my driveway it died again. Now I’m unable to start it, and I’m unable to jump it.

Rechecked fluids just to triple check and make sure I didn’t miss anything and everything’s normal there… 

This seems like an issue with the alternator, but I’m not 100% 

Any thoughts?
",3,1760301237.0,5,AskMechanics,1760383989,2025-10-12 20:33:57,2025-10-13 19:33:09,"mightymitch1 (Score: 2): Yep alternator

lemonD98 (Score: 2): Theoretically, if you can get it to start again and disconnect the battery, the car should stay running if the alternator is good. Or there’s other testers you can use that measure output while it’s running. You could also take the new battery out and take it to a shop to get tested or just check it with a voltmeter/multimeter if you have one. If the battery is still good (as it likely is) then that points pretty heavily towards the alternator being the issue (as it likely is), and could be why you had to replace the battery in the first place."
