id,title,selftext,score,created_utc,num_comments,subreddit,scraping_time_utc,created_datetime_utc,scraping_datetime_utc,top_comments
1njq61j,Volt window regulator won’t fit?,i recently bought a window regulator for the front driver side window to replace a broken one. after getting the old one out it feels impossible to align one of the screws into the new one. the old one looks like it has a different angle compared to the new. am i stupid or is did they send me the wrong part or lie about its compatibility with the 2013 volt?,1,1758145290.0,6,AskMechanics,1758224065,2025-09-17 21:41:30,2025-09-18 19:34:25,"LWschool (Score: 1): Can you share something where you actually compare the parts? This video is just you, struggling to get it in one handed lol 

Where did you buy from? Yes, shit happens sometimes and the wrong part ends up somewhere, somehow.

paulyp41 (Score: 1): Loosen both upper bolts slightly but do not remove, and try again"
1njpyqp,What part of the car is circled in red? Will bracing the two points improve handling and reduce body roll?,"Looking to buy a chassis brace that connects the two points circled under the car. What are those points called? Are they connected to the rear suspension at all?   
  
Trying to reduce the body roll around corners and make the car feel more planted. Rear sway bars are not an option unfortunately so I thought this could be an alternative if it works. TIA",1,1758144796.0,6,AskMechanics,1758224065,2025-09-17 21:33:16,2025-09-18 19:34:25,"Big_Brilliant_145 (Score: 1): I don't know. The 1960's mustangs had a support called a birdcage. 

djltoronto (Score: 1): Can you elaborate on why sway bars are not an option? Just curious"
1njppi5,Good enough?,Needed a gasket for my intake manifold and decided it prolly be cheaper and quicker to just cut my own then order one and wait for it to come in the mail. How’d I do? Can I get by putting this back onto the engine??,1,1758144165.0,12,AskMechanics,1758224065,2025-09-17 21:22:45,2025-09-18 19:34:25,"Due_Platform_5327 (Score: 3): What did you cut it out of

MightyPenguin (Score: 2): Well it looks good...but the sheet was 6.49 and I buy those gaskets at local parts houses all the time for like $3 a piece 🤣"
1njphts,HELP!,"I own a 1985 Toyota ae82, I have been on the hunt the last 4 years to find new fenders as mine are too rusted to fix without needing spray foam which I don’t want to do. I have checked every website I can find, put out Facebook posts, looked in scrap yards and still came out with nothing, does anyone know any way I can get these or have they basically become non-existent now
",1,1758143649.0,3,AskMechanics,1758224065,2025-09-17 21:14:09,2025-09-18 19:34:25,"LWschool (Score: 1): You mean AE82? Confused me for a second lol. 

I see some on eBay right now that you could repaint, [this one](https://www.amayama.com/en/part/toyota/538021a890) I found as one of the top google results, and I’m sure there’s more. It’s old but that’s a wildly popular car, I’d be surprised if there were zero fender kits (there are plenty of fender kits…)."
1njph98,2019 Honda HRV right blinkers turning on when headlights are on,"Title.

This started this morning. My 2019 HRV right side blinkers will turn on and stay on, as if I have used the lever, whenever my headlight are on. It does not do so when I only have high beams on. It works normally otherwise. The left blinker does not seem to be affected at all.

Any suggestions would be appreciated. Thank you!",1,1758143612.0,2,AskMechanics,1758224065,2025-09-17 21:13:32,2025-09-18 19:34:25,"Bluetex110 (Score: 1): Check the plug of your headlight for corrosion, it's usually a ground connection problem if something like this happens."
1njp6qk,Battery Question - can a disconnected fog light line drain the battery.,"Hey really hoping for some help on this one. Some idiot wanted to get around me so he hopped on the shoulder and tried to get back in front of me. He shorted it and tore off half my front bumper (2013 Toyota Avalon). Electrical lines leading to the fog lights were ripped out and hanging on the ground or touching the metal frame. 

My question is, would this parasitically drain the battery? Reason I ask is after 45 days of dealing with the back in forth the insurance company doesn’t want to pay for a new battery or the labor to replace. The battery is 2 years old but it is rated for 3-5. ",1,1758142916.0,4,AskMechanics,1758224065,2025-09-17 21:01:56,2025-09-18 19:34:25,"Realistic-March-5679 (Score: 1): It shouldn’t as the fog lights are typically switched on the positive side. Shouldn’t be any power draw with ignition off unless you cycle the lights and leave them on, but it would be a similar draw as having a bulb installed.

2005CrownVicP71 (Score: 1): No, it would not."
1njp16x,Can’t mount exhaust hangers on 1994 Ford Taurus GL 3.0 v6,"I’m replacing the rubber exhaust hangers on my Taurus and can’t find any way to put the rubber hanger on the mount. 

The mount is car side and is the front most hanger of two rear hangars. I removed it from the car to get a better look at it but still can’t figure it out. Any help is appreciated. ",1,1758142550.0,3,AskMechanics,1758224065,2025-09-17 20:55:50,2025-09-18 19:34:25,"Gambit3le (Score: 1): That was pinned in at the factory
   Grind off the ends of the bar and punch it out with a drift and a hammer.   Replace with a bolt and nut."
1njourx,2011 GMC 2500 HD," I have a 2011 GMC Sierra 2500HD 6.6L Duramax LML. I had a check engine light come on with a code P0420, thinking it was the injectors I put dieselkleen in it, did a force regen, and got it diagnosed. The injectors are still operating fine, no misfire or loping or anything. I was then told it was the catalytic converter by the time I got the converter and made it to the appointment to get it installed, my truck went into limp mode. Thinking it was still the converter I kept the appointment and they just installed it, come to find out that wasn’t the problem and it still went into limp mode. They’re going to try a forced regen again and see if that clears anything up. Any ideas of what else it could be? Maybe the DPF?",1,1758142129.0,2,AskMechanics,1758224065,2025-09-17 20:48:49,2025-09-18 19:34:25,"Sweet_Speech_9054 (Score: 1): P0420 is catalyst efficiency. It also inhibits regen. You probably need to clear the code and do a regen to see if any codes come back. Then address any remaining codes.

It may also be an egt sensor. They should verify the temperature difference between each sensor to determine if a sensor is bad or the cat is bad. But you won’t be able to know until you do a regen. You should know that it only tests for that Dec when the vehicle is in regen so that is how you need to test to see if the new cat worked."
1njoplp,What are these?,I have a 2010 Nissan altima was cleaning this morning and I noticed that something was unplugged. I thought to check the other and found something else unplugged buy looks a little different than the other.,4,1758141784.0,9,AskMechanics,1758224065,2025-09-17 20:43:04,2025-09-18 19:34:25,"Ok_Platypus1431 (Score: 1): They kinda look like a light connection, i would check you blinkers and brakes to see if somethings not glowing where it should

IceandEmerald (Score: 1): It kinda looks like a fog lamp connector. Im not a nissan guy, but I would assume from what i’m seeing that youre just missing the actual fog lamp assembly. Compare it to the other side. It’s also possible if its not plugged in over on the other side to anything or taped up out of the way that the connectors were there for manufacturing for the models that had fog lamps as an option."
1njoon2,Weird clunk and squeak without consistent behavior.,"2010 Mazda CX-9. I just had the ball joints, lower control arms, stabilizer links, ps cv assembly replaced by a place I trust. Shortly after, it began to clunk occasionally. I checked the torque on the parts that were replaced to make sure nothing was missed on the work done: all good.

Now, the clunking is happening frequently and has also developed an occasional squeak. It’s in the front, on both sides, can’t be reproduced by just bouncing the car. It happens on some bumps, some turns, but can’t be reliably reproduced by hitting bumps or turning the wheel; just sometimes.

I’m thinking maybe sway bushings since it’s on both sides and associated with bumps and turns, but I’ve never heard sway bar noise so I don’t know and the squeaking is throwing me off. It also sounds like it’s anywhere between the ds and ps, not just on the extreme sides.

Any ideas?  ",1,1758141723.0,4,AskMechanics,1758224065,2025-09-17 20:42:03,2025-09-18 19:34:25,"Asktolearn (Score: 1): Updating to add: 200k miles, auto, 3.6l. Also, I made a sharp u-turn and the problem stopped for a while. Went over railroad tracks and it returned.

beforethecrash (Score: 1): The most common clunk/squeak concerns for the CX9 usually end up being rear diff mounts if it's 4wd"
1njnt9d,Top 3 Worst Smelling Chemicals,"What is the worst smelling chemicals you've ever worked with. My top 3 are:

Gear Oil (Especially Fords friction modifier)
DEF
Burnt ATF",2,1758139683.0,10,AskMechanics,1758224065,2025-09-17 20:08:03,2025-09-18 19:34:25,"LetTheRainsComeDown (Score: 2): I second gear oil, fuck so sharp and sour smelling

JesusA-JA3 (Score: 2): Naphthalene, Decanter Oil (highly concentrated benzene), H2S"
1njnqlj,What suspension part do I need to repair?,"So basically I’ve had this Acura Rsx-S for a few months, it’s modified so bear with me. 
Recently it developed a clunk noise when dry steering or uneven roads at low speed, small to no vibration at high speeds suspension wise its stock just on eBay coilovers that I’m replacing with tein coils, so I wanted to know if you guys had a guess on what could be causing this problem, I mostly do repairs with my brother but he lives 2 hrs away and I want to get parts before hand so I we could repair and get going. ",124,1758139516.0,60,AskMechanics,1758224065,2025-09-17 20:05:16,2025-09-18 19:34:25,"Big_Tangerine1694 (Score: 206): If the play is only at 9 and 3, you have a tie-rod issue. Can be inner or outer, or both. If play is only at 12 and 6, you have a ball joint problem.  If equal play at 9/3 and 12/6, you have a bad wheel bearing.

paulyp41 (Score: 10): Need video from the inside view of the wheel, ball joint, tie rod etc"
1njnp5x,how do i retighten this?,,1,1758139422.0,11,AskMechanics,1758224065,2025-09-17 20:03:42,2025-09-18 19:34:25,"fartbuttknuckle (Score: 5): Unfortunately you don't. You purchase a regular worm clamp and replace it.  Those clamp like to get loose after a while.

InfamousGold756 (Score: 1): It looks like its sitting on the lip which is not letting it compress enough? What's it like when you move it over"
1njnjca,Hummer H3 vibration,,1,1758139051.0,2,AskMechanics,1758224065,2025-09-17 19:57:31,2025-09-18 19:34:25,"LWschool (Score: 1): Sounds like it could be CV joint or maybe, less likely, wheel bearing. Is it any different while braking or only really the accelerating/coasting difference?"
1njnis9,Can anyone help me identify this mysterious rubbing/grinding noise? Couldn't figure it out so far ...,"Hi everyone, since a couple of weeks I am starting to hear this strange sometimes loud rubbing sound while I'm driving at constant speed. Here's a sample of how it sounds:

https://reddit.com/link/1njnis9/video/faxuuppe5spf1/player

Here's some additional context:

\- The noise car be heard when I drive at constant speed, usually around 30 kph but sometimes at 60 or higher

\- It goes away immediately whenever I touch the brake pedal

\- It usually goes away when I accelerate

\- It happens independently from the steering wheel position, but usually when the wheels are straight

\- It is no accompanied by vibrations

\- There is no effect on the brake performance, both pads and discs seem to be in good shape

\- I talked to a mechanic when I first started hearing it but he couldn't reproduce the sound and checked both brakes and wheel bearings and told me that they are all in good shape.

Car is a 2018 Peugeot 308 GTI with about 100k km on the odo, so far no other special issues to report.

I am guessing that this is an issue with something like the dust shield or the brake pads adjusted too tightly that rub on the discs. Anyone know what can be done to stop this? It can get pretty loud and annoying.",2,1758139013.0,2,AskMechanics,1758224065,2025-09-17 19:56:53,2025-09-18 19:34:25,"Dean-KS (Score: 1): Is there a roof rack crossbar? They can oscillate, vortex shedding. Remove or wrap a bungee cord around it in a spiral, maybe six turns across."
1njn1uo,"Broken exhaust pipe, can I just use a repair kit?",2010 Nissan Sentra. Car became incredibly loud yesterday and it sounded like it was coming from the middle. I checked under and saw this crack. Can I just use a pipe repair kit or connector? Is it better to get it fixed at a shop?,1,1758137927.0,9,AskMechanics,1758224065,2025-09-17 19:38:47,2025-09-18 19:34:25,"7YearsInUndergrad (Score: 2): Definitely better to fix it at a shop, but you could probably get away with an exhaust band clamp over the break.

LWschool (Score: 1): Could you get a pick or socket extension or something and see how much is rust vs metal? Given the surface condition it might be a little more difficult to repair, because you need a pretty clean surface for it to last.

There’s like putty based solutions for smaller patches, and clamp/metal mesh ones for bigger holes."
1njmzl5,Brakes are grinding,"I drew on the rotor with a marker to see what was causing the rhythmic grinding sounds while I'm driving. As you can see in the picture, the brake pads scrape against the rotor in that one spot. The rotor and the pads don't look worn down, so I don't want to have them both replaced if they aren't causing the problem or if only one of them is faulty. I don't have the time to do every single troubleshooting method that Google tells me to do, so I'd like your opinion on what is causing this.",1,1758137777.0,6,AskMechanics,1758224065,2025-09-17 19:36:17,2025-09-18 19:34:25,"LWschool (Score: 1): Is it while driving in general? While applying the brake? Does road conditions affect it? Speed? Load? 

This isn’t like a standard test so I’m a little unsure, but this seems like brake warp - the rotor may not be perfectly flat, and on this side it only contacts at that point. Relatively common issue as brakes age but you would ideally do a full brake job to fix.

Spaced_rat (Score: 1): Sounds like warped rotors.  Only real way to fix this is to get new pads and rotors installed."
1njmra1,How would you go about removing this?,Lug bug snapped in half,1,1758137240.0,5,AskMechanics,1758224065,2025-09-17 19:27:20,2025-09-18 19:34:25,"Crescendo3456 (Score: 1): When in doubt, drill it out.

Not_me_no_way (Score: 1): Damn. Maybe a twist socket extractor if it would even fit in the hole. Are the threads stripped? Is that what caused it to snap?"
1njmp15,Is my battery or alternator dead?,"Woke up with car (2012 Volvo S60) not starting (no power)

I think I left it in Accessory 2 days ago and the battery drained, but I don't remember exactly. 

I got a battery jump kit, jumped it and it started. The battery read 12.15V (engine on).
Went for a 10min drive, turned off, and there wasn't enough power to start the engine. Jumped again, went for 20 min drive, now the battery says 12.35V on my multimeter. If I revv it at 2000rpm, I get to 12.37V at most. 
Car is on the driveway idling, I'll let it another 20 mins. 


Chatgpt says it should get to 14V while revving the engine, if not the alternator is bad. Is it right? Is the alternator or battery dead, or do I just need to let it idle more?",1,1758137094.0,4,AskMechanics,1758224065,2025-09-17 19:24:54,2025-09-18 19:34:25,"meme1280 (Score: 1): I'm betting on the battery. Take it to an auto parts store, they can run an electrical test on it and narrow it down for you.

LWschool (Score: 1): I’m betting alternator. That’s how my NAPA rebuilt one fails, i believe one of the diodes goes out so it can’t reach its full charging voltage anymore. Some places like autozone can diagnose it for free, as well."
1njmat7,Did I overpay for my car repair?,"Needed 4 brake pads, 4 rotors, and a caliper

$847 for parts, $405 for service fee 

A relative's friend who's a car mechanic said I overpaid by $600?? 

I'm in Philly  ",0,1758136184.0,15,AskMechanics,1758224065,2025-09-17 19:09:44,2025-09-18 19:34:25,"MightyPenguin (Score: 3): Sounds like for front and rear brakes, pads and rotors you paid around $626 per axle. In the city and not out in the country that is a very typical price for a brake job. You also didn't list what kind of vehicle it is as that obviously brings many variables with it.

You're relatives friend that says you overpaid is an armchair quarterback either stuck 20-30 years in the past or they are comparing to DIY/Sidework/Shadetree or CHEAP shop prices. If you went to a quality repair facility and got good brakes then that is normal.

Vivid-Appearance-549 (Score: 2): I paid about $612 for just front brakes/pads. So your total sounds about right."
1njm77r,First time seeing this happen before 😅,,2,1758135952.0,4,AskMechanics,1758224065,2025-09-17 19:05:52,2025-09-18 19:34:25,"SubiWan (Score: 2): Spark plug with a foreskin.

Raging-Porn-Addict (Score: 1): I had that happen on a few lawn mower plugs and they were always on the cheap plugs that had been in there a while. I have yet to see this happen on a high quality plug"
1njm0zg,Brake light wont light when i press the brake + esp light on,"My kia ceeds (2009) brake light wont light when i press the brake but it will light when i turn on the lights  Plus the Esp light in the dashboard turns on a few moments after i start the car, this has happened before but it will go in a few moment but now its a persistent issue. Any solutions?",1,1758135577.0,2,AskMechanics,1758224065,2025-09-17 18:59:37,2025-09-18 19:34:25,"Vuvuian (Score: 1): Sounds like a brake light switch. Usually attached to the upper part of the brake pedal. When the brake pedal is pushed, it pushes the button on the switch lighting up the brake lights.

That or all brake light bulbs are faulty at the same time, which is less probable but not impossible 🤔"
1njm0xn,2013 Honda civic p0128,"Hi,

I have a 2013 honda civic on which I got the p0128 code,  Check Emissions warning on my Imid. 

I then replaced the thermostat and didn't clear the codes. Eventually, after a couple drive cycles, the warning on my Imid stopped popping up so I assumed the problem is fixed. That said, today upon checking for codes using a OBD2 scanner, I see the p0128 still reported. 

Was I supposed to clear the code as well after the repair or has the issue not been fixed? I must clarify that now neither is the CEL on nor is the warning on my Imid. The only way to know theres an issue is via OBD2",1,1758135574.0,5,AskMechanics,1758224065,2025-09-17 18:59:34,2025-09-18 19:34:25,"Eves_Automotive (Score: 1): If you didn't clear the message/check engine light off with a scan tool, and if the message on the dash and the check engine light is now off you can still have codes in the system.

It takes 3 good tests to turn the lamp off, but 20 to purge it out of the engine computer.

Are you needing a smog inspection?  CA??  Northern???"
1njlx1n,Starter?,"Hello - is this a starter issue? Any help would be greatly appreciated 

Thanks!",1,1758135331.0,4,AskMechanics,1758224065,2025-09-17 18:55:31,2025-09-18 19:34:25,"Fun-time-foxy (Score: 1): I can't tell if there is a click or not. If not, yes it's the starter. If it does click, it's your alternator or battery. 
(Non professional, but I'm working on restoring my own car)
If you wanna still drive it, you can attempt to find the starter and give a good ol' love tap to the starter cylinder with a small hammer(mallets are preferred )not to be mistaken for the solenoid(which is the smaller cylinder). Word of caution tho... Once you do that you get, maybe 5-10 starts with it. 

Disclaimer. I've had starters that have gone longer, and know friends who drive their cars like that... But just for the overall average."
1njl7fw,Is it my shoes or discs that are the problem,"Before I spend lots of money.   At highway speed it's fine, but coming to a stop, say 10kmh the car feels like the wheels aren't round.  Something is squeaking and rubbing but I can't pinpoint it. 

I changed the discs and pads about a year ago, but I'd say the shoes have never been replaced. 

The rocking motion has been there before the pad change, but I changed them myself so there might be something I missed. 
I even thought it was my motor mounts, which did fail after all, but they were welded back into place. 

I've changed all the tyres too so it's not that.  
Is there other parts that I should be looking at? 
Mechanics around here charge $80/hour ",1,1758133729.0,4,AskMechanics,1758224065,2025-09-17 18:28:49,2025-09-18 19:34:25,"LWschool (Score: 2): Year make model? 

It’s not uncommon for front-disk rear-drum setups to spit out warped rotors. Drum brakes simply do not absorb that much load and heat compared to the front disks so it’s pretty uncommon for them to wrap. It’s something you can test with a few specialty tools, front at lest.

For rear - you can test if it’s warped by using the emergency brake to slow down. That will show you what those pads feel like without influence from the front. 

You should at least inspect the rear end shoes, make sure there’s life on them. 

Welded motor mounts is… weird… and could be the cause of the issue as well.

anotherbarry (Score: 1): I forgot to mention, handbrake is fine. 

But suspension squeaks a lot"
1njl2c2,Cruz,,1,1758133411.0,3,AskMechanics,1758224065,2025-09-17 18:23:31,2025-09-18 19:34:25,"TrainwreckdU (Score: 1): Why would you get all these codes and if u reset ecm would that work ? Disconnect battery, then hit brakes n then reconnect ? Or possible bad ground wire?

TrainwreckdU (Score: 1): And that valve cover gasket I already replaced so the next couple screens is where’s my problem lies"
1njkwx2,DEF Limp Mode 5mph Max,"My dodge dually 3500 is having the 5mph max in some miles light come on. Took it to Firestone they ran their diagnostics and saw that the def pump needed to be replaced. They threw me two prices to replace $2500, and to delete the system $3,300.
Took the pump replacement route and when it was ready a day later I saw that the same 5mph max light came on. I immediately returned back and they checked it out for another two days and now apparently I need a new def computer. Idk the cost for it but I would like to know some things before I proceed with it.

Is this a normal thing, like they told me the pump was the problem and now it’s the def computer??

How should I move forward?",1,1758133083.0,2,AskMechanics,1758224065,2025-09-17 18:18:03,2025-09-18 19:34:25,"LWschool (Score: 1): Unfortunately Firestone are not mechanics, they’re tire and lube techs, and I wouldn’t have suggested any work like this to be done with them. Advanced diagnostics is not their specialty. 

You have a few options. You can let them continue their work but I would do everything to pay as little as possible, given the obvious situation. You will have to be pushy. 

You could also demand a refund. You traded working pumps and the labor was failed. You’d have to be not pushy/persuasive. 

Nuclear option, you can have it diagnosed by a professional, get a lawyer, and fight about it. Will not be worth it tho, most likely, unless it was maybe a work truck? If your work insurance were involved that might get things moving."
1njkwn7,Did I wait too long?,"'06 Honda Pilot 4WD. 
Changed to this set of rotors (and the now used-up pads) at 169.7K miles. Now I'm doing just the pads at 173.7K I'm just rounding up a bit here and ist been 5 weeks. 
Q: Did I wait too long before changing the brakes? 

A: I probably did because the squeal bar is ripped off the old ones. Although I may have put them on the wrong side as the parts from rock auto were not marked (IIRC) but the O'Reilly parts are. But it's the same brand... 

Second question, am I driving like a maniac if the brakes only go 4000 miles? ",0,1758133067.0,14,AskMechanics,1758224065,2025-09-17 18:17:47,2025-09-18 19:34:25,"Whole_Condition8484 (Score: 1): definitely waited to long, you risk destroying your caliper waiting this long

randomly_there (Score: 1): If you went through brake pads in 4k miles, something is seriously wrong. You should be 10x that, at least.

The wear indicator goes on the inside pad.
Most brake pads don't label which side is which since most people doing it already know from experience. Also not 100% important it's on the correct side, but best practice to be.

Truthfully I'm not even sure how you killed pads in 4,000 miles. I pad slapped (replace pads and nothing else) the last time I did brakes, fully knowing the rotors were rough. Pads are cheap, I had no time, and it's my vehicle. It's been over 30,000 miles now and I've driven the car hard. 
Are you cleaning all the moving parts, and reappling brake caliper grease/lubricant to the proper areas? Without this, brakes can bind, and drag, which will wear them out quickly.
Also a bad brake line can cause a restriction and not release the brakes. 

Also, do all pads look like they wore the same? If not, this shows an issue. 
At 4,000 miles, that is an issue, but one you need to investigate. Either bad pads that fell apart, or something else?"
