id,title,selftext,score,created_utc,num_comments,subreddit,scraping_time_utc,created_datetime_utc,scraping_datetime_utc,top_comments
1ovlia3,Blower relay replacement and location,,1,1762990940.0,4,MechanicAdvice,1763062547,2025-11-12 23:42:20,2025-11-13 19:35:47,compu85 (Score: 1): The blower relay is part of the temperature control computer that lives behind the glove box. The resistor pack is in the engine bay IIRC.
1ovldju,2004 Honda Crv,Have an oil leak on the passenger side of the engine bay. Leaks a good few drops over night. I think it’s leaking onto the belt and soaking everything and even getting onto the hood. Any ideas? ,2,1762990617.0,4,MechanicAdvice,1763062547,2025-11-12 23:36:57,2025-11-13 19:35:47,"jbltecnicspro (Score: 2): Clean it up and see where the leak is.  I don't remember but I think the timing cover is in that area.  Eventually the Hondabond gets old enough that it disintegrates (it's 21 years old now).  That would cause the leak in the area where your serpentine belt is. Just my 2 cents.

liq69ers (Score: 1): Following because i have the same car and the same problem for years now lol"
1ovlden,Battery light and power steering warning lights intermittent,"Taking my car in tomorrow but curious what could be happening. 

2013 Toyota Yaris. Had no issues except burning oil as expected with older car.

Today, battery warning light came on a few times while running errands. Will remain on for maybe 20 minutes and then off again if I park for a moment and restart. Stays off but will come on again. Repeat. 

Then later today, as I go to restart again, my power steering light is on (red with exclamation) and I can’t steer. Let car idle a moment while I look it up in manual…and light goes off and steering normal. 

 Does this sound like bad battery or alternator? ",1,1762990606.0,3,MechanicAdvice,1763062547,2025-11-12 23:36:46,2025-11-13 19:35:47,"InvestigatorKey3959 (Score: 2): That’s an alternator issue. Battery light and EPS light means the car isn’t getting enough voltage. Have the shop test the alternator under load. If it dips, replace it."
1ovl6qh,Advice on Using PEA Additives,"Hello fellow mechanics and enthusiasts,

Thanks 🙏🏻",1,1762990135.0,3,MechanicAdvice,1763062547,2025-11-12 23:28:55,2025-11-13 19:35:47,"TheFredCain (Score: 1): Use them.  PEA is on the very short list of additives that even do anything at all.

RickMN (Score: 1): No harm, possibly some benefit if you have a carbon issue"
1ovl6q5,Do I need new front breaks?,"2015 Jeep Grand Cherokee, put around 40K miles in it, is it time to replace the breaks?",1,1762990135.0,5,MechanicAdvice,1763062547,2025-11-12 23:28:55,2025-11-13 19:35:47,"TheBigRobsOddPod (Score: 1): brakes\* and no youve got like 6mm give or take a mil on here still

ThicccTatter (Score: 1): I always go off the metal wear indicator pictured here on the pad in this photo.  It’s far from low right now. Once that pad gets close enough to touch then it would be about time to change them. 

I’ve seen pads wear uneven such as the front will last 50-60k miles but the backs will be low at 40k miles. Always check both when you do your maintenance. I check my pads every oil change on my whole fleet of vehicles."
1ovl00r,2013 Ford Focus ST - are these the same coolant?,"Hi,

I need a sanity check. Both of these are supposed to be YELLOW coolant for my focus st. The one on the left looks mostly yellow to me, while the other one is almost neon green. I can't tell if it's just that they're mixed differently or what.

Both came from different dealers in different months. One is a bit newer. Neither are older than a year. One came from the dealers own supply of coolant while the other was a prefilled jug.

Are these both fine to use?

Thank you!",0,1762989667.0,4,MechanicAdvice,1763062547,2025-11-12 23:21:07,2025-11-13 19:35:47,"1200multistrada (Score: 1): yep

Efficient_Nature9779 (Score: 1): Taste it, I think the one in the right is Gatorade"
1ovkz12,Please help! 2020 Mazda CX5 brake sounds,,1,1762989602.0,2,MechanicAdvice,1763062547,2025-11-12 23:20:02,2025-11-13 19:35:47,"Mission-Box-7981 (Score: 1): Get your brakes checked, probably rotors."
1ovkwlj,Am I Being Scammed? - Control Arm Collapse,"Hi and thanks in advance. I am being told by a local mechanic that my control arms are “split, falling apart” and are “totally collapsed,” and in need of a $1,200 replacement. I brought it in for a dead 12v battery, and have had no issues with handling or noise. I haven’t seen a control arm before today, but what I’ve seen online thus far makes me think they probably aren’t “collapsed.” My car is a 2015 Lexus CT200h aprx. 60k miles. Thanks again! ",1,1762989431.0,7,MechanicAdvice,1763062547,2025-11-12 23:17:11,2025-11-13 19:35:47,Maleficent-Fix4750 (Score: 5): That is normal for that style bushing.  Find another mechanic.
1ovkuz9,Rough idle smooths out with throttle,Hey y’all this is my sisters jeep and she asked me to look at and honestly I don’t know where to start here any help would be greatly appreciated gas gauge does not work,1,1762989324.0,5,MechanicAdvice,1763062547,2025-11-12 23:15:24,2025-11-13 19:35:47,waspygravy (Score: 2): Lol why does the steering wheel have a V Belt
1ovkt39,3rd Time Mechanic Fail,"Looking for advice and honest recommendations

About six months ago, I paid over $500 to have an engine oil leak repaired. Since then, I’ve had three different shops confirm that the same leak is still there. I’ve already taken it back to the original mechanic three times under their “warranty,” and each time they claimed it was fixed — but clearly, it wasn’t.

At this point, I’m frustrated and wondering if I should demand a proper repair or just move on to a more reliable shop. What would you do in this situation?

",1,1762989201.0,3,MechanicAdvice,1763062547,2025-11-12 23:13:21,2025-11-13 19:35:47,"ProofDizzy891 (Score: 1): The problem is that the first mechanic was incompetent and probably didn't even use dye that goes into the engine, and then you use a UV light to see where the leak is coming from. Just find good shop or dealer with good reviews and ASE certified mechanics and then get it fixed there. Get your refund from that person he doesn't deserve your $500. Take him to small claims court and be prepared to show pictures or evidence.

InvestigatorKey3959 (Score: 1): If they’ve tried three times and it still leaks, they’re not diagnosing it right. Take it to another shop for a dye test so you know the real source. Then decide if the first place should redo it or if you’re done with them."
1ovkh1p,How do I fix a clunking sound that I think is from a sway bar,"First, the obvious source of a clunking sway bar is a problem with the sway bar links. I'm pretty sure this is not the problem.

This for a 2013 Honda Odyssey

The front passenger sway bar link was not properly attached and this caused a lot of clunking that I ignored for several months. Then I took the car to the dealership. They found the unattached sway bar link, which ended up getting damaged because it hadn't been properly attached for a long time, and they replaced both front sway bar links. For those who are curious, the sway bar link was not properly attached because I messed up and didn't properly refasten it after I replaced the front passenger CV axle, but that is a separate story.

The car was fine for a while, but it is now making clunking sounds again, not as bad as before, but it's clunking. I inspected both front sway bar links, and they are securely fastened and they seem to be in good condition. They are only a few months old.

I removed the front passenger wheel, disconnected the tie rod end from the steering knuckle. I moved the knuckle back and forth with my hands. When I move the knuckle, there is a pop or clunk; and when I put my hand on the sway bar, I can feel the sway bar jolting when the cluck happens.

So if it isn't the links, then how do I make the snapping/clunking go away? Did the sway bar, or it's supports get damaged during the months that I didn't have a properly connected sway bar link? Or does anyone think that I am wrong, and it really is the sway bar links?",1,1762988407.0,4,MechanicAdvice,1763062547,2025-11-12 23:00:07,2025-11-13 19:35:47,"kyden (Score: 1): Check the sway bar bushings.  You should see it attached to the subframe.

xMebesx (Score: 1): Your away bar is mounted to the frame and has a replaceable bushing, if you are feeling the clunk in the bar itself, take a closer look at the bushings.


https://ibb.co/XxpDwCgW"
1ovkcuh,clutch issues,"just bought this 05 outback yesterday and drove 2 hours home no issues, as soon as i get in town i stop at a gas station and go to leave and i can’t get the car into first gear or any gear for that matter. i have to shut the car off and start it in gear. i also had to float the gears, after about 10 minutes of that the first 3/4 of the clutch pedal was play. and eventually the clutch pedal just stopped doing anything and when i would start it the car would just start rolling. and now after getting it home the clutch pedal is stuck to the floor and had a springy motion going back and forth from the floor. i just got a new slave cylinder and tried bleeding it to no avail. clutch is still to the floor. also driving the car going down the road before the clutch got stuck to the floor i was going down the road in gear and i would push the clutch and the rpms wouldn’t go back to idle but if i revved the car it would go up in rpm 
VIDEO IS OF ME DRIVING AND PRESSING THE CLUTCH/REVVING IT AND THE CLUTCH GETTING STUCK AT THE HALFWAY POINT ",1,1762988124.0,2,MechanicAdvice,1763062547,2025-11-12 22:55:24,2025-11-13 19:35:47,1200multistrada (Score: 1): Something is not allowing the clutch to come off the floor like it should. My guess is something mechanical is broken/leaking inside the master or the slave.
1ovk5zh,Ghost rev in park,,1,1762987655.0,3,MechanicAdvice,1763062547,2025-11-12 22:47:35,2025-11-13 19:35:47,BustywifeVibes (Score: 1): Do you have the dip stick tube and or oil cap on all the way? It sounds like it's searching for idle and those are common steps forgot about when changing oil
1ovk45i,Video of my car that won’t start,"I Made a post yesterday about my 239,000 Elantra that died and wont start.

Here is a video. I am trying to see if it the fuel pump or something else now before I bite the bullet and buy a new car.

I checked the fuses and relay and they are good. It turns over ok, (not seized or anything) and does rev like it wants to start as I pump the gas but never starts.

Any helpful hints on what to look at next or other issues it could be?

",1,1762987535.0,7,MechanicAdvice,1763062547,2025-11-12 22:45:35,2025-11-13 19:35:47,"Dunoh2828 (Score: 1): The massively overdue service reminder screams neglect to me.

rajl_mok (Score: 1): Any codes?"
1ovjqyz,What part is this and how bad is it? 2010 Chevrolet Equinox,"Context: 2 years ago my car was way out of alignment and I took my truck to a local t1re shop. They said it was a ball joint and I paid to fix it.  Once they ""fixed"" it i started noticing a clicking while making sharp slow turns.  Almost like if you put something in the spoke of your bike t1re.  

A few months later (end of 2023) I took it to a more reputable mechanic and they said the local shop did a terrible job and they had to replace that same  ball joint and a control arm.  That was fixed but I still noticed the clicking.  Again,  only when making sharp turns at slow speeds.  Nothing weird when on the highway or faster turns.  

I've driven my Equinox for 2 years with that clicking but it's only used to drive to work 3 times a week.  A tank of gas lasts me a month. I've had multiple oil changes where they do ""inspections"" where the cv joint and other suspension components are marked as good. 

I finally got fed up with the clicking and turned my wheels to inspect the cv joints and axles and they don't appear ripped or anything,  but noticed the grease build up by the passenger control arm in this picture.  It is not like that on the driver side. 

What is that? How serious is it? What can I expect to need replaced? Any insight is appreciated.",2,1762986661.0,6,MechanicAdvice,1763062547,2025-11-12 22:31:01,2025-11-13 19:35:47,"mango10977 (Score: 3): Looks like lower ball joint.

lampministrator (Score: 2): That is your lower ball joint ..  Sometimes they get over-greased and te grease comes out the boot .. However sometimes when it's on the lift the joint is ""relaxed"" and it get greased, and when the joint gets compressed it squeezes the grease out .. This is an indication of a worn joint.  The way to check it is to jack up that tire BY THE JOINT, until the front tire is about 2"" off the ground.  Take a sturdy prying utility (prybar, 2x4, etc etc that is at least 36"" long) and pry the wheel up.  Watch that joint.  If it moves AT ALL, it's bad.  This is a typical front end shakedown for lower ball joints..

ALSO -- Your CV axle is the most likely culprit for the clicking.  A ball joint will not make the noise you are describing.  Ball joints will ""clunk"" over bumps and rough road."
1ovjnzz,Rear brake pads wearing out unevenly?,"my 04 silverado 1500 got all new calipers, rotors, and pads, but after 7 months and not much use of the brakes (I try to avoid touching my brakes as often as possible) I check my rear brake pads and the inside ones were weeks away from being completely gone and destroying my rotors while my outside pads looked brand new. i would normally chalk this up as a caliper issue but both calipers are less than a year old and both wore out the inside pads the same amount. 

Im not a mechanic, but I’ve become a master at changing brakes because I need to do it so often with this truck. ",2,1762986465.0,4,MechanicAdvice,1763062547,2025-11-12 22:27:45,2025-11-13 19:35:47,"Patrol-007 (Score: 3): Slide pins are sticking. Likely corroded in place. I’m using 3M silicone paste to lube mine, front and rear, every other year. 

mrkprsn (Score: 1): Did you replace the brake lines? Hoses"
1ovjlv0,Did I damage my transmission by entering a conveyor car wash in Drive instead of Neutral?,"Hi everyone, I need some advice. Today I went to an automatic car wash with a moving conveyor ramp. I accidentally left my car in Drive instead of shifting to Neutral.

My car is an SUV,  I was not pressing the gas , the car was just idling. The conveyor started pulling the car forward, but the employees noticed and stopped the system pretty early (almost halfway through). After that, they told me to back out, so I reversed slowly out of the stoppef conveyor.

Could leaving the car in Drive for a short distance on the conveyor have caused real transmission or AWD damage? What should I check next? The car seem to drive normal now. Thanks !",3,1762986324.0,16,MechanicAdvice,1763062547,2025-11-12 22:25:24,2025-11-13 19:35:47,"Lucci_754 (Score: 21): Nothing bad happened to your car

lampministrator (Score: 21): The reason for neutral is for the safety of the individuals.  If you had enough pressure in your transmission (because it a was a performance modification or a malfunction) it ""could"" jump the steps and cause an incident.  It's a safety factor for the car wash, not a safety factor for your vehicle.  You're just fine."
1ovjlup,Piston misfire?,"This happened when I first turned on my car today, I turned it off and back on and the noise didn’t happen again and I can’t recreate it now. I’m guessing it’s a piston misfiring? But how concerned should I be especially if it doesn’t happen again? No warning lights came on either. 2011 Toyota Prius with 188000 miles. ",2,1762986323.0,2,MechanicAdvice,1763062547,2025-11-12 22:25:23,2025-11-13 19:35:47,"yeetlol (Score: 1): That is rod knock, I would imagine it’s gonna get a hell of a lot worse soon. Will need a new engine soon imo.. 

Edit, also check ur oil!!!’"
1ovjf76,What is this noise 1994 Chevy S10?,What is this noise coming from ? I’m thinking it might be from the fan ? As I was told the fan is supposed to spin freely when you spin it by hand but this is very tight to spin ,2,1762985892.0,7,MechanicAdvice,1763062547,2025-11-12 22:18:12,2025-11-13 19:35:47,"Educational-Link-810 (Score: 2): Sounds like one of the pullys, check to see if anything is hitting any of the pullys slightly.

Trick_Emergency8605 (Score: 1): I thought it sounded like the fan hitting the shroud"
1ovjdtp,I need a driver side window and mechanics for my Lincoln Continental mark 5,"So I need a driver side window (left door) and mechanics for my Lincoln Continental mark 5 and I don't know where to get one, with my knowledge there aren't any other Lincolns in my area, and the mark 5 doesn't share any other window except the mark 4; Is there any good glass I could buy online? Websites that deal in classic car parts or custom glasswork would be preferable. ",3,1762985801.0,1,MechanicAdvice,1763062547,2025-11-12 22:16:41,2025-11-13 19:35:47,"waynep712222 (Score: 1): In Los Angeles.. you may call San Luis Auto glass 
 don't forget there were 2 door hard tops.. 4 doors and convertibles..   san luis has a 4 story building with their used glass storage. 

 i am taking you have a 1960 model with the ice cream cone tail lights..  take measurements too. before you call anybody.. 

 in Arizona.. Desert valley auto parts.. 

 the nice thing is.. you might be able to remove the other side and have it duplicated. 

 its been decades since i worked on 50s thru 70s Lincolns.. 

 you did not say if you are in Nome Alaska or Finland.  i talked to some tourists from Finland and yes. they have a lot of 50s American cars they drive around in the warm months.."
1ovjap1,BMW Says Metal is Fluid is Normal,,0,1762985617.0,4,MechanicAdvice,1763062547,2025-11-12 22:13:37,2025-11-13 19:35:47,Tricky_Passenger3931 (Score: 3): Which fluid? Transfer case/differential fluids it’s very normal. Transmission fluid it’s normal to have some clutch material. Engine oil shouldn’t be glittery
1ovj9tg,Need help with a window switch that came off.,"TLDR : I’ll include videos but basically the plastic part of my window switch is off but everything still works and I can’t get it back in place.

Does anyone have an idea of how I can get it to work?",2,1762985562.0,16,MechanicAdvice,1763062547,2025-11-12 22:12:42,2025-11-13 19:35:47,"skadalajara (Score: 2): How much is a new assembly from your local parts supplier? Or a good used one from a local recycler's?

Nada_Chance (Score: 1): If the plastic button has a tab that holds it in place is broken off, you will need to get a replacement switch, either new, or a junkyard pull. If it isn't broken and you somehow managed to ""unclip"" it, you will likely need to remove the panel pull the switch and then clip the button back in place on the switch, and reassemble."
1ovizwr,How far can I drive with an oil leak?,"Hey everybody, I was planning a small roadtrip for the weekend (around 700km) but I noticed an oil leak on my Mitsubishi Challenger 2002. Little puddles formed overnight and smells like burnt oil after driving for a couple minutes.

Is it safe to drive if I check the oil level and top up?",22,1762984940.0,85,MechanicAdvice,1763062547,2025-11-12 22:02:20,2025-11-13 19:35:47,"Educational-Link-810 (Score: 38): You might get away with it, but there’s a chance of things to go bad, running low on oil mid-trip even a small leak can worsen suddenly. Take regular stops and keep checking the oil.

skadalajara (Score: 33): How far can you drive with an oil leak? A little further than the point where it runs out of oil.

On the plus side, your undercarriage will never rust."
1ovizoj,Am I getting uncharged or do I actually need this?,"2009 Honda odyssey 
I’m attaching the oil leak that we noticed when we had to switch the alternator. 
I was under the impression that Variable Valve Timing actuator would not be needed to get changed. Can someone recommend based on the quote we received and also look at the picture? 
Thanks for the comments! 
",1,1762984925.0,17,MechanicAdvice,1763062547,2025-11-12 22:02:05,2025-11-13 19:35:47,"00s4boy (Score: 6): Spool valve gasket leak killing the alternator. Common issue on that motor. 

Official Honda procedure is replace the gaskets, separator plate and the upper half of the valve as Honda doesn't sell the gaskets only just the entire valve, and somehow replacing the entire valve runs the risk of the valves getting tweaked and causing a cold start misfire. Aftermarket gaskets are a gamble, might work, might not.

TheBigRobsOddPod (Score: 4): you would LITERALLY have to kill me and take my money from my wallet for me to pay $40 per spark plug thats fuckin insane"
1oviy3p,Should I be concerned?,Had a major service done on my 2019 Range Rover Evoque. Garage said I need to get my battery changed urgently. Have I got time to wait or is this required right now?,2,1762984834.0,3,MechanicAdvice,1763062547,2025-11-12 22:00:34,2025-11-13 19:35:47,"Appropriate-Roof-466 (Score: 2): Depends on where you're at. I live in a very cold area so I would change that asap. Also depends on if you want your battery to shit out on you

Electrical-Nebula150 (Score: 1): Change it now, before you're stuck somewhere, or late to work when it won't start in the am. You know about it, so why not change it out on your schedule instead of waiting for it to not work at a very inconvenient time."
1oviuj2,Just has a full coolant flush,Had a full coolant flush about a month ago. I don’t know anything about cars but I feel like the coolant seems low. It’s about an inch lower than the bottom cool fill range line. ,1,1762984618.0,3,MechanicAdvice,1763062547,2025-11-12 21:56:58,2025-11-13 19:35:47,"Appropriate-Roof-466 (Score: 2): Check it after you've gone for a drive with your heat on full blast. If it is low still you can add to ""cold max"" once the engine has cooled down. 

More than likely there were a few air bubbles left in the cooling system that worked themselves out after the initial burping of the system after the coolant flush. It's pretty normal to have that happen. If you're worried about it you could fill it to the ""cold min"" and then do the process at the top of my response."
1oviudf,2014 Kia forte making higher pitched noise when starting/accelerating,My 2014 Kia forte is making a higher pitched noise when I start it and drive it.. it does not go away after driving. Can anyone help me ID the issue? ,1,1762984608.0,2,MechanicAdvice,1763062547,2025-11-12 21:56:48,2025-11-13 19:35:47,Apprehensive_Tip9356 (Score: 1): Cuold be an exhaust leak. Happened to me one time. Sounded like a whistle.
1ovitaq,Car smoking heavy white smoke.,"I replaced the valve cover gasket on my 1.8 Cruze. 3 of the 4 spark plug wells had a oil visually built up on them, obviously the whole plug got covered when I took them out to drain the oil, the coil also had oil all over it too. I put it all back together, started the car engine sounded good (I think) but then I noticed a lot of white smoke coming out of the exhaust, so I shut the car off. Is the smoke probably from the  oil on the plugs and oil (I wiped them off with a rag but nothing crazy). ",3,1762984542.0,2,MechanicAdvice,1763062547,2025-11-12 21:55:42,2025-11-13 19:35:47,"bmidd8 (Score: 1): The smoke should dissipate after the oil burns off, won’t hurt the car. If it was too much oil in the cylinders it wouldn’t have started at all."
1ovilq4,"Thread in lug nut broke off, buggering up threads on stud","How can I cut this off so that the threads will still work/start? I have a die grinder, hacksaw, files. Tell me what to do please.",2,1762984074.0,7,MechanicAdvice,1763062547,2025-11-12 21:47:54,2025-11-13 19:35:47,"Blastomussa1 (Score: 4): Use a file to dress the end, don't cut it. If you cut it it will still have to be dressed, shortening the thread length even more. Failing that, replace it.

hexen84 (Score: 2): Replace the stud. It is typically pretty easy and relatively cheap on most vehicles, there are a few out there you have to remove the hub to do it. Usually you can just smack it out with a hammer and punch and insert the new stud from behind and tighten it down with a nut and spacer."
1ovihzm,2024 6.7 cummins,6.7 Cummins with 45000 on the odometer. Just bought it. Has as pretty good tap That's intermittent. I've researched what I can. Took it to the dealer to have it listen to but I feel like they're just pushing me off until the warranty expires. They claim they intermittent tapping sound is a normal sound And there's nothing that can be done. It's just a characteristic of the 6.7 Cummins. I call bull and I'm not sure what my next step is.  Any advice or anyone had a victory with this issue? Including a video of the sound in case I'm hearing things. To me it sounds like a lifter failing ,1,1762983841.0,2,MechanicAdvice,1763062547,2025-11-12 21:44:01,2025-11-13 19:35:47,dumbasfick (Score: 1): My 2017 doesn't sound like that
