id,title,selftext,score,created_utc,num_comments,subreddit,scraping_time_utc,created_datetime_utc,scraping_datetime_utc,top_comments
1opjmz5,Suspension Noise,"I just got the front struts and sway bar links replaced on my Buick Encore (2013). I now have this new metallic tink noise. What could be the cause? 

Thanks for any input. ",1,1762387154.0,3,MechanicAdvice,1762457787,2025-11-05 23:59:14,2025-11-06 19:36:27,"Flaming-Wreck7986 (Score: 1): Something is loose, my guess is upper strut mount. Either way, we can speculate all we want but definitely take it back.

Jacobi-_- (Score: 1): Turn up your music, no more noise 🤣"
1opjl1d,12v battery,"I’ve got two different batteries both 12v one bigger than the other and higher amps, everytime I charge the big battery is says it’s charging in 6 v and it’s chilling at 7.6v sometimes goes down but it’s a 12v battery, the other battery reads 11.8v on the charger once “fully charged” as much as can be it reads 12.2v I go to start the car it somewhat attempts and then dies and goes back down to 11.8v. It will not go over 12.2v. Can get photos but don’t have anything hooked up right now. Thought about the good ol swap the battery trick get her started with the one in the working car then swap the batteries to try and charge it, any help or advice on why it’s doing that would be great. I’ve gone through 3 batteries in this car over the past 6 months but I’ve got a good starter and alternator and not sure if I’ve just overcharged it a few too many times (smaller battery was working perfectly until I left my glovebox light on) haven’t gotten it started since ",1,1762387013.0,4,MechanicAdvice,1762457787,2025-11-05 23:56:53,2025-11-06 19:36:27,"OstrichLate6082 (Score: 1): Both batteries are shot.

Buy a new one.

Bigdawg7299 (Score: 1): Neither battery is good.  You’ll need to replace them."
1opjimd,misfire sound or sputter without any MIL,"Hi all. I really need some help with my 1998 Grand Cherokee 4.0! I am preparing for a road trip in the next couple days and absolutely have to be back from California to Ohio by the 9th, so I'm in a real pickle here. I've recently thrown a used 90k miles LKQ 4.0l engine into my Jeep because the old one suffered the ole infamous piston skirt cracking. So, with this new engine I've so far installed a new ignition system (distributor, plugs, wires, ignition coil) and the crankshaft position sensor, because the wires had chafing on it, but still hear this sound in the exhaust. For reference, the vehicle's new engine came from a 1998 wrangler. I have zero check engine codes or anything and it otherwise runs perfectly fine. Great oil pressure and nothing else of note. Greatly appreciate your insights. Hope I'm not removing the head later but that's ok if so!",2,1762386842.0,2,MechanicAdvice,1762457787,2025-11-05 23:54:02,2025-11-06 19:36:27,thetamalwhisperer9 (Score: 1): I could be wrong but that sounds like a idler pulley
1opjfjz,Remote Car Starter Defective / Install and Uninstall Fees,"Hoping to get some advice. We won a decent remote car starter and went to get it installed by a reputable technician. He was charging $300 for install plus $100 for an analog interface part (might have the terminology wrong). After install get discovered starter was defective and uninstalled. Now option is to pay over $600 for install, uninstall and the part they say is no good to them. Or pay an extra $350 for a new part and starter. Is this fair? My wife paid $960 already despite them not installing the new starter so I need to decide if this is fair and go ahead or if I want the difference back (if I can get it he has our money already with no real invoice). Never really wanted a car starter in the first place so not too fussed about getting one. This is for an Acura 2011 RDX and a after market remote starter.",1,1762386624.0,3,MechanicAdvice,1762457787,2025-11-05 23:50:24,2025-11-06 19:36:27,"RickMN (Score: 1): You provided the part? If so, the installer is completely off the hook. You owe the install and uninstall fee. This is what happens when you provide your own parts; you assume all the risk that’s it’s the right part and that it works."
1opjdgq,"New brake pads, sound when turning?","Took my car in for brake work, and now it’s making this noise when turning left. Never had that before. 2020 4Runner. Any thoughts?",1,1762386476.0,2,MechanicAdvice,1762457787,2025-11-05 23:47:56,2025-11-06 19:36:27,Muted_Turnover6812 (Score: 1): Could be the backing plate or the missed the quieting pins
1opj8dh,What would you guys charge for a bulb replacement on a traverse 2019?,,1,1762386106.0,5,MechanicAdvice,1762457787,2025-11-05 23:41:46,2025-11-06 19:36:27,"stpatrickwillis (Score: 1): If you’re helping a friend, a pizza.

If you’re a shop, an hour."
1opiso9,Any input appreciated!,"I  bought a 2010 Chery QQ 0.8L inline-3 from a deceased estate, and it had never been serviced. The car only had 65,000 km on the clock.

After driving it for a while, it started making the noise from the video above. I decided to give it a full service, including an oil change, oil filter, petrol filter, air filter, radiator flush with new coolant, spark plugs, and spark plug leads (since the old ones were burnt through).

I was hoping the noise would improve or go away, but it hasn’t. I’ve also used Liqui Moly Injector Cleaner and Liqui Moly Hydraulic Lifter Additive, but there’s still no change.
",2,1762385008.0,7,MechanicAdvice,1762457787,2025-11-05 23:23:28,2025-11-06 19:36:27,"Debaser1990 (Score: 1): Wish I had some advice, I'm just amazed to see Chery QQ on Reddit. I wanted this to be my first car so bad when they were supposed to be sold in the US. The deal fell through somehow and we never got them.

-The_Legacy- (Score: 1): Sounds like Mr crabs running towards you"
1opiq9v,Cam Sprockets rotated. Can I rotate them back? Is there proper process?,"As the title says. Was working on my jeep liberty 2.4L engine and the cam sprockets accidentally rotated out of position. Looking back, I now realized my cam locks were not seated correctly hence them slipping. My crankshaft is still at what I would consider TDC, however the CAM sprockets are not lined up anymore. This is an interference 4 cylinder 2.4L engine. Working on getting photos. No timing chain installed at the moment. Rotation happened post timing chain removal.

Can I just rotate the cam sprockets individually? Should I put them back on and rotate the crankshaft to TDC again? 

*update: the engine is an interference engine. ",1,1762384836.0,2,MechanicAdvice,1762457787,2025-11-05 23:20:36,2025-11-06 19:36:27,"Flaming-Wreck7986 (Score: 1): Honestly I wasn't aware any modern engines were non interference. Yeah you'll be fine though, just rotate them back to the locked position. I'm not sure how the timing/lock system works on this engine, but I hope there are timing marks on everything or the lock only goes in a spot when they're at tdc? Just put everything back to tdc and pray you don't have to redo it lmao.

After you throw the chain on just rotate it a few times and make sure everything still looks good, but that's common practice anyways."
1opilz1,Timing 05 chrysler 300 3.5l,,1,1762384557.0,2,MechanicAdvice,1762457787,2025-11-05 23:15:57,2025-11-06 19:36:27,"Muskratjack (Score: 1): I feel like the top left cam needs to come back one tooth, but I'm having issues getting it there when I tighten the tensioner, I've tried clamps and blocks but when I release them it wants to go back to this. 

Am I going to need to keep taking it off/putting it on until it's perfect or is this within running parameters?

Everything with the engine is fine, but from what I read I need to turn the crank over a couple of revolutions to make sure everything stays correct with the belt, yet I start feeling resistance after a half turn of the crank.

I'm trying to beat the cold, so any hasty advice is welcome, thanks ahead of time."
1opilmw,What in the world is this hanging?,2011 Acura RDX turbo. This piece is just hanging and dripping water. What is it? Any help is appreciated?,4,1762384535.0,16,MechanicAdvice,1762457787,2025-11-05 23:15:35,2025-11-06 19:36:27,"Possible_Move7894 (Score: 17): AC drain line. And holy crap Redditors need an intervention about trying to be funny

Radiant_Street_5448 (Score: 9): If its clear water and doesnt smell sweet then its the AC drain hose"
1opi79s,Problem With Oxygen Sensor Monitor Prior To Smog Check,"According to my OBD2 reader I've managed to get all of the ""INC"" readings to clear prior to my northern California smog check...except for the ""oxygen sensor monitor."" 

I don't normally drive my car (2006 Honda Accord) much, so I've taken my car on several highway trips hoping this will do the trick.

Is there a way to know whether I just need to do more ""drive cycle""...or if something is broken?

Thanks,  
Allen",1,1762383578.0,5,MechanicAdvice,1762457787,2025-11-05 22:59:38,2025-11-06 19:36:27,"LWschool (Score: 1): If there’s no actual active engine codes anymore, yeah it’s probably just being picky. Vehicles originally sold in California have slightly more strict standards for those self checks."
1opi5nv,Muffler Snapped.,"My muffler snapped off, any way I could hang on the underside, or attach it back to get it to the shop or should I just give in and pay for a tow? I drive a 2008 Honda fit",1,1762383466.0,3,MechanicAdvice,1762457787,2025-11-05 22:57:46,2025-11-06 19:36:27,kyden (Score: 3): Remove the muffler and drive it to the shop.
1opi58j,Would you save her?,"2012 Nissan Altima, 150k miles. 

Mechanics are saying my catalytic converter is having issues. We are going to try a cleaning and hope for the best. Besides that, it also needs new spark plugs, fuel induction service, new engine torque mount, new outer tie rods, new serpentine belt, new sway bar end links, new powersteering return hose, powersteering fluid flush, a throttle cleaning, and a new TPS sensor. All in all about 5k worth in repairs. ",1,1762383439.0,7,MechanicAdvice,1762457787,2025-11-05 22:57:19,2025-11-06 19:36:27,"LWschool (Score: 2): For 5k for all of that, kinda good deal. But on a Nissan Altima… meh.

Flaming-Wreck7986 (Score: 1): No. Only a maybe if you just put a transmission in it, if not that'll probably go sooner rather than later unless the fluid has been religiously changed, even then I'm sure it's a gamble. 5k is plenty for a car that is much better and more reliable than an Altima. But I also work on cars and know what to look for, I'm aware not everyone could feel confident in that.

If the cat is plugged and causing it to run poorly, yeah try pouring that cataclean stuff in the tank. I have no experience with it but it's cheap enough (only like $20-30 looking it up) so screw it. If it's just a code and it runs fine, I'd still poor it in. Cats also go bad for a reason. 

I'd probably just keep driving it till the wheels fall off. If it absolutely needs a cat because it runs poorly (and you don't live in a state that checks emissions), I'd just get a cheap $80 cat off amazon and have some cheaper shop throw it in for you. 

Outer tie rods and to less of an extent, sway bar links are safety items. I'd get a quote for just those and see how bad they actually are. Belt yeah I'd do and it should be cheap enough. 

Power steering leak fix... depends on cost, how bad the leak is, and if it's leaking onto the alternator or something. Engine torque mount should be pretty cheap, and excess movement of engine does wear other parts. Spark plugs eh I'm sure it needs it but not strictly necessary in terms of driving till the wheels fall off as long as its not actively misfiring. At the same time they're cheap and take less than 5 minutes to do but idk what they're charging you. By tps sensor do you mean throttle position or tire? tire sensors are up to you but you can definitely live without one working.

throttle cleaning and fuel induction services are very upselly, not in the best interest of this car's current purpose for you. Honestly from the services recommended, and how outrageously expensive it is, it seems like they're just hitting you with the books. Dealership I assume. 

I would find a reputable independent mechanic (not a chain shop or something), and get a second opinion. Express what you're thinking about determining if it's worth putting money into, and bring up what dealer recommended along with what I said here about how much is really necessary to keep car running safely for now. Long winded reply but please don't put close to 5k in it."
1opi0bh,Is my engine knocking? Please help ls 6.0l LQ4,"Hey guys, I could use some advice. My front driveshaft U-joint broke and ended up damaging my engine oil cooler line and oil pan. I replaced everything myself and finally got it all back together, but when I started the engine, I'm now hearing a loud noise coming from the bottom of the engine area. Has anyone had this happen before or have an idea what it could be? (Engine was turned off immediately when the driveshaft broke) ",3,1762383112.0,3,MechanicAdvice,1762457787,2025-11-05 22:51:52,2025-11-06 19:36:27,"weoewoewow (Score: 4): Kinda sounds like an exhaust leak? Engine knocking sounds like… knocking: a quick deep thudding.

clapze21 (Score: 1): Sounds like an exhaust leak to me also hard to tell with the crap audio."
1ophueb,2015 Taurus,Doing a timing and water pump job on the 2015 Taurus. Trying to line up the timing marks. I have them all in the correct place but only one cam lock will actually seat. Anybody come across this before? Also have my concerns about the integrity of this motor. Diagnosed the water pump a few months ago and told the client not to drive it. He did an oil change and kept going. Oil was filled with about 8 extra qts of coolant.,3,1762382726.0,10,MechanicAdvice,1762457787,2025-11-05 22:45:26,2025-11-06 19:36:27,"agravain (Score: 2): I dont think you have the marks lined up. the double chain link should be at the crankshaft and the singles should line up at the cams. iirc

Vic_Pirelli (Score: 1): For what it's worth:

https://preview.redd.it/d7fq0mvnwizf1.jpeg?width=827&format=pjpg&auto=webp&s=afbc303e5568798aca76a0fee0752a358ea35fc0

Getting the chain routed from the left cam sprocket to the right cam sprocket isn't easy.  Everything has to be in just the right position.

A few months with coolant lubricating the crank bearings doesn't sound good.  You'll know for sure soon enough."
1ophdeh,2013 Mazda 3 - frozen lugnuts,"Trying to bust lugs on front left wheel of 2013 Mazda 3; think its the original rim/lugs..... All five lugs stuck tight.



Tried



\* repeated PB Blaster and tapping and whacking.....



\* 6 pt impact socket 1/2"" drive



\* breaker bar with the cheater pipe (just over 36"" combined)



\* nearly new Rigid High Impact Torque Wrench.



No joy



I've been doing my own brakes and rotations for decades.  Never met a lug I couldn't remove but then usually I'm torquing them to spec myself.  These were cranked on there by a shop.



Other than returning to the shop, what can I try next?

Thanks!",1,1762381628.0,2,MechanicAdvice,1762457787,2025-11-05 22:27:08,2025-11-06 19:36:27,justiceismini (Score: 2): You could try hitting the lug nuts with a torch to heat them up. I was in the same circumstance as you about a month ago but I ran out of options and had to take it to the shop. In my case though. my wheel studs were heavily rusted and the lug nuts themselves weren't in much better shape. I got the shop to replace all of the studs on all four tires and then I bought some new OEM lug nuts.
1oph0rd,Mechanic says he can't find replacement fuel line,"I have a 2002 olds alero GL2 and the main fuel line needs to be replaced. It's completely done for, and I already knew that. He says he can't find any for replacement but I looked online and I see listings for them. He said he called the locals scrapyards and can't find anyone who has them, and he refuses to replace it if I brought one in.

I just wanna know what's the next step for me. I really need this car. I can't afford to buy another one. Why is he saying he can't find one anywhere? Am I just out of luck? Should I see a different mechanic? ",46,1762380820.0,60,MechanicAdvice,1762457787,2025-11-05 22:13:40,2025-11-06 19:36:27,"Due_Ad_6085 (Score: 101): Go somewhere else

Comfortable-Bag7917 (Score: 68): If he absolutely will not install one you provide and says he cant find one, he doesn't want to do it. Id show him the online listings and if he still won't do it just find a different mechanic"
1opgyow,GlowShift gauge is stuck on when car is off,"I have 4 glowshift gauges. When I turned my car on after work, all but one lit up. The one out is my boost gauze, but the needle still reacted as I drove.
When I got home and shut the car off, the light came on!
All other gauges are off with the car off.
I tried disconnecting the battery, but it did not help.
Now that gauge is stuck on, and I am afraid that my battery will be dead by morning. 
What can I do?
Thanks",0,1762380686.0,3,MechanicAdvice,1762457787,2025-11-05 22:11:26,2025-11-06 19:36:27,"M4gnu5342 (Score: 1): Did you wire the gauge to the same spot as the rest of them… something seems backwards… trace the wires if you can..

Also if it’s LED it shouldn’t kill the car.. start it before going to bed for 10-15mins and it should hold until morning"
1opgpqj,Sealing the vent window,"Got a barn find 96 f150 standard cab, been tinkering with it when I have time. Power washed it yesterday to knock some dust and mouse poop off and both my door pockets ended up full of water. Got to looking around and saw both of my vent windows have a pretty good gap when closed. Was just wondering if any adjustments are possible or if I need to replace the seal/assembly? Any input is appreciated 

TL;DR glass dont seal and would like opinions/advice",3,1762380123.0,3,MechanicAdvice,1762457787,2025-11-05 22:02:03,2025-11-06 19:36:27,PersimmonSlight5685 (Score: 2): I don’t think that you will be able to adjust those but i was able to find what looks like the replacement seals online [OC auto carpets](https://www.google.com/aclk?sa=L&ai=DChsSEwipzKulttyQAxX4K9QBHdrRIX0YACICCAEQDxoCb2E&co=1&gclid=Cj0KCQiAiKzIBhCOARIsAKpKLANwzrqUtP7Lvt9-8s5doPoShDCxkSGQy5_KOKPUwq6pW8l4BkEthZgaAgLEEALw_wcB&cid=CAASsAHkaH-8fVY2EcHrIxJpcITA9tsmcFabjGRvWcjPH_IKl4RTN2R6sqSArZDvTCnhx6i9LbfqxiglapbIQmipbOd-Wby5I3M4v_nY1LbmsVVh-KW7fc2EqANHsCMUASMOItcjV2Iuy-Had-RdKL1ZaEp5QGa27oX5Re7QucyLcxUTHDS1y66nPAydqBWchcxTo_heYretsw4QKVPewyS0HuVF49XDSPlI9hIP8m9A2wxfwg&cce=1&sig=AOD64_3BvUWd_37H2lt6fifF3BM5J3SPPA&ctype=5&q=&ved=2ahUKEwi8_aOlttyQAxWQ5ckDHfRTPYcQwg8oAHoECAsQEw&nis=2&ch=1&adurl=)
1opgpe6,Just snapped this little tube while trying to get to a spark plug ….. what’s is purpose and can I tape it up or need to replace asap ?,,383,1762380101.0,49,MechanicAdvice,1762457787,2025-11-05 22:01:41,2025-11-06 19:36:27,"ButtonChemical5567 (Score: 345): Its a vacuum lines that goes to the fuel rail pressure differential sensor. You should NOT tape it up. You should:
-as someone already mentioned, pull the broken piece out of the elbow and shove it back in.
Or
-replace the whole line with a silicone vacuum line.

muddflapss (Score: 56): I hate vacuum lines.

Brittle as a 100 year old Ritz cracker"
1opgmlf,"p0151 code 2014 Ford Taurus SHO, Is this whistling sound an exhaust leak?","Hey everyone I had my timing chain/water pump and all that good stuff replaced a month ago, and got this p0151 code today. Trying to figure out if they messed up a pipe inside somewhere while doing the work or if the sensor is bad.

Trying and ignore the engine and wind sound, you can hear a whistling from the engine bay it seems, thanks",1,1762379932.0,2,MechanicAdvice,1762457787,2025-11-05 21:58:52,2025-11-06 19:36:27,Nicstar543 (Score: 1): It’s more present in like the last 3 seconds of the video
1opglgw,"I got a problem with a 3 way engine coolant bypass valve on a 2019 Ram 1500 classic 3.6L V6 engine. Replaced it, problem still not resolved. Codes are saying valve is stuck open due to low voltage. What’s the easiest way to fix it without starting a project that will be a problem later on?",,2,1762379856.0,3,MechanicAdvice,1762457787,2025-11-05 21:57:36,2025-11-06 19:36:27,svnbizzle (Score: 2): There is too much resistance in the wiring going to the component-or- not enough voltage is making it to the component. It’s a circuit issue not a component issue…. Look up what specs should be and then measure voltage on the circuit with a multimeter.
1opghw1,Idle stick supposed to do this?,Just bought this used 2001 toyota corolla with 130xxx miles. i noticed whenever i go fast the check engine light blinks then shuts off. whenever im stopped at a light the car will do what its doing in the video. is this normal? my foot is on the brake the whole time ,0,1762379625.0,7,MechanicAdvice,1762457787,2025-11-05 21:53:45,2025-11-06 19:36:27,"basshoss (Score: 2): Your car is misfiring. 

Flashing check engine light means active misfire. 

Probably just a spark plug or coil pack.

OBD2 scanner can tell you which cylinder

TBORLfan (Score: 2): “Idle stick” is great. No hate, i appreciate the chuckle it gave me. Accurate too"
1opgf2c,still getting grinding and thudding. 03 explorer,"
Hey everyone,

I’ve been trying to track down a front-end noise that I can’t seem to solve. I already replaced the front driver-side hub assembly, but the grinding and intermittent thudding are still there. I’m down about $170 and hoping to avoid throwing more money at parts that don’t fix it.

Here’s what I’ve done so far:
	•	Checked all suspension components (tie rods, control arms, sway bar links, etc.) — all feel tight.
	•	The drive axle has minimal in-and-out movement and feels secure.
	•	The rotor hasn’t been replaced yet.
	•	This started after a highway incident where I had to replace a component on that corner, and since then, the issue has gradually worsened.
	•	The noise happens mostly when steering to the left and fades when steering to the right.

I’ve uploaded a short video of the front corner assembly so you can see and hear what’s happening. Hoping someone might catch what I’ve missed.

Vehicle: 2003 Ford Explorer AWD, 4.6L V8",1,1762379440.0,3,MechanicAdvice,1762457787,2025-11-05 21:50:40,2025-11-06 19:36:27,"Slvrdgr (Score: 1): Hmm, have you tried rotating your tires yet to see if the sounds or direction of sound changes?"
1opgdro,Ignition coils need changing 2017 Toyota Corolla LE,"Helloooooo. Check engine light came on with the “trac off” light. Went to O’Reillys to check what the diagnostic codes were. The report says cylinder 4 misfired too many times within a predetermined period of time. Also cylinder 2 has been misfiring.

I was informed that i should replace not only cyclinder 4 but all of the rest as well. And to also replace the spark plugs. They quoted me $270 for the kit, no labor bc they recommended for me to just watch a video on YouTube and do it myself. I’m looking online and i see packs ranging from $50-100 on advanced auto parts, car parts, Walmart, apremium etc.

Are these reliable parts or should i go with the ones at oreilys or something similar? Also should i double check the diagnostic codes at another shop to make sure or are they normally accurate ?

",1,1762379358.0,4,MechanicAdvice,1762457787,2025-11-05 21:49:18,2025-11-06 19:36:27,stanleywilson333 (Score: 1): I would go oem on those. Probably ngks. Rock auto sells them. Oreillys should sell them 2 but probably pricey
1opg5f4,Spicer U joint install issue,"2007.5 Silverado 3500HD, 250K miles, 2-piece driveshaft. Can’t center the u joint.

Originals (fairly sure) were not easy to remove, lots of back & forth with ball joint tool, PB, and impact gun. Hope I didn’t tweak the yoke geometry, as impact was really maxing out (mid range 20V Dewalt).

First time with non-greaseable joints and haven’t done one at all for years. I didn’t monitor which cap came from which side and now learn I should, due to precise amounts of grease inserted at the factory. I used the press and impact to install, probably shouldn’t. 

Pressing back and forth, squeezing some grease out of one side (not shown in photo), I can get some decent movement in the joint but not buttery. Seems risky to think driving it will center it up and balance. 

Do I need to toss it and start over? Went down the removal path and got one cap off, but don’t think I can cleanly extract the whole thing without really messing up grease volumes. ",1,1762378813.0,10,MechanicAdvice,1762457787,2025-11-05 21:40:13,2025-11-06 19:36:27,"Ianthin1 (Score: 1): First thing I see is the caps are in the wrong locations.  You have one cap for inboard clip and one for outboard clip on each axis.  Caps should match on each axis.  Looks like the smooth caps for outboard clips belong in the yoke on the driveshaft.

Edit:  Also make sure none of the rollers fell over and are blocking a cap from fully seating.  Happens pretty often and can be easy to miss.

woreoutmachinist (Score: 1): Looks like the cap on the right dropped a roller."
