id,title,selftext,score,created_utc,num_comments,subreddit,scraping_time_utc,created_datetime_utc,scraping_datetime_utc,top_comments
1o85lqo,Debadging gone wrong?,How to get rid of this ,5,1760619851.0,21,autorepair,1760729627,2025-10-16 13:04:11,2025-10-17 19:33:47,"Sufficient-Reality-8 (Score: 5): Take it to paint specialist may be able to blend it

shotstraight (Score: 5): Someone repainted the panel and left the badges on instead of removing them. You are seeing the old paint. Put the badges back on or repaint it.

jasonsong86 (Score: 6): This is why you don’t debadge on older cars."
1o83pic,Is it possible to fix rims in this condition to make them look new again?,,2,1760614421.0,11,autorepair,1760729627,2025-10-16 11:33:41,2025-10-17 19:33:47,"Bulldog78 (Score: 1): Yep, you can find tutorials on YouTube. They show how you can do it with and without a mounted tire.

jasonsong86 (Score: 1): Of course.

Obvious-Bid-546 (Score: 1): Wheel refurbishment shop, that does diamond cutting."
1o82skd,Can it be repaired,"So this is KIA RIO  2013 / FEB
i dont know what my engin name 
The ECU wire was cutted and i dont have the digram to repair it,  can any one help me out ",1,1760611382.0,4,autorepair,1760729627,2025-10-16 10:43:02,2025-10-17 19:33:47,"Coyote_Tex (Score: 1): So, the wires have been rejoined in some manner.  Does the engine start and work?  What's the problem?  Do you just not like how the repairs work or have you diagnosed them as being faulty for some reason?

BosssNasss (Score: 1): Realistically a new wiring harness is required, along with keeping whoever worked on that away from any other faults in the future.

jshell1955 (Score: 1): Sorry that repair job was done crappily. The tape is loose and when that happens it's likely that you have one or more bad connections. 

Redo and retry, and use shrink tubes this time. This is a mess worthy of a seventh grader."
1o82m90,Start a collision repair in the US 🇺🇸,"I’m reaching out to all U.S. body shop owners for some advice.

I don’t currently live in the U.S., but I’m planning to open a high-end body shop/collision repair center, most likely in Texas.

At first, I believe that finding customers will be the most challenging part of this project.

What would you recommend doing to attract work from the very beginning?

I’m also very interested in obtaining manufacturer certifications — such as Porsche certified, Mercedes certified, Ferrari certified and so on.
What’s the process to get certified, and do you think it’s worth the investment?

Thanks in advance for your help!

#bodyshop #collisionrepair #texas #business


",3,1760610763.0,6,autorepair,1760729627,2025-10-16 10:32:43,2025-10-17 19:33:47,"Doc-Brown1911 (Score: 2): I don't own a automotive business but was an automotive engineer for years and have seen this bubble pop a few times. The bubble that we have been in for a number of years has already started to pop. People just don't have the money anymore. Why do you think you see so many stupid automotive raps instead of actual paint? It's a lot cheaper rap than paint. 


Finding qualified technicians that you can afford to pay is something that every automotive business in the US is struggling with right now. Fresh out of school techs don't know enough and old techs cost too much. There's a major labor gap in today's labor pool.


Starting a high end shop anywhere in the US is going to be very rough. People just don't have the disposable income anymore. And the people that do have the disposable income, already have a shop that everyone else in town works with because of word of mouth. 


It's not about the shop, it's about having a name people know and trust.


Not trying to turn you off to the business. Far from it. I just want you to understand that I've seen a lot of these businesses fail over the years. Be financially prepared to lose money for the first couple of years.

justabucketofwater (Score: 1): You haven’t mentioned anything about process. You don’t belong in this trade."
1o7ztri,DIY or pay a machanic,"What i know about cars, you could proberly fit on back of a match box..

But im concidering to do a DIY flush  (or multiple part flushes) ive seen a dozen yt vids, and all of em have the car up on a jack and use specilaised tools.. i have none of these, i bought a sython pump for a tenner, and Im thinkin maybe just suck it all out. And Replace it with new fluids, mainly coolant  and break/clutch fluids. I know this wont get all of it out, But say i do it 2-3 times over a few month, and the old mixes with the new, will it eventually be all brand new? 

Would i be able to do this myself, or am i risking blowing up my car, especially if they 2 types of fluids in they while it mixing.  Or shall i just trust a shop  who will see me coming a mile of, who may or may not do it 🤣

Thanks in advance. ",0,1760599895.0,13,autorepair,1760729627,2025-10-16 07:31:35,2025-10-17 19:33:47,"Character-Welder3929 (Score: 5): You could 


But it's not the flushing part that's difficult 


It's the filling up and making sure there's no air in the system that's critical 


I promise you it's absolutely worth the piece of mind not over heating and potentially killing the cunt 


Just ask if you can watch and learn as you keen as fuck

catdude142 (Score: 3): Sounds like you should delegate the job to someone who knows cars.

DNA1727 (Score: 2): DIY with your friend and a few cold beers."
1o7wun5,"Mazda 6 ,Orange light in starter and car wouldn't work","Greetings guys hope u doing well.

As the video shows car wouldn't start even though the battery is good condition and the light for it is green car still not working , any idea what's going on or some had same experience could help a brother here?",3,1760588836.0,7,autorepair,1760729627,2025-10-16 04:27:16,2025-10-17 19:33:47,"MeNahBangWahComeHeah (Score: 4): For folks who don’t have a volt meter to test the battery, you can buy a cheap volt meter that plugs into your car’s 12 volt power port (cigarette lighter port).  This handy little device tells you the state of your battery before you start the car.   After you start the engine, the voltage usually jumps up to around 14 volts, which proves that your alternator is charging the battery.   This little device has saved me multiple times, by informing me of a dying battery or an ineffective charging circuit.  The average tow truck driver will only want to tow your car to the nearest car dealer, who might want to replace the battery, alternator, and everything else they can think of.   So you could end up paying over $1,000 in parts and labor, when your only problem was a loose battery connector clamp, and a battery that needed to be recharged.

TheOneAndOnlyPengan (Score: 2): Check charge level of battery. That is an easy fix.

achopshopworker (Score: 1): Battery no bueno amigo. Get it changed out should be good to go"
1o7u8lo,2013 CRV - Axle advice - OEM or aftermarket,"Mileage -120,000 miles

My CRV has been shaking pretty good when getting up to speed between 60-72mph (after about 72 the shaking dampens quite a bit or stops completely).

At first I thought the tires needed to be rotated. So I took them in to Big Brand Tires and they rotated and then went for a test drive with one of the workers. They put the CRV up and looked underneath and said the front axles are shaking pretty good and probably should be replaced. They recommended to ONLY go with OEM Honda axles, but the price tag is around $600 per axle according to them - so $1200 for parts.

I am seeing online I can get aftermarket axels for around $150 each - So $300 for parts - For a difference of almost $900 total. SEEMS CRAZY. Are the aftermarket ones truly that bad? Or is there a good brand of aftermarket that is comparable to Honda OEM.

Any advice would be appreciated.",1,1760580725.0,8,autorepair,1760729627,2025-10-16 02:12:05,2025-10-17 19:33:47,"Bruce65lv (Score: 1): Never had a problem with aftermarket axles.

ImpossibleBandicoot (Score: 1): They're fine for daily drivers. Generally the build quality on OEM axles is better, one option is also to explore rebuilt OEM axles unless it's bent or something.

Also, a CRV with 120k probably has more front end issues than needing an axle replacement. Your control arm bushings, sway bar links, tie rods, struts etc may all be approaching EOL at that age and mileage so I wouldn't be surprised if more needed to be replaced. 

Last thing is, make sure the tires and wheels are all balanced, imbalanced wheel will exaggerate any front end issue.

subrosa-squirrel (Score: 1): What I normally do to weigh the cost is how many miles does it have and how long do I plan to keep the car. IMO I have installed several aftermarket CV axles and never had a problem with any of them, I would save the money and go aftermarket if it was me. Also, if you decide to purchase from Amazon instead of a parts store read the reviews and focus on the bad ones. If a lot of people complain about the same issue it's your sign to stay away. Just my thoughts"
1o7sfxf,Concrete paint scratches??,"So I managed to scrape the side of my car pretty bad on the corner coming out of a parking garage and the paint in these places is definitely gone. Any suggestions to fix this, because I'm not so sure a paint pen is going to help me here especially over time...",1,1760575613.0,1,autorepair,1760729627,2025-10-16 00:46:53,2025-10-17 19:33:47,"UndiscoveredSite22 (Score: 1): The scratches will remain. But clean it with soap and water first. let it dry, then wax the hell out of it. If its super shiny it will come off as glare, the masses will be none the wiser. Worked on my wife for about 3 months."
1o8lty7,Weird sound coming from my Honda accord,"I own a 2011 Honda accord that’s been giving plenty of trouble with the crankshaft position sensor. I recently just started hearing this weird sound when starting the car and while idle. Does anybody what it can be?

It’s already been through two different mechanics and both have said it was fine.",3,1760657674.0,4,mechanic,1760729627,2025-10-16 23:34:34,2025-10-17 19:33:47,"3RDGENX (Score: 1): You need to record the sound from under the hood. Can't hear it good enough to diagnose anything.

Nukelure (Score: 1): This is incredibly vague, and I can tell from a figurative glance that it'd be a pain in the rectum to find, no wonder they summed your problem up. My best guess is HVAC related if you cant hear it outside the car. is ur A/C charged? Coolant topped off and properly bled of air? 

With this video thats the best you'll get"
1o8lmfq,How to remove  human Urine from fabric passengers side seat?,"Happened like 15 minutes ago, my bladder is sensitive from having a baby lol ",1,1760657129.0,4,mechanic,1760729627,2025-10-16 23:25:29,2025-10-17 19:33:47,"azgli (Score: 3): Enzyme cleaner followed by steam cleaner. Should be pretty easy. 

NovelLongjumping3965 (Score: 1): One of those pet spot cleaners. After blotting with paper towels."
1o8l59i,Is this good starter clearance or what should I adjust,,0,1760655866.0,4,mechanic,1760729627,2025-10-16 23:04:26,2025-10-17 19:33:47,"RentonZero (Score: 2): You can nip the bolts down then take them back half a turn and start the engine a few times. If it's quiet tighten them back down, if it's screeching and keeps doing it try loosening the bolts a bit more and try again

CapitainMuffin (Score: 1): I should state that this is a Chevy 350 on an 87 Firebird"
1o8l20z,2020 gmc sierra brake fluid leakin in cabin,Just got the truck from a dealership used as is with 60k miles. Now everytime i press in the brakes fluid leaks out ,1,1760655634.0,5,mechanic,1760729627,2025-10-16 23:00:34,2025-10-17 19:33:47,"84cricket19 (Score: 3): Either the Brake master cylinder is bad or the brake booster seal is bad.

DiazIsDirectCurrent (Score: 1): These have an electronic brake booster unit, the rear seal has given up. The part alone is about $1500. "
1o8iqcr,Is my harmonic balancer bad on my base 2012 corvette?,,5,1760649826.0,3,mechanic,1760729627,2025-10-16 21:23:46,2025-10-17 19:33:47,"Ok-Attitude4043 (Score: 2): Yes, common issue. Don't wait until it comes off.

You_Cannot_Wield_It (Score: 1): commenting so i can check back later, i have a similar looking problem except mine is leaking oil too"
1o8i5fa,Rattling noise normal ? Superb 2021 2.0 TDI,Fairly paranoid about this rattly noise. Is this normal for a diesel ?  In the background the rattly noise is visible. ,1,1760648453.0,4,mechanic,1760729627,2025-10-16 21:00:53,2025-10-17 19:33:47,"DigEnvironmental7490 (Score: 1): To me this sounds like a smoothly-running diesel engine.  I don't hear rattling, but maybe a VW expert will chime in.

Diesel engines sound different because the combustion event in the cylinder is more abrupt than it would be in a petrol/gasoline engine.

RedCivicOnBumper (Score: 1): You should hear an F250 with a diesel.  This is nothing"
1o8hsgs,Yall think no spark? 1998 ford f150 4.2,,2,1760647585.0,6,mechanic,1760729627,2025-10-16 20:46:25,2025-10-17 19:33:47,"Puzzleheaded-Bag-121 (Score: 2): Put them all back in with the exception of the one second from the left. Plug in the coil or wire and put the spark plug in it with it resting on metal (any metal on the engine is fine). Start the car and see if it sparks.

Edit: alternatively put the spark plug in a different cylinder, run it for 15 minutes, pull it once the engine is cooled, and see if it still looks the same.

shotstraight (Score: 2): You could buy a $5 spark tester and test each one."
1o8h2vs,1990 Ford F150 XL 5.0 302 EFI causing me trouble (fuel especially) but cant figure out what i need help,"Issues that have happened
1. Tank only wants to take 8 gal on the front tank (its a 16 gal tank) 
2. When i filled both tanks up the front and rear it bursted the tube from the rear and started leaking it from the top and when i changed the tank to the front one it began doing the same thing but this time on the front 
3. The Fuel gauge stays up while the truck is off
4. Drove it until front tank marked less than a quarter and next day it marked half a tank (didnt even fill it) 
5. Engine stalls sometimes when slowing down doesnt happen alot tho
6. Truck struggles to turn on when engine warm
7. Spends my entire 18 Gal rear tank in just a 50 mile drive on the highway (70 mph average) (probably normal but i just wanna make sure)",0,1760645932.0,7,mechanic,1760729627,2025-10-16 20:18:52,2025-10-17 19:33:47,"Kellie_Avepops10 (Score: 2): The fuel selector valve is leaking internally or one or both of the in tank pumps' check valves are. The fuel is meant to be pumped to the engine, and excess fuel from the pressure regulator returns it to the appropriate tank. However the valve in the pumps that resists back flow has failed or the selector valve is allowing the fuel to return to the inappropriate tank. In essence your full tank is over flowing when the opposite tanks pump is running and you're dumping fuel out as you drive instead of using it. This needs an immediate repair by a knowledgeable professional.

marriedthewronggirl (Score: 1): Watching comments on this, as I have similar issues with my 90 f150. I do believe that there is only 1 vapor return line that goes to front tank. This explains how your front tank gets filled by itself. Being a 35 year old vehicle, have you inspected ALL fuel lines going to your tanks? The 1990 has a high pressure pump in each tank, unlike the older ones with 2 lp and 1 hp"
1o8fvem,1990 GMC Jimmy 350 Wiring Diagram,Hi everyone. I’m just looking for where to find a wiring diagram for a 1990 GMC Jimmy. It’s for my dad. Thanks all,1,1760643207.0,3,mechanic,1760729627,2025-10-16 19:33:27,2025-10-17 19:33:47,Stingray34 (Score: 1): [https://charm.li/GMC/1990/Jimmy%20Full%20Size%20V8-350%205.7L/Repair%20and%20Diagnosis/](https://charm.li/GMC/1990/Jimmy%20Full%20Size%20V8-350%205.7L/Repair%20and%20Diagnosis/)
1o8fkrq,Car window corner bent.,Hey! Sorry if this isn’t the right sub. Basically had a lock smith come out and he bent my driver side door up. Already called and got a partial refund. Is there anything I can do to fix it? I tried kicking it but I’m not tall enough thanks. 2013 Honda civic ,3,1760642525.0,11,mechanic,1760729627,2025-10-16 19:22:05,2025-10-17 19:33:47,"fudelnotze (Score: 12): Open the window.
Then bend it back in place.

InnerDistribution450 (Score: 3): Put your knee against the door panel. Grab the top corner of the door. Pull just a hair past where you want it to be. See if, when it springs back, it lines up like you want. Another option is to have a body shop do the work.

Edit. Remember leverage is your friend.  So put that knee up as high as you are able. Also, when you pull the corner, you want to pull in more gradually as opposed to snapping it in place."
1o8edgw,Power steering lines. My new favorite.,"03 Liberty 3.7L
Replacing the high pressure line and can’t get it threaded further than this into the gear box. I got it this far with a crowfoot wrench and my fingers. I put a ratchet on it, but it doesn’t want to turn… I’ve gotten it to this point again and again. What do you think? Run a tap through it? ",12,1760639835.0,11,mechanic,1760729627,2025-10-16 18:37:15,2025-10-17 19:33:47,"spaghetiwires (Score: 17): That's very obviously a flared line. Start the car and see if it leaks. It's normal that it does not thread all the way in.

Odd_Development8983 (Score: 3): That could very well be where it seats. Most power steering lines and brake lines will stick up a little just like this"
1o8e8v6,Clunking/Knocking and creaking noise coming from Passenger side.,"2017 Honda Accord EX 4 Cyl

There’s a clunking/knocking noise that’s only audible when slowing down or coming to a stop. There also seems to be a creaking noise recently when it comes completely to a stop. I changed the front end link which I thought was causing the issue but seems to have come back and sounds louder and worse. Any recommendations? ",1,1760639556.0,2,mechanic,1760729627,2025-10-16 18:32:36,2025-10-17 19:33:47,fxetantho (Score: 2): Check your whe3l nuts
1o8dsdl,Please help im at a loss and a little bit overwhelmed..,"I have a manual 2003 honda civic ex for starters, i've had my check engine light on for a while codes coming back are for catalytic converter and camshaft position sensor. A couple of months ago my car was having trouble starting, so I took it to a family friend mechanic who decided I needed a new starter, so we replaced that and It was running perfectly fine until yesterday when I tried to start it up there was no response AT ALL, it wouldn't even attempt to turn over, I could hear a little click from maybe power trying to turn on but nothing other than that. I've got codes \[ p0300, p0301 , p0302, p0303, p0304 (all cylinders are misfiring) , p0341 (camshaft position sensor) , p0420(catalytic converter issue) , and P1456 (small leak in evap system somewhere). The car does start when we push start it so it sounds like the starter I just replaced might be faulty?? My question is, where should I even start to fix my car, to at least get it up and running again? And do all of these issues somehow come together to one problem causing a domino affect? I'm very far from being a mechanic so a little guidance would be so so appreciated. Thank you all for your time",1,1760638552.0,4,mechanic,1760729627,2025-10-16 18:15:52,2025-10-17 19:33:47,"rosscO66 (Score: 1): Sure it's the cam and not the crank sensor?

azgli (Score: 1): Have you load tested the battery? "
1o8d2ut,Strange sound,"Hey everyone,

I have an Audi 1.4 TFSI from 2015 with 140,000 km on it. I know these engines are known to produce some ticking sounds due to the direct injection system, but this sounds quite loud, especially during a cold start.

It has an timing belt not chain!

I would really appreciate your opinions —
Does this sound normal for a 1.4 TFSI with 140k km, or is this excessive ticking?

Video is with a cold engine.",4,1760636997.0,2,mechanic,1760729627,2025-10-16 17:49:57,2025-10-17 19:33:47,"Flying-Toto (Score: 2): Injectors are loud when engine is cold. Totally normal

No worry about the ticking sound but check for a roller, there is a high noise behind."
1o8akar,Replace bushing?,"I bought a 2008 Tacoma base V6 4l. Whenever I hit a speed bump, I get a creek coming from the front right wheel. How does this bushing look to you? Messed up?",1,1760631495.0,2,mechanic,1760729627,2025-10-16 16:18:15,2025-10-17 19:33:47,"RJ45p (Score: 2): Thats a balljoint and it *looks* fine but looks aren't how you tell. I'd check your strut mounts and control arms first, also maybe grab a grease needle and fill the rubber portion from the inside on that balljoint - the rubber is a dust cover and grease boot. Meant to keep the grease in. Sometimes doesn't do its job too well and the joint gets dry, so a grease gun and needle can be helpful"
1o8928t,2012 Mercedes E350(help),"My sister-in law just sent me this picture saying she hit a small (5” pothole) doing about 30-35mph this morning, i cannot fathom this happening from that. what are your guys opinions and how should i go about fixing this ",1,1760628145.0,2,mechanic,1760729627,2025-10-16 15:22:25,2025-10-17 19:33:47,"armathose (Score: 1): You need a new rim, maybe a tire as well."
1o88dbk,Weird light came on,"2004 Lexus es330, the check engine, abs, brake, and maintenance light are always on but the one with the car and rear beams I think? Does anyone know what it is?",30,1760626569.0,87,mechanic,1760729627,2025-10-16 14:56:09,2025-10-17 19:33:47,"OpossEm (Score: 97): god damn your car needs jesus. it’s probably a light for saying a brake light is out. you should really get your lights checked out. constant brake light on and ABS light can be dangerous. possibly low brake fluid/leaking brake lines

kodiportalgabe (Score: 16): I remember one time my Camry's sensor lights started turning on for no reason (ABS, traction, etc). I ignored it and planned to take it to my mechanic my next day off. Well, later that evening my car wouldn't turn on. It was the battery. I don't remember if I had to change the alternator with it however."
1o8893i,Is this an oil leak or something else?,"151 ford focus mk3

Found a puddle on the ground (not the one in the video) and it smelt like oil. But in the video It's a clear liquid with no scent. Does anyone happen to know what this is?

I checked all the liquids in the car and they're all fairly full im just wondering if the car is safe to drive on as my gf needs to use it for the next 4 days to get to work or if she has to call in sick to take the car to the garage ",0,1760626296.0,8,mechanic,1760729627,2025-10-16 14:51:36,2025-10-17 19:33:47,"Jumpy_Active_2857 (Score: 5): sure its not water? ac?

TrapBoiLul (Score: 1): 
*
This is what i seen first, looks and smells like oil"
1o87cal,How bad is this I think it’s my transmission oil I just did an old change yesterday and found out it leaks ??💔,,11,1760624195.0,25,mechanic,1760729627,2025-10-16 14:16:35,2025-10-17 19:33:47,"ChanceFlamingo3058 (Score: 9): It looks like either you have the wrong O ring (too big) or it’s not tightened enough. I’d try to tighten it and see if the O ring goes invisible and if not then get the Ring from the dealer, replace it and then try.

anonymous25389 (Score: 5): Where is it leaking from? Your picture just shows the drain port which doesn’t look like it’s tightened all the way. If it’s a slow leak you can just baby it and check the fluid every now and then. If it’s leaking a lot it will obviously need to be fixed. This pan looks pretty accessible so it shouldn’t a major bill unless you run it out of fluid and ruin the transmission."
1o7x3h6,Need shifter cable for a 1998 Ford Mustang,"My sister needs to replace the shifter cable on her 98 Ford Mustang. It came off the hanger and dragged on the road for several miles. All that is holding the 2 halves together is a bit of the rubber coating. I've looked at sever different shops, junk yards, and even Google. Maybe I'm not searching right or something. I find plenty of 99-04 parts, but almost nothing from before. Can anyone help me, please?",1,1760589672.0,3,mechanic,1760729627,2025-10-16 04:41:12,2025-10-17 19:33:47,"Away_Option437 (Score: 1): The car is an automatic V6.

Reddittunataco (Score: 1): The Ford part# is F4ZZ-7E395-A. It is discontinued through Ford but you can still find them."
1o7wlsl,Evap system problems,"Every time I try and fill up my 1999 ranger xlt 3.0v6 the gas pump clicks off, it’s not a leak because it’s not throwing any p0445 or p0442 codes but it’s getting to be an issue.",1,1760588012.0,3,mechanic,1760729627,2025-10-16 04:13:32,2025-10-17 19:33:47,"NightKnown405 (Score: 1): There are two possibilities. Either there is a restriction or blockage of the path that the air and vapors in the tank follow during refilling which is past a check valve at the top of the fuel tank, to and through the canister, through the canister vent valve to the filter assembly. Or there could be debris in the filler neck blocking the fuel from flowing into the tank. Someone will have to test and prove what is going on."
