id,title,selftext,score,created_utc,num_comments,subreddit,scraping_time_utc,created_datetime_utc,scraping_datetime_utc,top_comments
1mz9c26,Brake pads,Hello! My brakes had been squealing really bad sounding like metal on metal so I thought my brake pads were worn out and needing to be replaced. When we took them off they looked like this. The middle is fine but the sides are worn down really bad. What does this wear pattern mean? ,1,1756074027.0,6,AskMechanics,1756150330,2025-08-24 22:20:27,2025-08-25 19:32:10,"Stay_OnceCarat (Score: 1): The car is a 2020 vw jetta s with 55k miles on it

Coakis (Score: 1): It means nothing, that's factory beveling."
1mz99vw,2007 Toyota Camry wont come out of park or start,"Some things don't have power, some do. Battery is at a healthy 12 volts. We can't even shift the car into neutral. Any help?",1,1756073875.0,3,AskMechanics,1756150330,2025-08-24 22:17:55,2025-08-25 19:32:10,"Naive_Ad_6975 (Score: 2): Disconnect the battery for a couple minutes then reconnect

No-Concern3297 (Score: 1): Steering wheel is locked.  I drive the same car since it was new and so far that’s only happened to me bc the steering wheel was locked.   The gear selector won’t move and they won’t crank while wheel is locked.  I did all of this stuff ur doing in the video and it was just a locked steering wheel.  Turn key to ON and tug on the wheel either way.

Also check it for a B2799 code if it’s not locked steering wheel.  It’s an immobilizer communication code that sets when key is on its way out. If that’s problem, it’s not doing anything bc it doesn’t recognize the key.

Other possibility is ignition switch is bad.  That’s more likely if you have a ton of shit on ur key ring.


Oh BTW.  If I wanted to be evil and fuck with someone, I’d break a leg off a fuse.  That test lamp ur using, a fuse sabotaged in that manner will still test good.  Lol.  Pull them out.  Maybe someone doesn’t want u to use the car."
1mz95v0,What wire is this?,"A mouse chewed through this wire. What is it, and can I replace it myself? ",2,1756073597.0,9,AskMechanics,1756150330,2025-08-24 22:13:17,2025-08-25 19:32:10,"SnooPeanuts8613 (Score: 2): Hard to say exactly for sure, but it connects to a solenoid of some kind, looks to me like something for the evap system or possibly a crank case breather or something. If you have some ability to solder (or use butt connectors) you should be able to source a new pigtail for that wire. Just see if there's a part number on that solenoid that it plugs into and you should be able to eventually find the right plug. From there it's just cut off the old plug and crimp or solder the new one on. Did this today.

jweezee (Score: 2): Looks like an evap purge solenoid but I don't know where those hoses go to say for sure. Look up that part for that vehicle and see if it looks the same"
1mz8mqk,Automatic ignition gone,"Hi

I drive a 56 plate Vauxhall corsa automatic.

Drove it a long way today and everything seemed fine until I tried to start it again later in the day.
Turning the key did absolutely nothing and the electrics of the car (dash lights and radio) were stuck on. The key buttons didn’t work to lock it either.

I phoned AA and when they came he said he could start it but I had to pull a fuse out when I got where I was going to turn the car off.

On the drive back home the car was struggling to accelerate until it got some speed as if it was stuck in a high gear.

What could have cause these issues?",1,1756072298.0,4,AskMechanics,1756150330,2025-08-24 21:51:38,2025-08-25 19:32:10,"Ok-Quiet-1233 (Score: 1): I apologize for my ignorance in this question but why do you call it a 56 ?

Wouldn’t the car be a 2006 or 2007?"
1mz8cnx,Is my car safe to drive til I can get my alternator replaced?,"I attached a photo of the autozone battery diagnostic report. From what the mechanic there told me, he said I should be fine for a few days til I can get it into my shop. Battery and ebrake lights came on together omw home from work today. I have about a 20 min commute to work, 14 miles each way. I work monday and tuesday and was hoping to be able to drop it off tuesday afternoon. What do yall think? 2006 subaru outback legacy 3.0L, 134k miles",15,1756071616.0,45,AskMechanics,1756150330,2025-08-24 21:40:16,2025-08-25 19:32:10,"WanderingRobotStudio (Score: 42): You're on borrowed time. You may need to jump your car, it could even shut off on you while driving.

davidm2232 (Score: 11): I'd say no. Throw a battery charger and generator on the roof. I did that for months with my beater pickups when I was in high school."
1mz80j1,What would you do? (08 cts engine),"I’ve got a Clean 2008 Cadillac CTS with the 3.6L V6 (126k miles, RWD). It threw a P0008 code (cam/crank misalignment) a while back, and now the engine’s completely seized - won’t turn over. I knew it was coming, oh well. I’m on a tight budget (looking for around 2k), have some experience, and a small driveway workspace. Got sockets, torque wrench, basic tools. 

I’m thinking DIY engine swap with a used 3.6L LY7. it’s my first swap, and my space is cramped. Car’s VERY clean, but only worth $600–$1,200 non-running. Worried a used LY7 might have chain issues later (this one died from stretch).Would you swap the engine or sell it as is and grab a running car

What would you guys do?",0,1756070792.0,27,AskMechanics,1756150330,2025-08-24 21:26:32,2025-08-25 19:32:10,"ChrisShiherlis- (Score: 10): not that

Downtown_Calendar_84 (Score: 5): What you can do is try to find car faxes using the vin the used engine was pulled from, if it looks like it has decent maintenance history then id use that engine  however if none of them have good maintenance records then youre either finding a refurbished engine or doing cam chains and other maintenance on a pulled engine. Since its already out that would be the time to do it.

 Or be scummy and throw in some random cheap engine and sell the car right away, potentially dooming someone else. This, I do not recommend."
1mz7xxz,Engine/drivetrain swap?,"Theoretically, would it be possible to put a 2.0L T or a 3.5L TT ecoboost in a nissan altima? I want to turn my 2012 altima into a project car at some point in time, and I feel like these are good engines to put in",1,1756070616.0,3,AskMechanics,1756150330,2025-08-24 21:23:36,2025-08-25 19:32:10,"Sqweee173 (Score: 1): You have to get the control units to play nice which probably isn't going to be easy to do

sexandliquor (Score: 1): This is one of those things where anything is possible if you have the money. But also if you have the kind of money to do that (and you’ll likely need a lot of it) then why the hell would you waste it dumping it into a Nissan Altima. I get it because of the sleeper aspect or whatever. But, all said and done you’d be better served just buying a GTR and being done with it."
1mz7xum,synthetic blend vs full synthetic oil change?,"
hi, i wanted to ask , my mechanic told me that bc my vehicle had full synthetic oil change last time , and that it wouldn’t be smart to switch back to a synthetic blend even tho my vehicle can take either or. he explained it a little unclearly so i wanted to ask what the reason was for this is. synthetic blends are just so much cheaper and if my vehicle can take both why not go back to that? i drive a ford focus 2016.
",1,1756070610.0,6,AskMechanics,1756150330,2025-08-24 21:23:30,2025-08-25 19:32:10,"jasonsong86 (Score: 1): With synthetic bend, you need to change oil more often so it might be cheaper to pay, you might end up spending more money in a long run. All engines can take all three kind of oil conventional, blend, and full. Conventional you need to change oil every 3000. Synthetic blend, 5000. Full synthetic 7500 so depending on how much “more expensive” full synthetic is it might be cheaper in a long run. 4 full synthetic oil changes is equal to 6 synthetic blend or 10 conventional oil changes. Similar concept applies to cheap tires. If a set of cheap tires will only get you 20k miles at a cost of $100 each but a $200 tire will last you 50k miles, it’s cheaper to buy the more expensive tires.

Ravenblack67 (Score: 1): I disagree with your mechanic.  You can use syn blend if you want.  It does not last as long as 100% synthetic.  Full Synthetic is a marketing term.  Decades ago there were some issues when synthetic was new."
1mz7u6v,brakes making a thumping sounds when applying the brakes.,"My Wife has been driving her 2020 Toyota Rav4 for the past few years. Last year we stopped driving her car for a year. We ended getting a new car and let her car sit in the garage for a good year until we decided to take it out again. I have been in the auto mechanic industy for 4 years. 3 years as a lube tech and then one year as a tech training. its been two years since ive worked on a car so all my knowlegde isnt there. I knew the car was dead since the alternator wanst running to keep the battery charged. I got a battery charger and charged the battery. Drove the car around the block for a few minutes and I noticed that the brakes where making a thumping sound when i would apply the brakes. Im aware that rust can possibly make the brakes make noise when sitting for a while. The vehicle sat in the garage for almost a year so I don't think rust really built up. I just need some Mechanic help and see if anyone could possibly tell me what could be making the noise before I take the vehilce to the shop.

update: I found the problem. It was the brake pad clips causing  the thumping noise. I just had to clean them off and re align the brakes pads and boom the noise is gone. 

",1,1756070366.0,2,AskMechanics,1756150330,2025-08-24 21:19:26,2025-08-25 19:32:10,ChrisShiherlis- (Score: 1): You've been an Auto Technician for 4 years and can't diagnose.... huh
1mz7ree,Is it worth it to replace the timing chain or to get a new car?,"I have a 240k mile 2006 Saturn Vue. Recently replaced the spark plugs but from it I learned of a timing chain issue that I missed. One mechanic gave me 6 months. One gave it a month and a half. So I'm trying to weigh the options here. The car is in otherwise good condition and regularly gets an oil change. I'm worried that new problems will arise after spending 1.2k fixing this issue. Like, if added a new part will make noticable other poor parts of the engine. Or make them work worse. My family is trying to talk me into getting a new car but my credit is also not great. I have a good job but I'm still paying down a debt from last year when I was out of a job. Id like a second opinion. On what route to take. ",1,1756070185.0,9,AskMechanics,1756150330,2025-08-24 21:16:25,2025-08-25 19:32:10,"2005CrownVicP71 (Score: 1): If I were in your shoes, I would drive it until it dies and then get something newer. Putting $1200 into an old, high mileage car is a risk that you’ll lose that money if anything else goes wrong.

Bruce65lv (Score: 1): No."
1mz7nl4,Are Wix oil filters still good?,I'm using a Microgard oil filter on my 2001 Camry but the anti drainback valve is faulty and it's causing dry starts. I don't want to use Toyota OEM because they don't do good at filtering the oil. Is Wix a good choice? ,1,1756069933.0,7,AskMechanics,1756150330,2025-08-24 21:12:13,2025-08-25 19:32:10,"ChrisShiherlis- (Score: 7): OP you have a 25 year old car you sure that's your problem?

-NOT_A_MECHANIC- (Score: 3): They don’t do good at filtering the oil? Lol. Fleet or dealer serviced vehicles with several hundreds of thousands of miles say otherwise"
1mz7kur,How much to fix,How much do you think this will cost to fix? 50/50 accident but we don't have insurance so we will likely have to cover at least half.,1,1756069752.0,6,AskMechanics,1756150330,2025-08-24 21:09:12,2025-08-25 19:32:10,"ChrisShiherlis- (Score: 1): We call that the Nissan Altima Bump

wrong sub OP try r/Autobody

Hat-Top-Grin (Score: 1): Use a plunger. Save yourself some money"
1mz7jkj,Window tinter cut my window seal.,"I had my 2021 RAV4 tinted last week and noticed a few cuts on the window seal, including one larger slice at the bottom that created a hole. Could this cause any problems if I don’t replace it, or is it just a cosmetic issue?

https://preview.redd.it/l60zz5rv81lf1.jpg?width=3024&format=pjpg&auto=webp&s=92680df8e3351b026887d6c42e061e30e74ad865",1,1756069667.0,5,AskMechanics,1756150330,2025-08-24 21:07:47,2025-08-25 19:32:10,ChrisShiherlis- (Score: 1): did you have your windows tinted by a Professional Shop that does it?
1mz77pj,Brake bracket bolt on too tight. How should I remove?,,0,1756068880.0,35,AskMechanics,1756150330,2025-08-24 20:54:40,2025-08-25 19:32:10,"-NOT_A_MECHANIC- (Score: 8): The right size 6p socket fully seated helps. There may be red loctite on there, so use a torch. Position the breaker a little lower than horizontal, lift with your legs. If the suspension doesn’t compress you’re not lifting hard enough.

jasonsong86 (Score: 8): Use a 6 point socket not 12. Breaker bar with extension. A trick I leaned is turn the steering wheel to allow clearance for breaker bar"
1mz71b3,Coolant in cylinder / crank,"Removed head to change gasket and some coolant pooled in one of the cylinders. Over some time it disappeared, I assume it drained past the piston into the crank. Waiting on another part so can’t run the car for a few more weeks, will this cause a bunch of damage? Also does that have any implications for the piston seal?

2008 Chevy Cobalt 2.2L Ecotec",1,1756068475.0,20,AskMechanics,1756150330,2025-08-24 20:47:55,2025-08-25 19:32:10,"1paniolo (Score: 2): Likely got there when you pulled the head.  Yes it probably drained into crankcase past the rings. Shouldn’t do any damage unless you try and start it before draining the contaminated oil.

ChrisShiherlis- (Score: 1): you assumed it did?"
1mz6lut,Help - 8th gen 2007 Hybrid AC not working DTC B2992 - Open in Thermal Protector Circuit,"Year 2007  
Make Honda  
Model Civic Hybrid  
Engine 1.3 L  
Mileage 120k miles

I posted here a while ago. All the other codes cleared up. I did also open the C101, threw some electrical cleaner at it and then this remained.

Thus far I have also gone to the AC clutch connector. Using Alldata, provided by my local library, this is essentially pins 11 (GRN) and 12 (BRN) on clip B of the climate control unit (i.e. CCU) which effectively makes it way to the 3-wire AC clutch connector and 11 -> 1 (BLU/RED) and 12 -> 3 (RED).

The doc says to check for continuity between those wires, as in 11 to 1 and 12 to 3. I found that 12 to 3 was open. I have a tone prober and traced it to a wiring harness just right of the 4th ignition coil. Almost center of the engine bay.

Now comes the weird part, this wire doesn't do anything special, so I jumped it from the CCU all the way to the 3-wire. It still doesn't turn on. AC light comes on but no AC. Clutch also doesn't engage.

The AC fuses and relays are fine. I tested them and can also jump the relay to make the clutch engage.

Anyway, when I look deeper into the schematics, I see that the CCU essentially ""grounds"" wire 12 (i.e. 3 on the AC clutch connector) to ""activate"". So I then jumped wire 3 direct to ground. Clutch still doesn't activate and no AC.

Looking further at the schematic it almost seems like the compressor has its own relay and fuse. I'm not sure but this is a wiring diagram and it does show the entire path, I would imagine it may show the path to the fuse relay with a little surrounding box but it doesn't.

Basically, any help here would be appreciated, from all the diagnostic steps I have, this could be an open or the CCU is bad. Unfortunately I can't find where to replace the CCU even from Honda OEM parts suppliers. I have confirmed the open between 12 and 3 but I also jumped it which as far as the schematic says, should be sufficient.

Also using the Honda AC (i.e. recirc + rear defrost), I get what I believe is 5 blinks ... or 6 blinks which means:

5 - A problem in the mode control linkage, doors, or motor (I do have the car door open when doing this)  
6 - A problem in the blower motor circuit (I don't know if this is true because the blower motor blows stuff)",1,1756067479.0,5,AskMechanics,1756150330,2025-08-24 20:31:19,2025-08-25 19:32:10,"tuphluv (Score: 1): Also, I did have to remove the top shield to get to the C101. I don't want to have to do that everytime, I'm sure it can be opened up easily so if anyone knows how to unplug the C101, I'd be very appreciative! I just don't remember if I pushed down or pulled up. I think I pulled up to open it from the engine bay in which case, any tips or tricks would be great :-D

tuphluv (Score: 1): It's the CCU and or something bigger, hoping not the compressor because that was B2989 and that went away after a long drive and some electronic parts cleaner.

Essentially the Alldata diagram for the layout regarding B2992 diagnostics was wrong but as I mentioned, Alldata also has the wiring schematics.

Following the wiring schematics I tested with my tone prober BRN and GRN, to C101 and then all the way to RED and BLU/RED AC Clutch 3P successfully. Then I also did a resistance / continuity test by using telephone cord that was just coiled up in the house. Put two ends in the CCU B ports to the actual BRN and GRN wires and carried it over to AC Clutch 3P and tested it there.

So going to give that a shot. The only other item I want to test is the AC PSI sensor but I think I need to back probe that as I can't read it real time w/ my OBD. If anyone knows if ThinkDiag 2 can do it, LMK. I know it's a subscription, but scan tools are pretty handy.

TIA!"
1mz6e1x,Whirling Noise?,"I drive a 2022 Hyundai Sonata. For the past couple weeks, whenever I start driving at any speed, I keep hearing this “whirling” noise from the drivers side tires.

I’ve taken it to 2 mechanics, and they both said that it’s the wheel hub. So ofc I replaced the wheel hub and it’s still there. Does anyone have any idea what else it couple possibly be??

I’m thinking maybe the brake pads, the rotors or the rotor shield maybe?
The steering wheel doesn’t wobble, no change in pressure needed when braking.

Any help would be much appreciated, I’ve been bleeding through costs for it.

",1,1756066974.0,6,AskMechanics,1756150330,2025-08-24 20:22:54,2025-08-25 19:32:10,ChrisShiherlis- (Score: 1): Left Front Wheel Bearing
1mz68se,"2017 Chevy Trax, what is this and how do I fix it?","I'm hoping I don't need to buy another one, but if I do, what is this called? I want to try to fix it myself because it seems like something I'd be able to do if I can find a video or something. I just gotta know what it's called. I looked up trim, but I just got a lot of videos of random metal decorative pieces on the sides of doors being fixed with tape",1,1756066635.0,5,AskMechanics,1756150330,2025-08-24 20:17:15,2025-08-25 19:32:10,"jasonsong86 (Score: 4): Remove the clips from the metal. Put them back on the plastic trim and then clip it back on. Some of them broke off so you need new clips.

ChrisShiherlis- (Score: 1): wheel well side trim but it likely has many plastic fasteners that go up into wheel well."
1mz60w3,"Psi drops 2 every 1-2 weeks, is it serious or the weather?","I know the weather can change and affect psi but is it like a leak or is it the weather itself. I bought fix a flat just in case I need to use it but before I use it, I’d like to have an opinion. It only happens to one of my 🛞 ",1,1756066138.0,7,AskMechanics,1756150330,2025-08-24 20:08:58,2025-08-25 19:32:10,"Patrol-007 (Score: 2): 1 psi drop for every 10F decrease. 

But should be consistent for all tires. Measure when cold (before driving, not in the sun)

If alloy rims and the tires have been on for six years, have the tire bead sealant reapplied. 

Tirerack.com

Fix a flat will make tire and TPMS (pressure sensors) non repairable. Just carry a bicycle floor pump or compresser 

Newguydoesntknow (Score: 1): 2005 Town & Country Chrysler"
1mz5hjv,Looking for honest opinions…,"I’m trying to get my daughter something reliable that can last her a good 3 years at least. The Jetta she has keeps getting its catalytic converter stolen and shes just ready to get out of it and trade it in. How do you guys feel about Mazdas? I don’t know anyone who’s owned it but I also can’t recall hearing/seeing any videos where people complain about them like they do certain models. Also, are there certain make, model, and years that you prefer. Much appreciated for any feedback 🙏🏽",1,1756064891.0,4,AskMechanics,1756150330,2025-08-24 19:48:11,2025-08-25 19:32:10,"Background_Radish238 (Score: 1): Honda CRV.

Vuvuian (Score: 1): I definitely love my 2003 Mazda2 DY Genki ☺️

Ol reliable friend it is. I service & repair it myself whenever possible.

https://preview.redd.it/xy7z8p2182lf1.jpeg?width=3264&format=pjpg&auto=webp&s=879fb59a56c15e1c45e2f9dc46920261e21f0f6f"
1mz5bpb,Loud pop when jacking car,"2013 hyundai Elantra 1.8L sedan

Title and I’m an idiot. I was jacking my car to do my brakes today when I heard a loud pop. I let the car off the back right when I heard it. I was jacking on what I thought was part of the subframe (image 1).

Now this tube is detached and I saw a little water leaking from it. Any idea what it is and where it connects? (Image 2)

Any help is greatly appreciated man to man (or woman) ",1,1756064519.0,4,AskMechanics,1756150330,2025-08-24 19:41:59,2025-08-25 19:32:10,"Nada_Chance (Score: 2): Pop could have simply been the car subframe shifting on the lift pad of the jack, and tilting the car made some collected A/C condensate run out the drain.

CommunicationSad887 (Score: 1): Well, can't really judge from the first picture, but I think that is not a part of the subframe but part of the unibody itself. Could be wrong though, I am not familiar with this car. If you can't see any dents, I would not worry about it too much, other than not to jack up from that spot again. Could just be metal reacting to the pressure and environmental temperatures etc.

I can however answer your second question. I am 95% sure that is where the water of the airconditioning is released. Totally normal for it to leak water when it ran on hot, sunny days the same day of the day(s) before."
1mz5an5,2013 Hyundai Tucson. Just lights come on and not turning over.,Died about 5 days ago and haven’t been able to jump it or charge the battery with my battery pack. Battery is reading 12.47 V. ,1,1756064453.0,9,AskMechanics,1756150330,2025-08-24 19:40:53,2025-08-25 19:32:10,"Ravenblack67 (Score: 1): It could be the starter.  Check fuses, the battery terminals, the wire going to the starter.  Bang on the starter with a wrench."
1mz4p13,Mystery Grand Prix issue,"My 2004 Pontiac Grand Prix GTP cuts power to the dash display (guages, HUD, radio, a/c, etc) often when I am driving and try to accelerate quickly, or when I try to maintain speed driving uphill. The engine continues running though so I can continue driving. After I’ve turned the car off and turn it back on, everything is restored until it happens again.

It’s been doing this for a few years now and I haven’t bothered dealing with it because I assumed it’s an electrical problem, and because I can usually just pop the car in neutral and turn the car off and on again while I’m still driving. 

Any mechanics that have dealt with this specific issue? Is it something I can fix myself?
I’ve owned the car since 2017 and it’s currently at 363000 km",1,1756063075.0,2,AskMechanics,1756150330,2025-08-24 19:17:55,2025-08-25 19:32:10,"Entire_Permission_14 (Score: 1): Check your wiring in your engine bay. Make sure grounds connected to your engine are clean and not full of oil from a leak or gunk. Look for broken wires or wires with green crust. Make sure your battery terminals are clean.

Check where your ecu is, I think those cars have it in the air filter box. Make sure a rat didn't make a meal out of the wiring."
1mz48u7,What is happening with my 07 Camry,"Started hearing this screeching noise with the AC on about a week or two ago, eventually it started the screeching even with the AC off, it will screech here and there mostly when I’m idling but it will kick in while driving too, especially on take off at stop lights. Changed the serpentine belt per several suggestions and it still screeches, last night on my way home from work , my battery light, and ABS light started flashing, battery light eventually stayed on, and when I got home and tried to start my engine up again to check it, it will not start. Is this more likely a problem with the alternator itself , or a bearing/pulley issue? Everything I try to look up about it, they all seem to lead back to one another, TIA! ",2,1756062067.0,9,AskMechanics,1756150330,2025-08-24 19:01:07,2025-08-25 19:32:10,"ChrisShiherlis- (Score: 2): It's getting Old OP

Rough-Philosopher130 (Score: 2): 07 Toyota Camry 4 Cylinder is has a swapped engine (same engine) about 60k on it but the ODO reads 160."
