id,title,selftext,score,created_utc,num_comments,subreddit,scraping_time_utc,created_datetime_utc,scraping_datetime_utc,top_comments
1ozwozf,"Best used car around ~£10,000?","Hi everyone, to cut things short here is a rough overview:

I am 19, this is going to be my first car and I know next to nothing about cars.

I will be driving the rest of my family, hence 4 seats are a minimum, with me being on the taller side, thus also likely needing a decently tall car (?).

Aside from the obvious of looking to get lower-end insurance group cars, I highly value comfort and reliability, with things like a decent speaker system, infotainment, decently high mpg, and such also playing a key role.

Some of the offers I have potentially considered include:

\- Honda Civic

\- Peugeot 3008

  
but I'd like to hear your thoughts on what I should get, and preferably what trims/years I should be looking at. Thank you",0,1763423850.0,10,CartalkUK,1763494543,2025-11-17 23:57:30,2025-11-18 19:35:43,"Agreeable_Ant_7107 (Score: 6): I don’t think you wanna spend 10K on a first car you want something small and easy especially your insurance going to be quite high as a new driver I’m guessing , try like a golf or polo around 2014-2016.

just-the-Gasman (Score: 2): Honda civic. Yaris. A Corolla may be? Those will cover all your needs!

Famous_Tie8714 (Score: 2): Don't get caught up on the height thing.  Some small cars will be absolutely fine, and some larger cars will feel surprisingly cramped.  There's really no logic to it and the only way to tell if you are going to fit comfortably is to go sit in one."
1ozvw2h,Any mechanics in? Estimate for repairs,"Hi all, I’ve just been crashed into at a roundabout. If I’m not going down the insurance route, how much would this cost to repair? Dacia Duster 19 plate Prestige. Thanks.",0,1763421782.0,2,CartalkUK,1763494543,2025-11-17 23:23:02,2025-11-18 19:35:43,"Specialist-Abies-909 (Score: 2): Write off. Go through insurance why would you pay for it otherwise?

Pitiful-Wrongdoer692 (Score: 0): What's it worth 8-9k? 

Insurance will wanna replace rear 1/4 and door skin...so will likely write it off...due to costs...probably looking at 5-6k ish....

Decent bodyshop with a old fashioned pannel beater will probably be able to pull that out without replacing the 1/4, probably get a second hand door in colour off ebay."
1ozvqbo,Is f82 m3 an okay first rwd,"Hey, so I’ve been looking for a new car. Ive had a few hatches then an s3 and then an rs3 for a short period. I was looking at a few different cars and the f80 seem insane value right now. I was speaking to a friend that has one however he warned id probably have to spend around £8000 on preventative maintenance and that it’s also too powerful as a first rwd. He told me to stick to rs3s (Im worried this is as he doesn’t want us to have the same car). I’d appreciate any advice even on the maintenance im looking at one around the 60k miles mark and looking to spend around £25k. Thank you in advance",0,1763421389.0,8,CartalkUK,1763494543,2025-11-17 23:16:29,2025-11-18 19:35:43,"Ziemniok_UwU (Score: 2): M3 is perfectly fine but the RS3 is far more usable even in terrible weather. Both are going to cost a fortune to upkeep so thats not really an argument for either side.

j_Ples01 (Score: 2): I bought my M4 in April this year and it was my first RWD and high performance car. Honestly, when you're not driving like a clown and trying to kick the arse out, it's a lot more grippy and stable than I was expecting after everything I'd read online. 

However, absolutely do not skimp on tyres. I have the Conti Sport Contact 7s on it as most people will tell you they're the go-to tyre for these and grippier than the PS4s.

£8k preventative maintenance? BS from someone who knows nothing about these and the S55.

If you're not planning to tune it, the crankhub is simply a non-issue and extremely overblown online. As evidence, the 'ring taxi F8X cars with 250k+ Nurburgring-only KM on the clock don't have an upgraded CH and have not had any issues with it.

Feel free to ask me anything else about these cars.

ADJE777 (Score: 1): Yeah great cars and the limited slip diff arguably is more controllable should you slide than an open diff on the 40i cars. 

The S55 maintenance isn’t as bad as made out unless you get one that hasn’t been properly maintained in the first place.

Also as a technical point F82 is the M4, F80 is the M3, F83 is the M4 Convertible."
1ozv5ne,Drop in MPG,"Hi,

A few weeks ago, I brought my Toyota Corolla '21 to a dealership for a random check due to a discrepancy in tyre air pressure readings. Since then, I have noticed a couple of changes.

Firstly, I've observed that the parking brake now automatically engages when shifting the gear to park mode, and it disengages when I move from Park (P) to Drive (D). Previously, I had to manually engage the parking brake before parking and press the acceleration pedal to disengage it when moving to Drive. While this may seem like a helpful feature, it has caught me off guard.

Secondly, I’ve noticed a significant drop in fuel efficiency. Before the service, I was getting around 67-68 mpg, but since getting the car back, it has dropped to approximately 58-59 mpg. Although my driving conditions remain consistent, I’m curious if the drop could be attributed to winter weather or if there might be another underlying issue. 

Does anybody had this issue ? 


FYI I had it serviced few months ago. 

Thanks. 
",0,1763420001.0,3,CartalkUK,1763494543,2025-11-17 22:53:21,2025-11-18 19:35:43,"OrdinaryAncient3573 (Score: 5): Presumably it got a software update. That may have updated inaccurate MPG calculations, or it might be unrelated, and to do with weather, more traffic, you're pressing the throttle a bit harder - that one might be because the software update changed the pedal setting, or some such - or all kinds of other things.

1995LexusLS400 (Score: 2): Is that drop in mpg something you measured yourself with the refueling receipt and a calculator, or what the car is telling you?

My currently daily drivers computer says I'm averaging 75mpg, but my wallet says I'm averaging 68mpg. Car mpg computers usually overread quite a lot. Given that the way that the parking brake works has changed, I'd guess that Toyota did a software update while it was in there and now it's giving you more accurate mpg readings.

just-the-Gasman (Score: 2): I had a 2020 2.0 Corolla and the fuel average I used to get would be around 58-65mpg. 
The parking brake would always engage automatically, I think you can turn it off if you want to. My current car needed to have manual activation of parking brake which seemed a bit strange to me until I realised it was turned off. 
In the winters, the average does drop noticeably so I wouldn’t bother too much."
1ozv0ka,"If you had £37k spare for a car but prefer it not depreciate too much, what would you buy?","I have spare cash and could sensibly spend £35-£40k on a dream car. I would prefer one that doesn't depreciate too much. My dream car is Alpine A110 in this bracket (not sure if I fancy a special edition but they're a fair bit more). I had a lexus rcf before and so beautifully luxurious but it was rather expensive to run! 

Anyway, what would you buy, and why?

  
Just a bit of fun!

  
I drive a mb c250 coupe 2014 plate and got 140k miles on it, part of me wants to keep it for another 100k plus since they seem to easily achieve and I love the car to be honest but considering getting dream car whilst I am young(ish).",1,1763419657.0,89,CartalkUK,1763494543,2025-11-17 22:47:37,2025-11-18 19:35:43,"RepresentativeStooj (Score: 16): If you’re dead set on not saving it for something else, a W204 C63 AMG. 

They’ve sort of levelled off in price and you’d still have 5-10k for the inevitable repairs.

blubbered33 (Score: 18): Lotus Elsie. Now they're not being made anymore they will only go up in value. Already going up in fact.

Famous_Tie8714 (Score: 7): The alpine is what sprang to mind when I read the title before I even saw you mentioned it.  Something classic is probably better in terms of depreciation though."
1ozutxg,Squeak noise from my bmw f30,"I have a bmw f30 320i manual 2016. I am hearing a squeaky noise from my engine bay, it is not a stead squeak it happens after every revolution if that makes sense. It is starting to get cold here so is because of moisture. Any advice would be great, I have had the car for a week. ",0,1763419223.0,1,CartalkUK,1763494543,2025-11-17 22:40:23,2025-11-18 19:35:43,tune-happy (Score: 2): Tensioner or pulley
1ozurcj,335d touring or golf r estate?,"Both seem like great options. I’m sure lots have owned them on here. Which is your pick any why?

Daily driver doing circa 10k / year

Mid 30’s, no kids but an active lifestyle means a bigger car is preferred. Can’t decide between these two. Or maybe an alternative I’ve not thought of?

Not necessarily these two exact examples, but 335d touring vs r estate",1,1763419046.0,36,CartalkUK,1763494543,2025-11-17 22:37:26,2025-11-18 19:35:43,"Taylor2597 (Score: 4): I would pick the BMW. But remember you’re paying a big premium on any works doing to it. Just had to get a load of bodywork done on mine… £800 for a headlight was painful🤣

JackRowley (Score: 8): 335d touring would be my pick!

jock_fae_leith (Score: 2): I had a 330d xDrive Touring with a 310bhp map for 6 years, am now in year 3 of Leon Cupra ST (ie same platform as Golf R estate).

335d all day.  Feels much more solid, driving dynamics are better with the rear biased AWD, Golf/Leon feels like a FWD hatch 95% of the time, but without the benefit of the trick diff you would get in many fast FWD hatches.  6 pot paired with the ZF-8 is a lot better than the 4 pot/DSG and goes like stink from pootling in low revs in a way that the VAG car doesn't.  iDrive is miles better than VAG's touchscreen.  BMW split tailgate is a nice feature.

Downsides to the BMW - boot is a bit smaller due to the rear wheels intruding - the Golf/Leon floor is essentially a regular rectangle whereas the BMW wheel wells shave off about 25% of the boot floor.   BMW manual seat adjustment (if it doesn't have electric option) is rubbish compared to VAG.  Earlier xDrives suspension was not the best (springs a bit soft), many owners like me fitted AC Schnitzer uprated springs.  Later models had some of the shortcomings addressed.  Adaptive Suspension is a nice option to have and can be used to stiffen the feel of the suspension.

If you are dead set on a VAG car after all this have a look at the Leon Cupra ST as it comes with all the options eg Dynamic Chassis Control as standard, unlike the VW."
1ozuchi,Is a hybrid suitable for my driving pattern?,"I've owned a diesel for the last five years that has somehow coped with my driving pattern which consists predominantly of a 2 mile round trip for the nursery/school run, occasional 30min round trip at weekends and once a month 4 hour round trip on motorways to visit family. The long trip must be doing the job of sorting the DPF out.

Looking at my next car I was thinking Hybrid or PHEV would be more suitable given my short trips (I know electric would be ideal technically but humour me) but I've read this driving pattern would really screw over the petrol engine given how little regular use it would get. And that actually it is the worst possible choice. Is this right?! ",5,1763418085.0,31,CartalkUK,1763494543,2025-11-17 22:21:25,2025-11-18 19:35:43,"ajh489 (Score: 21): If you're considering a regular ""self charging"" hybrid, then I see no issues at all. Just drive it however you want and the engine will work itself out.

ryanstarman123 (Score: 10): hybrid and phev have a feature that tells you if you need to use the engine and i have a similar driving pattern and works wonder for me i mainly use the battery in summer and engine in winter

EntirelyRandom1590 (Score: 7): This is basically how I used a Vauxhall Ampera. Only after 6 weeks (covid lockdown) did it force an engine burn cycle.

But definitely just get a BEV."
1ozu9ru,Coolant leak help,"Hello Ladies and Gents . Noticed some dry pink Crust and can feel wet pink coolant on the black hose towards the silver clip/clamp. Does anyone know what this pipe is and where the leak is coming from?. Car is Audi A5 2014 TFSI 1.8 Petrol. Could it be the Coolant hard pipe / small return hose above the turbo?
",1,1763417907.0,3,CartalkUK,1763494543,2025-11-17 22:18:27,2025-11-18 19:35:43,"Purple-Orchid-3693 (Score: 1): Here is every part of the coolant system for that car: 
https://audi.7zap.com/en/europe/a5-s5-coupe-sportback-8t3-8t8-facelift-parts-catalog/coolant-hoses-for-vehicles-with-auxiliary-heater/#modification_id=1245294&group=3&node=439137
Looks to me like the line has split or gotten a hole, if you find the exact part you can replace it. Shouldn’t be too much.

Man_in_the_uk (Score: 1): I suspect it's coming from the hose with the green dot above it. Would be worth cleaning it all up and monitoring after every drive.

CaptainAnswer (Score: 1): Looks like the pipe with the green dot on the hose is either split or the clamp is failing, give everything a really good clean up then check again after a few miles - make sure theres enough coolant in it before you do anything else tho"
1ozu0ef,Need help it’s going to be my second car.,,1,1763417300.0,1,CartalkUK,1763494543,2025-11-17 22:08:20,2025-11-18 19:35:43,"JackRowley (Score: 3): It seems dear to me, would have an 08 Passat for €2500 here in roi and we’ve the vrt added into that price too."
1oztw51,Should buy it or not? Help please 🙏,,0,1763417019.0,13,CartalkUK,1763494543,2025-11-17 22:03:39,2025-11-18 19:35:43,"Low-Break-3694 (Score: 4): Miles? Service history? Private sale? We need these details!

Numerous-Paint4123 (Score: 6): Are you a taxi driver?

hollie040 (Score: 3): I'll play. DVLA says it had done 116k at the last MOT in September. The fact it's had an MOT every six-ish months or so says it's been a taxi. Last three MOT passes were clean. I mean, it might be alright? But impossible to tell without a service history."
1oztu5v,Since everyone is against a 20 year old buying a BMW what do you suggest?,"Given my past few posts, no one really likes the idea of a young person driving a BMW regardless whether I got the money or not so what should I get then?

Requirements: 

- should be able to do a 40/50 mile motorway commute at one go without issues
- I live in London so ULez free is ideal 
- need minimum 4 passengers 
- Low insurance quote, I’m probably going to sell the car after a year, the car won’t even be used much, I’ll keep it to claim the NCB
- something very reliable that won’t break the bank something I can fix easily and cheaply, something that does not cause issues 
- as cheap as possible to buy but must be of good quality 
- Not important but big bonus it’s quite fun to drive 

Please let me know car makes, models, what year reg and how much mileage I should be looking at.

Is FSH important on these smaller cars?

I WILL GET THAT BMW eventually!",0,1763416889.0,56,CartalkUK,1763494543,2025-11-17 22:01:29,2025-11-18 19:35:43,"PhysicsAgitated6722 (Score: 9): If you want a BMW and can afford the criminally high insurance premiums, get one. I don't know why you're listening to others. I have owned a few, and they are great until they are not, and then they are  guaranteed to empty your bank account.

As to FSH, yes. A well maintained car is less likely to cause you issues. It's especially important when you resell it because it will make it easier to sell.

DepthVisible2425 (Score: 3): If you're not going to use it that much just get an old Japanese car and bank the 1 years NCD. You can save up for a better spec /younger BMW next year then, and of course your premium will be far lower.

R2-Scotia (Score: 4): My daily is an 04 plate SAAB. If it's been maintained properly I see no huge issue, but be prepared for stuff to break as it simply wears out."
1ozttxa,Mazda 3 2L or Honda Civic 1.8 V-TEC?,I’m hesitating between these two for modele between 2016 and 2020 ? What do you suggest guys?,0,1763416874.0,2,CartalkUK,1763494543,2025-11-17 22:01:14,2025-11-18 19:35:43,"ToPractise (Score: 3): Very biased but the 3 will be a better driving experience (especially if manual). Think the interior on the 3 is a little more exciting too.

Both are reliable as hell, just avoid the 1.0 Civic.

It depends what you need it for, but I'd go with your gut on this

Ziemniok_UwU (Score: 1): Civic is more spacious and has the biggest boot in class. Mazda is a bit more exciting and a bit faster.

Both are good, we have a Civic 1.8 in the family and its never let us down. Magic seats are amazing for transporting items."
1ozts9j,Looking to upgrade my car in the next 2 years is this a good choice,Currently drive an I20 and want something abit faster I have heard good things about the MG3 SE just would like some advice. ,0,1763416777.0,34,CartalkUK,1763494543,2025-11-17 21:59:37,2025-11-18 19:35:43,"ToPractise (Score: 8): Just a heads up, no one here is going to recommend an MG.

Forza5026 (Score: 3): certainly are risks to getting this, not too safe, small boot, cheap interior

Sammydemon (Score: 3): Imagine paying £18k for that"
1oztq8h,Torn between BMW & Toyota & Hyundai,"I’m looking for my next car, and I’m stuck and want some input, pretty different cars I know, all options work for me just down to reliability and honestly driving experience. I’ve had a BMW in the past, had a bottom end and got rid of it.

The options are:
BMW 320i / 320D / 330E ( looking at the 2019 year )
Toyota Yaris GR
Hyundai I20N
Hyundai I30N

Would love to know your thoughts on which one I should purchase! I am genuinely torn because all are great cars",0,1763416647.0,13,CartalkUK,1763494543,2025-11-17 21:57:27,2025-11-18 19:35:43,"kharma45 (Score: 1): Well first of all, do you want a run of the mill small saloon or a hot hatch? They’re very different propositions.

just-the-Gasman (Score: 1): I was in the same position. I had the perfect 318d 2020 picked out but I hesitated. I went for 2.0 Corolla hybrid and had no complains. A mind fully relaxed and no worries. 
Try Lexus as well if you want to have something more premium feeling

Ziemniok_UwU (Score: 1): GR Yaris is the most fun but probably overpriced for what it is. I30N/I20N are better value and still super fun so I would get one of those."
1oztbny,Thoughts on this mx5 as first car?,"Hello,

Thinking of this mx5 Nc1 sport. Seems like a decent price for the miles and condition. 

No rust
Clean mot history 
66k miles 
Service history and 4 new tyres

I keep reading about how cheap mx5 are but all the ones under 4k all have rust


Would appreciate any thoughts or advice !

It’s between this and an old Saab 9 3 at the moment :)
",56,1763415708.0,53,CartalkUK,1763494543,2025-11-17 21:41:48,2025-11-18 19:35:43,"boomerangchampion (Score: 49): Looks very clean to me, those headlights haven't got a speck of fogging on them. Make sure you stick your head right underneath it to really look for rust.

Whether I'd recommend it as a first car I'm not sure. They're not exactly untameable beasts but they'll go if you hoof it, and they'll go sideways if you *really* hoof it. Make sure you get an insurance quote first as well.

Famous_Tie8714 (Score: 23): Not long ago I'd have said that price was crazy, but I guess these days not so much.  If insurance is reasonable then go for it.

ThorburnJ (Score: 11): If its truly clean and rust free underneath then go for it - assuming insurance is doable for a first car.

I'm not known for my sensible car buying decisions though.

I had a Mk2 MX-5 at 20 and as my first rear wheel drive car it taught me a lot."
1ozt1v2,Advice pls,"My car - 1.9TDI skoda fabia estate - has started making a humming sound when i turn off the engine. Just for a few seconds, and then it fades. I know for a fact the timing belt needs changing - i just dont know how imminently. Could this sound be linked to that? Im so worried and so skint lol so hoping its not that rn",2,1763415100.0,1,CartalkUK,1763494543,2025-11-17 21:31:40,2025-11-18 19:35:43,TimeForGrass (Score: 1): Hmmmm... 
1ozskjz,Did I make the right move not buying this rust bucket or was I being paranoid?,,0,1763414040.0,11,CartalkUK,1763494543,2025-11-17 21:14:00,2025-11-18 19:35:43,"InViewOfNothing (Score: 6): Everything you've shown there is surface rust on replaceable components. The subframe is a bit more costly to do but it doesn't look bad enough from that photo to need replacement anyway

verone3784 (Score: 3): From the photos, that just looks like average surface corrosion on the subframe and suspension components that develops over the life of the car.

Any car that's more than a couple of years old is going to start to develop surface rust on pressed steel subframe parts and the exposed steel on cast suspension parts like this. 

From the limited views in the photos, it looks like even the exhaust, the heatshield and the actual floor of the car look to be in great condition.

Annual_Lab1719 (Score: 2): No info about the car (age, mileage, price) 😄

All looks like surface rust, no holes, etc. 

I would say normal for something 15-25 years old, 100k+ miles"
1ozsc4w,Motorway - selling experience?,For those have used motorway - review/rate your experience? How close did you get to the quoted price etc? ,0,1763413507.0,5,CartalkUK,1763494543,2025-11-17 21:05:07,2025-11-18 19:35:43,"DeanyyBoyy93 (Score: 1): They will tell you one price when its been through their auction but then when the person turns up they just say its the wbac price. Standard they do it at every visit the dude said. 

geubes (Score: 1): A year ago, I was estimated 14k, auctions ended at 13,750. Guy turned up with a truck, paid 13,750 and away it went. Easy.

underrated_tool (Score: 1): Four years ago.

Excellent, no trouble at all, I picked up their agent at the train station. He drove off two hours later in the car, money, as agreed, in my account, no issues."
1ozsbof,0% APR EV DEALS ELIGIBILITY,"Hi Guys,
Looking at some offers on the new electric vehicles and wondering if there is any minimum salary requirement to qualify for these PCP deals.
Dont want to face embarrasment as I am on around 30k per annum currently.",0,1763413479.0,13,CartalkUK,1763494543,2025-11-17 21:04:39,2025-11-18 19:35:43,"Famous_Tie8714 (Score: 4): Credit rating is going to matter more than your salary, and you can check that online for free.  It's actually pretty easy to get car finance as it's secured against the car.

raulscholes (Score: 3): Not to be rude but why do you want to buy a new EV on £30,000 per annum? Buy an old car - wait till you reach a higher salary , preferably 40% bracket with a company offering salary sacrifice ( if that scheme still remains when you reach that threshold )

Car is a depreciating asset and there is a saying don’t buy one on credit unless you can afford to buy it in full

thatbigbigenergy (Score: 1): Have a look on CarWow"
1ozrshl,2nd Car Advice,"I’m in the long process of purchasing a car to replace my first car (Hyundai Getz). 

My 1st Car:

Hyundai Getz 1.1L GSI
4 Door, 5 Seats
66 BHP
Quite a small boot and seats quite tight but normal for a smaller car. 
Mileage: 100,000
MOT: 10 Months Remaining 
Tax: £165 Per Year
Manual

Whilst, I think I’ll keep the car for at least the remaining 10 months, I wanted to think long term and look for a second car in the meantime. I think I’m quite interested in a MK7 Golf, I’m enthusiastic for cars but not super into it. I just want a car with a bit more enjoyment, reliability, fuel efficiency, bigger boot space and space for my passengers whilst doing more longer commutes. I’ve added a car advertisement for the type of car I’m looking for. Would this car be suitable and is it overpriced? I feel like it is but that’s the car market these days lol.

2nd Car Criteria:

Year: 2013 or above 
Seats: 5
Boot Space: Bigger than 288L (Size for my Getz)
Mileage: Lower than 80,000
I’d prefer automatic as I plan to keep the car for 5 years and maybe even more. 
Budget: £8500 (Ideally, I’d like to spend no more than £7000 but I’d rise to £8500 if I can’t find something within my price range).

",0,1763412267.0,5,CartalkUK,1763494543,2025-11-17 20:44:27,2025-11-18 19:35:43,"Ziemniok_UwU (Score: 3): Does it have to be an auto? The 1.4 TSI engines were paired with awful autos. If you want an auto you need to be looking at the 2L TDI engine versions, though they are diesel which may not fit your use case.

Also check out the Seat Leon as its literally a Golf with the same chassis and engines but tends to be cheaper.

love_you_by_suicide (Score: 1): you're paying a premium for the low mileage on that one specifically and I don't think it's worth the extra on a car that's twelve years old"
