id,title,selftext,score,created_utc,num_comments,subreddit,scraping_time_utc,created_datetime_utc,scraping_datetime_utc,top_comments
1ndn64i,Usual this of that question,"My wife wants a small car (had a old aygo up to 2 weeks ago, written off not at fault). She wants another aygo 1 lit (2016). Or a clio 0.9 (same age, same milage) 
What do you recommend. The Toyota we had never had any engine issues. I don't know much about Renault clio 0.9      
Any suggestions? Thanks in advance ",0,1757530913.0,9,CartalkUK,1757619180,2025-09-10 19:01:53,2025-09-11 19:33:00,"RelevantCrypTitan (Score: 1):  ho sempre ritenuto le Toyota molto durevoli come auto; le clio non sono male ma a parità di prezzo e di optional difficilmente sceglierei la clio...

UniquePotato (Score: 1): I’d get another Aygo, or possibly a Yaris

lconer (Score: 1): We’ve got a Clio 0.9 and we are very happy with it. No problems, nice car to drive around. A bit plasticky inside, but it’s just a Clio so."
1ndmp5c,Good value diesel car,"Hi All,

Looking at options for good value diesel cars - looking at around 80k mileage and to spend around 7k but can adjust if I think the car is worth paying extra for.

I’d ideally like for it to have carplay and around a 2017 plate minimum to meet the Euro6 standards as I’m in and out of Bristol, Birmingham and London a lot and it just looks better inside and has a more dated infotainment system. Parking sensors and cameras would be good, as well as cruise control too. 1.5L did me just fine as I previously had a Mondeo. I have a lot of people normally in my car, so ideally a 5 seater with comfy seats for both driver and passenger and good boot space is an ideal to have. Preference for hatchbacks / saloon / sedan / coupe as I like that look for my car.

I’ve seen Civics, Corollas, Insignias and Avensis thrown around, but wondering what else is out there?
Any thoughts on what best to get and where else I can look is appreciated. Autotrader seems limited for the area I live in Warwick.",1,1757529871.0,1,CartalkUK,1757619180,2025-09-10 18:44:31,2025-09-11 19:33:00,"ginginsdagamer (Score: 1): Skoda Octavia or superb are actually really good. reliable and super comfortable especially the superb. decent power and low consumption.

should be able to find 2016 or 2017 for that kind of money, would absolutely reccomend it."
1ndmm04,"JLR says it now believes that ""some data has been affected"" in the cyber attack on the company last week.",,25,1757529671.0,6,CartalkUK,1757619180,2025-09-10 18:41:11,2025-09-11 19:33:00,"Forsaken_Boat_990 (Score: 15): Shocker that

JamieLee2k (Score: 8): Yep got the email this morning, We still have no time frame when we are to return to work

BlackBerryCollector (Score: 3): So their IT system is as reliable as their cars."
1ndm9m3,"2014 Audi A5, Yay or Nay?","Hi all, 

Im eying up an A5, probably around the 2012-2014 range. There’s loads available semi local to me with full service history, and sitting around 90-100k miles at £6,000

Being someone who doesn’t know that much about cars, I have some questions I’m hoping some of you guys can help with 🙏🏼

If the car has full service history with proof, what mileage would you consider too high, giving the potential for faults and expensive fixes? 

What engines are desirable/ones to avoid?

Is there any specific work I should make sure is complete before considering?

I know TDI engines are generally considered good but I’d rather some input of guys who know a lot more than me",1,1757528887.0,4,CartalkUK,1757619180,2025-09-10 18:28:07,2025-09-11 19:33:00,"Ziemniok_UwU (Score: 1): 2L petrol and diesel are the best and most robust engines in the A5. 

If service history is good they are safe bets but you also need to consider if stuff like the DSG gearbox service and Quattro system was serviced if the car has these. A car can hav full service history but no gearbox services and thats a big red flag.

It's usually the Auto gearboxes or quattro system that ring up the big bills on these because the engines themselves are mostly bulletproof."
1ndkzhb,Toyota Corolla Touring - Can I get some advice please?,"Hi All,

I’m at a stage in life (mid 40’s) where I would like to upgrade my Diesel Honda Civic mk9 for something a bit bigger in terms of boot space. Helps with a 3 year old daughter….🤣
I’ve been quite liking the look of the Toyota Corolla Touring, but I’m so used to Diesel it’s scares me a little bit. I travel approx 45 miles to work and back each day ( 22 each way) and I get around 65-70MPG and I’m worried that I’ll get significantly less from a petrol hybrid? Honestly I don’t really understand how a hybrid of this type works…how long will it run on hybrid for on a journey exactly? 
Spec wise I’d like it to look as sporty as possible….soooo GR spec is it? 

Sorry to sound foolish but I’m so used to diesels I have no idea about the future.

Cheers

Ross",0,1757526059.0,9,CartalkUK,1757619180,2025-09-10 17:40:59,2025-09-11 19:33:00,"Fragrant_Associate43 (Score: 3): Expect 60 mpg on Eco. Probably 55 on Sport.

Sure-Afternoon9095 (Score: 3): Bought a 73 plate Touring Sports (2L GR Sport Trim) 3 months ago and i genuinely love it. 
Averages 60mpg in eco mode and costs about £45 to fill the tank from empty. Also helps to learn how to drive it as a hybrid
Space in the boot is great, the boot shelf has 2 levels plus a recess for a spare wheel. Back seats fold flat so can fit nearly anything in there. Its packed with tech (adaptive cruise, lane tracing, auto wipers etc) but this might be dependent on trim level. 
I also have the bigger 2L version and it has a decent bit of grunt if you need to floor it for whatever reason. 
Already done 4000 miles on it on all types of road. Love it.

Pitiful-Wrongdoer692 (Score: 1): I use one as a cab in my second job as a part time taxi driver, the owner of the company has given me a brand new car to use for a few days, and im commuting in it to my full time job which is 30 miles away....im averaging 65mpg, its a nice drive  but I wouldnt own one with my own money."
1ndkt0z,Rubber Kerb Ramp which adhesive?,"I'm having to put a rubber Kerb down on our drive as I fear the wife is gonna reverse through our bay window. 
We've got a new car which takes up a lot more space and now the two cars are a fair bit closer together.
I don't really want to be drilling and screwing it in place as the drive is tarmac so was thinking of using a grab adhesive or similar. Anyone done this successfully? ",1,1757525671.0,3,CartalkUK,1757619180,2025-09-10 17:34:31,2025-09-11 19:33:00,"Kobbett (Score: 1): After a quick look around, this is what I'd try -
https://www.amazon.co.uk/AlphaChem-Multi-Purpose-Adhesive-Exterior-Cartridge/dp/B0DB2FN2KH

Banpainterman (Score: 1): CT1 you can get in Wickes.

MasterofBiscuits (Score: 1): Yes it should work, I used something similar on a rubber weather strip on my old garage, glued direct to the concrete. It's still there \~15 years later."
1ndkg9x,Seeking reliable and affordable automatic,"Hi - I desperately need some advice on my next car. 

At the moment I have a Vauxhall Astra 2016 SRI. I love my Astra, but its clutch has gone dangerously sticky, and due to health reasons I need to (reluctantly) switch to an automatic car.

I drive maybe 4,000 miles per year. My commute to work is only 15mins each way (4 days a week). The longest regular journey (once a week ish) is 45 mins each way, to see my parents. Mostly main roads, towns and dual carriageways with the occasional motorway trip.

I know nothing about cars, besides the fact I love to drive mine, and I’m beyond overwhelmed. I just want a hatchback, ideally with car play, easy to drive, petrol… I would appreciate any recommendations you could give - TIA

Edit: I forgot to say I can’t go electric as I live in a flat with no charging points, thanks!",1,1757524889.0,6,CartalkUK,1757619180,2025-09-10 17:21:29,2025-09-11 19:33:00,"OneUnrealBean (Score: 0): You dont need diesel, mileage you are doing is a killer for a diesel, short trips and low speed driving is a no no.... diesel needs driving, a lot of driving to be sound and engine to be happy. Otherwise you are risking pricey breakdowns with injectors, excesive carbon build ups on engine components, troubles with dpf and egr if not mapped out etc. Get petrol or electric"
1ndketa,0% interest credit card to buy a car,"I just recently passed and I’m looking to purchase a decent car that I can have for the next 4-5 years. 

I’ve been accepted on a Barclays 0% interest credit card for 24months and can borrow up to £4,800.

I can also do a balance transfer for 20 months. 

I’m not entirely sure and just need some help as I want to use the whole £4800 as balance transfer and pay up front for my insurance. I’ve been quoted around £3400 so I don’t mind paying it off. 

I have some savings but I want to keep it in case of a rainy day. I’ve only just started saving and I’m on a £30k salary but I also earn 500 - 1000 as extra income depending on the month. 

Would this be possible? Any advise would be greatly appreciated.",6,1757524800.0,28,CartalkUK,1757619180,2025-09-10 17:20:00,2025-09-11 19:33:00,"FartBakedBaguette (Score: 37): You’re a bit all over the place with your thoughts here so just to clarify a few things before you potentially financially ruin yourself.


Your credit card has a limit of £4800 to spend on that card interest free for 2 years. This means you can just pay back the minimum every month for 2 years and will start paying interest on the remaining balance from month 25s due date. 


In month 25 you can either clear the balance if not already done so, continue accruing interest OR, if credit rating allows, apply for a balance transfer credit card and transfer the remaining balance to this.


A balance transfer and a purchase offer are not the same thing.


Please read what you’re signing up to and fully understand the implications.

random-0181 (Score: 2): Congrats on passing. Well done. Out of curiosity what’s the car you buying as £3400 for insurance is mental. Regarding the credit card. You say you have 0%..is that on purchases? Usually that’s valid for purchases made within a certain number of months when first get the card. Secondly the balance transfer is only to another credit card. if the card is for purchases and your using the card to pay for the car insurance just check that the insurance company takes the card and second of all make sure you set up a fixed monthly instalment to clear it off in 10-12 months. 

Regarding the car just make sure repair and maintenance costs is added to your budget. This is overlooked by a lot of drivers at the start

Also with the insurance. Will you be using the for work? Just make sure you have the adequate cover if you do. It doesn’t cost much extra.

sc42dr (Score: 2): Use cinch or similar to purchase using credit card if a dealer says no."
1ndkelj,"Just did 2400 miles from North West to Poland and back and absolutely loved every second of it, apart from Rastplatz areas in Germany. Always wanted to do an Eurotrip, and here are my thoughts:","- The only time someone flashed their lights at me or honked was in England, when I was doing 50 on a 50, funnily enough it happened twice, when I was driving there and when I was driving back. The 50 was permanent in circle on the motorway information board. 
- Our (English) service stations aren't as frequent as in Belgium, Holland, Germany and Poland, but are cleaner, more modern and most importantly free (and so are the Polish ones, everywhere else it's €1 PER PERSON). Can't speak of France as I was there for about 30 minutes before I reached Belgium and I haven't seen a single petrol station. 
- Petrol is so much more expensive in Belgium, Netherlands and Germany. Poland is on par with England. 
- There are free rest zones with toilets called ""Rastplatz"" in Germany but the state of those... Seriously the smell, the dirt, there was literally sh*t outside of them. 
- I don't expect everyone to speak English obviously, so I had to use live translate or show on my fingers I want to pay for pump no X at the petrol stations in Germany, or to get a coffee. Weirdly enough the closer I got to Berlin the worse it got with communication. No such issue in Netherlands, Belgium. Not sure about Poland, as I'm polish :-) 
- We have the worse roads here in England. Belgium and Netherlands motorways were so nice to drive on, Germany a mix of both nice and not so nicr, Poland unless you're on a motorway (and even then it's not always great), is still 20 years behind with their road quality. 
- The road manners are amazing in Germany, Belgium and Netherlands, England and Poland were the worst. Was so much fun to close the Speedo on autobahn (where allowed) :-) It's so nice to not see too many lane hoggers. I've found German drivers really nice and polite behind the wheel or when chatting at a Rastplatz etc. I talk a lot about Germany, because France was about 30 mins, Belgium and Netherlands about 1hr each to pass, and going West to East in Germany was about 9hrs so I've spent most of the time on autobahns there. 
- Surprisingly driving on the ""opposite side of the road"" was very easy, but that's probably because I'm a SUV wanker and can see clearly what's in front of me sitting higher up, unless there's a lorry. However there weren't too many of them and when they are there, they don't take up 3 lanes out of 4 overtaking each other. 
- The only place where I had to pay any kind of toll was a DART charge in England but you can avoid that slightly. The motorway from Dunkirk to Belgium (Antwerp) is free. So were the Motorways in Belgium, Netherlands and Germany. In Poland it depends on where you are going. 
- We have achieved close to 39 MPG with fully loaded boot and a family of 4 in a 2.2 tonne SUV with a 3.5L V6 and electric motors, on a motorway doing 70 MPH (apart from a couple of stints where I closed the Speedo on autobahn). I take that as a win. 
- It was the most comfortable drive I've had in any of the cars I've owned (including LS430 and 3GS450h!).
- There were a lot of chairs and 1(yes one) sofa on the ferry from Dover to Dunkirk (and back), so I would highly recommend either a small inflatable mattress or connecting chairs to form a bed if you want to take a nap on a ferry but it was cheaper than tunnel by about £130, plus you could stretch your legs, eat something at a restaurant and grab a hot drink. ",86,1757524787.0,29,CartalkUK,1757619180,2025-09-10 17:19:47,2025-09-11 19:33:00,"krush_groove (Score: 10): FYI France and Belgium are € 0.80 at most petrol stations for the toilets.

Goss5588 (Score: 9): Lexus seats are incredibly comfortable, many reviewers say they are the MOST comfortable.  Then, the cabin is near silent, with no rattles.

Last, but not least, with them being the most reliable cars on the road, you have very very comfortable journey, with no stress or worries.

pompokopouch (Score: 3): Point 2. Are you talking about the toilets or parking at the service stations?"
1ndjzmi,"A new car has dash cam fitted by the dealer, does it mean that this vehicle was modified?","A car is sold new by a dealer and they install dash cam. I suppose it means ""after sale"" because it happened after the car arrived from the factory. Does this mean that the answer to the motor insurance question ""Has this car been modified?"" should be ""Yes""? Or is dash cam similar to installing mudguards and alike equipment?",1,1757523870.0,5,CartalkUK,1757619180,2025-09-10 17:04:30,2025-09-11 19:33:00,"Tek9293 (Score: 7): If its been “hardwired” into the car, instead of just plugged into a 12v lighter socket then yes its a modification, probably won’t affect your insurance price though.

humpty_dumpty47368 (Score: 5): Fitted with a dash cam is a modification.
In most circumstances one would hope the Insurance company welcomes it.

Felrathror86 (Score: 2): Is it an official one? Like an accessory from an OEM catalogue? Then no. 

If it's a third party one that the dealer has fitted, then kinda. My insurer doesn't seem it as a modification, but do want to be notified."
1ndjupi,Private plates,"Hello, I was looking at a private plate I’m interested in although it costs £1100 on reg transfers, it has a make an offer option how much down do they accept, does anybody have experience? Thanks",1,1757523588.0,9,CartalkUK,1757619180,2025-09-10 16:59:48,2025-09-11 19:33:00,"Electronic_Laugh_760 (Score: 5): 10p? £1? £100? 

How on earth would anyone on Reddit know.

Elithiomel_Zakalwe (Score: 1): Buy direct 🙂 

https://dvlaauction.co.uk/auction/B276"
1ndje2t,Pound for pound easily the best car I’ve ever owned. But mainly because I tend to buy utter leaky rusty tat.,,76,1757522565.0,55,CartalkUK,1757619180,2025-09-10 16:42:45,2025-09-11 19:33:00,"NakedPatrick (Score: 16): I have a couple of hot hatches (ones a track car) but I see this gen boxer and I REALLY want to scratch that red itch

EmbarrassedTeller (Score: 6): Great shot, where are you driving?

Purp1eMagpie (Score: 3): Lovely photo. Not at all jealous..."
1ndjaro,Finally found a way to stop missing auction cars on Copart/BCA,"Been noticing a lot of traders saying how draining it is scrolling Copart/BCA all day and still missing out on the right stock. I ran into the same issue, so I built a tool that lets you set exact criteria (cat, mileage, damage, budget) and then it just alerts you when those cars show up.

It worked so well for me that I’ve packaged it into software and I’m rolling it out now. If anyone here wants to test it, I can set you up on a free trial. Would love to get some feedback on it.",0,1757522369.0,2,CartalkUK,1757619180,2025-09-10 16:39:29,2025-09-11 19:33:00,Bantzmanz (Score: 1): Not a trader.  But do look on bca for cars occasionally. Also a software developer. Would love to have a go
1ndj5wh,How long could a 2016 Toyota Yaris last?,"How many years could I get out of this car? It has 89,000 miles on it and has been serviced every year. It has no rust as far as I can see and is in working order. It is automatic which could hurt the reliability but how long can I get out of this? I plan to keep this car until at a minimum 2029-2030 if not later where it would probably have about 130,000 miles, could it last that long?",0,1757522073.0,9,CartalkUK,1757619180,2025-09-10 16:34:33,2025-09-11 19:33:00,"PsychologySpecific16 (Score: 2): All cars, even unrliable ones, can go on forever even if they end up like triggers broom. 

If it's just until it's not economical to repair, could be ten miles, could be another 200k.

RejectedIdeas (Score: 1): 200,000 Miles and more is not uncommon with Toyota’s. Especially if well maintained. You don’t say which engine and what type of automatic gearbox it has but generally the Yaris is a car that should last.

iamthesmallone (Score: 1): Most likely, but how is anyone meant to say for sure? 

Use the car and find out!"
1ndj182,Questionable End Result from an Audi garage in the UK,"I recently took my 2008 diesel Audi A4 into a local Audi garage in the UK to have the wheel locking nuts replaced and as part of the service, they offered to address a couple of recalls which I naturally said yes to assuming they would be positive for the car. They were both emissions based.

After a horrendously long wait and terrible customer service, I drove away to find a particulate filter error message on my dashboard (there were no warning lights or error messages prior to dropping it off). There was also a huge decrease in the car's ability to accelerate (I believe due to it now essentially being in limp mode to protect itself).

I took it back and they reviewed it over the weekend and into this week. They've finished their checks and have diagnosed that the diesel particulate filter needs replacing. The parts alone costing £2,400...

My question is, has anything dodgy happened here or is this legit? I had an MOT the previous week and nothing was flagged regarding emissions however now the DPF needs replacing? According to the garage, the error message was stored in the car's memory however surely something that could determine whether a car passes or fails it's MOT should be all over the dashboard and not stored in the background?

Is this all legit or has something dodgy happened and do I need to escalate further?",1,1757521799.0,2,CartalkUK,1757619180,2025-09-10 16:29:59,2025-09-11 19:33:00,"Apprehensive_Shoe_39 (Score: 2): > I had an MOT the previous week and nothing was flagged regarding emissions however now the DPF needs replacing? According to the garage, the error message was stored in the car's memory however surely something that could determine whether a car passes or fails it's MOT should be all over the dashboard and not stored in the background?

In regards to this the MOT will only check no lights (eg DPF/EML) on the dash and do a rudimentary check on emissions. Provided your car is not wildly off then it'll still pass, even if worse than comparable make/model/engines. So passing an MOT doesn't prove it was tip top.

I'm not saying they haven't screwed you over but there may be a lack of explaining/understanding. What's plausible is they mean it had an active logged fault from before you took it to Audi. Not enough to trip a warning light but enough that the car was aware, and has been for some time (it'll log the time/date). And, whether coincidence or through something they've done, when you drove it away the car has now decided this fault has got severe enough to light up a warning and put itself if limp mode.

That being said. You got some ""emission updates"". That would be the diesel gate update no doubt? If so, it's far too much of a coincidence. Maybe your old firmware was conscious, but allowed, whatever state your car was in to continue but this new firmware is much more strict and/or the acceptable parameters have changed. If that's the case then they really should have a way to check before applying the update. On the other hand, maybe your DPF was just about to die anyway. Hard one to judge.

Alarming_Support_458 (Score: 2): I highly suspect that the internals of the DPF has been removed and mapped out of the ECU. Their software update would have overwritten that map and that it the result of your issues. They will be unable to undo their update as the remap is obviously not something they will store. It will need another remap to delete the DPF properly."
1ndiniy,MOT help is this a failure or not?,So I’ve got this with the cv boots would this fail a mot ? ,0,1757520986.0,7,CartalkUK,1757619180,2025-09-10 16:16:26,2025-09-11 19:33:00,"RustyU (Score: 8): Yes

MyKidsFoundMyOldUser (Score: 6): Yes it is. Throwing thick grease into your brakes is not something that would pass many road safety inspections.

rocketfromthepast (Score: 3): It's leaking, so yes."
1ndilb6,UK Study: Luxury Car Owners & EV Enthusiasts Wanted 🚗⚡,"Hi all,

I’m a researcher with **Studio intO**, a design research agency that works with global brands to understand how people interact with technology, products, and services in their everyday lives.

We’re running a study in London focusing on *luxury cars and electric vehicles*. We’re looking to speak with individuals who:

* Own a luxury car (Aston Martin, Bentley, Jaguar, Lotus, McLaren, Mercedes-Benz, Porsche, Range Rover / Land Rover, Rolls-Royce, Ferrari, Maserati, Lamborghini, etc.), (either ICE or EV) **and/or**
* Are interested in purchasing a luxury EV (Tesla Model S, Porsche Taycan, etc.).

📞 Pre-selected participants will first have a short call.  
🖥️ Those chosen for the full study will take part in a **90-minute remote interview**.  
💸 All participants will receive financial compensation for their time.

If this sounds like you, please fill out the short survey here to check eligibility: [https://forms.gle/6X9qCp23TDF4GKZ49](https://forms.gle/6X9qCp23TDF4GKZ49)

Happy to answer any questions - or you can email me directly at [estair@studio-into.com](mailto:estair@studio-into.com)",0,1757520857.0,1,CartalkUK,1757619180,2025-09-10 16:14:17,2025-09-11 19:33:00,"cloche_du_fromage (Score: 2): I'm not telling you my name, email, income and disposable income just to find out of I qualify...."
1ndihay,Hit and Run Help,"First time posting so apologies if I’ve added this one to the wrong place.

As above the can pictured hit my car and left the scene. This is about the best CCTV footage of it I have.

The first part of the plate appears - at least to me - to read ‘VG24’ or ‘VG74’, with the last part potentially beginning with ‘Y’.

Any suggestions or help identifying the vehicle hugely appreciated. I’ve tried several variations on DVLA and the partial plate search, but nothing definitive as yet, so reaching out to Reddit for help if possible, thanks!

",1,1757520615.0,1,CartalkUK,1757619180,2025-09-10 16:10:15,2025-09-11 19:33:00,"Pottrescu (Score: 2): Looks like an Iveco Daily if that helps, the plate is too blurry for my knackered eyes to make out."
