id,title,selftext,score,created_utc,num_comments,subreddit,scraping_time_utc,created_datetime_utc,scraping_datetime_utc,top_comments
1nvssfw,O2 Sensors PITA,"So basically i got two lean codes for my engine, i tried to replace both upstream o2 sensors and have had the worst time in doing so. I’ve tried every hack i’ve seen online and was wondering if anyone had any magical guidance or help or if i should take my loss and just go to a mechanic. I’ve gotten the special o2 sensor socket, i’ve tried heat, i’ve tried starting the car,   i’ve tried oil penetrator. i’ve tried everything i could think of and i’m having no luck. I’ve made minuscule progress and actually have had it turn but then it stops.",2,1759374713.0,3,mechanic,1759519967,2025-10-02 03:11:53,2025-10-03 19:32:47,"nueroticalyme (Score: 1): If it turned and stopped, it is likely stripped. You are going to need a half-inch drive o2 socket and a breaker bar. It will destroy the threads coming out. Usually, it damages the o2 sensor threads and not the bung threads. You're going to need an o2 thread chaser clean up the threads once you get it out.
Most lean codes that I see are from vacuum leaks, not o2 sensors.

QuickMasterpiece6127 (Score: 1): So… did you check for a vacuum leak / fueling issue or just immediately decide the sensor saying there’s a fault is at fault?

Usually not too bad when you use the o2 socket + penetrating oil. Sometimes have to add heat from a torch. If still no good, might have to pull that manifold out to remove them on the bench."
1nvpzw3,2018 Honda accord with 1.5t help,"Rough idle?

My 2018 accord  1.5t does this thing where when coming town stop the rpm’s slightly dip and it shutters doesn’t stall though , the shaking is annoying at times this car has had the fuel injectors replaced and head gasket replaced already, 

So I’m wondering what can this be? Car has 84k miles could could I need the throttlebody cleaned or the idle air control valve clean by any chance the shakes are annoying especially when in drive when I put the AC on it shakes a little less",1,1759366755.0,3,mechanic,1759519967,2025-10-02 00:59:15,2025-10-03 19:32:47,"Icy_East_2162 (Score: 1): It can many things , Faulty spark plug/s ,faulty ignition coil , Vacuum leak , they have been known to carbon build up on valves , Dirty fuel filter , Has it put the check engine on at all ,Or have you tried to retrieve any stored data from the ECU ,

UndeadGOATX (Score: 1): No check engine car had the head gasket and fuel injectors replaced at 43k miles due to Hondas 1.5t engines being not good. 

Just get this shake on drive I know 4 cylinders with turbo will have them but it’s been annoying when coming to a stop it’s like the rpm drops 500 but doesn’t stall and when the ac is on is doesn’t shake as much."
1nwdvtu,my car doorknob snapped off,what should i do? ):,18,1759434387.0,78,StupidCarQuestions,1759519967,2025-10-02 19:46:27,2025-10-03 19:32:47,"SaucyNelson (Score: 23): You can never open the door again. Get used to climbing into the passenger seat, and pray this doesn’t happen again.

enNova (Score: 10): Chevy hhr. This is a common issue. Order metal replacements online for $15-20, watch one of the many YouTube videos on this. It’s annoying to fix but there’s a lot of videos on it.

RestaurantCandid5274 (Score: 12): You can replace it"
1nwd5gr,09 corolla,noticed the sunroof is not even and this little thing sticks up. should i be concerned? i haven’t had any leaks or anything happen yet and i hardly use the sunroof ,2,1759432730.0,2,StupidCarQuestions,1759519967,2025-10-02 19:18:50,2025-10-03 19:32:47,"Ordinary-Trade8323 (Score: 1): The weather stripping is deformed, usually you can replace them and then just realign the glass. While it's out just clean in and around the tracks and roof.

Ok-Sir6601 (Score: 1): Yes, be concerned"
1nwcqnr,how do I fix this trim,the rear driver side door has this plastic shield leading up to the weather stripping and it randomly popped out so now I have to close the door by holding the trim in and sliding my arm out while I close the door. I don't see any clips on the inside so I'm not sure what to do,1,1759431799.0,4,StupidCarQuestions,1759519967,2025-10-02 19:03:19,2025-10-03 19:32:47,Ok-Dealer-588 (Score: 2): Follow it up to whatever it connects to take the whole piece out look at all the clips chances are some of them are missing and are broken. React accordingly to rectify either problem before putting it back in which generally is going to be with the fist but use the meaty part
1nvwa98,What is causes this sound?,,6,1759386486.0,1,StupidCarQuestions,1759519967,2025-10-02 06:28:06,2025-10-03 19:32:47,"BillyJack0311 (Score: 1): Assuming that you are asking about the rhythmic squeaking, that sound is consistent with disk brake pad wear indicators making contact withthe rotor(s)."
1nvqof1,Exhaust fix,I put a new exhaust on my car but I twisted off the bolts from the catalytic converter and had to drill the bolts out. It didn't go well and the new exhaust doesn't fit right and now I have a leak. Can I jb weld the connection? ,0,1759368655.0,3,StupidCarQuestions,1759519967,2025-10-02 01:30:55,2025-10-03 19:32:47,"unsubstalker (Score: 1): just goop it on real thick

ilre1484 (Score: 1): It's going to leak again with JB Weld. You should either replace the Catalytic converter or, if you have the resources.get a used flange , cut off the one that is damaged on your car, and weld/have the new one welded on, and bolt the pipes together properly.

dmorulez_77 (Score: 1): Just take it to a muffler shop and have them fix it"
1nvp491,Recommendations for bench test ECU,"Hey all,

I am looking to get some hands-on experience with an actual vehicle CAN network without the risk and inconvenience of using a real vehicle. I am specifically looking to capture CAN frames and play around with the OBD-II request/response data. Curious to know if anyone has recommendations on a good ECU I could buy on eBay or salvage from somewhere for bench testing? Any make/models that are particularly easy to work with that don't require too much extra hardware to get running besides a bench power supply and a few differential wire pairs?

Thanks!

",1,1759364248.0,7,CarHacking,1759519967,2025-10-02 00:17:28,2025-10-03 19:32:47,"Pubelication (Score: 2): Most modern ECUs will freak out if being powered on without receiving the CAN messages and sensor data they expect.

Make an [ESP32 OBD2 emulator](https://github.com/limiter121/esp32-obd2-emulator) with a CAN transceiver, add some pots and buttons and you have a rudamentary ""ECU"" for a couple bucks. Then use a second microcontroller with a CAN transceiver as the ""OBD2 reader"".

MotorvateDIY (Score: 2): I can tell you from first hand experience, that any ECU from a 2008 - 2016 Nissan/Infiniti works well on the test bench and are typicallly less than $100 on ebay, or less at a scrap yard.

Also, the complete (and free) factory shop manual (with wiring diagrams) is available at nico club dot com.

This is exactly how I got started 5 years ago. Good luck!

yycTechGuy (Score: 1): I'd use an STM32F767Z because it has 3 CAN transceivers and an Ethernet port and a USB port.  You can buy a Nucleo board to prototype with.   It also does floating point math.

You can connect to it via Ethernet (UDP?), USB or a serial port.

You can use FreeRTOS so that you can read and write CAN messages in one task while you handle other functions in another task."
1nwk55v,2019 Ford Escape SE OBD2 port,"As title said i got a locksmith to make a key for my SUV but I found that it has a weird OBD2 port
He said that it’s missing something and i need to tow the car to dealer. 
Have you guys see this OBD2 port like this ? ",1,1759449470.0,3,AskMechanics,1759519967,2025-10-02 23:57:50,2025-10-03 19:32:47,agravain (Score: 4): follow the wire and see if that's plugged into the actual obd port
1nwjyx7,1998 grand marquis. Am I sol?,Ayo right below where my thermostat is it is cracked. Can this be replaced or repaired or Am I sol?,10,1759449002.0,14,AskMechanics,1759519967,2025-10-02 23:50:02,2025-10-03 19:32:47,"Southern-Dance-521 (Score: 18): You need a new upper intake manifold.

Leeme guess....Ford or Lincoln with the 4.6L engine.

There's an upgraded manifold available for this engine, and it's easy to do.

Replace the upper and lower hoses while you're at it. 

The 4.6L is a bulletproof design, but even an idiot knows how to accidentally fuck shit up.

AlmostOldMan69 (Score: 6): My 98 needed a whole intake manifold. Carbon portion cracks over time."
1nwjpnp,Still leaking,"Have a leak on my 2013 Chevy Silverado 5.3 2WD, I thought it was the oil pan gasket so I changed it. The leak was not there for like 2-3 weeks and I checked this morning and it’s still leaking. Is the rear main seal next?",1,1759448285.0,2,AskMechanics,1759519967,2025-10-02 23:38:05,2025-10-03 19:32:47,"FabiosGlisteningPecs (Score: 1): Check the valve covers in case it's leaking down the back, but otherwise it'll be the rear main seal. If you don't want to do that, Lucas oil stop leak works well and has never caused me any issues."
1nwjpdv,AC Question Please Help,(Code B1455) Does anybody know what would be causing my AC to blow very weak in my 2014 is250? Sometimes it stops blowing when I press a button but I can still hear the motor running. And on the blowing up top mode it blows at my feet. Whole thing seems screwed up. And I cannot figure out the problem the air is directed in the wrong direction and is blowing weak please help!! 🙏🙏,1,1759448266.0,7,AskMechanics,1759519967,2025-10-02 23:37:46,2025-10-03 19:32:47,"Deep_Dust6278 (Score: 1): If i had to guess your dampers are screwed up.  A lot of times a failure or vacuum leak will cause the dampers to default to defrost mode.  Se where the air is going.

Bruce65lv (Score: 1): Could be a mode door actuator,or calibration."
1nwjo41,Bad rust or is it fine?,"I’m looking to buy a 97 Celica and it has corrosion on the last few MOTs and I only have these pictures should I avoid or not? 
",23,1759448163.0,31,AskMechanics,1759519967,2025-10-02 23:36:03,2025-10-03 19:32:47,"PhastasFlames (Score: 31): Brother it’s literally crumbling

Queasy_Author_3810 (Score: 16): shes dead jim"
1nwjhr8,Loud ticking from 1.5L 2019 Escape,I know the direct injection can be noisy but this seems excessive. Any chance this is something more serious? Thanks,1,1759447674.0,11,AskMechanics,1759519967,2025-10-02 23:27:54,2025-10-03 19:32:47,"Worldly-Cap-7104 (Score: 2): Sounds like a purge solenoid.

LandCruiser76 (Score: 1): I'm sorry is that a plastic valve cover......"
1nwjdx7,Old 1977 f150 won't turn on,"Hello I have a 1977 f150 with a 1994 351 v8, last time it ran was in 2012 ive tried to turn it on got it to turn over, it gets gas, has spark, i think it could be something with the timing, ive checked for compression and have rotated the crank pulley to mark 0, still nothing
Or somwthing with distribuator, spark plug wires are in order.

If anyone could help me out or put me in the right direction. Would be very appreciated ",2,1759447388.0,6,AskMechanics,1759519967,2025-10-02 23:23:08,2025-10-03 19:32:47,"CanEvasion (Score: 1): How old is the gasoline? You may have to drop the tank and clean all the lines.

Dull-Ad-7333 (Score: 1): Might be poor petrol for sitting too long but that’s a fuel issue if there’s compression and spark"
1nwj8ku,Do I need an alignment?,"2013 Honda CR-V, has about 120,000 miles on it. Just got all four tires replaced, and the tire place did an alignment check. 

The mechanic said that, without switching out any pieces, he could only align the toe and caster (?). He said since the bottom of the car is pretty rusty, I’d need replacement parts and to get it worked on at a mechanic’s shop. 

My steering wheel pulls to the left just slightly. 

My question is, with this current alignment, will there be any safety issues, or will it just mainly affect tire wear and a bit of the steering wheel pull to the left?

Trying to balance cost with getting things fixed that absolutely need to be. 

Thanks in advance!

",7,1759447003.0,14,AskMechanics,1759519967,2025-10-02 23:16:43,2025-10-03 19:32:47,"Embarrassed-Use-389 (Score: 11): Red = alignment.   If you don’t, your tires will prematurely wear in funky ways.

persona_non_grata_1 (Score: 4): With the rear numbers looking that way - yes. An alignment is warranted. Also not a fan of the rear camber (not typically adjustable without specialty parts.)"
1nwj6l9,What’s this part called?,"Hi i have corrola 2003 1.8 
I noticed that the hose is completely broken but the car runs fine i was wondering what does it do and will cause damage driving around in this condition ",1,1759446858.0,5,AskMechanics,1759519967,2025-10-02 23:14:18,2025-10-03 19:32:47,Slowburn21814 (Score: 1): Looks like the EVAP purge solenoid.
1nwj5xs,HELP! 03 Mustang Timing!,"Ok so I do not know the first thing about working on cars. please work with me here, as I do not know the correct names of these parts. But I have been helping my husband to the best of my ability with replacing the timing tensioner on my mustang. we got all of the new parts on, and I noticed that the marks are not lining up like the book and like every video that I have seen say that they should. I asked my husband about this but he keeps saying that it doesn't matter, and that that's where they were when we took the old chains off? It just doesn't feel right to me. is this no big deal like he is trying to tell me? or am I on to something here? please help me before he gets the engine put back in my car! ",1,1759446811.0,4,AskMechanics,1759519967,2025-10-02 23:13:31,2025-10-03 19:32:47,"persona_non_grata_1 (Score: 1): The marks dont matter - they absolutely do. For every rotation the bottom cog makes, the top makes 1/2. This is one of those situations where accuracy counts.

MGTOW4LIFE19 (Score: 1): The color links go on the dots on the cam and crank gears. It do matter, all 4.6L and 3.8L are interference engines and a lot of the 5.0.  which means if you set it wrong the engine is going to buckle the valves and pretty much be finished or a VERY expensive fix."
1nwj4wa,"Serpentine belt snapped, Pulley loose","My serpentine belt snapped, and when I went to replace it I noticed the A/C compressor pulley is a little loose. The car is a 1999, so I’m guessing the bearings in the compressor are pretty much dust at this point.

I plan on replacing the entire A/C compressor, but I won’t have the money for another 2 weeks. My question is: can I safely install a new serpentine belt and drive the car for a short time with the loose pulley, or am I risking damaging the new belt (or worse)?

Thanks in advance.
",2,1759446737.0,6,AskMechanics,1759519967,2025-10-02 23:12:17,2025-10-03 19:32:47,"o5blue8 (Score: 3): Nope. It'll break again.

Bruce65lv (Score: 2): No,you need to replace the compressor.Get a belt that would work w/o the AC compressor for now,if it can be configured to exclude the AC."
1nwj1i1,What is this and how do I clean it?,"I'm assuming it is old and hardened grease of some form that has solidified. I the first one I scraped it off then used scotchbrite but there's too many to do that if I don't have to. 

I tried boiling to soften it but it didn't help much, soaked in household degreaser but it doesn't seem to have much effect. Would brake cleaner be better? 

I just want it off to apply new grease, they're only for low speed manual winding but currently they get stiff if not operated for more than 15 minutes",11,1759446487.0,4,AskMechanics,1759519967,2025-10-02 23:08:07,2025-10-03 19:32:47,"No-Worldliness-6601 (Score: 5): I would say heat it up but that would make it brittle. Maybe soak it in some gasoline?

LandCruiser76 (Score: 4): Gas/ diesel is a great solvent just be careful with it.

If not that. I would try simple green if you want non flammable 

Brake clean 

An ultrasonic parts cleaner

Dawn soap+ a bit of isopropyl alcohol"
1nwiufd,Is this corrosion on these brand new bearings?,Got these brand new sealed bearings with what looks like corrosion on them. Are they bad? I got them from a closing machine shop along with a ton more and I plan to resell them. ,2,1759445985.0,2,AskMechanics,1759519967,2025-10-02 22:59:45,2025-10-03 19:32:47,Embarrassed-Use-389 (Score: 3): Hard to tell what i am looking at.  One piece looks solid with a “burnt” edge and some are translucent.  I would clean them with a solvent and see if that cleans this “oxidation” up.
1nwimge,Alignment with no machine?,"Hi,

I just went to get an alignment at a mechanic, and when I went, the guy didn't use a machine, but he went for a few drives to adjust the cambers. Is it normal? Should I go to another mechanic to get an alignment? Also, my steering wheel is slightly off center too.",1,1759445403.0,6,AskMechanics,1759519967,2025-10-02 22:50:03,2025-10-03 19:32:47,"SuitableGain4565 (Score: 1): What kind of vehicle? 


I mean it's not normal, but on some applications it probably wouldn't be super hard

Remarkable_Yam1945 (Score: 1): If the steering wheel is off center the alignment was either not done or done incorrectly"
1nwiexw,What is this noise?,What the heck is that faint whirring noise? 2000 hilux. Can hear it only above 30km/h ,3,1759444859.0,5,AskMechanics,1759519967,2025-10-02 22:40:59,2025-10-03 19:32:47,"supracollector1995 (Score: 1): Could be a wheel bearing or brake pads going to be nonexistent or a warped rotor there’s a whole bunch mare noises I’m not no mechanic but it’s problems I’ve had before I’m currently learning in a auto shop at my school

84cricket19 (Score: 1): Almost sounds like rubber on metal rubbing, like it’s driveline related, is it 2wd or 4x4?  Brake pads would have a more metal on metal sound. Most pads have a squeal indicator when the pads are low.  Do you have any vibration along with the noise?"
1nwi6sy,Trying to Buy a 2018 Forester: Dealer vs Mechanic Dilema,"After looking for many cars and a bad experience with an older sales guy trying to coerce and mislead me (that’s a different story), I found a car I liked from All Wheel Drive Motors, and independent car dealer in CO that specializes in Subarus. I am thinking about getting a 2018 Subaru forester 2.5i limited with 88,000 Miles, for $14,000. It has a decent car fax maintenance history other than minor cosmetic damage and no transmission or diff fluid serviced. - Somthing I’m planning on doing if I get it. It’s also got “new” (meaning replaced at some point in 88,000) control arms, spark plugs, stabilizer bar, rear control arm bushings (weird to only do the back?), sway bar links, and A/C condenser, and Brakes but they are low already. 

I test drove it and set up an appointment to get a pre-purchase inspection from Christian Bros.

They said they found some big problems with these being the main concerns: 
1) A Camshaft Carrier Leak, 
2) Leak from the front differential hosing, part of the transmission. *see photos.
3) Bad control arm bushings in the front. (Oddly enough I didn’t feel shaking or vibrating on my test drive.)
4) Torn cv axle boot.
5) corroded battery (less important)


The dilemma is I took it back to the dealer’s mechanic and gave him the report, he first said he was surprised (I know, suspicious) and that he thought the CAM carrier leak was actually a valve cover gasket leak and that the leak of the transmission near the differential hub was just a sweat of gas and nothing to worry about. He said he has seen some misleading reports form Christian bro’s in the past and was wondering if the photos they took were legit. (also sus). 

He wanted to look at the car because he would be “disappointed if the car got on the lot like that.”
He looked at it himself the next day and confirmed the problems, (expressing his disappointment) other than the problems he thought were different diagnosis. He called me and told me he would fix most of the problems that came up “red” in my inspection, except the bodywork ofc. (I’m still waiting for his work order to confirm which exact things they are doing.) 

I called Christian Bro’s and told them what the other mechanic from the Dealer said and I found out both are supposedly Subaru specialists. So even if they aren’t lying I’m not sure why they think the roots of the problems are different. 

I am finding it difficult to trust either place. I don’t know if Christian Brothers has a motive to fluff a report and of course I am always suspicious of what the dealers say even if they seem to be nice people.

Christian bro’s agreed to have the same mechanic double check the work the dealer’s shop is supposed to do for a lesser rate than a full inspection. So I’m thinking about taking it back when they fix it maybe.

I just wanted more opinions on the problems and overall shape of the car. 

I am a lower paid teacher, so this could be a good deal if I get to the bottom of this dilemma, but i definitely don’t want to get ripped off but having a problematic car ofc. 

Advice please? 


",1,1759444266.0,6,AskMechanics,1759519967,2025-10-02 22:31:06,2025-10-03 19:32:47,"zrad603 (Score: 3): If someone comes to me and asks me for a PPI, I'm gonna flag everything that is even the slightest problem. 

Like, if you already owned the car, I would probably say just ignore most of that until it gets worst.    But you should know about every scratch and every dent, and every leak.  That's what you paid for.

theleafveins (Score: 1): Im hoping someone can confirm the problems/parts involved so I understand if the dealers might be telling the truth."
1nwhyru,How screwed am I ?,"Have lost some performance on engine, the turbo is boosting, there is some blow by on the diesel engine (video) 
Transit van is 2016 and almost 290,000 km ",2,1759443700.0,5,AskMechanics,1759519967,2025-10-02 22:21:40,2025-10-03 19:32:47,"Elementary2 (Score: 2): run some cleaners through the fuel... put some molybdenum in the oil... make sure you're not running it with the oil cap off.  

But do let it cool down, and then inspect the bottom of the oil cap and show us that pic

Appropriate-Mark-64 (Score: 1): Techron is pretty good"
1nwhs6h,Any ideas on what’s making this sound?,My engine on my 2014 Nissan Sentra is making this sound when warming up. Then comes back for a bit when idle ,1,1759443254.0,3,AskMechanics,1759519967,2025-10-02 22:14:14,2025-10-03 19:32:47,"MGTOW4LIFE19 (Score: 1): Look down and see if it's the AC clutch broken or tensioner spring.

Elementary2 (Score: 1): I think I can see it vibrating wrong does your alternator has a shot bearing?"
1nwhmtq,Oil leak,"

Got an oil change done on 2022 Acura mdx few days ago. Just noticed spots of oil in garage, looks like fresh oil and not the old. Not sure if it happened same day or day later. 

Took it back to Honda dealer. I’m pretty sure what advisor said was when the oil was being drained into the pan they used a filter and not a funnel. He said technically they should have used the funnel. He said there was oil on the subframe and that is where it splattered. 

My husband said I misunderstood and have no idea what I’m talking about. He said they only use a funnel when they are pouring the oil in from the top. That part I know because I’ve done myself on other cars. He says it was poured in from top with no funnel and it spilled onto the subframe. I’m pretty positive the advisor said when they were draining it into the pan which I assume that would be the old oil. 

So basically my question would be do they use a funnel to drain oil out of the car? How would the oil splatter into subframe? ",1,1759442886.0,3,AskMechanics,1759519967,2025-10-02 22:08:06,2025-10-03 19:32:47,"SlowDownToGoDown (Score: 1): The oil filter is on the right side of the car, inboard and slightly forward of the right front wheel.

Check out this [YT video](https://youtu.be/Qgod43zaLNM) at 3:17 for him to show you  where the filter is.  Then go 11:00 minutes to see him rig up a lil cardboard funnel to keep oil from splashing on the subframe.  

Sounds like they splashed some oil on the subframe that runs under the oil filter and didn't clean it off well enough and it dripped in your garage."
1nwhgo7,How can I get this connector off,I’ve gotten the pink tab pulled as far back as it goes but it won’t push down and I cannot get it off,1,1759442484.0,3,AskMechanics,1759519967,2025-10-02 22:01:24,2025-10-03 19:32:47,"MGTOW4LIFE19 (Score: 1): https://preview.redd.it/w8dcnipryrsf1.png?width=1080&format=png&auto=webp&s=408b4a78f07ae4b9118d80fbdf8e32f1fe4282c5

Press really hard and pull, looks like you already got the safety lock pulled out."
