id,title,selftext,score,created_utc,num_comments,subreddit,scraping_time_utc,created_datetime_utc,scraping_datetime_utc,top_comments
1octhcf,Does this rear Hub/Bearing Assembly look normal?,"It’s a 2019 Hyundai Elantra. We both live in the northeast US. I was doing the rear brakes and after taking the rotor off I noticed this rust. I brushed a bit of it off, but I thought it could use a coat of rust proofing paint (I didn’t have any). 
  
Both sides had similar rusting. 
  
Is this normal surface rusting for a 2019 Hyundai Elantra? ",1,1761091895.0,5,AskMechanics,1761248140,2025-10-22 00:11:35,2025-10-23 19:35:40,"Extra_Programmer_970 (Score: 2): Normal where you live

Warrior_Mallak (Score: 1): That rust is abnormal, even for a 2019. Try bring down rust more then paint."
1odoeb0,Anybody know what this buzzing sound is?,2007 es350.,2,1761176970.0,1,AutoMechanics,1761248140,2025-10-22 23:49:30,2025-10-23 19:35:40,Front_Future_8614 (Score: 3): Sounds like the steering column motor as it’s going down.
1odks4o,"Check engine light, 2014 Honda CRV","My check engine light came on. Took the car to Autozone the machine said to replace the air filter and the air flow sensor. Replaced them and the light came back on. Had Autozone check it again. Same code. The person reset it and I drove it 3 days. Now the light is back on. 

Any idea what I should do next?",2,1761167717.0,3,AutoMechanics,1761248140,2025-10-22 21:15:17,2025-10-23 19:35:40,Icy_East_2162 (Score: 1): What code comes up ?
1odhjoh,Semi long term mechanic out of work. Need advice!!,"I'm a mechanic with 6 years experience in the field and 18 months school. it may not be much but hear me out. I've been out of work for like 3 months now looking for a new shop to work in. I'm based in NYC and the shop I was working at primarily only worked on taxi cabs and Amazon/ citibike vans; this isnt the type of shop I saw myself working at long term. Now I'm more selective about the jobs I apply to because I do not want to move from shop to shop as this is even unfair to the shops themselves. I just want to grow at one good shop.
At first there were a few jobs posted that I responded to and got responses back. The issue is that a lot of shops are demanding 10-15-20 years experience.
Or do not want to pay the salary for the demand in hours and skill.
I just want to know a few things and gain clarity on them to further help my endeavors in finding a job.
Because it may turn out that l've been full of myself this whole time.
Am I wrong to think that shops are incorrect in demanding 10 or more years experience?. The way I see it is a lot of independents and franchises only want a worker and don't want to invest into the tech at all.
I've even stated during interviews that I continue to study and expand my knowledge all the time. I mean, I'm far from green. I can do everything except rebuild a motor or trans and l've never done a timing chain. But my diag and electrical skills are on point including reading a diagram. Which leads to my next question.
Do shops not care that I went to school or that I can read a diagram and follow specs and instructions or am I being slightly arrogant?
I mean I have to start from somewhere and believe the shops are being unfair in judging my skill based off of my schooling and age. Even going as far as brushing my schooling off as a non contender. It's a little defeating at this point. When I put 6 years into this. It's
not a lot I know. But for me it's 6 dedicated years and even my instructors got tired of me at one point.
I'm 31 years old and while I have no kids nyc is still expensive with studios starting at 2k on the low end.
Right now a job called me back and said he was looking for a guy to work 6 days a week for $700. Am I out of my mind for saying no to that? I'm not a guy with 20 years but I believe I am worth much more than that.
But on the other hand I really need a job and feel that maybe I'm being ungrateful. I just don't want to accept anything because I really need it.
What salary should I be asking for at this point in my career? Am I being arrogant and ungrateful in thinking I'm worth more? Should I go back to school and change careers completely? That kind of where I am right now.
Thank you in advance for any and all advice and criticisms. ",3,1761160354.0,1,AutoMechanics,1761248140,2025-10-22 19:12:34,2025-10-23 19:35:40,"Freekmagnet (Score: 2): I would suggest applying at dealerships if you want to advance more in your career.    Generally a dealer shop will value having several years of formal schooling and verifiable continuous employment at one shop since it indicates you are a reliable worker that shows up every day.   Point out in your interviews that you are not afraid of electrical- that is usually a skill that tis difficult to find in a new employee.

Up until the last few years dealerships wanted an automotive degree to fill starting tech positions, but the shortage of qualified techs has worsened to the point where many of them are hiring people with little to no formal training and sending them to factory training classes if they show promise.

A dealer may want to start you out in a lube or tire bay despite you having more experience than that position requires but it is a foot in the door and gives you some income right now.    If you impress them by doing quality work in under flat rate time so you are producing money for the shop then they will likely want to throw some other jobs, like brake and chassis service at you to see how you do.    Also, an important quality in a tech is having the ability to spot other needed work so they can sell it- oil chang services do not make much money for the shop, selling other needed work during that service is the goal.   What you do not want to do is be over confident, as in presenting yourself as if you know everything about car repair.    Even if you think you do, the reality is that what you do not know is far greater than you realize at this point.    I've been doing this for 40+ years, am a shop manager and lead diagnostic tech at a busy modern shop, am a program advisor to 2 technical schools, and I learn new things every day.    What you know after 6 years on the job is a good start, but be careful to not come across as overconfident and a know it all- instead present your self as having experience and a skill level that will start making the shop money immediately and a willingness to learn more.     Those guys that come in to interviews clai=ming to be car wizards that know everything (I've interviewed my share of them) are invariably the ones that get in over their head and constantly break stuff in actual practice.

ASE certs, and state vehicle safety and emissions inspector licenses are a huge plus if required where you live.    You have enough experience to be able to take a couple basic ASE tests (brakes and steering/ suspension are probably the easiest), most independent shops and some dealer shops will see that as proof of your skills and also that you are motivated and want to be a professional.  A section 609 refrigerant handling certification is very easy to get for about $25 online (MACS.org) and some employers will value that, especially the fact that you were motivated enough to get one.     A letter of recommendation from the instructors where you went to school, or from your previous employer or shop manager is a plus when presented along with your resume.   having any or all of these things when you walk in to an interview puts you a whole level above 90% of the other candidates for the job.

IDK what pay rates are in a metropolitan area like NYC, but I assume they would be higher than where I live in rural central PA.     In my area entry level guys working in tire stores and lube bays generally are in the $15/hr range to start, and anyone doing tech work should be starting out in the $20/hr  + range at least.   Keep in mind you are not going to be offered top dollar until you have proved yourself, but starting pay should be enough to at least pay your basic bills.

One thing the is very important to most employers is that you have a fairly complete tool set- if you have been at this for 6 years I assume you do.    It's kind of a standard requirement for a tech position almost anywhere.    It might impress an employer if you were to ask for a copy of their required tool list during an interview to make sure you have everything required on your first day.

Something to keep in mind is that employers are evaluating what you can do to generate money for the shop, and if you are a reliable and dependable employee that is going to show up on time (or even a few minutes early) every day.   Talking too much about what you want from them can be a turn off; talk instead about what skills you can bring to the place that will earn money for them, and how you can complete work quickly and accurately without comebacks.  Let them know you realize time is money, and that you are expected to meet the shop's production goal for your position every day.  That is what an employer wants to hear.    A professional resume is very helpful; even if you do not get the job this time most employers keep on file resumes of candidates that impress them and you may get a call later if the first guy doesn't work out."
1odojch,Trying to sell my car but just found out it’s got a hidden salvage history?,"Hey folks,

Bit of a tricky one, I’m trying to sell my car and only just discovered it’s got a salvage record. 

Before I bought it back in 2019, nothing about Cat S/N/C/D came up anywhere. Even now it doesn’t show on most vehicle check sites, but a couple of random ones show it as “salvage repaired.” I found the Salvage photos and it was repaired before I bought it. 

The car’s been fine the whole time I’ve had it, and I even got a brand new engine this year after a recall

Does anyone know the best place to sell something like this? I’m guessing most online buyers or dealers will avoid it if they see “salvage” anywhere?

I was only made aware today when a company contacted me back letting me know they are unable to buy it for this reason. 

Appreciate any advice please as I’m a bit lost on what to do next.

Thanks ",0,1761177362.0,2,CartalkUK,1761248140,2025-10-22 23:56:02,2025-10-23 19:35:40,"Aware_Kaleidoscope77 (Score: 2): Sell it privately through autotrader, shouldn’t be much hassle. Just make sure you price accordingly."
1odn3yz,Convertible dilemma?,"Hi all, 

I am currently in search on a two seater convertible. I've owned a couple of z3s and a 3.0 si e85 z4 in the past. I have really enjoyed them although I currently own a 130I which covers the 6 cylinder side of things nicely. The convertible would be an addition and although I love BMWs I fancy trying something else as they may be too similar to the 130i. I have considered Mr2s, mx-5s, 986 boxster, 350z  convertible or another z3. The mk3 MR2 is currently my stand out contender as it's cheap, different to my 130i, less prone to rust than the mx-5 and different engine placement to what I've experienced. 

What should I do?? I can't make a decision and some input would be good if you have had some of the cars on the list or been in a similar situation. I have around £4k to spend so obviously the mk3 MR2 is appealing as I'd also have money left over but it may feel a bit slow for me. Have a soft spot for the z3/4 but I've had them already and also have the n52 powered 130i.

Cheers!",0,1761173553.0,12,CartalkUK,1761248140,2025-10-22 22:52:33,2025-10-23 19:35:40,"Competitive_Pen7192 (Score: 1): I think you will struggle at that money other than what you've already mentioned.

A Renault Wind? Lol probably not.

You won't get a decent Alfa Romeo GTV or Brera for that money either.

Resign yourself to a BMW Z4 3.0

Sebbbax (Score: 1): Alfa Spider?

harmonyPositive (Score: 1): I've ridden passenger in a mk3 MR2 and it's plenty nippy in my opinion. 138 HP doesn't sound like a lot but the car is light, it pulls plenty hard when you rev it high. I highly recommend getting a chance to test drive one."
1odmg8p,Anyone own a Mk7 Golf R Estate?,I’ve got a craving for a fast DSG 4WD Estate car… although I’ve heard the Mk7/7.5s can be hit and miss. Any tips?,30,1761171816.0,42,CartalkUK,1761248140,2025-10-22 22:23:36,2025-10-23 19:35:40,"KingDamager (Score: 33): Not the estate, but the regular one, depends what you want really. Like obviously it sits under the ‘hot’ hatch umbrella based on pace, but I’m not sure it embodied the spirit of it. I’d call it more like a mini GT car tbh. Absolutely rapid, and incredibly easy to lose your licence if not careful, and will eat motorways all day long. Has all the mod cons you could want (except for wireless car play now I think about it), and still comes from a button age(if that’s your thing). Probably more engaging options exist for the twisty’s though. 

I’ll be real though. I’m not sure I’d be buying a 2018 with 127k miles… 

The 7.5 infotainment is nicer than the 7 I think. 

The common ‘big’ issue is the water pump / thermostat housing. It’s a known issue with the ea888 and to my knowledge no one is doing an Ali one yet, but would be nice if they did as the plastic one likes to crack and piss coolant. Servicing is about 200-400 a year depending on minor vs major and who you get it done by. 

Can obviously be tuned quite easily to be quicker. Don’t personally think they need it. 

If I could go back I’d probably get an estate. Didn’t love the look but would love the extra space now I’ve got little people.

Ziemniok_UwU (Score: 16): I mean almost 130k miles on a hot hatch is never a good idea. Cars notorious for being driven hard. I would find one under 100k even if that means you have to get a 7 over a 7.5.

Seanlaszlojones (Score: 14): I'm starting to sound like a broken record on here for Skoda suggestions but for consideration when looking at these, the Superb Sportline 280s have the same engine, gearbox, haldex setup and are a much more practical estate and have a nicer environment than the golfs. they are pretty rare and can docommand a premium. I see a lot on noise on the Skoda groups/forums about these; many around the £16k mark though. (they do look better than modern golfs IMO)

only one on autotrader atm and its a very plain early model example. [https://www.autotrader.co.uk/car-details/202506033109510](https://www.autotrader.co.uk/car-details/202506033109510)"
1odlysr,2008 Vauxhall corsa,"So I bought my car in September, she’s automatic and adorable. I haven’t been able to drive her as I’m still learning. When I went to buy the car the speedo didn’t move. He said he changed the speed sensor when he delivered it so all would be fine. 


Anyways I got learner insurance and taxes it as my test is next week and wanted some extra hours in it. Speedo still doesn’t move, every now and then it wakes up but I mean this happened once for 5 minutes in 3 full days. 


Speed sensor apparently done, just thinking now do I change the 10a fuse? I’m just a girl 🤣 also got no dad to ask as he’s 6ft under so can someone please help thanks guys ",2,1761170581.0,5,CartalkUK,1761248140,2025-10-22 22:03:01,2025-10-23 19:35:40,"StarX2401 (Score: 3): Get a cheap OBD2 reader and it will let you check the speed directly from the 4 speed sensors on each wheel, these go to the ABS module which gives you the speed. If that reads correct then the issue is the speedo, either you can try and repair it by resoldering the pins inside (https://www.youtube.com/watch?v=QL5Z\_Rpg1rU) or you can try and install one from a different car (they won't be too expensive, probably around the £10-20 mark on ebay or your local scrapyard)

I recommend the bluetooth ones that connect to your phone, they are very cheap and the app to use it is usually free (I use an app called 'Car Scanner"" [https://www.carscanner.info/](https://www.carscanner.info/), there's another good one called Torque but I believe its paid) If you have an iOS device then you need one that supports Bluetooth Low Energy (BLE) or WiFi

Sakers92 (Score: 2): Hi, without a diagnostic check, its always a bit of a guess over the Internet but:


Your corsa gets the speed from the ABS wheel speed sensors which measure MPH.


The ABS computer then sends this speed to the instrument cluster on your dash, where your speedometer is. The bit you look at.


If there are no ABS warning lights on the dashboard, then chances are the wheel speed sensors are all ok, otherwise there would be an orange fault light on permanently.


This leaves 2 options, the instrument cluster is faulty, or the signal wire BETWEEN the instrument cluster and the ABS computer is broken or damaged.


There are other very rare, and very unlikely possibilities but from a blind diagnosis, what i listed are the most likely issues.

10A fuse: there isn't one for the speed sensor alone if I remember correctly, the fuse will be for the FULL instrument cluster, if the fuse was blown, there would be other things not showing up, or the whole thing wouldnt turn on, its unlikely to be this, but no harm trying anyway.

I was a gold standard diagnostic technician for Vauxhall for 6 years, I know 2008 corsa's very well.


I hope this can help point you in the right direction."
1odlqyk,First car - Yay or Nay?,"Hello all.

I came across this SEAT Leon 2019 the other day and thought I’d ask as a new driver if this car would be best to avoid or would going to check it out?

https://www.makautomobiles.com/details/used-car-in-manchester/seat/leon/1.5-tsi-evo-fr-euro-6-ss-5dr/1607542/",39,1761170052.0,75,CartalkUK,1761248140,2025-10-22 21:54:12,2025-10-23 19:35:40,"Abject-Dingo-133 (Score: 165): That is a loooooooot of miles for a 2019 car. They're runaround cars for sure but thats about 33k a year

Crymore68 (Score: 22): Would really depend how thick the service history is

_FilmActorsGuild_ (Score: 110): £5k? 😂 165k miles?! I'm a mechanic and I would not buy this. It will be a money pit."
1odljfm,Rear bumper fix advice,My fiancé managed to put it back together but it’s not done properly.Any advice on how to do it properly at home please?Also do you think cable tie will do for a bit?The biggest issue is the circled bit as the vertical bit broke.TIA🙏,1,1761169550.0,1,CartalkUK,1761248140,2025-10-22 21:45:50,2025-10-23 19:35:40,"NearlyLegit (Score: 2): Have you considered a third zip tie mate?

Also, I can't help but notice that your bumper looks absolutely ficked.

Unless you plan on intimately introducing a large mallet to the bumper, I'd probably recommend fixing it at home by buying a set of trim connectors/rivets/whatever, and a new bumper. Just replace the whole thing when you get a minute."
1odlh0v,"VW Scirocco - 2013, 97K Miles - No cambelt","Hi all. I recently started a finance arrangement on a Scirocco I fell in love with after driving. After realising what I’d done, I’m worried about the fact the car has only 3 services and no cam-belt.

I expressed this to the dealer and they gave me a fair discount and ordered the timing belt and water pump kit for me - which I’ve got in the car. I just need to find someone to fit.

In the meantime, play it safe? Or is this a general guide and not something that needs doing asap? I guess I’m just worried I’ll be having too much fun and it will snap and I’ll be without a car at all. Thanks for any info",1,1761169390.0,10,CartalkUK,1761248140,2025-10-22 21:43:10,2025-10-23 19:35:40,"colin_staples (Score: 1): If it has genuinely only been serviced 3 times in 97,000 miles, don’t buy this car.

The fact that the cam belt seemingly hasn’t been changed is the least of your worries.

There are other Sciroccos

FatDad66 (Score: 1): I have a VW (not the same model).  I had the belt done for the second time this year. I would not drive it anywhere except to get the belt changed. It should be changed every 60k miles or 5 years. In some regions it can be longer, but I would not risk it. You could be fine, but if it lets go you may need a new engine (if the resultant bang does not make you crash and total the car. 

Was the car long service schedule (30k miles between services?) even then you are missing a lot of services. "
1odkh35,Idk what to title this,"Bassicaly i have a phone that is charged VIA a USB C cable. now i can’t connect to my 107 because it doesn’t have bluetooth so i was gonna swap the radio with one that has bluetooth. (none of the screen stuff because i hate them) 

but basically as a for now thing, i was wondering if it was possible to have a AUX cable connect to my phone to the radio itself.

ultimately i never used an aux thing before and dont know what will break what. so i cane here to ask first",0,1761166986.0,4,CartalkUK,1761248140,2025-10-22 21:03:06,2025-10-23 19:35:40,"cwci (Score: 4): You can buy a usb-c to 3.5mm jack for the aux connector on your existing radio.

spamjavelin (Score: 2): Assuming that the aux connection you're talking about is a 3.5mm jack, your best bet is a Bluetooth adapter like [this](https://amzn.eu/d/a93y7S2), seeing as your phone probably doesn't have a 3.5mm jack itself.

I used to run a similar one on my old car and it was pretty decent. It'll also save the cost of a whole new head unit.

StarX2401 (Score: 1): I used a bluetooth to aux adapter on my Corsa and it worked pretty good, they go for around £2-3 on aliexpress. Alternatively you can get an FM transmiter but the aux adapter has better sound quality, and I'm pretty sure the 107 has an aux port"
1odkfrb,Car advice,"Hello,

I’m looking for a reliable automatic car in the £13,000–£14,000 range for a small family — we’re expecting a baby in three months. 
I’m not a car expert (just a regular driver), so I’d really appreciate practical advice.

I’m considering these options (all automatic)
- 2020–2021 Ford Kuga 2.5 PHEV
- 2019–2020 Mercedes B-Class 1.5 petrol
- 2019 Volkswagen T-Roc petrol
- 2018/2019 BMW X1 petrol

Which of these would you recommend for reliability, space for a baby seat and pram, running costs, and general ownership (repairs/servicing)? If you have other suggestions within the same budget and automatic transmission, I’d love to hear them.

Thanks!",1,1761166904.0,8,CartalkUK,1761248140,2025-10-22 21:01:44,2025-10-23 19:35:40,"OrdinaryAncient3573 (Score: 3): If your primary goal is reliability, don't buy any of those. Buy a Toyota/Honda/Suzuki, or a Korean car. 

If you're willing to tolerate something that's well-engineered, but not quite up to the same standard as those, in exchange for something a bit nicer, have a look at Volvos, and maybe BMWs if you particularly like them.

Or, forget about reliability and buy something weird and French: 

[https://www.autotrader.co.uk/car-details/202506243832635](https://www.autotrader.co.uk/car-details/202506243832635) (Holy depreciation, Batman! List price for that was 30k new, three years ago...)

[https://www.autotrader.co.uk/car-details/202509046045110](https://www.autotrader.co.uk/car-details/202509046045110)

Disastrous-Yam-4703 (Score: 1): Get a BMW 4 series gran coupe. You can get a 2017+ model for that price range so engine and general reliability should be decent and it’ll drive better than any of the SUVs you’ve listed. Plus it has a hatchback boot door so it’s practical enough for all the baby stuff. 

If you do lots of mile you can get the diesel model instead.

ArmoredGoat (Score: 1): Vw t-roc and ford Kuga are very different size car. Have you seen some of these in showroom? For young family, i think the ford is the best one but not in phev form. Thinking outside the list, toyota collora estate or yaris cross. Yaris being suv will make loading baby easier but plenty people get by normal estate cars just fine. I suggest you have a think about how big the baby seat and buggy are first. Some baby seat have removable cradle and absolute pain to load and unload in a small car/door doesnt open wide."
1odkelv,I Know That They Do Very Little Car Content Anymore but Here’s an Epic GIF,,9,1761166834.0,9,CartalkUK,1761248140,2025-10-22 21:00:34,2025-10-23 19:35:40,"HoveringPorridge (Score: 21): Of all the offshoots spawned by Car Throttles' self immolation, ""All the Gear"" is by far my favourite. The others I still watch from time to time if I'm browsing YouTube, but ATG is the only one I'm actively subscribed to.

I think the fact it clearly has very little budget compared to the others, paired with the fact that it's a bit naff, means it feels uniquely British. Like something that would be on Channel 4 in the early 2000s.

DeanyyBoyy93 (Score: 6): Love these lads. Along with TDC they are keeping the cheeky boy content going 

Kheltosh (Score: 4): It's from the latest [video](https://www.youtube.com/watch?v=ObZB9zRxViI) of ATG."
