id,title,selftext,score,created_utc,num_comments,subreddit,scraping_time_utc,created_datetime_utc,scraping_datetime_utc,top_comments
1o72cl8,"2017 Mazda3, 2.0L keeps throwing p013a code even after replacing o2 sensor after cat","Helllo, 

A week ago the mechanic replaced the 02 sensor after the cat. I’ve driven a handful of times but I’m fairly positive I’ve yet to complete even one full drive cycle. Do I need to try and do 2 full drive cycles and hope the code clears itself? What else could it possibly be? 

Thanks for your help ",1,1760505224.0,2,mechanic,1760643270,2025-10-15 05:13:44,2025-10-16 19:34:30,jslick89 (Score: 1): I’m pretty sure my mechanic used an original part. If offered to give me my old sensor in the box of the replacement part. He had it in his hand but I told him he could just toss it. Now I’m wishing I would have looked at the box at least.
1o70vcs,How to make sticker sticky sticky to bottle,"Brake cleaner bottles were pretty easy, engine shampoo bottles were pretty easy. I have no clue on how to make the safety sheet “stickers” (they’re all laminated) stick on transmission oil bottles. No matter how well I clean the bottles, nothing sticks to them.

I must not be the only one in that situation??

My “OSHA” requires them",1,1760500332.0,3,mechanic,1760643270,2025-10-15 03:52:12,2025-10-16 19:34:30,"cheekyfreaky4042 (Score: 1): Gorilla glue Spray adhesive. Clean surfaces very well first

kurangak (Score: 1): With cellotape?"
1o705az,"Changed my starter for the first time; no shoes, no gloves","My car wasnt starting due to a dead starter, decided to change it myself and saved myself like $400. Super satisfying . This is my first time doing something major to my car, Ive done minor things before (oil change, lights, electrical additions,etc) but this was funn",2225,1760498113.0,354,mechanic,1760643270,2025-10-15 03:15:13,2025-10-16 19:34:30,"silic0n_jesus (Score: 230): Good job. at least you were wearing your safety Squints. Remember safety third.

MiddleCentipede (Score: 45): Feels good, good for you!"
1o6xoeg,What happened with the strut towers of this rallycross car?,"This car ran all rallycross season this year and driver came in 2nd.

I'm thinking of buying this car to drive it myself next year in asphalt rally.

It's a 206 S1600 kit car.

But the strut towers are weird, do you have any idea what happened there?",29,1760491061.0,45,mechanic,1760643270,2025-10-15 01:17:41,2025-10-16 19:34:30,"traveling_wrench (Score: 73): Towers were cut, reinforced and modified to hold a racing strut and external reservoir. If you’re not aware of the need for this, this is likely more race car than you need.

SThayer68 (Score: 41): They're modified for racing. Is that what's ""weird""?"
1o6x7wn,"Help. Left Headlight positive connector returns solid red but(works fine just comparing troubleshoot), but right side(non working headlight) returns dim red. Fuse is fine, cable looks fine, what could be the cause?",,3,1760489776.0,5,mechanic,1760643270,2025-10-15 00:56:16,2025-10-16 19:34:30,"Primary_Major6518 (Score: 2): Dimmer side has resistance somewhere in the circuit. Whether it be a corroded ground or chafed wire. Also when testing light circuits, use a halogen test light. It pulls 0.5-1 amp and is great for load testing circuits. LEDs require much less power to light up to full brightness. Do NOT use a regular test light on computer circuits. The current draw is too much for the computers to handle.

thewraith42O (Score: 1): Load test the circuit with a light bulb"
1o6x5os,2010 Grand Caravan SXT 3.8 will not crank.,"After seeing a similar post to my issue I figured I would post again to see if anyone has answers. I have a 2010 Dodge Grand Caravan SXT. It has the 3.8 engine. A couple of years ago it would intermittently not start. You would turn the key and it would have power but it would begin to turn over and then it would stop. Almost like a hard crank but it would never do a full crank. It got to the point last year where it wouldn’t crank at all anymore. Same issue everytime. I have had multiple mechanics come by and look at it and they couldn’t figure it out either. I have replaced the ignition switch, rekeyed it, put in a new TIPM unit and replaced the starter twice (the first one was bad off the shelf).  I’m truly at a loss. My next move is tow it to an automotive electric shop near me and let them chase whatever ghost is causing this. If anyone can help or has any answers I’ll try just about anything at this point. ",1,1760489615.0,3,mechanic,1760643270,2025-10-15 00:53:35,2025-10-16 19:34:30,"ThugMagnet (Score: 1): Please put on your worst shirt and best eye protectors. Please disconnect your battery and polish the heck out of your posts and connectors using your battery brush. Uncap the ""Christmas Tree"" brush and clean out the inside of your lug connectors. Pry the lugs open, seat them on the posts then tighten. [https://a.co/d/4orF2Lv](https://a.co/d/4orF2Lv)"
1o6wn7y,Knocking sound,"So my belt has been squeeling for a bit so i decided to try n clean it and now, every now n then when i hit the gas i will hear this knock then my belt sqeeul gets worse for a second then my idle will go lower than usual then slowly back up",1,1760488206.0,2,mechanic,1760643270,2025-10-15 00:30:06,2025-10-16 19:34:30,"ollieottah (Score: 1): Sounds like a pulley might not be spinning freely. My bet is on the tensioner pulley. You'll probably want to replace the belt, tensioner and is there is an idler pulley you should replace that too. They often come bundled in a convenient, affordable package. But, before you spend money, remove the belt and see what moves and what doesn't."
1o6wclk,"Gday all, Mechanic from Australia here. Was just wondering if any of you awesome lads and ladesess could tell me if this is the reason the truck won't start/ ignition won't start?","I've replaced the batteries in this truck and haven't gotten so much as a ignition light. Took the covers of the terminals and have found green death as well as the joining wire for the 24V connection. Was wondering if it's the reason it won't start. Its of a Isuzu truck, Model: FSR850 Long 235
Year: 2016",3,1760487388.0,13,mechanic,1760643270,2025-10-15 00:16:28,2025-10-16 19:34:30,"traineex (Score: 10): Yeah nah nah yeah, cotton candy isnt conductive. Brush it off, get some dielectric on the bolt posts, spray protectant. Do all the terminals. Replace the fuse. Then get some maccas monopoly

totallynotAhusky (Score: 5): I’m not from Australia, but I do live in the rust belt of the Americas soo I’d recommend pulling all the cables off the tops the batteries and scrub them with a wire brush until all the green gunk is off. Then if you wanna go the extra mile get some lubricant and spray your towel and then rub each terminal down. Then replace that fuse block or whatever it is. You might be able to get away with wire brushing the wire ends but you should replace that fuse block."
1o7l8k3,can Twin Turbos do the turbo flutter?,"My friend is asking cause he wants power in his car, but he also wants the sound of a closed turbo system or well, the turbo flutter and he asked me to ask ppl on reddit so sorry if this post is too stupid that it made you lose a couple braincells. :)",0,1760557860.0,10,StupidCarQuestions,1760643270,2025-10-15 19:51:00,2025-10-16 19:34:30,"Unique_Mix9060 (Score: 7): I can see why this sub exists

KleptoMama (Score: 4): bruh

Cheeko914 (Score: 3): Lmao"
1o7l0h4,This light popped up and I dont know what it means,,4,1760557342.0,67,StupidCarQuestions,1760643270,2025-10-15 19:42:22,2025-10-16 19:34:30,"The_Undermind (Score: 56): Thats your turn signal

Specifically the left one.

Kelvinator_61 (Score: 28): Which light?  The service engine, tire warning, or left turn signal?

BassWingerC-137 (Score: 15): Park it and start using public transportation. You’ve not earned this yet."
1o7jikh,Trying to learn more about my car (2015 Hyundai Elantra) Is this a normal engine sound?,"What do you think, sounds normal or not? Just looking for some opinions on the sound",0,1760553996.0,2,StupidCarQuestions,1760643270,2025-10-15 18:46:36,2025-10-16 19:34:30,"diarrhea_planet (Score: 1): Sounds normal, the clicking is the injectors

djltoronto (Score: 1): Yes"
1o7iahx,Anyone know what this knocking noise could be? Audi TT 2014 41k miles.,,0,1760551270.0,4,StupidCarQuestions,1760643270,2025-10-15 18:01:10,2025-10-16 19:34:30,"Uforiia (Score: 1): I can't really hear what you are trying to show or where it's coming from. If it sounds like its outside the car, its likely the top bushing on the struts/shocks. If its inside the car it will be something inside the steering column that would take some diagnosis"
1o71jq3,"Do you guys keep any cars in your driveways that have been rotting for decades, cause they’re sentimental?",,1,1760502508.0,9,StupidCarQuestions,1760643270,2025-10-15 04:28:28,2025-10-16 19:34:30,"toiletsurprise (Score: 2): I don't, but my folks have a 74 Javelin doing just that.

18WheelerHustle (Score: 2): Im offended

The_Shepherds_2019 (Score: 1): https://preview.redd.it/obj8q0k3e8vf1.jpeg?width=3000&format=pjpg&auto=webp&s=582af3da1769b3092f5b80204bfc92ff646eeb27

There's my lawn ornament. Ford, funnily enough"
1o7cd5b,How to get fuel level from the car which doesn't support it?,"Hi there, I am doing a project with STM32 and CAN tranciever SN65. I connected it to the car and was able to get PRMs. But when I tried to get fuel level (2F PID), I got no data. I've read many car manufacturers does not implement that parameter. So are there any other ways to get the fuel level? The concrete car is VW Golf VI. Maybe not directly fuel level, but remaining distance or last refill.",2,1760538132.0,17,CarHacking,1760643270,2025-10-15 14:22:12,2025-10-16 19:34:30,"WestonP (Score: 3): Connect to your powertrain CAN, then look at the 3rd byte of 0x320. I believe that should be it for approximately MK4 through MK7 Golfs, based on research I had done for an MK4 project.

ddxcb (Score: 2): The car could have fuel level in the ECU commands. If the ECU is using UDS protocol, then you will need to call it.

This one works for my Passat. 07E0221048

hey-im-root (Score: 2): I found it in my CAN bus via the OBD2 port by filling up the gas from empty to full at specific speeds and then replaying the frames as a visual graph. Helped me pick out the bytes pretty fast"
1o7rd8y,Transmission Shop Put ATF Instead of CVT Fluid,"Hello everyone! I wanted to get your thoughts on something that happened recently.

I went to a transmission shop and asked them to do a partial fluid change on my 2012 Scion iQ (55,000mil). I even showed them the exact fluid the car requires Toyota CVT Fluid FE. But they ended up filling it with ATF instead of CVT fluid. When I found out, they admitted the mistake and said they would fix it by doing a double flush with the correct OEM Toyota CVT Fluid FE and refill it properly. I drove about 4 miles with ATF before they started the flush.

My question is after this full procedure, will my CVT be safe and works good or could this mistake have caused permanent damage? Has anyone else had a similar experience?

https://preview.redd.it/11yquar46dvf1.jpg?width=3024&format=pjpg&auto=webp&s=8b47a467787c31db176712dad52e311ea34d7633

",1,1760572665.0,4,AskMechanics,1760643270,2025-10-15 23:57:45,2025-10-16 19:34:30,"FallNice3836 (Score: 2): Your iq is likely fine. Toyota cvts aren’t super sensitive to fluid, and the ws/cvt fluid share a lot of similarities. 

I would take their word and carry on. That said I get your frustration when you coached them and they still fd it up."
1o7ratj,I feel like they are just trying to scam me. 2017 Volvo s90 T6,"I bought my car used in February. 2 weeks of having it the check engine light came on. I took to the dealership I got it from (not a Volvo dealership) they said they recommend a fuel system cleaning and it’s a cold start misfire that they can only replicate on cold starts. I ran two rounds of Techron through about 2 months apart because the check engine light would go away on its on for a couple weeks after 5 drive cycles and I thought it was the Techron. During this time I was constantly scanning the ecu and it was showing random misfire with a sub code of cylinder 2 misfire. Now it moved to cylinder 3 and 4 for the sub codes but still main code is random misfire. The light went away for a while, mind you this entire time I have ZERO misfire symptoms, no consistent rough idle, no loss of power, or anything like that. I took it to a Volvo dealership and within an hour or two of me dropping the car off they send an estimate for a full fuel injector replacement. When dropping it off I explained that my symptoms line up with being a carbon buildup issue rather than injectors and I’m looking for that so could they do a leak down test, compression test, and see if it’s only replicated on cold starts. 

The service advisor told me the tech only scanned the ecu and did a duty test saying the 3 and 4 failed the duty test. Even though the duty test doesn’t show the root cause it’s just showing that there’s a compensation to opening the injectors, which can be cause by weak airflow from carbon buildup. However they didn’t do any other type of test to confirm the injectors being the issue. This is the conversation I had with him. Am I over reacting or being difficult? They haven’t fully diagnosed it and is going off of experience and I understand I’m not a Volvo tech but if my symptoms don’t point point to injectors, they didn’t fully check it and are trying to charge me $615 for the “extra” test outside of the ecu scan. Any advice?",2,1760572486.0,5,AskMechanics,1760643270,2025-10-15 23:54:46,2025-10-16 19:34:30,"DerpiestDave (Score: 7): The thing is, Volvo dealerships work on these engines every day. A leaky injector can definitely cause cold-start issues, and old spark plugs can lead to misfires.



The extra tests you want to do will probably just waste money and won’t show any different results.



I’m guessing you used AI to look up symptoms and tests. That’s not a bad idea to help you understand what might be wrong, but you have to remember that ChatGPT isn’t a mechanic — the guys at the dealership are.



I’d let them replace the parts, and if it doesn’t fix the issue, then you have a reason to complain."
1o7quhk,"Hello, just wondering what causes my van to make this kind of sound. Is there a debris in the AC fan or the AC fan motor is broken? Its a 2017 Toyota Sienna. Ty for your help!!",,1,1760571312.0,2,AskMechanics,1760643270,2025-10-15 23:35:12,2025-10-16 19:34:30,jon1501 (Score: 1): This is either the fan squealing or else it is while less likely a small piece of debris has become lodged or a perforation somewhere that is in such a position to act like a reed
1o7qcv9,Anybody know why my radiator cap and coolant look like this?,,1,1760570040.0,3,AskMechanics,1760643270,2025-10-15 23:14:00,2025-10-16 19:34:30,"juggednfinessed (Score: 2): Did you perchance accidentally poop in there?

linnadawg (Score: 2): Looks like rust. Flush the system. Remove thermostat. Heater turned on."
1o7pp46,How feasible would it be for a beginner to DIY front quick struts and rear shocks?,"Hello, I have a 2017 Hyundai Accent with about 93k miles on it. I bought it at \~42k and don't know its maintenance history before then, but these suspension components haven't been replaced while I've driven the car. After an absurd quote for spark plugs/coil packs 8 months ago, I've been looking into doing my own maintenance. 

My car scrapes a bit when going over speed bumps unless I take them real slow, and I can feel bumps on the road quite a lot while driving. This is all amplified when I have other passengers. I don't bounce around at all but I do find the occasional bottom-out concerning. The shop that quoted me for the spark plugs also got in my head about shocks/struts needing replaced, but they wanted $2600 for all 4 and I honestly don't want to pay that or associate with that shop again (meineke, if you're wondering). I haven't done much maintenance myself yet, but I'd call myself fairly handy with tools. 

Would it be wise to diy my shocks and struts or should I just pay up to a different shop? I'm not looking to take the thing apart and reuse the springs, so I'll just stick with quick struts.. The parts are quite expensive already but nothing compared to what I imagine it'll cost to pay someone else for it. I've been back and forth on it for a couple hours already.

in Charlotte, NC if that means anything lol.",1,1760568436.0,12,AskMechanics,1760643270,2025-10-15 22:47:16,2025-10-16 19:34:30,"Dangerous_Boat_2571 (Score: 2): It is feasible to work on your own vehicle. But do keep in mind that you need the right tools, time, patience and knowledge. Before you plan to do it yourself, look up some videos about your car’s make and model. This will help you give an idea of what you need and the process to uninstall/install new assemblies.

AT-JeffT (Score: 1): I imagine the rear stuts are pretty easy.  Why not watch some videos and give the rear struts a go, first.  

I'm a mobile mechanic and i've helped a number of people who have gotten a bit over their head on DIY stuff.  Typically, I just help them through the part they are stuck on and stay until they are comfortable completing the rest.  I bill hourly and even with an hour or two of my time they still come out ahead vs a shop.  Look for a highly-rated mobile mechanic (not some craigslist/FB hack) and see if they would consider doing the same."
1o7pmjh,Hyundai Tuscon tow Capacity,Hey guys I have a 2019 hyundai Tuscon and I'm looking at getting a small rv that weighs about 2200lbs. I've been looking online and I have seen it tows 1500lbs and others saying it tows 3000lbs. Does anyone have any insight on this?,1,1760568261.0,2,AskMechanics,1760643270,2025-10-15 22:44:21,2025-10-16 19:34:30,RichardSober (Score: 1): What does your manual say?
1o7pceo,Ac and Heat all or nothing,"AC is cold, heat is hot, but they only work at full blast. No air comes out vents on settings 1-3. At 4 the air starts blasting. Why do you think it does this? 2012 F150",1,1760567560.0,3,AskMechanics,1760643270,2025-10-15 22:32:40,2025-10-16 19:34:30,"Bored_Dad_Bod (Score: 3): Typically resistor. Like an easy to charge part for under $100 at your local auto parts store

Spaced_rat (Score: 2): Usually a resistor pack failure causes this, or the switch on the dash is failing."
1o7pbp5,Car problems(brakes),"I had my brakes done about a month and half ago. My partner did them and normally I ALWAYS go to the shop. Never had a problem. I went driving the next day it immediately started grinding. He told me that I just had to let them set in. It’s now later and it’s gotten worse especially after the rain. At first it was just squealing which is why I got them done. Now it’s grinding and squealing really bad. 
Anyone have an idea? I plan on taking it to the shop tomorrow for an inspection. I just want to know am I looking at a big bill?",1,1760567508.0,7,AskMechanics,1760643270,2025-10-15 22:31:48,2025-10-16 19:34:30,"Spaced_rat (Score: 1): Hard for any of us to tell how expensive this will be, because we don't know what was messed up.  Your partner should have performed a bed in procedure as soon as the new pads/rotors were installed.  Hate to say this, but maybe one of the brake pads was installed backwards.  Ive seen it...

PandaKing1888 (Score: 1): Yes, it could be anything.

From improper pads, to not using a backing compound or backing plate.

It could just be, higher carbon rotors/pad combos are great if you have to really stop fast, but the trade off is maybe a little noise.

I would suggest a side road, maybe have him do this.  Get up to speed and slam the brakes on a few times.  Oh another thought, most new rotors come with a coating so they don't rust.  If that is not properly removed, can get into the pads and squeal.

I am dumb, I'm not there, so yeah.  Best of luck!"
1o7p5ot,What is this line/hose?,1997 Wrangler 4-cyl.,1,1760567080.0,3,AskMechanics,1760643270,2025-10-15 22:24:40,2025-10-16 19:34:30,"oddjobs1979 (Score: 4): Axle vent. It should be routed up high somewhere. Not critical, just a zip tie to fix it. Leave some slack for the axle to move

Senior-Pie3609 (Score: 2): Looks like the differential vent line."
1o7p2h2,Why is my coolant doing this when trying to bleed air,First off the coolant isn’t even light green anymore and I don’t think I’m making any progress bleeding because it keeps doing this ,244,1760566849.0,113,AskMechanics,1760643270,2025-10-15 22:20:49,2025-10-16 19:34:30,"Spaced_rat (Score: 393): Id take a whiff of the bubbles.  If they smell like exhaust, then you are experiencing BHG.

MGtech1954 (Score: 69): I do not see air/gas bubbles.  I see fluid volume being moved.   Possible restriction in radiator.   There is a fluid tester for exhaust in coolant :  blue to yellow.   If shop has exhaust gas analyzer that can test for bad head gasket."
1o7ouc1,Wide open throttle on startup,Start my 1989 prelude si after head gasket swapped and have no idea what is going on. Seems to be applying throttle but the main throttle valve isn’t moving. I’ve never had this issue before when working on cars any possible issues or advice on finding a possible issue is appreciated.,1,1760566266.0,4,AskMechanics,1760643270,2025-10-15 22:11:06,2025-10-16 19:34:30,"Due_Box_7111 (Score: 1): I forgot to mention it’s 2.0 and an auto.

Quiet_Economist7398 (Score: 1): Seems like you have air leak. Looks like a lot of hoses. Air possibly getting in past throttle plate?"
1o7otc9,Help me identify this fluid,"Just noticed this. It's a bit greasy but does not feel like oil. From what I could tell it's happening towards the front of the car, middle so under the hood. It's a 2018 Nissan Rogue ",0,1760566197.0,7,AskMechanics,1760643270,2025-10-15 22:09:57,2025-10-16 19:34:30,"LIVINGSTONandPARSONS (Score: 1): 2018 Nissan Rogue 
About 120k miles
I don't know the engine size
Automatic transmission 

Bought it new and have not had any issues with the car so far

jasonsong86 (Score: 1): Oil. Middle probably the rear main seal on the engine is leaking. Take a picture under the car."
1o7orzi,2010 Corolla rear drum question,2010 Corolla. 306k miles. Just doing some maintenance and am not sure if the rear drum looks good. And also can’t tell if the bearing sounds okay. Drives fine. Just don’t know what I’m looking at,1,1760566097.0,4,AskMechanics,1760643270,2025-10-15 22:08:17,2025-10-16 19:34:30,"ConstantMango672 (Score: 2): You don't have the drum pictured... lol 

Those are the brake shoes.  They still have life"
1o7omwy,Dealership charged me $780 to try to find a leak in my AC.,"2017 Lincoln MKZ

They recharged it with dye and kept it for two days, couldn't find the leak. They told me to come back in twenty days and they would inspect it again. They found the leak and replaced the condenser asy. The total came to $1968 which was covered by the extended warranty company I purchased when I bought the car. I had to pay the $200 deductible. The dealership hasn't reimbursed me for the initial inspection ($781). After getting ignored (non return calls) form the service advisor, I called the Service manager and he's telling me some 3rd party warranty companies will only cover one recharge. This was today. He said he'll dig into it and see if there's some money I can recoup. Has anyone had to deal with this?",127,1760565734.0,132,AskMechanics,1760643270,2025-10-15 22:02:14,2025-10-16 19:34:30,"Sir_J15 (Score: 26): Yup that’s right with R1234yf refrigerant. Be glad they did it with reclaimed and not new. New would be 2 to 4 times that rate depending on the dealer. I have also seen aftermarket warranty companies not cover refrigerant costs. Have seen a couple go as far as not covering recovery and recharge either.

TheSammySavage (Score: 169): It’s 1234yf. The service to charge and pull 1234yf is around 2.5hrs then there is a diagnostic charge of 1 hr. So roughly 3.5hrs is where you are at. Blame the government for 1234yf. Also do remember 10lbs of 1234yf is 500-600 dollars. 30 pounds of r134a is 400 dollars."
1o7oimk,2020 equinox,"Hey all!
My engine light has been on and off for a week or so. Swing by auto zone today to run a scan and it came back saying P1101, throttle body cleaning and set idol adaption. I barely know how to check my oil, can someone point me in the right direction? ",1,1760565447.0,3,AskMechanics,1760643270,2025-10-15 21:57:27,2025-10-16 19:34:30,Ravenblack67 (Score: 1): That code means you have an issue with your mass airflow sensor.  There is no code for cleaning the throttle body.  Idle adaptation is normally done after cleaning the throttle body.
