id,title,selftext,score,created_utc,num_comments,subreddit,scraping_time_utc,created_datetime_utc,scraping_datetime_utc,top_comments
1oopyju,2010 Chevy Impala. What is this and how hard is it to fix?,Went to replace the brake pads and noticed this looked like something that should be connected but isn’t. Am I correct in that? Is this something I can buy a part to fix myself?,3,1762306796.0,5,AskMechanics,1762457787,2025-11-05 01:39:56,2025-11-06 19:36:27,"I_heal_lips (Score: 2): That’s your swaybar end link. Super easy to fix, especially if the old rusty bolt comes off easy.

Jackass0905 (Score: 1): Kinda hard to tell from the photo but looks like a sway bar, have at it."
1oopwi9,Step by steps needed,"I can do basic mechanical work using YouTube videos, research, and follow step by step instructions. The economy sucks and I cannot afford to take it to the shop. 2005 Nissan Altima 
I was changing a strut and the cv joint came out (it fell), the rotor was at an angle and I couldn't get it back in. I got a mobile mechanic (off Facebook 😞) to come and get it back in. He got it back in place and left. When I lifted the car I noticed the ring on the ground. He gave me the run around and never came back.
I need some LITERAL step by step instructions to remedy this situation. Keep in mind I don't know shit and I will research what you tell me to do to better understand the assignment.
I have NO experience with this part of the car!
I need to know how to get the ring back in place, what grease and parts to buy and how to do the work. Thank you in advance for any help. Or if anyone is generous and located in central TX would be great 🤷‍♀️",1,1762306642.0,3,AskMechanics,1762457787,2025-11-05 01:37:22,2025-11-06 19:36:27,gresser32 (Score: 1): Replace the entire assembly and be done.
1oopv2i,Can anyone identify this sound coming from my 2011 Nissan Sentra SR,I recently had the engine mount and o2 sensor replaced this week. I discovered it's making this sound. Can it be something serious?,1,1762306536.0,3,AskMechanics,1762457787,2025-11-05 01:35:36,2025-11-06 19:36:27,Fun_Designer1663 (Score: 1): Sounds like an exhaust leak
1oop6xe,Not a car guy so don't know what this is.,Is this transmission related?  Gf noticed she had something dripping from her car.  Seems like a cap or something got busted off this thing. It's a 2017 Dodge Journey.  We're hoping it's nothing too costly because we just cant afford to have problems like this right now.,4,1762304686.0,8,AskMechanics,1762457787,2025-11-05 01:04:46,2025-11-06 19:36:27,"scummy2323 (Score: 5): https://preview.redd.it/qt9jbb45aczf1.jpeg?width=640&format=pjpg&auto=webp&s=c0b2b1141e8e6179a6b3a0bd00f62dc32d5e6666

Have a look in this storage bin, i bet its wet in there. That's just a plug to drain it.

MonteFox89 (Score: 2): Some dodge journeys have compartments in front of the rear seats in the floor. Check there"
1oop3sk,Help with new Tacoma,Hello I recently purchased a new 2025 tacoma trd sport and since owing it I've had about 5 alignments done on it and my steering wheel when driving straight leans to the right a bit. Went to toyota and the guy said his steering wheel does the same thing and that there's nothing bent or loose underneath. I've noticed my front passenger tire would lean inwards towards the truck. I've gotten that fixed multiple times. Now I took it to another place and they did their alignment and after a few days my front driver side is leaning out away from the truck. I've turned everything off that could be affecting it electronic wise. I got new tires and it still does that same thing I'm starting to get frustrated cause toyota seems to think I'm crazy and that since I'm 22 I'm probably hitting curbs (which I'm not) any advise on what could be going on? Also when I do have my steering wheel a bit to the right it'll drive straight as an arrow for about 3 seconds which is normal. Am I overreacting and overthinking? Should I leave it alone? ,1,1762304456.0,3,AskMechanics,1762457787,2025-11-05 01:00:56,2025-11-06 19:36:27,Any-Welcome-2978 (Score: 1): Did you have them check the control arm bushings? Too much play can cause leaning on either side.
1oooxrb,Rhode Island emissions,"I’m planning on modifying the exhaust on my car and I’m determining how much I need it to be “legal”. There’s a carb legal exhaust header with a cat in it but also one not listed as carb legal but still with a cat. Should I be good as long as it doesn’t throw a CEL at me? Or do I need to spend the extra money
",1,1762304017.0,5,AskMechanics,1762457787,2025-11-05 00:53:37,2025-11-06 19:36:27,"Wrong_Plan8277 (Score: 1): Car is a 2012 Mazda Miata 2.0 sport

Ok-Maintenance-9538 (Score: 1): It looks like RI is a CARB state, so they likely use a sniffer as part of their testing so I'd go with the CARB compliant setup."
1ooouyc,RPM Drops to zero when starting car?,"When trying to start my car after driving, it will crank seemingly normally but the rpm will immediately drop to zero. All the accessories will stay lit up and powered like normal. If I let it sit for a hour-ish it will start fine, or sometimes the rpm may dip after starting.  It will also idle roughly most of the time at stoplights etc, but drives fine otherwise. Currently I have the fuse for the abs pulled out due to a bad wheel speed sensor which is why all the lights on the dash are illuminated. I have checked for codes but do not see anything outside of the codes for the abs.

  
Suzuki SX4 2010 126k miles automatic",3,1762303809.0,5,AskMechanics,1762457787,2025-11-05 00:50:09,2025-11-06 19:36:27,"Old_Addendum_9798 (Score: 1): will most likely be a problem with one of the fuel air mixture sensors

u25low (Score: 0): Could be throttle valve clogging up. Try adding some gas when starting the car and see if that helps. For me the fix was extremely quick and cheap - take off the throttle body and clean it up"
1ooo94w,Another brake question…new rear brake squeaks,"Hey guys, I just got my front brakes fixed on my CRV years. They work great. Please understand this is my kids car so I don’t drive it.  

Anyway, I did the rear brakes not too long ago. Like maybe 300 miles ago. During the test drive for the front brakes and discover that one of the rear brakes is squealing.  It’s a rotor and pad, not a brake shoe. 

And if it matters, this is a 2008 Honda CRV.   And before I try to fight daylight again to fix it, can you give me your best guess what the most probable culprit is?  

Thanks in advance ",2,1762302214.0,8,AskMechanics,1762457787,2025-11-05 00:23:34,2025-11-06 19:36:27,"FallNice3836 (Score: 2): Did you lubricate the pad edges? Are they cheap pads? Really cheap pads are metallic and noisy.

FreddyBear001 (Score: 1): Without a brake inspection anything we say would be like guessing in the wind. You'll just need to take time to get back in there and see what's going on. Perhaps the brake pad wear indicators are hitting the rotor due to a stuck caliper or maybe you put really cheap pads on there that are worn out already. Probably isn't logical, but possible."
1opj5q0,cayenne turbo 4.5 v8 weird soind knock and its serviced pls help,,1,1762385918.0,1,CartalkUK,1762457787,2025-11-05 23:38:38,2025-11-06 19:36:27,UnintendedBiz (Score: 1): Timing chain?? Is it higher mileage?
1opj3tt,Bmw 840d - Reasonable purchase?,"Hi
For quite a while now i have been looking at getting myself a car.
Previously had a 335, 435, M4, so i am quite comfortable with Bmw's, and i have always liked the shape of the 8 series, apart from the car being so damn long!

Now, 
İ am looking at the Diesel, something with no more then 30k miles, dravit grey.

With a budget between 30-35k, do you think this is reasonable?
They seem like they have already taken that large depreciation hit.
Feels like allot of car for the money.

For anyone that already owns one, any pointers to watch out for? Looking to buy a BMW used approved one.",2,1762385784.0,2,CartalkUK,1762457787,2025-11-05 23:36:24,2025-11-06 19:36:27,icemonsoon (Score: 2): spend half that on an m6 and use the rest to run it
1opijr9,Puma ST Ecoboost reliability?,"I'm thinking about going for a 2022 Puma ST with Performance Pack as my next car, however, I'm confused about the potential for borkage with the Ecoboost Wet Belt.

I know the 'Dragon' engine shared with the Fiesta ST has a chain, but the oil pump is still wet belt? Is this as much of an issue? Will it eventually go bang in the same way? Catastrophic if so?

Any other issues to be aware of?

Cheers!",1,1762384411.0,3,CartalkUK,1762457787,2025-11-05 23:13:31,2025-11-06 19:36:27,"Forsaken_Boat_990 (Score: 3): It has the capability the go in the same way yes, though i dont think its nearly as prevelant. Personally I wouldn't trust a new ford as far as I could throw it and would suggest literally anything else.

scbond (Score: 1): Had a Fiesta ST with the 1.5 engine for three years and not a single issue. Never skipped a beat."
1opi4mt,"Is this allowed? 2 cars, 1 reg plate","Spotted this up London, near Bond Street. First time seeing 2 cars with 1 reg. Money talks? ",331,1762383396.0,145,CartalkUK,1762457787,2025-11-05 22:56:36,2025-11-06 19:36:27,"PromptCorner (Score: 327): Maybe filming something and need two vehicles for different shots. Makes sense if the registration isnt, well… registered! 😂

Peanut0151 (Score: 221): A mate of mine had three Morris Minors, only one would be roadworthy at a time. He used the same numbers plate for which ever one he was driving. 1982, like

MrReadilyUnready (Score: 193): That plate isn't currently assigned to a vehicle, so technically neither are registered lol."
1oph99e,"Anyone want a ""max power"" Peugot RCZ?",,1,1762381365.0,26,CartalkUK,1762457787,2025-11-05 22:22:45,2025-11-06 19:36:27,"SP4x (Score: 5): Playing devils advocate here, I'd say that, paintwork aside, it's more attractive than some of the latest offerings from manufacturers.

therealharbinger (Score: 6): It's not even wrapped..

That's literally hand drawn graffiti..

mrburns199 (Score: 9): Why did I know it’d be Birmingham…"
1oph8e1,Recent MOT,"Just had my MOT, would any one guide me on average cost for this please. I’m just a girl that doesn’t want to be ripped off 😅",0,1762381308.0,5,CartalkUK,1762457787,2025-11-05 22:21:48,2025-11-06 19:36:27,"WebGuyUK (Score: 2): Unless it's a rare car, that needs scrapping. You're talking easily many hundreds possibly over a thousand, it needs a new subframe and new springs, scrap it and find another car unfortunately.

Odd-Attention-4358 (Score: 2): Just a side note, the DVLA has the proper page to check MOTs rather than some random 3rd party.. [https://www.gov.uk/check-mot-history](https://www.gov.uk/check-mot-history)

OrdinaryAncient3573 (Score: 1): What's the car worth, roughly? If it's still worth, say, £5k if those are fixed, then either it's worth paying to fix, or  someone would buy it off you for a reasonable discount and do the work. If it's £1k fixed, then time for the scrappy - or try to sell it for anything you can get over scrap price. If it's somewhere in between, you need to get prices and make up your mind.

Just as a very rough guesstimate, only knowing it's some sort of Corsa but no idea about age, I'd say that's perhaps £500 in parts and £800-£1k in labour. I'd be surprised if it was much less than that, but not too surprised if it was 50% higher - and I wouldn't fall off my chair if you told me it was double. As always, ask a few places for quotes to fix, and you'll get a reasonable idea of the going rate in your area."
1oph0n0,EVs to pay per mile.. thoughts?,"Not an EV driver myself, but does not make sense considering the 2030 mandate imo - and would be very pissed off if I’d just bought one.",32,1762380812.0,288,CartalkUK,1762457787,2025-11-05 22:13:32,2025-11-06 19:36:27,"kharma45 (Score: 110): The latest in the Telegraph’s have a guess at stuff and see what might be right. 

Not against it but they’re not reliable.

Apprehensive-Risk542 (Score: 18): I don't really think this story is credible..

However if they do it, I think they'd likely do it across all cars and make a small token reduction in fuel duty.

Also I believed they'd likely tier it, so your first 5k would be free, 10k would be 6p a mile, 15k 8p a mile etc

dorsetlife (Score: 8): How would this work if you go for a drive down to the south if france and back? And what about foreign cars over here?"
1opgfto,So which looks the best? I've looked at a lot of cars.,,2,1762379491.0,18,CartalkUK,1762457787,2025-11-05 21:51:31,2025-11-06 19:36:27,"j03 (Score: 8): I’d personally be tempted by the Lexus. I think the Civic is a bit ugly. The Octavia is nice enough, but the interior quality of the Lexus will be far superior, and they’ve been making hybrids for decades. Do you know if it has Lexus service history? If so, it will still be under warranty.

Successful_Caramel79 (Score: 6): I think the lexus stands out the most out of those three, however it also depends on your mileage and driving split. The skoda looks the most economical but all three are fairly bullet proof

WitekCannon (Score: 2): It's subject.
For me Civic but in white only 
Lexus in black
Skoda in ""skoda green"", I don't know the exact name of that colour"
1opg10q,"20k for a new daily, what would you get?","Looking for some advice please, I'd like to get a new (to me) car, budget would be max 22.5k I think. 

Looking for something that: 

- Has good boot space 
- Comfortable, especially as I do a few big mileage trips
- Has at least some power. Doesn't have to be a supercar but just something 
- 4/5 doors 
- I do like some of the driver comforts, like heated seats, reversing camera 
- Decent reliability and not overly high mileage 

I've considered a 4 series gran coupe, I like the boot on that one. Have also looked at the Audi A4 & A5. 

Have looked at estates, I do like that they offer most of the things I'm looking for. My only reservation is they do seem really long. I have a sportage at the minute and the estates are even longer. Those of you who own / driven estates, how did you find them day to day? Especially around car parks and tight spaces ",4,1762378536.0,26,CartalkUK,1762457787,2025-11-05 21:35:36,2025-11-06 19:36:27,"Maty612 (Score: 4): Something like this i think will be perfect for you
http://www.autotrader.co.uk/car-details/202509236561894?utm_source=share&utm_medium=android-app

Thread-Hunter (Score: 3): Volvo xc70 or v70 d5 2.4. It's a real beauty and built like a tank.

Apart_Knee1501 (Score: 2): Corolla Touring Sport with the 2.0 engine and in either GR or Excel trim - you can find them second hand within budget "
1opfz78,Brought a car from scrapyard auction,"Last week I brought a car from auction at a scrapyard and it didn’t come with a V5, but the lady gave me the V5 reference number can I use this reference number to get a logbook or do I have to apply for a whole new one? ",0,1762378423.0,1,CartalkUK,1762457787,2025-11-05 21:33:43,2025-11-06 19:36:27,"NervousEssay5074 (Score: 3): If you have the reference number, change it online to you and they post a new one out automatically."
1opfmag,Stupid question (apologies in advance!),"I've got a car which currently has run flat tyres, and they all need replacing. 

I'm currently shopping around for the best deal (thanks you some helpful people on here!) but noticed regular tyres are much cheaper than run flats.

My question is can I get away with regular tyres or do I need to buy run flats again?",1,1762377632.0,5,CartalkUK,1762457787,2025-11-05 21:20:32,2025-11-06 19:36:27,"Sa-SaKeBeltalowda (Score: 2): I made a mistake and bought Pirelli runflats last year. This year I swapped to regular tyres, because those tyres made car feel like shit. Never again I’m buying runflats, not only they cost more, they are also much stiffer, and pass a lot of vibration to suspension and steering. Get a set of regular tyres, order a decent tyre repair kit and never think about it again.

Jimbomdave (Score: 2): You def need to replace all 4 - you shouldn’t mix them.

Only thing to check is if the car is under warranty and the car requires them for the spec of the car eg. Suspension etc

jay19903562 (Score: 2): Should be fine swapping for comparative load rated non run flat tyres. 

But bear in mind if it had run flats it probably doesn't have any provision for punctures like a spare wheel or a foam kit."
1opfm7j,Antifreeze check,How do I tell which type of antifreeze is in my car? Apparently colour is not indicative. ,1,1762377627.0,3,CartalkUK,1762457787,2025-11-05 21:20:27,2025-11-06 19:36:27,"ciaoqueen (Score: 1): Should specify in the manual.

blueberryG3 (Score: 1): plug reg into halfords

therealharbinger (Score: 1): Errrr.

They all seem to have changed in recent years.

Blue is now green..

Red is now pink..

Mercedes coolant is now bright pink.

Audi has gone from blue to Green."
1opfae1,Scraped Rear Bumper,"Unfortunately I scraped this 2012 reg VW today, left my details and spoke with the owner tonight. They are going to get some quotes next week and let me know costs.
Currently stressing and wondering if anyone can advise on likely rough costs? Based in NE England. Thanks. ",0,1762376908.0,6,CartalkUK,1762457787,2025-11-05 21:08:28,2025-11-06 19:36:27,"Barph (Score: 2): That's a write off if ever I saw one

Otherwise_Public2579 (Score: 1): Minimal damage, wash it, T-Cut it and touch up pen £20 max if the owner does it himself or about £300 at a body shop"
1opf9g5,Skoda Scala replacement seatbelt,"My boyfriend has a 2022 Skoda Scala 1.5 5 door hatchback and his driver side front seatbelt has stopped working. It is locking after a few inches, and can get it to fully pull down if he gets it at the right angle. 
He took it to a garage and they have advised he needs a new seatbelt and have suggested buying one online and then taking to them to be fitted. Both of us are not very car savvy and I have been trying to look online, but am struggling. Does anybody have any advice on how to source a replacement seatbelt? ",1,1762376853.0,4,CartalkUK,1762457787,2025-11-05 21:07:33,2025-11-06 19:36:27,"OrdinaryAncient3573 (Score: 1): Is that not still in warranty? If not, talk to a Skoda main dealer, and ask for a part number. Then google it.

scbond (Score: 1): Ever heard of this mythical website called ‘eBay’?

_tym (Score: 1):  [Here ](https://www.ebay.co.uk/itm/136556548452?fits=Car+Make%3ASkoda%7CCars+Year%3A2022%7CModel%3AScala&_skw=2022+Skoda+Scala+seatbelt+front&itmmeta=01K9B1CXSP4T3FN06C802W5XQ5&hash=item1fcb679164:g:Gd4AAeSwQvto5Oij&itmprp=enc%3AAQAKAAABAFkggFvd1GGDu0w3yXCmi1fR04zu9aWj2QMA1JCe6AqhAuZnykWRJaj874AaVd5i075zGQkcVaH4%2FSK7bWUjecvyq9H91Q5cgdKKPt6qqv4rTtYhSPWeTHAsXBR2gvolF58NUqbm3HbKf8opRS2Vb0DWLG%2BXuMICWZR6tXiGtvcF6l2keaGiBigYbhDNjCBTstqTiR%2B92n8i%2BjdRPJ50UTSuna5YiAM4%2BkoKkW%2BGOS3h5mquc8tx%2FbZ89qqtlFAxUlb2aweDxit271s5I%2ByM4Z2M8LKVjFtosBS8fhY%2B7Wzs2psByQyuKzQPnZ2ReD5uC8wpqL6EK6TnqNnxDYKkIVw%3D%7Ctkp%3ABk9SR4bds-HKZg)& [Here ](https://www.ebay.co.uk/itm/257193342891?_skw=2022+Skoda+Scala+seatbelt+front&itmmeta=01K9B1CXSQF8P5KN2GVS8NZJT2&hash=item3be1eaf7ab:g:2Z4AAeSwGBZpC2AI&itmprp=enc%3AAQAKAAAA4FkggFvd1GGDu0w3yXCmi1dAkkuVhLtRAuwver1V%2B6OOexn8UUsRIKNCDSVL9AMrGZ%2FgeEKA%2F9YZ8ZhumePCJKeZHry%2FhKjnZ6EXPQHdLaDGE1aCbUfmko5NdH%2FBiNYMFE%2F2eI%2FI%2F%2BXP1DtKaowYb2EL2x7nJx%2FDgIuB3qucJLNVnWfF7Mk5W26ySxZD1dv5PqQMMo%2FZRuEl6HNwJXpWT%2FBtnuXtLhsp8t0Awmo5P1Q%2FtouBl8uGh14%2FhVHWLbTxgeP2a3Gvv6B4JTl0XKrgcb0mkS8jzGdNxpHOO1sosySJ%7Ctkp%3ABk9SR4bds-HKZg)"
1opf8w3,wtf is wrong with BMW,,274,1762376816.0,149,CartalkUK,1762457787,2025-11-05 21:06:56,2025-11-06 19:36:27,"liquidio (Score: 148): I really think BMW’s design language struggles with their kidney grille. Many other manufacturers have found it easier to adapt whatever their iconic ‘face’ for the car is, but with BMW it somehow looks a bit silly without its underlying function. 

Just an opinion, you’re free to disagree. Perhaps there would be a better solution if they weren’t pursuing the design direction they have been.

TopDonutPlainsGopher (Score: 158): Feels like every car manufacturer is going for the big blocky look nowadays. You know it's bad when Renault Clios are starting to look sexy.

UnfortunateWah (Score: 58): Ngl that looks pretty cool, and a damn sight better than some of their current stock of outrageous grilled vehicles."
1opf857,"Find me a car - the more bonkers the better. Budget £4,418","I just sold a car and I have a 20-year NCB I don't want to go to waste so I want to get a fun shitbox to insure using it. I'm ancient and live in the country so insurance cost isn't much of an issue.  I've already got a Lexus LS430, an old SLK and a family snore-mobile SUV type thing, so those bases are covered. And I've currently got £4,418 in my savings account. What should I get? ",4,1762376769.0,73,CartalkUK,1762457787,2025-11-05 21:06:09,2025-11-06 19:36:27,"TheOneWithoutGorm (Score: 31): Renualt Wind. Maximum quirkiness, excellent build quality

OrdinaryAncient3573 (Score: 13): Bonkers? Not much more bonkers than a Mia Electric:

[https://www.theparking-cars.co.uk/used-cars-detail/mia-mia/voiture-electrique-mia-12-kw/MENQ1O5M.html](https://www.theparking-cars.co.uk/used-cars-detail/mia-mia/voiture-electrique-mia-12-kw/MENQ1O5M.html)

[https://www.whatcar.com/news/mia-electric-car-driven/n8240](https://www.whatcar.com/news/mia-electric-car-driven/n8240)

Central driving position, so it's basically indistinguishable from a McLaren F1.

OolonCaluphid (Score: 7): Mercedes ML55 AMG £3,995

http://www.autotrader.co.uk/car-details/202510297503770

Audi A8 4.2 TDI quattro

http://www.autotrader.co.uk/car-details/202511017584836 

Impreza WRX Prodrive wagon £3600. I had one near identical and it was brilliant. Well just ignore that I paid about the same as this 12 years ago. 

http://www.autotrader.co.uk/car-details/202510177237939

Audi S4 4.2 avant with 'minor issues' and £2500 left in the bank to fix them...

http://www.autotrader.co.uk/car-details/202511057672730"
