id,title,selftext,score,created_utc,num_comments,subreddit,scraping_time_utc,created_datetime_utc,scraping_datetime_utc,top_comments
1nqhw2m,How do I get rid of the Airbags service light in my sierra,"2015 sierra 

I got it after changing back my HMI (had to return the 2.5 I got long story) and after that I noticed the airbag service light came on, i know it's a glitch it's got to be
 But how do I erase/reset the light?

Ive tried to use my obd2 scanner but it won't work

I've contacted a shop in my area and they say that they'll let me use their stuff for free to fix my car if I do it myself (VCX diag nano probably and of course their Techline connect account)

What i need to know is tomorrow when I go, what should I be using? DSP or SPS2? Can someone please explain? If it'll make you all feel easier in no where near north America or Europe im in Riyadh and i'd really appreciate the help

",0,1758832577.0,3,CarHacking,1758915136,2025-09-25 20:36:17,2025-09-26 19:32:16,"vilius_m_lt (Score: 3): SPS2 is for programming. You would use GDS2 and just do vehicle diagnostic which will pull codes from all modules. Any higher level scan tool will have that option too

K9_Heaven (Score: 1): Have you unhooked your battery for about 30 minutes? Letting all systems drain power? For minor things this can reset the system. It seems stupid but I have had this work for many IMMO issues, Airbag and check engine codes that would not go away."
1nqmk0j,Loosing coolant after water pump replacement,So I had a mechanic change my water pump and it costed me 400$ now he did that a few days later I hear a bubbling sound from my resovoir so I assume it’s because I need to bleeed the air from my radiator but when I do my radiator is quite literally bubbling and just boiling the coolant and it’s rising and overfilling a no spill funnel is this a blown head gasket ? At this point I’ve put 900$ into this car in the last month and I’m my wits end also gonna add a pic of the oil cap btw this started happening after I got a recent oil change yesterday but this is all a few days after my water pump replacement and thermostat housing + thermostat replacement ,1,1758844474.0,4,AskMechanics,1758915136,2025-09-25 23:54:34,2025-09-26 19:32:16,"samdtho (Score: 1): Do you have oil in your coolant? Do you have coolant in your oil? If not, take it back and have them complete the fix. It’s probably got air in the system and was only (or a majority) filled with water."
1nqlyp9,Uhhh. Whats that suppose to mean,,1,1758842825.0,2,AskMechanics,1758915136,2025-09-25 23:27:05,2025-09-26 19:32:16,Alarmed-Biscotti-925 (Score: 2): Honda crv 2000. Saw smoke when i came to a red light with oil spatter on the inside of the hood
1nqln79,Hunter Quick Check--have you worked with it? Opinions?,"I take my Subaru to the dealership for its work and noticed they are using one of the Hunter Quick Check setups to check wheel alignment. If you're not familiar, it's basically a laser scanner that scans the vehicle as it rolls through the service drive area.

  
So, I'm interested in hearing from mechanics or alignment techs that are familiar with this system and what they like or hate about it. I'm just a retired GM tech interested in the technology of it. Seems pretty amazing.",1,1758841968.0,2,AskMechanics,1758915136,2025-09-25 23:12:48,2025-09-26 19:32:16,hassan254 (Score: 1): Sounds like a good thing but I’ve not used it nor know anyone who has
1nqllnx,"Squeaking noise when reversing , deeper issue besides Rotors?","No picture of the pads but they’re definitely new. Wondering if my rotors look “thin” to you guys? Was adv by Brake Check that my rotors were thin and my struts needed replacing. The struts is most likely true but unsure of the rotors because my front ones were fine, so it doesn’t make sense that only the rear would be bad? ",1,1758841849.0,2,AskMechanics,1758915136,2025-09-25 23:10:49,2025-09-26 19:32:16,Ok_Communication4875 (Score: 1): It’s a 2018 Toyota RAV4 Limted FWD / safe to assume most parts are factory because who ever owned the car before me didnt do SHIT besides oil change and aftermarket cosmetics.
1nql8s5,2005 Corolla S (208k miles) with code P0741,"Check engine light with that code has been on since I bought the car almost a month ago, had a singular day when the check engine light was off but besides that, it’s been on, I’ve heard multiple different outcomes like changing the solenoid and draining the fluid can cause more transmission issues (the fluid is definitely bad), others have said just drive it until the car dies, another said to just fix it and it’ll be fine. The car definitely accelerates slow (until about 25mph then again after 50mph), I can feel the shifts but they aren’t super aggressive and from what I’ve been told, it’s slipping, I’m just not sure on what the best course of action would be (everyone that’s looked at it says the car is still in very good condition and was taken care of)",1,1758840905.0,2,AskMechanics,1758915136,2025-09-25 22:55:05,2025-09-26 19:32:16,Pilot_G3 (Score: 1): To be honest I just cleared the code and it never came back
1nql32f,What’s the issue ?,"2000 Lincoln town car, at first the wire would just slip out and the car wouldn’t go out of park until it was put back on to its clamp, and it would spark when connecting. Went to move it out of park today and it wouldn’t budge, when the wire was removed and connected there was no spark. I think it’s the parking switch wire, I’m not to sure which is why I have someone checking it out tomorrow but I’d still like to be sure. Anyone knows what could be the problem causing this issue could be? I’m thinking replacing that wires and the piece it attaches too but I’m not too sure of it’s official names or if that’s the problem. Wires look cooked imo, but again I don’t know too much. Thanks in advance.",1,1758840490.0,3,AskMechanics,1758915136,2025-09-25 22:48:10,2025-09-26 19:32:16,"Typical_Depth_8106 (Score: 2): That looks like your ignition/shift interlock feed wire at the ignition switch connector on top of the steering column. The sparking you saw before was a loose/burnt connection barely making contact. That’s why it would “work” sometimes. Now there’s no spark because the wire or terminal is cooked and not carrying power at all. The car won’t come out of park because the shift interlock solenoid isn’t getting the power it needs from that circuit.


What I'd do is first inspect the ignition switch connector. If the plastic or pins are melted, that’s your failure. Then test that wire with a multimeter, you should see 12V with the key in RUN. If not, the problem is upstream (ignition switch or fuse). If yes but it doesn’t carry through, that wire/terminal is bad.

Replace the cooked wire/terminal with the correct gauge and a new pin (don’t just tape it). Ford sells pigtail connectors for this exact repair. If the ignition switch itself looks burnt, replace it too, that's a very common failure on these."
1nqkxqo,What is this part?,"I have ford edge SEL 2014 and I noticed a clicking sound when the car is running and the gear in P. The clicking noise is followed by slight vibration. This issue keeps repeating on car on P. I looked inside below the hood and found this part vibrates when the clicking happens. I think it is related to AC but not sure

Could someone tell me what is this part and what is it for? Is it normally operated like this? Is it serious and needs replacement? Is it actually this part that is causing this issue or maybe it is another part?

Thanks in advance 
",1,1758840102.0,2,AskMechanics,1758915136,2025-09-25 22:41:42,2025-09-26 19:32:16,"Bruce65lv (Score: 1): Its the tensioner.Can't tell from the picture,but the clicking could be the AC compressor cycling.Could be low on freon.Does not mean the tensioner is bad."
1nqko95,"Does ""red timing belt"" mean it was replaced?","I bought a 2010 Honda Odyssey from Copart, repaired the collision damage, got it titled as rebuilt, and it's now my daily driver. It has over 120,000 miles, which makes a timing belt replacement urgent. I don't have the service records, but when I registered it at Hondas my garage website it had the attached record. Anybody knows what it means?",1,1758839417.0,2,AskMechanics,1758915136,2025-09-25 22:30:17,2025-09-26 19:32:16,"lantrick (Score: 2): 46k would be unusual to replace the timing belt. Honda says replace @ 105k/7years

edit: since its an interference engine, many opt to replace on a shorter interval.

SO, even if it was replaced, it's time to do it again @ 7+ years. Honestly , I'd make the appointment today."
1nqkgal,Can someone please tell me what this is and where it goes in my '06 Chevy Silverado,,3,1758838854.0,4,AskMechanics,1758915136,2025-09-25 22:20:54,2025-09-26 19:32:16,"Comfortable_Rub_3912 (Score: 3): Parking break switch

MountainSpite6431 (Score: 1): Some kind of limit switch 🤔"
1nqkg81,What would cause new oil to turn nasty black after just a few hundred miles?,"For context, it's a 1983 Chrysler Lebaron Woody Convertible (yes, the Jon Voigt car).
It has under 40,000 miles and has been sitting for about 20 years. 

Yes, I know, 1983 was not Chrysler's finest hour mechanically.

 In spite of all that, it's in amazing condition, starts right up and runs great, but after it's fully warmed up ir runs like crap. Rough idle, bogs on acceleration.

I'm trying to get it back up to snuff, but before I spend a bunch of cash, I want to know if I'm already boned.

Why is the oil so nasty so soon?",0,1758838849.0,12,AskMechanics,1758915136,2025-09-25 22:20:49,2025-09-26 19:32:16,"Diligent_Working_709 (Score: 1): Maybe old sludge heated up and mixed in? How does it look in the oil fill/valve cover area?


I've heard of people using transmission fluid or kerosene/diesel in the oil to help break up sludge, the detergents help collect it then you just change the oil a couple times with cheap stuff after running it for a little while.

Extra_Programmer_970 (Score: 1): 2.2 turbo?"
1nqkf0g,How difficult is it to make my '99 crv AWD again?,"Bought a 1999 crv, the previous owner apparently took out a good chunk of the AWD functionality, like the drive shaft, rear differential, and both half shafts, except they kept the original transmission. How difficult would it be to make my crv AWD again?",1,1758838767.0,5,AskMechanics,1758915136,2025-09-25 22:19:27,2025-09-26 19:32:16,"agravain (Score: 2): you would have to put all that stuff back...

ItsJustAnotherVoice (Score: 1): Difficult? Not much. 

Will probably cost you a good amount of money since thats the valuable parts they took out lol"
1nqka8t,Does this intermediate shaft look ok?,Trying to isolate source of slight wobble on the car. Is this shaft leaking grease? Or is this completely normal?,1,1758838435.0,2,AskMechanics,1758915136,2025-09-25 22:13:55,2025-09-26 19:32:16,jakeklong (Score: 1): It's fine. Probably a wheel / tire issue
1nqjw82,how to remove tightly spinning bolt that wont come outward?,,9,1758837472.0,21,AskMechanics,1758915136,2025-09-25 21:57:52,2025-09-26 19:32:16,"Affectionate_Net_252 (Score: 11): Looks like that square nut should be welded but the weld has broken. An impact is likely the answer. You may need to find a pry bar to wedge the nut or put pressure on the exposed threads of the bolt while hitting with an impact.

ClimbaClimbaCameleon (Score: 3): If you’ve got a skinny flat head try putting it into the top hole and wedge it between the square nut and the frame to put some tension on it. This might hold it enough to let you draw the bolt out without it moving."
1nqjr1x,Should the output shaft of a manual transmission be able to rotate freely while in gear but with the clutch depressed?,"Trying to work out a strange feeling pedal on my e36 manual swap. it's not soft, but resists fast movement like it damped somehow. Maybe it's just bled improperly but maybe it's smth else. I can't turn the output shaft by hand under the conditions listed in the title, and i'm on the fence on whether this indicates a clutch that is not disengaging fully. The clutch is used but fresh. Is it possible that a tiny bit of pressure on the friction plate causes just enough engagement with the flywheel that the output shaft can't be spun by hand?",1,1758837114.0,4,AskMechanics,1758915136,2025-09-25 21:51:54,2025-09-26 19:32:16,"rddtlcksdrtybtthls (Score: 1): Sounds like issues with either master or slave cylinder or rubber hose connecting the two

steelartd (Score: 1): If you have it in first gear then it will be harder to rotate than if it is in direct drive. You will probably still feel some drag from the disc but you should be able to rotate it."
1nqjbkv,2010 Rav 4 at 100k miles,"1. $535 ALTERNATOR & BELT 

2. $207 SPARK PLUGS 
3. $135 AIR FIKTERS 
3. $166 BRAKE FLUID flush
4. $192 ATF TRANS flush
5. $755 WATER PUMP / BELT plus flus
7. $117 OIL CHANGE 
8. $910 FRONT SHOCKS 
9. $677 REAR SHOCKS

They are offering 20% off plus free alignment so $2955 out the door. Fair deal? Or should I walk. I need the alternator replaced. Plus ball joints and stabilizers leaking grease. Everything else I haven’t done and prob needs to be for preventative maintenance. Curious your thoughts. ",0,1758836056.0,4,AskMechanics,1758915136,2025-09-25 21:34:16,2025-09-26 19:32:16,"Junner55 (Score: 1): Would you be willing to learn how to change shocks? It’s relatively a simple process. 

I would personally avoid ATF flush and opt for drain and fill. Also what kind of air filter costs 135??!"
1nqj6u7,Is my car totaled? 2012 Toyota Avalon limited 142k miles,Was hit while parked. ,0,1758835728.0,6,AskMechanics,1758915136,2025-09-25 21:28:48,2025-09-26 19:32:16,"Vivid-Ad2262 (Score: 4): I’m surprised the car didn’t explode with that kind of damage

LilSkills (Score: 4): This has to be ragebait"
1nqiyyu,Pads or Rotor?,Are my pads low to where they need to be replaced ? or is the rotor damaged or scored from looking from this view ?,2,1758835174.0,13,AskMechanics,1758915136,2025-09-25 21:19:34,2025-09-26 19:32:16,"cormack_gv (Score: 2): They're both fine.

tvmdc1 (Score: 2): Both  are good!"
1nqit0p,Wife’s car has been shaking a lot lately and seems to be coming from under the hood. Found this when lookin.,Would this cause the car to shake when accelerating? I never hear any loud clunking or banging noises when changing gears. It just shakes a lot more then normal when accelerating ,18,1758834770.0,11,AskMechanics,1758915136,2025-09-25 21:12:50,2025-09-26 19:32:16,"crudelydrawnpenis (Score: 14): I believe that’s your transmission plug.. 
take a look at this video. 

https://www.youtube.com/watch?v=n7LbSkldR0A

daleming69 (Score: 13): Either it splashed out enough fluid to make the internals unhappy or received enough debris to also make the internals unhappy. Get it to a shop and have it diagnosed in person because it could be transmission related or something entirely different"
1nqio3c,What’s a reliable late-model “beater” pickup truck that’s relatively easy to maintain?,"I need a pickup to help me with house projects and landscaping. I’d try to do most of the beginner/intermediate work on it myself.  I’d also need it to commute to work (about 20 highway miles a day) with a pretty average climate (Denver). What’s a good bet in your eyes? Make/model/year/decade?

EDIT: disregard “late-model”. I can’t edit the title ",1,1758834434.0,8,AskMechanics,1758915136,2025-09-25 21:07:14,2025-09-26 19:32:16,"w4559 (Score: 5): Early 2000s Chevy /gmc.  If it doesn’t rust out, it will last forever.

OutsideAd3064 (Score: 3): OBS Chev or GMC  - that's from 1989 to 1998. I think they are the right blend of modern yet simple.  The 5.7 vortec is a good engine that will run forever.  I put a bluetooth stereo and remote start in mine for some modern touches and I personally love the body style.  The only problem is they are becoming hard to find not all rusted out and the ones that aren't are pricey (but still way cheaper than a new 65,000 dollar truck)."
1nqig5z,Any reason car manufacturers go the long route?,"Any reason why manufacturers go the long way with air intakes? Why not move components, like the battery in the bottom pic and put the intake on the same side as the turbo?

Noticed this on cars that I own and cars that I want to buy in the future even though they're supposed to be sporty",167,1758833903.0,63,AskMechanics,1758915136,2025-09-25 20:58:23,2025-09-26 19:32:16,"CameronsTheName (Score: 146): Longer tubes reduce intake noise, allow more even velocity, probably better for fuel economy somehow.

Top_Blacksmith7014 (Score: 61): Turbos get real hot. Also long intakes are good for low end torque. Some engines even deploy dual intake runners to increase the area under the curve of the torque figures. Long runners for low end tq, while short runners good for high rpm tq."
1nqhzfw,Broken muffler -- cost to repair?,"Canadian here (for quote purposes).   

Vehicle is a 2011 Mitsubishi Lancer Sportback SE.   

The break is right before the CAT.   

I've sent pics to a number of mechanics around town and am waiting on replies, but thought it might be prudent to get some neutral opinions here as well.   

I understand possible fixes for something like this could range from a simple weld, to welding in a new CAT, to replacing the entire exhaust assembly.   

I've had one mechanic respond and say only a full replacement will suffice and quoted me $4.5k. I am definitely not able to afford that.   

I can source a replacement CAT for around $250 (maybe less, haven't done an exhaustive search yet...pardon the pun).   

Any other opinions would be appreciated. Thanks much.",0,1758832791.0,12,AskMechanics,1758915136,2025-09-25 20:39:51,2025-09-26 19:32:16,"Paradise_9703 (Score: 3): Thats not a break. Thats attempted theft

Paradise_9703 (Score: 2): Itd probably cost you 1/2 as much as quoted to replace it yourself. If the bolts arent frozen I dont think itd be too difficult"
1nqhq1x,Would this explain the clutch not being quite right...,"I had a gearbox change a couple of months back... The original was destroyed by debris on the road and I got a 2nd hand replacement fitted by a local mechanic. 

It's been bugging me since that I can't engage first gear with the clutch down until I'm almsot completely stopped. 

I just thought it was either minor colattteral damage to the clutch or dual mass flywheel or an inferior gearbox. 

But I Googled it and the AI told me to check the clutch fluid. 

As you can see it's not very low but it is just below the minimum line and only just fills the bottom of the chamber. 

Would topping this up make a difference? 

Would I need to do anything other than top it up? 

Would this be appropriate for topping it up? 
https://amzn.eu/d/5trKWdP

2014 Honda CR-V diesel, 1.6L turbo ",2,1758832198.0,2,AskMechanics,1758915136,2025-09-25 20:29:58,2025-09-26 19:32:16,drunkenhonky (Score: 1): Top it up and bleed it if you can.  Do you have any leaks? Low clutch fluid could 100% cause the clutch to not fully disengage giving you problems putting it into gear.  I just hope nothing else is torn up from it.
1nqh4u3,Sniped lines,"2000 1500 Chevy 4x4, my friend was having issues and was looking around and found this, what is it?",16,1758830847.0,10,AskMechanics,1758915136,2025-09-25 20:07:27,2025-09-26 19:32:16,"SuitableGain4565 (Score: 25): Someone replaced the brake lines (very common for Chevy) and they didn't yank the old ones out. 


While they might have routed them the same as the old lines, they might have preferred them to not accumulate mud or salt by changing things up.  


Personally I would have taken the old lines out, but they might have felt lazy

Doip (Score: 3): Oddly unfamiliar with that era Chevy but on everything else I’ve seen, those are brake, fuel, or transmission lines. Any of the issue with those systems?"
1nqgvqd,Knocking Audi TT 2.0TFSI,"Just started it up, and suddenly making a pretty loud knocking sound. 

It's been a bit tricky the last few months - but read in a few places those engines can be. But this is pretty bloody loud.

Sounds expensive....",0,1758830246.0,2,AskMechanics,1758915136,2025-09-25 19:57:26,2025-09-26 19:32:16,PureMatt (Score: 1): *ticky not tricky.
1nqgddb,Does anyone know what this means?,Is this a battery issue? Alternator issue? Something else engine related?,8,1758829040.0,24,AskMechanics,1758915136,2025-09-25 19:37:20,2025-09-26 19:32:16,"Last-Variety-630 (Score: 25): You need a jump, low cranking amps. The battery isn't charged enough to turn over the starter.

moomooicow (Score: 15): On today’s episode of dead battery"
1nqgc5l,Need some help.,My 2011 Nissan Sentra is making a weird noise from the passenger side and have no clue what is wrong with it. This is what it sounds like:,2,1758828963.0,2,AskMechanics,1758915136,2025-09-25 19:36:03,2025-09-26 19:32:16,"Last-Variety-630 (Score: 1): Sounds suspension related, but there's no way to diagnose from the video."
1nqg9ux,Dodge challenger sxt,"I changed both fuel pumps, relays, and fuses and still wont start dont know where to go next.",1,1758828814.0,4,AskMechanics,1758915136,2025-09-25 19:33:34,2025-09-26 19:32:16,"RichardSober (Score: 1): You was supposed to confirm the power supply and voltage drops first. All these codes have set conditions. ""High input"" means your PCM sees voltage values outside of the expected range."
1nqg5oj,about replacing brake lines,"I have an oldtimer that had problems with brakes. My mechanic replaced two copper (or some sort of metal) lines with bendable plastic lines. Picture attached (the line failed right on the crimped part). One of the replaced failed I think almost immediately, but he didn't notice.

My question: is this the right way to replace? The crimped connection doesn't seem that strong (just gut feeling), or am I wrong?

Second question: if I would would want to DIY with copper lines. Are these cheap off brand flaring tools good or does one need more professional tools?

https://preview.redd.it/yzte6tkh4drf1.jpg?width=4000&format=pjpg&auto=webp&s=aeb58126a1dd2a9b61498888bc3920b78db8a701",1,1758828553.0,9,AskMechanics,1758915136,2025-09-25 19:29:13,2025-09-26 19:32:16,"River_2675 (Score: 1): Is the line plastic or a flexible rubber line. 
Rubber lines are fine to use as a long line that runs along the body and a failure in one of them should be rare, but if they are plastic then please have the car towed to a shop for replacement

The line that you took a picture of is a rubber line for instance

ApartShelter5613 (Score: 1): it's rubber not plastic, my bad. I attach the picture. The rubber feels plenty strong, but the crimpped part is bad (even without knowing that it leaks). I'm not a mechanic, just for hobby a bit, so I'm seeing people do this with copper or some other metal tubing and i'm wondering, wouldn't it be better if I did it with copper as well?

https://preview.redd.it/s6n6qi5r6drf1.jpeg?width=4000&format=pjpg&auto=webp&s=5d0bb9f7d422fcf571a0f3b48f96e4ff1ccbbd6b"
1nqfms9,Can I leave my car untouched for 1 month?,I’m going out of town and was wondering if I should have my neighbor start my car while I’m gone. It’s a 2020 Ford Escape. Thanks!,1,1758827349.0,6,AskMechanics,1758915136,2025-09-25 19:09:09,2025-09-26 19:32:16,"ibo92can (Score: 2): What I usualy do is take off negative terminal on battery. Is it a must? No. Since I dont have a battery booster i just make sure battery stays juiced until im home again (4-5weeks) 

Also if possible a good idea to park it in a garage or cover it up so bird poo dont burn the clear coat/paint.

bitmanip (Score: 1): One month is nothing. Worry about things when they are like 9-12 months idle. Even then, battery is really only thing to worry about and likely not an issue."
1nqfe2s,"2017 grand Cherokee, park sense issue","Hello everyone

 Anyone know why my parking sensors are doing this ? I had a minor accident a week ago and it's just acting eird ever since was",1,1758826812.0,2,AskMechanics,1758915136,2025-09-25 19:00:12,2025-09-26 19:32:16,RichardSober (Score: 1): Your sensor likely points in a wrong direction. Scan trouble codes and inspect parking sensors.
1nqfbs5,First day and I’m nervous,"So I’m starting to work at a independent shop on Monday and I am in school for automotive but theory compared to on hands work is much different and I haven’t really worked on cars, and I’m scared I might mess up or I might slow them down or I might not understand something and they get upset with me.

So what are some tips or suggestions I should keep in mind or something you guys have done to help you when you were first starting??? ",2,1758826659.0,11,AskMechanics,1758915136,2025-09-25 18:57:39,2025-09-26 19:32:16,"heyalrightmineohmine (Score: 3): You will see extremes 

Some will understand your situation be willing to teach you but try to absorb everything you can cause they will turn on you if you keep messing up.

And you get the other who won't say anything to you and watch you sink. 

I was like you when I first started I was scared to fix cars and was so careful I was slow too. Eventually you get so comfortable that you start working like a machine

VH_Saiko (Score: 2): Go slow be at your own pace and triple check your work and ask questions definitely ask questions i been working at my shop for almost 3 years now and I still ask all the questions I can it never hurts to ask and be slow."
