id,title,selftext,score,created_utc,num_comments,subreddit,scraping_time_utc,created_datetime_utc,scraping_datetime_utc,top_comments
1od97bg,Brake caliper piston!!,My buddy wore his brake pads down to nothing but the Bear break pad metal and his rotor was literally falling apart.It pushed his piston out of his piston sleeve of the brake caliber too far and was leaking.I replaced rotor and brakes pushed caliber piston back in all the way no resistance nuce and snooth and it stopped leaking.Will it be okay? Or should I replace the caliber for him?,0,1761141894.0,3,StupidCarQuestions,1761248140,2025-10-22 14:04:54,2025-10-23 19:35:40,"throwaway007676 (Score: 3): The caliper is no good after that, I hope you at least bled it afterwards? You don’t just put the caliper back together after it falls apart from neglect and abuse."
1od7vb8,"What's this part called between the windshield and side window? It's part of the car's main frame. Please don't judge my choice of car, I chose the first image after typing in 'car'.","I'm an English teacher and had a student ask me what this part of the car is called but I haven't got a scooby what it's called. I couldn't even find it's name after researching it.

Thanks in advance!",48,1761138669.0,37,StupidCarQuestions,1761248140,2025-10-22 13:11:09,2025-10-23 19:35:40,"Far_Section3715 (Score: 51): A pillar

machetemonkey (Score: 8): For grammatical clarification, it is not a “pillar” it is specifically the “a pillar” — as others have detailed above, each upright, roof-supporting pillar of a car has a letter name, dictated based on the order. 

So, from front to back, you have the:
- A Pillar
- B Pillar
- C Pillar

Then depending on the body style, you can also have the D Pillar and theoretically an E Pillar, etc.

Opposite_Opening_689 (Score: 3): A pillar"
1od0x72,pov...,,1,1761115022.0,2,StupidCarQuestions,1761248140,2025-10-22 06:37:02,2025-10-23 19:35:40,"G00fyG33k (Score: 2): Wrong sub methinks

noahbrooksofficial (Score: 1): Why does this keep getting posted? It is so fucking pointless"
1octr3r,What's the ideal ORVM angle? Should the tires (or mud guards) be visible? Should the ORVMs and IRVMs have an area of overlap?,"I suppose there are no ideal settings.

If you tilt it in a manner that the mud guards or the tires are visible, then you don't see much of the other cars. What's more ideal?

If you tilt it in a manner that lane-spitting bikes are visible when close, then you risk not seeing other cars that might be driving close and almost parallel to you, assuming that your peripheral vision does not pick them up. Again, what's more ideal?

Moreover, there's also a question of whether ORVMs and IRVMs should have a tiny overlapping area. What's the answer to that question?",2,1761092648.0,7,StupidCarQuestions,1761248140,2025-10-22 00:24:08,2025-10-23 19:35:40,"djltoronto (Score: 1): The mirrors, plus shoulder check, should give you 100% visibility unless physically blocked by the B pillar. 

Adjust them so you are comfortable

No_Report_4781 (Score: 1): I think the goal is to be able to see what is behind/to the rear side of your vehicle so you can safely maneuver. There’s no reason to try to make them overlap 

JonohG47 (Score: 1): Blind Zone Glare Elimination Method. Period. Full stop. This is the way. I have spoken. More importantly, NHTSA has spoken.

https://www.nhtsa.gov/sites/nhtsa.gov/files/blindzoneglaremirrormethod.pdf

In all seriousness, this is one of the highlights of my kids’ driver’s ed. Not sure I can get behind 8 and 4, or the push-pull method, but adjusting the mirrors this way is a game changer."
1odeotz,2011 Saab 9-5 NG Carplay Module,"I’m currently in the process of modernising my 2011 Saab 9-5 NG a little, while still keeping the car looking completely stock. Recently, I successfully upgraded the radio from DAB to DAB+ by installing an Opel DAB+ module, which integrates seamlessly into the Saab interface like it was factory (Saab went down under before GM deployed DAB+ in any cars).

Now I’ve come across these wireless CarPlay modules that connect between the radio unit and the factory screen, essentially “injecting” video and audio signals into the original hardware. As you might expect, there aren’t any modules made specifically for the 9-5 NG, but since the system is GM-based, I assumed there must be something close enough to work.

So I bought and installed a module designed for the Opel/Vauxhall Insignia A with the 7-inch NAVI900/950 screen. It does display the CarPlay interface correctly, but when I use the steering wheel or centre console buttons, the commands are sent both to CarPlay and to the original Saab interface running in the background. On top of that, there’s no audio output from the module at all.

That got me thinking: perhaps a module intended for the Cadillac SRX would be a better match. It also uses an 8-inch display like the Saab, and its infotainment architecture seems much closer to the 9-5 NG — especially since it’s closely related to the 9-4X. Has anyone tried this before or any idea how I could maybe get it to work with the Insignia module?",4,1761154062.0,6,CarHacking,1761248140,2025-10-22 17:27:42,2025-10-23 19:35:40,"bonecows (Score: 1): I checked on Aliexpress and seemed to find a few made for the 9-5, those wouldn't work?

Lee2026 (Score: 1): If the controls are over canbus, you may be able to install a gateway between your vehicle bus and the radio. Then filter the messages and only allow certain ones to pass or block them all if you don’t need them to communicate with the existing system anymore"
1od5er0,Anyone else using phone overlays in older cars? Here's my Bluetooth setup,"Hey, so I've been driving a 2002 Acura RSX and finally installed a Kenwood DDX 7025BT to get Bluetooth. Still no Android Auto though.

Got frustrated trying to safely use my phone with maps while driving, so I built simple app with overlay (named SafeDrive Companion) that auto-launches when my phone connects to the Kenwood. Been using it for 3 months now and it works surprisingly well:

* Starts automatically when Bluetooth connects
* Quick shortcuts for maps/music/fav apps/messages
* Overlay doesn't cover navigation (this was huge for me)
* Brings nav back after calls interrupt it (or after closing other apps)
* No ads or data collection stuff

Does anyone else use their phone this way in older cars, or is this ""too niche""? Just curious if this kind of setup would even be useful for others.

https://preview.redd.it/d6f24usg9nwf1.png?width=1909&format=png&auto=webp&s=2e389bb4ff19a4cd7cb4888a5a987499c98a27d6

",7,1761131750.0,5,CarHacking,1761248140,2025-10-22 11:15:50,2025-10-23 19:35:40,"Internal_Marzipan_98 (Score: 1): for those who are interested : [https://www.youtube.com/watch?v=nHUMxOiRQ\_k](https://www.youtube.com/watch?v=nHUMxOiRQ_k)

theonetruelippy (Score: 1): Nicely done, congrats!

JK07 (Score: 1): I'll give it a go!"
1ocvhh9,VXDIAG VX mánager download,"Be careFul with the site https://www.vxdiagshop.com 

Imagen 1:
The Link first Link (orange) doesn't work but the second works, and this have a Worm/virus 

Imagen 2: 
That's what Windows defender detect, synaptics.exe This infect all the .exe in your computer, so you are not safe just with delete the .exe original.

I've have this problem some many times but i didn't know where i get the virus until now ",2,1761097492.0,3,CarHacking,1761248140,2025-10-22 01:44:52,2025-10-23 19:35:40,"homeys (Score: 2): I will only use their software in a virtual machine that is dedicated only for that.  I had some sort of infostealer and a bunch of my usernames/passwords got out back a year or so ago and it's the only thing I can pinpoint it to.

trailing-octet (Score: 2): Mhha has a cleaner for that synaptics bastard thing. 

Seconding the comment about virtual machines. Gonna mess about with cloned stuff you absolutely want to sandbox that shit. Keep it network isolated to - so have no virtual network card, or if you must put it into a guest/iot network. I use “proper” enterprise firewalls to control the VMs internet and lateral movement (fortinet and Palo Alto networks) if I am going to examine this software for evaluation of functionality. Genuine tools don’t face the same issues.

mister_dray (Score: 2): That's why you always I stall stuff like this on a virtual machine so if it is, it's contained within that virtual machine and you can always use a snapshot to go back to the previous machine state"
1odo1t9,Can this be welded?,2016 Subaru legacy. How would you repair this? ,28,1761176032.0,34,AskMechanics,1761248140,2025-10-22 23:33:52,2025-10-23 19:35:40,"slamaru (Score: 33): Looks weldable to me. I’d align the pieces together by hand, make some alignment marks then pull the muffler and flange, clean em up and zap em back together. The bigger question is why did it break in the first place as usually rust is the answer but not the case here. Did a hanger pop off or break on the muffler putting strain on this joint? If so gotta repair that too.

Foehammercdxix (Score: 7): Looks like corrosion+shitty original weld caused this. Yes it can be welded back together. If you're not a welder just look up local muffler shops,  shouldn't be too pricey"
1odnu8b,Should this battery cable be repaired or replaced?,"I’ve been working on my buddy’s car, a 2008 Pontiac Grand Prix with the 3800 naturally aspirated engine, and I recently fixed a misfire by changing spark plugs and replacing the broken PCV hose (I believe that’s what it is, it’s the short one that runs from the intake plenum to the intake tube). He’s still having trouble starting the car though without using a jumper pack, and I think the positive battery cable is definitely a prime suspect. I’m wondering if it could be repaired with a splice kit or if it would be best to replace the entire cable. ",2,1761175476.0,10,AskMechanics,1761248140,2025-10-22 23:24:36,2025-10-23 19:35:40,"Rare_Improvement561 (Score: 6): I’d just replace it there’s no telling how much corrosion is up inside the insulation. Peace of mind and all that.

Additional-Serve-261 (Score: 2): 2nd vote for changing the cable and terminal but if you want to test it to see if it’s worth spending money on that part straight away then get the wire brush out and clean terminals, expose fresh wire and put back together."
1odnpjq,1995 Chevy G20 van 6 cylinder. New tapping noise.,"Bought 100miles away, drove great home, no tapping, was very happy with the ride. Next morning started it up and there's a tapping noise. Neighbor says its the lifters.
Pretty bummed, as its a beautiful van. I checked driveway for spots, checked fluids ,(coolant was a bit low) Drove fantastic, no play in the steering. Everything seemed great. But went to show it off next morning and there's a tapping, gets loader and faster as you rev it up. 
Hoping someone can say if the neighbor is right about the lifters and how hard of a job or expensive it is.",5,1761175126.0,2,AskMechanics,1761248140,2025-10-22 23:18:46,2025-10-23 19:35:40,"MagicGator11 (Score: 1): I'd love to give some assistance, but I'm not that G20 specialist. Just wanted to say that I absolutely love how those G20 vans look. When I was on the market for a work vehicle, I was heavily looking at those G20 vans simply for the aesthetic. If it weren't for the 300 inline, I'd be rolling around in one of those. 

Hope you get an answer soon and it's nothing serious!"
1odngck,Vehicle diagnostic,"Hello previously I was having issues with my muffler, my mechanic fixed it, we were driving and he said I don’t like that rattling, I heard a quiet rattle that went away. He said it might be the transmission. I don’t hear anything now, and honestly since he said something about it. How much would it cause to get it diagnosed I have no lights on. My car is at 248,000 miles and I drive for uber so I want to make sure I don’t need to get a job.",1,1761174451.0,3,AskMechanics,1761248140,2025-10-22 23:07:31,2025-10-23 19:35:40,"LWschool (Score: 1): I have no idea what car you're talking about. Could be $500 could be $10,000. 

I would think you and the mechanic are reading into literally nothing. If nothing is actually wrong there's nothing to diagnose or fix."
1odnay3,Fix this gap?,Shy cheap way to put the 2 pieces of my back bumper together? Maybe a glue? This is a Toyota Prius c,1,1761174065.0,2,AskMechanics,1761248140,2025-10-22 23:01:05,2025-10-23 19:35:40,Extra_Programmer_970 (Score: 2): Plastic welder
1odn0ih,Any fix for this besides replace catalytic converter completely?,2017 ford escape. Auto shop said the only fix they can do is replace the entire catalytic converter. Should I get a second opinion? I mean I know it looks bad and clearly needs a repair. No engine lights on. ,2,1761173302.0,3,AskMechanics,1761248140,2025-10-22 22:48:22,2025-10-23 19:35:40,"Lavasioux (Score: 2): A muffler shop can weld this with a sleeve, or... you can with a welder and sleeve. 😁

Every-Ladder-6101 (Score: 1): maybe an exhaust clamp"
1odmve7,"Should I trade in my 2019 Ford Fusion 1.5L Ecoboost if I owe ~$16,000 due to potential coolant intrusion?","I went to O’Reilly to get a new battery for my car and the front desk worker noticed that I had the 1.5L engine. He had an older Ford Fusion and the first thing he asked was the mileage (108,361) and if I had to get a new transmission (which I did last year around 100,000 miles).

He then informed me about the coolant intrusion issue that this engine is known for and suggested that I should trade it in before I get around the 130,000 miles mark which was his expected mileage for the engine before it goes bad.

Since I bought this car in May 2023, here are the list of major repairs I’ve paid for:

July 2023 - Sub-Frame reassembly due to loose bolts and damaged CV shafts $3106

April 2024 - New Alternator and Stretch Belt $954

August 2024 - Transmission $3236

Any advice is greatly appreciated!",2,1761172927.0,5,AskMechanics,1761248140,2025-10-22 22:42:07,2025-10-23 19:35:40,"Ravenblack67 (Score: 2): I would not make such a big decision based on the opinion of one person.  Suppose you sell the car for what you owe?  You will need another vehicle and be right back where you were.  Find out what the car is worth before you do anything.  Ignore the sunk cost.  Focus on what you have vs what you owe.

Monst3r_Live (Score: 1): Inside your driver door jamb will be a sticker with the vin. In the top corner,  you will see date, this is when your vehicle was built. if its built before or up to february 2019 you're engine is effected. But if its built after that, it has the revised engine."
1odmrus,What would cause both timing and water pump belt to snap?,"We just acquired a 1997 Honda Accord EX manual 5 speed 4cl and plan to refurbish it, along with an engine rebuild due to damage to the pistons and valves. (My son wants the experience) He found that both the timing belt and water pump belt are broken and we're trying to understand how that happened. It's an interference engine, if that helps. Google isn't helping much.",1,1761172665.0,4,AskMechanics,1761248140,2025-10-22 22:37:45,2025-10-23 19:35:40,"Sqweee173 (Score: 2): Age and neglected maintenance usually

Vuvuian (Score: 1): I'm just having a guess that the waterpump belt was so aged & worn, that when the timing belt snapped, it ricocheted & broke the waterpump belt on the way.

Maybe the waterpump just broke by itself while being unused afterwards."
1odmqky,What do you think about the state of this car?,,3,1761172575.0,3,AskMechanics,1761248140,2025-10-22 22:36:15,2025-10-23 19:35:40,"MarkoVukotic (Score: 1): This evo looks really good from the outside, but I am interested in your thoughts about the rust (especially bottom). Should I buy this car, is it risky, can you see something here that I missed?

MarkoVukotic (Score: 1): https://preview.redd.it/eke0mwqqqqwf1.jpeg?width=1320&format=pjpg&auto=webp&s=31d50cd72dc71ed3c38e9ac93159c570d99b1838

4G63 engine state"
1odmqb0,Engine knocking noise when accelerating,"I’ve got an 2012 Audi A3 2.0 tdi DSG. 
It’s recently started making this tapping noise when I start driving it from cold, particularly whilst it’s under load. There doesn’t seem to be any word noise whilst it’s idling.
The sound goes away after a couple minutes or if I rev it a bit harder. 
Any ideas what this could be?
Thanks for any help in advance ",1,1761172554.0,7,AskMechanics,1761248140,2025-10-22 22:35:54,2025-10-23 19:35:40,"outdoorsmen_16 (Score: 2): Im not really familiar with audi but it sounds like it could be your timing chain rattling or rod knock but take what I say with a grain of salt, I had an 06 Chevrolet colarado (3.5L in line 5 Vortec) and it's timing chain started to rattle and you could hear it super bad especially when towing something or pulling up hill. I hope what I shared helps if at all possible plug it in non a code reader and see what comes back as well.

jayson212022 (Score: 1): rod knock, start saving money for new car or engine/ rebuild if done soon enough"
1odmocj,What part is broken here?,"I took off turning left, I did take off a little too hard trying to beat traffic, heard a breaking and scraping noise. Pulled over as soon as I could and this is broken by the front driver side tire. What part is broken here? Google image is giving me ball joint, drive shaft, and control arm. Just not sure!",1,1761172412.0,10,AskMechanics,1761248140,2025-10-22 22:33:32,2025-10-23 19:35:40,"nostradumbass7544678 (Score: 3): Your front CV axle is broken, all the way. Never seen one fail like that.

Cute-Crab8092 (Score: 1): Your axle is broken. Likely other shit is near broken"
1odmkfv,Tips on replacing valve cover gaskets in 2018 Subaru Impreza?,Just did the spark plugs and one of the tube seals is bad and leaking oil so I am going to change both valve cover gaskets/seals. Online I can only find videos on impreza’s with the older aluminum valve covers and mine has the plastic ones but not sure if it will be much different. From what I know I will have to jack up the motor a little to get enough clearance to remove the covers. Anyone have any pointers? It looks like just removing one bolt on each side to be able to hack up the motor.,1,1761172131.0,2,AskMechanics,1761248140,2025-10-22 22:28:51,2025-10-23 19:35:40,"LWschool (Score: 1): I did it on an older legacy recently, obviously not the same but pretty similar. 

I did not have to jack up the engine, just removed the battery front drivers side and air ducts from passenger side. 

Unless it's been sitting a while it will drip a fair amount of oil - a known tradeoff of boxer engines is that oil doesn't drain super well from the valve train,  because it's all horizontal. 

If you were ready for some extremely annoying work you could do valve adjustments too, but it's pretty sucky without lifting the engine."
1odme8n,What is this?,I have bought recently a Kia Proceed 2010 and i can not find what this is. ,4,1761171667.0,3,AskMechanics,1761248140,2025-10-22 22:21:07,2025-10-23 19:35:40,shrewdlogarithm (Score: 1): It looks a bit like the older Garmin GPS connector - and as it has 'pins' there will be a hole under it with a wire going through it I guess?
1odm3x1,"follow up, thanks for all the help with the airbag situation, i managed to grow some balls and do the incredibly dangerous and extreme task of unscrewing 4 screws MYSELF. Was fun learning some stuff and now i can continue with my nerd things without exploding",no more bomb,7,1761170933.0,11,AskMechanics,1761248140,2025-10-22 22:08:53,2025-10-23 19:35:40,"FallNice3836 (Score: 3): Glad it didn’t kill you like every keyboard mechanic warned. It’s almost like they are hard to detonate unless you intentionally induce voltage.

Frost640 (Score: 3): I'm just going to repeat what I said in the other thread:


Airbags can and will kill you. Please do not open them up."
1odly63,Timing Cover Gasket Leak,,1,1761170538.0,2,AskMechanics,1761248140,2025-10-22 22:02:18,2025-10-23 19:35:40,Tall-Water8898 (Score: 1): Got sent this photo for my 2GR-FE engine w/ 130k miles. How bad is it? Got quoted 5k. for a timing cover gasket replacement.
1odlx9t,Weird sound,,1,1761170478.0,2,AskMechanics,1761248140,2025-10-22 22:01:18,2025-10-23 19:35:40,"CR33PYFR13ND (Score: 1): 2025 Toyota Camry XSE AWD, 2.5L 4cyl, Automatic, 5500 miles, excellent condition.

I'd like to add that this is a non-plug-in hybrid with 4 driving modes: Sport, Normal, Economy, Electric. The sound occurs with all driving modes, at any speed, and in any condition.

The Camry reddit doesn't take kindly to people, not sure why I posted this there in the first place. r/AskMechanics always seems to provide people honest insight from what I've seen. Thank you in advance. Please ask questions if needed.

Be well!"
1odlsl9,Can anyone help me identify this pipe?,It look like it's leaking under upper area of my 2010 Mazda 3. Am not quit sure what they are.,1,1761170165.0,2,AskMechanics,1761248140,2025-10-22 21:56:05,2025-10-23 19:35:40,Large_Peace9085 (Score: 1): looks like a high pressure power steering line.
1odlrip,"New Starter, Car Died a Week Later","2018 Kia Sportage with 170k miles. Getting ready to trade it in. Car started acting up, would only start occasionally when I turned the key. Eventually, stopped turning over...just one single click every time I turned the key. Mechanic told me it was the starter. Had it replaced and it was good for about a week. 

Now, it won't start...not even a single click when I turn the key. Radio comes on, headlights strong, power locks and windows ok. So, not a battery issue. Mechanic has it and still working on it but he told me not an engine seizure, relay or security system issue because he has already ruled it out. He's thinking it could be a short or broken ground somewhere as the starter isn't getting power. Any thoughts? Hoping that the starter was installed properly but if it wasn't, would I be able to go a week and over 250 miles without issue?",1,1761170091.0,4,AskMechanics,1761248140,2025-10-22 21:54:51,2025-10-23 19:35:40,"LWschool (Score: 1): The battery can be dead and the radio/lights/windows work fine, that's absolutely not a diagnostic for dead . Try jump starting, check the battery with a volt meter, load tester, or bring it to autozone or similar (they can test it for free).

That being said, it's at the mechanic - we cannot help you, your mechanic will help you. This kind of starting issue is usually not that hard to diagnose, such that it's probably low priority to him, unfortunately.

Large_Peace9085 (Score: 1): does it start if you fuck with the shift lever? bad inhibitor switch maybe?"
1odlqr8,Help with Toyota Camry XSE V6,"Hi, so I’m wondering what could be causing my sluggish acceleration in my Camry. It has about 82k miles, and about 3-4 months ago I replaced my spark plugs and an ignition coil that misfired.

Ever since then, the driving performance has decreased and sometimes it feels like it will stall out but doesn’t.

I’ve looked at what it could be online and a lot of people said to clean the MAF sensor, so I did that, but it only helped it for a day and went back to driving with decreased performance. I also replace air filters and still have the same problem.

I also noticed that whenever I am low on gas like a quarter or less it drives just like it used to, like it’s never had an acceleration problem. But when I put gas, that hesitation becomes 10x worse than how it was before I refilled my tank. I was thinking of cleaning my tank with Techron, but not sure what’s recommended for that.

I just want to figure out what’s wrong with my car. No one believes me when I say it’s driving differently, and there’s no check engine lights, the oil is good. Only thing I can think is I have a bent rim, but my mechanic sealed it for the meantime until my replacement comes in. I’m just at a loss. Please any help would be greatly appreciated, I have some travel plans and want to make sure my car is in good working condition when I go.",1,1761170036.0,4,AskMechanics,1761248140,2025-10-22 21:53:56,2025-10-23 19:35:40,"persona_non_grata_1 (Score: 1): based off the statement regarding fuel - Id be inclined to think purge valve. The best way to test it is capping it off (the side that goes to the canister) and also looking at fuel trims when its running poorly. Typically if the purge is bad it will indicate when the vehicle runs an evap test but thats not always bulletproof. 

If it was in front of me - Id take a strong look at raw data against known good values and see if anything looks out of spec."
