id,title,selftext,score,created_utc,num_comments,subreddit,scraping_time_utc,created_datetime_utc,scraping_datetime_utc,top_comments
1n45j3m,2014 Jeep Cherokee Help,"2014 Jeep Cherokee was driving fine then parked. When going to drive aging this is what it’s doing. Any advice on where to start?
U1504 pending and PO123 is stored.",1,1756570326.0,3,MechanicAdvice,1756668666,2025-08-30 16:12:06,2025-08-31 19:31:06,kyden (Score: 1): Try a jump start.
1n45e2p,Timing Chain Jump? Bad Starter/Flywheel?,"Greetings! 

I’ve got a friend who’s 2017 3.6l Chevy Traverse sounds like something has gone wrong internally. 

No Codes when I scan it. I replaced heater core hoses and the radiator on this vehicle about 2 months ago along with the purge valve I elbowed the nipple off of so I know this vehicle was running ok with no major issues then. 

Not sure how much abuse (overheating/lack of oil) but I’ll lean towards some, more than none. When I first did the radiator work it had an overheat code stored and he claims it was that same morning that it got hot is when he brought it to me. But yeah we know how that goes. 

I see online that these things are pretty common for having timing issues, especially paired with lack of maintenance/oil pressure. Not so much starter/flywheel problems… 

Looking for any input/info before I go and start taking things off to take a peek at the valve cams. 

Thanks in advance! ",1,1756569977.0,8,MechanicAdvice,1756668666,2025-08-30 16:06:17,2025-08-31 19:31:06,"Level_Restaurant8247 (Score: 2): Starter or flywheel teeth, or both.

braknstuf (Score: 2): I don't hear the engine cranking, just starter not engaging. Could be the mechanism that extends the starter gear or stripped teeth on either the flywheel or starter gear."
1n45cp3,How does it look?,"Changing the valve cover gasket on my 14 Accord, first time seeing the inside of the engine and truthfully have no expertise so if anyone could tell me a bit more based off the photos I’d greatly appreciate it. Would like to know if there’s anything I should do to it. ",13,1756569883.0,18,MechanicAdvice,1756668666,2025-08-30 16:04:43,2025-08-31 19:31:06,"HersheyBussySqrt (Score: 3): Looks great! Clean up the mating surface real well before installing the valve cover with the new gasket. Make sure not to over torque the valve cover bolts and tighten the bolts starting in the center then moving outward in a criss cross pattern.

Superhippo2477 (Score: 1): That is one very clean K24 sir! I own a ‘15 looks good too I would recommend doing spark plugs while youre in there"
1n45c8m,Hotel valet left my window open overnight in the rain. We are driving 9 hours home today. Anything I should / shouldn’t do on the drive home?,"2025 Toyota Sequoia. The water is thankfully isolated to the front passenger side, but it is A LOT. There is water in the speakers, the air vents, deep in the seat (which is a massaging seat so presumably has lots of electronics). Hotel gave us towels to dry everything off as best we could. I am sitting on a towel because there is water coming out of the seat. We are traveling in the southern US with a toddler so running the heat isn’t an option. It’s currently raining so we also can’t drive with the windows down. We are running the AC on the lowest setting and the seat is ventilated. 

Anything else I should do on the drive to help dry it out and protect the electronics in the door and seat? 
",38,1756569851.0,36,MechanicAdvice,1756668666,2025-08-30 16:04:11,2025-08-31 19:31:06,"Patrol-007 (Score: 132): Get something in writing from the hotel Re what they did, for them to pay for damages from leaving window open 

Electrical-Cup-5922 (Score: 106): I would have been making sure the hotel was paying for a detailer before I left"
1n459ob,Hi I have an Audi A3 1.6 2002,"The problem is that I lose power sometimes but when I turn the car of and on it works normally and all lights go out, I managed to do a diagnostic while the check engine light was on and it showed me 3 problems (photo down below) 
Do I have to worry allot or is it something that can wait a little bit
Thanks for helping.
",2,1756569681.0,2,MechanicAdvice,1756668666,2025-08-30 16:01:21,2025-08-31 19:31:06,RudbeckiaIS (Score: 1): How old is your timing belt?
1n451ch,Gashes on New Hitch,"I bought a relatively cheap hitch ($200) from a site that ships most items in two days.  After a single use (with bike rack attached, \~250 miles)) I noticed these two gashes.  Is this cosmetic/nothing to worry about, or is this a safety issue that I should consider returning?

It was a mild hassle to install, so I don't relish the idea of uninstalling, but it bothers me that it has visible damage after a single use.  If there is no safety concern, I will probably just keep the hitch as-is.  The hitch will be used very infrequently and only for bike rack or light trailer use.

https://preview.redd.it/qhhx7xjvh6mf1.jpg?width=3024&format=pjpg&auto=webp&s=f36bb1079885f8a2d7c39ff18a7787c71cc6f4ab

https://preview.redd.it/a8xtnwjvh6mf1.jpg?width=3024&format=pjpg&auto=webp&s=84ff8704126281b7173e5381d7e4c3d8b86531b7

",2,1756569099.0,3,MechanicAdvice,1756668666,2025-08-30 15:51:39,2025-08-31 19:31:06,"ka36 (Score: 2): Those are splits in the metal from what it was being pressed, they were there before you installed the hitch. It's not a structural location, so it's not a safety issue.

PurrfectPitStop (Score: 1): Not a huge deal looks like it is from poor QC during manufacturing. I’m a little anal and own a welder so I would make it look all pretty, but it shouldn’t be a problem. "
1n450kj,Bike wont start,,1,1756569043.0,2,MechanicAdvice,1756668666,2025-08-30 15:50:43,2025-08-31 19:31:06,"RudbeckiaIS (Score: 1): My money is on the pickup coil (crankshaft position sensor on EFI models): it's one of the endless issues I have had with these Triumph and the symptoms match. Unless the bike was stored for a long time guarajnteed it's already on the third or even fourth sensor.

Disconnect the sensor and check resistance: 560 ohm on a cold engine, 640 ohm on a hot engine. The gap was changed during production from 1 to 0,8mm in a desperate attempt to avoid redesigning the part, like BMW would have done. 

If the pickup coil is the problem, get a brand new one from the dealership. The price has literally doubled in a decade (it's around €80 now!) but at least it has a two year warranty. Gap it to 0,8mm and you will be fine until it fries again. ;-)"
1n44ipw,Oops,"Ok so I know I’m gonna get chewed to pieces for this post but I need emergency temporary fixes and the situation is as follows. 
It’s been overheating so to combat that I’ve been running the heat to help cool it down. I just replaced the battery and while I was doing that I added some water to the resivour tank bc my friend said it’s the same thing when it’s summer. As soon as I started it the heat is no longer blowing hot and the water was dripping out underneath kinda quickly. Which was not happening before. Also steaming/bubbling. which means I can’t use that to cool it until I can get it officially looked at. What can I do to make the heat work again?? It will blow kinda warm when we’re moving but as soon as it stars idling it’s back blowing cold. 
Please don’t come for me I’m trying to claw my way out of homelessness and I have no other options rn to “fix” it. So I’m seeking a way to rig it for like another month. Will adding actual coolant help? Lolllll",1,1756567814.0,3,MechanicAdvice,1756668666,2025-08-30 15:30:14,2025-08-31 19:31:06,"Poma-alien (Score: 3): It sounds like you have a coolant leak which is obvious but it’s likely overheating as well because there are air pockets in the cooling system. You need to bleed the cooling system and the heater core and keep adding coolant or water to the system as you lose it. You may also have to keep bleeding it frequently to keep the air pockets out that may be forming as you lose coolant. That should reduce the frequency that the car is overheating.

Professional_Alps_36 (Score: 2): You seem to be losing coolant/water faster than you can keep it full.  You feel no heat because you don't have coolant flowing through the heater core anymore since it has built up an air pocket. Water is ok for temporary purposes but if it ever gets to freezing where you live the water will freeze, expand, and can break and crack a lot of things including your engine.  

Keep topping it off keep some jugs of water or premix coolant in your car.  If you have a cap on your radiator and reservoir you need to fill both but wait until your car is cool to fill the radiator.  Depending on how bad the leak is it may have pressure on it and steam and water will spew out and burn you."
1n44fcv,Questions about “Standards of Practice” as a Mechanic,"— What are your “standards of practice”? Things you do no matter the situation, to make things right for your customers and protect yourself from problems as a mechanic?

** your responses are greatly appreciated **",0,1756567577.0,3,MechanicAdvice,1756668666,2025-08-30 15:26:17,2025-08-31 19:31:06,"mode01 (Score: 1): Communication is key.  Understanding the customer complaint, and the condition of the rest of the vehicle before you get started.  Always a full scan and data log if the vehicle is drivable and safe to do so.  Critical fluid checks.  Are all monitors complete, distance since codes cleared is less than a few hundred miles?  You can't have an informed conversation with the customer until you are informed of the vehicle. MPI are not just to sell more, it is a critical step in cya.  If a bolt feels like it is going to break and you can still put it back together, time to talk with customer.  When the customer can still make choices, you are still in control.

RepresentativeRun71 (Score: 1): Get that shit on a lift and do a full visual inspection regardless of the customer complaint. Plug in a damn scan tool and check for codes regardless of the complaint. Connect a battery tester to make sure battery is good to begin with to avoid the, “bUT mah mAtTerY Wuz gUD,” bullshit when they’re trying to scam a free battery. Do a sealant test if doing AC work, so you don’t ruin your shop’s AC equipment."
1n44e7n,Did I just mess up my oil filter choice?,"Okay so I have a 2020 VW Touran II with a DPCA engine code. I bought an oil filter from a trusted webshop in Hungary (UNIX). I filtered results to match the type and engine code and bought the following oil filter. However the oil filter is a bit strange with a wrench socket in the back. I installed the filter but I am still not sure if it is the right choice.

I checked whch type it matches on Autodoc and it does not give the W Touran II with a DPCA engine code as a result.

The oil filter I bought: BOSCH 0 451 103 318 - EAN code: 3165143176337

My previous oil filter: BOSCH F 026 407 143 - EAN code: 4047025151825

Thank you for your help.",3,1756567501.0,6,MechanicAdvice,1756668666,2025-08-30 15:25:01,2025-08-31 19:31:06,"lantrick (Score: 2): It’s fine , it’s still the correct filter

jasonsong86 (Score: 1): Filter is cheap. A damaged engine is not if it’s bypassing not filtering due to the gap."
1n44e0u,What would cause this grinding noise ?,"1999 jeep grand Cherokee 4.0 making a grinding noise on the passenger side wheel. Any ideas on what could / would cause this to happen ? 

I can remove wheel to inspect further but I have no idea what to look for. No play in the wheel when I try and shake it back and forth. So I think .. key word think a wheel bearing is not the issue here. ",1,1756567487.0,4,MechanicAdvice,1756668666,2025-08-30 15:24:47,2025-08-31 19:31:06,"aortiz66 (Score: 2): Brake pads are most likely worn out and it's just grinding metal on metal, if it's not the steel shim indicator grinding on the rotor to let you know it's worn as well. The rust on the rotor face means the pads are not touching the pads and grinding, which would clean the center of the rotor off any rust over time. You would want to check and make sure the caliper is not seized up when pressing the brakes, it should clamp and when you let go of the brakes it should visibly release. If it is seized, the caliper slide pins will need to be cleaned and re-greased with a silicone or ceramic based grease that is safe for the  rubber boots, like Permatex Silicone Ceramic Extreme or AGS Sil-Glyde. Most likely, it will just need a new pair of pads, but remove the caliper to check both sides. Sometimes it wears out uneven so the outside pads shouldn't be your only indicator of good or bad brake pads, make sure to check the inside as well.

Responsible-Fox-9098 (Score: 1): https://preview.redd.it/b3jslhm7f6mf1.jpeg?width=3024&format=pjpg&auto=webp&s=d8b5f083e1d870b1769bdaf3fc0acf085672cb9d

The pad seems to be grinding on the rotor ?"
1n44dmf,Do I have to buy another new axle because of this bent piece?,"I bought an axle but didn't install it so it's past return window.  The box was just left sitting in place and when I finally opened it I noticed the cardboard support was not around this side it was just in the box.  Obviously damaged during shipping. 

This is a passenger side axle for a 2002 Sienna.  The end that goes into the trans.

I dont see how I can get this properly round myself.  Any help?",3,1756567460.0,5,MechanicAdvice,1756668666,2025-08-30 15:24:20,2025-08-31 19:31:06,"Cat5edope (Score: 4): It’s pretty easy to bend back in shape, it doesn’t have to be perfect just bend with some pliers"
1n4485n,Why is it making this noise???,I just put a new battery in and was trying to see if the dash would light up and it does this sound as soon as I put the key in the ignition. Any one know what the problem is?,1,1756567091.0,5,MechanicAdvice,1756668666,2025-08-30 15:18:11,2025-08-31 19:31:06,"Level_Restaurant8247 (Score: 4): ""You left the key in the ignition, don't lock the door alarm."""
1n4454a,"Can I adapt a BMW E36 320i fuel pump to a 1999 Mercedes S320 (W220)?""","Hey everyone,

I’m working on bringing back a 1999 Mercedes S320 (W220). The original fuel pump is weak (not building enough pressure). I had an old BMW E36 320i fuel pump lying around from another project, but it’s physically different from the Merc one.

Before I buy a new pump, I’m wondering:

Can the BMW pump be forged/adapted to fit the Mercedes?

Are the pressure/flow rates close enough for the S320 to run properly?

Any tips on wiring or fuel line connections if I do attempt the swap?


I’ve attached photos of both pumps for reference.

Thanks in advance — just trying to get this car running without spending a fortune on OEM parts.",0,1756566884.0,2,MechanicAdvice,1756668666,2025-08-30 15:14:44,2025-08-31 19:31:06,"WhereDidAllTheSnowGo (Score: 2): Start with Rock Auto

Get both parts specs and see what’s different.  And the parts cost vs yer labor cost

Besides huge safety issues you’ll probably find it’s FAR cheaper to use the proper part upfront because you’ll have far bigger problems to put yer labor against"
1n440br,Is this hose supposed to be loose? 2011 Chevy Malibu 2.4 I,,0,1756566559.0,2,MechanicAdvice,1756668666,2025-08-30 15:09:19,2025-08-31 19:31:06,DiscoDiscoB00mB00m (Score: 1): No but it’s nothing serious if it isn’t. It’s the I let for the secondary air injection pump. If you can’t snap it back into place any competent shop should be able to for minimal expense. Don’t go like this long term as it is letting unfiltered air into your engine. If you want to try yourself just line them up and push in you will feel a little click.
1n43vt8,Hole in the coolant tube.,"To be honest, I know nothing of cars. I don’t know if “coolant tube is the right word. But it’s the tube that carries the coolant back into coolant…. Jug? But I was wondering if it is ok for me to to this up until I can the try of the month and I can afford to take it to the mechanic. It’s. Chevrolet aveo 2012. I don’t know engine type but I hope that doesn’t matter",0,1756566251.0,8,MechanicAdvice,1756668666,2025-08-30 15:04:11,2025-08-31 19:31:06,"HardyB75 (Score: 3): I wouldn’t risk it. That hose you can most likely replace yourself.

cyborg-waffle-iron (Score: 2): ""Upper radiator hose"" is the term you're looking for. 

If you are going to try to limp this long for a little bit before taking it to the mechanic, wrap over it well with something like duct tape and get a jug of PRE-DILUTED coolant to keep in the car since you will likely need to top it off here and there.

This should not be a very expensive repair as it does not take long to switch it out."
1n43tvp,Clunking and banging when braking,"19 Civic sport touring 

The lug nuts are not loose , I was thinking maybe a calliper
",1,1756566123.0,2,MechanicAdvice,1756668666,2025-08-30 15:02:03,2025-08-31 19:31:06,1023516752 (Score: 1): Wheels need to come off man could be warped rotor loose brake liner in caliper
1n43qdl,Handbrake lights stays on,"Vehicle: 2008 Honda Accord


As titles says... The handbrake light on the dash comes on and off while driving, sometimes it is on for long durations. 

The ""beeping alarm"" that should occur when driving with an engaged handbrake does not sound. If I lightly engage the handbrake (1-2 clicks) then the alarm does sound. 

Brake fluid levels have been checked and are good. ",1,1756565896.0,3,MechanicAdvice,1756668666,2025-08-30 14:58:16,2025-08-31 19:31:06,"cyborg-waffle-iron (Score: 2): It sounds like the parking brake cable may need to be adjusted. I had a Hyundai with a very similar issue.

WhereDidAllTheSnowGo (Score: 1): Work the emergency brake cable, max then off, max then off. 

Confirm it locks AND releases the rear wheels.  If sticking, replace the cable and lubricate.  Once they rust, WD40 and lube and such are a quickly failing temp fix

Adjust per your manual.  Some have a nut to tighten.  Driving backwards is how many self-adjust"
1n43mw2,A rhythmic sound coming from underneath a 2011 Toyota Camry Hybrid. Thoughts?,,1,1756565654.0,5,MechanicAdvice,1756668666,2025-08-30 14:54:14,2025-08-31 19:31:06,animatedhockeyfan (Score: 1): In the rhythm in time with the tire rotation or the engine revs?
1n43mc1,"Milky residue under oil cap, but orange to the touch?","I had the head gasket on my 2008 Subaru replaced about a month ago. Yesterday, I noticed the coolant level was below the “Low” mark, so I topped it off slightly above the line while the engine was cool. This morning, the coolant is back below the “Low” mark. When I removed the engine oil cap, I saw what looked like a milky residue inside, but when I touched it, the residue appeared orange on my finger. Should I be concerned?
",6,1756565614.0,35,MechanicAdvice,1756668666,2025-08-30 14:53:34,2025-08-31 19:31:06,"SaurSig (Score: 50): ""Orange to the touch"" is a wild use of words.

R2P_edibles_ (Score: 7): Head gasket"
1n43h2q,Washers on lug nuts?,"Need to replace these rounded off lug nuts with these splined one. Problem is. These splined ones don’t have washers like the oem ones. 

Thoughts?",1,1756565256.0,7,MechanicAdvice,1756668666,2025-08-30 14:47:36,2025-08-31 19:31:06,"WhatveIdone2dsrvthis (Score: 24): That is the wrong replacement nut type. Do NOT use it. There are conical, round, and shank. You need the shank (or flange) type. (edit for image addition)

https://preview.redd.it/0hu6ghn276mf1.png?width=430&format=png&auto=webp&s=9278c0811f2bf7400259a562bd5bc12a0c5b660e

OkGuess9347 (Score: 5): Besides those being the wrong Spline nuts they are also a nightmare. Stick to oem. Multiple out of 20 will seize and strip. Stick to hex shaped lug nuts."
1n43din,Heater hose connector replacement?,"I spent the past few days driving to various auto parts and hardware stores trying to find the Dorman or similar type heater hose connector shown in the first pic. This brass one (second pic) is all I was able to come up with.

Will this brass barbed one work fine or should I just order the Dorman part to avoid issues? ",1,1756565015.0,7,MechanicAdvice,1756668666,2025-08-30 14:43:35,2025-08-31 19:31:06,"WhatveIdone2dsrvthis (Score: 3): As long as overall inner and outer diameters are essentially the same, you can use the brass fitting. The system only holds about 15 psi, so exact isn't needed. Just make sure your clamp is on well.

whiplash-willie (Score: 2): The one made for heater hose has a better chance of surviving a disconnect and reconnect.  Those barbs cut into the inside of the hose and make the connection basically permanent, so your future will include replacing hose anytime you have to work on this connection.

However, I have used them many times.  They will work just fine."
1n435kg,Help with ford!,,1,1756564477.0,2,MechanicAdvice,1756668666,2025-08-30 14:34:37,2025-08-31 19:31:06,covid-was-a-hoax (Score: 1): I would start by checking battery connections. After that there is clearly a loose connection somewhere in a main line or a bad ground.
1n4gc55,Car has an oil leak …,"It is labor day weekend in the States & my regular mechanic won’t be open until Tuesday , does Firestone check & repair oil leaks ? ",0,1756598272.0,1,CarTalk,1756668666,2025-08-30 23:57:52,2025-08-31 19:31:06,"CTSwampyankee (Score: 1): You’re assuming you could get an appointment, repair  parts and timely repair. 

A few drops? Don’t worry about it, checked the oil level and monitor until appointment. 

Pressure leaks and significant oil leaks? Get under and shine a light to determine origin. This isn’t hard, there are only so many places it can come from."
1n4fyhy,TIRE PUNCTURE,Puncture dancing on the 1 inch mark of the side wall. Question is am I gtg with a plug for a few days while tires get ordered or is running the spare a better choice? Will be on passenger rear. ,2,1756597139.0,4,CarTalk,1756668666,2025-08-30 23:38:59,2025-08-31 19:31:06,rws1017 (Score: 6): If it were my tires I would just run a plug for the few days until the new tires arrive unless I was taking long trips.
1n4euv6,Car takes 10 seconds to accelerate from 0 to 20,"Model: 2010 Mazda 3 2.0 Non Skyactiv

Context: got it for $900 to fix the TCM which I did and it’s no longer throwing codes. Car passed emissions just 20 days ago so the TCM issue was recent. The ATF fluid is definitely overfilled, can see better here https://ibb.co/JFqsXkJB

Symptoms:
- Very slow acceleration from 0 to 20 mph takes 10 seconds.
- Changing gears gets better after that and cat can hit 60 mph and keep that speed effortlessly. 
- Accelerating uphill is very difficult and it’s even unable to if the hill is steep enough.
Rough idling, shaking engine, shaking airbox.


What do you guys think could be the culprit?

Thanks a lot!


",103,1756594026.0,89,CarTalk,1756668666,2025-08-30 22:47:06,2025-08-31 19:31:06,"TeamEdward2020 (Score: 1): Locking this thread because the OP has already gotten any useful information out of us and we've now devolved into some *crazy* in-fighting. 

For those of you more seasoned in this forum please remember, we all started somewhere, most of the time we didn't get to choose where. Lets try to be as kind as possible so we can build our community together.

Suitable_Team_9215 (Score: 178): Just a shot in the dark here. I would pull off the intake, and see if the throttlebody is opening the whole way. If it’s running OK, it would have to be air in /air out. So an exhaust restriction. Or an intake restriction. A.k.a. bad throttlebody.

CafeRoaster (Score: 60): Definitely fix the ATF before trying to fix anything else. It could be in limp mode and starting in 3rd gear."
1n4d5nr,Is it possible to put a v8 on a 10th gen Honda Civic?,"I know this might seem like a crazy post, and it is… but I’m just wondering, would it even be possible to fit and function any sort of v8 on a 10th gen civic? 

10th gen’s currently have 1.5L turbo’d engines and 2.0L N/A engines. How time consuming, expensive, and difficult would this be? Lol",0,1756589440.0,13,CarTalk,1756668666,2025-08-30 21:30:40,2025-08-31 19:31:06,"hapyhar0ld (Score: 23): Anything is possible if you have the money and just because you can, you need to ask yourself if you should.

EtArcadia (Score: 11): Possible? Anything is possible given enough effort and money. The reality is though that the fabrication needed to turn a FWD economy car into a RWD V8 car would essentially amount to building a new car from the ground up. It would have most of a Civic's body but would it even be a Civic anymore? 

It would also cost much more than buying virtually any V8 performance car that already exists.

This is the sort of thing shops build for SEMA to show off their fabrication chops, it's not the sort of thing regular people do to just drive around.

ProMasterBoy (Score: 6): Just buy a V8 car"
1n4d0f2,Tire flat due to nail punctured. Need help :<<,"Hi guys, i need some help for my Rav4 TRD offroad 2020. My sister car recently got a flat tire due to a nail puncture. Im not sure if this area is a safe area to patch it or should i just replace a whole new tire for this one ? 
Appreciate it a lot guys
",0,1756589062.0,28,CarTalk,1756668666,2025-08-30 21:24:22,2025-08-31 19:31:06,"Sauerkraut_boi (Score: 11): It’s fine, tires dry rotted to hell tho

CFHQYH (Score: 15): That's not a nail.

Peanutbuttersnadwich (Score: 3): That tires dryrotting it needs a full set."
