id,title,selftext,score,created_utc,num_comments,subreddit,scraping_time_utc,created_datetime_utc,scraping_datetime_utc,top_comments
1ozm6s4,How can I make these 96+ Tacoma seats fit in my 95,,1,1763399974.0,6,MechanicAdvice,1763494543,2025-11-17 17:19:34,2025-11-18 19:35:43,"Extension-Drawer2099 (Score: 1): Carefully

S7alker (Score: 1): They look too different and I wouldn’t risk my safety trying to shoehorn those in. I found the seats are supposed to work 95-2004 but then see many specifically say 95.5-2004 and assume the early run used your seat and may have been left over 94 seats? On my old 93 yot I got a set from a similar year 4 runner seats because I found seat bracket issues and adapters to be not worth the trouble."
1ozlkap,2013 Carolla (low miles) Sway at high speed,"I have a 2013 Carolla I bought last year. It has 28,000 miles on it. That’s not a typo. Bought it from CarMax last year with 17,000 miles when I got it. 
(Wanted something before lane departure and other high complications)

The vehicle developed a sway at highway speeds a few months ago. I rotated wheels and changed the front brake and rotors yesterday. 

Tried to drive it this morning and it was all over the place. I had to turn around and make it back home. 
The vehicle seems light on the road. Like, it was being blown around by wind. Wind speed was 0-5mph. It was already doing it, but it’s now dangerous. Feels like a speed wobble. 

Note: I’ve not worked on this vehicle but done suspension work on other trucks and vehicles I’ve owned. I’ve looked it over and bushings look great, sway linkage is great, tie rods look great. 

Any idea. 
",1,1763398595.0,4,MechanicAdvice,1763494543,2025-11-17 16:56:35,2025-11-18 19:35:43,"66NickS (Score: 1): How are your tire pressures? Tire conditions?  With that low of miles it’s possible the tires are very aged but not worn. After about 5-6 years tire age becomes a concern and at the 10 year mark they should be replaced.  Some people are more aggressive on this believe and will replace tires starting at the 5/6 year mark. 

Have the tires been balanced recently?  A poor balance would cause a vibration, but maybe that’s what you mean when you say sway.

lolwhatmufflers (Score: 1): This could very well be tire related if those tires are original to the car. Very possible with the low miles and the fact that Carmax inspections are apparently very location-specific as to how good they actually are."
1ozlgb6,Can someone help me figure out what’s wrong? (2007 Ford F150 4.6l),"This truck keeps over heating. I’m not sure what the problem is. The engine has been replaced, new radiator, new radiator cap, new thermostat. What could it possibly be? ",1,1763398349.0,4,MechanicAdvice,1763494543,2025-11-17 16:52:29,2025-11-18 19:35:43,"quickscopemcjerkoff (Score: 1): Could be improper coolant flushing. If all the air isn’t removed from the cooling system it can overheat. Could also be a faulty temperature sensor giving you a bad reading.

animal_013 (Score: 1): Do you have heat in the cab?"
1ozl7nr,Ticking sound on a cold day,This ticking only happens on a cold morning on the initial start up.  It does go away after a few minutes. Should I be concerned? Oil is fresh and full. 153k 2014 Honda Pilot,1,1763397809.0,2,MechanicAdvice,1763494543,2025-11-17 16:43:29,2025-11-18 19:35:43,"Typical-Play4473 (Score: 1): I would guess it’s injectors, though I’m more of a Toyota guy and we all have stupid loud injectors over here. If it’s does away when warm I doubt it’s a pressing issue. Could also be a pump on its way out, don’t quote me though. Could always stop by a shop and see what they think too."
1ozl5ef,How reasonable is this quote?,"2009 Camry XLE V6 alternator broken. Claims battery is bad as well. $1,300 for parts and labor. I know the alternator is cheap, but that seems a little steep, no?

",0,1763397665.0,3,MechanicAdvice,1763494543,2025-11-17 16:41:05,2025-11-18 19:35:43,"auto_medics (Score: 2): If they are using an oem alternator, they are about $400.  That job is about 4 hours of labor on the v6.  If their labor rate is 150, thats 600. Plus the battery, seems pretty close.

WhereDidAllTheSnowGo (Score: 1): Do you own a set of wrenches?

This is a rather easy repair.  Check out YouTube for the DIY and see if it’s something you or a friend want to do"
1ozkt9c,Truck stutter starts?,2014 ford f250. 6.7. About 60 degrees outside this morning. It did this last month but couldn't get to replicate it. Finally able to get it on video this morning. What could be the problem?,1,1763396923.0,3,MechanicAdvice,1763494543,2025-11-17 16:28:43,2025-11-18 19:35:43,auto_medics (Score: 2): Is it at longer crank? Start by checking the battery
1ozkmo4,Iveco / OM 40 1976 diff question,,1,1763396523.0,4,MechanicAdvice,1763494543,2025-11-17 16:22:03,2025-11-18 19:35:43,"RudbeckiaIS (Score: 1): If my grandfather were still alive you would get a very complete answer in the time it would take to reach him. He worked on these lorries literally every day.

Your best bet is to change the conic gears inside the differential since I see it's leaking like crazy and needs to be rebuilt anyway. Sometimes you can find the gear sets on Italian eBay but your best bet is to ask transmission repair workshops if they have them in stock. If your lorry still has the original setup you have 8/36, or 4.5 ratio as Americans would say. 9/35 or 12/40 were pretty widely used on OM 35/40, less so on the 50/60 due to higher gross weight.

Honestly I wouldn't gear an OM 35/60 higher than 12/40: they weren't really built for highway work and the low gearing was there so they could be brutally overloaded (there's a reason Italy used to have so many public scales, many are still there albeit non-operational). Fiat built the 690 and 691 for long hauling, but they were completely different vehicles. 

That's about the extent of my knowledge on the matter, hope it was useful."
1ozkjls,Quote for 2015 Jeep Wrangler,"Hey folks, how does this quote look for our 2015 Jeep Wrangler? 

Is it high a about right? I've tried googling but it seems all over the place in terms of expected cost for this work ",1,1763396333.0,5,MechanicAdvice,1763494543,2025-11-17 16:18:53,2025-11-18 19:35:43,"Limoundo (Score: 1): not a mechanic but looking at the youtube video to replace the gaskets looks like a bit of a pain honestly.  Usually these types of videos are maybe 20 to 30 minutes long, these are an hour plus.

RichardSober (Score: 1): The bill is fair. Ask them to inspect cam lobes when they drop valve covers."
1ozkh5n,Power steering pump groan,"I recently replaced the power steering pump and line on my 2005 Honda pilot (v6, 3.5L). But even after putting in new fluid (specific type for Hondas) and turning the wheel to bleed the system, the power steering pump is still groaning pretty loudly, especially when turning. 

Is this common and the fluid still needs to saturate the system or is something else going on? Thanks",1,1763396180.0,3,MechanicAdvice,1763494543,2025-11-17 16:16:20,2025-11-18 19:35:43,"Budpalumbo (Score: 1): Did the pump come with the inlet fitting attached, or did you have to use the old one?  The o-ring is a common failure that allows air to be sucked in without a leak.

Let it sit after filling and testing, bleeding all the air out can take a bit."
1ozk9uk,Clutch won't bleed,"Hey guys got a 2007 mini cooper and I can't get the clutch to bleed. I've tried to gravity bleed it, vacuum bleed, manually compressing the slave, even went an bought a power bleeder and nothing works. Currently I got the power bleed on at 20psi and a vacuum pump at -10psi and I've got absolutely nothing coming out of the valve. ",2,1763395723.0,11,MechanicAdvice,1763494543,2025-11-17 16:08:43,2025-11-18 19:35:43,"BaboTron (Score: 2): If you got the valve to open, then the nipple might have some debris caught in it. Or the line corroded inside and there is debris in the fluid.

If I were you, I would completely remove the bleeder nipple and make sure you can see it’s clear, and go from there.

TheCamoTrooper (Score: 1): As dumb as it sounds, did you make sure the bleeder valve is open? It really should be as simple as if it's open and you press the clutch fluid comes out"
1ozk67b,Help!,My AWD 2011 RX350 (2GR-FE) has been making this weird noise every time I accelerate a bit hard from stationary or low speeds. The heavy sounding thump in the video only could be heard after the car goes through uneven roads. Any idea whats making the noise?,1,1763395487.0,2,MechanicAdvice,1763494543,2025-11-17 16:04:47,2025-11-18 19:35:43,WesternAd7089 (Score: 1): Sounds either like engine mounts or something in the suspension
1ozjygi,Steering rod boot popped off. The shop used zip ties to clamp it back. Is it okay?,"Car: 2016 Mazda6 

They did some sway bars and steering rod work worth $3,800 worth of work. Recenty, the steering rod boot popped off.

I went back to them and they used a zip tie to clamp it back. **Is that a ghetto fix?** Should they have used the appropriate boot clamp? 

Also, the wheel squeeks when turning the wheel. 

https://reddit.com/link/1ozjygi/video/x2zgu7flau1g1/player

",0,1763395006.0,8,MechanicAdvice,1763494543,2025-11-17 15:56:46,2025-11-18 19:35:43,"wpmason (Score: 6): Pretty standard practice. 

The boot just keeps dust out and it should ever be under serious strain.

None (Score: 2): [deleted]"
1ozjq3j,"Some rubbing rotational noise from the rear, but only when cold, goes away after 5-10 mins of driving. What could it be?","It’s clearly related a rotating component, but I’m blanking on what it could be there that would go away once warm. A wheel bearing would make continuous noise wouldn’t it? Can it be something brakes related?",2,1763394471.0,6,MechanicAdvice,1763494543,2025-11-17 15:47:51,2025-11-18 19:35:43,"Massive-Rate-2011 (Score: 1): Is it AWD? Rear diff warming up maybe?

What car?

lampministrator (Score: 1): It can be .. If you are in a place that is salty and gets damp at night, you can be getting a light coating of rust on the rotors in the rear, and as you drive it rubs off.  This in common near coastal towns as winter approaches."
1ozjo4i,Looking for help on how to add lights to my motorcycle CORRECTLY,"So last year I wrapped my car with Christmas lights but couldn't be bothered with the wiring so I just used a portable power source and called it a day. 

Cant really do that on the motorcycle, at least without it being a pain in the ass, so Im trying to figure out if I got this laid out correctly. I have NO knowledge when it comes to wiring stuff *correctly* so I just need someone to give a quick look over and revise this little plan of mine where needed.

So to make this work, Im planning on buying a aftermarket fuse box that I can connect to my battery. And with that I can plug the xmas lights in. But since the battery on the motorcycle is 12V and the rating for the x-mas lights are 29V I cant just directly plug it in... right?

So to deal with that, Ill be starting at the aftermarket fuse box with 16awg wire into a boost module (dc-dc 3-30v to 5-35) and adjust the voltage output accordingly. Then I should be able to wire the xmas lights to it, hopefully.

And after all that, at some point in between the xmas lights and the boost module I want to throw in a switch to be able to turn them on and off at  any given moment.

So please let me know if this would work, if there something I need to do differently to make it work, OR if its just plain stupid. ",0,1763394344.0,11,MechanicAdvice,1763494543,2025-11-17 15:45:44,2025-11-18 19:35:43,"mtfbwyall (Score: 4): Don’t

khatidaal (Score: 2): This is so tacky.. can't wait for this fad to be over"
1ozjngx,Rotor retention screw Stuck,"Howdy yall,

Currently working on getting the hub assembly off this 2013 silverado. Stuck at the point where I need to get the retention scree out of the rotor and cant seem to get it out regardless of what I do. I tried without lugs on, then tried on to try and get some of the pressure off. Impact bit did nothing, hit it with a torch and still won't budget. I locked the wheel in place and tried with a breaker bar, ended up just breaking the bit. Anyone have any advice on how I could get this loose?

Already did driver's side, that one came off no problem. This one is seized like nothing else",2,1763394303.0,37,MechanicAdvice,1763494543,2025-11-17 15:45:03,2025-11-18 19:35:43,"velocityhead (Score: 15): When you say ""impact bit"", what do you mean? The right tool for the job is an impact driver that you smack with a hammer, like this one:

https://preview.redd.it/lqva4jtjju1g1.png?width=1571&format=png&auto=webp&s=44355c32cb255054cd94cd0f384d2df719eaa67f

Nada_Chance (Score: 12): If it won't come loose with a hand impact driver, drill the head out. It's not required after it leaves the assembly plant."
1ozjc2g,Please help me with this car part name {urgent},"I recently changed my alternator of my 2008 toyota yaris, and like a dummy i returned the old one with this little piece still attached to it. I can’t go back to the store and get it off, so my only option is to HOPEFULLY find this part, as Toyota is telling me the only way to get it is by getting their $460 alternator which will take a week, and I just do not have the money for an entirely new alternator. Is there some sort of alternate solution i can use? ",17,1763393555.0,21,MechanicAdvice,1763494543,2025-11-17 15:32:35,2025-11-18 19:35:43,"CLSmith95 (Score: 10): Looks like a bracket for a wiring harness.  Likely not an integral part to the alternator functioning, meaning you can put your car together and drive it.

You can use some friction tape or zip ties to keep the harness spaced away from the alternator and call up local junkyards and auto recycling yards to see if they can get you either a cheap used alternator with the bracket or let you go in and pull the bracket off one yourself.

SubpopularKnowledge0 (Score: 3): Go to a junk yard"
1ozj37f,Alt/ serpentine belt wear analysis,"Hi all, I drive a 2009 Honda accord lx-p I4 and am wondering about the current condition of my alternator belt. Above are 2 pictures of the inside of the belt and a picture of a small crack that I noticed just now and is kinda worrying me. Is this urgent that I replace? I guess I should mention I have ~5-600 watts rms extra load from my sound system. (That’s full power I normally leave it at like less than 3/4 volume). Would it be bad to drive it until it gets worse?",1,1763392980.0,14,MechanicAdvice,1763494543,2025-11-17 15:23:00,2025-11-18 19:35:43,"TurkishSwag (Score: 4): Belts are unpredictable. While that crack is definitely a concern, there’s no way to know if it will last 2 weeks or 2 years. I would replace sooner than later but I don’t think it’s likely to snap in the next few days.

ClassicNumerous6038 (Score: 1): Bad to drive till it gets worse? Yeah…you don’t want it snapping on you. However it’s unlikely to snap right away

Just get it done within the month lol"
1ozisim,Is it bad to pull my radiator off while i wait for a new one to come in or should i wait till i have the part ?,Ik stupid question but idk if it can cause problems to pull it off and have it sit for 1-2 weeks,2,1763392295.0,3,MechanicAdvice,1763494543,2025-11-17 15:11:35,2025-11-18 19:35:43,"txcancmi (Score: 5): It's OK to pull it in advance but why would you? Some people may struggle to remember how to reassemble everything after a couple weeks.

If you do pull it in advance, be sure to plug any open hoses with rags in order to keep critters out."
1oziif4,2008 Pontiac Vibe Question,"Hello! For context before I get into the issue I encountered this morning: I have been in the process of replacing my car radio since it died on me a couple weeks ago. It has become a multi day project unfortunately, even with my background in audio. Given that, we had to disconnect my battery so I wouldn’t electrocute myself while working on the radio. We reconnected it yesterday afternoon so I would be able to drive myself to work this morning. So here we are at this morning. Here’s the issue: when the car is idling (usually at stop lights or stop signs), it rumbles/shakes much more intensely than what most would deem normal. The headlights were also flickering a bit. My best guess is that it’s battery related but I have limited knowledge on cars. The car was taken in for inspection and some other work (needed part of my muffler fixed, oil change, rotation) last week to a trusted local shop and they did not let me know about anything like this nor has it occurred since I picked it up from the shop until today. So is this related to us disconnecting the battery yesterday? Is there poor connection at the battery terminals? Forgive my poor explanation. It’s been a rough morning obviously.",2,1763391629.0,3,MechanicAdvice,1763494543,2025-11-17 15:00:29,2025-11-18 19:35:43,"txcancmi (Score: 2): How much have you driven it since reconnecting the battery? On almost all modern cars, disconnecting the battery clears some/all of the computer learning. When you reconnect the battery and begin driving the car, the computer has to relearn certain performance data points."
1ozicz9,Valve cover gasket replacement on 2016 Elantra,"2016 Hyundai Elantra , 1.8 L engine

Recently took my car to the dealership for regular maintenance & they informed me that I needed a ""valve cover gasket replacement"" (attached photo taken by dealership). The quote for the repair was over $1000, so naturally I'd like to know:

1. How necessary/immediate an issue is this?

2. How likely would I be able to safely do this on my own? I've made a number of minor repairs by myself (lights, spark plugs, oil changes, etc.) But I haven't done anything more complicated than replacing the trunk latch yet",1,1763391274.0,2,MechanicAdvice,1763494543,2025-11-17 14:54:34,2025-11-18 19:35:43,"cparks1 (Score: 1): It's just a small oil leak, it's not a big issue. It might get worse as time goes on, or it might not.

It should be a fairly easy job for you. If you can't figure it out on your own I'm sure there's a couple of YouTube videos that could help. I watched the first couple minutes of this one, he seems pretty detailed. https://youtu.be/XzokFIVQOSs"
1ozhuym,Is this normal?,07’ accord 2.4l. Engine kicks in and out when I have my vents on in the car. It’s been doing it since I got the car and am curious if it’s any concern. ,2,1763390089.0,10,MechanicAdvice,1763494543,2025-11-17 14:34:49,2025-11-18 19:35:43,"mmiller1188 (Score: 3): That's normal. Whatever mode you have selected (maybe defrost?) is running the AC compressor to dry the air out and it's cycling the cooling fan as part of normal AC system operation.

SippsMccree (Score: 1): Is the AC on? Cars will often cycle the radiator fans to make sure that the AC system is getting enough air through the condenser to work properly"
1ozhp4r,Is this a concern?,"2022 VW Tiguan was parked in the garage for a week and found this spot when it was moved. Is this normal or what does it mean? If something needs to be repaired, what is it and how expensive? 

Bought used with 18k miles 7 months ago and had inspected first. Warranty was 6 months of course",1,1763389690.0,2,MechanicAdvice,1763494543,2025-11-17 14:28:10,2025-11-18 19:35:43,"ViziEdits (Score: 1): Hard to tell what would need repaired but definitely looks like an oil leak. Could be a front or rear main seal, valve cover gaskets, really anything."
1ozhgav,Where is my coolant going?,"Just a general question for anyone who can answer it. I just replaced 90% of my cooling system in my 1997 ford ranger.

I replaced the rad, upper and lower hoses, thermostat, heater hoses and flushed it about 8 times after doing so.

Only things i havent replaced are heater core and radiator cap.

Heat works great, no sweet smell from vents and no puddle on passenger floor or anything.

The truck seems to be losing coolant at a pretty quick rate. Roughly a quart added to my reservoir in under 250kms.

My oil looks, and smells fine not like a milkshake and there is no white smoke from my exhaust. No visible leaks anywhere. Where is my coolant going???",1,1763389089.0,6,MechanicAdvice,1763494543,2025-11-17 14:18:09,2025-11-18 19:35:43,"Unlikely_Rise_5915 (Score: 3): Could still be air in the system, was it bled?  Have you done a pressure test?"
1ozhcm2,Oil leak or burning oil?,"08’ Ford Ranger 2.3L 4-cyl with manual transmission. 

I’m losing oil somewhere… I started noticing oil build up a while ago but just assumed it was an old leak because none of it looked “fresh” and has that caked on oil vs shiny oil. I changed my oil tonight cause the light came on and there was MAYBE a qt of oil that drained out. Definitely looked like used oil but normal otherwise. When I was under the hood I noticed “fresh”, meaning shiny, oil on the air intake tube and the 2.3l plastic cover for the, I think it’s the throttle body but my knowledge is very basic. It looks like it’s coming from this part but idk what it is, when you take that cover off it’s just a plastic tube looking think and you can see shiny silver inside (assuming it’s a piston or something). It looks like it’s coming from this part cause it’s only wet around it, but idk what it is? 🤷🏼‍♂️

Any ideas? ",1,1763388831.0,2,MechanicAdvice,1763494543,2025-11-17 14:13:51,2025-11-18 19:35:43,"Rebeldesuave (Score: 1): What you circled looks like a PCV hose. Nothing to do with the throttle body. 

If you were looking for the throttle body just follow the big fat air intake hose up to the engine. That's where the throttle body would be"
1ozh7bx,Urgent SOS,,1,1763388455.0,3,MechanicAdvice,1763494543,2025-11-17 14:07:35,2025-11-18 19:35:43,"Sophias_dad (Score: 1): https://www.velostern.com/threads/p1326-knock-sensor-code-beware-water.5888 might help.

It also might help to know the year/engine of your veloster

sanman1212 (Score: 1): If it's just the check engine your worried about just bring it to an auto parts store and have them hook it up to an obd reader and see what codes come up. It might be nothing serious"
1ozh4ya,What is this sound?,"2016 Subaru Outback, 2.5L 4 cylinder engine, 140k miles.

It makes this noise intermittently, only really when accelerating gently, and/or turning right. It’s been making this sound every so often for the last year, but over the last month it’s gotten more frequent.

No noticeable issues with handling, braking, driving in general. No alert lights on the dash.

Anyone know what the problem is? And how urgent it is?",1,1763388286.0,4,MechanicAdvice,1763494543,2025-11-17 14:04:46,2025-11-18 19:35:43,"Cereal-Killer541 (Score: 2): Sounds like a CV joint going out

Alternative_West4060 (Score: 1): It's all wheel drive, yes? I think it's that thing at the bottom that spins that make the back wheels also spin, forgot what it's called I'm high rn

It could be bent, loose or disconnected, do you feel you've lost some engine power after that noise happened? Or does it act a bit off in sharp curves? If so that might be it, lift the car and check that it's not broken or bent and that it can learn too looovveeeee agaiiiinnn

Edit: not a mechanic btdubs"
1ozgpcn,Experienced these lights,"Car began struggling to accelerate and the steering seems stiffer then usual 


The engine light also comes on and off now (which never used to happen) 

",2,1763387219.0,3,MechanicAdvice,1763494543,2025-11-17 13:46:59,2025-11-18 19:35:43,"uhnonEmuhS (Score: 1): I had the same problem with an 09’ Prius. Diagnosed as an abs issue and after driving it around super dangerously for a month the battery died and when I replaced it, it fixed the abs issue. Mechanic said that because the battery was essentially dying it wasn’t allowing the abs to work properly. Idk if it’s bullshit cause they didnt know or anything but new battery fixed my issue but it was going to be a full abs system replacement. 

Amazon has super cheap code readers. Yeah they wont be fancy but you can get an idea. 

Not a mechanic btw, get professional advice before you start spending money 😂"
1ozggv5,Need help identifying what is sticking out here,"2015 Volkswagen Passat Wolfsburg edition. Found it like this this morning, the car still moves in a straight line, but what is this/how could this have happened/how can I get it fixed?",472,1763386605.0,78,MechanicAdvice,1763494543,2025-11-17 13:36:45,2025-11-18 19:35:43,"dustyflash1 (Score: 1904): Looks like a pressure washer extension

karduar (Score: 438): That is the nozzle of a pressure washer. Fell off someone's truck and you were the unlucky person to find it."
1ozfzkq,Unusual noise,"Got a video from a friend stating their vehicle made an unusual noise when cranking, any idea on what it could be?",7,1763385351.0,4,MechanicAdvice,1763494543,2025-11-17 13:15:51,2025-11-18 19:35:43,"Sophias_dad (Score: 3): Starter misalignment, flexplate cracked/damaged or teeth worn.  Note that a starter misalignment would cause really bad tooth wear on both the starter and flexplate.

Sounds like MOST of the evil noises only occur during cranking itself."
