id,title,selftext,score,created_utc,num_comments,subreddit,scraping_time_utc,created_datetime_utc,scraping_datetime_utc,top_comments
1o8maw3,2014 Ford Taurus sluggish acceleration,There are no issues with combustion as far as I can tell. The idle seems fine and I don’t have any shuttering or spikes in RPMs but I notice when I’m accelerating onto the highway I’m sticking my foot to floor and gradually climbing to like 50mph? Outside of just how punchy it is when I driving i genuinely can’t see anything else going on that may be an indication of something bigger. Also I have taken it to two transmission shops and both told me that everything seems fine as far as that’s concerned. Any thoughts?? ,1,1760658941.0,5,MechanicAdvice,1760729627,2025-10-16 23:55:41,2025-10-17 19:33:47,"Crabstick65 (Score: 1): Mt first thought is a plugged exhaust, but that's an utter guess as I'd be doing a variety of checks."
1o8m7pz,2015 jeep grand Cherokee blown head gasket possibly should I trade it or fix it,,1,1760658699.0,4,MechanicAdvice,1760729627,2025-10-16 23:51:39,2025-10-17 19:33:47,kyden (Score: 1): Are you sure it’s a head gasket and not a failed oil cooler?
1o8m1qo,2014 Subaru Legacy weird noise,"2.5l 2014 legacy 

Haven’t heard this noise before, but when I go above 50mph and let off the accelerator, my car makes a shaking sound from the front right. 
Sounds like washboard gravel road or rumble strips maybe. 

If I accelerate or brake the noise stops. Doesn’t matter if I am going straight or turning noise is still present. 

I feel it in the steering wheel but it doesn’t violently shake like death wobble. If I start off faster the noise is louder

I have a few videos but they are all similar quality, you can just hear it over the road noise ",1,1760658253.0,3,MechanicAdvice,1760729627,2025-10-16 23:44:13,2025-10-17 19:33:47,Just_Airport_4719 (Score: 1): Sounds like it could be a variety of things. Maybe could be a tie rod end that’s worn or the CV axle . Or even  worm ball joint. Would be worth looking under the car and see if there’s any parts that are possibly broken
1o8lxhm,Power tool question,"To start: I don’t care that matco rebrands 

Has anyone even used any of the matco power tools? Their new 1/4” drive impact can use both 12 and 16 volt batteries. 

I’m torn between the Snap On 1/4” drive impact that uses the 14.4 volt battery. they both have 100 ft lbs of break away torque so i know they’ll both work. 

Any one who’s used either snap on or matco power tools i would love any insight ",1,1760657934.0,4,MechanicAdvice,1760729627,2025-10-16 23:38:54,2025-10-17 19:33:47,"Mikey3800 (Score: 3): I know it's not your question, but why not use Milwaukee? Milwaukee is probably better priced and more widely available. And their tools only use 2 different types of batteries. I've owned Snap On and Milwaukee electric tools and now almost all of my tools are Milwaukee. I have one Snap On electric ratchet that I use at home. It works enough for stuff around the house, but that's it.

smthngeneric (Score: 2): I use Milwaukee power tools mainly. Ill buy some tool truck hand tools and stuff but for power tools it's hard to beat Milwaukee. I do however use the small snap on 3/8 and 1/4 impacts with the rocker switch. Absolutely love those for things like adjusting body panels where you want to loosen something and then immediately tighten it. And I did just the other day buy the snap on 1/4 mini impact (if you even want to call it that) and I love it. It's damn near the size of my hand and works like a power ratchet where you break it loose and then it takes it out. It's been really handy for under dash stuff and cramped spaces."
1o8lvuw,Temperature gauge not aligned,"Hey all, I just got done doing a ton of work on my 2005 nissan 350z and after getting it back together we had an issue where the fuse popped for the ecu. No big deal, but now the gauge for temperature shows halfway when the engine is cold, and stabilizes at high. Anyone know how I can recalibrate them?",1,1760657814.0,6,MechanicAdvice,1760729627,2025-10-16 23:36:54,2025-10-17 19:33:47,"PriorTemperature3237 (Score: 2): Check your ECT sensor(s)

PriorTemperature3237 (Score: 1): Anyways I had a issue with my Nissan and the wires going to the temperature sensor were slightly stripped and touching each other causing a similar condition."
1o8lrt6,Can i remove the condenser without any issues?,This car recently hit the back of a jeep. The radiator was leaking out of the plastic but was temporarily patched with some JB weld that is holding for the time being. My concern is that the condenser is rubbing on the radiator. Can i remove the condenser for now without any major problems in the future? Its a 2001 Lexus RX300 ,21,1760657521.0,17,MechanicAdvice,1760729627,2025-10-16 23:32:01,2025-10-17 19:33:47,"cdabc123 (Score: 17): oof, you can but it would be a process to ever get the ac back in working condition. You could likely also leave it as is, the rad is bent and battered, the condenser isnt going to do much more harm then it already took. Just maybe ignore it and buy a new rad if it becomes a issue.

CaptnSave-A-Ho (Score: 10): That condesor isnt going to do any damage to the radiator. The JB weld should be your biggest concern since it will likely fail. The condenser can be removed and left out, but now your AC will be exposed to the elements and this will greatly decrease its life, or make it so you have to replace the entire system to have functioning ac. Taping off the ends of the ac lines wont adequately protect the system either. I would leave it and try and replace the radiator as soon as possible."
1o8lkdb,Wheel lock broke inside the bolt (BMW). How to remove it without braking the bolt?,,1,1760656977.0,5,MechanicAdvice,1760729627,2025-10-16 23:22:57,2025-10-17 19:33:47,"theg33k (Score: 1): Your local auto parts store probably has a set of these you can borrow for free: [https://www.amazon.com/YEKEPRO-Removal-Extractor-Removing-T12206/dp/B0BWTHJH9Z?th=1](https://www.amazon.com/YEKEPRO-Removal-Extractor-Removing-T12206/dp/B0BWTHJH9Z?th=1)

  
They will destroy the lug nuts, so you'll have to buy a new set, but you will get them off.

Successful_List2126 (Score: 1): Weld a nut onto it.  What a pain!"
1o8leuq,Loosing 1km petrol every 10 seconds - Demio,"My Mazda Demio is going down 1km every 10-15 seconds on the fuel gauge, the fuel loss is also reflecting on the gas metre dropping bars. 

It doesn’t go back up after the car is stationary overnight, and there is no leak. How do I fix? 

2011 Mazda Demio Hatchback 

",1,1760656578.0,2,MechanicAdvice,1760729627,2025-10-16 23:16:18,2025-10-17 19:33:47,"Grand_Possibility_69 (Score: 1): So if you just wait for a bit the fuel gauge reads empty? If you then go to gas station is the tank still (almost) full? If yes it just seems you have a bad fuel gauge. Maybe sending unit is the most likely problem, but check (with multimeter) before replacing parts."
1o8le69,How much has this oilfilter gone trough?,Seller states he changed the oil 1000km ago ,0,1760656525.0,6,MechanicAdvice,1760729627,2025-10-16 23:15:25,2025-10-17 19:33:47,"MaxPaing (Score: 5): The oil. The filter has 30.000

Gun__Nutz (Score: 4): Not much keep using it"
1o8ldrc,O2 Sensor Leaking Oil on My ‘03 Mazda Tribute — Am I Cooked?,"Hey everyone! My 2003 Mazda Tribute recently started burning oil, so I took a look underneath and noticed oil coming from around the O2 sensor (photo attached). It looks like the sensor itself might be leaking oil.

I’m not sure what this means — is my engine in serious trouble, or could it be something simpler? Any advice before I take it in would be appreciated.",1,1760656492.0,5,MechanicAdvice,1760729627,2025-10-16 23:14:52,2025-10-17 19:33:47,"Badiaz562 (Score: 4): Are you sure it wasn’t an oil leak or something at one point that dripped onto it and subsequently burned on the hot exhaust? There should not be oil coming out the exhaust. Maybe if it was burning but not in liquid form.

theg33k (Score: 2): As the other comment suggests, your O2 sensor doesn't plug into something with oil, so it shouldn't be possible for oil to leak out of it.  More likely something above is leaking oil and dripping onto the O2 sensor."
1o8l9ic,"Burning smell, what is it","After a bit of driving I will start smelling a burning/burnt smell and when I parked earlier and opened my hood I saw smoke coming from this area so I’m assuming its whatever is on all the parts in there. 
I don’t know how to describe the smell, just smells like something burnt or burning. 
I’m wondering if anyone can tell what it is by the video and should I try cleaning it off to see if it comes back, if so how should I do that?
Car is a 2010 volvo s80 t6",1,1760656175.0,3,MechanicAdvice,1760729627,2025-10-16 23:09:35,2025-10-17 19:33:47,"mfriendly1 (Score: 1): Probably oil that’s leaking and dripping on the exhaust.

Sorry6 (Score: 1): So you have a mostlikely oil leak, most likely up high looking at the location of the wet parts. My advice would be to degrease the engine and spray it completely clean. Then go for a drive and then check when you get back for the leak again, once you get the location you can then fix or get fixed. It will also get the oil of your engine for the time been to stop burning."
1o8l8xu,Advice on getting a refund?,"I dropped off my truck because the engine was overheating after about 30 minutes of use. The mechanic said he was fairly certain it was a thermostat issue. He replaced the thermostat told me I was good to go. I paid the bill and left. On my 10 minute drive home, the engine immediately started to overheat again per the temperature gauge on my dashboard.

I immediately turned around and dropped the truck back off at the mechanic right before they closed. The mechanic had already left for the day, so I had to speak with the receptionist. She said they would take a look in the morning.

My question is this: how do I go about asking for a refund for the work done (that didn't correct anything)? Do I ask them to take the price charged off of future work to be done? Do I ask for a full refund? I got charged $350, and my truck is in the same situation it was before I dropped it off. Not sure how to handle the situation.",1,1760656133.0,15,MechanicAdvice,1760729627,2025-10-16 23:08:53,2025-10-17 19:33:47,"cdabc123 (Score: 2): meh, I think most of the time you are on the hook for stuff you agree to repair. They say it might be a thermostat, you say go ahead and fix it, and they fix that part. They didnt guarantee they can fix your overheating issues as that can be a complex process. It can be pretty hard to diagnose sometimes, although, as a personal mechanic id do a better job about testing to ensure thats the actual problem, especially when working on my own stuff or friends.

So whats the issue? could be a head gasket that causes overheating which would be very expensive. could help to flush coolant. Definitely check to see if the coolant is filled properly, on some cars doing the thermostat can get air into the system which is hard to bleed out, and can cause overheating till it does. 

You say it immediately started to overheat? that's not really normal, did the engine seem hot? could be a bad sensor. Definitely make sure the car actually has coolant in it... what is the make and model and description of problem?

iz-LoKi (Score: 1): If the truck is still there and they properly test the repair and find out other work is needed then you can see about getting some off the bill for the inconvenience. There is a chance he did not complete the repair fully and could fix the issue quickly and then its up to you on how you want to handle it. I would see how they handle the issue and course correct."
1o8l55z,World's most stuck on lug nuts,"I've tried PB Blaster Penetrant, hammering on a socket, breaker bars, an impact wrench .5mm socket in-betweens, the extension for them. I've tried hitting it with my purse too. Somebody save me. If you take note, the two that I said come off, the acorn part is silver and fine, the 3 that are rusted brown are damned. One is destroyed because i also tried ripping the cap off and getting to the bare steel lug but the lugnut is still stuck on. This post is my blood writing on the wall.",2,1760655858.0,17,MechanicAdvice,1760729627,2025-10-16 23:04:18,2025-10-17 19:33:47,"Lucid-Design1225 (Score: 3): Big ass breaker bar with an even bigger cheater pipe. 

“Give me a place to stand, and a lever long enough, and I shall move the world” -Archimedes 

True shit bro. Whoever put those lugs on probably just ran the impact for 15 seconds.

UhOhAllWillyNilly (Score: 1): First I’d try a bigger breaker bar. Second I’d try whacking the impact wrench with a sledge *as you’re trying to loosen them.* (A roadside service tire changer had me do this when his impact wrench wouldn’t loosen a couple of lug nuts on my 18-wheeler and it worked.)"
1o8kx9t,Brakes condition?,"Background:
Got 4 new brake pads and rotors from powerstop installed for my 2011 lexus is250 around 115k. Car is now 125k (I only drive about 5k a year). Im in New England. 

The Lady says she thinks we should check out the brakes. I feel that I have to apply slightly more pressure on the brakes to stop. 

Brought it in, shop said my rear rotors are done and the pads are real low. I'm surprised because I just got them done 10k miles (2y4m) ago. He said the rear rotors are done because of the surface, they're completely worn. I thought the surface was just oxidized and just hasn't been worn down because I don't drive the car enough. And I thought no way the pads are worn after only 10k miles. 

What do you guys think, do I need new brake pads and/or rotors?

Pic 1&2: front driver side
Pic 3&4: rear passenger side
Pic 5&6: rear driver side

Front passenger looks the same as front driver side
",1,1760655283.0,3,MechanicAdvice,1760729627,2025-10-16 22:54:43,2025-10-17 19:33:47,"asianx13oy (Score: 1): After reviewing my own post it seems there is plenty of pad left so already hard to trust this shop. But what about the condition of the rear rotors, do I need to get them resurfaced? Its weird on the rear passenger side the whole rotor has those bumps whereas the rear driver side it there are bands of smooth and bands of bumpy. Would driving the car more often and doing hard stops smooth out the surface?

Nuisance_cs (Score: 1): Ignore my previous comment. The fronts look fine but the rear needs to be done. It looks like the rotors are pitting and the pads aren’t creating full contact. I would replace the rear pads and rotors when you can"
1o8kx10,what’s causing this sound?,this is the front passenger wheel never noticed this before has never given me a issue while driving but can hear it when it’s on the jack.,1,1760655265.0,2,MechanicAdvice,1760729627,2025-10-16 22:54:25,2025-10-17 19:33:47,"wirey3 (Score: 1): That is slack in the drivetrain. From the axle to the transmission, there are tolerances for the parts, which allow these parts to move just a little bit. The rattling is caused by you closing the tolerances and the parts bumping each other. Entirely normal, it happens on every car where the drive axle is."
1o8kn0o,Advice for installing new alternator with higher amps,"Hi all, 

I have a 2014 Ford Fusion SE 2.5l with just over 150,000 miles, and I had the alternator fail on me on Tuesday. I went ahead and ordered a new one and was planning on installing it tonight, but I realized that the amps for the alternator I bought (175amp) differ from the stock one (150amp).

I’d like to know if installing the new one would negatively affect my car. I’m not planning on installing anything that would require more power consumption anytime soon. Thanks. ",1,1760654555.0,3,MechanicAdvice,1760729627,2025-10-16 22:42:35,2025-10-17 19:33:47,"Unironically-Ironicc (Score: 2): No it’s won’t affect anything but have more headroom for electrical. Long as the part is the same and fits

kyden (Score: 1): You should be fine, hopefully the power wires are the same size for both."
1o8ke0m,Belt squeak on a Subaru Outback,"2014 Subaru Outback, squeaking from serpentine belt area, it goes away when the engine is at operating temps.  
The serpentine belt was recently replaced a few months ago.  
I’m not able to identify the exact source of the sound.  Any help is appreciated, thanks.",1,1760653917.0,3,MechanicAdvice,1760729627,2025-10-16 22:31:57,2025-10-17 19:33:47,"lestsgoritenoww (Score: 1): May be your pulley

NtSFstEddie (Score: 1): That noise sounds kind of ""metalic"" to me. Like dry/worn bearings. Take the belt off and spin the idler pulley and the pulley on the tensioner to see one sounds or feels different from the other. The idler pulley looks like it has rust or something on it."
1o8kdi4,2008 5.4 replaced transmission shift cable but arm won’t move?,,1,1760653880.0,6,MechanicAdvice,1760729627,2025-10-16 22:31:20,2025-10-17 19:33:47,"Strong-Perception-97 (Score: 2): The white part on the cable, has to go in the black bracket on the transmission.

Grimmisgod123 (Score: 1): Is the nut on the lever too tight?"
1o8kd5z,Handbrake stuck?,"So today i parked my car at the gym and after an hour i wanted to drive away, however it wouldn't move. The handbrake is down, but when trying to reverse, the car just lunches up like it would do with the handbrake up. I'm not so handy with cars (yet), this is my first car (peugeot 106 accent 1995). I do however need my car for daily commute. Is there any tricks on getting it unstuck myself? ",1,1760653857.0,6,MechanicAdvice,1760729627,2025-10-16 22:30:57,2025-10-17 19:33:47,"MaybeVladimirPutinJr (Score: 2): If you're stuck right now, pull the brake all the way up and smack it upward at the top of it's travel. Try a couple times and see if it lets go. 


If you're at home, start taking the rear brakes apart. The parking brake cables will run to the rear brakes. 

shotstraight (Score: 1): Probably rusted brake cables, you can release the brake and try wiggling the cables around, sometimes they will let go."
1o8k98p,Multiple Codes All at once,"2022 Toyota Tacoma V6 with 90000km on it. Check engine light came on so I tossed the OBD on and it spit out, P0174, P0171, P0455, and P1170. Not sure where to start looking for issues, can’t see any damaged or unhooked hoses, can’t hear an obvious vac leak. I should mention it’s a manual, and when clutch in coasting after being on the gas the tach bounces up to 2000 from 500 a couple times before it settles, like fuel is being spit in still? Any suggestions or insight is appreciated. ",1,1760653586.0,4,MechanicAdvice,1760729627,2025-10-16 22:26:26,2025-10-17 19:33:47,"OldFashionedGary (Score: 2): Check for signs of rodent damage and wire chewing at the top of the engine. Don’t ask me how I know this… 😭

Chemtrailcreator (Score: 2): Get fuel pressure checked. 2GR equipped Toyotas have a history with fuel pumps. There was a recall a bit back on that."
1o8k7t4,"Put a rebuilt starter in my 2008 Tacoma 4cyl just last week, now it's sounding like the drive gear isn't disengaging","FYI the motor itself doesn't seem to keep running, it just sounds like the drive gear isn't disengaging.  
How common a failure is this?",1,1760653486.0,2,MechanicAdvice,1760729627,2025-10-16 22:24:46,2025-10-17 19:33:47,"Jbolsa (Score: 1): Happened to me when I got a cheapy rebuilt, then I swapped for another and it didn't stick as bad as previous starter but I didn't like it. Then I got a rebuilt by denso for few bucks more and it was good."
1o8k34w,What is this noise?,"bought this car a little bit ago, alternator was on its last legs, just replaced it with a new one today. thought this noise was just from the old one going bad, but unless the new one just happens to be messed up in the exact same way (it's a duralast gold, so not exactly OEM, but at least not a reman), i feel like it's got a be something else. the pulleys below the alternator were my first guess, but they're all clustered so close together i can't really localize the noise as coming from them or the alternator.

the increases in volume and pitch with rpms, but pulling the alternator harness cable doesn't change anything (i've seen videos of alternators making noises similar to this, but they go away when the cable is pulled). it's loud enough that i can hear it faintly but distinctly over the engine even with the windows up as long as my radio is off.

voltage from the alternator seems fine (for now), voltage drop test showed everything in normal ranges, so for the moment it's kinda just an annoyance, not an actual issue, but i'd kinda like to prevent it from turning into one if this a precursor.",1,1760653160.0,3,MechanicAdvice,1760729627,2025-10-16 22:19:20,2025-10-17 19:33:47,kyden (Score: 1): Is the power steering reservoir full?
1o8jwxf,Need help with really concerning noises and feelings in my car,"I have an issue with my 2011 chevy equinox, everytime i turn it, it makes continous CLANKS and then smoothes out after awhile for being on the highway. BUT, i had a few relatives of mine check on it, and they put pressure on the back of the car to try and see how the suspension and movement was, and now after that it makes ABSURDLY more clanking and continous vibration up until getting up to speed, the car also has some trouble accelerating uphill.",1,1760652728.0,6,MechanicAdvice,1760729627,2025-10-16 22:12:08,2025-10-17 19:33:47,"InvestigatorKey3959 (Score: 1): Sounds like something got messed up in the suspension or drivetrain when they pressed on the back of the car. Could be a control arm, strut mount, CV axle, or even a motor mount. The extra clanking and vibration aren’t normal, don’t keep driving it like that. Get it checked ASAP before it gets worse or damages something else.

tamatoawasd (Score: 1): i should add that it does NOT do this when throttled and in park, it is only when the car is moving"
1o8jtns,It takes a lot of force to shift from some gears. Why?,"I had my manual transmission replaced one year ago at a mechanic shop in my 2011 Subaru Impreza diesel. It works great, and I've driven it 20k km since then without issues. But it has always had one small problem since swapping the gearbox, and that is that half of the gears take some extra force to get out of gear. I don't remember exactly which ones right now, but I think it's 2,4,6,R. This is mostly just a ""cosmetic"" problem, but it can be a bit annoying or sometimes even painful for the shoulder.. I drive a lot.

The shop that did the transmission shop are aware, but they didn't know why. I've talked to another mechanic that has worked on the car a bit, and he has a theory about the ""cables"" in the transmission. That one of them is for half the gears, and the other for the rest of them being too tight. But I don't do anything more advanced on cars myself other than bulbs, wheels and battery, so I don't have any deeper insight on this. Any idea on what this could be? Is it a easy fix? It's a great and reliable car, but I don't want to spend a lot on something so old if this is a big job.",1,1760652495.0,6,MechanicAdvice,1760729627,2025-10-16 22:08:15,2025-10-17 19:33:47,"Salty-Image-2176 (Score: 2): Does it shift smoothly with the engine off?  
If so, you have a bent shifting fork.  
If not, and it's difficult to shift regardless of engine status, it could be a linkage issue.

shotstraight (Score: 1): I would try cracking the bleeder and see if you get an air bubble out first thing. Then look for other issues."
1o8jsm0,Bmw issues,"My 2006 bmw 325i is idling rough and stalling, also smells like gas and maybe something burning. it’s making a weird suction noise which is why i’m thinking something with the air system. any tips on where to look is appreciated! ",1,1760652425.0,2,MechanicAdvice,1760729627,2025-10-16 22:07:05,2025-10-17 19:33:47,"aberg59 (Score: 1): Probably has a vacuum leak somewhere, check all the intake hoses and manifold. Also check if your IAC valve is dirty if the engine has one"
1o8jprs,Is it really that important to have the exact pushrods to the exact rockers?,"Title. 1992 fleetwood.

  
Im doing a rocker arm and pushrod job and some people tell me i have to remember which pushrod went under which rocker arm. Well my dumbass didnt do that and I mixed them up. How bad is it to have random rocker arms to random push rods?",4,1760652230.0,11,MechanicAdvice,1760729627,2025-10-16 22:03:50,2025-10-17 19:33:47,"RickMN (Score: 8): They all wear in differently. If you mix them up, you'll wind up with a noisy engine and possibly accelerated wear

unlistedname (Score: 3): As long as nothing has abnormal or irregular wear, which would need you to replace other parts anyways. I've never had an issue putting them back wherever. I'm adjusting the valves anyways if I have the push rods out. They should have the same wear surfaces and everything else, I'm sure there are some fringe cases where it's an issue but I haven't found them. Rollers and lifters are a different issue but push rods themselves are interchangeable"
1o8jpb3,Where is this noise coming from?,I have a 2023 Honda accord and I noticed a noise coming from the passenger side but it’s on  and off. Any ideas where this could be coming from? ,2,1760652200.0,3,MechanicAdvice,1760729627,2025-10-16 22:03:20,2025-10-17 19:33:47,"Salty-Image-2176 (Score: 1): Is it AC/Heat related? Increase decrease with the fan?  
What about engine RPM? Or different gear?  
Try these out and report back."
