id,title,selftext,score,created_utc,num_comments,subreddit,scraping_time_utc,created_datetime_utc,scraping_datetime_utc,top_comments
1mh2v2r,When the hell to change oil?!,"Hi. Frustrated with the diversity on information on the internet. Just bought a well loved 2002 GMC Yukon at nearly 195000 miles. She runs pretty great, does not seem to be burning oil whatsoever, I already put a 1000 miles on. The handbook writes I should change the oil every 3000 miles, the previous owner was to be on top of the maintenance and topped off the oil himself. 

However, after reading online now the opinions differ, especially since this is a 23 year old vehicle, I am assuming the quality of oil had changed? Is it perhaps now vehicles can last 5000 miles+ without an oil change because the quality of synthetic is better? Or is it best to just stick to what the manual recommends, be better safe than sorry and change the oil every 3000 miles like it says.

 I do mostly country driving, nearly no city driving. I plan on taking her 1000 miles cross country because I will be moving in October. I want to be on top of the maintenance as best as I can, I think I could maybe get another 100000 out of her before shes in for. 

Love to hear advice, I am just a girl trying her best to be responsible with my vehicle and make the right choices. I don’t mind putting in the money as I got a great deal, about half of the value on carfax. 

Thanks 🙏 ",3,1754278092.0,60,AskMechanics,1754422792,2025-08-04 03:28:12,2025-08-05 19:39:52,"mr_nobody398457 (Score: 43): > … I am just a girl trying her best to be responsible with my vehicle and make the right choices…

Good for you — but let me clue you about men and motor oil. There are only a few topics more controversial, best quarterback of all time, best pitcher of all time and “Star Wars” vs. “Star Trek”. 

Put in the oil that the manufacturer recommended, change it as often as they recommend, and live your life, full of joy, love, and reliable transportation.

Federal_Sympathy4667 (Score: 7): An old saying goes (and don't take it the wrong way):

RTFM

R - ead
T - he
F - ucking
M - anual

May sound harsh but I don't know how many people never do... it is all there.

If your car has no manual, either buy one or call a autoshop/dealer for that info specific for your model. And I apologize for the ""rough"" saying there but I often use it to get the point across."
1mh2k04,Any Ideas?,"Hi,

I have a 2019 Ford Ranger wildtrack.

I have noticed a clear gel like substance continuously accumulating in the floor of the passenger side.

Images attached.

Any ideas what it may be from would be much appreciated.

Thanks!",1,1754277112.0,2,AskMechanics,1754422792,2025-08-04 03:11:52,2025-08-05 19:39:52,TheOnlyCyanide (Score: 1): goon juice
1mh2ftg,Is there anything I can do or put on windshield/crack to stop the cracking from continuing?,,0,1754276759.0,8,AskMechanics,1754422792,2025-08-04 03:05:59,2025-08-05 19:39:52,"Azal_of_Forossa (Score: 3): Once it's bigger than like a dime it's beyond true repairs. You may be able to drill a not deep hole at the end of each of the, it looks like 7, cracks, that'll prevent them from hopefully spreading further, but this should have been addressed when it happened, not two years later. Live and learn.

[This video](https://www.youtube.com/watch?v=ng-OH_Bg3pA) will explain it better, and show the result. I'd recommend looking at multiple video guides that actually show the process if you actually want to take on this challenge yourself.

Just an FYI, once the crack reaches the edge of the windshield, water intrusion is officially on the table, fix it now before it spreads further. While we can dwell on the should haves, you can still prevent further damage.

(I posted this on your original post, but I'll post it here as well)

StefanZ98 (Score: 2): you’ll need a new windshield anyway"
1mh243f,Is 2016 Ford Fusion Worth it?,"Hey everyone!
I have zero knowledge about cars, so I thought this would be the best place to ask for help. I’m working with a $6K budget and looking for a reliable used car that can last me at least 3 years (6 years would be amazing, haha).

I came across a 2016 Ford Fusion SE. Priced at $5.9K after taxes. 2.5 non turbo engine, FWD. It has a clean title, is being sold by a reputable dealership, and they’re totally fine with me taking it to a mechanic for an inspection — which I definitely plan to do.

The only thing giving me pause is the mileage: 157,000 miles. My daily commute is around 20 miles, mostly highway (about 90%).

Do you think this car could reasonably last me another 3 years? Any advice, thoughts, or things to watch out for would be greatly appreciated!

Thanks in advance! 
",1,1754275787.0,2,AskMechanics,1754422792,2025-08-04 02:49:47,2025-08-05 19:39:52,"2005CrownVicP71 (Score: 1): If the transmission has been replaced/rebuilt, go for it. The 2.5L is very durable and reliable but the 6F35 transmission is notorious for premature failure."
1mh206r,Question About Possible Battery Corrosion in Honda Civic Key Fob – Should I Replace the New Battery Again?,"Two days ago, I got the “keyless remote battery low” warning on my 2016 Honda Civic. I picked up a replacement CR2032 coin battery today and just swapped it out. The old battery was a bit tough to remove, so I used a small flathead screwdriver to pop it out. The new one went in without any issue, and I reassembled the fob. The fob is working fine. 

However, after putting it back together, I noticed two of my fingertips had green stains on them. Neither the old nor the new battery looked corroded or leaking, and I didn’t see any liquid inside the fob. I washed my hands twice and the stains came off.

Now I’m second-guessing things though and wondering—could the green staining mean one of the batteries (possibly the new one) was corroded or compromised? Should I replace the battery again just in case, or am I overthinking this? I really don’t want to risk damaging or ruining my key fob.
",1,1754275464.0,2,AskMechanics,1754422792,2025-08-04 02:44:24,2025-08-05 19:39:52,Ravenblack67 (Score: 1): Clean the battery holder or it will get worse and you will need another battery soon.
1mh1xoq,Improperly tightened Axle Nut,"2012 Dodge Journey. Front wheel drive. My family's car. I replaced the front left lower control arm following this video. https://youtu.be/_3qZVsvAoW8?si=Hog8JfylIoAJv8iQ. No problems there. I needed to tighten axle nut to 180 lbs/ft but my torque wrench only goes to 150. I reattached the front right wheel and lowered it before going to buy a torque wrench. I saw the store was closed so I decided to torque it to 150 and then do a quarter turn with a breaker bar. I got a lot of resistance and heard a semi-loud click before the breaker bar had moved much. I thought maybe I had over tightened it with my impact (Bauer Battery). Also I was not using a pry bar to stop the wheel or apply the brakes. Reminder the other front wheel was on the ground.

I was able to remove the axle nut, and I retightened to 150, for certain this time, then used the breaker bar with brakes applied and I was barely able to tighten it further, and no clicks or anything.  I drove it around and on highway and didn't hear/smell anything unusual. Its the click sound made when tightening that worries me.

A couple things:
1. Beforehand I knocked the bearing off the axle(sorta?) with a punch following the video.

2. I was tightening the front left while the front right wheel was attached and lowered.

3. I did not stop the wheel from spinning with a pry bar or the brakes the first time I put the axle nut on.

",1,1754275264.0,4,AskMechanics,1754422792,2025-08-04 02:41:04,2025-08-05 19:39:52,"Just-nonsenseish (Score: 1): Just get yourself an impact that has a setting in that range go till it stops.
loctite it.

 For example the minimum setting on my dewalt is a 175.

loctite and that bitch ain't going nowhere without a torch 

if you didn't loctite? do it again with loctite

or just send it"
1mh1mxf,Cans I use an aux fan from a 300d on a 300cd,,0,1754274373.0,5,AskMechanics,1754422792,2025-08-04 02:26:13,2025-08-05 19:39:52,"Praxis-KUMAR (Score: 2): I don't know for sure, but generally the Amazon part lookup is correct. I also don't see that model in the description.

Coakis (Score: 2): Whats the individual part numbers for each? Do you know how to cross-reference part numbers?"
1mh1aor,Question about Autozone battery tester,"Bought battery from auto zone 2 years ago. Still under warranty. Have a 2020 jeep gladiator. Recently been having issues where if truck parked for few days I end up having to give it a jump. I give it a jump and drive it around. Went to autozone and they hooked up battery tester and said battery is good. Question is since I gave it a jump and drove it around,  is that giving a false reading saying its good when it could still be bad or is their diag tool still able to tell. This has happened twice in a month.",1,1754273398.0,5,AskMechanics,1754422792,2025-08-04 02:09:58,2025-08-05 19:39:52,"Maximum_Budget_4035 (Score: 1): Sounds like a parasitic draw. It can take the battery down far enough the vehicle won't start without a jump, but the battery still has the capability to collect and hold a charge. First suggestion, unplug any accessories in the interior outlets and see if it happens again. Being you said it's a Jeep, start questioning any exterior accessories hooked up(light bar, rock lights etc.) as a secondary cause of battery drainage. Best suggestion, take it to a shop versed in electric diag and request a parasitic draw test. It may be necessary to leave the vehicle overnight, or even multiple based on your description, but there could be a module staying awake that should be asleep when it hasn't been prompted. Keyless entry systems are the most active, if you leave a key close to the vehicle it might be keeping communication active be a use it can sense the key. Move any spare keys that might be close, it could simply be an issue where it's reading the key and trying to respond the way it's designed to. Keyless entry is a passive system but it's woken up by a signal from the fob.

If none of the quick fixes I suggested change anything, unhook the battery next time it won't be driven for a few days and see what happens. If the battery is dead, and it's not being caused bysomething extraneous, that will give you definitive proof."
1mh19rr,How do I tell what kind of transmission fluid I need,"The title says it all really, I’m not the smartest when it comes to vehicles and my trucks transmission fluid leaked all over my carport (it’s been fixed) but now I’m in need of transmission fluid and I have no idea what to get                                                                   For context I have a 2000 ford f150 4.2L V6 4x4 and I doubt this matters but it is a long bed any help will be appreciated thank you so much ",1,1754273322.0,16,AskMechanics,1754422792,2025-08-04 02:08:42,2025-08-05 19:39:52,"unwtch (Score: 3): if an automatic just mercon atf

alpaca-yak (Score: 2): best is to call a ford dealership and ask them to look it up from the VIN. you can find the vin on a sticker in the driver's door frame.

it's probably mercon v."
1mh18ho,2011 Dodge Journey 3.6l V6,"Having likely brake issues with 2011 Dodge Journey Mainstreet 3.6l V6. Was doing about 3 hours of freeway driving (avg. 75 mph) 2 days ago, everything was completely fine until the last 20 minutes of the drive. Ran into some pretty heavy traffic, going back and forth between 5mph and 50mph every other minute. I got around a clump of traffic and sped up towards my exit ramp, going about 65-70mph, and all of a sudden got death-wobble levels of shaking in my steering wheel, manageable enough to steer through the off-ramp and slow down, but just barely, (I always drive woth one hand but I went 10 and 2 so fast lol, probably my first time since drivers ed). I parked the car and checked it out, lots of brake dust on the rim, smell of burning brakes, and immense heat coming from the front passenger side. Let it cool down for 10-15 minutes, then finished the last 30 minutes of my drive on backroads. Yesterday, I took a look at it, and for the life of me could not figure out what the issue is. Rotors, pads, caliper pins, wheel bearings, all seemingly in good shape. No leaks or cracks in the brake line, compressed the caliper piston with a clamp, it compressed with a normal level of difficulty, and reengaged when pressing on the brake pedal. I figured it must've just been some crazy fluke that caused the shaking the day before, so I put it all back together, took it for a test drive, hit 75mph, no issues, no shaking, so I figured it was some random happening or whatever, and that it was fine. But then I took it back out today, it was fine for the first stretch of driving (70mph avg.), but then the issue came back after hitting some heavy stop-and-go traffic again. So my 3 hour drive turned into a 5 hour drive having to take state highways instead of interstate freeways lol. I can drive up to 60mph before the shaking starts, and if i haven't used my brakes in ~15min., I can get up to 70 with no issue. But as soon as i consistently use my brakes for a couple minutes, the shaking starts back up at high speeds again. I'm assuming its something with the caliper piston, or my master cylinder, but I am by no means a traoned mechanic, and would really appreciate some advice. 

TLDR: Front right brake having issues releasing pressure after moderate use when travelling at freeway speeds. No visible/obvious issues with pads, rotors, caliper, brake line, or wheel bearings. Can travel ~55mph with no issue, severe steering wheel shaking when driving 65+ after moderate brake usage. No shaking at any speed if brakes haven't been used in ~15 minutes. I'm completely lost on what this could be. ",1,1754273218.0,2,AskMechanics,1754422792,2025-08-04 02:06:58,2025-08-05 19:39:52,"RichardSober (Score: 1): If you are going to launch a parts cannon any time soon, I'd throw a flex hose first. A collapsed hose can act as a valve. It would cost \~$15 + some brake fluid. I've seen them fail on this car out of the blue, but they caused problems on low speeds as well."
1mh18b6,"Help please: 2012 Prius C 170kish miles not accelerating past 45mph, hybrid battery insufficient charge error in EV mode, drive it in ECO, mostly highway. Even now that I’ve switched to mostly city and only 20min commute, Only getting 16mpg?",,2,1754273204.0,2,AskMechanics,1754422792,2025-08-04 02:06:44,2025-08-05 19:39:52,Shade_Slimly (Score: 1): It sound like a fault with the HV system. You need to have it scanned for codes and diagnosed.
1mh0z6g,"(STUPID QUESTION) My 2006 chevy silverado 1500 has a rear main seal leak can I put some really strong, heat resistant, water proof tap on it.", .,0,1754272496.0,7,AskMechanics,1754422792,2025-08-04 01:54:56,2025-08-05 19:39:52,"ALilTooForward (Score: 2): The expense of repairing a rear main seal leak is in getting to the actual part. The seal itself should be reasonably cheap. 


If the engine is out of the vehicle and you're looking for a quick solution, I really don't think any kind of tape/sealant is going to hold up to the conditions a real main seal is subjected to, at least not for very long if at all. 


If the engine is in the vehicle, I absolutely wouldn't go through the trouble of getting to the rear main without acquiring a correct new part ahead of time, as you're asking for a lot of extra time/money/problems if you dump a bunch of oil out the back of the engine either on the ground or all over a clutch... lol and then at a minimum you'll be doing it all again anyway

2005CrownVicP71 (Score: 2): The transmission needs to be removed to access the rear main seal. What exactly will you tape?"
1mh0wix,How much more can I get out of these tires? And are my brake pads good?,"I intend on replacing these tires very soon, they’re very close to the wear indicator but not there yet. Can I drive another 600 miles on these before replacing? Any help is appreciated!",2,1754272286.0,19,AskMechanics,1754422792,2025-08-04 01:51:26,2025-08-05 19:39:52,"SlowDuc (Score: 5): Tires are only a couple MM above the wear bars and showing some signs of dry rot. I’d say you are in “replace at next good sale” realm of tires. Pads look fine (at least on that one wheel).

Glittering_Captain99 (Score: 3): That one pad looks to be 7-8/32” or so, which is good.  That doesn’t mean they’re all the same, though."
1mh0mu3,How long is it okay for a car to sit?,"My son, who lives an hour away, lost his license due to seizures. Now he won’t be getting it back until at least March of 2026. His car is parked in a lot at his apartment complex. What can he do to keep the car from deteriorating? The car isn’t worth much, but he will eventually need a way to get around. ",0,1754271523.0,18,AskMechanics,1754422792,2025-08-04 01:38:43,2025-08-05 19:39:52,"NicholasVinen (Score: 4): Better to drive it a couple of times a month. Definitely add fuel stabiliser to the tank regardless.

Shot-Swimming-9098 (Score: 3): March of 2026 isn't too far off, and I hope your son recovers fully. Are you in a cold weather spot? Winter might be rough on the battery. 

I have a utility vehicle that I usually put about 500 miles a year on. I haven't had any real issues, except that it goes through batteries faster than the daily drivers.  

Try to drive it once a month. When you do drive it, don't make a short trip, get it all exercised, and it will all be good. Do the oil change after a calendar year since the last one, even if it doesn't need it by miles. If nothing else, it's a reason to get it moving again."
1mh0lxl,2007 Honda Accord EX,"I have a 2007 Honda Accord EX. I do not know what this piece is that circled in the red and I am trying to find out because it is cracked and I need to replace it. I’ve gone to the automotive stores over here and they don’t know what it is and also tried Google lens, but it’s not helping. If anyone knows, please let me know it would be appreciated.",1,1754271448.0,5,AskMechanics,1754422792,2025-08-04 01:37:28,2025-08-05 19:39:52,Nesteaa (Score: 1): Its just an air chamber for the breather system. PN: 17138-RAA-A00. Google the part number and you will find lots of places that sell it or you can order from your local dealer
1mh03w2,How do I wire these lights to turn on with both my parking and headlights?,"I have a 07 ram and on my light panel is off,parking lights, and headlights. I want to wire these lights (that have a red and black wire) to turn on when my parking lights AND headlights are on. Thanks ",0,1754269980.0,16,AskMechanics,1754422792,2025-08-04 01:13:00,2025-08-05 19:39:52,"The_Phroug (Score: 11): you fucking dont.

you dont need to blind people while you're driving, your headlights on the low beams are bright enough for 95% of any night driving

M3pul (Score: 5): Oh boy another blinding car on the road"
1mgzqfu,"stuffed up and put the battery terminals on the wrong way around on my 1984 60 series landcruiser and the electrics won't turn on, I can put power directly to the engine fuse and they turn on but it won't crank please help",H,1,1754268893.0,3,AskMechanics,1754422792,2025-08-04 00:54:53,2025-08-05 19:39:52,"saucykryptok9 (Score: 1): 84 ...... what electronics?

Quietbutgrumpy (Score: 1): Stupidly put on booster cables backwards and blew the fusible link.  This is how I spent my Sunday."
1mgzj05,Loose rotor + wheel play,"Hey guys, I have been noticing alot of clunking and clicking coming from my front wheels after both front CV joints being replaced. I did this myself and have driven the car at least 100km since. Clicking noises still persist (old CV joint had blown so they were clicking hence the replacement). Noticed there was slight wheel play on my RH wheel, not side to side play but if I grab the wheel and pull away from the car. Both tie rods were replaced along with the CV joints so I am ruling that out.

I have removed the wheel to find the cause of the clicking and noticed that the rotor was ever so slightly loose. Removed the rotor and everything else is solid, no other play on the knuckle or tie rods. Is the loose rotor the cause of my wheel play? I would assume that fastening the wheel back on would lock it back into place, so I am a bit confused as to why there is play as everything else is solid.

My car is a 1996 toyota celica if that helps.

Any help would be appreciated 🙏 
",0,1754268285.0,6,AskMechanics,1754422792,2025-08-04 00:44:45,2025-08-05 19:39:52,"Bored_Dad_Bod (Score: 2): Rotor is supposed to do that. What about your inner tie rod ends?

tikkikinky (Score: 1): The wheel and lug nuts keep the rotor in place.  You should also have the wheel on if you’re checking for front end play or wheel bearings. The rotor is not the clicking noise.

Did you torque the axle nuts with a torque wrench? Did you double verify you installed the correct cv axles? Is the clicking when you are going straight or turning?

If it’s clicking when going straight then make sure the axles are seated completely into the transmission. Look under it for anything that might be rubbing from the axle or the rotors.(make sure the brake pads are properly seated too). If you can jack it up and put it on jack stands then crawl under it with the parking brake on and have it in drive you might be able to pin point the location of the noise."
1mgyuaj,No vacuum pressure at idle,"I checked the vacuum pressure with a gauge device while the car was idleing at ~1400 rpms. It did not read any pressure.  If I put the hose to my finger there is no pressure.  If I blow into it, while off I can hear the air going into the intake duct.  Is that normal to have no to little pressure at idle? 2003 Infiniti FX 45.  ",0,1754266310.0,3,AskMechanics,1754422792,2025-08-04 00:11:50,2025-08-05 19:39:52,"mlw35405 (Score: 3): That is not on the vacuum side of the throttle body. That is just the air intake for the crankcase or something. You have to check vacuum from a hose coming off the intake manifold itself.

Unlikely-Act-7950 (Score: 1): Vacuum doesn't create pressure it's the lack of pressure.   But you won't find any on that side of the throttle blade"
1mgysle,Is $7k for a 2011 Honda with 155k miles outrageous?,"ETA: Totally forgot to say - it’s a Honda CRV EX with an I-4 cyl. 

My parked 08 Honda Accord was totaled yesterday, and I’m in need for a new car ASAP. I don’t have a ton of time to look, and I don’t want a car payment so I’m working with a limited budget. 

I’m only looking for a Honda or Toyota, so even more limited in options. The car looks like it’s in great shape, the carfax report shows a single owner and very regular maintenance (including a new AC compressor in the last two years). I’d of course have it inspected by a mechanic before purchase, but is this a decent option? ",0,1754266177.0,7,AskMechanics,1754422792,2025-08-04 00:09:37,2025-08-05 19:39:52,"eweyda (Score: 1): Idk if it's outrageous but I better not have to change shit. Wheel bearings, CV axel, belts etc or 4k

Andeo1025 (Score: 1): I have an 07 and a 12. Both have been good cars. The k24, 5 speed auto combination is a proven reliable one. The biggest question is maintenance. If it was well maintained you should be fine. If it's got a lot of deferred maintenance that can get expensive."
1mhtxsz,"Current car is approaching end of useful life. Need advice on my next car, likely an EV","My current Vauxhall Corsa E (1.2L, 64 plate) is starting to cost me a significant amount in repairs and although roadworthy currently, I’m looking to move on before the mileage gets too high (currently at 80k so not terrible) or something more expensive breaks. 

I’ve been considering EVs as my biggest expense outside of bills is fuel. I mostly use the car for commuting (20 mile round trip) but do go hiking in the Lake District every month or two (90-135 miles each way depending on where I go). My new place will have EV charging and solar panels so I have the means to charge at home without much cost. 

What are my options? I’ve been looking at ID.3s and the Cupra Born but I’m not sure if there are any options in the price range I’m looking at (15-18k). I’d be buying in Spring 2026 most likely.",0,1754351771.0,3,CartalkUK,1754422792,2025-08-04 23:56:11,2025-08-05 19:39:52,"MountainPeaking (Score: 1): Hate to suggest it but a Tesla M3 is a good option here. They have by far the best range / charging network so for longer trips are great. 

You could also consider a PHEV? Sounds perfect for your use case. Something like a 530e etc would easily cope with a 20 mile commute then use petrol for those longer trips.

Competitive_Pen7192 (Score: 1): I know it's a Corsa but how is it reaching the end of its useful life?

Most cars with reasonable repairs can go to 150k and 15+ years old before becoming economically really unviable...

If you want a new car just say it. Something that's 11 years old and on 80k shouldn't be scrap, even a Vauxhall.

Negative_Link_277 (Score: 1): > My current Vauxhall Corsa E (1.2L, 64 plate) is starting to cost me a significant amount in repairs and although roadworthy currently, I’m looking to move on before the mileage gets too high (currently at 80k so not terrible)

How is that end of life? And what do you call significant repairs? 

> What are my options? I’ve been looking at ID.3s and the Cupra Born but I’m not sure if there are any options in the price range I’m looking at (15-18k)

Can you tell me what kind of mindset you need to have where spending £15,000-£18,000 to avoid a few hundred quid of repair bills and several hundred quid a year in fuel seems like a good idea?"
