id,title,selftext,score,created_utc,num_comments,subreddit,scraping_time_utc,created_datetime_utc,scraping_datetime_utc,top_comments
1njo9ol,Reverse camera,"My daughter is looking into fitting a reverse camera into her 2023 vw polo. It has a screen and sensors already, any ideas how much it will cost?",0,1758140742.0,4,CartalkUK,1758224065,2025-09-17 20:25:42,2025-09-18 19:34:25,"LazyEmu5073 (Score: 2): A decent kit which integrates with the original screen is costly. These list kit only price, or with install...

[https://www.carcommunications.co.uk/vw-polo-rear-camera-kit-5f-2070773028?language=en&currency=GBP](https://www.carcommunications.co.uk/vw-polo-rear-camera-kit-5f-2070773028?language=en&currency=GBP)

New-Assumption-3106 (Score: 1): Sorry to not help with your question but this post prompts me to ask why, oh why are ALL cars not fitted with reverse cameras and head up displays. It's basic and simple tech that has been around for DECADES. I just got a new (to me) car with a HUD and it's a game changer. No more looking down for my current speed, the speed limit, my next set of directions, my cruise settings. Also reverse cam of course.

Stunning-Squirrel731 (Score: -2): If she is fitting it then it won’t cost anything?"
1njnzy3,First car suggestion,"Hi All, 
I have recently passed my test and have 3 years of experience in other country. I am planning to buy a used car, could you suggest which one i can go with, i want cars similar to Ford focus or Astra. Budget is 7000",1,1758140120.0,5,CartalkUK,1758224065,2025-09-17 20:15:20,2025-09-18 19:34:25,"I_am_feel (Score: 3): A ford Focus or an Astra

Stunning-Squirrel731 (Score: 3): I would get a vintage wine, some cheese and a fiat panda

Demeter_Crusher (Score: 1): For you it will be all about the insurance costs. Get some quotes and see what is viable."
1njng5x,A £1200 repair?,"Really? £1200 for this tiny car park knock? 



Range Rover Sport SE - Main dealer quote",2,1758138839.0,44,CartalkUK,1758224065,2025-09-17 19:53:59,2025-09-18 19:34:25,"doc900 (Score: 22): £200-400 a panel seems to be what most people on here see being quoted per panel.
Personally I'd just get a touch up pen, it looks like a nice clean chip which is the easiest to get a good 5ft paint job with a pen by filling in the missing paint

Stunning-Squirrel731 (Score: 23): Where is the damage?

Stevenc15211 (Score: 7): Mobile can do that for like 60 quid"
1njne2o,Second car recommendations,"So family of 4, looking for a second car. Will do about 5000 - 8000 miles annually and I want something reliable for under 5 grand. I'm thinking a petrol one of the following, Honda Civic or Jazz or Toyota Auris or Yaris. I was just looking people's thoughts/experiences, opinions and alternatives ",0,1758138705.0,1,CartalkUK,1758224065,2025-09-17 19:51:45,2025-09-18 19:34:25,"queefmcbain (Score: 2): You're in the right ball park, I'm looking at a Civic myself. Avoid the 2012s, they drink oil. But practicality wise, they're ace"
1njncdi,Looking for recommendations for a smallish family car,"Been driving my Ford Fiesta for some years now, love it, but we now have an almost 3 year old who we seat in a rear-facing car seat in the back and I'm very aware he will soon need to become some sort of contortionist. Also, the front passenger seat is essentially out of action while the kid's seat is installed. 

I just want to fix those two issues and have a bit more boot space, that's all. Not looking for a giant SUV, but would massively appreciate some recommendations for a slightly larger car, especially from anyone who has also been in the market for a car with the intention of installing a rear-facing child seat. Also can't do electric.

Budget on the lower end, but would consider finance options if needs be, so recommendations more important for now. TIA!",0,1758138599.0,6,CartalkUK,1758224065,2025-09-17 19:49:59,2025-09-18 19:34:25,"who_can_ (Score: 2): Honda jazz! You’ll get any pram in the back too, (and the rest of the house that must now be carted everywhere!)"
1njmzwy,Family Car Recommendations Under £9k,"Hi all, long-time reader. I could do with some advice as I’m due for a car upgrade with our second child on the way. 

Currently have a Leon but need something bigger, mainly for nursery/school runs and the occasional weekend trip. I live within the ULEZ so it needs to be compliant, and ideally petrol rather than diesel due to all the time spent sitting in London traffic and only do about 6k miles a year. 

I’d prefer an automatic, but if there’s nothing ideal and reliable it’s not a dealbreaker. 

I’ve always liked estates for the space, but now I’m wondering if something with a higher seating position might be better for loading the kids in and out—especially for my wife who’ll be recovering from a c-section. 

Budget is around £10k which I know isn’t loads in this market. 

Any advice/ recommendations is appreciated! Thank you!",0,1758137801.0,3,CartalkUK,1758224065,2025-09-17 19:36:41,2025-09-18 19:34:25,"RustyU (Score: 3): >Currently have a Leon but need something bigger

Leon estate 😁

This_Distribution990 (Score: 1): Leon estate got one myself great family car, 
If you wanna go higher up don’t go for any crossovers get a proper suv, 
X5 , tourag, q5 
Any of the small crossovers are useless for space

redandbluedragoneyes (Score: 1): Go to any dealership with your partner and just sit and try estate, SUV, cross overs etc and see what you like.

once you found the size / style you like, then you can look for something within your budget. 

You do have the Leon estate, Passat estate, Octavia estate, all of these cars are made by the VW group.  
You also have the Auris estate a lot of taxi drivers use the hybrid one as they can put 300-400k on the clock before having to get a new car."
1njmg92,Do headlight restoration kits work more than once?,I mean for kits that deal with various scratches and sanding grits. Tia ,1,1758136526.0,2,CartalkUK,1758224065,2025-09-17 19:15:26,2025-09-18 19:34:25,"elliomitch (Score: 1): Yes

Alternative-Draw-578 (Score: 1): Yes"
1njl4za,Helping choosing a second hand car? Honda?,"Good morning!

I am moving back to France after 2 years abroad, and I need to buy a new car when I return. I live in the countryside so diesels are alright. I am English so would like the CarTalk UK opinion. 

After a long search, I'm going to buy a Honda.

I have 3 cars to choose from that fall within my budget (6-8k euros, yes car prices outside the uk are nuts), and of the whole market they are the only ones that fit my criteria of being fun to drive, reliable, and not too expensive.

To start there’s the Honda civic 8th generation from 2006-2011, with the bulletproof R18, 1.8L vtec petrol with 140 horsepower. Supposed to be fun, but it's starting to look a bit tired and dated.

The Honda civic 2012-2015 in 1.6L I-dtec diesel, reliable, super low fuel consumption, supposed to be less fun than the civic 8, but more modern.

And my favorite, which unfortunately is not the most spacious, the 2010 Honda CR-Z, 1.5L petrol engine with hybrid battery, reliable, fun, low fuel consumption, but essentially a 2 seater as the rear seats are useless. (IMA hybrid batteries last a long time, but in case of replacement between 700-1500).

I'm going on road trips next year, so I need comfort, but fun on twisty roads, and then for the future I have no idea, but I would like to buy a car that I can try and keep for 10 years. When it starts to be too dated I would like to keep it as a project. Most of the work I will do myself, and otherwise my mechanic is a Honda specialist, so good prices on that side too.

So here they are, I can't choose between the 3, and if ever please make suggestions for other options, I'm not against buying a jazz either.

Thank you!!

[View Poll](https://www.reddit.com/poll/1njl4za)",3,1758133575.0,10,CartalkUK,1758224065,2025-09-17 18:26:15,2025-09-18 19:34:25,"Bebecofp (Score: 1): The CRZ will hold more value.

Spot on, 8th will be more fun.  
That is the only argument between 8th and 9th.

I myself hold similarly question between a Volvo c30 Diesel or Petrol.  
So, diesel consumes less fuel and is cheaper to maintain.  
Petrol is not that much more expensive to maintain, a slightly more expensive to run. But it permits fun.  
I Just decided, Fun is price to pay that i would like to keep on my car.

queefmcbain (Score: 1): I've gone 9th gen purely because it's more comfortable than the 8th gen

NostrilWarbler (Score: 1): Have a 2010 1.8 civic. So much fun , very practical and been very reliable. Lots of fun to absolute horse it too"
1njktsr,Is the Clk230 Sport Kompressor coupe worth it?,"Hello, how's it going? I was interested in buying a Clk230 Sport Kompressor coupe, I am from Argentina and I wanted to know if it's a car with good mechanics or what the most common failures are, since I'm looking for a good car that doesn't have many complications, especially being from Argentina, a country where parts for vehicles like this are more complicated to import. Thank you.",1,1758132892.0,1,CartalkUK,1758224065,2025-09-17 18:14:52,2025-09-18 19:34:25,"Hostile_Duck69 (Score: 1): it's an old German car with a supercharger, it's going to cost money to maintain

if you really want simple focus on a car with less features 

I know if you wanted to keep with German cars Volkswagen made alot of simple but well built cars in South America, the Gol comes to mind"
1njkiiw,Do mobile speed camera hatchbacks exist in London?,"Was driving thru north London and passed a hatchback/smart car with 2 cameras on the roof and a camera label on the door.

Is this just a parking enforcement or do they monitor speed as well? ",0,1758132191.0,5,CartalkUK,1758224065,2025-09-17 18:03:11,2025-09-18 19:34:25,"stillanmcrfan (Score: 2): Could it be a contractor doing maps for the likes of google?

lvjamestervl (Score: 2): It will just be parking enforcement to catch people parking on yellow zig zags or cars going down roads they shouldn’t

na481 (Score: 1): Most likely parking enforcements, Ealing council have these vehicles."
1njkelq,Best bang for your buck car around 6.5k-7k,"I know these get posted a lot but I am struggling, so I appreciate any and all comments. Need something between 6.5k-7k can be lower as well ofc.

Preferences:  
\- comfortable  
\- decently fuel efficient  
\- I would prefer an auto but I know it is hard out there  
\- reliable  
\- petrol, hybrid, i don't care for diesels and want to go into ulez zones.  
\- good for rain, I want to feel safe driving it  
\- I drive on the motorway 2x a week and the rest of my drives are suburban, towns etc - I am in Scotland so it limits options a bit I've noticed - unless I want to travel 200+ miles.

  
Comfortable and safe are the most important to me, i hate how loud cars are on the motorway and want to be able to speed up safely to overtake/merge etc.

Many thanks!!",9,1758131978.0,40,CartalkUK,1758224065,2025-09-17 17:59:38,2025-09-18 19:34:25,"mysterylemon (Score: 18): Volvo V40 D4 seems to be a bit of a hidden gem in this price range.

180hp, 50+mpg and £30 road tax.  Theyre arguably one of the best looking hatches in recent times and it's a Volvo so safety comes before anything else.

queefmcbain (Score: 4): Honda Civic? I'm shopping for one in the same price range as you and it ticks all those boxes. You do enough miles to get one of the diesels as well and they're great engines.

1-Man-on_A-mission (Score: 8): Lexus RX- Hybrid

They will be older now, but are well screwed together. I think there was a facelift around 2010/2011. 

That's the one to go for. Try to get one with the glass roof, and light interior."
1njk7pu,Planning to save a disco 2,There’s a abandoned disco sitting on someone’s drive it’s a bit of a run down house and I’m not sure who lives there I might knock tomorrow and see what the deal is hasn’t had a MOT since 2022 went and passed without advisory’s what should I look out for and how much do I offer ,2,1758131571.0,1,CartalkUK,1758224065,2025-09-17 17:52:51,2025-09-18 19:34:25,"No-Translator5443 (Score: 2): Rust, look at YouTube vids I’m sure people have put guides on there for them as they’re popular"
1njjign,Is this too much body rust on this Miata NC?,"Looking to buy this NC miata at really good price for what it is, just passed inspection, no rust under the carriage, but somehow has rust on the body, no idea what happened here.

Would you buy this? Is this gonna be an issue in the next 1-2 years? How bad is it? Should I ask for my deposit back? Thanks!",1,1758130049.0,8,CartalkUK,1758224065,2025-09-17 17:27:29,2025-09-18 19:34:25,"zephyrmox (Score: 3): No rust on the underside but panel rust on an NC seems unlikely - have you seen photos of the underside?

Chance_Journalist_34 (Score: 1): Thats isnt bad.  Most NCs have at least this amount if not more unless they have already been repainted.  

Also, this isnt technically rust as the panels are Aluminium i think, its galvanic corrosion/reaction.

Though if you want to be confident in your purchase you really need to see underneath the car,   as that is where they are most rusty.

fireheed (Score: 1): That's just a wee bit of surface rust/corrosion. Nothing to concerning from the pictures and should be too bad a fix, or expensive."
1njj2gc,How to Do a Major Car Service – Oil & Filter Change DIY Oil Change Easy Way,"September is when I do my Major Service.
Oil & Oil Filter change. Air Filter, Fuel Filter & Pollen filter. Total cost was around £125 #Bosch & #Shell stuff.
This time I did the lazy oil change, threw in a can of #LIQUIMOLY as standard and the extra step of cleaning the MAF sensor. 

Closest service that was simular was over £300! 
I do an oil change in March, September full monty as its my MOT in October. 6 months apart and the weather is more ideal.

Thanks if you like the Video
https://youtu.be/LTJ_YVN6jCQ

#mot #service #car ",0,1758129073.0,2,CartalkUK,1758224065,2025-09-17 17:11:13,2025-09-18 19:34:25,"ashyjay (Score: 2): A major is more than just fluids, filters checking tyres and brakes, it's checking gators, ball joints, bushings, bearings and if it has them sparkplugs"
1njiwmb,"No V5C (well, it’s being withheld)","Hi all, bit stressed about this situation. I gave my car to a friend whilst I was serving a ban and I’m due to get it back this month (I have the car back, had it towed to a garage to be serviced as it hasn’t moved for a while) but my friend is not giving me the V5C or the spare key. Is there any way I can change the V5C back over to me without his details? I don’t know what address he would have put on the log book when I gave the car to him. I have a timeline of messages over the last year or so of us talking about the car and he worked for me using the car. I have the previous log book with my name on it from before I gave him the car. Can anyone give me some advice?


",0,1758128723.0,2,CartalkUK,1758224065,2025-09-17 17:05:23,2025-09-18 19:34:25,"This_Distribution990 (Score: 5): Logbook isn’t proof of ownership, by him keeping it in his name he’s just telling the dvla he’s liable for taxing it. And filling out any convictions associated with the car. Yeah you can fill out a v62 form

steadvex (Score: 1): V62 form, depending on the car you might be able to get the key programmed out so said friend can't reclaim the car with the spare "
1njimzu,What cars am I missing?,"My missus and I are recent homeowners in London and are looking for a ‘nicer’ car after my ‘06 Mazda died of rust at its last MOT.

I’ve had a look out and about on the roads/autotrader, and outside the Germans, the new Mazdas and the odd Alfa Romeo I’m often left thinking the more popular car designs don’t do it for me.

But yeah I’m in the market for a petrol hatch/small SUV for <£20k, and I’m at the point where I just want something that’s a bit interesting to look at, without breaking the bank.

For context, I’d say the new Mazda 3 hatch is the best looking car on the road atm, with more than enough engine for London so I’m leaning towards one, or maybe the slightly bigger CX-3. Also think these are best on value for £. But are there any other cars I should be considering?",0,1758128138.0,4,CartalkUK,1758224065,2025-09-17 16:55:38,2025-09-18 19:34:25,"Numerous-Paint4123 (Score: 2): CX-3 isn't any bigger in reality, its just on stilts. The 3 is miles better looking and will drive nice.

InViewOfNothing (Score: 2): The Mazda3 is a good car but honestly they're not that powerful and not as good on fuel as you might expect.

I'm biased but an F56 Mini Cooper S/JCW is a really good car imo. Service them (every 10k minimum) and they're very reliable, nippy, great to drive, and look a lot more interesting than half the copy paste shit out there these days. Interiors are very nice too"
1njiciz,Recommendations for first car,"Need a cheap low insurance first car and have some requirements.
I am 6,6 and not slender so the car will have to be large on the inside. 
I am a carpenter by trade and need space for tools and materials. 
Clean air zone compliant. 
Thank you for any suggestions. ",2,1758127489.0,4,CartalkUK,1758224065,2025-09-17 16:44:49,2025-09-18 19:34:25,"This_Distribution990 (Score: 1): Seat Leon estate ? 1.4 tsi, got the perfect car for ya pm me ;) nah it’s a great car can pick em up around 4-6k for something half decent

Doubleday5000 (Score: 1): What's your budget?

How large a car do you need? A Volvo V70 estate is pretty vast. An Skoda Fabia estate is small, but pretty capacious if you just need a couple of tool bags rather than 3m lengths of decking board. 

Also don't necessarily conflate the size of the car with being good for tall drivers. When I passed I was 6'4 and near 300lbs. Fit fine in a tiny Skoda Citigo as long as I stumped up for the higher trim and got the height adjustable seat. Adjustable seat and steering wheel are really important for me. Check [www.parkers.co.uk](http://www.parkers.co.uk) for detailed specs and options on cars. I've sat in much bigger cars that are less comfortable than that tiny Skoda.

Plastic_Length8618 (Score: 1): These two sound like good options for a first car becuse they’re often driven my middle aged people, rather than young drivers likely to
crash, so insurance companies think they seem less risky."
1nji1bz,What's it like driving a car with no technology in 2025?,My first and only car had a reversing camera and parking sensors so parking wasn't an issue and I don't think I could live without them now. I don't think I have ever driven a car with no kind of rear camera (even during driving lessons) and (definitely) I couldn't park without them. It's always felt weird not being able to see directly behind your car as you could easily miss a cat / small kid / other things you don't want to reverse into. But I am considering selling and buying a more spacious car with some more horsepower - but that would come at a cost of getting an older car without stuff like that. Would it be much harder to drive and easier to bump into stuff?,95,1758126794.0,379,CartalkUK,1758224065,2025-09-17 16:33:14,2025-09-18 19:34:25,"neukStari (Score: 430): Refreshing, brilliant, fantastic, sexual.

Forsaken-Original-28 (Score: 44): Older cars are often easier to see out of so reverse cameras aren't so important 

mixmasterboaby (Score: 120): Got a 23 year old Mk2 Renaultsport Clio. Doesn’t have traction control, ABS or air con, let alone modern things like touch screens etc.

Wouldn’t change it tbh. When this one dies I’ll get another 172 or 182.  
  
Small cars are easy to drive even without cameras etc. it depends on what you’re looking for, personally I just want something fun, fast and cheap(ish) that focuses on driver experience."
1nji06o,Where do Kia/Hyundai sit in the manufacturer reliability list?,"I know there will be reliability statistics on this, but I’m just curious to know what people on this sub think.

People often say that Japanese cars (specifically Toyota/Lexus) are the best in terms of reliability.

Historically, people always said German cars were the most reliable, although I gather that’s less true nowadays.

At the other end of the reliability spectrum, you’ve (sadly) got the British manufacturers like Vauxhall and JLR. These really don’t have a good rep on this sub.

Then you’ve got everything in between - your French cars, Italian cars, the list goes on.

So where exactly do the South Korean Kia/Hyundai go in terms of reliability? I can’t say I’ve ever heard anyone say “don’t touch a Kia or Hyundai”, so would you put them closely behind the Japanese, or more middle of the pack?",2,1758126722.0,21,CartalkUK,1758224065,2025-09-17 16:32:02,2025-09-18 19:34:25,"Ambulance4Seiver (Score: 5): I usually refer to [this *What Car* reliability survey](https://www.whatcar.com/news/most-and-least-reliable-used-cars-brands/n21160), since it covers cars more than five years old, i.e. mostly out of warranty.

They score very well, if not as good as the best Japanese.

This also aligns with my personal experience; owned a six year old Ceed for four years and 70k miles, girlfriend had a seven year old Picanto for five years and 50k miles, mother's had three Picantos in a row, and her partner has had a Ceed and a Rio.

I feel like they're almost as reliable as the Hondas I've had, although more prone to niggling wee faults like the passenger side window not working, or a button on the steering wheel becoming temperamental. Nothing that will ever leave you stranded.

They also don't have the same indestructible-even-when-neglected feeling that the best Jap bangers have; they do like to be properly maintained.

racerjoss (Score: 3): I’m not sure. Lots of people rate them, but their rep in the USA is fairly poor.

I wouldn’t put them alongside Toyota, but they are probably more like mid-pack.

colin_staples (Score: 2): I have a Kia Ceed. Bought it 4 years ago, used (it was 6 years old then, with a year warranty left). It’s 10 years old now, has 100k miles.

Has been faultless * and feels like a 4 year old car

*the reversing camera got some water in it and they replaced it for free as it was still within the 7 year warranty"
1njhsp4,"Thoughts on car S cars? Would you buy one, any idea what the insurance uplift is like?","Used to be pretty straight forward in the past written off etc. But now car S and car N seem a little ambiguous. Especially with cars getting written off by insurance for what seems mostly cosmetic repairs.


So yeah, would you buy one? 
Does insurance penalize you massively for having one? 
Can you sell or trade them in? 
",0,1758126266.0,1,CartalkUK,1758224065,2025-09-17 16:24:26,2025-09-18 19:34:25,Aidenk77 (Score: 2): I’d probably buy a Cat N if the price was right but I’d give Cat S a swerve.
1njhone,What is this camera?,This is located on Lewes road Brighton. Can this device get one done for going through a red light? Anyone gave knowledge/experience with them? Tia ,0,1758126030.0,7,CartalkUK,1758224065,2025-09-17 16:20:30,2025-09-18 19:34:25,"llamaz314 (Score: 5): If they catch you going through a red you're done. The top part is a deadly laser (think Death Star but even more powerful) that beams anyone who runs a red and instantly explodes their car. They take these things seriously in Brighton.

BlazinPBo (Score: 1): It's an ANPR camera. Unlikely to have anything to do with the lights. More for Police etc. to use if they need to find a car. Camera will read the plate and have a timestamp for when the car passes by.

Diligent-Repair-3129 (Score: 0): Also this road is a red route and had bus lanes going in both directions but red light is the main concern. Any and all advice welcome"
1njhmsb,How much does it cost to swap tyres between wheels?,"Hi, I have fitted a new set of tyres all 4 tyres last month but I just bought a set of rims with old tyres on. Just wondering does anyone know what the garage or fitter usually charge to swap to new tyre to another set of rims?

4x **A** Rims **A** Tyres & **B** Rims **B** Tyres ---> **B** Rims **A** Tyres, **A** rims takes home **B** tyres dispose.

Thanks",1,1758125920.0,7,CartalkUK,1758224065,2025-09-17 16:18:40,2025-09-18 19:34:25,"ringobringoo (Score: 1): probably £30-£80if they also need balancing

PeiMeisPeePee (Score: 1): do you just want the tyres swapped or the rims balanced as well?  5 quid a tyre without balancing should cover it."
1njh8hl,MOT advisories,"Hello, I bought this car (2012 Audi A1) one year ago and had my first MOT done today, and passed but got these advisories. The last 3 MOTs passed with no advisories. Are these things I should be concerned about/need to fix? I've read rust can be pretty bad but can also just be from overnight rain (it's been chucking it down all week), how fucked am I?

Cheers",1,1758125053.0,2,CartalkUK,1758224065,2025-09-17 16:04:13,2025-09-18 19:34:25,"bothermoard (Score: 2): overnight rain may leave some surface rust on your brake discs yeah, but your advisories point to the whole underside of the car being corroded which will have been happening for some time. This is not good and your car likely will need welding in the next year or two as rust will just continue to spread.

SAUCE_B055 (Score: 1): A night of rain won't cause this level of rust lol.

Sounds like this car has lived on salty roads for most of it's life. Ultimately none of these were deemed bad enough to fail and won't have appeared in a year so whoever did the MOT previously deemed them not an issue. Maybe the first 4 could lead to concern but I'd keep driving it until it fails on one."
