id,title,selftext,score,created_utc,num_comments,subreddit,scraping_time_utc,created_datetime_utc,scraping_datetime_utc,top_comments
1ov48wl,Mercedes ML / GLE - better quality lug bolts?,"My MIL has a 2024 ML 350, and I change her winter and summer rims. The original flower shaped lug bolts swelled up after 5 or 6 years, and it was difficult to get a socket on them. She then bought a set of aftermarket lug bolts with a regular hex 17mm head, and after only 2 winters they are swelling again. Every single bolt is a fight to get the socket on, then take it off.

Does Mercedes sell good quality regular hex 17mm bolts? I have had VWs with 17mm lug bolts for over 20 years and this issue has never happened. I'm hoping to find an alternative...

https://preview.redd.it/jisdh7yoot0g1.jpg?width=3024&format=pjpg&auto=webp&s=934b2d7d86a724a638864d3ec8889d978865d9c5

",1,1762951765.0,3,MechanicAdvice,1763062547,2025-11-12 12:49:25,2025-11-13 19:35:47,"ihatewrenching (Score: 1): Benz sells a black set that don’t do that, a parts department should be able to help you, just make sure they are the same length. Here’s what they look like idk if that part number applies to ur car I just ripped it off the internet to give you a visual.

https://preview.redd.it/u0kmmirowv0g1.jpeg?width=1600&format=pjpg&auto=webp&s=7328c2bcfe2787efdb9b78062f58cf06983992ed

The star ones swell cause of the chrome and tech ur supposed to use a special socket as a 17mm can damage and swell it but its gonna swell eventually anyway."
1ov46gg,Is this oil or could it just be because my car is old this is my coolant reservoir .,I drive a 2004 v8 cadalac srx I noticed more smoke then usual from the exhaust but its also always 40f or lower outside so I thought it could just be the cold and I never let my car warm up all the way I only drive short distances so I thought it was just condensation. Am I in trouble or could it be nothing.,1,1762951568.0,15,MechanicAdvice,1763062547,2025-11-12 12:46:08,2025-11-13 19:35:47,"SignificantDrawer374 (Score: 2): Yes, it's just condensation, like when you breathe out in the cold

DominantGoblin (Score: 1): https://preview.redd.it/5r1sryospt0g1.jpeg?width=1868&format=pjpg&auto=webp&s=158d5e39b797fbcd417fa73e89b44857280327a4"
1ovlc4h,Does anyone know where this oil could be coming from? 2009 ford focus,,2,1762990518.0,11,CarTalk,1763062547,2025-11-12 23:35:18,2025-11-13 19:35:47,"TheFredCain (Score: 5): If it didn't spill recently from the opening, then it's very likely the valve cover gasket.

ddoherty958 (Score: 3): Could have spilled during filling. Was it changed recently?

SudnlyStrukDead (Score: 3): Going off pic 3 it’s 100% the valve cover."
1ovi4jq,"1995 Bronco XLT 5.8l starts normal but idles like shit, is it a vacuum issue or am i cooked",,1,1762983002.0,2,CarTalk,1763062547,2025-11-12 21:30:02,2025-11-13 19:35:47,"Mundane_Trade_9167 (Score: 1): Knowing how brittle the vacuum lines are on those, I would definitely start there. I had a 93 that if you looked at one of the lines, it would crack"
1ovhvo9,CODE PO 171,"I was wondering does anyone know if there's a program out there that can help fix vehicles for low income. 
I need to get to work I can't keep using my mom's vehicle. 
I put the FIXD into the car and it came up cold p0171 on Monday I was driving 80 miles from Tracy to Stockton and when I stopped the car I look back it was like steam coming from the right side from under the hood. My sister said that's normal but I didn't feel like it was normal and had a funny smell a couple hours later I had to take my daughter to work so I put the FIXD in and that was the code that came up I tried to get a payday loan but I couldn't and mechanic said was going to be $140 just to look at it in a couple weeks ago I just got an alternator. I know they say Ford stands for found on road dead with this car is mine and I can't afford to make payments. I need to get to work.",1,1762982447.0,1,CarTalk,1763062547,2025-11-12 21:20:47,2025-11-13 19:35:47,Bomber_Man (Score: 1): Lean code is no bueno. If it isn’t fixed you have a significant chance of eventual engine damage. Steam from under the hood is worrysome as well as it sounds like it might be a coolant leak which would be an additional unrelated issue. Sounds like finances are tight. So much so that you can’t get a payday loan? So no good credit? Might be time to organize an alternative transport option of some sort. As the current situation sounds untenable.
1ovhqtn,Is the transmission F’ed?,"This is a 2013 Mercedes GLK with the diesel bluetec engine. It has this issue where in reverse it’ll do this when you try to accelerate. You’ll hit the gas and the engine will just rev in one place then suddenly catch and jerk the car really hard. It doesn’t do this in drive. I noticed it gets worse when it warms up. I was wondering if this is fixable or the transmission just needs to be replaced? I heard these transmissions are pretty reliable. 

Also on a side note, it says the auxiliary battery needs to be replaced which I already did replace it so I’m not sure if something needs to be reset? The weird thing is whenever I try to scan it with my scan tool, it’s never able to communicate with the ECM no matter how many times I tried. I’m not sure if the computer in this thing is just damaged. ",0,1762982141.0,2,CarTalk,1763062547,2025-11-12 21:15:41,2025-11-13 19:35:47,"VegasLatinaXO (Score: 1): Honestly doesn't look that bad, maybe just need a few tweaks.

zalsrevenge (Score: 1): I'd say it's fucked."
1ovflu0,Wheel alignment,"I found a good price for my wheel alignment but the dealership man told me that I should get new tires (he doesn’t mean from them he means in general) before getting an alignment 

Is that true? My wheels do need to be replaced again soon but I really feel like the issue is the alignment. ",0,1762977358.0,3,CarTalk,1763062547,2025-11-12 19:55:58,2025-11-13 19:35:47,"1sixxpac (Score: 1): You may well need parts, tires and an alignment. 
There are many perishable bushings, bearings, etc in a front end that will wear. 
A good shop will find any issues and let you know what they are before performing an alignment.

_clever_reference_ (Score: 1): There's no way for us to know if you need tires, wheels, or other components with such little info.

abusche (Score: -1): wheels or tires? you say both. no, it makes no diff what tires you have on when the alignment is performed."
1ovbp6h,"2014 Camaro 3.6L alternator replacement, buy part myself or let shop handle it?","

My 2014 Camaro 3.6L needs an alternator. The shop I go to quoted about $950 total for parts and labor, which feels steep. When I searched around, I found what looks like the OEM part number 22888109 listed on GMPartsGiant for $371.

Has anyone ordered from that site before? Are they legit GM parts? Thinking about buying it myself and just paying a local shop for the install",0,1762968978.0,5,CarTalk,1763062547,2025-11-12 17:36:18,2025-11-13 19:35:47,"DaveLDog (Score: 3): Many shops won't install customer provided parts, none will provide any type of warranty if they do. If you're going to do the install you can purchase from any reputable store, or a non reputable one if you prefer.

1sixxpac (Score: 2): Any job you don’t want to do twice it’s best to buy a quality part. 
Or make sure your shop has a parts/labor warranty. 
Never bring your part to a mechanics shop. 
Just my personal experience

MapleSurpy (Score: 1): Have had over a dozen problems with GMPartsGiant.com and similar non-actual GM dealer websites. If the item isn't actually in stock (EVERY ITEM SHOWS IN STOCK) they just put it in ""processing"" forever, don't call you, and you have to blow up their email to get an answer. They also use the shittiest shipping possible with wrong or missing tracking and don't take returns even if the part is broken. 

Not to mention most shops won't take your parts, and if they do they increase their labour rate (since they can't make markup on the part anymore) and give you zero warranty on the repair.

Looking at my part cost on that, and the labour time, + coolant & bleed (need to remove a coolant pipe to get to it) costs, you MAY save $50 if a shop says yes, but again...no warranty."
1ovbj9t,Vibration and sound coming from front wheels?,"Been hearing kind of a whooping, grumbling noise from the frotm left tire as well as strong vibration you can feel it on your feet on the driver side. 

What do you think the issue is?

https://imgur.com/a/Aw8niSn",1,1762968614.0,1,CarTalk,1763062547,2025-11-12 17:30:14,2025-11-13 19:35:47,Patrol-007 (Score: 1): Bearing? 
1ovb837,Any advice on fixing this dent at home?,"I got this weird looking, lined dent on my fender. I've heard of at home methods to fixing dents (ex. hot water & plunger) but I wanna hear from people with more experience than me. I'm kinda tight on money, so I'd want to at least try a DIY fix, and if that fails, I'll take it to the shop. I plan on fixing the scratches with sandpaper and touch up paint. Not looking for perfection, but this is driving me crazy lol. Any help or advice is appreciated!!

https://preview.redd.it/7oi5pcz21v0g1.jpg?width=4284&format=pjpg&auto=webp&s=7a299a3e9eda94d5056ab3393f2583d9ed9ba986

https://preview.redd.it/3idricz21v0g1.jpg?width=4284&format=pjpg&auto=webp&s=2e6cb9dd69b1f62043cb56602db009fece5e433d

",0,1762967938.0,2,CarTalk,1763062547,2025-11-12 17:18:58,2025-11-13 19:35:47,"Equana (Score: 2): That is not a DIY fix. None of the YouTube or TikTok magic will work with that dent and paint damage.

Turn it into your insurance and get some estimates for repair.

ahj3939 (Score: 1): I would leave the scratches alone and call someone for paintless dent repair. I wouldn't file insurance claim, PDR isn't going to be too much more then your deductible."
1ovan8i,Working outside after having had shop access for years SUCKS.,"Worked at a Honda dealer for 4 years, got out and started going to school to fix planes a couple months ago. I still take on side work every now and again to put cash in my pocket, but working in the parking lot again reminds me of how much I need a garage of my own. I live in a townhouse without so much as a driveway. I've done a fair bit if repairs out in the parking lot, but none are very pleasant.

Today I'm doing the timing belt on a 2014 Honda Odyssey for a close friend of my brother. He bought the car for his wife a couple months ago and it was pretty much perfect except for being due for one. It is 100% doable as a weekend project (I estimate it will take me 3-4 hours total, granted I've done over 100 of these), but working in the elements isn't the best. I'm in Maryland where the temperature fell off a cliff a few days ago. What I'd give for indoor space of my own for jobs like this. I'll definitely have the money for a house with shop space once I get started in aviation, but that's still 1.5 years away. In the meantime, I gotta slum it. ",275,1762966756.0,76,CarTalk,1763062547,2025-11-12 16:59:16,2025-11-13 19:35:47,"trivletrav (Score: 122): GOT THEM SOFT HANDS FROM THE LIFT, BOY! lol yeah parking lot work blows.

chanarang (Score: 31): Yea I'm lucky I have a driveway to work in, but having a lift was so nice.  Also I hate that I have to pay people to do alignments and tire mounting/balancing.  10+ years of being able to do it myself was awesome.

Dirty_Old_Town (Score: 9): I have access to a shop still, but whether or not I can use it for my own jobs depends on how well I'm getting along with my boss.

Agree 100% that working outside sucks."
1ov99ni,"Hello, is this a wheel bearing or a tire noise ?",I dont know wich would be the faulty component,1,1762963705.0,2,CarTalk,1763062547,2025-11-12 16:08:25,2025-11-13 19:35:47,"postitpad (Score: 4): If you’re not sure swap the tires around. If it’s a tire the noise will follow the tire. If it’s a wheel bearing it won’t.

ImTheRealMarco (Score: 1): I'd say wheel bearing since I just had one fail on me and it sounded just like this, made everything seem louder, which I just assumed was tire noise. Spoiler alert, it wasn't just tire noise.

Other than that, I have no clue, not a mechanic or anything."
1ov7evw,Bad/Slow O2 Sensor?,"I had to replace my cat as the pipe split open and started to get noisy, about a month later I get a check engine light.  First time doing any logging to identify an issue like this.  I noticed during the logging the Bank 1 sensor 2 is very slow to respond, or doesn't respond at all like the Bank 2 sensor 2 is, I assume these should be fairly in line with each other?

The bank 1 cat was replaced.  Am I good to start with a bank 1 sensor 2 replacement first?  Should I replace both O2 sensors in the bank?",2,1762959587.0,1,CarTalk,1763062547,2025-11-12 14:59:47,2025-11-13 19:35:47,"traineex (Score: 1): I'm not the best w data, but next step for me, check specs for b1s2 , possibly here charm.li

If its out of spec, r/r w oe or oem. Looks like its intermittent no signal from b1s2, its easier in person/w more experience"
1ov6t4f,Is this still salvageable?,"To cut it short my dad scraped my car while trying to reverse park in our garage. I am a first time car owner so I have no idea on how to fix this and my dad has never scraped our other cars until… today. So both me and my dad have zero idea on what to do but to go to the car repair shop which im sure will be expensive. I asked my friends and they just told me the same thing to just go to a car repair shop. 

The scrape isnt that deep in my opinion but it is very noticeable.. I did some quick research which suggests to apply color matched filler paint pen and polish it by sandpapering it?

What do you guys think? Will it be much costly if I DIY or shall I leave it to the expert? 
",0,1762958212.0,9,CarTalk,1763062547,2025-11-12 14:36:52,2025-11-13 19:35:47,"Mememaker123459876 (Score: 3): It’s is just take it to a body repair shop and they will tell you how much it costs

Kay_Cowgirl (Score: 1): Buff it out (like actual buffing wheel) and get a touch up paint pen from auto store. (Make sure to have the paint code of the car).

Effigy59 (Score: 1): You’ll never be able to make this look ok if you’ve never done it before. Last time I did this it cost $1500 to fix but the end result was absolutely perfect."
1ov63aa,What could this sound be while turning?,This sound isn’t very loud at the moment. It’s on the driver side and happens when I slightly turn the steering wheel to the left. It’s slightly high pitched. ,1,1762956501.0,2,CarTalk,1763062547,2025-11-12 14:08:21,2025-11-13 19:35:47,"Efficient-Display721 (Score: 1): Check power steering fluid level


What's the year make and model of the vehicle "
1ov598e,Mazda CX-5 rims on Toyota Highlander,"I have been searching around for another set of wheels and winter tires for my wife's '21 Highlander. Found some from a '14 CX5 that should fit with some hub centric rings. However I wonder about the wheel load rating.  The Highlander GVWR is 6000 lbs, and according to Google the CX5 is 4500 lbs.
Anyone know what the factory mazda wheels spec to?",1,1762954421.0,1,CarTalk,1763062547,2025-11-12 13:33:41,2025-11-13 19:35:47,Patrol-007 (Score: 1): The dealer 
1ouz51g,Can You Use a Full 5L -35°C Washer Fluid in Cold Regions? (Europe/North America),"In the cold regions of Europe and North America, how do people usually use windshield washer fluid? I noticed that most antifreeze windshield washer fluids sold in Nordic countries are rated for -35°C, and they often come in 5L containers. Do you typically use an entire 5L jug in one fill-up? If not, do you store the leftover fluid inside the car? If possible, please share your car model!",1,1762933665.0,40,CarTalk,1763062547,2025-11-12 07:47:45,2025-11-13 19:35:47,"mrcandyman (Score: 4): I have a case of 4 3.78L jugs in my car right now that I use to refill my 4 vehicles. I don't usually use the full jug in one go, no. I just fill it to the max lines. Also, the stuff I get is [rated for -45C](https://www.canadiantire.ca/en/pdp/rain-x-clearview-winter-shield-windshield-washer-fluid-45-c-3-78-l-4-pk-3999298p.html?rq=washer+fluid)

billp97 (Score: 6): they sell it by the gallon in north america. ive never seen -35c fluid. where im at in eastern PA -25F is the lowest rating youll find in the average auto parts store. i always get -25f rainx orange and run it all year because theres no reason to switch to a summer only formula. personally i fill the reservoir as much as itll take and put the bottle in my garage. i take my car through a touchless wash if its above 40 and clean my windshield when i get gas in the winter so i dont go through more than a gallon of wiper fluid a year. 24 wrx

OS420B (Score: 2): You get both pre mixed and concentrate and in various container sizes.

If it's possible, it's always smart to store a little extra in the car, as you can suddenly run out if it's really grimy outside.

If a full 5L can be emptied into the reservoir really depends upon the car itself and the amount that is already in, some have smaller, some have larger. But most with a level sensor and warning lamp in the gauge cluster tend to warn premature anyway, so you'll often have a little more to spare at the end.

If I purchase a pre mixed, I prefer the smaller bag styles instead, as those are easier to store in most trunks."
1ouwmdf,Jeep Engine Knock?,Hello everyone! 2021 Jeep Grand Cherokee. Today I have noticed unusually low RPM during idling(500-600). Later tonight I have noticed a scary sound that sounds like engine knocking. Is that the bearing rollers on the camshaft rocker arms or is it something much worse? Is that so or am I being paranoid? Please help! Thank you ,1,1762924655.0,1,CarTalk,1763062547,2025-11-12 05:17:35,2025-11-13 19:35:47,"ObligationGlobal2633 (Score: 2): You should start with checking for excessive valve lash, could just be a noisy valve-train that needs adjustment"
1ouua6d,"06 Camry US, does my car have am immobilizer?","Trying to figure out if my car has an immobilizer, it seems like they were standard in the 06 Camry, but I don't have the security light like shown in the manual. Is this a transponder key?
",2,1762917515.0,8,CarTalk,1763062547,2025-11-12 03:18:35,2025-11-13 19:35:47,"Paulywally042 (Score: 8): Per the brochure for 06 Camry, the engine immobilizer on a 2006 is standard on SE V6 and LE V6 and came with that and an alarm system standard on XLE.  The four cylinder SE and LE versions do not come with an immobilizer. Your key head also looks smaller than the ones that have an immobilizer. 

I’d venture an educated guess that you do not have a transponder key requirement.

Appropriate_Strain94 (Score: 3): That key is NOT an immobilizer type so the answer is no.

kyden (Score: 1): Probably not if you don’t have the light. I think it was only the xle and the se that had immobilizers."
1outjpl,Is it worth it?,"Hey y’all! I wanted to share my 2005 Chevy Tahoe z71. I know it’s stupid asking about this on Reddit but id love some input from people who may have been in my shoes.
I’ve owned this, what I’m going to call a “truck”, truck, for the last year and a half personally now myself after purchasing it off of a family remember rather than let it go off to someone else. It’s sitting at 167k on the odometer which isn’t too bad, but it’s got its issues. It’s going to need a paint job and body work eventually, it makes a couple weird noises here and there, and well- it’s got a 4L60. The thing is, it’s been around since I was a lil kid and I’ve made so many memories that I want to be able to share to my future kiddos, but at the end of the day, is it worth holding onto it for that long? I’m almost 20, within the next few years I’ll be making more and can get an arguably far better project for my interests like a 3rd Gen 4Runner for instance.  
What do you guys think? Has anyone else been in my shoes and just didn’t know if it was right to let it go or hold on?",0,1762915467.0,3,CarTalk,1763062547,2025-11-12 02:44:27,2025-11-13 19:35:47,"EastClevelandBest (Score: 7): If you got the money and want a 4runner then get a 4Runner. 


Financially wise, it is better to keep fixing up GMT800

FarmerRonnie (Score: 2): Dump the money in it if you wanna have it around for awhile."
1outbr3,Still can’t figure out this starting issue,"I’ve been chasing this problem for a while. The car cranks fine but sometimes struggles to start, and once or twice it died right after ignition. I replaced the NGK plugs, changed the Denso fuel filter, and even checked the alternator output. Still, the issue kept coming back, so I finally took it to a local shop.

Big mistake. They charged me around $180 for a few quick tests, said everything was fine, and sent me home with no real answer. After wasting time and money there, I figured I might as well check things myself. The battery is an older Panasonic, so it might be getting weak. I’ll start by checking voltage with a multimeter, and if that doesn’t help, I’ll use the BT100 to run a full battery test. Honestly, that’s probably what I should have done in the first place.

Anyone else learned the hard way with unreliable shops, especially on older Lexus models?",19,1762914858.0,8,CarTalk,1763062547,2025-11-12 02:34:18,2025-11-13 19:35:47,"CanoegunGoeff (Score: 6): Pull the computer and look for leaking, swelling, and/or corroding capacitors. 

90s model Toyota sedans tend to have the capacitors fail, often causing random stalls, no starts, misfires, mis-shifting, ghost codes, low power, etc. 

I had a 97 Avalon with the same 1mzfe that needed a computer to solve misfires, fluctuating fuel trims, and stalls. 

My 96 Camry has also had the ignitor circuit capacitor fail, causing a p1300, misfires, stalls, no starts, and a slipping auto trans. 

Also just replaced a computer in my buddy’s 04 Tacoma yesterday, again, for random stalls and no starts, ghost codes, circuit low voltage in several circuits, etc. 

Check the ECM. Very common issue for these at their age now.

airfryerfuntime (Score: 2): If it cranks fine, why are you so concerned with the battery?

This sounds like a bad fuel pump. Get a fuel pressure tester. There should be a schrader valve on one of the fuel rails.

LuckyMinusDevil (Score: 1): Sounds familiar. My 2001 ES had almost the same issue last winter and it turned out the battery was just getting weak in the cold. Once I swapped it, the hard starts disappeared completely."
1ousec7,"2002 grand marquis LS 51,800 miles.",keeps throwing the abs light and the brake light but will go off randomly.  Doesn’t seem to be the fluid level. Abs module I’m assuming ? How do I check that? Voltage meter I assum,4,1762912305.0,5,CarTalk,1763062547,2025-11-12 01:51:45,2025-11-13 19:35:47,sagalez (Score: 1): Start by checking the wheel speed sensors and connectors. They can trigger both lights if dirty or corroded.
1ourweb,Is there a simple way to fix this? What might be the cause? On the bottom of the rear.,"I have no clue how or when this happened, I haven’t hit anything and I just noticed it. Do I have any hope of fixing it myself? :(",0,1762910933.0,2,CarTalk,1763062547,2025-11-12 01:28:53,2025-11-13 19:35:47,"cerbera79 (Score: 2): I have no idea what this is an image of.

muskratsincopenhagen (Score: 1): Looks like a shopping cart or something scratched it. It won’t go away but you could maybe lighten it with the Maguires scratch remover"
1ovhkpl,"First-time buyer — dealership delays and new issues popping up before I can even pick up the car (2013 Dodge Avenger SXT, 60k miles, ~$9k total","I’m in the process of buying a 2013 Dodge Avenger SXT (or STX, depending on the trim) with about 60,000 miles on it for around $9,000 total from Northtown Hyundai.

Last Friday I test-drove the car and really liked it. The salesperson (Issac) said there was a knocking sound when the heat was on — supposedly just the blower fan — and promised it would be fixed that same day.
Then the delays started.

Monday: He said the repair still wasn’t done.
Tuesday: He told me they had to send it to Dodge because it wasn’t actually the blower fan after all.
Wednesday: I was told the car was finally ready, and we set a 3 p.m. pickup time. I even left work early and was on my way when he called to say the ABS light came on, so I couldn’t take the car.

Now it’s been almost a week, and the car’s still at Dodge. He keeps saying he won’t deliver it until the light is fixed (which I appreciate), but between the multiple overlooked issues and poor communication, I’m starting to worry about the car’s overall quality. Especially since he originally bragged that Hyundai “doesn’t put anything on the lot that isn’t quality.”
I still want this exact car — it’s under my budget and fits what I need — but at this point I’m thinking about:

Asking for a pre-purchase inspection at my own mechanic before signing anything.
Requesting some kind of price adjustment (maybe a few hundred off) for the delays and missed work time.

Is this reasonable? Should I still move forward with this car if they fix everything, or is this a sign to walk away?",1,1762981762.0,11,carquestions,1763062547,2025-11-12 21:09:22,2025-11-13 19:35:47,"azgli (Score: 6): Walk away. It's a Dodge and these are just the start of the issues. 

JDMdoode- (Score: 4): Don’t walk away. Run away. Roller skate away. Anything quicker than walking. 

This is just the start of your problems if you pay $9k for a used Dodge that’s over a decade old. 

Save that money, buy a Toyota or a Honda and thank me when you see a Dodge on the side of the road."
