id,title,selftext,score,created_utc,num_comments,subreddit,scraping_time_utc,created_datetime_utc,scraping_datetime_utc,top_comments
1ozwow6,21 jeep grand cherokee massaging seat bladder swole,"(chevy tech here) Got into my car and noticed the massaging seat bladder on the passenger side was swollen all the way up. Popped the back off, disconnected air lines and bled the system just so the seat is usable. Is this a valve issue or a module issue?",1,1763423843.0,20,MechanicAdvice,1763494543,2025-11-17 23:57:23,2025-11-18 19:35:43,"starrpamph (Score: 2): This is getting dumb..

CurrentlyatBDC (Score: 4): You can only fix by replacing the massaging seat module. ‘Module’ in this system contains the controller & all of the pneumatic controls ie it’s an all in one design.

(CDJR guy here)"
1ozwmls,2005 honda Rincón cross connected jumpers,I cross connected jumper cables and now there are no lights on the console when I turn the key to on. Blown fuse somewhere? Where would I find that fuse? Battery is in rh rear wheel well. Help please!,1,1763423682.0,2,MechanicAdvice,1763494543,2025-11-17 23:54:42,2025-11-18 19:35:43,"LWschool (Score: 1): It may have fried something called the Fuseable Link, which is like the main connection from the fuse box to the cars electronics. It’s designed to take big-failures (or mistakes like this one) and not fry every single fuse."
1ozwenz,Needing help!!! 1995 Chevy truck 1500 real head scratcher.,"So I bought a 95 Chevy 1500 and it ran like shit, barley got it home, I got it home and we got it running fairly good on start up if you didn't hold down the gas and keep it above 1500 rpms it would bog down and then die but when you got it to run it ran perfect and drove just fine. I put a new fuel pump/filter, distributor, spark plugs, ignition coil, icm, and battery well I let it sit for above 8 days and now it will not start at all it will try to start but won't. We keep resetting the timing but once we turn it over the distributor button will go from pointing to plug wire 1 to wire seven even though the notch on the harmonic balancer is in line and the 1 piston is all the way up. and it is now taking turns backfiring from the exhaust and the carburetor. Any suggestions ",2,1763423115.0,3,MechanicAdvice,1763494543,2025-11-17 23:45:15,2025-11-18 19:35:43,"trampstampjack (Score: 1): You might have to pull distributor back out an check gear on bottom, or possibly the gear that turns it. Maybe broke a tooth on first start. That's the only thing I can think of that might cause distributor to turn as you say. Or if vacuume advanced make sure all lines are secure, hole free, an clear. Any diaphragm, pump, valves are working correctly. Been a long time since I had to work on anything that old. Hope it helps, good luck.

LostGeezer2025 (Score: 1): I doubt your timing method is doing you any good at all, especially if you're still using the stock ESC, neither is hammering it with the parts cannon :(

It's been a few years, and while the forum is on its last legs the manual and tech document page is still functioning for the moment if you're willing to learn.

[https://67-72chevytrucks.com/vboard/showthread.php?t=700011](https://67-72chevytrucks.com/vboard/showthread.php?t=700011)"
1ozw8xz,Need help identifying this NOISE!!,2015 BMW X3 2.0L,1,1763422703.0,2,MechanicAdvice,1763494543,2025-11-17 23:38:23,2025-11-18 19:35:43,maxedoutshawty (Score: 1): probably a wheel bearing
1ozw7ed,Just wondering if anyone could possibly know what’s up.,"Hello everyone, I’ve got a 2015 Dodge challenger SXT, so the 3.6 liter penistar V6. And recently I’ve been feeling weird things, like just now I filled up on the normal 87 gas that I always get. Then maybe 2 minutes after filling it up I’m sitting at a stop light and I can feel my engine do something, it’s like it’s vibrating. But it’ll do that for a couple of seconds and then just stop and go back to normal. I do my usual oil changes, I do everything I’m supposed to but I’m not sure what could be wrong. Could it be fuel? Or is it just because the engine has so many miles on it now. (I’m about to hit 150k) ",1,1763422593.0,7,MechanicAdvice,1763494543,2025-11-17 23:36:33,2025-11-18 19:35:43,"Outrageous_Tie4997 (Score: 1): To add to the post this also randomly happens, it’s not just after I fill up with gas, I could have been using the same tank of gas for a week and suddenly it’ll randomly feel like that again when I’m sitting at a stop light or just parked and letting the car idle.

maxedoutshawty (Score: 1): put it in neutral and see if the vibration goes away, that will rule out transmission issues"
1ozw1c5,"A screw fell when changing my car radio to a screen, help!!","Help, I was changing my car radio when I was using the magnetic thing to pull out the screw, instead I bumped it into something and it fell down the hole, the ac controls and everything stop me from reaching the bottom, should I just leave the screw and buy a new one or is it dangerous? Please help.",1,1763422164.0,7,MechanicAdvice,1763494543,2025-11-17 23:29:24,2025-11-18 19:35:43,"kurangak (Score: 3): It belongs to the void now.

lxstinthedream (Score: 1): It’s an auris 2007"
1ozvz6c,2013 Ford Flex Leak,"Hello everyone, hope your day is going better than mine. I am trying to figure where this coolant leak is coming from, any help is much appreciated.

",0,1763422000.0,3,MechanicAdvice,1763494543,2025-11-17 23:26:40,2025-11-18 19:35:43,"Zionverse (Score: 1): It's flowing either down or from this rubber/metal casing on driver side. Don't see radiator leaking from underneath

aSyntacticParadigm (Score: 0): You need a new radiator gasket"
1ozvou2,Does anything look abnormal?,"I removed my camshaft gasket, does anything about it looks abnormal?",226,1763421287.0,52,MechanicAdvice,1763494543,2025-11-17 23:14:47,2025-11-18 19:35:43,"goochmoney69 (Score: 128): First off, you’ve removed your valve cover, and valve cover gasket. Why? Oil leak?

Everything seems to look good. No sludge build up and even wear on camshaft lobes.

Immediate-Share7077 (Score: 26): Lobes look worn like normal if its a higher mileage engine. No sludge or varnish which is a good sign its had oil changes regularly."
1ozvoco,Don’t understand this,"I bought a ‘92 Suzuki cappuccino a month and a half ago & it came with this Blitz boost controller installed. The whole time I’ve owned the car, the controller has displayed a zero until last night when I was parking I noticed it displayed a negative number right as I was turning it off. This morning when I started the capp up, it was displaying negative numbers again. They would fluctuate with the throttle so I assume that I somehow bumped it and got it to display a live reading of boost levels, my question is are these numbers low?(didn’t have time to take a video but it would sit around that -28 at idle) & also am I right that I’m looking at boost levels? ",177,1763421255.0,30,MechanicAdvice,1763494543,2025-11-17 23:14:15,2025-11-18 19:35:43,"Economy_Side9662 (Score: 147): That's reading vacuum right there. -28 centimeters of mercury is your idle vacuum Measurement at idle

Omnivec (Score: 35): Found the installation manual, Love the ways we used to bypass oem controls. Were in the states?

[https://www.jdm-manuals.com/wp-content/uploads/2014/04/Blitz-Dual-Solenoid-Boost-Controller-DSBC-Installation-Instruction-Manual-English.pdf](https://www.jdm-manuals.com/wp-content/uploads/2014/04/Blitz-Dual-Solenoid-Boost-Controller-DSBC-Installation-Instruction-Manual-English.pdf)"
1ozvn9c,CBR600RR won’t start when hot,"Beautiful 2011 CBR, fires right up when cold. when engine is 165F or above, won’t start. battery isn’t the issue. nice and strong cranking, just won’t start. if i let it drop temp it fires right up. any ideas? engine temp sensor? lmk🤙",1,1763421182.0,3,MechanicAdvice,1763494543,2025-11-17 23:13:02,2025-11-18 19:35:43,"LWschool (Score: 1): So, it’s not uncommon for 4 cyl sport bikes to have difficulty hot starting. It’s a combo of factors, but, it does tie back to the battery, the only force that pushes the starter is the battery. 

Your battery can be perfectly fine for cold starts, because there’s much less friction than when everything is warmed up and at the right, right clearance - and hot-starting simply takes too much power. 

You could check this by using a multimeter to inspect voltage drop and/or amps pulled during a hot vs. cold start. 

I have an old carbureted bike that has this same issue if the battery isn’t really-new. I stalled it in uphill-highway-rush hour one time, wouldn’t start for several minutes. Extremely embarrassing and dangerous situation lol.

RudbeckiaIS (Score: 1): Try flipping the kill switch a few times the next time it happens. If it solves the problem replace the switch: it was very common on several Honda models built 2010-15 that used the same switch with just different length of the wiring."
1ozvmrk,Deformed stuck oil filter,"Hi all, new to this and cars so please dont laugh and dont ask me how this happened.

I have a 2017 Buick Envision, I drained the oil but the oil filter is extremely stuck. Ive banged it too much to the point that it is completely mangled. Im just wondering if there's any suggestions to get it off?

Ive tried a oil filter wrench, a hammer and screwdriver, etc. At this point im just about to get a mechanic.
",2,1763421149.0,4,MechanicAdvice,1763494543,2025-11-17 23:12:29,2025-11-18 19:35:43,"TwistedKestrel (Score: 3): You \*might\* still be able to get it off with channel-locks, large pliers, or vice grips. You may need to squeeze very hard to grip the mangled filter. It will either spin it off, or tear off what's left of the filter body.

If you tear off the oil filter body, then at that point you will need to CAREFULLY spin off the base using a chisel and a hammer. The chisel only touches the oil filter remnants, and you need to make sure that you are applying force in a counter-clockwise direction! There is a chance that the oil filter union pipe comes out at the same time. If so you will need to separate that from the oil filter carcass, and re-install it. You will definitely know if this happens because there will be nothing for the new oil filter to thread on to

nabob (Score: 1): ...your first mistake, using the orange can of death Fram Extra Guard......"
1ozvmm9,Can't find right pinch weld adapters,"I have big red t43004 jack stands and trying to get some pinch weld adapters for them. I bought these adapters for them after not being able to find any info on whether they'd fit or not and they don't.

 Does anyone know which adapters would fit my jack stands? 

Seven Sparta 4 Pcs Car Jack Pad... https://www.amazon.com/dp/B07N691QNG?ref=ppx_pop_mob_ap_share

 ",1,1763421139.0,3,MechanicAdvice,1763494543,2025-11-17 23:12:19,2025-11-18 19:35:43,"LWschool (Score: 1): From briefly googling it seems like there are no options for that. 

The company that makes these doesn’t even make a pinch weld adapter, I’d say you’re out of luck. 

I’d seen these reviewed, and perform well on YouTube, but I didn’t see any benefit since traditional jacks are absolutely proven tools. The only benefit to Big Red IRL is they don’t weight as much, but I don’t carry my stands around."
1ozvl8a,1997 F-250 HD 7.5 RWD break rotor question.,"I acquired a F-250 earlier this year, and I've got some front end issues going on. When I purchased it, I got a bit of clicking noise by push/pulling the top of the t ire. I know this is usually ball joint or wheel bearing. I'm also starting to get some bad wear on the inside of the t ire. Possibly the strut assembly on top of it. Correction if that is incorrect would be appreciated!

  
It has 190k miles, so I was just going to replace the bearing, ball joint, and springs/shocks in one go. My confusion comes with the bearings. It appears that the wheel bearing on this truck, are in the break rotor? Is that accurate? (I've never seen that before) And the bearing sold for it, don't come with races. Is the race already pressed into the rotor unit? Ordering from RockAuto, so I'm trying not to order things I don't need. Thanks for the help! (Oh, I think it makes a difference that this is 8800lb GVW, with a twin I-beam axle)",1,1763421047.0,4,MechanicAdvice,1763494543,2025-11-17 23:10:47,2025-11-18 19:35:43,"hikingsticks (Score: 1): Why don't you lift it up and identify what the actual problem is, and just fix that? You can replace everything if you want to, but it's a waste of time and money.

A ball ball joint can easily cause uneven tyre wear on its own.

I don't know this specific vehicle, but it's definitely possible to have the bearing integrated into the brake disc. Common on the rear axle of French cars."
1ozvl6l,Can someone identify what this noise is?,"Car started making the noise a while ago and my gf never really took it in. Someone said engine problems but he wasn’t 100% sure so I figured I’d see if anyone knew for sure what’s happening here? We’re long distance currently, so I haven’t gotten much time to look at it myself.",1,1763421044.0,5,MechanicAdvice,1763494543,2025-11-17 23:10:44,2025-11-18 19:35:43,"No_Tooth_6446 (Score: 1): It’s the rattling noise near the start, the car is a 2003 ford expedition Eddie Bauer edition

cormyee00 (Score: 1): My guess would be your timing chain."
1ozvkon,Has anyone changed this part yet?,Has anyone ever changed a complete intermediate camshaft cap?,5,1763421011.0,3,MechanicAdvice,1763494543,2025-11-17 23:10:11,2025-11-18 19:35:43,"5lippers (Score: 6): Looks like a bmw of sorts. Most of the time, the cam cap itself is a matched piece with the head. What's the reason for replacing?

rosscO66 (Score: 2): What engine?"
1ozvh12,Squeaking sound,Car makes a squeaking sound when AC/heater is turned on . When I start to drive it goes and sometimes ( very little ) when I’m stopped at a light . Any car people can help me out with what it can be ? ,1,1763420761.0,3,MechanicAdvice,1763494543,2025-11-17 23:06:01,2025-11-18 19:35:43,"Savings-Pen-2228 (Score: 1): 2016 Corolla S

Mountain_Schedule_40 (Score: 1): Could be A/C bearing is failing"
1ozvgfq,2017 Lexus CT200h keeps dying but will jump?,We’ve had this problem of this car that will jump fine and run great until we turn it off then it dies entirely. It has a brand new battery and the car does have subwoofers in the back. problem started after replacing RCA cables that broke. ,1,1763420721.0,3,MechanicAdvice,1763494543,2025-11-17 23:05:21,2025-11-18 19:35:43,"hikingsticks (Score: 1): Buy a multimeter and measure battery voltage, charging voltage, voltage after resting over night, etc.  Without those numbers it's just guessing.

SlowDownToGoDown (Score: 1): You have a nice amp(s) driving the subs, right?

They are likely wired directly to the positive terminal of that new battery, right?


Pull that wire off the positive terminal, and see if the issue goes away.  

If it does; you know it's a problem in the aftermarket amp/wiring, versus the entire rest of the car. 

Let us know what you find."
1ozvg5p,Power Steering leak. Reservoir or hose clamps?,is this a hose clamp leak or a reservoir. 2005 Toyota Avalon 90k Miles.,1,1763420703.0,3,MechanicAdvice,1763494543,2025-11-17 23:05:03,2025-11-18 19:35:43,TruckeronI5 (Score: 1): Hose. 100% normal for 2005 toyota. Hose just wore out.
1ozvcnd,3S-FE oil burning,"1992 Camry Sv21 wagon 5sp burning heaps of oil.

Compression between 160-164 and I've heard oil rings are known to clog up.

Previous owner was a mate of mine who had run engine cleaner through it doesnt seem to have helped.

Other common issues before I pull the head off and do valve stem seals?

Will be checking PCV later today and probably vent to atmosphere, doubt it has egr but will be blocking that too.",1,1763420461.0,2,MechanicAdvice,1763494543,2025-11-17 23:01:01,2025-11-18 19:35:43,"RudbeckiaIS (Score: 1): Originally it was worn rings: Type 90 3S-FE had none of the oil drainage issues Third Wave engine had. It's just tear and wear. 

Since you mention very high oil consumption be warned that if it ran for too long with worn piston rings the cylinder lining may be have been polished to a mirror-like finish, which means reboring and OS pistons/rings. Extremely common on older Toyota whose owners are too ""thrifty"" to replace pistons and rings. 

Engine cleaner is only useful to help the seller feed his family. ;-)"
1ozvaub,Exhaust leak advice,"I was told “3 different points, there’s a gasket at the front needs to be fixed, the resonator needs to be replaced and some bolts look welded or fused together” so they couldn’t do the work there and I would have to take to a muffler shop… I don’t even know what my question is, if I’m being honest, any advice is appreciated and parts needed, maybe an estimate I would have to spend and possibly if a JB putty would do the trick…2015 Chevrolet Spark 1LT, thank you…",1,1763420348.0,2,MechanicAdvice,1763494543,2025-11-17 22:59:08,2025-11-18 19:35:43,BustywifeVibes (Score: 2): I'm assuming you had it at a smaller shop to get it looked at. They were being pretty honest with you because they would probably replace all the parts and end up costing a lot more than one would think. However at a muffler shop they would be able to weld in new sections of pipe and or muffler with custom welding and not have to replace the exhaust manifold or converter saving money in the long run
1ozv9e9,2012 charger overheated is head gasket blown??,,0,1763420251.0,3,MechanicAdvice,1763494543,2025-11-17 22:57:31,2025-11-18 19:35:43,"pleirbag (Score: 2): Brother in Christ, what do you want us to say?

Electronic-War1332 (Score: 1): Maybe. Maybe not. Check your coolant or something"
1ozv8fh,Advice on a 01 mercury mountaineer,"Hey, figured I would turn to Reddit as I’ve had no luck getting my work car running right. 

It has the 5.0 V8 and 120k miles on it, I’ve replaced the fuel pump, alternator, EGR valve, upper and lower intake, throttle position sensor, spark plugs, and idle sensor. 

The issue itself is a fuel air mixture problem, after I replaced the EGR and a new harness those codes went away and an o2 code popped up instead.
It will hard idle in the morning when it’s cold but if I drive it 10 minutes I can’t even stop without it dying, at this point it’s fouling out so much the rpm’s are fluctuating, black suit blows out after being ran for a bit, and the engine shakes when you slowly accelerate. 

I’ve thought about a MAF sensor but when I unplug it nothing changes. Fuel filter? Maybe the plugs have gotten so fouled out? 

Any thoughts or ideas? It would really help! ",1,1763420186.0,2,MechanicAdvice,1763494543,2025-11-17 22:56:26,2025-11-18 19:35:43,"hikingsticks (Score: 2): Why the alternator?

You need to read live data and see how the O2 sensor readings are behaving under different conditions. Idle, wide open throttle, cruising, etc.

Also a smoke machine test for vacuum leak might be an idea.

But start with live data."
1ozv3f6,"After a jumpstart, car dies. Is it the battery or the alternator? (Toyota Corolla 2003)",Is there anyway to know if my car dying is the result of a faulty battery or a faulty alternator? I got a jump and was able to drive it for about half a mile (check battery light was on the whole time). And it inevitably died again. The battery is bout 8 months old and fairly new. ,1,1763419853.0,6,MechanicAdvice,1763494543,2025-11-17 22:50:53,2025-11-18 19:35:43,"hikingsticks (Score: 3): It's the alternator. You should buy a multimeter though, they're cheap and incredibly useful.

animal_013 (Score: 2): Likely alternator."
1ozutdt,Suggestions for car (quote included) - should I get them done?,"My car is at Kia Dealership now for transmission change covered by warranty.

Mechanic said that brake pads, rotors, alignment, etc. are suggested to be change “due to mileage” amounting to about $1K !!! I’ll pay but not if it’s unnecessary.

Does that sound right?

I double checked and asked if they were suggesting I need these things done, and he kept saying due to miles?

So I asked for the quote to emailed, they made notes as well:

Front rotors ($572) and pads ($125) are due to ru$t buildup??

The brake flush ($130), fuel injection ($190) and alignment ($130) is due to mileage?? Does that sound right?

(I have a 2020 Kia Soul with 88k miles)

Thank you in advance 🙏🙏
",1,1763419188.0,2,MechanicAdvice,1763494543,2025-11-17 22:39:48,2025-11-18 19:35:43,"Ok_Yogurtcloset4165 (Score: 1): They likely do need to be replaced but that price is ridiculous, I suggest you change the pads and rotors yourself with decent aftermarket parts. Doesn’t take a ton of tools or knowledge, might take a beginner a few hours but it’s valuable experience. Take it to a shop for the allignment tho, and make sure the shop uses computers for the allignment not older methods."
1ozuq6m,Advice for car ramps that aren't a fortune?,"I don't have a lift available at home and would like to change my automatic transmission fluid. I'm hesitant to just use 4 jack stands would prefer cribbing/ramps. But holy shit they are EXPENSIVE looking at them online. I've seen DIY tutorials on how to make my own... and I may go with that option, but for the sake of time I wouldn't mind just buying something.

I'd love to have up to 10"" lift but I could probably make due with 5-7"".

Wondering if any of you had any suggestions on cheap brands. Thank you!",1,1763418969.0,28,MechanicAdvice,1763494543,2025-11-17 22:36:09,2025-11-18 19:35:43,"SceneSensitive3066 (Score: 4): Pretty sure Walmart has a pair for like $60

alwaus (Score: 4): Look up the post from that guy a few days ago who made his own ramps out of 2x12s."
1ozukjg,I can't get this key fob apart to replace the battery,My sisters car has a replacement key fob and it's beeping and we have no idea how to change the battery on it.,0,1763418607.0,7,MechanicAdvice,1763494543,2025-11-17 22:30:07,2025-11-18 19:35:43,"daemosdemon (Score: 3): From what u have shown, i would say that screw needs to be removed to get the silver edging off which should reveal the ability to seperate front and back(2 screws if there is one on the other side as well)

raceace701 (Score: 1): What car.   Have you tried YouTube"
1ozuijf,2006 Mazda Tribute,Does anyone know where this noise is coming from? And what it could possibly be? It's like a whirling noise. Been happening a long time. ,1,1763418478.0,3,MechanicAdvice,1763494543,2025-11-17 22:27:58,2025-11-18 19:35:43,"AcrobaticFinance8982 (Score: 1): Now this probably doesn’t apply to you but on my 1.9 tdi I have a gates timing belt kit and it makes this noise, I’ve also heard it on countless other cars here in Ireland cause gates is the most common brand mechanics use"
1ozuicm,is diag fee flat rate or hourly?,"never brought a vehicle in for troubleshooting before. lexus dealer, electric gremlin. service advisor told me $260 an hour for diag, they’ve had it for 5 hours so far, no call. explicitly told the service advisor i can’t afford multiple hours of diag work. can they legally rack up a whole days worth of diagnostics and charge me for it? google says it’s flat rate, service advisor said hourly. what’s the deal? ",1,1763418466.0,4,MechanicAdvice,1763494543,2025-11-17 22:27:46,2025-11-18 19:35:43,"NightKnown405 (Score: 1): ""Electric Gremlin?"" Is this something that is bad all the time or does it randomly happen and go away and not occur again for some period of time? 

In most cases like the latter shops have had a tendency to only charge for the time spent to take a good initial evaluation of the problem and then only the time spent doing testing while the problem was present. In the past technicians have invested multiple hours over several days to weeks and not been paid at all for the time that they actually put towards solving the problem, (BTDT) and that has served to convince technicians that were good at doing this kind of work to leave the trade for careers that didn't screw them over for being both talented and disciplined in their approach. 

At this point all you can do is keep working to have an open dialogue with the shop at your expectations as well as any pricing limits. The rest is between them and their technicians. 

In the meantime, how exactly did you describe the symptom to the shop? How likely is it to occur on any given road test? Are there any driving conditions that are more likely to get it to happen? Had anyone connected a scan tool to the car and pulled codes from every module? If so what did they get and what computer generated each code? What is the year, make. model and engine of your car,?

waynep712222 (Score: 1): this test... print several copies.

 one for yourself. and one for the techs.. https://i.imgur.com/SnzhDh0.jpeg

 guess what i do for a living.. yep.. fix cars.. 

 you did not mention year model or engine.. or what is acting up..

  poor electrical cable connections, poor fuse block connections..

 corrosion like this 2011 camry negative battery cable.. https://i.imgur.com/c72jnIx.jpg

  the six step voltage drop test just yesterday found stuff on a 2013 Highlander.. were the alternator output connects to the long fusible links in the underhood fuse block."
1ozuhbc,1991 Toyota Tercel - Is it fine to replace one of my engine mounts on an incline like this?,"It’s really my only place to work besides a walmart parking lot, I am just worried about the engine shifting forward out of place while I take the old mount out.",1,1763418398.0,2,MechanicAdvice,1763494543,2025-11-17 22:26:38,2025-11-18 19:35:43,biohackenthusiast (Score: 1): yes it’s fine
