id,title,selftext,score,created_utc,num_comments,subreddit,scraping_time_utc,created_datetime_utc,scraping_datetime_utc,top_comments
1mhtv9x,How to clean?,"Got this alternator from the junkyard yesterday, was wondering how I'd go about cleaning it up either after or before I get it tested to see if it works. Any tips would be appreciated!",1,1754351587.0,3,MechanicAdvice,1754422792,2025-08-04 23:53:07,2025-08-05 19:39:52,"Spoon_i_am (Score: 1): I forgot to add that this alternator is from a 1999 Subaru Forester

xROFLSKATES (Score: 1): Hey buddy I’m gonna be so for real with you rn.
It’s fine. Don’t bother."
1mhts74,"ABS, TRACK, Steering Wheel and engine light","I recently got my front breaks done, rotors and pads. Shortly after these 4 lights turned on with the wheel being stiff. Could that have anything to do with it or what could be the cause for them to go off at the same time? ",1,1754351352.0,2,MechanicAdvice,1754422792,2025-08-04 23:49:12,2025-08-05 19:39:52,Playful-Night9474 (Score: 1): it’s a kia forte 2017
1mhtlbm,"Stud is spinning, calling all for advice on removing lug nut","As mentioned above, this stud is spinning and we’ve tried a multitude of tools to remove this thing. Drilling, melting, sawing, hammering, you name it this thing will not come off if there’s any advice you have please tell.",1,1754350837.0,8,MechanicAdvice,1754422792,2025-08-04 23:40:37,2025-08-05 19:39:52,"Massive-Factor-3400 (Score: 1): Maybe put a punch on it and hammer it through

jetty_junkie (Score: 1): Finish cutting it at this point.  I’d cut in on it as far as I can go where you have already cut. Then I’d try using a chisel on the outer edges to see if I could cut through the nut and peel it off 

You are almost there. It seriously shouldn’t take much more"
1mhtiib,would you trust my jackstand setup?,,0,1754350636.0,17,MechanicAdvice,1754422792,2025-08-04 23:37:16,2025-08-05 19:39:52,"MikeWhooo13 (Score: 13): Looks safer then most things I've gotten under before lmao

qwikh1t (Score: 4): No"
1mhtg6y,2016 Hyundai Elantra didn't start and then the battery light came on. Waited a few minutes and it started just fine and no dash lights. Is this a sign of a failing alternator?,"I had kind of a similar issue like a year ago where my car wouldn't start and even turned off once while waiting at a stop light, but only the engine light came on for that. The mechanic said it was just a loose terminal and nothing else serious. He tightened it and it's been fine since then until today when it didn't start initially and the battery and engine lights came on. Waited a few minutes and then it started like normal and no dash lights came on",1,1754350468.0,2,MechanicAdvice,1754422792,2025-08-04 23:34:28,2025-08-05 19:39:52,Ejb119986 (Score: 1): Have your battery tested
1mhte8d,Greyish smoke,"Hey i have a 2015 bmw x1 and recently i have been having a issue where smoke blows out the exhaust kinda greyish smells burnt not sweet i checked for any oil residue there wasnt any im having a fuel issue after where it consume way more then normal and smells like a bit of gas no leaks whats so ever for the fuel lines or hpfp or feed line i already changed the hpfp,cam follower,sparks,ignition coils so im assuming my fuel injectors took a poop possibly i was checking for bad valve stem seals since i havent done a oil change n the valve cover is a bit leaky and burns onto exhaust manifold it seems i dont got many codes any suggestions will help im stuck before i just start buying and replacing things but my next thing would be likely valve cover and fuel injectors",1,1754350328.0,2,MechanicAdvice,1754422792,2025-08-04 23:32:08,2025-08-05 19:39:52,KingEmfour (Score: 1): Has only been started twice since this issue has arised
1mht9jv,What would cause this?,Caliper isnt seized although one of the piston boots has a slight tear. Sliding pins werent seized either. Just curious what else would cause the outer pad to wear out faster. ,2,1754350003.0,7,MechanicAdvice,1754422792,2025-08-04 23:26:43,2025-08-05 19:39:52,"DropTopGSX (Score: 3): There is friction between the tabs of the pad and the bracket, it's very unlikely to be exactly equal amounts of friction on both sides which can affect not only how evenly they apply but also how easily they separate.


That is a very reasonable wear pattern though, they are never perfectly equal. Replace any torn boots, clean the rust from under the abutment hardware, replace the pads/hardware and send it.

Additional_Bed6455 (Score: 3): The slide pins needs to be lubricated."
1mht96w,Car acceleration issue.,"My car accelerates very poorly when I take off from a stop, I’ll barely get anywhere and the engine will roar. Doesn’t seem to happen at higher speeds. 

Also when pressure the gas when making a turn it even worse car moves slow and kicks back. 

Been going on for a week. Did have coolant system fully replaced a week ago. I made a post about that part minutes ago.

",1,1754349979.0,4,MechanicAdvice,1754422792,2025-08-04 23:26:19,2025-08-05 19:39:52,"Equivalent_Heart_804 (Score: 1): i would take it to a shop bro , especially if you ain’t got no codes .. my 09 crown vic started doin that friday . i’m gone replace my tps ( throttle position sensor ) , and if that don’t work im just gone get it towed to a shop

Phillyjay26 (Score: 1): Car is a 2005 Buick lacrosse btw."
1mht3h4,Need help finding a part (2016 Chevrolet Malibu),"I really need help finding this part, I have a rather severe vacuum leak that I can tell is getting progressively worse, whether it’s used or brand new, the service center I take it to explained it was discontinued, I have scoured marketplace, eBay, RockAuto, Car-Parts, local salvage yards with no luck
If anyone can help me locate one or has one they would be willing to sell please shoot me a DM
Any help would be appreciated
Thank you so much",1,1754349568.0,2,MechanicAdvice,1754422792,2025-08-04 23:19:28,2025-08-05 19:39:52,BlessedWaza (Score: 1): dm me
1mht2o8,What type of lubricant spray do I use on these spots. I guess I also need something that is safe on the ball joint rubber boot too,I tried penetrating oil but the threads were squeaking  real bad ,1,1754349511.0,10,MechanicAdvice,1754422792,2025-08-04 23:18:31,2025-08-05 19:39:52,"Grand_Possibility_69 (Score: 2): Grease on threads. Penetrating oil is too thin for high force that's there when it's tightened.

But why would you lubricate the fork? It's not supposed to move against the part it's pushing. I'd clean this area with brake clean and want maximum friction there. Especially when arm/knuckle is aluminum I'll hit the tool to the back to shock the joint loose when tool is tight. Friction there will help in this.

Brush_my_teeth_4_me (Score: 1): I would put a very thin layer of brake grease on the threads, like barely any and maybe a thin layer on the contact points but I dont think that part is necessary"
1mht04t,gazillion warning lights after recall repair,"Hi gang,

I drive a 2018 Civic Si that I brought in last week for a recall to replace the fuel pump. My car has drove and behaved fine until I brought it in to the dealership, which they returned to me with a million alarms on start-up. I’ll attach a video…… 

Anyways so they are claiming that the vehicle stability modulator failed coincidentally in their shop and it has nothing to do with the fuel pump “since the parts aren’t interconnected.” Which, I suppose… maybe…. but I’m being asked to pay 2k to replace it? I went in for a voluntary recall!!!! Any thoughts and insights on this would be appreciated.

Thank you!!

side note: I am bringing it back to them in two days for them to review their work to ensure it was installed correctly, but they’re adamant it was coincidental.
",2,1754349331.0,2,MechanicAdvice,1754422792,2025-08-04 23:15:31,2025-08-05 19:39:52,jossie-the-cat (Score: 1): ⚠️ Marriage problem 🏃‍♀️   light was missing
1mht010,MAF Sensor visible buildup,I have a MAF sensor and part of it has visible buildup that no amount of cleaner will remove. Any suggestions on how to get it clean?,1,1754349324.0,8,MechanicAdvice,1754422792,2025-08-04 23:15:24,2025-08-05 19:39:52,"HoosierDaddy_427 (Score: 1): I don't see anything on it, but if you're positive just buy a new oem sensor."
1mhsy53,Is it safe at all to drive with a shredded serpentine belt?,"I have a Saturn ion 2004 and my serpentine belt decided to just snap while i was backing out of a parking spot, had some family members come over to help. However, my sisters husband looked at it and told me it looks drivable mind you im like a 5 min drive from home maybe less. I didn't feel safe driving however i was told multiple times its safe to drive and he even started tearing off the strands of the serpentine belt and told me to ""crank the car but slowly"" so he could tear off the rest of the shredded belt. Is it even safe to TOUCH let alone drive with it shredded? I was told multiple times again he knows what he's doing however i dont know if i should just trust him and put my worries to the side or trust my gut.",0,1754349191.0,16,MechanicAdvice,1754422792,2025-08-04 23:13:11,2025-08-05 19:39:52,"arizonafleshraisin (Score: 3): If you dont feel safe have it towed to a spot.

Vic_Pirelli (Score: 3): It probably won't have power steering with a broken accessory belt.  It won't be charging the battery either.  But the biggest concern is that it won't be turning the water pump, which could cause the engine to overheat, possibly resulting in expensive repairs.

It's your car.  If you're not comfortable driving it, have it towed."
1mhsxyi,What's a reasonable [non-dealer] price for these repairs?,"Dealer is charging $15,000 to fix everything. I already paid $630 just for diagnostics. Plan to take it to a non-dealer shop to get an estimate based on the print out of the report from the dealer. 

I'd hoped to keep the price below about $5000 and maybe get another couple years out of it. But thats probably still too much to pay. What do you guys think?

Am I cooked or what?

ps. how much do you think I could sell it for with it needing these kinds of repairs

---

VW Tiguan 2012
85,000 miles

[$8000] Cylinder Head Assembly: REPLACE CYLINDER HEAD WITH NEW ONE-TIME USE HARDWARE INCLUDING TIMING CHAIN REPLACEMENT, INTAKE GASKETS, VACUUM PUMP SEALS AND FUEL INJECTORS DUE TO CYLINDER 1 EXHAUST VALVES BEING BURNED UP

[$2200] Thermostat Housing Replacement: REPLACE LEAKING WATER PUMP/THERMOSTAT HOUSING

[$1800] Alternator Replacement: REPLACE ALTERNATOR DUE TO INTERNAL FAILURE WITH NEW SERPENTINE BELT

[$3000] [Other]: REPLACE TURBO CHARGER DUE TO UNDER-BOOST FAULTS

[$630] [Diagnostics and Inspection] ",1,1754349177.0,4,MechanicAdvice,1754422792,2025-08-04 23:12:57,2025-08-05 19:39:52,"Dadofpsycho (Score: 1): The cost of these repairs far exceeds the value of the car. So I wouldn’t get this company to do the work. 

I think the prices are excessive. You could get the cylinder head rebuilt rather than replacing with a new one. Thermostat housing and water pump would likely have easier access with the cylinder head off so that price seems very excessive. And likewise the turbo would need to come off to remove the head so it should just be the part with minimal labor. 

Is it possible that they are giving you a high price in the hopes that you will trade your car in for scrap value and then you would buy a new one?  Personally I would take this to an independent shop that perhaps specializes in VW or European vehicles and see what they charge for this work.

Extreme_Map9543 (Score: 1): What’s the exact issue with the car?   Coolant leak and a bad alternator are obvious.  But what did they say is going on with the cylinder head, timing chain, and turbo.   At those prices I would definitely say the car would not be worth fixing.  "
1mhswzj,"Stupid question, but what is this stick pulled out in this car I bought? I can't put it back (2002 Toyota Tacoma)",,2445,1754349108.0,637,MechanicAdvice,1754422792,2025-08-04 23:11:48,2025-08-05 19:39:52,"Doc_Spratley (Score: 2317): This is your parking brake.

So-Durty (Score: 1215): Funny story.  When I was in high school my friend had a Tacoma with this parking brake.  We were at a stop light and he did a one wheel burnout next to our friends.  Didn’t realize a cop was a few cars back and when we did, he just kept doing the one wheel burnout, pulled the parking brake out, and stuck his hand out for help from the cop.  The cop got out of his car and walked up to him and my friend playing dumb says, “This thing is stuck and I’m trying to go!  Can you help?”  The cop showed him how to put it back in by twisting it and he let us go on our way."
1mhstyp,these lines on the transmission looks like cracking and i don't know what it is,,1,1754348890.0,4,MechanicAdvice,1754422792,2025-08-04 23:08:10,2025-08-05 19:39:52,"Malikai0976 (Score: 3): It's just from the casting. No issue so long as none are leaking trans fluid.

SparkyBos (Score: 2): Id say its just casting marks on a older trans. Not saying I know for sure tho."
1mhsrtp,2006 Impala starting issue,"For a long time now the car would randomly not start or take a few tries l, sometimes dying and then start, recently tried the tap on the relay and it starts, although I think if you tap anywhere on the fuse box it will start. The car will randomly shut off while driving as well, somewhat often. Any help would be awesome!",1,1754348731.0,3,MechanicAdvice,1754422792,2025-08-04 23:05:31,2025-08-05 19:39:52,"hikingsticks (Score: 1): Check ignition relay and ignition cylinder, loose fuses, wiring. Sharp check battery terminals and earth wires between engine, body, and battery.

truthsmiles (Score: 1): Based on your description I’d think you have a loose or corroded wire or connection in or to the fuse box. Probably a larger run circuit. 

I’d probably start by driving it slowly with the hood popped and the fuse box cover off, and when it dies, leave the ignition on and carefully use a test light to check every single fuse."
1mhsm42,Hi all,Hope you can helps I have a ford cmax 2008 1.6 petrol manual. I was driving it earlier and my orange engine light came on and the red engine light did too. Car went slow and steering wheel went stiff. I had to put hazards on and pull into a side road but funny thing is just as I pulled into a 10 seconds after the problem the lights went off and my steering came back. While I was in this situation I struggled to accelerate. Does anyone know what this could be. Thanks ,1,1754348330.0,4,MechanicAdvice,1754422792,2025-08-04 22:58:50,2025-08-05 19:39:52,A925D (Score: 1): Scan it for codes
1mhsjx3,2020 ford ranger tick or normal,"Hi, im new to these 4 banger turbo engines is this normal sounding. Thanks ",2,1754348176.0,3,MechanicAdvice,1754422792,2025-08-04 22:56:16,2025-08-05 19:39:52,"phenofarm (Score: 1): 2020 ford ranger xl

TryImaginingDragons (Score: 1): I’m not familiar with Ford motors, but that doesn’t sound right to me.

Make sure the oil is topped off. Take this with a grain of salt, but it sounds like something in the top end or maybe a chain rattle?"
1mhsi2u,What are these build-ups on bottom of engine?,"Hi, I was under my car re-torquing headers and starting an oil change and noticed build up in a few areas. Just wondering is it just dried up oil or some other substance and should I be concerned? 

For reference my car is a 2016 Scion FR-S Manual. ",1,1754348043.0,7,MechanicAdvice,1754422792,2025-08-04 22:54:03,2025-08-05 19:39:52,"TheBigYellowCar (Score: 3): Looks like a small oil leak with a bunch of dort and grime sticking to it. Valve cover gaskets tend to start leaking like this. If it’s not running down & dripping on the ground I wouldn’t worry about it so much, but you can trace it up to find the source.

kissmyash933 (Score: 1): You have an oil leak somewhere. The dry dusty black is probably just normal dirt buildup, but in the first photo you have oil dripping just above and to the left of that ground strap, and it’s wet in that bolt as well."
1mhsf39,Switch Under Panel,"Does anyone know what this switch is for, it appears for something aftermarket.  It’s located on the driver side on the left below steering wheel.  I haven’t traced it back any further yet…
2023 Toyota Tacoma TRD Sport 
Any leads would be appreciated. ",1,1754347837.0,6,MechanicAdvice,1754422792,2025-08-04 22:50:37,2025-08-05 19:39:52,hikingsticks (Score: 1): What happens when you press it? Ejection seat?!
1mhsde9,"Car won’t start, clicking sound","My car wouldn’t start, I think it’s a dead battery. Was making this sound in the upper right under the hood after I tried to start it the first time. But the sound died away after a minute and didn’t come back on my later attempts. Tried to boost it off and it made some progress (at least the inside lights started working) but couldn’t get it to start. The battery had a lot of corrosion on the terminals. Tried cleaning some of it off but was in a parking lot and didn’t have a lot of materials. Does it sound like just a dead battery?",1,1754347717.0,2,MechanicAdvice,1754422792,2025-08-04 22:48:37,2025-08-05 19:39:52,hikingsticks (Score: 1): Clean the terminals and replace the battery
1mhs9rf,I'm Having Issues With My Family Car's Coolant. My Family Isn't Listening To My Concerns And I'm Worried About The Integrity Of The Car (specifically the engine),"My family owns a 2020 Kia Sportage. Recently we just ran out of the coolant. We couldn't get the coolant right away, so I did some research and learned that water is a good temporary solution for low mileage distances. After so much research and comparison, I finally found the coolant we needed. Before we left to Autozone, my sister poured a full xtra large polar pop cup of water in the coolant thing, when she had put half of that earlier. 

Her reasoning was because it had ran out fast, but had she not done that, the coolant thing would've gone empty fast like it did before. I was counting on that so we could just pour the coolant in. We open the hood and we see it's no longer empty, but filled with a dark blue liquid. Obviously the old coolant mixed with the water. We drive back home assuming it would go down when driving, but it didn't.

Doing more research, I learned if we don't drain the old coolant mixture, we could possibly break the engine. I was being very a adamant about the situation, but they swear it'll just ""run out"". Mind you the AC isn't working properly either with these issues I mentioned and I know that's not a good sign either. Please give me the best advice you can, and if possible is there a way for me to drain the coolant without having to jack up the car. My mom feels it might drop, so I'm trying to exhaust every possible option. 

A professional opinion would be much appreciated... Thank you for your time, any help is welcome ",0,1754347461.0,5,MechanicAdvice,1754422792,2025-08-04 22:44:21,2025-08-05 19:39:52,"drake90001 (Score: 3): AC not working has nothing to do with coolant levels

teknogroover (Score: 2): I would determine where the coolant leak is, first. You can rent a cooling system pressure tester from AutoZone or O'Reilly's for free, or purchase one on Amazon. This way you can pressurize the system when it's not super hot and look for the leak. Also check your oil to make sure there's no water/coolant in it. If there is, the oil will appear milky or like chocolate mousse. This would indicate a blown head gasket or cracked head or block and the coolant is being turned into steam. You exhaust will smell sweet and have steam coming out of the tailpipe. You can also get a test strip that you can dip in the coolant to check for exhaust/carbon, which would indicate a bad head gasket or cracked head/block. Once the leak is located and repaired, you can drain the coolant by locating the petcock valve on the radiator (usually on the drivers side and the bottom of the radiator), and unscrewing it to drain the coolant. To get the old water and coolant out of the block, you can remove the thermostat and flush out the block and head with a garden house. Then get some compatible coolant and mix it with distilled water 50/50, or get premixed coolant."
1mhs91b,Hemi 5.7l suddenly noise,"A Ram Classic 5.7L Hemi with 16,000 miles suddenly developed this noise today. Yesterday, when I turned the car off, there was no problem; today, when I turned it on, it started. Could this be the famous Hemi ticking noise?

When walking a few meters the same noise stops, but when turning it off for a few minutes and turning it on again the noise returns.",1,1754347410.0,2,MechanicAdvice,1754422792,2025-08-04 22:43:30,2025-08-05 19:39:52,Psychological_Ad3537 (Score: 1): Truck model Ram Classic 2023 with Hemi 5.7l
1mhs28g,Need Confirmation,Started after 2-3 tries. Friends say it is the battery. Going to get a new one tomorrow. I would like some redditors to confirm though,1,1754346948.0,7,MechanicAdvice,1754422792,2025-08-04 22:35:48,2025-08-05 19:39:52,"kyden (Score: 2): Dead battery.

None (Score: 1): Could be battery. How old is the battery that’s currently on the car?"
1mhs27s,2001 Honda Accord - Coupe Standard,"I didn’t realize that the front passenger-side sunroof drain tube became disconnected from the black outlet grommet that passes through the A‑pillar to the outside of the car. Because of that, rainwater was draining inside the cabin instead of out under the car. When I removed the carpet, I noticed this. What are these sections for? They have like rubber or something. In both the passenger and driver side floors. ",1,1754346946.0,2,MechanicAdvice,1754422792,2025-08-04 22:35:46,2025-08-05 19:39:52,teknogroover (Score: 1): Those plugs can be removed to drain out water or to access something. Usually just drains.
1mhs165,Trying again…in need of advice,"2008 Honda Accord v6

Got my car fixed about two months ago. I’ve been knowing the mechanic for a good 8 years. He did something major to my engine because it was overheating. Now this. Do anyone know what this could be? ",4,1754346874.0,13,MechanicAdvice,1754422792,2025-08-04 22:34:34,2025-08-05 19:39:52,"teknogroover (Score: 4): I would remove the belt and see if the sound goes away. If it does, then the sound is coming from an accessory or belt idle or tensioner pulley. Check the fan too, making sure it's not hitting the fan shroud. The frequency of the sound is low/slow, so I'm thinking the fan might be a good place to look. If the engine sqeaks after starting it up when cold, then the timing belt tensioner is going bad.

ZealousidealFun2268 (Score: 2): It sounds like an idler bearing or a tensioner bearing trying to lock up. Remove your belt and see if the noise goes away."
1mhryfs,Any idea of what this noise may be. 2021 elantra sel 69k miles,So i recharged my ac last year and it just went hot again. Don't have warranty anymore so trying to figure it out on my own. Not mechanically savvy but trying to start doing my own things unless it's something bad,2,1754346696.0,6,MechanicAdvice,1754422792,2025-08-04 22:31:36,2025-08-05 19:39:52,"Aleikumselam (Score: 2): why bother fixing that korean junk.Sell it and buy a car

RegularTurnip9436 (Score: 1): Sounds like the valves are loose? How’s it drive?"
1mhru10,Bought a Chrysler 300c 2013 with a seized engine due to overheating what engine components should I replace engine spins now but when I try to start it just cranks doesn’t start,,0,1754346398.0,8,MechanicAdvice,1754422792,2025-08-04 22:26:38,2025-08-05 19:39:52,"hikingsticks (Score: 7): The engine. You should replace the engine.

captianpaulie (Score: 0): Thermostat water pump, motor mounts of any of them are bad normally a radiator spark plugs obviously oil and filter. You have to get zinc additive for a new motor unless you’re putting a used motor in."
1mhrqkt,Is this normal leak?,"Hey guys, this is a 1995 nissan skyline rb25 det. I'm checking out exhaust leak for my car. The video is what I have found. I beleive this part is called wastegate bushing. I'm just wondering if this type of leak is normal or I will have to repair or replace this part. Please give me some advise. Thank you",2,1754346164.0,2,MechanicAdvice,1754422792,2025-08-04 22:22:44,2025-08-05 19:39:52,Impressive-Leg7667 (Score: 1): [this leak video](https://streamable.com/8pfb33)
1mhroqc,Engine noise at startup 5.7 hemi gen 3,"45k miles. 
2020

Is this okay or should I have a shop look into it?",1,1754346040.0,3,MechanicAdvice,1754422792,2025-08-04 22:20:40,2025-08-05 19:39:52,Active-Sun-6013 (Score: 1): Hemi tick
1mhrokv,"Intermittent Problem - No Start, No Sound","My Honda Fit 2015 (automatic, 120k miles) occasionally has issues with starting.

I turn the key, lights and radio come on but the car doesn’t start. No sound, nothing.
After a couple of tries (once it took so many) it finally starts.
I thought shifting to neutral while braking helped at first but not always.

It happened for the first time last month, for 1-2 days.
Then it stopped and I drove it normally.
Now it started again and I’m so scared of getting stranded.

Since it happens intermittently, how can the mechanic diagnose it? 

When I take the car to them, it might just magically work. Is it possible for them to visually diagnose the problematic parts?

",1,1754346030.0,5,MechanicAdvice,1754422792,2025-08-04 22:20:30,2025-08-05 19:39:52,"Aces900000 (Score: 2): They can test the parts yes. Sounds like it’s going to be the starter if you’ve never had it replaced.

hikingsticks (Score: 2): Sounds like a bad starter relay. Could also be the solenoid on the starter motor.

If you can see the starter motor, when it's refusing to start give the solenoid a few taps. If it then starts, it's the solenoid and you need a new starter motor.

The relay is cheaper and easier to replace."
