id,title,selftext,score,created_utc,num_comments,subreddit,scraping_time_utc,created_datetime_utc,scraping_datetime_utc,top_comments
1ndpaqy,What is this noise?,Hello Reddit. I have been trying to fix this noise for a while. I just replaced my Dogbone mount  subframe bushings in hopes it would fix the issue as they were completely shot. Well it fixed the drivetrain sloppiness but not the sound any ideas? 2017 Audi a3 E-tron,3,1757535928.0,2,StupidCarQuestions,1757619180,2025-09-10 20:25:28,2025-09-11 19:33:00,year_39 (Score: 1): Check ball joints and end links for any play. Ball joints would be my first guess for bumping while turning the wheel.
1nd8gz2,What engine is this,I found this engine in my shed when I moved into my new house what is it ,10,1757492363.0,14,StupidCarQuestions,1757619180,2025-09-10 08:19:23,2025-09-11 19:33:00,"the_scat_man06 (Score: 3): I think its an engine

VenomizerX (Score: 2): Just from the clutch fan design and the engine's side profile, I could tell it's definitely a 4-cylinder Toyota. Looks like it has an injection pump so it must be those ""C"" diesel engines, probably a 2C? It's the motors they put inside small vans and cars at the time, as the ""L"" engines were for Toyota's trucks and vans.

N1njaF1sh (Score: 1): I think it’s a Toyota 3C diesel."
1nd8gwu,What engine is this,I found this engine in my shed when I moved into my new house what is it ,14,1757492355.0,10,StupidCarQuestions,1757619180,2025-09-10 08:19:15,2025-09-11 19:33:00,"MeTheRealBritton (Score: 2): Im not entirely sure but it looks close to one that i have for a vw rabbit. Is it diesel?

ExpensiveDust5 (Score: 1): It's a RWD Turbo Diesel of some sort, since the fan is on the front of the engine.

lo_mur (Score: 1): There’s no stamping or identification cast into the block? I’d be looking for part numbers and stickers on any of the components, if you see a bunch of Denso stuff it’s going to be Japanese, Toyota or Nissan most likely given it’s a diesel. A bunch of Bosch stuff will point you towards German stuff, etc."
1nd6srh,Identify Sound 1997 Geo Tracker,"Can't figure out what this rattling sound is caused by. Any help is appreciated 
",1,1757485756.0,5,StupidCarQuestions,1757619180,2025-09-10 06:29:16,2025-09-11 19:33:00,cheerfullpizza (Score: 1): Sounds like maybe a rattle on the exhaust?
1ndjkix,Pulled Security code from GM IPC without needing to dump eeprom,"I've been working on some software that allows you to do quite a few things with GM IPCs, which now includes reading security codes directly from the clusters memory. Just need the 100 different types of gm clusters to get the memory addresses for them all lol. Been having such a blast working on this. This security code was confirmed to be correct using SPS ",48,1757522952.0,27,CarHacking,1757619180,2025-09-10 16:49:12,2025-09-11 19:33:00,"Alarming_Support_458 (Score: 4): Lovely stuff! Out of interest how did you get into this, did you start as a tech and learn the software or start as a software engineer and learn about vehicles?

appletechgeek (Score: 2): Opcom/vauxcom can already pull the codes out of a lot of clusters so maybe you can get some data out of there too.

To

EM_Spectrum_Explorer (Score: 2): Very impressive! Certainly a step up from the Vauxhall Nova days that could be started by removing/replacing the hazard warning switch upside down and bump starting.


Very handy if you ever lost your key."
1ndgjkq,Golf mk6 mirror folding on key fob,"Hi, is anyone here familiar with coding golf mk6 to fold mirrors on key fob?",1,1757516373.0,1,CarHacking,1757619180,2025-09-10 14:59:33,2025-09-11 19:33:00,"TheDefected (Score: 1): If it is possible it should be obvious in VCDS.  
Most like it'll be in the convenience electronics, long coding, and just go through each byte and VCDS will tell you what they do with a name.  
If you see it, tick the box and write the coding back."
1ndu44s,Does this sound ok?,,1,1757548368.0,2,AskMechanics,1757619180,2025-09-10 23:52:48,2025-09-11 19:33:00,Lanky_Principle5636 (Score: 1): Sounds like dirty injectors
1ndtbd3,How does this spark plug look?,"I only pulled one because I’m gonna replace them all anyway, but I’ve heard that spark plugs tell a story and was wondering what kind of story mine told. Is this just normal wear or something more? 

1999 Silverado 320k miles",2,1757546128.0,2,AskMechanics,1757619180,2025-09-10 23:15:28,2025-09-11 19:33:00,"justinh2 (Score: 1): Yours tells a story of someone previously installing shitty-ass, dual-tip, Bosch Platinums. Install some AC Delcos when you go back together."
1ndt1dw,2025 Jeep Compass North 4x4 Hydro locking,"I bought 12 days ago, I’m in disbelief. They said water got into the cylinders and caused it to hydro lock. I bought it with 25 KM, Brand new. What could have caused this? My drive from work to home is 10 minutes. I park in a garage every night. ",1,1757545376.0,2,AskMechanics,1757619180,2025-09-10 23:02:56,2025-09-11 19:33:00,"Maleficent-Class5829 (Score: 1): It is a Jeep, not known for quality or reliability. Take your money and get a Toyota of the same price. There is a reason why they call Dodge, Chrysler, and Jeep the three Stooges."
1ndt0mz,"Marine Steyr diesel, fitted new turbo and rerouted charge pipe and adjusted waste gate, still not building boost","Hey all, I’m helping a friend with a boat he’s trying to sell and we’re having issues. I fitted a new turbo on it, had to reroute some hoses and the charge pipe, it’s running and spinning but we can’t get it to build boost. The wastegate valve has been adjusted but I’m at a loss here at this point. I don’t know much about turbos or adjusting, I just retrofitted it. I’m a NA guy. The turbo spins but we’re getting zero boost build. ",1,1757545319.0,3,AskMechanics,1757619180,2025-09-10 23:01:59,2025-09-11 19:33:00,Zhombe (Score: 1): Vacuum leak / vacuum pump issue? Might explain old turbo not working.
1ndsz3w,Tried shifting into reverse without clutch on startup now it makes grinding noise won’t start,"My clutch wasn’t working, so I tried to put the car into reverse while the engine was turning over(on start up) when something broke and now when I try to start the car it just makes a horrible grinding noise. Please help if you have any idea what it Is ",1,1757545220.0,2,AskMechanics,1757619180,2025-09-10 23:00:20,2025-09-11 19:33:00,"armathose (Score: 1): So your forced it into reverse while the engine was running?  Why?  You need to fix your clutch, and probably replace your transmission."
1ndsq5w,Safe to drive this tire back and forth to work for a few days?,Two chunks missing on sidewall,1,1757544571.0,6,AskMechanics,1757619180,2025-09-10 22:49:31,2025-09-11 19:33:00,"TarXaN37 (Score: 4): My vote is you'll be fine. My tires are missing way bigger chunks and they don't even vibrate.

SpiritedRain247 (Score: 2): these are fine, no cords showing and they're tiny, i would run like normal."
1ndsn8m,Funky transmission,"I have an 04 Chevy Silverado 1500 z71 4x4.

Recently Rebuilt 4l65 (yuck)

In 2wd it takes 2-4 sec to change from drive to reverse and reverse to drive. 

In 4wd its almost instant. 

No slop in the driveshaft, u joints, rear end. 

Pushing the gas during the delay doesnt make it faster. 

Tow mode has no impact. 

What the hell could possibly be the difference between 2wd and 4wd. 

Now you can suffer too, thanks. 
",1,1757544360.0,2,AskMechanics,1757619180,2025-09-10 22:46:00,2025-09-11 19:33:00,maarkwong (Score: 1): That’s a great car
1ndsigy,2008 Civic Si. Key won't turn.,"2008 Civic Si
180k miles.

Went to start car and ignition key wouldn't turn.  Tried turning the steering wheel while moving the key and still no movement.  Now the steering wheel is locked all the way to the left and the key will still not budge.  I can remove the key and reinsert it but there is some friction now when doing it like I kind of sort of have to force it in and out.  Car is stuck in a parking lot.  

What's the quickest, cheapest, easiest way I can at least just get my car home?  Thanks a bunch",1,1757544008.0,8,AskMechanics,1757619180,2025-09-10 22:40:08,2025-09-11 19:33:00,"Vuvuian (Score: 2): Might be lucky & maybe the transmission isn't properly in Park, push the shifter forward again to be sure. If it's an auto anyway."
1ndshun,Oil in air intake manifold,I bought an engine from LKQ and when I was installing the air intake manifold a huge amount of oil came out. Should I return the engine before finishing installing it or should I see how it performs first?,1,1757543961.0,2,AskMechanics,1757619180,2025-09-10 22:39:21,2025-09-11 19:33:00,Romario477 (Score: 1): It’s a 2015 Jeep Cherokee limited 4x4
1ndsd0r,"Car started making strange noise while I was parked, any ideas",Hyundai Tucson 2006. Just got transmission fluid changed,2,1757543601.0,2,AskMechanics,1757619180,2025-09-10 22:33:21,2025-09-11 19:33:00,Zmastapuppydawg (Score: 1): Sounds like a loud blower motor for the ac. Try turning the air off and see if it stops.
1ndscp7,Push weedeater dies when it’s level,It was running fine the died. Now it’ll only stay cranked when it’s tilted back. It has plenty gas in it and it’s fresh gas. ,3,1757543578.0,5,AskMechanics,1757619180,2025-09-10 22:32:58,2025-09-11 19:33:00,"HedgehogOpening8220 (Score: 7): Maybe a kinked fuel feed hose?

ecobooms550 (Score: 6): Check the oil? Maybe it has an oil level sensor that shuts it off if it gets too low? My old generator had that and it would shut off because I underfilled it by a tiny amount."
1nds2vs,Found after my son was working on 2007 Forrester- any idea what it is?,,1,1757542864.0,3,AskMechanics,1757619180,2025-09-10 22:21:04,2025-09-11 19:33:00,viole_8 (Score: 3): That looks more like a segment of a shift cable off of a mountain bike than a car part
1ndrywb,2006 Toyota Scion,,1,1757542589.0,2,AskMechanics,1757619180,2025-09-10 22:16:29,2025-09-11 19:33:00,"Maleficent-Class5829 (Score: 1): Toyota made those engines poorly and will burn oil like crazy. They did do a campaign to fix them, not all of them qualified. You can check it with the vin on carfax or call Toyota to see if they replace it. Other than that, they are good cars."
1ndrrs7,New York State Inspection Question,"In New York you can pass emissions with 1 monitor being not completed.  Is this ok?  Everything is completed except Fuel System.  Or are the ones that are completed but not available (Heated Catalyst, etc) also going to count against that total?

Thanks in advance!",3,1757542078.0,6,AskMechanics,1757619180,2025-09-10 22:07:58,2025-09-11 19:33:00,"Scone_Of_Arc (Score: 1): Car is a 2016 Hyundai Elantra SE

z28_335i (Score: 1): Yes you can more than likely it's a scanner glitch and I have it happen even with my snap on ones and is more than likely set. Fuel system should usually set the instant you set the car. Regardless, any vehicle after 2001 can have 1 monitor down and still pass NYSI. Anything older doesn't have to be emissions tested anymore"
1ndrnts,Why is my car randomly completely dying,"When i say completely, i mean completely. Can’t roll up windows, put my emergency/hazard lights on, can’t use my key fob to lock my doors, wont accelerate and no dashboard lights at all. This will happen when i am driving every so often, like once a week. I’ll have to pull over and sometimes i can put it into park and it’ll let me start it right up but other times it’s taken hours of it just sitting there for it to let me start it again. 

I had my battery and alternator tested and they said it’s gotta be something electrical. The big problem i have is most of the shops i have called have all said they’re not sure they can fix it since if the problem doesn’t happen while they are testing things then they wont be able to find it. They’re wanting to charge me 150 an hour and cant guarantee that they can find anything.  

Im so frustrated and don’t know what to do. If you have ever heard or experienced anything like this please share what you know! Thank you 

It’s a 2009 Honda accord coupe EX ",2,1757541796.0,6,AskMechanics,1757619180,2025-09-10 22:03:16,2025-09-11 19:33:00,"pixl8er (Score: 2): What exactly are you doing when this happens, is it always on hills, same speed, cold outside, hot outside, as much information is needed as possible. Are there any weird smells? A wet spot on the passenger floorboard?

MyNameIsRay (Score: 2): Everything completely dying is almost always a loose connection on one of the main lines to/from the battery.

Maybe its the ground, maybe its the hot lead to the fuse box, maybe it's the main fuse, but something is breaking that circuit."
1ndrgod,What are these parts called?,"What are these parts called in my '02 Ford Taurus OHV? I want to replace them, but I'm not sure what they're called to find the parts on Rockauto.

The connector/clip to the crankcase on the lower hoseband the one to the air intake on the upper hose are broken. Both boots are cracked/deteriorated, and I think are causing some creaking noises.",1,1757541291.0,2,AskMechanics,1757619180,2025-09-10 21:54:51,2025-09-11 19:33:00,"Sudden-Rule4352 (Score: 1): looks like a PCV hose (rear, near intake manifold) and a breather hose (front side, near oil cap)."
1ndr8gr,"I've got all my brakes replaced at the dealership, I just noticed this and want to know if it's normal?","Is it anti-seize and if so, is it applied like it should be?",0,1757540716.0,17,AskMechanics,1757619180,2025-09-10 21:45:16,2025-09-11 19:33:00,"YoungFair3079 (Score: 17): yes anti-sieze. Waaaayyy too much of it.

SourReefer (Score: 6): Looks like anti seize. Probable a little liberal with it but it won’t hurt anything. If it really bothers you just rinse/wipe it off"
1ndqshr,ENGINE LIGHT ON,"I did check from OBD scanner and got this code and its for Transmission Fluid pressure. Any idea how much this gonna cost and what need to be fixed?

Its an Hyundai elantra 2021 IVT 2.0",1,1757539604.0,2,AskMechanics,1757619180,2025-09-10 21:26:44,2025-09-11 19:33:00,"Just_Pea1002 (Score: 1): Look up the code in your manual or find one online if you don't have one, see the fault and get a quote from several local mechanics is probably your best bet"
1ndqmpx,can someone help me figure out what part this is and where i can get a new one… 2009 chevy cobalt lt 2.2l,,1,1757539198.0,2,AskMechanics,1757619180,2025-09-10 21:19:58,2025-09-11 19:33:00,Diligent_Product3684 (Score: 1): Dealer or auto zone
1ndqli2,"HELP, Brake grinding noise","My brother installed my brake pads about a week and a half ago and I've noticed ever since, there's a grinding noise when braking slightly. I've never heard this noise before when I've taken it to shops, but the grinding sound sounds too harsh and they squeak too despite being new brake pads, it's past the break in period so I'm confused how to resolve this.",1,1757539111.0,2,AskMechanics,1757619180,2025-09-10 21:18:31,2025-09-11 19:33:00,"-NOT_A_MECHANIC- (Score: 1): Just pads/pad slap? If so, likely new pads are touching rusted parts of the old rotors that weren’t being touched before either due to binding parts and/or unevenly worn pads. Also, a week and a half is hardly past the breakin period unless you’re putting on a lot of miles. Have you tried asking your brother about it? If he shrugs it off take it to a shop…or actually take it to a shop regardless"
1ndqf79,I don’t know what these sounds are but I need help diagnosing it,Pretty sure I can’t afford any fixes here,1,1757538666.0,4,AskMechanics,1757619180,2025-09-10 21:11:06,2025-09-11 19:33:00,"AnythingSilent7005 (Score: 1): Start with an oil change, use Mobil 1 for toyota engines or original toyota oil.

GalwayBogger (Score: 1): It's a Very Very Toyota ingine sound"
1ndqehi,What would cause this gauge to jiggle like this?,"2000 Ford Ranger.

I just picked it up from the mechanic. They fixed a leak from the rear differential. Not saying that has anything to do with - I’m not sure how it even could. Just mentioning it as a coincidence as the first time I’m seeing this jiggle was immediately after picking up the truck from the mechanic. ",2,1757538618.0,3,AskMechanics,1757619180,2025-09-10 21:10:18,2025-09-11 19:33:00,"AnythingSilent7005 (Score: 1): electrical contact degradation/corrosion can cause an engine temperature gauge to flicker unsteadily. Poor connections, corrosion, or loose wiring at the coolant temperature sensor, its wiring harness, or the gauge itself can lead to inconsistent electrical signals, resulting in erratic needle movement or flickering on the dashboard display.

wirey3 (Score: 1): Rangers are known for their electrical demons, especially in the dash. You probably have some corroded wiring"
1ndq49l,What’s the best windshield wiper brand right now?,"I really need to replace my old wipers, they streak like crazy and make driving in the rain stressful. There are so many options out there (Rain-X, Bosch, Michelin, etc.), and I can’t tell what’s marketing vs. what actually lasts. What are the best windshield wipers you’ve used? Looking for something durable that actually clears well in bad weather.",60,1757537915.0,99,AskMechanics,1757619180,2025-09-10 20:58:35,2025-09-11 19:33:00,"throwaway393838 (Score: 38): Bosch or OEM.

-NOT_A_MECHANIC- (Score: 20): Advise against rainx. Bosch icon/aerotwin are top for rubber blades, OE for many manufacturers. If you want silicone, trico silicone ceramic are good."
1ndpltq,I have a 2023 Tahoe engine oil life is at 8% after driving 5k miles is that bad does that mean it’s burning amor of oil ?,2023 tahoe,0,1757536672.0,3,AskMechanics,1757619180,2025-09-10 20:37:52,2025-09-11 19:33:00,"ihadsexonce (Score: 6): It means you should change your oil and reset the oil life.

Chemtrailcreator (Score: 1): Doubtful it’s burning oil…open the hood and pull the dipstick to check it. You should really do that occasionally regardless of what anything on your car is telling you is fine.

I’d be willing to bet the level is completely fine and it just needs to be changed. 5k miles is actually a change good oil interval regardless. "
1ndpiwf,Am I cooked?,My brother scraped my car when I let him use it (never again). How bad is this and how much to get it fixed or atleast barely noticeable? I ran my finger over it and I can barely feel the scrapes and cleaned and washed the area and it does look just a little better then this picture got off all the smudge looking scrapes  ,2,1757536475.0,5,AskMechanics,1757619180,2025-09-10 20:34:35,2025-09-11 19:33:00,"carsilike (Score: 1): Go to a body shop and pay them $50 to buff it out… you’re going to survive the damage

JMikel0226 (Score: 1): My girlfriend side swept her garage and I fixed it with a wax I got from Autozone. $15 looked similar to this"
1ndp9o4,This cant be right. Is my daughter getting taken?,"She had a spring break upfront awhile ago and is just getting it into a shop where she moved,call it greater Washington DC area. She sent me her estimate and the 1st thing that caught my eye was $270 for an oil change!!!! Like wtf?! Why are these part markups so high? Amd the plugs and coils cost? This doesn't make any sense to me price wise.",807,1757535856.0,678,AskMechanics,1757619180,2025-09-10 20:24:16,2025-09-11 19:33:00,"Imaginary_Degree6779 (Score: 597): 600 for a 4 cylinder spark plug job is wild. Find somewhere else

NoOilJustVibes (Score: 426): They charge you a $30 fee for being in the military wtf 😅"
1ndp1gi,Is my car totaled?,"I have a 2014 Toyota Corolla S that was rear ended and I was just curious if it will be totaled or not?  Car currently has a little less than 133,000 miles on it. It was still drivable after the accident. It honestly felt like it normally did before the accident. No grinding or pulling of any sort but the muffler was loose and needing to be tied up.  No fluids were leaking and no air bags deployed.",0,1757535300.0,5,AskMechanics,1757619180,2025-09-10 20:15:00,2025-09-11 19:33:00,"RondoTheBONEbarian (Score: 4): What's the trim package, mileage, engine size, what did the mechanic see, how expensive are the parts, parts availability, market value and so on?


Ive seen minor damage get totaled and heavy damage get fixed


This is a question for the insurance company 

Extra_Programmer_970 (Score: 1): Yes totaled,too old to fix"
1ndorxn,Rod knock or ac related?,"Speed of the knock increases with throttle, but fully goes away when AC is turned off. Iv also noticed my ac blowing less cold then usual. Can a ac compressor make this noise? ",1,1757534652.0,3,AskMechanics,1757619180,2025-09-10 20:04:12,2025-09-11 19:33:00,"Hmmmmmmhmmmmn (Score: 2): Bad ac compressor can definitely make the noise, if you turn the ac off and it stops totally it would definitely be that, if you want further proof take the belt off

Diligent_Product3684 (Score: 2): Bad ac compressor definitely"
1ndorou,Short Trips Causing Problems?,"So my care has had a few issues related to the battery. 

I live 1 mile from work, about a 10 minute drive due to traffic, and often only drive to and from work all week. The weekend takes me to the supermarket, but this is also only 1 mile in another direction. Two or three times a month, max, I might drive the car for an hour to go outside the city. 

I live in a place that is hot all year round, with temps in the 80s even in winter. Does this help everything stay warm and help water evaporate, as I know the condensation can be a problem?  Also, if I just leave the engine running for an extra few minutes without driving, will that help alleviate problems or do I actually have to drive? ",1,1757534635.0,3,AskMechanics,1757619180,2025-09-10 20:03:55,2025-09-11 19:33:00,"Maleficent-Class5829 (Score: 1): It can become an issue if you drive it short distances. I recommend you drive it but use a low gears so the engine revs higher than normal. Once a week, take it for a 20 min drive on the highway to stretch its legs."
1ndoogg,Car Door noise - replaced check strap already,"Vehicle: 2011 Kia Sorento, 2.4L Automatic

In the last several weeks, the car has been making a very loud sound opening and closing both front doors.  Loud as in you can hear it from 20ft away and it would scare the daylights out of you.  The door check straps *looked* swollen and rusted.

I replaced both door check straps a few days ago and they were both quiet.  But the driver's side door is squeaking now....it's no whereas loud as before I replaced it.

Did I do this incorrectly, too tight maybe? I mean they seem to function fine.  I can't see anything wrong with the hinges.",2,1757534428.0,7,AskMechanics,1757619180,2025-09-10 20:00:28,2025-09-11 19:33:00,"whiskeythrottle (Score: 3): White lithium grease is your friend.

yeetlol (Score: 1): Put a layer on silicone grease on that rod, can almost guarantee it will go away"
1ndoirp,Should this be replaced?,"Asked my mechanic uncle, he said it’s fine and cut the piece off. Just looking for a second opinion.",1,1757534059.0,3,AskMechanics,1757619180,2025-09-10 19:54:19,2025-09-11 19:33:00,"Nada_Chance (Score: 1): No leak, no bulge, no visible or damaged sidewall plies/cords, no problem.

Cyberus7691 (Score: 1): Unc is right."
1ndo9s0,AC/heater fan stuck on full blast,"I have a 2004 toyota tundra. The fan knob fell off, and I guess I put it back on wrong and turned it the wrong way, because now it's on full blast and I can't turn it down/off no matter how I put the knob on and turn it. If I just want it to be off, can I simply find the appropriate fuse and pull it out? Also, would the knob be something a mechanically inept person such as myself could fix somewhat easily? I'm not sure what exactly to search to find a youtube video for that...",1,1757533461.0,4,AskMechanics,1757619180,2025-09-10 19:44:21,2025-09-11 19:33:00,"I_-AM-ARNAV (Score: 2): Yeah if you pull the right  fuse out, she'll stop blowing. 

It's a fairly simple fix.

Vuvuian (Score: 1): Got needle nose pliers? Could try using that to turn the spindle on the a/c dial."
1ndo269,Need to fix my car with ZERO experience,"I recently bought my first car — a used 2021 Audi A4 (about 3 months ago). Lately, I’ve been hearing unusual noises from both the brakes and the engine. At first, I didn’t think much of it since I drive very carefully, but the noises kept getting worse.

I took it to a service center and was told I need to replace the brake pads, brake motor, and motor mounts. The quote I got is $4,500. That feels way too high, and I’m worried I’ll get taken advantage of since I have **zero experience with car maintenance/repairs**.

Can someone point me to the right direction? 

Inspection Details:  
ON TEST DRIVE I FELT TWO DIFFERENT FEELINGS WHEN BRAKING I FELT A BRAKE PULSATION. FOUND FRONT BRAKES TO HAVE BRAKE MATERIAL TRANSFER THAT CAUSES A SHUTTERING FEELING WHILE DRIVING. SEE ESTIMATE FOR BRAKES. I ALSO FELT EXCESSIVE ENGINE MOVEMENT AND FOUND MOTOR MOUNTS COLLAPSED CAUSING ENGINE TO HAVE EXCESSIVE MOVEMENT AND VIBRATION. RECOMMENDED TO REPLACE BOTH MOTOR MOUNTS; FRONT BRAKES ARE PULSING DUE TO MATERIAL TRANSFER TO VEHICLES ROTORS. RECOMMENDED TO REPLACE.",0,1757532967.0,5,AskMechanics,1757619180,2025-09-10 19:36:07,2025-09-11 19:33:00,"libra-love- (Score: 1): German cars are expensive. This is known. If you didn’t know that, you did zero research. 

Go to an indie shop that’s comfortable working on German cars. You’ll likely get a lower Quote. But this car will NEVER be cheap to repair. 

Also in the future, never ignore noises. That’s how you go from a $400 repair to a $4000 repair 

Edit: brakes may or may not be needed at this moment. Motor mounts are IMPERATIVE

Working_Dog8576 (Score: 1): Watch YouTube videos on how to fix it and if you still aren’t confident enough try taking it to a local mechanic instead of the dealer because their prices are usually lower"
