id,title,selftext,score,created_utc,num_comments,subreddit,scraping_time_utc,created_datetime_utc,scraping_datetime_utc,top_comments
1odocm9,Recently installed a new fuel pump and started hearing a new noise.,I recently installed a new fuel pump on my 99 Grand Marquis and started hearing a strange sound. It doesn't sound normal. Maybe I'm just paranoid. Any thoughts?,1,1761176842.0,7,MechanicAdvice,1761248140,2025-10-22 23:47:22,2025-10-23 19:35:40,"240x6 (Score: 1): is it super loud or only when you get under the car/listen for it? potentially your new fuel pump is actually working or works way better than your old one so it’s making noise now- which is a good thing. maybe read reviews on the fuel pump you purchased and see what other people have to say. 

also do you hear this same noise when you turn the key to the 3rd position (ignition on, don’t crank car, just to where all your lights on your dash turn on)- do you hear this same noise for a few seconds and then it stops?"
1odo527,What is this noise from!?? Video w/ audio in description,"1998 Hzj75 1hz n/a

Can only hear it while sitting in the car barely noticable from the engine bay

While moving i dont have to be accelerating to hear it but it gets louder with more rpm. 

Happens while driving and stationary.

Speedometer stopped working about a week ago maybe it has something to do with it?

",1,1761176277.0,2,MechanicAdvice,1761248140,2025-10-22 23:37:57,2025-10-23 19:35:40,django24_7_365 (Score: 1): Could be the tach cable dry and needing lubricant
1odnsm7,2018 Toyota Prius - Gas keeps spitting back out at me. Is it safe to drive?,,1,1761175352.0,4,MechanicAdvice,1761248140,2025-10-22 23:22:32,2025-10-23 19:35:40,"slavinindai (Score: 1): Can you explain more? Like are you running it while its ignition is on?

wiishopmusic (Score: 1): Gas is spitting out while filling up? Yes it’s ok to drive to the repair shop."
1odnrjl,How many misfires are too many?,"I’ve been hooking up my scanner to the vehicle a few times lately and I’m seeing some misfires. Anywhere from 0-9 misfires. With no particular pattern. Sometimes one cylinder develops 6 misfires, another day that same cylinder develops 0 misfires. The car drives perfectly fine and I can’t tell when these misfires occur I just know they are being recorded on the system. ",1,1761175268.0,4,MechanicAdvice,1761248140,2025-10-22 23:21:08,2025-10-23 19:35:40,"cardoc22 (Score: 1): You should have basically zero misfires     Year make model????

Equana (Score: 1): When a misfire code is set, you have too many misfires."
1odnngx,Mechanic botched oil change,"I just had my oil changed in a 2019 Tacoma with 116k miles on it, two days ago. I'm headed out of town, about to drive from GA to VA and about 49 miles in I get a low oil warning. Pull over immediately and there's oil all over the bottom of the truck, and the dip stick is totally dry. 

I'm waiting on a tow back to the place where I had the oil change done. I guess what I'm wondering is how would I know if there's real damage done to the engine, and what would that be? How would I prove this and hold the shop accountable. I'm a couple months away from paying this thing off and I was hoping to keep this truck for as long as I could. Thanks in advance ",1,1761174969.0,11,MechanicAdvice,1761248140,2025-10-22 23:16:09,2025-10-23 19:35:40,"vaporsilver (Score: 3): Oil Analysis - Blackstone Laboratories

https://www.blackstone-labs.com/

Send them a sample and you'll get a full detail on what is going on.

principaljoe (Score: 3): you tow it to any other ASE certified shop and have them document findings.  You tip them 100 dollars up front to do a thorough job documenting.
have him pull a couple oil samples to send to labs and document pulling them.  you don't have to test them immediately but whoever reads his writeup will know you're no fool.

there is no reason to go back to the original shop, except if you want to save them postage by picking up a check.
this should be handled 100% over the phone and email, and then small claims if they don't pay.

the original shop has total conflict of interest and can only work against you if desired.

edit: tip the tow truck driver and have them document how the car was found and what under the car looks like."
1odnl1u,Help! Tried to pull a fuse and cracked the top?,"Tried to pull a 60Amp fuse, the ABS one, but couldn't get it out. The plastic top disappeared in the process. How would I protect it till I can get it to a shop?",1,1761174792.0,10,MechanicAdvice,1761248140,2025-10-22 23:13:12,2025-10-23 19:35:40,"cardoc22 (Score: 3): Just put the fuse cover back on and your fine

agravain (Score: 2): Just put the fuse box cover back on"
1odnjnm,Is it worth it being a mechanic?,"So I’m currently an A/V installer. My background is in cars though, Mainly audio installs (not that DIY stuff) I’m very familiar with all data and such.

My main worry is pay. I make 700-900 a week (overtime) and can’t afford a pay cut. At least not a big one. 

You guys think dealership or locally owned shop is the way to go? I know the market is trash RN but I’m getting tired of the travel I deal with in my current position.

Thanks in advance.",1,1761174693.0,6,MechanicAdvice,1761248140,2025-10-22 23:11:33,2025-10-23 19:35:40,"QwopperFlopper (Score: 1): As a mechanic it’s hard on your body and the pay is garbage most of the time. It will also make you hate cars. 

Go into machining if you want a career change. Lots of money in it for people with common sense. 

I make around 1k a week after tax and my job is fairly stress free.

240x6 (Score: 1): definitely try doing regular repairs on your own vehicle for a while and see what you think of it. this sucks to say but some people have it and some people just don’t. you gotta be somewhat of a mechanically inclined person, which from what you’re saying it seems like you might be.

dealers are usually either a hit or miss and it’s pretty cutthroat there- i can’t speak from experience though cause i’ve only worked at independent shops and chains. 

unfortunately, if you do decide to start- you will most likely start from the bottom.. so as a lube tech. pay probably won’t be as good as what you’re getting now, so you will more than likely have to take a pay cut.. unless you miraculously find a place that wants to pay you as much as you’re getting now with not any real professional automotive experience. 

once you make your way up to a technician role, your paycheck is practically what you make of it. you get paid flag rate, there’s a set amount of hours you will get paid for when you do a specific job (manufacturers make these rates for the specific cars), you win by beating the set time. for example if a certain job calls for 6hrs and you finish it in 2hrs, you win. 6hrs worth of pay just for 2hrs of your time. or, it can go south- and you can spend 8hrs on that job but only get paid for the 6, that’s when you lose.

i know so many techs making 150k+ a year, these guys are pushing a wholeee bunch of hours. as you get better at your job and perfecting your craft- your paycheck will reflect it. EFFICIENCY is the key to this game.

if you have any questions feel free to DM!"
1odnhqf,Are parts being on backorder an issue for all brands?,"Do all brands deal with parts being on back order with no ETA available?

Or is Jeep/Stellantis the worst?

Currently going on one month of my Jeep sitting in the service department waiting on a part (covered under warranty) that the service advisor tells me is on back order and doesn't have an ETA",1,1761174551.0,15,MechanicAdvice,1761248140,2025-10-22 23:09:11,2025-10-23 19:35:40,"cdojs98 (Score: 3): Since Covid, it's been an industry-wide issue. I was with Toyota when it began, and we saw issues already starting in 2020. Went to CDJR trying to find work and the shortages caught up quickly anyway; same story. Fast forward a few years, 2023-24 I was with JLR; even worse there.

Brianthelion83 (Score: 2): Everyone has back orders and delays. Everything is on intergalactic back order. 

Fleet I manage has several freighliners waiting on oneboxes for months. I have two
Silverados that need a tube for the intercooler , been down since July of 24."
1odnhon,Peak throttle position bellow 100%,"I have bought a car 4 months ago, it is a 2006 corolla with the 1.4 4zz engine. Recently while monitoring sensor data just for the kicks of it, I noticed that the throttle position can not get above 92.16%, at first i thought that that the carpeting or something prevents the pedal from reaching it's bottom possition, witch is not the case. It is a cable throttle and opening it all the way by hand, by twisting the throttle itself produces the same number. I have 0 issues with that car so far, apart than the fact that once in while it might not fire up first time, but that could be due to the fact that it has a dual fuel system(petrol & lpg), letting it run for 3-4 seconds with petrol before sutting it down prevents it for what i understand. So is that reading normal or not ?

Btw i have not tested it while the engine is running, but i dought it makes any difference as it is cable operated, the idle possition is at 14.5% while running or not, and the idle is fine, i have had no issues with it.

Thanks to anyone helping, I very much appreciate it.",1,1761174548.0,4,MechanicAdvice,1761248140,2025-10-22 23:09:08,2025-10-23 19:35:40,"Grand_Possibility_69 (Score: 2): This is normal and not a concern at all.

>It is a cable throttle and opening it all the way by hand, by twisting the throttle itself produces the same number.

This proves that it's how it should be.

It's done on purpose.

One reason could be explained by example of electronic anti shutter valve on some VAG car diesel engines. It's exactly like throttle. It's used for shutting engine and to help with egr. The position sensor on them goes exactly from 0% to 100%. And as it's used the plate and hindge wears. With enough wear the position sensor will go beyong 0% and 100%. So suddenly the sensor will go over as they left no extra travel on sensor. Then the system will think it's at the opposite end and constantly try to force it in exactly wrong direction. So you'll have to change the part. Some people have fixed them by adding a limiting tap."
1odngok,Metal in oil,Went to change the oil while currently working on a idle issue. The car is running fine outside of it idling very poorly but when I went to change the oil there is a ton of metal. It looks like tiny rings ,1,1761174475.0,2,MechanicAdvice,1761248140,2025-10-22 23:07:55,2025-10-23 19:35:40,"240x6 (Score: 1): almost kinda looks like the threads in your oil pan for your drain plug… which would honestly be the best case. if that’s from your engine internals, then oh man hahaha. if you have had no drivability or noise issues with your engine, i would say just run it!!!"
1odnd98,Autozone couldn’t help. Does anyone know what this is?,Hey! I have a 2018 Chevy Sonic LT Turbo sedan. the check engine light came on and i took it to autozone for diagnosis. they said this one code showed up and it could be a multitude of things and they don’t know what the problem is. i figured i’d post here before i fork over hundreds at a shop. TIA! ,0,1761174231.0,15,MechanicAdvice,1761248140,2025-10-22 23:03:51,2025-10-23 19:35:40,"SmokedWhiskey (Score: 2): AutoZone’s scan will point you in the right direction but it won’t give you the exact cause, just the general area of the problem

A system too lean code can go one of two ways. Sometimes it’s quick and simple, other times it’s a bit of a chase depending on how the vehicle is behaving. A good shop should be able to explain their diagnostic process and what the costs will look like before getting started. In most cases lean faults are diagnosed within about an hour, though that’s just to identify the cause, not the repair itself

Also try to avoid the free diagnostics trap. It might seem like you’re saving money, but if a shop isn’t being paid to properly test and verify the issue, it often leads to parts being replaced unnecessarily instead of the actual problem being fixed

SubpopularKnowledge0 (Score: 2): The code means that ur air/fuel ratio is off. The engine is receiving more air than it is expecting, or it is receiving less fuel than it should. Most likely its a vacuum leak somewhere in ur system, but u need a shop to diagnose it correctly."
1odnbtu,Bump stop rot,Not a mechanic but it looks like the bump stops on this dodge Dakota are rotted badly what is the best way to go about this can they be fixed? It doesn’t look like they’re attached to anything in the suspension but like I said I really don’t know ,11,1761174123.0,8,MechanicAdvice,1761248140,2025-10-22 23:02:03,2025-10-23 19:35:40,"workinginacoalmine (Score: 13): Looking at all that frame rot, I'd say those bump stops are the least of your problems.

QwopperFlopper (Score: 6): I would inspect the rest of the frame. Those dakotas are total rust buckets."
1odnbkp,can someone please help me find out what this is?,"i just love this car and want to build it for my own enjoyment, but don’t want to spend hundreds of dollars on tints and rims only for it to need a rebuilt engine, i got this 2000 camry LE at 120k miles with new timing belt, and new radiator, car fax is good im just not sure what this is, seller said this car sat for a few years, please help me diagnose it",1,1761174104.0,13,MechanicAdvice,1761248140,2025-10-22 23:01:44,2025-10-23 19:35:40,"not_ur_avg_nerd (Score: 3): Rare chance it could be the timing bet loose and slapping something or starting to come apart. I’ve had them make sounds like the engine was knocking

I_AM_W0LF (Score: 2): Checked plugs and wires and the air filter?"
1odn43k,Endoscope pictures,"Hello.
Can someone who does engines help me with understanding this endoscope?
I am aware that something went wrong in this cylinder but I am wondering what and what are next steps.
I am doing preventive endoscope - engine did not have any bigger issues and was running before.
I think it was running lean? Is it possible to put new sparkplugs, replace injectors and run it or I am looking at engine rebuild?
Thank you.",1,1761173562.0,3,MechanicAdvice,1761248140,2025-10-22 22:52:42,2025-10-23 19:35:40,"M240i_Lew (Score: 1): I would be concerned with the bore scoring. (Vertical lines down the bore)

As for the debris and edges of the piston I can't comment."
1odn008,What’s causing this sound when I break?,"I have a 2023 VW Jetta with less than 13,000 miles. I believe the engine is 1.5L I-4. My car has been making this sound whenever I break at low speeds. 

It could be making the sound all the time when I break, but I’ve only ever noticed it when I’m pulling out of the garage or out of parking spaces and have to break to check my surroundings before continuing on with my drive. Doesn’t sound like it can be heard as much outside of the car as it can be heard when you’re inside. 

After I press the break I feel like there’s still something that’s continuing to move for a second or 2 longer than it should? Like something isn’t catching the same way it used to? I know that’s a terrible description😅

I first noticed this happening after I got my alignment done…but maybe it’s been doing this the whole time? I’m weirded out because the place that did my alignment initially said they couldn’t align the back due to the camber (?) being fixed…but then they took my car back again and miraculously was able to align the whole thing? I’m worried they did something that is causing this noise. I would have brought it back, but the same week I moved 800 miles away so that’s wasn’t an option. ",1,1761173267.0,2,MechanicAdvice,1761248140,2025-10-22 22:47:47,2025-10-23 19:35:40,"Jasonh123_ (Score: 1): I would take it by the dealer, leave off the part about another shop working on it though in case the warranty will cover it."
1odmiwe,Charged battery to 12.80V but still doesn’t start,"I charged the battery to 12.80V using one of those plug-in chargers. Checked with a multimeter, showed 12.80V; reconnected the battery terminal, tried to start — all dash lights came up, car kept clicking, but no start. Checked the idle voltage of the battery, down to 12.24 — do I have a bad battery or something else is going on? Thanks for any suggestions!",1,1761172016.0,3,MechanicAdvice,1761248140,2025-10-22 22:26:56,2025-10-23 19:35:40,"Sophias_dad (Score: 1): Your battery probably has very little capacity left. Measure the voltage while someone is turning the key to start.

BKFM72 (Score: 1): You need to measure voltage when trying to crank motor. Also clean battery terminals even if they look ok. Also check connections and voltage at starter when cranking"
1odmhft,Why is my steering wheel doing this?,"I’ve changed out a bunch of stuff after something happened to my left side suspension. Now this is happening. If I turn left it’ll try to go to the right and vice versa. It didn’t happen before so I’m curious what yall think. 
",1,1761171906.0,34,MechanicAdvice,1761248140,2025-10-22 22:25:06,2025-10-23 19:35:40,"Y_0un9_dr1p (Score: 3): It’s a gs300 2001 sorry for not including that earlier

james734 (Score: 1): Is the wheel bent?"
1odmgro,What is this?,,1,1761171855.0,4,MechanicAdvice,1761248140,2025-10-22 22:24:15,2025-10-23 19:35:40,"B-asdcompound (Score: 1): Government tracking device. You should probably rip it out.

DestinationUnknown13 (Score: 1): Garmin dock. [https://ebay.us/m/5KXin3](https://ebay.us/m/5KXin3)"
1odmd93,Need Help Identifying,2002 Chevy Avalanche 1500 z71 5.3 Vortec. Trying to figure out what this part is as it is leaking and I need to research repairs. Thanks,1,1761171594.0,3,MechanicAdvice,1761248140,2025-10-22 22:19:54,2025-10-23 19:35:40,"sabre420z (Score: 1): Rear main seal

waynep712222 (Score: 1): the oil pressure switch is on the top drivers side rear of the engine. between the valve cover and the back of the intake manifold.. 

 that is the first place to check.. spray it off with some carb or brake cleaner.. wrap in paper towel or toilet paper and start the engine.. let it run a few minutes.. rev it up a few times then shut down. check the paper towels to see if you find oil.. 

 valve covers gaskets could be an issue.."
1odm5cs,Infinity QX60 awd grinding noise,Getting a grinding noise from the right rear wheel on my vehicle. Brakes are good and the dust shield isn’t rubbing. The noise goes away when going at idle speed or turning the corner. Wheel bearings? ,1,1761171035.0,5,MechanicAdvice,1761248140,2025-10-22 22:10:35,2025-10-23 19:35:40,"Successful-Cook6806 (Score: 1): Sounds like a wheel bearing to me, if you're located in North America take a look at rockauto they have some good quality parts there."
1odm483,Is there a gas cap I can buy that is like your standard gas cap but it has this easy fuel port on it?,I have,0,1761170956.0,11,MechanicAdvice,1761248140,2025-10-22 22:09:16,2025-10-23 19:35:40,"Wolfire0769 (Score: 5): Why do you want a gas cap?

Taipers_4_days (Score: 8): They are widely available, just DON’T STICK ANY CYLINDERS INTO IT. They are not easily removed without help."
1odm1ar,Help me identify this line,It look like it's leaking under my 2010 mazda 3 but i don't know what it is...,1,1761170755.0,3,MechanicAdvice,1761248140,2025-10-22 22:05:55,2025-10-23 19:35:40,Maleficent_Worker116 (Score: 1): Fuel line or power steering. Smelling the fluid should give you the answer
1odlofo,2002 F250 7.3 PowerStroke,"Hi all —

Picked up a 2002 F-250 7.3 L and the blower motor isn’t coming on. I’ve traced the circuit with a multimeter and test light.

Here’s what I found:

Slot 85 (coil power) on the blower-motor relay has no voltage with the key ON.

Slot 86 (coil ground) is open and does not complete a ground path.


To test, I jumped 12 V into slot 85 and grounded slot 86 to the chassis — the relay clicked and the blower motor came on. All fan-speed settings worked, but the blower stayed on even when the selector was in the OFF position.

This tells me both the relay and motor are fine (I think), but:

The coil power feed from Fuse 28 → slot 85 is open inside the Central Junction Box (CJB).

The ground side (BN/YE wire from slot 86 → function selector → G201) is also open.


So it seems the CJB may have an internal fault or a damaged trace.
Before I bypass it, I’d like to confirm there isn’t something I’m overlooking.

Is there a reasonable or known workaround for this issue?
(Schematics attached for reference.)

",1,1761169882.0,5,MechanicAdvice,1761248140,2025-10-22 21:51:22,2025-10-23 19:35:40,"general_transport (Score: 1): Wouldn't the fan be controlled by the computer, triggered on by some temperature threshold from thermocouple reading somewhere?

TurboXMR79 (Score: 1): Did you check fuse 55?"
1odlmu5,chirping noise,"Recorded this after driving home from work
sat parked idle 
been ongoing for a while and had serpentine belt changed back in march thinking thatd solve that but it didnt

2006 chrysler town and country",1,1761169777.0,2,MechanicAdvice,1761248140,2025-10-22 21:49:37,2025-10-23 19:35:40,FitAbbreviations7976 (Score: 1): forgotcto note it only got louder in the end because i moved my phone closer to the car
1odlluh,Are these Denso ignition coils fake?,"Title basically says it. They came in a box that says made in Japan, Chinese characters are next to a few words. I don't see the metal piece on the top of the coil in photos online. These are also not what the parts looked like in the listing. 

Really just a sanity check because they look fake to me. ",12,1761169711.0,26,MechanicAdvice,1761248140,2025-10-22 21:48:31,2025-10-23 19:35:40,"Successful-Growth434 (Score: 30): Probably fake. Ebay sellers sell OEM-looking stuff all the time. If I am trying to buy OEM, I use Rockauto or go to the dealer.

RelationshipOne9466 (Score: 7): Parts like coils and plugs etc should never be aftermarket. I know Denso is a major OEM supplier for many manufacturers but not in all cases.  And the Chinese characters on your box would give me the willies. Only my opinion of course."
1odlknn,Have i destroyed my clutch?,"Replaced my clutch last week. Did a hard acceleration today, and the wheels spun a bit. Now the biting point is really high, and it’s super difficult to start on hills. Should I just replace everything again, or is there something else I can do?",2,1761169632.0,7,MechanicAdvice,1761248140,2025-10-22 21:47:12,2025-10-23 19:35:40,jasonsong86 (Score: 1): Something is not right.
1odlk08,Tapped in this pilot bearing until it bottomed out and hit the lip inside the bore. Mechanic friend and ChatGPT both say that I put it in too far. Did I mess up? 2010 Honda Civic Si (K20Z3),,0,1761169588.0,15,MechanicAdvice,1761248140,2025-10-22 21:46:28,2025-10-23 19:35:40,"MoneyPop8800 (Score: 3): Service manual says it needs a 2.4mm-2.6mm depth from the face of the crankshaft. If it’s bottomed out, it’s too far

Jaded_Public5307 (Score: 2): It doesn't matter."
1odldys,"Sounds like rod knock, but...","My R18A1 EXS Civic got a peculiar noise that sounds like a knock but it's hard to listen. To listen, I have to hold mid throttle and it appears around 2.5k to 3.5k rpm but I can only listen it in idle. Sometimes when forcing first gear around 4k to 5k rpm but it's even quieter.

Also I've been daily running with this noise since I got the car, more than 2 years and it did not increased with time. And also do not appear in higher rpms like 7k.

Already replaced: Engine mounts and accessory tensor and belt. Valve adjustment also was done. Oil 5w30 8100 Motul Ecolite recently changed.

Any thoughts? 

Thank you in advance ",1,1761169186.0,5,MechanicAdvice,1761248140,2025-10-22 21:39:46,2025-10-23 19:35:40,"Miserable-Werewolf35 (Score: 1): Ive done a few of these engines. Sounds like timing chain rattle to me. How many miles?

Traditional_Ad_1360 (Score: 1): Rod knocked is a double knock."
1odld3j,Is a $300 parts + labor for a sway bar link replacement a bit too or is that the standard rate?,"From what I can tell, this seems like it might be on the higher side. I drive a 10+ year old car that's probably worth like $4-5k now. Was quoted that amount to replace the sway bar link setup because the car was making a weird noise when going on humps, etc. It's not too bad a noise but $300 seems like a bit for a minor issue that I'm ok with ignoring. Or could I be missing something here?

Update: 
To clarify, that's $300 for both links and that includes labor ",0,1761169125.0,15,MechanicAdvice,1761248140,2025-10-22 21:38:45,2025-10-23 19:35:40,"AreaBackground5339 (Score: 2): Just one endlink? They’ll bill an hour and the part is cheap. You’re looking at about $250/hr so yeah pretty high.

Disastrous-Current-6 (Score: 1): What kind of car do you drive? I just did my sway bar and the parts were $35 from auto zone."
1odlb1q,Hyundai Atos please help me identify what the noise is,,1,1761168985.0,9,MechanicAdvice,1761248140,2025-10-22 21:36:25,2025-10-23 19:35:40,"Porstage (Score: 1): Reposted due to error in posting.

QwopperFlopper (Score: 1): Is it low on oil?"
