id,title,selftext,score,created_utc,num_comments,subreddit,scraping_time_utc,created_datetime_utc,scraping_datetime_utc,top_comments
1o54rt3,Any idea what is going on?,"2013 Scion Frs (fa20), just started doing this ",68,1760313593.0,62,MechanicAdvice,1760383989,2025-10-12 23:59:53,2025-10-13 19:33:09,"oStreamZo (Score: 58): Cooked im going to say

star08273 (Score: 29): that sounds like a spun bearing"
1o54mi2,Is this strut mount bad?,I've had a clunking sort of rattle in the front end of my daily (2015 Kia Optima EX) ive been chasing.  The outer tie rod ends had a ton of play so I decided to replace those thinking that was it but while I was under there I noticed some movement in the strut mount as well.  Think this could be my rattle?  A bad strut mount also seems to be consistent with the heavy inside wear I discovered in all four corners as well.  I think ive got strut mounts and an alignment in my future but a seccond opinion for my sanity would be appreciated! ,1,1760313174.0,4,MechanicAdvice,1760383989,2025-10-12 23:52:54,2025-10-13 19:33:09,"Lumpy-Marsupial-6617 (Score: 2): Yeah it's not supposed to move like that. It's supposed to be solid without movement. The strut shock needs to travel up and down not what it's doing right now.  The fact that it's moving all around the sides in addition to traveling up and down means that it's probably clunking up against the strut mount area when it flexes too much. 

That's some really poor material imho."
1o54hm5,"Is this a battery, alternator, or catalytic converter issue? (2019 Subaru)","We’ve been having to jump our Subaru very often for the past few months. Like 75% of the time, i’d say. Our commute to work is also very short (give or take 10 mins) so we thought maybe we weren’t driving it far enough to kick alternator into working. Assuming it was a battery issue, we took it to a Batteries Plus to have the battery tested. They said the battery was totally fine, so we’ve been manually jumping it since while we save money to see a mechanic. (Yes, I realize now that waiting was a mistake.) 

No check engine lights, etc., but for the last week or so it’s been smelling like rotten eggs in the car. We assumed it was roadkill or food that we couldn’t find. Yesterday, the battery was super dead. No lights/sounds at all when putting in the key. We tried to jump it and nothing. Google said it could be a bunch of issues, including the catalytic converter and alternator. I bought a car battery charger to charge the battery overnight indoors, but i’m sketched out by the possibility of the battery leaking, being flammable, etc. No bulging that I can see. 

Any advice you can give us would be very helpful and appreciated.",1,1760312785.0,7,MechanicAdvice,1760383989,2025-10-12 23:46:25,2025-10-13 19:33:09,"wormwormo (Score: 3): If your battery is more than 5 years old it’s gone.  The most common cause is usually the right answer. So replace that battery before looking into the starter, fuel pump, etc

Btw Subaru are known for crappy weak batteries from the factory.  Go to autozone.   Peo boys or. Advanced auto.   Buy a good battery like gold.  Or diehard.   Online shows you batteries that will fit your car.   Buy the heaviest most powerful cca. One

FixxerAuto (Score: 2): A battery tender may work well for you- just plug an extension cord into the car each time you park it at home- kind of like a block heater on a diesel truck. THe rotten eggs smell is the cat- probably going bad from the short trips- you need to drive that car somewhere far at least once in a while to get everything up to temp and burned off. 10 minute trips are hell on vehicles in the long run."
1o54akd,Clutch pedal question,"have an 85 gt that I need to press the clutch pedal all the way to the floor for the clutch to disengage, and the first 1-2 inches of travel are very loose how can I fix/adjust this? My knowledge of clutch workings is cables and i believe this is a hydraulic system. Also this issue just started recently. Thanks in advance",1,1760312232.0,3,MechanicAdvice,1760383989,2025-10-12 23:37:12,2025-10-13 19:33:09,"Grand_Possibility_69 (Score: 2): I'm not sure what car this is.

First, make sure it's not low on clutch fluid. If not and you haven't added it's not a leak on the line or slave. Next check it's not master. Push pedal all the way down. Then move up by about an inch or less than 3cm. Then move back and forth this area for 10 times. Or even more. Stopping with it all the way down. Then try putting it in gear (with engine running) if you now can't because clutch isn't released it's a bad clutch master.

You could checks the clutch pedal adjustment. Mostly for pedal-free play. But also pedal height. But this should only need adjustment when the clutch master, clutch pedal, or maybe on some cars clutch switch for cruise control was replaced.

Other than these it's a bad clutch. Then you'll just have to live with it until you get it replaced or it starts to slip."
1o547xw,2018 Silverado 1500 light issues,,1,1760312026.0,2,MechanicAdvice,1760383989,2025-10-12 23:33:46,2025-10-13 19:33:09,sourestpatchkid (Score: 1): Additional info: 2018 Chevy Silverado LT 1500 5.3L V8 Gas automatic transmission and 118970 miles on the truck
1o545jd,what is this?,"been having trouble when I hit a bump truck goes ape shit. assuming it’s supposed to be bolted to the frame where circled in 2nd picture, but there is not bolt or anything, i’m assuming that broke and is what’s causing this. i could 100% be wrong though i’m no mechanic just a poor kid that’s always fixed his own shit lol in theory could I just somehow reattach it to the frame or does the part have to be replaced. it’s a 2nd gen 4x4 ram 1500 btw, thanks in advance for any help ",3,1760311844.0,2,MechanicAdvice,1760383989,2025-10-12 23:30:44,2025-10-13 19:33:09,"Orcapa (Score: 1): Sounds like you have the Death Wobble:

https://www.thurenfabrication.com/pages/death-wobble-explained"
1o5454m,What is supposed to go here?,I bought an aluminum radiator and it fits perfectly except for one small port that leaks coolant when I try to fill it and it doesn't exist on the oem radiator. Does anyone know what kind of plug or petcoc is meant to go here? ,1,1760311814.0,3,MechanicAdvice,1760383989,2025-10-12 23:30:14,2025-10-13 19:33:09,"FixxerAuto (Score: 2): Im thinking that may be for a low coolant sensor?

keep_username (Score: 2): Sounds like you had better contact the manufacturer and find out. They may have a plug for models that don’t use the connection on the side. Are there threads in the hole?"
1o544ac,"370z, car won’t detect keyfob / neither the door locks / unlocks, have to put the key inside the key slot to start the car","2020 370z, car won’t detect keyfob / neither the door locks / unlocks, have to put the key inside the key slot to start the car.

It’s not the keyfob itself 

- reprogrammed key myself thought i was doing it wrong so I called 2 different locksmith, same result. Key gets programmed but car won’t detect key unless it’s inside the keyslot, buttons don’t work on keyfob ",1,1760311750.0,4,MechanicAdvice,1760383989,2025-10-12 23:29:10,2025-10-13 19:33:09,"loganmax8 (Score: 2): I'm assuming you did already, but it's not mentioned in your post. Did you make sure the battery is any good?"
1o53zwd,09 Toyota Camry 3.5L electrical question for air intake control valve…,"The green and purple wires almost look cut but it looks as if it’s a common issue of not enough slack causing it to break. One wire is power and the other is ground and from research these wires are for the vacuum solenoid valve that controls the air intake actuator. No idea when they broke but I noticed after I swapped my radiator earlier today. The vehicle has been and continues to feel very smooth mechanically. No vibrations or stutters when at idle or accelerating. No rich smell to exhaust. Even starts up without a hitch. I’m just a bit stumped. I’m by no means a mechanic but I can get by. I do plan to test the plug with a meter but electrical on a vehicle can be finicky so I’m here first while this problem seems to not be a problem.

Any ideas what I should be paying attention for until I fix this issue?

Thank you in advance!",1,1760311411.0,5,MechanicAdvice,1760383989,2025-10-12 23:23:31,2025-10-13 19:33:09,FixxerAuto (Score: 1): Just go to the local junk yard and cut a pig-tail off another car with some extra wire- splice it onto your harness and your done.
1o53vx3,Drums & Shoes,,2,1760311110.0,2,MechanicAdvice,1760383989,2025-10-12 23:18:30,2025-10-13 19:33:09,"oshaCaller (Score: 1): They're a lot harder than a disc brake job, but watch a few videos and you should be ok. Only take one side apart at a time, that way you can use the one that's not apart as a ""guide"".

I mainly use a pair dykes like these, I use them to grab the springs:

[cutters](https://www.harborfreight.com/11-in-high-leverage-diagonal-cutter-59737.html?hftm_sc=740&utm_source=google&utm_source=google&utm_medium=cpc&utm_campaign=22887600187&campaignid=22887600187&utm_content=186569172431&adsetid=186569172431&product=59737&gad_source=1&gad_campaignid=22887600187&gbraid=0AAAAADAHb4cz5puiMQOS_35n98d6ulLFo&gclid=Cj0KCQjwo63HBhCKARIsAHOHV_Up4AAA8rQW_4_iTYb9vdcy8X4LeiOCdZAHqOoe5wO9NFwApDzPRI0aAhtZEALw_wcB)

and a tool kit like this:

[tool kit](https://www.harborfreight.com/drum-brake-spring-pliers-kit-3-piece-63640.html)

If you're feeling froggy you can replace the wheel cylinders, the shop you go to would have told you they were leaking so they're probably fine. Sometimes when you are taking them apart you can knock one of the cylinders out if you aren't careful and you'd have to put it back together and bleed the brakes if that happens.

You will have to adjust them when you are done, you want to adjust them where they have a light drag. Using your parking brake often should keep them adjusted.

I've been a mechanic for 20 years and I've done less than a hundred drum brake jobs, a lot of newer mechanics have no clue on how to do them."
1o53j9h,2004 infiniti g35 upon turning the key this noise,Rattling noise after turning the key to ignite. Any ideas on what it is?,2,1760310134.0,2,MechanicAdvice,1760383989,2025-10-12 23:02:14,2025-10-13 19:33:09,FixxerAuto (Score: 2): Sounds like an issue between the ring gear and starter- id pull the starter to inspect.
1o53fgv,Why could my gm engine crank fast but not start after changing intake manifold and valve cover?,"2018 Buick encore preferred 1.4liter 

It used to run and start fine, but had a rough idle, loud hissing near the valve cover, and sometimes stalled at stop lights.

I replaced the intake manifold first, and it actually started and ran fine afterward but after a short drive it shut off while I was driving. Then I replaced the valve cover (new gasket and PCV diaphragm) to rule out the hissing/PCV issue, but the same thing happened: it started and ran briefly, then shut off again while driving, and now it cranks fast but won’t start at all.

So far I've

Purge valve replaced plugs checked (MAF, MAP, throttle body) Tried unplugging MAF (no change) Tried unplugging purge valve

Engine codes

P0443 p0420 p0496 p1101 
",1,1760309856.0,8,MechanicAdvice,1760383989,2025-10-12 22:57:36,2025-10-13 19:33:09,"Protholl (Score: 1): How old is the engine/car?

FixxerAuto (Score: 1): Cranks fast as in no compression?"
1o53ez4,Stuck hoses,"After finding oil in one of the coil wells, I'm trying to change the valve cover to a 2.0 fsi BPY engine (Audi a3, vw golf mk5) but I'm finding it incredibly hard to free the cover by sliding off the hoses in the back of the cover. 

Those two hoses won't come off (for different reasons)
* the left hose seems fairly caked to the underlying tube and brittle. The pick I'm using is more likely to keep disintegrating it bit by bit than getting it free 
* the right hose responded better to my picks and looks free but the ridge is opposing an impossible resistance to slide it off

Any suggestions (besides cutting the hoses)?   ",18,1760309819.0,20,MechanicAdvice,1760383989,2025-10-12 22:56:59,2025-10-13 19:33:09,"Skidz305 (Score: 6): I used a 90° pick to go around the perimeter between the hose and plastic while pulling away from the valve cover and it freed up that exact same hose from the valve cover.

katakana250 (Score: 3): 2006 Audi a3"
1o5390z,Electrical Advice,Car won’t start when it’s hooked up to a battery. Makes the sound like in the video but when I attach it to a running car (like I’m jumping the battery it works) not a battery issue as I’ve tried 3 known good batteries. I’ve tried messing with the grounds and that doesn’t seem to fix it. My only guess is for some reason it needs more CCA for some reason despite the fact that it started fine on 610 CCA before it sat for a while and now even with trying 650 CCA it still won’t start. Any advice is much appreciated cause I’ve been having issues with this car for months. ,1,1760309379.0,7,MechanicAdvice,1760383989,2025-10-12 22:49:39,2025-10-13 19:33:09,Jasonh123_ (Score: 1): I’d still pull the battery and take it to a parts store to be tested.
1o536ao,Have a question,What do you think is leaking its a 2017 f150 lariat with the 5.0 and i cant tell if this is maybe a rear main seal or maybe it just something simple like the pan. Let me know probably just go with the cheapest option first anyway but was wondering.,1,1760309179.0,5,MechanicAdvice,1760383989,2025-10-12 22:46:19,2025-10-13 19:33:09,"aztechtyler (Score: 1): Rear main or oil pan. Just did one last week, both leaked

BossedupT (Score: 1): It’s common for the oil pan to leak in that exact spot on the 5.0s happened to mine when I had one."
1o52tiy,Fishing tape stuck over headliner,,1,1760308260.0,6,MechanicAdvice,1760383989,2025-10-12 22:31:00,2025-10-13 19:33:09,"FixxerAuto (Score: 1): Well, i guess youll have to take the headliner out then. It is stuck between the roof and HL?"
1o52syu,How would this turbo being too big for the manifold be installed??,,1,1760308222.0,4,MechanicAdvice,1760383989,2025-10-12 22:30:22,2025-10-13 19:33:09,FixxerAuto (Score: 1): Looks like you just need to make a spacer to go on the flange to me
1o52qbf,I broke the bolt on the valve cover,Just for context I have a 2007 Chrysler 300 3.5L V6. I was working on the car and accidentally wrenched it too tight that the bolt snapped inside the hole I need to get a retriever nail or do you guys have any advice also does it matter that only 1 bolt is missing can I still drive it? I also included a picture to make it more clear any advice would be greatly appreciated.,1,1760308030.0,6,MechanicAdvice,1760383989,2025-10-12 22:27:10,2025-10-13 19:33:09,"fallout76sucks1 (Score: 1): I mean itll probably be fine, drive it if you dont feel like fighting it but check if it leaks

Comfortable-Tip4723 (Score: 1): I did that on my truck the other half is still there I just used jb weld on the other half of the bolt"
1o52lrf,2003 Honda Accord Oil Leak,"I don't know much about cars but I'm trying to learn so I can start doing this stuff myself. I got the car started finally but now it's smoking quite a bit from this area. It smells like burning oil and there was some oil I wiped off underneath my car so I'm almost positive it's an oil leak, just not entirely sure where it's leaking from or how to fix it if anyone can help. Thanks ",1,1760307709.0,2,MechanicAdvice,1760383989,2025-10-12 22:21:49,2025-10-13 19:33:09,"SyllabubInfamous8284 (Score: 2): Valve cover gasket possibly, running down onto the exhaust,"
1o52g90,2018 Hyundai Tucson 1.6 engine noise,Any guesses on what the sound is? 70k on motor,1,1760307317.0,3,MechanicAdvice,1760383989,2025-10-12 22:15:17,2025-10-13 19:33:09,"Glittering_Clue9920 (Score: 1): Sounds like what I’d expect a Hyundai with 70k on it to sound like

Advanced_Snake (Score: 1): This sounds like a normal Hyundai/Kia GDI engine to me"
1o52cli,What is this sound?,"2001 Honda accord ex 2.3l
Sound has been driving me nuts. Pads look fine on car and I even changed both front brake hoses in worry of a bad line not letting brakes release and still the noise is there. Just does the noise when rolling even at low speed. Sound doesn’t happen when braking ",1,1760307055.0,2,MechanicAdvice,1760383989,2025-10-12 22:10:55,2025-10-13 19:33:09,ElBeefCake_ (Score: 1): have the rotors checked as well. pads might be fine but the rotors might be so warped they’re scraping on the heat shield. could also be something stuck in your wheel bearing or just your wheel in general
1o5270g,Code po441 Kia rio 2013,"Hey everyone,

I have a 2013 Kia rio that’s throwing code po441. I have already replaced the purge valve and was going to look into replacing the vent valve and vapor canister but I noticed that this line connected to the high pressure fuel pump is loose and was wondering if this could be my issue? Any advice would greatly appreciated, thank you!",2,1760306665.0,2,MechanicAdvice,1760383989,2025-10-12 22:04:25,2025-10-13 19:33:09,"FixxerAuto (Score: 1): Nah, that looks normal. the passages for the purge valve must be clogged with gunk i suppose"
1o526c5,this noise heres a better video for anyone that can help me figure out whats wrong with my car,,1,1760306616.0,6,MechanicAdvice,1760383989,2025-10-12 22:03:36,2025-10-13 19:33:09,FixxerAuto (Score: 1): Hmm well it has even compression- must be missing fuel or spark.
1o51z2b,2008 buick lacrosse just keeps dying on me,"Hi,
I'm so frustrated i may scream lol. My 2008 buick lacrosse died in in the parking lot a few weeks ago, kept saying power saving mode activated, and my windows wouldn't roll down randomly. I took it up and the code reader said everything was fine. My windows started working again so I thought maybe the problem solved itself. Well I go on my lunch break and my car dies again. I jusqqt got a new battery a few months ago. Idk why my car keeps just dying when I don't leave any lights on or anything.",2,1760306113.0,6,MechanicAdvice,1760383989,2025-10-12 21:55:13,2025-10-13 19:33:09,McDready (Score: 1): You have a multimeter? Good chance your alternator might be on its way out. Other things to check are battery terminal for a snug fit. If you have the multimeter look up how to test your alternator with it. It'd be alot of typing that a video could do a better job of explaining.
1o51unz,What's this metal plate for behind inner tie rod on steering rack?,"Im replacing my tie rods and noticed my steering rack boot on one side had broken. Looked on the other side to see how it was mounted and on the passenger side the boot had a metal plate in between the inner tie rod and the steering rack. But on the driver side there was none. I can't find anything about it online. 

What is that plate(1st picture) and do I need it for boot assembly?",1,1760305801.0,13,MechanicAdvice,1760383989,2025-10-12 21:50:01,2025-10-13 19:33:09,"FixxerAuto (Score: 1): Are you talking about the dark nut with the ball in it?

TheVillainInThisGame (Score: 0): That's probably the metal clip that is meant to hold the boot to the inner tie rod."
1o51ocb,06 Honda S2000: Had this issue happened to me just now. Anyone know what it could be?,"Would not do anything after trying again. No crank happened after pressing the start button again. I had to take out key and reinsert then it started up first time. 

Battery is dated at 9/22… could it be that? or is it the starter you think? 

69K miles 2006 AP2. No engine modifications ",1,1760305364.0,3,MechanicAdvice,1760383989,2025-10-12 21:42:44,2025-10-13 19:33:09,"Tediz421 (Score: 2): prob pushing it on the battery tbh. check the warranty date. they usually fail a little bit after with regular city kind of driving. you can pull it and get it charged/tested at an autozone for free

kyden (Score: 1): Get the battery tested."
1o51goc,Exhaust bolt stuck don’t know what else to do,"I’ve tried PB blaster overnight and MAP torch for heat. Impact went get it out, my rachet gave out before the nut and my breaker bar is too big and It catches on the exhaust should I just angle grind this off ",2,1760304836.0,10,MechanicAdvice,1760383989,2025-10-12 21:33:56,2025-10-13 19:33:09,"Similar-Assistance55 (Score: 1): 2012 370z

new-Baltimoreon (Score: 1): ""Can't be stuck if you're a liquid!"""
1o519hl,Head gasket good to use?,Got a Fel-Pro head gasket for 1989 Toyota Supra. Bent at the corner. Wonder if this will still be good to use or just get a new one instead.,1,1760304343.0,2,MechanicAdvice,1760383989,2025-10-12 21:25:43,2025-10-13 19:33:09,"SwitchAdventurous24 (Score: 1): It looks like it’s already delaminating at other points than just the edges, I wouldn’t risk it for your Supra, for an everyday beater ya send it."
1o5117r,“Starter transistor”,"1994 Toyota pickup 3vze manual 5spd

Truck Was having fuel/power issues. getting bogged down, symptoms suggested a bad fuel pump. Replaced pump and no cigar. My Mechanic replaced the piece showed in picture with a used part out the junk yard. Now I want to replace it with a new one but Cannot figure out what part this is. Mechanic swears it is an ignition transistor, nothing shows up on my searches. 

It is located right beside the ICM, under the same mounting bolts used for the ICM assembly. 

Any leads??? ",1,1760303788.0,4,MechanicAdvice,1760383989,2025-10-12 21:16:28,2025-10-13 19:33:09,"Optimal_Cupcake2159 (Score: 1): I don't know anything about the starting system, but this sort of looks more like a diode, since it only has two leads instead of three. Unless the metal tab is the emitter. Maybe searching for the term 'diode' might help. 


It might even be a MOSFET of some sort. 



Interesting if they still make those, though, the used part might be the only option.


Next idea might be try to find the specific wiring diagram and see if it has in the schematic. 

Alpinab9 (Score: 1): I dont know what you call them but they are used to reduce RF in the ignition system. (Radio frequency)."
1o50rhb,"Rear Shocks, Springs, or Both","My ‘03 Chevy Truck has developed a creek when absorbing bumps. I’ve recently changed the front shocks and now thinking I have an issue with the rear suspension. 

Question is: is it the shocks, springs, or both? Is there a way to tell? If not, what is best practice from a repair point of view? 

If I have to replace one, it seems like I might as well replace both on each side. ",2,1760303137.0,8,MechanicAdvice,1760383989,2025-10-12 21:05:37,2025-10-13 19:33:09,"TwistedBrodozer (Score: 2): The shocks and springs are cheap enough you might as well replace everything while you’re at it, and clean and grease all the pivot points back there while you’re at it.

osoteo (Score: 2): Here we call them bushines, they are rubber bands that go between the suspension and are almost always responsible for those squeaks."
1o50p5t,"Which would you buy? Some say only go OEM for Civic camshaft sensor, others say the Hitachi and a few other brands from RockAuto are more or less OEM equivalent [2002 Honda Civic EX]",,1,1760302986.0,6,MechanicAdvice,1760383989,2025-10-12 21:03:06,2025-10-13 19:33:09,"NtSFstEddie (Score: 3): When it comes to anything electronic, such as sensors, always go with OEM. When you go with 3rd party brands, NEW=Never Ever Works. There's lot of videos from Pinehollow Auto Diagnostics on YT that show this. If you get one that doesn't work and you assume it's good because it's new, it will throw you off track on what the problem really is. Then, when you can't fix it and take it to another shop, that sensor will likely be overlooked because you told him it was replaced.

Holiday-Marsupial942 (Score: 2): I would never under any circumstances spend huge money on OEM when a cheap alternative exists.  If it fails in five years, so what?  Buy another one. A 2002 car means you can't afford THE BEST OF THE BEST OF THE BEST, SIR! and so why would you spend caviar money on a bag of ramen noodles?  Yes I read that other post and he's completely wrong and clueless about ""how things are"" in the real world.  $20.00 is chump change.  Spend the money, throw it in and see how long it lasts, and ignore the wailing of Mr. Howell over here sipping on his champagne with his pinkie out, acting like he knows something you do not.  The OEM lasted 23 years, and if the aftermarket only lasts half that long, the car will probably be dead long before that."
1o50n79,How do I clean this much grease off the diff and mufflers.,I’m replacing the leaking pinion seal soon ,1,1760302861.0,6,MechanicAdvice,1760383989,2025-10-12 21:01:01,2025-10-13 19:33:09,"compu85 (Score: 1): A plastic scraper. Once you've mechanically removed a lot of the junk, use the pressure washer at a car wash.

Gloomy_Skirt_3394 (Score: 1): Brake cleaner. A something you can scrape with. Then wash after. And repeat one more time"
1o50mbi,Dash board lights after OBD2 scanner,"
Summary:

Sketchy Dude and friend come take a look at car I am selling. No lights on no codes.

They plug their scanner in. Then proceed to point out minor defects and offer me half the asking price. 

Turn my Honda accord back on, it has the VSA light, brake check light (triangle with !) check engine light PO108, manifold absolute pressure barometric high pressure circuit. It’s shifting weird and won’t shift above 40mph. It’s totally messed up. 

I unplug battery, erase all obd engine codes TCM and ECM codes with scanner at auto zone.

The lights are still on.

1. Can you even do this with a scanner the sketchy dude plugged in? Did I get scammed by the sketch ball?

2. How do I fix it?I drove around like 10 miles after I erased the check engine codes and the ECM + TCM at auto zone. Do I need a better scanner 


",2,1760302808.0,2,MechanicAdvice,1760383989,2025-10-12 21:00:08,2025-10-13 19:33:09,Ravenblack67 (Score: 1): I'll bet they pulled a fuse.
