id,title,selftext,score,created_utc,num_comments,subreddit,scraping_time_utc,created_datetime_utc,scraping_datetime_utc,top_comments
1ndu93c,Looking for your guys advice - 2016 Honda civic starter issue,"Hey guys my gf’s civic has been taking forever to start, usually like ten different try’s with the starter to get it to start running. 95K miles and I’ve heard this is often when starter needs replaced for this model. I have almost zero car experience but was going to try to fix it myself since it’s about $1000. After watching some videos it looks like it is a really tight squeeze and pretty difficult. What would you guys recommend? I’m willing to put the time in and work on it but scared I will mess something up and end up costing even more.  ",1,1757548753.0,2,MechanicAdvice,1757619180,2025-09-10 23:59:13,2025-09-11 19:33:00,Outrageous_Lack8435 (Score: 1): Have an 06 accord. Not a chance i was gonna screw with my starter. Its under the exhust manifold. Brake a bolt and your screwed
1ndu91t,$1400 fix?,,1,1757548749.0,2,MechanicAdvice,1757619180,2025-09-10 23:59:09,2025-09-11 19:33:00,"DayHot2168 (Score: 1): Maybe?

Lots of context is needed."
1ndu7ft,Axle Shaft,,1,1757548623.0,3,MechanicAdvice,1757619180,2025-09-10 23:57:03,2025-09-11 19:33:00,"Sophias_dad (Score: 3): The CRV only very rarely directs any power to the rear. Unless you are going to a snowy region, that axle's just along for the ride(literally)!

I'd wire brush, spray it with appropriate rustoleum, and send it.

DayHot2168 (Score: 1): Lots of bad advice.

Okay, even if the rear axle is almost never used. And it does break. What happens when the conditions are such the car requires to engage the rear? You have a spinning shaft flailing around wildly under the car that can damage other stuff. Or it breaks and falls out and leaks the diff fluid destroying your diff.

Don't be dumb. Replace it. Hondas of this era were known for CV axles failing due to rust. I've towed many."
1ndu540,How does this happen???,"I went to the shop because my check engine light was on (I assumed it was a loose gas cap- it was). When I dropped my car off, all that was needed was to tighten the gas cap and reset the light. then when I went to pick it up, it didn’t start and the mechanic is now saying I need a new battery- after I already paid and was out the door. 

they wouldn’t have said anything if my car had started, even though when I went in to ask for help they said, “oh I think someone mentioned you needed a new battery.” however, when they did the diagnostic check on my battery when I first brought my car in, the battery was completely fine. 

how did this happen over the course of two days? what do I do? I don’t understand how my battery could go from totally fine with no issues to completely not turning on and why if the mechanic knew about that, that wouldn’t tell me anything at all- also why did it test okay then?",1,1757548445.0,12,MechanicAdvice,1757619180,2025-09-10 23:54:05,2025-09-11 19:33:00,"Unfair_You_1769 (Score: 3): How old is your battery?  You can take the battery to most auto parts stores where they can charge and test your battery for free.  Also, the check engine light should turn off by itself after driving several miles.  Just curious, if you thought it was a loose gas cap, why didn't you check that yourself?

RickMN (Score: 3): How old is your battery? Older batteries can easily go from starting to dead overnight. All it takes is one too many specs of plate material to fall off the plate, sink to the bottom and short out the battery."
1ndu4is,"Ticking noise, manifold exhaust leak?",,1,1757548399.0,2,MechanicAdvice,1757619180,2025-09-10 23:53:19,2025-09-11 19:33:00,"Sad4502 (Score: 1): 2009 Jeep Patriot 4x4 2.4l cvt trans
Nosie only starts in gear, drive/reverse (easier to hear in reverse)
Needs to reach around 1500rpms to occur
Replace manifold/catalytic converter in the past year

Could this be a manifold gasket leak?"
1ndu0qs,Clutch cannot engage/disengage,Clutch suddenly lost its grip while driving. The car runs meaning I can press the clutch(?) but I can’t gear up and down. Some gaskets in the hood has some leaked oils on them but I have no idea what those are. Any advice is appreciated and I will pray for you in your preferred religion.,1,1757548097.0,5,MechanicAdvice,1757619180,2025-09-10 23:48:17,2025-09-11 19:33:00,"frutsmel (Score: 1): When I had this happen to me, it turned out to be my clutch fork being completely split. I would look at the clutch components and the lines, hopefully this helps! Good luck

fkthefkup (Score: 1): Seems like a failed slave cylinder"
1ndu0o2,"2004 suzuki aerio, bad throw out bearing? Clutch doesn't slip, hard to shift into 1st occasionally","https://reddit.com/link/1ndu0o2/video/vsqo5pnicfof1/player

",1,1757548091.0,2,MechanicAdvice,1757619180,2025-09-10 23:48:11,2025-09-11 19:33:00,"ka36 (Score: 1): Does sound like your release bearing might be on its way out, but it can't cause your problem. Some transmissions just don't like shifting into 1st sometimes, the easy fix is usually to go into second (clutch pushed down of course) then into first. I've found that usually realigns things well enough"
1ndtx91,Rat in my car. Please help.,"Not a mechanic issue, sorry for the long post.

As title, I got a rat in the car, I dont it’s been that long because I clean the engine bay pretty often, and haven’t noticed anything strange. 

Last week, I opened the hood as usual to clean the engine bay and notice some droppings on top of the engine, then I used strong flash light to inspect the engine bay. Sure enough I discovered a bunch of left over seed and nut on the plastic cover. I removed plastic cover and clean out all food, droppings, give the engine bay a quick wipe (I haven’t hosed it down yet because I’m a little scare doing so. 

Since then, I check the engine bay every day and haven’t seen any droppings, but still sometimes see some a little rat poops here and there.

My concern it, I’m not sure if the little guy has nested in the car or not. The car still functions normal and no weird smell, at least for now. 

I have used peppermint spray but I don’t dont think it does the job, rat still keeps coming back and forth. I’m getting a bunch of trap types today and try to catch this little guy.  In the mean time I’m trying to locare it’s nest if there is one. I daily drives this car, I check engine bay every morning and still couldn’t trace the nest. Where should I look at now? Like even if I successfully catch him, I still have to clean the nest somehow. This drives me nut.

Any input would be greatly appreciated.

TIA


",1,1757547828.0,3,MechanicAdvice,1757619180,2025-09-10 23:43:48,2025-09-11 19:33:00,"AcceptableMinute9999 (Score: 1): They do make an electronic device you mount in the engine compartment that makes some high-pitched noise, but I don't know if it actually works. You're lucky they're not chewing your wires up."
1ndtrls,Wrench Size?,Would anyone be able to identify what wrench size to use for this nut? I’m trying to switch out a car battery and I’m holding a 12mm on the picture.,1,1757547379.0,4,MechanicAdvice,1757619180,2025-09-10 23:36:19,2025-09-11 19:33:00,"SignificantDrawer374 (Score: 1): Looks like an M8 bolt so it's likely a 13mm. Did you not have a 13mm to try?

Gr8tWh1te (Score: 1): Looks like a battery post/terminal. Use either 1/2 inch or 13mm to loosen."
1ndtunf,How the hell do I get OBD1 codes?,"The flash technique is not working, get a different code every damn time. 1993 ford ranger 4.0, got for super cheap cause it drove previous owner crazy trying to fix it, and now after probably 8 hours of doing everything I can by hand to diagnose while waiting on an adapter my scanner don’t work with it ugh. ",30,1757547624.0,47,MechanicAdvice,1757619180,2025-09-10 23:40:24,2025-09-11 19:33:00,"Primary_Major6518 (Score: 35): Get one of the cheap OBD I scanners from autozone. It's a little yellow one. Literally like 20-40 bucks and comes with a booklet. It's what I had to use when I was pulling codes on my 93 Ranger 2.3L

LetJesusFuckU (Score: 33): A paper clip, repost from another reddit post. I have used this method. 


Check your engine codes with a paper clip. It can help a lot. (Especially with injector equipped models)

My 90 was dining super rich and I was trying to figure out what if many things was causing this issue. I stumbled on a way of checking check engine lights and figured out I had a left oxygen sensor issue. (It was sending a message telling the engine it was running lean so the injectors kept throwing more gas than it needed)

So, to figure out what check engine light codes you have all you need is a paper clip. Use the paper clip to short the two pins in the upper right corner of your obd1 port. Then switch your key to the on position. Your check engine light should blink once then twice, giving you code 12 telling you you are in diagnostics mode. It will do this three times. Then it will flash your code (if it’s a two digit code the first set of flashes will be the first part of the number and then the next series will be the latter part of the number). It will then give you code 12 three times and move on to the next error code or repeat the first error code if you only have one."
1ndtunz,Any idea what this bumper cover goes too?,,1,1757547625.0,2,MechanicAdvice,1757619180,2025-09-10 23:40:25,2025-09-11 19:33:00,BoxxBodySprings (Score: 1): 2012 porsche boxster
1ndttvf,Blower cranks but won’t stay idle,"Got a blower, cleaned the carb, and changed out the carb gasket, installed a new crank assembly. She will run great for 2-5 mins but then chokes up and dies. My guess is the spark plug is fouled causing the spitting, and/or the vacuum s seal is compromised allowing too much air into the carb, any thoughts or suggestions?",1,1757547559.0,2,MechanicAdvice,1757619180,2025-09-10 23:39:19,2025-09-11 19:33:00,BoxxBodySprings (Score: 2): r/smallenginerepair
1ndtq2w,"Whine When Accelerating, Shop Says Alternator","After driving the car for a while (15+ minutes) when I accelerate hard (3k+ RPMs), the car makes the high-pitched whining noise you can hear in the video. 

I took it to a transmission shop and after a brief inspection they said it could be the alternator.

However, I don't get this noise when I rev hard while the car is in park/neutral. If it was the alternator, shouldn't I be getting the noise regardless of if the car was moving or not? ",2,1757547264.0,12,MechanicAdvice,1757619180,2025-09-10 23:34:24,2025-09-11 19:33:00,"livenature (Score: 1): It could also be the power steering pump. They whine when going bad. Get a second opinion before changing the alternator.

Oranginal_Juice (Score: 1): Could be anything that runs on the belt with a bearing. Water pump, alternator, A/C compressor. Easiest way to diagnose is put her in park, rev it up, and find where the whine's coming from."
1ndtq1a,Crankshaft bolt refuses to budge on 2.7 dodge charger v6 base model.,"Replacing head gaskets on this damn charger and the engineers over at Chrysler smoked a lot of meth on this one. Ive taken off the intake manifold, valve gasket covers, valve covers, air filter, spark plugs and timing belt with rocker arms and cam gears. Trying to take off the stupid crankshaft pulley so I can get to the timing cover without impediment. This bolt won't budge, yes I've tried WD-40. Yes I've tried a breaker bar, a 2ft one. Thing just sits there and spins until you go far enough and it refuses to move completely. What do I do? ",1,1757547261.0,3,MechanicAdvice,1757619180,2025-09-10 23:34:21,2025-09-11 19:33:00,vcg_opg_ofhg (Score: 2): Sorry is the bolt just spinning or is the whole pulley spinning?
1ndtnwa,2000 Chevy Tahoe HVAC question,"I got quote for a blower motor resistor today. Front is $30, and rear is $110. Is it not just the same part? Or will I have to pay triple for the rear replacement?",1,1757547096.0,3,MechanicAdvice,1757619180,2025-09-10 23:31:36,2025-09-11 19:33:00,"Ianthin1 (Score: 1): First, it’s not the same part. The rear is probably more expensive because it’s a less common failure. Second, why do you need both?  I’m not sure I’ve ever changed a rear resistor on anything."
1ndtmek,Clunking noise ? 2021 Toyota Corolla SE,My friend’s car makes a clunking noise. I was able to get it consistently by moving the steering wheel left and right while moving. It doesnt do this while stationary. It sometimes does this at consistent low and high speeds. Doesnt seem to get worse when you fully turn,1,1757546981.0,2,MechanicAdvice,1757619180,2025-09-10 23:29:41,2025-09-11 19:33:00,Alpinab9 (Score: 1): Typically side to side is traced to sway bar links or bushings.
1ndtkb0,My car won’t start,It’s a 2006 Honda CR-V. Recently had the start replaced about 3 months ago. Started to sound a little off when I started it last night.,3,1757546818.0,27,MechanicAdvice,1757619180,2025-09-10 23:26:58,2025-09-11 19:33:00,"suspectedusedcondom (Score: 6): Battery is shotttt

Major-Ad-1971 (Score: 3): Try to jump it.  Most likely the battery"
1ndtjza,I need some advice from yall gangstas about die grinders!,"What up playas!

TlDR; keep the 2 batteries for $92, or keep the straight die grinder and batteries for $200, but I really want a right angle die grinder so do I sacrifice for a free die grinder with my batteris
So Milwaukee dropped a banger for 2 batteries i have been praying for on sale, and a free straight die grinder thats brand new, and is wayyy better than the gen 1 grinders, both angle and straight got a remake.

What im wondering from you guys is this; I really want the right angle grinder as my first die grinder tool i would own. Im not hip on the die grinder as a tool, but I am a contractor and use my tools every day. I have had needs to use a burrito for gouging/shaping wood, ive had the need to sand in tight spaces, same with polishing in intricate spaces, I am a woodworker as well and have some uses there such as a kutzall bit for shaping, again sanding, whatever comes up.

So the batteries would only cost my $92 if I give up the straight die grinder. And thats great cause thats what I want in this deal.

If I keep the die grinder, which is $230 by itself, plus batteries at normal price are $240, thats $470 if I bought them normally, and my current price I paid for both of them is $200.

So, is the straight good enough that I should keep it, or am I gonna be in a situation where I dont really know what im missing if I keep it and dont get a right angle anytime soon?",1,1757546794.0,7,MechanicAdvice,1757619180,2025-09-10 23:26:34,2025-09-11 19:33:00,"Ianthin1 (Score: 1): I can’t help you with the math, but I have the right angle and it’s one of my favorite tools. I don’t have the straight yet but it won’t be long before I do. 

As far as batteries go get the biggest you can. These things will chew through the smaller batteries pretty quick if you spin them very fast. I use either a 6.0 or a newer 2.5 CP if I need to get in tight spots."
1ndtj1z,Rattling noise after rim change,"Hi everyone,

I recently changed the rims on my W222 S350d.
Before: 20x8.5” 245/40 (front) and 20x9.5” 275/40 (rear)
Now: 19x8” 245/40 all around

Since the change, I’ve noticed a strange noise when driving at higher speeds. It starts around 140–150 km/h on the highway and becomes especially noticeable at 180–200 km/h. The sound is like a rattling/vibration noise. It seems as if the noise is coming from the front right side of the car. I thought the rims were rubbing on the caliper, but i checked and they aren’t

I know it’s hard to explain, but if you listen closely/put the phone to your ear, you can hear what I mean.

Does anyone know what could be causing this issue?

EDIT:
In addition to this, i thought maybe the bolts i use were too long, but they seemed alright. I posted a picture of how the bolts look.",1,1757546724.0,2,MechanicAdvice,1757619180,2025-09-10 23:25:24,2025-09-11 19:33:00,Loose-Cover-958 (Score: 1): https://preview.redd.it/q0vjqzv39fof1.jpeg?width=3024&format=pjpg&auto=webp&s=8d3a3c3392ba9d63ce5163fd1288f0b80f20ca6e
1ndtgju,"2003 mustang clutch pedal noise, any ideas?",New cable and quadrant and adjuster a while back this noise is new tho,1,1757546528.0,5,MechanicAdvice,1757619180,2025-09-10 23:22:08,2025-09-11 19:33:00,"clappinuv (Score: 2): I’m sorry I don’t have an answer but that would annoy the shit out of me.

PermissionSafe2183 (Score: 1): Also only noticing it when it’s hot out"
1ndtf6k,2024 VW Taos - Missing air intake cover?,"So quick background, my wife brought home a 2024 VW Taus with less than 300mi on it. Have had it for about a week without issue and yesterday she said she was accelerating out of a drive-thru and heard a ""pop"" and then had trouble with acceleration. I'm not mechanically inclined but listening to it it sounded like an air leak. I popped the hood and noticed the hose coming off the back of the air filter housing was barely hanging on and the clamp was loose. I tightened it back down and took it for a test drive confident that I had fixed it. Same issue, ""whooshing"" with acceleration and no real power. When I pop the hood again is when I noticed the missing shroud/cover you see in the first picture. 

I thought maybe it was pulling too much air into the engine and causing issues? Of course it triggered all kinds of warnings including reduced engine power. Anyways, got it back to the VW dealership in hopes that they would just be replacing that plastic shroud but they're saying that the turbo needs replaced. I told them the above and inquiried if this could have caused all the error messages which led them towards diagnosing it as a faulty turbo. Basically he told me they would replace the shroud but there's no way it would pull enough air to cause engine issues and the turbo was definitely going to need replacement regardless. 

Genuinely, forgive my ignorance but I'm just wondering if this sounds plausible? I would think you would replace the $50-100 plastic part and see if that alleviates the issue before replacing the entire turbo. Thanks guys, I do appreciate it.",3,1757546420.0,4,MechanicAdvice,1757619180,2025-09-10 23:20:20,2025-09-11 19:33:00,"Jibletman360 (Score: 1): The missing shroud will not cause any real issues. Plus, you’re getting it all for free under warranty right?"
1ndtduq,Help with vibrations,"Ok to start with I have a '04 honda EX civic that has served me well however ever since I changed my suspension to lower it an inch and a half (just a set of springs and struts with a SPC camber kit) it went from driving perfect to having an issue when under load above about 60mph. When I try to accelerate around that speed the car will start vibrating, nothing with the steering wheel it still drives straight but if I try to accelerate faster it will get worse and if I let up it goes away. The kicker is that it doesn't always happen, most of the time it does but at times it'll be rock solid. 

Some more info, I know it isn't the wheels as I have had those rotated and balanced twice since it's happend. I'm also 80% sure it's not the axles as I've checked them and they don't have broken boots and virtually no play when pushing them around. ",1,1757546316.0,3,MechanicAdvice,1757619180,2025-09-10 23:18:36,2025-09-11 19:33:00,"Safe_Willingness_956 (Score: 1): Might be you lowered it, and the tire is rubbing in the fender well."
1ndtag7,02 Lexus ES300 Misfire and Oil Leak Into Spark Plugs and Intake Manifold Help!,"Vehicle: 2002 Lexus ES300
Engine: 1MZ-FE 3.0L V6

Problems:
——————
- I bought the car in late July, on the road it misfired really really bad and we went home and started work on it. Spark Plugs needed to be replaced, so we replaced those. However, 2 of the spark plugs were covered in oil. We replaced the spark plug tube seals, and the valve cover gasket. This was finished in early August.

- For a while, the car still ran like crap, it misfired more and more often, and then my car broke down like a week ago. We looked at the spark plugs, and some of them were loose. So we torqued them back in and continued to dig deeper, the same spark plugs that were covered in oil were covered in new oil.

- After finding this out, we looked at the gaskets for the intake manifold, and those were covered in oil, I will attach a photo of those seals and the intake manifold itself in the comments. I also looked at the PCV Valve, and it looked in pretty poor condition. I will attach an image showing the old one in the comments, I bought a new one from NAPA.

- I tried looking for the upper and lower gaskets for the intake manifold, but only found the lower ones. This had me stuck, so I ended up calling a Lexus dealership, called the parts section and asked some questions. The guy there said that for the intake manifold, unless you are doing coolant work, the only gaskets that must be replaced are the upper ones, which connects to the throttle body. He also said that the reason the misfiring is happening because of the broken seals in the intake manifold. He suggested that I replace the valve cover gaskets with OEM ones, as the blue aftermarket ones never fit and will cause oil to leak. He suggested that I replace:

1. Replace aftermarket valve cover gaskets with OEM ones.
2. Replace intake manifold upper gasket with new OEM ones.
3. Replace PCV Valve, which I did.

- Also, the car alarm goes off after I lock the car and it happens every ~3-8 hours, we looked at the o2 sensor but couldn’t really tell from appearance, we also looked for the door ajar light to come on in the dash when locking the doors, but it didn’t come on which tells me that the sensors for the doors are good, the sensor for the trunk is good too, so I assume that it is the hood, I am unsure of what to do for that, and I am assuming that it has something to do with the engine problems so I set it aside.

So, I want to know what to do. If you have any questions please ask. If there are any more pictures you want, please ask. Thank you.

",1,1757546062.0,7,MechanicAdvice,1757619180,2025-09-10 23:14:22,2025-09-11 19:33:00,"Radiant_Ad1918 (Score: 1): https://preview.redd.it/d72y1npl7fof1.jpeg?width=3024&format=pjpg&auto=webp&s=029eca4e2b59be1600b828622a0d283e7d4ecca1

Old vs. New PCV Valve

Radiant_Ad1918 (Score: 1): https://preview.redd.it/7p3lvo6s7fof1.jpeg?width=3024&format=pjpg&auto=webp&s=f2b0a5cec1c0be696b32270f5de18b2070ac4140

Upper Gasket for Intake Manifold

Radiant_Ad1918 (Score: 1): https://preview.redd.it/64cc34uu7fof1.jpeg?width=3024&format=pjpg&auto=webp&s=fe20316c1cf5f447002a7e8786439b6defad2de8

Lower Gasket for Intake Manifold"
1ndsj0p,Noise left side of car,"Honda civi 2018 Ex 2.0
Please help trying to figure out wat this noise is. ",1,1757544047.0,3,MechanicAdvice,1757619180,2025-09-10 22:40:47,2025-09-11 19:33:00,"DayHot2168 (Score: 1): Could be anything. 

Put your hands on parts and start shaking them. See what's loose. May require some pry bars to check some things."
1ndsyj1,How do you fix the seatbelt buckle (where the belt clicks in) on a 1999 Dodge Ram 1500?,"Mine broke, as in the button is loose now (I guess the spring is shot or something) and I'm wondering how to replace it. Tried to Google, was just getting stuff on ""if there's something stuck in there"" but I don't have anything stuck, it's just broken. ",1,1757545179.0,2,MechanicAdvice,1757619180,2025-09-10 22:59:39,2025-09-11 19:33:00,"hopopo (Score: 1): In that car clip is most likely secured with a single bolt to the frame of the vehicle. Try to find a replacement from another Dodge from that era and simply replace it.

https://www.moparpartsgiant.com/oem-1999-dodge-ram_1500-seat_belt.html"
1ndsxgs,Stuck torque converter nut,"These were some stubborn nuts. We used these extractors to get the others but this last one won't budge. Kinda tore up at this point. Any advice or recommendations?

Nissan Murano year unknown

Thanks",1,1757545100.0,5,MechanicAdvice,1757619180,2025-09-10 22:58:20,2025-09-11 19:33:00,"YOdOtHeThiNg (Score: 1): Find the one that fits right on the top edge of the bolt, hammer it on

MonsterMash_479 (Score: 1): Hammer and Chisel in a loosening direction. Heat will help too"
1ndstix,Is it safe to drive with a CEL for a purge valve?,"Just bought a certified pre-owned 2023 Kia K5 LXS. 43k mileage and runs smooth. A couple of days later I got a CEL so I took it back to the dealer and they took a look at it. Told me that it was just a bad purge valve and I would be getting it replaced under warranty. Is this okay to drive with? Most likely won’t be getting it replaced until next week and have some driving to do in between (I commute to school). Also going to autozone later today to double check that the code is indeed just an evap code. 

TLDR; is it okay to drive with a purge valve CEL for a week or two?",1,1757544811.0,6,MechanicAdvice,1757619180,2025-09-10 22:53:31,2025-09-11 19:33:00,"r4x (Score: 1): Have had a large evap leak with engine light on. For the last 2 or 3 years. Every so often I will pull the codes with my scan tool just to make sure that's the only reason it's on.

HighLadySuroth (Score: 1): Ask the dealer about a loaner car until the part shows up. We often give out loaners at my VW dealer in this situation. I am a tech so I don't know the exact details such as cost, but I dont believe the warranty customers are paying out of pocket to have the loaner car. Not 100% sure though. I would ask them"
