id,title,selftext,score,created_utc,num_comments,subreddit,scraping_time_utc,created_datetime_utc,scraping_datetime_utc,top_comments
1od5v4p,2009 Ford Fiesta knocking sound from rear,"2009 Ford Fiesta 5dr, 1.3 manual, 56k miles. 

It’s recently started making a knocking sound from the rear of the car, I had a Quick Look under and saw this, could this be the cause? 

It seems like the frequency of the knocking increases with the speed of the wheel so that’s what is confusing me. These pictures are rear drivers side, about in line with the rear doors. 

It first started happening just under suspension compression, and now it seems to happen sporadically. Doesn’t happen until I’ve been driving for a couple of minutes, maybe something to do with the rear drum brakes once they’ve started to engage? ",1,1761133198.0,3,MechanicAdvice,1761248140,2025-10-22 11:39:58,2025-10-23 19:35:40,"NickRMX6 (Score: 1): DIYer advice: that's an exhaust heat shield, that has come loose. That might make a rattling or scratching sound, but I think it's too light to make a knocking sound. I think that's something else, but I don't know what. But as a test, grab hold of the exhaust tailpipe, and shake it, and see if you hear any noise, and if it sounds the same as the knocking sound you hear when driving."
1od5u38,How’s this gear pattern look ?, ,3,1761133109.0,2,MechanicAdvice,1761248140,2025-10-22 11:38:29,2025-10-23 19:35:40,CherokeeBoyColin (Score: 1): I would maybe shim the carrier one tiny shim towards the pinion so it gets a slightly deeper contact. Don’t want it all the way down deep but maybe one more of the smallest shims possible. I don’t think it’ll hurt the way you have it though
1od5skt,PLEASE HELP ME,"I have a problem with my whip. It drove fine the other day when I went to pick up pizza, when I tried to start it to go home, it stopped working and made this sound. Me and my mate bump started it, it started but had no power. I thought it was the alternator however the battery still has charged. Is this the starter motor? What going on with this please help me ",1,1761132973.0,6,MechanicAdvice,1761248140,2025-10-22 11:36:13,2025-10-23 19:35:40,"serf_mobile (Score: 1): That is definitely a low battery sound. The battery might appear fine but it doesn't have quite enough power to move the starter. Get a jump from someone if you can. 

Most likely the battery isnt accepting enough of a charge from the alternator. Assuming the alternator is working at 100%, you need a new battery

Edit - you said you got it started but it had no power. That sounds more like the alternator isnt charging and the whole car is running off just the battery. The battery may be fine and just needs to be recharged. But if this is happening, the alternator is prob shot.

Prestigious-Arm9609 (Score: 1): Check power going to the starter solenoid.if it's above 12 volts,the starter is likely the issue."
1od5kyj,Toyota Aygo automatic won't start!,"Can anyone help, please? My Toyota Aygo automatic, 09 plate, will not start. Key won't turn in the ignition, brake pedal won't depress, can't take it out of neutral. Had the same thing happen about 6 months ago, left it for a few hours and went back to it, and it started as normal. What is happening?? Thank you!",0,1761132285.0,3,MechanicAdvice,1761248140,2025-10-22 11:24:45,2025-10-23 19:35:40,"RudbeckiaIS (Score: 2): It's the key barrel, yet another ""feature"" of the Aygo/C1/107. 

Spray a little PTFE penetrating spray (whatever you have available) in the barrel, leave it there at least 30 minutes, then try inserting and turning the key. If it works just repeat the lubing once a year and you are done, if it doesn't you will need to replace the key barrell: as much as I try avoid suggesting this due to the massive cost of Toyota parts, dealership can order a barrel matching your key with your VIN to avoid changing all the locks on the car."
1od54xk,06 sentra jokes encouraged,,1,1761130858.0,2,MechanicAdvice,1761248140,2025-10-22 11:00:58,2025-10-23 19:35:40,Busy_Initiative9120 (Score: 1): Its not that bad of an angle id estimate no more than 35 degrees
1od529u,Strange Electrical Issue,"I have a 2008 Toyota Sienna with the 3.5L 2GR-FE engine. I recently had a DTC of P0355 indicating a fault on the cylinder 5 coil. I swapped the coil pack with the cylinder 6 coil pack expecting the fault to move there. To my surprise, I got a new DTC code of P0354 indicating it is now on cylinder 4 which I didnt alter. What might cause this condition?",1,1761130626.0,3,MechanicAdvice,1761248140,2025-10-22 10:57:06,2025-10-23 19:35:40,sebtru1 (Score: 1): Damaged wires on the harness. Look and see if the harness it not rubbing on anything
1od4wk6,Help! Cannot get steering shaft back onto the rack,"I removed the steering shaft to regrease the splines, I unbolted the bottom of it that connects to the rack to do this but cannot for the life of me get it back on. It took a bit of force and prying to get it off, so it was probably on there pretty good. I think the position is aligned correctly to the rack but I can't be sure (it shouldn't have moved right?)

I've tried to widen the split in the u-joint with a large flathead screwdriver but it still doesn't go on.

Any help would be appreciated! Stuck with no steering right now. Car is a 2011 Ford Fiesta",1,1761130083.0,12,MechanicAdvice,1761248140,2025-10-22 10:48:03,2025-10-23 19:35:40,"iebwithoutwax (Score: 3): is it aligned with the flat keyway? maybe some rubber mallet persuasion if everything is lined up

MrBusa08 (Score: 1): Did you secure the wheel before you took it loose? More than likely it only goes together one way and the wheel has turned and it’s off center now! Get you another person at the joint and you rotate the wheel left or right and see if it doesn’t slide back together! A little dab of grease on the splines may help to"
1od4g84,Super stupid question,"very inexperienced with cars, and have neglected my gmc terrain’s oil change. Meter says 0% life, no oil light or noises. Would it be save to make a 40 minute drive home on 55mph roads?",1,1761128487.0,8,MechanicAdvice,1761248140,2025-10-22 10:21:27,2025-10-23 19:35:40,"FlakyLion5449 (Score: 4): It's not going to matter

EugeneWPG (Score: 3): No worries, even another 1000 won't hurt. Just drive carefully. Your oil life meter not a real oil quality meter its metering hours and miles."
1od4bui,High pitch noise at 5k+ rpm,"I have a 1.4 petrol Turbo Alfa Romeo . It has an exhaust and air intake and a few other mild mods . 

When I accelerate through the rev range a high pitch noise starts at around 4 and a half 1000rpm increasing in sound as I go higher. Is this something to do with my intake whistling ? Or is it Turbo? Or what could this be ?

Video was recorded on phone by
My passenger .",1,1761128051.0,2,MechanicAdvice,1761248140,2025-10-22 10:14:11,2025-10-23 19:35:40,"Shape_Flashy (Score: 1): Most likely bad turbo geometry, this happens to my m47 when cold"
1od49nu,How much would it cost/how long would it take a mechanic to install car seats?,"I have a 2014 brz sport tech and found a 2020 brz ts seats. I tried installing them during this past summer but I could not get the seat bolts out. I think one of it is stripped. I tried using bolt extractors but that was also unsuccessful. I bought new bolts from the dealership and will supply them to the shop. I have been thinking of getting them installed before I park the car over the winter. I know that shops would charge by the hour so based on your guys’ experience, how long would it take to install the seats given that the bolts may have to be extracted.",1,1761127839.0,2,MechanicAdvice,1761248140,2025-10-22 10:10:39,2025-10-23 19:35:40,awqsed10 (Score: 1): Car seat? 1hr at most. Car detailing guy take it off in a few minutes.
1od3y0s,When should I change the timing chain on my 2010 VW Passat B6 1.4 TSI?,"
Hi! I need advice about my 2010 VW Passat B6 1.4 TSI (automatic, petrol & natural gas). It has 210,000 km (130k miles) and has started to give a slight shake during a cold start. The shake goes away after about a minute.

My mechanic says a worn timing chain on this engine will usually trigger a check engine light, but mine hasn't come on yet. The car runs perfectly otherwise.

Should I wait for the check engine light or replace the chain now based on the mileage and cold-start shake? I want to avoid a catastrophic engine failure. Thanks!",1,1761126664.0,4,MechanicAdvice,1761248140,2025-10-22 09:51:04,2025-10-23 19:35:40,"Low-Summer260 (Score: 1): You have this car from 0kmhs mate? 
If yes how is the maintenance and the issues of the 1.4 TSI engine"
1od3m0i,What are these 3 blue sockets for ? (MX-3 1994 1.6L),"Hi guys, I found these socket working on my new projet car under the glove box, but I have zero clue about what they are or where they go. Any ideas ? ",1,1761125420.0,7,MechanicAdvice,1761248140,2025-10-22 09:30:20,2025-10-23 19:35:40,"Calaiss (Score: 1): likey for different spec models for power windows etc if it doesnt have them. 

or are things not working?"
1od3afu,I just got my blower motor replaced and now engine temp dial is playing up.,"I have Honda civic 2009 and just noticed this today, I got the blower motor replaced 4 days ago. Are these possibly connected in any way? The dial will point to zero then at a random time whilst driving it will go up slightly possibly showing the correct temperature then stay there for a bit before falling back down.

Just to clarify I was told all of the dash had to be undone to access the blower motor hence asking if in the process of undoing the dash this had to be messed with or not.",1,1761124187.0,16,MechanicAdvice,1761248140,2025-10-22 09:09:47,2025-10-23 19:35:40,"Calaiss (Score: 2): whole dash doesnt need to come out at all, how much did you get charged?

OldBiker6969 (Score: 1): No connection....."
1od2wjv,Peugeot 2008 cambelt change: is oil change necessary?,,1,1761122718.0,2,MechanicAdvice,1761248140,2025-10-22 08:45:18,2025-10-23 19:35:40,FrenchOldMechanic (Score: 1): ***This engine is fragile to be polished. So you can't save money or change your car.***
1od2p6v,"VW Polo Mk4 (9n facelift). No sounds/chimes for headlights, seatbelts, warning lights, handbrake, nothing","As stated in the title. No idea why this is happening and i'm at a loss. Attaching fusebox pic in case it may help. Issue was already there when i bought it.

Previous owner did install an aftermarket radio, which makes me wonder if they messed up something in the process of doing so.

Thinking of pulling all the fuses one by one as a first step. Opinions?

Thank you all

  
EDIT: replaced battery a month ago because i forgot the headlights on overnight and wouldn't hold a charge afterwards. replacing the battery had no effect on this problems



https://preview.redd.it/i0z2bveljmwf1.jpg?width=1200&format=pjpg&auto=webp&s=516d3d16454da4940b2cb881bb82b1e7de189866",1,1761121903.0,5,MechanicAdvice,1761248140,2025-10-22 08:31:43,2025-10-23 19:35:40,Sophias_dad (Score: 1): Dead battery is a first  guess.  Pulling fuses won't help get power to anything
1od23f5,Whistle noise scatpack,Whistle noise seems to come from little box on intake manifold however it was a problem before got engine replaced and intake manifold replaced because of the same noise can you guys hear it what is it no codes btw and it get louder when accelarating,1,1761119533.0,2,MechanicAdvice,1761248140,2025-10-22 07:52:13,2025-10-23 19:35:40,Intelligent-Ad-6734 (Score: 1): Check all the pcv lines.  The smallest crack will be pretty loud.  Just replaced a section of line that was hidden by the mesh loom they put over them on a different hemi.
1od23f2,Flexdrive Tachometer,Hey i just got this given too me and would like to know the value and a bit of info on it if anyone can help that would be awesome thnx 😊,1,1761119533.0,2,MechanicAdvice,1761248140,2025-10-22 07:52:13,2025-10-23 19:35:40,Greenlight0321 (Score: 1): https://online.doningtonauctions.com.au/m/lot-details/index/catalog/163/lot/43463/TACHOMETER:%20A%20tachometer%20by%20FD%20Instruments?url=%2Fm%2Fview-auctions%2Fcatalog%2Fid%2F163%3Fpage%3D8
1od21yx,Engine wont start in cold,"So ive had my car for ober 4 years now and with the cold weather coming it has started to have issues. Previous i have had an issue with the head cover gasket leaking oil into the cylinders but i got it fixed about 8 months ago. Now that its grtting cold the engine will not start and wont even crank when its cold. I thought it was a battery or starter issue but after replacing snd testing both are fine. So i belive that when it grts cold the metal shrinks and is creating to much friction for the starter to move (I belive thag the residue from the burnt oil may have a part to play) otherwise when the engine has warmed about to about 60 degrees fahrenheit it will crank and start just fine but once it gets colder than that (lets say 45 degrees fabrenheit) it does not start or crank. I have ran some liqui moly fuel addedive to try to clean the pistons (incase their getting stuck) and liqui moly oil addedive (claims to help keep it lubricated) now at 2am as im writing this im keeping the engine warm by starting it back up before it gets to cold and so far is working (it is currently 46 outside) so my question is am i correct in my theory or am I another ignorant DIY repair gone wrong

Edit: i drive a hyundai sonata 2009 2.4L",2,1761119376.0,5,MechanicAdvice,1761248140,2025-10-22 07:49:36,2025-10-23 19:35:40,"Dangerous_Echidna229 (Score: 2): Do we have to guess what you drive?

Technical-Math-4777 (Score: 1): If you’re cold it’s cold, bring it inside "
1od1zn4,EGR Problems,"I have a 2013 BMW 640d, I replaced the alternator a week ago and since then the EGR valve smokes on startup, white smoke comes from the exhaust, it's idling rough and my OBD2 is showing EGR error of 30%. I had to remove the EGR manifold to get to the alternator, is there anything I could have done while doing that that could cause problems with the EGR valve?
The car hasn't been driven, for obvious reasons.",1,1761119126.0,3,MechanicAdvice,1761248140,2025-10-22 07:45:26,2025-10-23 19:35:40,"RudbeckiaIS (Score: 1): [Let's use this for reference.](https://www.realoem.com/bmw/enUS/showparts?id=LZ71-EUR-06-2013-F12-BMW-640d&diagId=11_9541#11717810871)

Possible causes are: you have a vacuum leak between #2 and #16 or line #17 got torn. O-ring #5 is torn/pinched/misaligned. Steel gasket #6 is broken. Hose #12 and/or #13 (coolant lines) are torn or no fully pressed in. 

Absolutely worse scenario, the EGR cooler got hit hard and has an internal leak."
1od1x11,Best impact under $200,I'm starting as a lube tech soon and I need a 1/2 impact wrench. Any recommendations on a budget of $200? ,3,1761118845.0,6,MechanicAdvice,1761248140,2025-10-22 07:40:45,2025-10-23 19:35:40,"Nero2743 (Score: 2): If you're just starting out get an air impact. Much cheaper. Aircat, Earthquake would do just fine. Lube techs are only doing tires/oil changes/filters to start anyway.

sillysalmonella87 (Score: 1): Hercules."
1od1mfj,"Oil leaking out twice right after oil change — broke down 300 miles in, then again 200 miles later. What could be causing this?","Desperate for some help understanding what’s going on. 

Monday morning I got an oil change (2017 Lexus RX 350 w/ 75,000 miles) before starting a 1,000-mile road trip with a friend. About 300 miles into the trip, several warning lights came on: AWD malfunction, ICS malfunction, low oil pressure, and check engine. I pulled over and saw a large oil leak underneath.

Had the car towed to a local shop and stayed overnight. The mechanic there said there was no gasket on the oil filter, so the place that did the oil change either forgot to install it or didn’t tighten it properly and it came off. They replaced the filter, added oil, and said everything looked fine.

The car ran perfectly for about 200 miles, then the exact same issue happened again, same warning lights, oil leaking underneath, and I had to get it towed and stay overnight again.

Could the first incident (running low or out of oil) have caused lasting engine damage that’s now leading to another leak? Or is it more likely something was still installed incorrectly?

We’re currently stranded overnight at another motel, and I can’t sleep because I’m so anxious about the whole situation. Any insight or suggestions on what I should ask the shop to check in the morning would be really appreciated.
",1,1761117668.0,10,MechanicAdvice,1761248140,2025-10-22 07:21:08,2025-10-23 19:35:40,"FusoStorm (Score: 2): All those warnings can trigger from one engine fault. Main one which id assume from a code check would be low oil pressure.

Need to let the shop know the recent issues so they can look into the potentials, i dnno where your based but i hear those jiffy lube/ quick oil change places aren't the greatest businesses to visit if your having ongoing issues.

If the first guys missed the seal on the oil filter, I would be hoping the oil filter cap isn't cross threaded, maybe ask them to check the drain tap on the oil filter cap aswell.

Once they refill the oil you'd want the prev leaks cleaned, test driven and rechecked for leaks to see if there is anything still leaking.

Fingers crossed no engine damage

o0gy172 (Score: 1): Did the second leak also occur at the filter/filter housing? How much oil was left on the dipstick after each leak? If you only lost a couple ounces before shutting it off (during both incidents) I wouldn't be too worried about oil starvation, but considering it was enough to trigger the oil pressure sensor, I'd avoid running the engine at all costs.


- I doubt the local mechanic would've made the same mistake of forgetting the gasket

- Stuck gaskets from old filters on 2GR-FKS threads are pretty obvious to spot so it's extremely unlikely both mechanics somehow double gasketed(?) without noticing

It's entirely possible that the filter housing itself became warped or cracked when it was first tightened without a gasket. If the local mechanic reused the damaged housing, a leak could occur from the same spot, regardless of whether a new gasket was installed."
1od1c31,What is this sound?,"Doesn’t make it straight away when driving but does eventually, just gets worse. (2017 Holden Astra) I’m thinking maybe the ball joint?",2,1761116569.0,5,MechanicAdvice,1761248140,2025-10-22 07:02:49,2025-10-23 19:35:40,"ludrubru (Score: 2): without being there or having more info with isolated  it could be anything.

when turning the wheel i’d say it sounds like a [worn strut mount](https://youtube.com/shorts/N0ehGw9eEBE?si=etfcgFzb1fkFdCWw) or [sway bar bushings](https://youtu.be/4ODcxWm4Icg?si=nkgtudbpec-rSzef). if the sound is from above the wheel id say strut mount. if below, it could be swar bar bushing.

failing ball joints typically make a [clunk sound](https://youtube.com/shorts/ibRr4o6RSmI?si=dFSBTi0_PKtnWkdX) when going over bumps.

hopefully this helps, good luck

o0gy172 (Score: 1): 1. Does it squeak when the wheel moves in all 4 directions, or only when it rotates left/right? Try turning the wheel while slowly driving over a bump or curb

2. Jack up both front wheels and wiggle the wheel at 9 and 3, then 12 and 6 (might need a pry bar to wiggle up/down). Squeaking or excessive play during the latter usually indicates ball joints. Try recording a video under the car while shaking the wheel to see if you can spot any play in the tie rod or ball joibt

3. Buy one of those pointed stethoscopes to listen to each joint while someone turns the wheel for you"
1od16hw,Torque Spec for Gas Tank Bolts,"2004 Ford Mustang GT. I replaced the fuel pump and the tank, but when i went to fill it up it leaked out of the top. I am trying to find out how tightly those top bolts should be done. Some parts on the gas tank are very hard to find now so I really don’t want to strip the threads or damage it. I’ll pull it again to retighten but I’d really appreciate some advice on how tight to get the seal right. there is a good gasket on it. ",1,1761116001.0,2,MechanicAdvice,1761248140,2025-10-22 06:53:21,2025-10-23 19:35:40,Tesex01 (Score: 1): Probably problem with a gasket or fitment itself.
1od0uq3,Am I cooked? (pls help),"2009 hyundai genesis, stopped on me on the freeway. i heard grinding noises and saw smoking once it stopped on me. ",2,1761114758.0,10,MechanicAdvice,1761248140,2025-10-22 06:32:38,2025-10-23 19:35:40,"Laqota (Score: 1): Uh... That's weird. Have anything replaced?

Clutch/TC, Flywheel, etc?


But without even looking down there or anything. Yeah. Your starter isnt engaging with the flywheel for some reason, and the smoking story and such is kinda concerning.

Subros_25 (Score: 1): By any chance was it running hot? Was there and steam or smoke coming out from the hood? Any smell?"
1od0ump,To repair? and how?,"I own a 2007 Honda EX 1.8 L with 185k on it  and I was wondering what I should do about my axles and suspension. A mechanic told me that I would need axles, knuckles, lower control arm, and struts for the front and schockw for the rear. I am thinking of giving it a go and could use some ideas on where to buy the parts and what parts I should get. Any help is appreciated.

I bought all of the above parts and I was wondering if anyone knew what order I should put them in? 
Do I just take out all the parts first? I was concerned that there would be issues with not being able to figure out the proper alignment if I took them all out at once.",1,1761114748.0,5,MechanicAdvice,1761248140,2025-10-22 06:32:28,2025-10-23 19:35:40,"Every_Lead3128 (Score: 1): Do it one side at a time. You can remove the strut and knuckle as one assembly if you want

Tesex01 (Score: 1): I wouldn't touch suspension if you have no clue what you are doing. It's very easy to turn it into death trap. You will need to go for alignment afterwards anyway"
1od0mod,Is this a normal price?,"
Asking for my boyfriend - is this an ok price?We are in Austin, TX.",4,1761113912.0,53,MechanicAdvice,1761248140,2025-10-22 06:18:32,2025-10-23 19:35:40,"SubpopularKnowledge0 (Score: 5): This is a fair price. Especially for austin. 

Please dont listen to people saying it would be much better to do it yourself.  Yes, doing pads and rotors can be a pretty good job to do diy if you have no experience, but it will take time and if you have no tools you need to spend the money you would save on the first job on a proper jack, jack stands, and possibly sockets and a breaker bar. If your bf is up for it i say go for it. 

But if you’re doing the caliper too, that is gonna invite more things you could do wrong the first time. You have to crack the bleeder screw, and if you have no experience theres a good chance u will strip it on an old car. And u have to properly bleed the breaks or u risk a serious safety hazard for yourself. 

So yes, its a good price. If he gets into the idea of doing the job himself and he has no experience or tools, he will absolutely spend that much money on parts and tools.

AcornAnomaly (Score: 8): That's only a little bit more than I paid for just pads and rotors on the rear a couple years ago.

I'd say it's a good price."
1od02i9,Oil filter destroyed,"So was doing on oil filter without a wrench bc my current one doesn't fit properly and decided last ditch effort to use the screw driver method but didnt realise it was tearing the filter apart, when I went to turn it the casing came off and now I'm left with this. Does anyone have any ideas on what I can do to get it off?",90,1761111857.0,56,MechanicAdvice,1761248140,2025-10-22 05:44:17,2025-10-23 19:35:40,"TheGeek00 (Score: 107): Ik you’re sweatin in that Valvoline pit rn 😭

Kdiman (Score: 78): How have i been twisting wrenches for 40 years and never had this happen but I've  seen no less than 4 posts recently all the same issue?"
1oczpxa,Stumped,I have a problem with my fuel in a 250 fuel injection. When riding it bogs and not spontaneous on throttle. Thinking maybe TPS but wondering if easy to do. Or am I thinking wrong?,1,1761110579.0,4,MechanicAdvice,1761248140,2025-10-22 05:22:59,2025-10-23 19:35:40,Laqota (Score: 2): Sounds like a pump issue.
