id,title,selftext,score,created_utc,num_comments,subreddit,scraping_time_utc,created_datetime_utc,scraping_datetime_utc,top_comments
1o8brby,1994 V8 (5.2L) ZJ Jeep Grand Cherokee Laredo just back from the shop. It is transmission-hunting and the Jeep feels it lacks power to the wheels.,"**STORY**: I inherited a V8 automatic transmission ZJ Jeep after the original owner (a relative) died one year ago. The Jeep was cared for meticulously – service schedules adhered to 100% at a single SoCal shop where, he also took his classic Jaguars. The Jeep ran perfectly with 239K miles when I received it. I got no maintenance records – all were thrown out by his widow.

Upon receiving the Jeep I noticed leaky transmission oil on my driveway. As a temporary solution, I added Luccas Transmission Fix. Not sure if it helped, but it didn’t seem to hurt any.

The Jeep's gas gauge was non-functioning. I decided to address both issues and have the Jeep inspected by a reputable local shop.

**WHAT HAPPENED**:  I took my Jeep to the shop for a radiator flush and installation of a new fuel pump assembly. The shop changed my oil to 5W30 Napa synthetic + Napa Gold oil filter, installed new ATO spark plugs and a new spark plug wire set, replaced my leaky transmission oil cooler line, and added 2L transmission fluid. The service receipt said nothing about a transmission flush but I am guessing they did it.

**PROBLEMS**:  Immediately after receiving the Jeep two days ago, I noticed transmission gear hunting on an eight mile climb up a low-grade hill above the shop, and what felt like poor power to the wheels. The gear hunting issue seemed to improve after about seven miles, as did the shifting smoothness – which I attributed to the transmission warming up. The grade of the hill changed slightly on that eight mile climb, which was another variable. No noticeable gear hunting on the descent in Hi-4.

I parked the Jeep 35 hours at my office. Fully cooled, I drove it up a 5.5 mile steady hill to my home last night. The same issue happened: gear hunting and poor subjective power to the wheels.

After cooling the Jeep outdoors overnight I took it out again on pavement this morning on a variety of hills. This time I also drove in Lo-4. The gear hunting was worse in Lo-4 than in Hi-4. About 1/4 mile down a fairly consistent decline the transmission suddenly lurched from third down to second gear. RPMs rose to over 4000. The Jeep was in “D,” not in first or second gear. I was not attempting to engine brake, just steadily driving downhill with my foot lightly on the gas.

I checked my transmission fluid with the engine running and warm, vehicle parked on the level. The tranny dipstick shows oil was below the “add oil” mark.

I understand these old GM transmissions often run better with gunky old tranny oil, and they start having problems after you change the tranny oil. I did not specifically ask to have tranny oil changed, but it was implied because of the leaky transmission oil cooler line. I also did not ask for engine oil change – I always do that myself. (Grumbling because of a $1637 service bill with multiple extra things I did not want done; I gave them a detailed written list of what I needed.)

**QUESTIONS**: 

1. *Aside from driving up the bill, did my shop do any thing wrong?* If they drove the Jeep they would have noticed gear hunting and possibly topped off my tranny oil or fixed the issue before returning it to me. They had my Jeep over three weeks and should have had enough time to make sure it was working properly.
2. Should I take it back to the same shop, top off the tranny oil myself, or add a quart of Luccas Transmission Fix?
3. Any other thoughts?

I am obviously not a mechanic. My daily driver is a manual transmission Mazda 3. Old GM automatic transmissions were a distant memory until I inherited this Jeep.

Thank you.",1,1760634103.0,2,MechanicAdvice,1760729627,2025-10-16 17:01:43,2025-10-17 19:33:47,"GoingForHundred (Score: 1): Similar topic last year in a 2007 Honda Legend, possibly due to transmission adaptive tables or failing shift solenoids. Not sure about the relevance to a 1994 ZJ Jeep?

https://www.reddit.com/r/MechanicAdvice/comments/1h1zh9u/transmission_hunting_any_ideas_why/"
1o8bqfv,Am I being ripped off?,"Rear Bent Tie rod on my right rear wheel, do these prices look normal? The complete total almost comes to about $1700, so I am skeptical to know if this is truly how much damage a pot hole caused . ",2,1760634055.0,13,MechanicAdvice,1760729627,2025-10-16 17:00:55,2025-10-17 19:33:47,"t0iler (Score: 9): Seems pretty fair on labour, a lot of your cost seems to be the parts.
Never good to hear a 4 digit quote, but this one seems reasonable coming from a Honda tech in NS, Canada.

taschnewitz (Score: 3): Sounds like you hit more of a crater than a pothole.


That looks pretty reasonable for the services they're quoting.


You can get second opinions from other shops"
1o8bfvt,E brake stuck to the floor can’t get it up,"Been awhile since I used it on my 2001 Chevy Silverado, and it’s just stuck now. Any advice or suggestions will help please! ",1,1760633437.0,4,MechanicAdvice,1760729627,2025-10-16 16:50:37,2025-10-17 19:33:47,"Mcmikemc1 (Score: 2): https://youtu.be/Gu72EoHv3Hw?si=S_8mn3U2hyKYjye7

DemoManU812 (Score: 1): pull the lever while pushing down hard on the ebrake pedal. Soetimes they get stuck. If that doesnt work then it could be seized up"
1o8bdhk,P013C Lexus is300,"2017 Lexus is300 had this error code for about a year now, it comes on usually around halfway fuel mark and goes away (sometimes it comes on different times). Also dissapeared for 6 months and then came back. Seems very intermittent, tried replacing gas cap, not sure if it could be the actual fuel door?

Any tips?
Thanks",1,1760633298.0,2,MechanicAdvice,1760729627,2025-10-16 16:48:18,2025-10-17 19:33:47,"taschnewitz (Score: 1): You have a very clear indication that you have a bad O2 sensor, not a gas cap or gas door. "
1o8bcm1,91 Acura Legend coupe front end suspension need help,"In what order exactly, am i supposed to reassemble my entire front end suspension? its all took apart on both sides but right now i already got the new CV axels in, new balljoints pressed in, new upper control arm installed, and when this is done im replacing the rack & pinion.  


when assembling the hub, with the lower ball joint slipped in that hole, i cannot get the CV Axel to slip thru the hub because the strut is in the way and i cant just remove it and install it last.

super close to finishing need help what order am i supposed to do this",1,1760633245.0,2,MechanicAdvice,1760729627,2025-10-16 16:47:25,2025-10-17 19:33:47,"TheBigYellowCar (Score: 1): Tough to say without actually putting my hands on it, but in my head I would put the steering knuckle on the axle, connect the lower ball joint, connect he strut, and leave the upper ball joint for last. 

If you have the new rack on hand I’d do that first just for the sake of having more room."
1o8b0wm,2010 Toyota Corolla which do I need to fix first and are these prices fair?,"Sorry if this isn’t allowed. I bought a used Corolla a while ago and this was the pre purchase inspection thingy. 
I’m broke as a joke and don’t know jack about cars. I’ve already put in $700 because right after I bought it, the water tank disintegrated (funny enough, that was the reason I got rid of my last car…).
Anyways I don’t want to get charged too much over repairing stuff that isn’t necessary, but also the car rides really rough and so I know I gotta do something… 
I have $800 I can put towards my car. Would it be worth it to buy parts and try to do it myself or should I just take it to a mechanic?",0,1760632541.0,21,MechanicAdvice,1760729627,2025-10-16 16:35:41,2025-10-17 19:33:47,"CravenMoorehead9029 (Score: 14): Damn these prices are ridiculous! $75 for wiper blades? You can get them for $20 at orileys and they will install them for free!

Big-Preparation-1594 (Score: 4): Wiper blades, rear brake shoes, spark plugs, and front right caliper are easy diy that can be done. Plenty of videos on YouTube on how to do. 

Everything else would be for a more experienced diy mechanic, but definitely possible to do yourself. Those prices are nuts."
1o8au2w,Honda fit throwing p0420 code,"I drive a 2015 honda fit EX its at 127,000 miles. It just started giving me a p0420 code while i was driving. It shows this twice. Im trying to figure out a best course of action to tackle this without paying a mechanic. 
And any youtube videos/guides showing how to do stuff really helps out. 
Im not sure if it contributes but i just fixed my ac dial, the metal bar that connects to the flaps was bent so i unbent it. 

Yes i have to use a broomstick to hold the hood car didnt come with a hoodstick and i have this on hand 😭😭
",1,1760632120.0,3,MechanicAdvice,1760729627,2025-10-16 16:28:40,2025-10-17 19:33:47,"Slalom44 (Score: 1): You catalytic converter isn’t doing its job, and the reading between the upstream and downstream oxygen sensors isn’t showing enough difference. This usually means your cat is bad and needs to be replaced. But before you bite the bullet, you may want to try using something to clean your cat. I’ve used CataClean in the past with success, but there are other products as well.

RudbeckiaIS (Score: 1): 2015-2016 Fit/Jazz had a serious problems with fuel injectors QC at the factory. To cut a long story short this problem with fuel injectors, not a failing catalytic converter, will trigger P0420. 99% this is your problem. To confirm this diagnosis you will need I-HDS or another diagnostic software or tool that can perform an injector AF test. 

Honda replaced the whole set of four fuel injectors under warranty (once they admitted the problem in late 2018) on cars that displayed P0420. Since you would need to pay out of pocket you can get away with just replacing just the injector(s) that fail the AF test."
1o8at38,Power steering pulley,So I was in the process of takeing the pulley off and the lip kind of broke what do I do ?,1,1760632056.0,10,MechanicAdvice,1760729627,2025-10-16 16:27:36,2025-10-17 19:33:47,"micknick0000 (Score: 1): Were you removing the pulley to replace the pump?

See if your parts provider can get a pump with a pulley installed.

lampministrator (Score: 1): You weren't using a [Puller](https://www.grainger.com/product/48UU71?gucid=N:N:PS) Were you?  You need to use a tool [Like this](https://www.summitracing.com/parts/wmr-w87022?seid=srese1). -- It has two halfs that are held together on the notch by a sleeve.  You may be able to salvage it with the correct tool."
1o8ap4r,My turn signals won’t work 2014 ford escape,So my hazards turn on and blink but only in the rear. When I go to use turn signals it blinks really fast but only in the rear again none up front. Any help guys I’m thinking it’s a fuse but I don’t know which one I found the owners manual online and still don’t know what it’s labeled under.,0,1760631802.0,6,MechanicAdvice,1760729627,2025-10-16 16:23:22,2025-10-17 19:33:47,isajahr (Score: 1): Could it possibly be that the bulbs are bad?
1o8ao6k,Stiff brakes and won't move easily.,"Yesterday, I added the brake light push piece that turned off the lights, and they went off successfully. I drove for a long time, and then when I got close to home, I noticed the brakes started getting progressively harder and felt different. So I parked, and it took 2-3RPM to even go small distance.

So this morning, I started it, and there was no issue. I drove it, and again, the brake pedal got harder, high rpm, and wouldn't move by itself without hitting gas hard on Drive/Reverse. I noticed a burnt smell and smoke coming the driver's side rotor(?).",1,1760631740.0,7,MechanicAdvice,1760729627,2025-10-16 16:22:20,2025-10-17 19:33:47,"Primary_Major6518 (Score: 1): Sounds like the caliper is locking up. Stiff brake pedal indicates either a failing vacuum booster or pressure not bleeding back into the master cylinder. Could be a bad hose, the cylinder itself, or something with the ABS. What exactly did you install to ""*make the brake lights turn off*"""
1o8alc8,What is this sound?,,1,1760631558.0,4,MechanicAdvice,1760729627,2025-10-16 16:19:18,2025-10-17 19:33:47,"Overall-East-9129 (Score: 2): It’s a 2008 Chevy hhr with a 2.2L eco

Independent_Bat5524 (Score: 1): Sounds like a rod bearing."
1o8akgd,Mattco won't replace tools,"Okay so I'm writing this for my boyfriend. He's a mechanic and he gets his tools through Mattco, which is new for him because he usually uses Snap-On. Well, he has a flashlight he needs to replace and another coworker of his needs to replace his rachet. However, the delivery driver is refusing to replace these items and put in orders, because he owes ""too much in taxes"", which he doesn't specify who he owes these to. He is also refusing to talk to people who don't owe him money for the tools he's brought in the past month.

After much arguing between the driver and my boyfriend the driver said it would take 3 weeks to a month before he can put the order in, and that the workers will not receive their orders for a year. Then he said that he needs receipts for all the items as well, which I guess some people at the workplace don't have them and he refuses to look them up in the system. Any idea of what I should do?",44,1760631505.0,75,MechanicAdvice,1760729627,2025-10-16 16:18:25,2025-10-17 19:33:47,"Protholl (Score: 176): Your matco guy seems shady.  Try direct

[https://www.matcotools.com/customercare](https://www.matcotools.com/customercare)

smthngeneric (Score: 58): Your matco guy is on tool hold. He's essentially maxed out his credit with matco and can't order more tools without clearing his debt. He'll probably go under soon"
1o8a5kg,What do you mechanics use to keep bolts organized?,"I’m not talking about a few bolts or a small project. 

I had a relatively easy project but I had to remove a lot of stuff to get there. I didn’t lose any bolts, but it was real easy to start second-guessing myself about which kind of bolt want where. 

Is there a “removed bolts organizer?”
I’m basically looking for a magnetic cupcake tray that I can write on or something along those lines. 


Thanks! ",3,1760630577.0,43,MechanicAdvice,1760729627,2025-10-16 16:02:57,2025-10-17 19:33:47,"reddog093 (Score: 11): > I’m basically looking for a magnetic cupcake tray that I can write on or something along those lines.

  
Cardboard seems to work for most people, but I usually just take photos, store things in zip-lock baggies and tape the bags near their related parts. 

https://preview.redd.it/nrsjslu51ivf1.png?width=1080&format=png&auto=webp&s=4cb869a6ad2801a0aa4439f6225a60179989b962

iLikesmalltitty (Score: 5): One big bucket."
1o8a5k3,2012 Opel Corsa D 1.2l Petrol - High Fuel Trim,"Today I replaced the spark plugs in my Opel Corsa as I'm trying to get to the bottom of a high fuel trim issue and I'm replacing easy parts like spark plugs along the way to learn more about how to do basic maintenance/troubleshooting on cars.

The carbon buildup on the plugs indicate that there is too much fuel entering the system, my downstream 02 Sensor is reading steady at 1.275v which too high above 1v. Should I look at replacing the Downstream 02 sensor next? My upstream sensor fluctuates between 0.070v and 0.800v which seems within range? I have also replaced the purge valve as I found it was stuck open and causing very rough acceleration/hesitation.

  
A few months back I got an engine light for a P0420 'Efficiency below threshold' for my catalytic converter, I cleared the code and it has yet to come back.

  
Looking forward to reading any queries or potential solutions you might have which might give me a different view on the problem. ",1,1760630577.0,2,MechanicAdvice,1760729627,2025-10-16 16:02:57,2025-10-17 19:33:47,"Alpinab9 (Score: 1): The plugs are worn but a good color. If no faults are present, you have no problems. A decent scan tool will show live data, including your short-term and long-term fuel trim STFT LTFT. If they are -10 (rich) to +10 (lean) or less, you are good. I dont think it will even throw a fault unless these numbers get to around +/- 15."
1o8a4oj,Bad noises,"Drove into work today with no issues until I got off interstate. Essentially lost power for the most part. Shut it off, turned it back on. Sounded horrible. Was able to limp it a couple blocks to work where I took this video. Giving me P0012, P0022 and P0025 codes. 

2008 Toyota Tundra 5.7L V8",1,1760630524.0,6,MechanicAdvice,1760729627,2025-10-16 16:02:04,2025-10-17 19:33:47,"NomMyShark (Score: 3): Motor is cooked

DEIhire (Score: 2): The engine is knocking. Will need to be rebuilt."
1o89ygf,Anti-theft system recommendations,"Hope I’m in the right place here. I’m purchasing a new to me vehicle this week, my top option is an ‘06 civic 5-speed manual with just under 170k miles. I’ve worked on my 98 accord myself for 4 years (yes I’m a YouTube mechanic lol, gotta do what you can while poor 😂 and hey, the car made it to 234kmi after being in a donation lot, till the torque converter went on me, still driving 1st-2nd and occasionally 3rd with caution for the last month 😂), so am somewhat comfortable making repairs but installation of things like kill switches would be new to me. My goal is to 1.) not wake up to no car of course, we live in a rough part of our city, which is in general a rough part of our state and 2.) bring my premiums down a bit

Would love some input into what my options are and how “beginner” friendly some of their installations are. I’m a quick read, got through almost 1700 pages of my 98 accord manual along with lots of videos and call in’s to my retired mechanic Grampy, and have been able to troubleshoot and repair just about everything wrong with it over the last 4 years so I’m not entirely incapable. Thanks! ",1,1760630157.0,4,MechanicAdvice,1760729627,2025-10-16 15:55:57,2025-10-17 19:33:47,"Tesex01 (Score: 3): Don't waste your money. If they want to steal it. They will steal it.

charros (Score: 2): The club"
1o89w14,Would this crack be enough to cause an issue? 2015 sti,"I’m getting an intermittent blinking care with no check engine light. It tends to happen at around the 25 minute mark. My working theory is that the car won’t go into closed loop mode because it’s getting inconsistent readings of air fuel ratio due to this crack in the inlet. 


The crack in the inlet is after the mass airflow sensor. Would this crack big enough problem to cause such an issue? Furthermore, what can I use to seal this crack?",3,1760630003.0,5,MechanicAdvice,1760729627,2025-10-16 15:53:23,2025-10-17 19:33:47,"zzzaj2017 (Score: 2): JB Weld is your friend 😁

Lopsided-Office-312 (Score: 2): Yes."
1o89fhi,"Goo on the ignition switch (??), flashing lights, clicking sound when turning key in Ford E-350?","Hello! I recently bought an 07 Ford e350. This morning, the key wouldn't turn when I tried to start the van. After a bit of jiggling it ended up starting normally. I had the same issue later in the day, and when I jiggled the steering wheel while turning the key, the key turned but the engine didn't start. Instead, the dash lights started flashing and there was a loud clicking sound. After that, the key would turn normally but the clicking and flashing lights happened every time I tried to start it.

I wondered if it was a bad ignition lock cylinder or ignition switch, and after some brief googling (I know nothing about vehicles lol) I decided to try disconnecting the ignition switch and moving the pin manually to try to get it to start and bypass any issues with the ignition lock cylinder. When I got it out, I found thick, light yellow goo on the pin and more yellow goo inside of the hole that it goes into. I put the key in the ignition and the lights turned on when I moved the pin manually, but the clicking sound still happened when I moved it farther. 

Does it sound like replacing the ignition switch might fix the issue? What might the yellow goo be coming from? Any advice is much appreciated!!! :)

(Reposted because I forgot to attach the video the first time!)",2,1760628962.0,5,MechanicAdvice,1760729627,2025-10-16 15:36:02,2025-10-17 19:33:47,"mentaldemise (Score: 2): Sounds like a dead battery. I have an E-350 where I just keep a jump trigger in the cab because the ignition wasn't the issue. I haven't bothered to track down the actual issue though.

Slowburn21814 (Score: 1): That yellow goo is called dielectric grease and it is supposed to be there as a corrosion preventative. The problem you're having is a dead or nearly dead battery. The difficulty in turning the key is either the steering wheel lockout (likely) or a worn key or ignition cylinder. If jiggling the key in the ignition worked, then its your key or cylinder,  but if jiggling the steering wheel back and forth worked, then its the steering lock.

Get another vehicle to jump you. Positive (red) terminal to positive terminal, then negative terminal on the donor car to body ground on your van. That'll be pretty much any bare metal under the hood. Keep donor car running and even bring the throttle up to 2500ish rpms while cranking over the van. Good luck and report back."
1o89730,Tensioner spec?,Is there a spec for how many teeth can be exposed before timing is jeopardized? 3.6L V6 Pentaturd. ,1,1760628444.0,3,MechanicAdvice,1760729627,2025-10-16 15:27:24,2025-10-17 19:33:47,"Opposite-Ad-2548 (Score: 1): I don't think there's a spec, but that looks maxed out!"
1o88yrg,5.7L Hemi no start,"I have a 2022 Grand Cherokee WL with the 5.7L Hemi.  I’ve had some no starts with the starter not engaging, a jump gets it going.  I replaced the battery, after a week it’s doing it again.  Next steps I’m considering are check starter connections, replace secondary battery and assuming it still doing it replace the starter.  Should I think about something else? ",1,1760627927.0,2,MechanicAdvice,1760729627,2025-10-16 15:18:47,2025-10-17 19:33:47,"Crabstick65 (Score: 1): Simple, you need to see what happens at the solenoid trigger wire on the starter when it's not cranking, assistant turns and holds key in start position, you test with a test lamp for voltage, if the voltage is present at 12 volts then starters bad.

use science, not guesswork.

If no voltage present then you need to work back through the system with a voltmeter, this system will have a starter relay which will have ecu controlled ground for immobilisation etc plus there will be a feed from the ignition switch possibly passing via the body module."
1o88t47,Oil change before winter storage,,1,1760627566.0,2,MechanicAdvice,1760729627,2025-10-16 15:12:46,2025-10-17 19:33:47,yourredneckfriend (Score: 1): Yes. Part of the oils function it to clean contaminates from the combustion process. Don't leave the contaminated oil in the engine over the winter.
1o88rpp,Car “slips” under load. Cause?,,1,1760627476.0,2,MechanicAdvice,1760729627,2025-10-16 15:11:16,2025-10-17 19:33:47,MCA2142 (Score: 1): Check the O2 sensor.  Make sure the connector is fully seated.  You might have to replace it.
