id,title,selftext,score,created_utc,num_comments,subreddit,scraping_time_utc,created_datetime_utc,scraping_datetime_utc,top_comments
1nqmjaz,How do I separate the Turbine Housing?,Turbo is off of a 1987 Conquest TSI. ,1,1758844416.0,11,MechanicAdvice,1758915136,2025-09-25 23:53:36,2025-09-26 19:32:16,"mushmushhhh (Score: 1): Snap ring pliers.   See the big snap ring on the bottom there?  Take that off.

So-Durty (Score: 1): Courtesy of [The No Way Guy](https://youtube.com/shorts/H_kyNXQ4yg0?si=7I7C88o3QeOVvWf1)"
1nqmgb7,Mercedes steering issue on highway,"Okay this is going to be super specific but here goes. My wife recently bought a 2022 Mercedes GLC with $18K miles. Seems to drive fine except for this one issue on the highway. We haven’t noticed it any other times. 

For context most of the section of highway we drive regularly had some work done right between the two lanes which left a slight hump in the pavement when it was repaired. Anytime we switch lanes and go over this uneven section the car noticeably pulls in the same direction we are traveling (i.e. pulls to the left when switch from right lane to left lane). The faster you go the more noticeable it is. 

Normally I would blame the road for this, but I can’t replicate the issue with my car. I checked her tir pressure and it’s normal. Could this be a steering column issue? Or just a weird quirk? ",1,1758844181.0,2,MechanicAdvice,1758915136,2025-09-25 23:49:41,2025-09-26 19:32:16,"ihatewrenching (Score: 1): Toe out will do this, check alignment as a first step. These also have a steering module software issue that causes them to shimmy the wheel when going over bumps at 40+"
1nqmcyo,Engine knock at 2k rpm and below?,"2004 Subaru Forester. Oil level is full and has been. Sound started a few days after changing sparkplugs, but this may be coincidental. Some days it doesn't make this sound, or stops when the engine warms up. Its been like this for a few weeks now. yesterday and today, the spund wont go away. Once i get above 2000 rpm the spund is gone, and the engine feels like its running very smoothly. I removed all the accessory belts and ran it, but the sound was still there. None of the accessory pulleys. I'm at a loss, and terrified this is it for my car. I'm on a broke college student budget, so I can't take it to a shop yet. I stopped driving it in case it causes more damage. What now? Would internal engine damage stop making sounds under load and when reving? It gets so normal and quiet when driving. Just when I get to a stop and the rpms go down. The check engine light is just for gas cap evap. No other codes. ",1,1758843918.0,7,MechanicAdvice,1758915136,2025-09-25 23:45:18,2025-09-26 19:32:16,"Primary_Major6518 (Score: 2): Sounds rough. You definitely have something knocking around. Possibly timing chain (due to the misfire issues)? Im not sure if its rod knock. Any who, what's happening is when you let off the throttle your oil pressure drops. Its dropping low enough that something isn't getting lubrication. It shoots back up when you get on the throttle if i had to guess

octuplepants (Score: 1): Added info I forgot:

Had the car 5 years, put 35k miles on it. Changed the oil every few thousand miles.

After changing sparkplugs, I had major misfiring issues. I changed all the plug wires (TWICE) and the ignition coils, then the misfiring stopped."
1nqm2bp,OBD2 Scanner upgrade,"Anyone have experience with this Gearwrench? I currently use an Ancel AD310 which has served me well for all my repair needs, but live data is pretty limited.

I'm getting an P0430 cat efficiency code and want to investigate more detailed live data. I think considering the code, investing in a better scanner is worth it.

I'm open to any other suggestions too. Thanks!",1,1758843108.0,6,MechanicAdvice,1758915136,2025-09-25 23:31:48,2025-09-26 19:32:16,"RichardSober (Score: 1): What car do you have and how are you going to diag P0430 with a ""better"" scanner?"
1nqm1h0,Career change from Industrial Maintenance to Heavy Equipment Mechanic,"I'm very mechanically inclined. I've ran manual and CNC machines since I was 18. Been welding since I was 15. And have been doing industrial maintenance for 4 years. I've been working on cars since I was 16, as well. So I know my way around engines. I have an interview in 4 days and was wondering if there was any advice, reading material, videos, ect. to gain more knowledge on heavy equipment such as backhoes, excavators, dump trucks, ect. As well as some interview questions that you've asked or have been asked. I really appreciate any information as this is a job opportunity that I am really excited for. ",1,1758843044.0,4,MechanicAdvice,1758915136,2025-09-25 23:30:44,2025-09-26 19:32:16,"MiniTrucker84 (Score: 2): I'm a service coordinator for a heavy equipment repair company.  70% of service calls are troubleshooting either hydraulic or electrical issues. Proper troubleshooting techniques and eliminating potential issues is a huge benefit, especially if you're working for a company that's not a dealer with proprietary software. Good luck with your interview!"
1nqlznn,Strut/shock Replacement?,"Hi there, I'm planning to take the car into a mechanic, but want to at least sound somewhat competent when I go in, so I have 3 questions I was hoping for assistance with: 

1) We noticed oil leaking on the driveway from the (strut?/shock?) circled in red. I'm guessing this part needs to be replaced (you can see it covered in oil in the the pic, though it's not actively dripping anymore). Is this a correct assumption or can this potentially be repaired? 

2) Do they need to be replaced in pairs (i.e. the other wheel as well)? 

3) Is the rusty area circled in yellow something that I should be concerned about or is it mostly cosmetic? What is that part called and does it need to be replaced? 

Thanks in advance!! ",1,1758842901.0,2,MechanicAdvice,1758915136,2025-09-25 23:28:21,2025-09-26 19:32:16,Primary_Major6518 (Score: 1): Shocks do need to be replaced in pairs as they do affect handling. That looks to be the wheel hub/knuckle mount? Don't know the technical term. I would have them inspect that as that where the wheel mounts.
1nqluq4,"Pardon my ignorance, I’m ordering parts to repair on my passenger side on my 03 Volvo s40. Is this bent to hell link pin a sway bar link or a stabilizer link?",,1,1758842525.0,5,MechanicAdvice,1758915136,2025-09-25 23:22:05,2025-09-26 19:32:16,"Slvrdgr (Score: 2): ![gif](giphy|hM9zK1qvsrwek)

Ok_Specialist_2233 (Score: 1): Same thing, different name."
1nqlor7,"Does this look right to you, is the camber off?","I was doing some fender work on the left side when I walked away turned to look at the car and saw this. Is it supposed to be like this? I do have adjustable camber bolts. 

It’s a 2004 Honda crv with HRG 3 inch lift. ",4,1758842086.0,23,MechanicAdvice,1758915136,2025-09-25 23:14:46,2025-09-26 19:32:16,"a-borat (Score: 52): Yeah but you also couldn’t have taken a worse photo for comparing something’s variable angle against a constant if you left the lens cover on. 

Back up, and let’s see how the tire sits under the car, preferably next to something big and vertical.

TheRevEv (Score: 5): I looked up these hrg kits. They do not appear to be adjustable, but they have offset spacers they say correct camber and caster. 

It's possible whoever put the lift in didn't put them on the correct sides. 

It's also possible that  thus is just how these kits are gonna ride. 

I've been out of the offloading scene for a while, but I remember this stance being fairly common on a lot of the more economical IFS lift kits."
1nqlkza,Won’t turn over,"1998 S10. Never made this noise before. Checked for animal nests, chewed wires, etc and can’t find any. 

Thoughts? ",8,1758841799.0,6,MechanicAdvice,1758915136,2025-09-25 23:09:59,2025-09-26 19:32:16,"Idea_Neither (Score: 5): Low voltage

Otherwise_Plenty_174 (Score: 3): Cables or cable ends at battery"
1nqlk7i,I think there are oil droplets in the ac?,"hi not sure whats going on. I have an electric vehicle, if it matters, but this past week or so I'll be driving and I get alot of chest tightness and my mouth tastes something, not sure if its oilish(reminds me of cod oil?) and I get tightness in the chest( got worried i had covid but it got better after i coughted it out after getting home). 

I drove again, and same thing. feels like there was oil in my lungs. Reminded me a lot of diffused eucalyptus oil which has given me breathing issues before (not into esdebtial oils just I’ve been around it) ",1,1758841743.0,3,MechanicAdvice,1758915136,2025-09-25 23:09:03,2025-09-26 19:32:16,Dr3kw1ll (Score: 1): Refrigerant leak.
1nqlk58,Do the same year Corolla and Corolla Cross share the same infotainment system for replacement purposes?,"Got quoted $8k for replacing the apply car play screen on a cross. Thinking about finding one from a junked Corolla, since they seem to be the same, & replacing it myself. Could anyone confirm they’re similar enough to exchange?",2,1758841738.0,2,MechanicAdvice,1758915136,2025-09-25 23:08:58,2025-09-26 19:32:16,Fategfwhere (Score: 1): This would be for a 2022 Cross btw
1nqlivv,Can someone adultier and experienced in the automotive industry please tell me what to do?,"I have a 2017 Lincoln MKC with 194,000kms on it. It’s the best car I’ve ever had. Never caused any troubles, no body issues(looks great), has always run great and has been paid off for awhile. It owes me nothing I guess. 

It now has transmission problems. The dealership (I know, don’t yell at me) did a diagnostic and reports back that it’s clutch pack(s?) related. Obviously recommends a replacement for $12,000. 🤣 (oh and offered to get the sales department to give me a trade in value lol wth). 

Tomorrow I will take it to a proper transmission specialist to take a look and give their own assessment. 

From what I can tell, it’s still valued at $15,000-$17,000? (Obviously without the transmission problems). I *know* this car has a handful of years left in it. 

Please dear mechanically inclined humans, tell me what is the most I should reasonably spend to repair, replace, or tell me if there’s other things I should consider about all this. Am I getting rid of it? What do I do? Is it worth it? I need some hand holding on this one. Please be gentle with me. I’m a woman and am feeling pretty sensitive about this whole thing. The car industry is scary as shit and I’m currently scared of making super bad decisions, being taken advantage of and feeling stupid(er). I wish I had a dad or grampa to help me, and am hoping some kind Reddit soul will. 

I don’t know if this helps but I’m Canadian and I like my trusty car and don’t want to feel scared and dumb all over again trying to buy a new one. 🫣🥺",2,1758841646.0,5,MechanicAdvice,1758915136,2025-09-25 23:07:26,2025-09-26 19:32:16,"whiplash-willie (Score: 2): Any good local transmission shop will knock out an overhaul in the $6-8k range.  For that king of money, if you get 6 more years iut of it you are probably about $100k ahead of the payments on a new ride.

Past-Attorney-8197 (Score: 1): where do you live? go on [car-part.com](http://car-part.com) and find yourself a used transmission with low km, and have it installed by an independent shop."
1nqlhkg,Cheap brakes store?,"Where can I buy them for cheap? I'm looking to trade in my car soon so I don't need to spend tons on brakes 

 tia",1,1758841546.0,6,MechanicAdvice,1758915136,2025-09-25 23:05:46,2025-09-26 19:32:16,"lethalnd12345 (Score: 3): RockAuto

cormack_gv (Score: 2): DIY replacement?  Lots of places.  Amazon, Rock Auto, AutoZone, etc. (assuming you are in US).  In Canada, Amazon, Canadian Tire, PartSource."
1nqletq,1997 Mazda b2300 cluster problems,"My 1997 b2300 speedometer sometimes works perfectly other times not at all or tries to work but is very unstable. I have replaced the vss, and the plug on the vss still not working. I think it might be a short between the speedometer and the tach, cause sometimes when it's working, and I hit the gas it drops the speedometer, also the tach bounces when I speed up sometimes. Also want to know if a ranger speedometer would fit mine. Wish I could get a video of it jumpingbbut it's not cooperating. 2wd 2.3l automatic transmission ",1,1758841344.0,3,MechanicAdvice,1758915136,2025-09-25 23:02:24,2025-09-26 19:32:16,BIG_BOI_LLAMA (Score: 1): Got a video of it jumping around can I put in the comments? 
1nqlcdy,GMC Acadia wont start after sitting for a month,"Car been sitting for about a month and a half. Went to start my car today and got nothing—no lights, no power at all. Tried jumping it, and everything lit up fine. Battery shows 13v on the meter on the dash, but it’s also giving a “low battery” warning. Car still won’t start with the push button. Any ideas what might be going on? Should I pull the battery and try a trickle charge??",2,1758841174.0,2,MechanicAdvice,1758915136,2025-09-25 22:59:34,2025-09-26 19:32:16,KwazzySells (Score: 1): Your first step would be to try a new battery or have it tested at a parts store. It sounds like it is depleted and in need of replacement.
1nqladx,How can I pass the Emissions test,How could I bypass the emission test? I have a Check Engine Light on my dash for code P2422 – EVAP System Vent Valve. Will this automatically make me fail the emissions test? I’m also fully catless with a tune on my 2006 civic could  this affect the test? I’m from Illinois. 🫩,0,1758841026.0,4,MechanicAdvice,1758915136,2025-09-25 22:57:06,2025-09-26 19:32:16,"Ejb119986 (Score: 2): Fix the check engine light and do a drive cycle to ready all the monitors and then get your inspection.

AcceptableMinute9999 (Score: 0): There's no way you can pass unless you can pay someone to cheat for you."
1nqkw88,How bad is this?,"Would anyone recommend attempting to fix this? I want to see if it’s a possibility, I’m not very mechanic savvy, but I feel like if I could fix this it could be a good learning experience, but I’m also ready to accept the fact that it’s done for and not keep throwing money into this engine and just replace it with a new one, what are your guys thoughts? Please let me know, connecting rod is also messed up so I know that will be another issue.",1,1758839994.0,25,MechanicAdvice,1758915136,2025-09-25 22:39:54,2025-09-26 19:32:16,"txcancmi (Score: 18): No machine shop or reputable welder I know would even quote a repair on that. She's done.

Zealousideal_Ad3038 (Score: 5): That’s done for, you may be able to save some money just getting a short block and reusing your heads depending how they look"
1nqkvh9,Bushings Starting to Tear? (2021 Volkswagen Arteon SEL R-Line),"I brought my car in for an oil change and they mentioned the front bushings are just starting to tear but should be okay until I need new tires for the winter (I'm a college student so I'd rather get both done at once to save time and money). They don't look terrible, but my steering has been clicking slightly at full lock for about a month or two. I just wanted to get a second opinion, as I'll probably be driving about 1-2k miles on them before I get the tires replaced.",1,1758839941.0,2,MechanicAdvice,1758915136,2025-09-25 22:39:01,2025-09-26 19:32:16,mushmushhhh (Score: 1): Those could easily last another decade.
1nqkubr,Need help with 2013 ford Taurus alternator,Just replaced an old bad alternator with a new one from oreillys and it simply didn’t work took it to a shop only to be told that one was bad also any advice on how to proceed with a new alternator and if anything I did while replacing it caused the second one to fail ,1,1758839863.0,2,MechanicAdvice,1758915136,2025-09-25 22:37:43,2025-09-26 19:32:16,"lethalnd12345 (Score: 1): Almost impossible to do it wrong.  More likely it was a bad part, which does happen"
1nqksoi,What's this little hose do?,"So I helped a buddy jump his car, & I think in the process of moving the jumper cables this little hose popped off. There's air coming out of it. Tried to put it back on but I checked a few days later and it came off again. 2004 Lexus ES330

I tried to zip tie it on there but couldn't get the tie tight enough. Maybe I'll get a hose clamp? Or what do you recommend? And what does it do?",3,1758839743.0,11,MechanicAdvice,1758915136,2025-09-25 22:35:43,2025-09-26 19:32:16,"George___42 (Score: 7): If I remember correctly, that's the vacuum lines for the engine mounts.

Yes you read that right.

Toyota uses a adaptive engine mount that accounts for vibration based on the vacuum produced to realize engine load and thus harshness.  Meant to make the cabin smoother since the engine mounts can block resonant frequencies at a broader range of the rpm.

The Active Control Engine Mount (ACM) is the technical name if I am not mistaken.

iscoleslaw (Score: 3): Make sure it’s long enough first but just cut the tip off the hose that’s split and put it back on"
1nqknuy,Any Tips to Save Money When I Attempt Putting new Shocks In My Car?,"I ordered some nicer shocks for my car (2005 Chevy Trailblazer I6 4.2L). I'm also planning on replacing ball joints, swapping/flipping my UCAs (for better ball joint angle with increased ride height), and cleaning that brown corrosive stuff off my precious metal components. So far, I pretty much just have some ramps and a 3/8 and 1/4 inch socket/ratchet set (plus a bunch of wrenches). 

I'm just wondering how I can save a bit of money on this little project of mine. I am saving for college right now, so I don't really want to break the bank here. I know some people who have floor jacks and jack stands, but I am not 100% sure if they would be down to let me use them for the amount of time I'd need them. If I am not mistaken, I can rent some stuff like a ball joint press and torque wrenches (Black Friday also might help me out). 

Anywho, any advice is appreciated. Thanks, Y'all!",1,1758839390.0,3,MechanicAdvice,1758915136,2025-09-25 22:29:50,2025-09-26 19:32:16,agravain (Score: 1): why do you want to increase the ride height?
1nqkl7b,Can someone please tell me what this is and where it goes in my '06 Chevy Silverado it's automatic transmission this is underneath the dash hanging,,2,1758839199.0,4,MechanicAdvice,1758915136,2025-09-25 22:26:39,2025-09-26 19:32:16,"Bitter-School-62 (Score: 3): Parking brake switch?

Dr-gizmo (Score: 1): Parking brake switch"
1nqjog4,05 Accord with no heat and defrost.,,1,1758836936.0,5,MechanicAdvice,1758915136,2025-09-25 21:48:56,2025-09-26 19:32:16,"External-Industry253 (Score: 1): Could be a bad heater core. Also maybe one of your hoses is blocked. You can usually touch them from the engine bay. The two hoses must be hot. If one of them is cold, your heater core needs a flush"
1nqjnii,What do I need to do to fix this...,"dont say ""bring it to a shop"" really cant do that unfortunately i cant afford that at all. do i just need to tighten the shit out of the cv axle nut or whats the deal.. thanks in advanced btw. 

new brake pads would be an obvious here too.",1,1758836875.0,23,MechanicAdvice,1758915136,2025-09-25 21:47:55,2025-09-26 19:32:16,"Huge-Purpose-3336 (Score: 8): Wheel hub

Optimal_Cupcake2159 (Score: 6): New hub/knuckle. It looks as though the axle has somehow chewed it's way through the bearing. That's well beyond tightening. 


And, given the way bearings usually require a hydraulic press to install them, that is a job for a shop. "
1nqjjrk,Car cranks but won’t start. 2003 Toyota Camry,"Got this car from a buddy who had been working on it for a while. Car sounds like it’s trying to start but can’t. He worked on the fuel pump and wiring but still can’t get a start. Code reader is stating a computer failure and won’t display codes. Do I need to replace the ECM? Battery and alternator have been replaced recently. 

",1,1758836617.0,10,MechanicAdvice,1758915136,2025-09-25 21:43:37,2025-09-26 19:32:16,"agreeable-911 (Score: 2): Could be a crankshaft position sensor or a camshaft position sensor   That’s what it sounds like to me, but I don’t thinkthey’re hard to get to. They might be a little pricey.

Grouchy_Radish9554 (Score: 2): Fuel pump? Or is there gas in it?"
1nqjbok,2012 mazda 3 missing bolt on rear motor mount,"Missing bolt on the rear engine motor mount. The one that goes straight up in there. I know i used a 17mm socket to remove it but something happened and it fell out.
",0,1758836064.0,3,MechanicAdvice,1758915136,2025-09-25 21:34:24,2025-09-26 19:32:16,External-Industry253 (Score: 1): Just put it back in place
1nqjapx,Wires wont unclip,,1,1758836001.0,2,MechanicAdvice,1758915136,2025-09-25 21:33:21,2025-09-26 19:32:16,dilbert_fennel (Score: 1): It looks to me like there is a clip holding it in place in the bottom half of the square. See how the top half has wires but the bottom half just has a plastic tab? Try to wedge a flathead there and press it up while pulling the plug out
1nqj3q0,What makes an engine run quieter?,"Hello, I have a diesel car VW 2.0 TDI. 

My neighbor bought the same model, with the same engine code, both cars are with stock generation, without any modifications. The difference between them is that one has manual transmission, the other has an DSG automatic. 

I want to ask why one runs noisier, even though it has fewer kilometers? In your experience, what can make the engine quieter - additives, different gas stations? Does the oil affect - for example, if you drive with 5w40 and put 5w30 or 10w40, what would be the effect?",1,1758835503.0,6,MechanicAdvice,1758915136,2025-09-25 21:25:03,2025-09-26 19:32:16,"Pistonenvy2 (Score: 1): oil pressure definitely effects noises, idk much about diesels so i cant really speak to what is or isnt loud but probably something in the valve train as thats usually what makes the most noise in gas engines. 

thicker heavier oil can quiet things up.

abuse or neglect can make things louder. there are too many factors to really make an assessment.

Grand_Possibility_69 (Score: 1): Is it noisier one missing engine cover? Or the insulation part under it or under the hood. Most of diesel engine noise comes from the diesel fuel burn itself so mNy things don't change it.

Or perhaps one has bad dual mass flywheel. This does make a lot different engine idle sound. It's easy to check on cold start with manual transmission."
1nqiyaa,What industrial degreaser can clean this bad of an oil spot?,,474,1758835128.0,353,MechanicAdvice,1758915136,2025-09-25 21:18:48,2025-09-26 19:32:16,"LightningLeg (Score: 527): Dawn dish soap. Dump it on there and leave it for like 2 days. Pressure wash it. Good as new

lonerwolf85 (Score: 47): Zep purple degreaser works good on concrete stains."
1nqiutt,"Tensioner pulley, belt, alternator or something else? Help please","1997 buick lesabre
Loud whining noise on passenger side so not power steering related. 

Please help me figure out what this is",1,1758834895.0,5,MechanicAdvice,1758915136,2025-09-25 21:14:55,2025-09-26 19:32:16,"DrifterDavid (Score: 1): Take a screwdriver and put it up to your ear. And with it running touch the metal end to each thing. Believe me you'll know when you hit it. It will be super loud in your ear. Also always good to have one of these around, and they're cheap for finding noises like that. But screwdriver or prybar will work in a pinch. 

  
[https://www.harborfreight.com/mechanics-stethoscope-63691.html](https://www.harborfreight.com/mechanics-stethoscope-63691.html)

F1rst_Time (Score: 1): I’m sorry but that very much sounds like a bad power steering pump."
1nqisov,2018 Silverado 6.2l shifting issue,"As the title says, I have a 2018 Silverado 6.2L, its the LTZ midnight edition if that matters at all. When I test drove it, no issues. But then went on a trip and noticed that when cruising, it would shift funny, make a bit of a clunk sound and the traction control light would show briefly on the dash. It doesnt happen often, and the dealership (Chevy) said the transmission fluid was very dark. They weren't sure why that was missed on inspection (concerning) but they did a full flush, said they dropped the pan and there was no metal found. I just did a little drive and it happened again. What else could be the cause? I am taking it back but want some ideas for them to maybe look at?",1,1758834748.0,5,MechanicAdvice,1758915136,2025-09-25 21:12:28,2025-09-26 19:32:16,"nimbleVaguerant (Score: 1): The last time we had a similarly aged GM truck with a shifting issue in the shop, the trans from the dealer was back-ordered 3 months out.  And the core was worth more than the new transmission itself.  

Good luck."
1nqirq2,Why are my cars headlights working but not my tail lights? I also have a check engine light. Are they linked?,,0,1758834683.0,5,MechanicAdvice,1758915136,2025-09-25 21:11:23,2025-09-26 19:32:16,"Inevitable-West6272 (Score: 1): It’s a Vauxhall corsa 2015

RichardSober (Score: 1): >I also have a check engine light

Scan trouble codes."
1nqiqx3,OEM or aftermarket for radiator and ac condenser?,"Im helping my mom fix up her car since she hit a curb and messed up her front end. She has a 2017 Honda Accord EX-L and needs a new radiator and ac condenser. Does it matter if I go OEM (would order through honda warehouse) or aftermarket? I know OEM is usually more expensive at $430 for both before taxes. Aftermarket has a kit from of radiator, ac condenser, and cooling fan from carparts.com for $214 before taxes.",1,1758834627.0,2,MechanicAdvice,1758915136,2025-09-25 21:10:27,2025-09-26 19:32:16,"WhereDidAllTheSnowGo (Score: 1): Aftermarket is fine.

It’s a popular model.  Radiators are simple.  Hard to go wrong.  Easy to install.

AC requires better machining. Best to find one of these that you can return.  You have tools to work on AC?

Rock auto is usually the best way to go."
