id,title,selftext,score,created_utc,num_comments,subreddit,scraping_time_utc,created_datetime_utc,scraping_datetime_utc,top_comments
1npvt2g,"2010 Odyssey, $1500 power steering pump job?","Mechanic said to my dad it’s a big job because something about the rack and pinion. I’m a car guy but idk what the hell he’s talking about, I’m not a mechanic. Lol. Does he just not want to do it? I don’t think his rate is more than $150. 

Bit of a long post but:

Oh and the deal with this van. Has 270k km, rust, transmission shifts great despite an unknown service history and my dad’s aggressive driving, and I heard the transmissions are bad on these. Check engine light on for who knows what (I’m not around a lot to check). Work van. So scratched up that it feels good to use it for work. Regular oil changes. Currently nothing needs to be done on the suspension afaik. It constantly has heavy stuff in the back though. He can’t really afford another vehicle but he’s just been dumping power steering fluid constantly and filling it up. Not really sustainable. 

Do you think maybe I should give it a scan with my BlueDriver, make sure the suspension doesn’t need anything, and if it’s all good, a bunch of family members try to pitch in for him? Because somehow this van keeps going and getting a used vehicle is a nightmare (I don’t buy things with rust and we live in Ontario. I will be teaching my dad the same). 

Do you guys know if the transmissions usually slowly start slipping on these or is it an instant thing where the transmissions is suddenly bad?",1,1758769134.0,9,AskMechanics,1758915136,2025-09-25 02:58:54,2025-09-26 19:32:16,"Funkyrager (Score: 1): That the tech has to drop the rack and pinion? Depending on how its setup the tech may have to drop the subframe, and then yes that would be a big job,

Particular_Angle_300 (Score: 0): Get underneath. Look at the power steering and the steering rack. Get the codes scanned for free at an autozone or Napa. Cosmetically don’t worry about it. Move parts around, they feel really loose? Like too loose? Bounce your full weight on the front and the back."
1npvpuy,Used Car Lot Kill Switch,"I read my friend’s car and he had every sensor malfunctioning. Took his terminals off, cleaned up his ECM. Well, this is what happened. Clearly it is not a very well wired kill switch. If the shady dealership tries to screw him, any advice?",3,1758768870.0,3,AskMechanics,1758915136,2025-09-25 02:54:30,2025-09-26 19:32:16,"Interesting-Bed408 (Score: 1): I’d like to know about this as well, also have a malfunction in my equinox.  Can you uninstall?"
1npviuq,Replace tire ?,"Hey guys, noticed this on my tire, Should I replace ? I think been driving about a week with this. Size 325/35",3,1758768274.0,10,AskMechanics,1758915136,2025-09-25 02:44:34,2025-09-26 19:32:16,"Corey415 (Score: 3): Yes, replace this tire. 

The rim rash at the same spot indicates a severe impact either from a curb or pot hole.

There is also a chunk of sidewall missing on the same tire, and also rim damage at the top of the picture.

Bruce65lv (Score: 4): Yes.It's done."
1npv4wg,2011 CRV VTC Actuator Rattling,"I've been looking to buy a used car because I totaled my last one. I looked at a 2011 Honda CR-V FWD at a small dealer and test drove it. The carfax had no accidents on it and it looked like it got regular maintenance and oil changes every 5-6k miles. It drove great. I was about to take it to a mechanic to get it inspected when the dealer mentioned that it made a rattling noise when it starts up cold. Mentions he already changed the VTC actuator and the timing chain and it still makes the noise. I hadn't noticed it because it was already warm when I got in it to test it. And yes, it sounded like he did the work himself. I ended up taking it to the mechanic anyway and they didn't find anything else wrong with it.

I would love your thoughts. What else could be making the noise or did he just install the parts wrong? In your experience, is this a recurring issue that could end up being a money pit for me?",1,1758767110.0,7,AskMechanics,1758915136,2025-09-25 02:25:10,2025-09-26 19:32:16,"Fine_Flounder8359 (Score: 1): It was probably replaced with a cheap one     The actuator

Fine_Flounder8359 (Score: 1): You can do those without taking the front timing cover off and untiming the exhaust cam and crankshaft"
1npujmc,"Backed into my friends car, how much will it cost?","I backed into my friends car.  This is the damage.  Car door won’t open, the dents hit in just the worst spot right on the hinge there, but the dent(s) itself is small. 

How much should I expect to need to pay?  I’m trying to fix it without going through insurance.  I worry they won’t be able to pop out the dent due to the location and it will require a whole new fender(or door?) and paint match.  (Isn’t that like $1000+ at that point?)

A bit nervous as I’m in a tough spot financially right now but I can’t just not get his car fixed.  ",0,1758765393.0,22,AskMechanics,1758915136,2025-09-25 01:56:33,2025-09-26 19:32:16,"yacko2000 (Score: 15): Your soul... 👻

my_fun_lil_alt (Score: 4): File an insurance claim. That might be in the $2-3k range."
1npuitn,Why does my car makes this noise when i turn steering?,"Im trying to figure out a weird issue with my car. When I turn the steering wheel it makes this weird noise. I can only hear it from outside the car. Inside the cabin its silent. I checked the power steering fluid, its full. Any idea what could be the issue?

Car: 2011 Mazda 3",3,1758765331.0,10,AskMechanics,1758915136,2025-09-25 01:55:31,2025-09-26 19:32:16,"HeavyUncensored (Score: 5): That’s definitely a power steering pump👍🏼

YourMomsOnlyFans69 (Score: 2): Failing PS pump"
1npufsu,Rear main seal?…maybe,So I have a 6.7l Cummins that I have been working on for a good while (since I was 14) I’m 16 now and it’s had a lot of problems that was just one after another I fixed everything and it ran perfect for about a month then one day I started it and it was rolling white smoke like crazy from the exhaust and had a fuel knock so I bought new injectors replaced a couple of gaskets and when I tried to start it again it now smoked from the rear of the engine and knocks even louder 😭 I also noticed all the oil went missing (luckily the engine only ran for like 2 seconds before I shut it off) and I was wondering 1. How can I diagnose if it is the rear main seal or not and 2. Is this a very challenging part to replace I do know I will have to either drop the transmission or pull the engine which I don’t mind I’ve done those things before but would it be better to just take it too a shop or try it myself. I did buy a ram 1500 after this so I do have a vehicle I just want to fix this up so I can have a good work truck or pass it to my brother. So what do you guys think? ,1,1758765093.0,4,AskMechanics,1758915136,2025-09-25 01:51:33,2025-09-26 19:32:16,None (Score: 1): [deleted]
1npu8ff,08 Subaru Forester radio swap,So I have a new stereo from another 08 forester that I’m trying to install but there’s this seemingly unnecessary cable attached to the current stereo. My new stereo obviously has nothing attached and in all the videos I’ve found for this project that cable doesn’t seem to be in the picture. What’s going on?!,1,1758764513.0,7,AskMechanics,1758915136,2025-09-25 01:41:53,2025-09-26 19:32:16,"AccomplishedPea4948 (Score: 1): If you’re talking about the black with yellow stripe wire, that’s a ground. Detach the radio mounts from your old radio, mount them to your new radio, and reconnect the ground.

Last-Variety-630 (Score: 1): Plug it up and see what happens."
1npu6cm,Volvo XC60 Hood issue,"Hey, I have a 2010 Volvo XC60 and when I try to open the hood only one side pops open. 

If someone else is trying to open it and you pull it will unlock, that also works with putting some cardboard in between to create some tension. 

It seems like the latch has been replaced, but it still has that issue. Do you know how to fix that? 

Thanks 

",1,1758764341.0,4,AskMechanics,1758915136,2025-09-25 01:39:01,2025-09-26 19:32:16,"Bruce65lv (Score: 1): Loosen up the catch just enough so it will [move.Open](http://move.Open) and close the hood to see if the piece on the hood will move the catch to the right position.Tighten it when its moved position.Also spray some white grease on it,and you could twist  the rubber stops up so there is more tension on it.Taking the place of your cardboard."
1nptvmf,2002 Ford 250 (gas),I’m having a issue when I’m driving my truck will kill but the power is still on in the truck I have to stop park and turn the key a couple times and it starts like nothing and it’ll kill shortly after driving a bit further at first I changed my fuel filter after it was really dirty like black water dirty and I changed my alternator on the vehicle and changed the battery terminals and gotten a new battery I think it could be my fuel pump but I genuinely don’t know what else it could be before I take it to a shop that’ll look at it any ideas on what the issue could be?,1,1758763498.0,2,AskMechanics,1758915136,2025-09-25 01:24:58,2025-09-26 19:32:16,GnarlyLeg (Score: 1): My 02 manual v6 mustang was doing this too. Changed everything you did and it kept doing it. My mechanic couldn’t figure it out and eventually replaced some wire harnesses. Problem solved.  Sitting in his shop everything tested fine. It was probably a short that only happened in certain circumstances like hard turns or bumps.
1npt5tr,Toyota Highlander - Transmission Leak,"I recently had my 2017 Highlander in for service to have the transmission fluid changed. I recently noticed a few drips underneath the car in the driveway. When I crawled underneath to take a look, I noticed what looks like transmission fluid leaking from the left side of the transmission near the drivers side front wheel. It looks like a few of the bolts are leaking. Also, there’s a black plastic piece bolted onto the transmission and there appears to be some seepage where this plastic piece is bolted to the metal. I’ve attached pictures, any help/advice would be appreciated. Hoping it’s just some work seals/gaskets that need to be replaced. Thanks",1,1758761444.0,2,AskMechanics,1758915136,2025-09-25 00:50:44,2025-09-26 19:32:16,TieIntelligent7184 (Score: 1): Clearly the canooter valve
1npt0jh,Starter or Battery,"2019 kia sportage with 125,000 miles. Tried to start car and a message pop up that the key wasnt detected. Replaced key fob battery and had the same message still. There is an emergency start procedure and the engine cranked a little bit but did not turn on. Stranger tested battery and it was around 8 volts. Jump started it and it turned on no problem. Battery will be 3 years old in November. Took to autozone and they tested the battery again and said it was fine so the starter must be starting to go. I don't know that I believe them and am curious what y'all think. Battery or starter?",1,1758761026.0,3,AskMechanics,1758915136,2025-09-25 00:43:46,2025-09-26 19:32:16,"RichardSober (Score: 1): >Battery or starter?

Correction: battery, alternator, serpentine belt, bad PCM, voltage drop, parasitic draw or normal discharge in between very short trips?"
1npszy5,Is My Engine Knocking?,"Just bought a 2013 Mercedes G63 AMG with 50k miles with the M157 engine. Noticing this noise when idling. Super paranoid the car is piped. Can any Merc experts either calm my nerves or spike my anxiety?

",0,1758760978.0,3,AskMechanics,1758915136,2025-09-25 00:42:58,2025-09-26 19:32:16,"taro_tanaka7 (Score: 1): bro you dont' need an expert to tell you that nothings wrong. I really don't get people like this take it to the dealer and explain your concerns bro. its literally just idling with no ticking. Have you done research and look up what  a knocking engine sounds like? NO OBVIOUSLY, because you wouldn't have made this video

taro_tanaka7 (Score: 1): people are so quick to ask instead of doing some actual research and learning something."
1npsv4n,Trying to make the power recliner work outside of the car from a vw golf 2019. Wiring problem.,"https://preview.redd.it/cbvxgi55i7rf1.png?width=1080&format=png&auto=webp&s=719229f1d678474e0909a294898b53856ed08ffb

https://preview.redd.it/sjegslm5i7rf1.png?width=1080&format=png&auto=webp&s=fe9c4bffb94d4d3c4f6f33e8d2f37f8a079a62e8

https://preview.redd.it/p19sj126i7rf1.png?width=1080&format=png&auto=webp&s=a7d5fdf0bc8050985658b28a0fa68f0a4a1e3cdc

I got my 12v motorcycle battery ready I believe the thick brown is the ground and I hook that up to negative. And I try hooking the rest with positive. It doesn’t work. Why is that? Which color should I go for?",1,1758760588.0,6,AskMechanics,1758915136,2025-09-25 00:36:28,2025-09-26 19:32:16,"Deeponeperfectmornin (Score: 1): You're correct in thinking the thick brown is negative

Thick red/black trace is positive

Am guessing that the switch is fitted in the seat and connected

Am guessing that motor is connected to the switch"
1npsp5c,Where is this carpart from.,Hi I’m just posting to see if anyone had any idea where this came from reversed my car this morning found this on the ground wondering where it’s from as I’m lost.I have a Mazda axela 2006 ,1,1758760111.0,2,AskMechanics,1758915136,2025-09-25 00:28:31,2025-09-26 19:32:16,tcrispy (Score: 1): Kinda looks like an exhaust flap from a heavy duty truck.
1npsj4r,TPMS Light blinks then stays solid,"The pressure on all tires is good. Google says this means that the battery in one sensor is likely dead. How do I test to figure out which sensor is malfunctioning?

Hyundai Elantra 2011",1,1758759631.0,4,AskMechanics,1758915136,2025-09-25 00:20:31,2025-09-26 19:32:16,lantrick (Score: 1): A good scan tool will tell you. There are also TPMS specific sensor readers that can read the sensor data. You really need a way to read the sensors to troubleshoot.
1npsge0,Any idea what this noise is?,"Cranks won’t start 

2012 GMC Terrain",1,1758759411.0,5,AskMechanics,1758915136,2025-09-25 00:16:51,2025-09-26 19:32:16,"Unique-Worth-4066 (Score: 3): Valves hitting pistons

Busy-Associate3397 (Score: 2): Sounds like no compression to me, maybe your timing chain jumped a few teeth"
1nqjqga,Question about 2012 chevy malibu codes,"Hey all. 
I have a chevy malibu that was rough idling and stalling out.   Did the basics,  a tune up, made sure fuel pump was good,  etc.  Ended up being the mass air flow sensor.  Replaced the sensor,  car is running good now.  Checked the codes,  it's still throwing a code p0113 and p0102.  Google says it's the mass air flow even though it's brand new.

Is there anything else that could be throwing those codes that I'm missing?  As I said, car seems good now but I want to take care of it if it's a problem other than the sensor.  ",2,1758837073.0,4,AutoMechanics,1758915136,2025-09-25 21:51:13,2025-09-26 19:32:16,"Breddit2225 (Score: 2): Did you clear the codes after you put the mass air flow sensor on? The codes will remain in memory until they're cleared or the proper number of restarts after repair.

The IAT code would set if the sensor was unplugged with the key on.

Mechanical_Meerkat (Score: 1): I'm assuming you have the 2.4l engine? That was the most common engine in those that I worked on. Do you have access to a scan tool that can read the data from the induction system? That would help a lot in diagnosing the concern. Have you checked all of your intake system? Any broken rubber pieces or clamps? What does the air filter look like? If possible, can you check the wiring harness for any areas that may have chaffed?"
1nqmmq3,Parking Ticket,"Hi so i got a parking ticket through the post on the 6th and on the letter it says if i pay before the 20th it will be £60 however ive only just been able to pay it off which meant that it should be £100 however when ive gone to pay it only charged me £60.

My question is: will this cause me problems down the line or will it be fine?",0,1758844695.0,1,CartalkUK,1758915136,2025-09-25 23:58:15,2025-09-26 19:32:16,PurpWippleM3 (Score: 2): You could call the parking enforcement company and ask them?
1nqmdan,Catalytic Converter Question?,"Hello all, I've got a 2018 BMW 520i and I've recently had an engine replacement since buying it from a nightmare dealership so no hopes of any form of warranty or replacement on their end.

Due to misfires from the previous engine, I now need to replace 2 lambda sensors and the catalytic converter. I've tried cat cleaners and a bit of an Italian tune up to no avail, I've been quoted by a couple different garages with prices being:

Aftermarket - £700   
OEM - £1300  
Genuine - £2000  
(all quotes including price for labour, VAT, Cat and 2 sensors.

I'd like to know whether or not an aftermarket cat is that much different in terms of efficiency, longevity and performance compared to a genuine one, and whether these prices are reasonable or am I being played for a idiot.

Any help would be appreciated thanks!",1,1758843945.0,4,CartalkUK,1758915136,2025-09-25 23:45:45,2025-09-26 19:32:16,"Substantial_Tea5836 (Score: 2): Damn, you’ve had a rough run with this car. Those quotes are kinda standard for UK garages, unfortunately — BMW parts are just savage on the wallet. On the aftermarket vs OEM/genuine debate: honestly, aftermarket cats *can* get the job done and might pass MOT, but longevity’s always a gamble and sometimes fitment can be dodgy. Performance-wise, unless you’re tracking the 520i, you probably won’t notice much difference. But, yeah, genuine parts usually last longer and won’t throw mystery codes a year later.

Lots of folks go aftermarket and are fine, especially if you get a decent brand, but if budget allows, OEM is a safer bet for hassle-free ownership. The dealer price is just pain. For a daily, £700 for decent aftermarket isn’t wild — just steer clear of the super cheapo options. Maybe ask about warranties before you commit? Fr, with that history, no one would blame you for picking the best value and keeping receipts just in case.

DaughterOfATiredMech (Score: 1): Following as I think I’m having the same issues. Fortunately for me it’s under warranty and the dealership are replacing the CAT. 

I’ve heard not so many good things about aftermarket and codes often come back. I’d stick with either oem or genuine if you don’t wanna do the job twice. 

Prices don’t seem to bad i was quoted around similar without the o2 sensors but I’m in London."
1nqm6ey,how dumb is buying this car,,0,1758843412.0,13,CartalkUK,1758915136,2025-09-25 23:36:52,2025-09-26 19:32:16,"FabianTIR (Score: 6): If it's been looked after, probably not that dumb. I'm not Audi expert so there might be specific issues with this car/engine that could make it extremely dumb.

Anecdotally though, I bought a 2006 Z4 coupe for 5k last year. It had 158k miles on the clock. On paper, that's probably dumber than this TT and thus far it has been pretty much fine. Only actual broken thing was the coolant tank and that only cost me £50 to replace

WideLibrarian6832 (Score: 3): Nice car, I bought one for my daughter when she got her license. She loved it.

SharpGlitter164 (Score: 2): I'd be wary of an early 2.0 TFSI, from memory they had pretty widespread oil consumption issues."
1nqlqtj,What car to get?,"I am currently saving to buy my next car.

Let’s say my budget is around £6k-£8k but it’s quite flexible and obviously, ideally, I’d rather not spend a whole lot.

I need this car to last for a few years to come, but I also quite like driving-driving (motorsport fan).

Saloon/hatch (no SUVs please lord)

The cars I’m looking at are:
- honda 9/10th gen civic
- merc C Class w204
- Toyota celica (funny although impractical)
- Ford Fiesta (variants)
- BMW 3 Series
- Hyundai I30

I welcome any alternate suggestions.

Thanks for any replies in advance.

",0,1758842235.0,6,CartalkUK,1758915136,2025-09-25 23:17:15,2025-09-26 19:32:16,"hassan254 (Score: 2): I had a bmw 320d for 5yrs, honestly apart from the servicing and little jobs, the car did its job. I know people shit on bmws but I had no issues with mine

dylan105069 (Score: 2): The W204 is great, if you’re looking for diesel you should avoid the BMW unless it’s a 3.0L. The 2.0L diesel BMW N47 engines (2007-2014) are unreliable. If you’re going for the W204 C-Class the C250 CDI is probably the best choice, a lot more torque than the C220 CDI, same displacement, same efficiency.

PrinceRicard (Score: 1): \^ if you like driving, prepare to love it."
1nql9fv,Hello-Looking for a used automotic hybrid car. Is Toyota yaris good or are these options better?,First time driver!,0,1758840954.0,2,CartalkUK,1758915136,2025-09-25 22:55:54,2025-09-26 19:32:16,"FlatsInDagenham (Score: 1): Automatic* 

They're all plain and soulless cars"
1nql0i3,Ran when parked i know what i have 🤣,,1,1758840307.0,3,CartalkUK,1758915136,2025-09-25 22:45:07,2025-09-26 19:32:16,"no73 (Score: 2): Looks AI. 

TheJimsterR (Score: 1): Some light surface rust only.

jackgrafik (Score: 1): I think it was an early 70s Toyota Corolla"
1nqks20,What age do you get bored of fast/sporty cars?,"I’m 30 and been driving since I was 17, I’ve been fortunate enough to own some fast or pokey cars, I’ve owned a total of 19 cars (some stopgap cars) nothing supercar territory but all sorts ranging from torquey diesels, Starlet Glanza, Evo, Impreza WRX’s, M3’s which have been fun to own and I’ve been satisfied. 

But I find myself now really into older 4x4s, mainly Japanese stuff such as Land Cruisers, Hilux Surf etc. I dont know if its just because of my age, or because I’ve owned most cars I’ve wanted to as not many cars feel fast to me any more, I just dont get that thrill. Maybe this is me just wanting to extend my enthusiasm for cars into another type of car which is also more fitting for my lifestyle.

My friends are only now starting to buy sportier/nice cars and are baffled when I tell them I want a 1997 Hilux surf next 😆

Have any of you ever just grown out of the sports car phase or do you come back to it at some point.



",54,1758839699.0,256,CartalkUK,1758915136,2025-09-25 22:34:59,2025-09-26 19:32:16,"ThePurplePenetator (Score: 84): 63 years old and I still love absolutely every type of car. I have a real appreciation for the very good cars that get a bad rap because of the owner base…

BookishBabeee (Score: 75): At some point comfort, practicality and character feel more rewarding than chasing 0-60 times.

FabianTIR (Score: 21): Well I'm only 29 and only got my first sporty car a year ago, but I can't see myself getting bored of such cars for a looooong time. I've got a mate who's into his 60s and still thrashing a boxster on the weekend so I suspect that will be me in about 30 years lol"
1nqk1dr,Best way to finance a car?,"I've always bought my cars outright but they've never really exceeded £15k and I've always been told it's better to buy than use finance.

But I'm looking to get a car that's around £30k, and whilst I have the money I'm not hugely comfortable about spending that outright on a car and would rather keep some money in the bank.

What would be the best way to finance this car? I'd be getting it from the second hand market so I assume lease, PCP, etc. are not available to me (and to be honest, I'm not sure what they are!).

So I just wondered what other options I had available to me? ",0,1758837819.0,6,CartalkUK,1758915136,2025-09-25 22:03:39,2025-09-26 19:32:16,"Famous_Tie8714 (Score: 9): PCP may still be available if it's on an approved used scheme at one of the main dealers.  Otherwise it's either a loan through the dealer or privately from your bank.  Either way you will pay interest and it will cost you more overall than just buying the car.

Have you considered just buying it outright, but also setting up a standing order to take pretend ""car payments"" from your bank each month and put the money back into savings.  If you can trick yourself into believing this is paying off the car you will build a buffer back up pretty quick and won't accidentally spend it on other things, while not having to pay any interest on a loan.

underrated_tool (Score: 2): PCP is available on a used car. Not something I'd do personally, but it is available.

im-pickle-riiiiiick (Score: 2): Pcp will have extortionate rates unless brand new, eg 8.9% - 20%.

If dealer accepts credit card, then a 0% purchase card is the cheapest way.
Next cheapest is a money transfer card, usually 0% for 12 months but with a 4-5% fee, then balance transfer to a 0% card at the end of 12 months"
1nqjjka,Just got my 1st car!!! what's the best way to check number of owners?,,107,1758836603.0,102,CartalkUK,1758915136,2025-09-25 21:43:23,2025-09-26 19:32:16,"M0nkeyTenni5 (Score: 118): The V5 will tell you when you get it.

Darthblaker7474 (Score: 106): Have a sniff of the drivers seat, that'll tell you.

PaulaDeen21 (Score: 48): Now this is a first car done right. 

Bloody love a K11. Enjoy!"
