id,title,selftext,score,created_utc,num_comments,subreddit,scraping_time_utc,created_datetime_utc,scraping_datetime_utc,top_comments
1og63zg,Changed the starter and now it makes this noise. Civic 2008.,"Changed the starter on this civic and got it to start a couple of days ago. Didn't take the car out since and now it doesn't start and makes this noise in the video. We're lost here, can someone offer some help? ",2,1761435735.0,3,MechanicAdvice,1761507151,2025-10-25 23:42:15,2025-10-26 19:32:31,"htraygo (Score: 2): Def not a starter issue, the car is cranking over just fine. Sounds like it’s trying to start but not kicking over. Check your fuel source at the fuel rail and your spark plugs to make sure they aren’t completely fouled out.

LittleFoot-LongNeck (Score: 2): It’s just trying to Fire.  Sounds like it has compression.  Check fuel/spark/air."
1og5sqc,What could that noise be?,For contacts I have a 2012 Ford mustang with a 3.7 L It is a base model and I've recently noticed a ticking sound or a knocking sound  coming from my engine My guess would be that it is related to piston slap but I'm not sure what the exact cause of that could be until I open the engine up. What's your guess?,1,1761434850.0,2,MechanicAdvice,1761507151,2025-10-25 23:27:30,2025-10-26 19:32:31,"Elegant-Impression38 (Score: 1): Drunk guess: cam phasers 

Change oil at 3000 interval for 3 oil changes"
1og5oy4,Honda dealer wants $8.6k for a transmission leak on my Civic — am I getting ripped off?,"
Hey everyone,

Got a 2013 Honda Civic with about 139k miles. Took it to the Honda dealer for a leak and the tech confirmed it’s coming from the transmission case. They pulled the shifter linkage cover and said no leak there, but found a bad fluid leak from the intermediate transmission case gasket.

Dealer says I need:
	•	Reman transmission (code BY001) – around $6,205
	•	Rear main seal (EN19) – around $2,445
Total quote: about $8,600 😬

They’re basically saying it’s bad enough that it’s not worth just resealing.
Car drives fine otherwise, shifts smooth, no codes.

Before I drop that kind of money —
	•	Is replacing the whole transmission actually necessary?
	•	Can a trans shop just reseal it cheaper?
	•	Are these prices normal for dealer work?
	•	Or am I better off selling it / driving it until it gets worse and topping off fluid for now?

Appreciate any advice or real-world experience with this kind of leak.
",578,1761434546.0,290,MechanicAdvice,1761507151,2025-10-25 23:22:26,2025-10-26 19:32:31,"Mrcarter1995 (Score: 685): Keep an eye on the fluid, keep it topped off and you could go many more miles with no money spent besides some fluid.

kittynation69 (Score: 245): Instead of fixing the leak they recommended replacing the entire transmission? 🤣🤣"
1og5msc,Rear main seal scratch on crank,"I had scratched the crank while taking out rear main, had polished out, feels smooth but want a second opinion",1,1761434376.0,7,MechanicAdvice,1761507151,2025-10-25 23:19:36,2025-10-26 19:32:31,Entire-Potato-724 (Score: 1): You're done dude. You need a new car.
1og5kee,Help,,1,1761434190.0,2,MechanicAdvice,1761507151,2025-10-25 23:16:30,2025-10-26 19:32:31,Entire-Potato-724 (Score: 1): Well that goes exactly to the same place that you removed it from. Hope that helps.
1og5ie1,Clean enough?,Been struggling to get all the gasket off and finally feel like this might be good enough. Just want a second opinion before continuing?,2,1761434032.0,6,MechanicAdvice,1761507151,2025-10-25 23:13:52,2025-10-26 19:32:31,"Omegalodong (Score: 2): Move your finger and Nail across the surface. If its smooth, and you can only feel the metal finish then its good

woohooguy (Score: 1): [Scotch-Brite Heavy Duty Scour Pads, 6 Sponges Total - Walmart.com](https://www.walmart.com/ip/Scotch-Brite-Heavy-Duty-Scour-Pads-6pk/16564933)

You scratched up the mating surface pretty good in some areas but the surface isn't clean. Hopefully the scratches wont cause leaks.

Go at the mating surface with the course green scotch-brite pad and carb cleaner with your fingers and HARD pressure. It'll clean up much better than what you have now.

You can use a whizzy wheel but probably dont have the tools or the technique to not damage anything, and the oil film on the entire engine screams low budget.

If you are using grey silicone RTV alone to button that pump down make sure to let it cure. If you are using a paper gasket butter it up with  alight coat of grey RTV. If using a metal gasket dont use anything but the gasket."
1og5b3q,Timing chain stretch symptom?,My 2011 VW 2.0 TSI sometimes has a sudden moment of power loss under full throttle and then continues fine. Idle seems to be a bit rough and it has thrown codes for low fuel rail pressure. I’ve changed most of the high and low fuel system over the last 2 years so all parts are relatively new. Could it be timing chain related? This engine is known for having tensioner issues. Wouldn’t I get timing related codes? The high pressure fuel pump is run off the engine timing so it could make sense? Any thoughts before I spend £2k on a timing chain.,1,1761433452.0,4,MechanicAdvice,1761507151,2025-10-25 23:04:12,2025-10-26 19:32:31,"Infinite-Jury-4167 (Score: 2): It’s best to get this diagnosed properly from an independent specialist you trust. They can take a look at the chain tensioner to see how far out it is (notches) as well as see the how many degrees out via scan tools to rule out or diagnose a chain/timing issue.

This is the best video on it all here:  https://youtu.be/L5EvMjoeMvU?si=K2YcuAKr-2IL3dAC

On my previous 2011 MK6 GTI the chain, tensioner, guides etc cost me £1300 so £2k seems way too much! 

If you have replaced fuelling parts and didn’t use originals to save money they won’t last as long (if it were to be any of those items and not the chain)

Other things could be leaky injectors, carbon buildup, air leaks, PCV failure, intake flaps, rear main seal leak - there is just too many things to guess.

Any good specialist near you? (They shouldn’t be the type that just throws parts at the car at your expense) If so bite the bullet for a proper deep diagnoses including chain inspection.

My 2 cents hope it helps, hate seeing a fellow EA888er down and wish you good luck in getting it  running as it should again."
1og54si,Will my car pass emissions?,,0,1761432969.0,6,MechanicAdvice,1761507151,2025-10-25 22:56:09,2025-10-26 19:32:31,"Vic_Pirelli (Score: 9): It will fail.  A MIL for any reason is an automatic fail.

redwingcut (Score: 3): Bro thank god I don’t have to deal with that bull shit where I am!"
1og4xku,Poured oil in my transmission...,"Like the title says I was doing a transmission fluid drain and fill and had completed it. Then went to check the dipstick and decided it needed a little more and reached for the same red bottle that my transmission fluid was in but it turned out. The last few bits were actually engine oil. So it's now about 95% transmission fluid and 5% engine oil...

Does anyone have experience with this or know what I need to do? I love my 2010 Honda Accord and want it to survive well past when I die... Thanks ",2,1761432405.0,9,MechanicAdvice,1761507151,2025-10-25 22:46:45,2025-10-26 19:32:31,"Background-Pear-7494 (Score: 7): Have you started it yet?

Another drain and fill will clear it out if it’s still in the sump. 

Will it harm anything? Don’t know. 
Worth the risk over $40 in ATF? Not to me.

cormack_gv (Score: 2): Automatic?  If it shifts OK I wouldn't worry about it."
1og4sdh,Camshaft sensor or timing chain?,"So I failed emissions and the mechanic running the emissions testing said I needed a new cam shaft sensor and I'd be good to go. 

I had AutoZone run the codes too when I went to get the part and their print out said that I needed to replace the timing chain, guide, and sensor, but theirs also said I needed to get a new oil filter and change my oil, when it's still pretty new and my oil life is at 80%. I'm having a hard time believing their readout when it feels like I'm being told to replace fresh oil, and I can barely afford the sensor alone.

Can anyone provide insight on the best way to move forward here? Is the AutoZone reading weird or does the emissions one just see the first code and stop?

Edit: okay, so how doable would diagnosing and replacing be myself? What sign should I be looking for to check the chain and the sensor for damage?",1,1761432024.0,4,MechanicAdvice,1761507151,2025-10-25 22:40:24,2025-10-26 19:32:31,"fozrockit (Score: 1): You need to have the vehicle diagnosed by a mechanic. Neither of the people you spoke with were qualified to give you advice. The fix finder site/program is just a tool auto parts stores use to sell you parts.

moomooicow (Score: 1): You shouldn’t believe any of that because no one actually assessed the problem for what is needed to fix."
1og4re0,Help with this noise (g35x sedan 2007 160k km),,1,1761431945.0,2,MechanicAdvice,1761507151,2025-10-25 22:39:05,2025-10-26 19:32:31,arisbedros222 (Score: 1): Noise only happens when its idling
1og4pil,Issues with my VW Beetle / Fuses,"Hi all,

First time here, not well versed in car maintenance, but in this economy I’m trying to be.

Couple of issues with my 2009 VW Convertible Beetle that I’m trying to figure out. Most seem electrical and I’ve been told I might have a power drain after a battery went out only a year in.

Here’s the list and what I’ve been up to:

Main issues are that the driver window won’t roll and button seems dead - power locking seems slow too. Hatchback won’t open or respond and button seems dead. Trunk won’t open with internal switch or on the fob. 

I understand the trunk especially might be a whole different issue, but today I was focused on the window and hatchback. Everything pointed to checking the fuses first but as soon as I did I was more confused.

I’ve attached the images from my car, including the car and my fuse box. I was looking at 30 and 38 as possible culprits when I realized - the fuses seem to be all f-cked? All of these issues are recent and I’ve never touched the fuse box, so I haven’t changed anything. 

Using the online source linked below and my manual, it seems that some things are lining up. Any insights? Could this be the power drain issue? 

Thanks all 

https://fuse-box.info/volkswagen/volkswagen-new-beetle-1998-2011-fuses-and-relay/amp

",1,1761431799.0,5,MechanicAdvice,1761507151,2025-10-25 22:36:39,2025-10-26 19:32:31,"NervousAd596 (Score: 2): They also had trunk wiring harness issues, lol. Same cause. Just brittle wiring after a few years.

AmputatorBot (Score: 1): It looks like OP posted an AMP link. These should load faster, but AMP is controversial because of [concerns over privacy and the Open Web](https://www.reddit.com/r/AmputatorBot/comments/ehrq3z/why_did_i_build_amputatorbot).

Maybe check out **the canonical page** instead: **[https://fuse-box.info/volkswagen/volkswagen-new-beetle-1998-2011-fuses-and-relay](https://fuse-box.info/volkswagen/volkswagen-new-beetle-1998-2011-fuses-and-relay)**

*****

 ^(I'm a bot | )[^(Why & About)](https://www.reddit.com/r/AmputatorBot/comments/ehrq3z/why_did_i_build_amputatorbot)^( | )[^(Summon: u/AmputatorBot)](https://www.reddit.com/r/AmputatorBot/comments/cchly3/you_can_now_summon_amputatorbot/)"
1og4nng,What motor mount is this?,Im trying to identify what part this is so I can replace it myself. All I have to work off of is motor mount-front.,0,1761431656.0,16,MechanicAdvice,1761507151,2025-10-25 22:34:16,2025-10-26 19:32:31,"ButterscotchWitty870 (Score: 3): That’s been replaced before.  That’s a poly bushing someone has put in there, definitely not OEM. 

They typically don’t go bad often, but they are much, much stiffer

DarthJigTheThicc (Score: 1): Make and model is a 2012 Kia Rio"
1og4jtp,My mom’s car keeps having bad buildup on the battery terminals.,"She’s been having building for about two months now. I replaced her battery about a month and a half ago and cleaned the crap out of the connectors. Yesterday she had a couple lights pop up on her dash and then her car wouldn’t start, after she cleaned the terminals a little it’s working fine with no lights. She just sent me this picture and the color looks weird. Anyways I am looking for advice on how to properly clean this to keep it from happening and also why the color looks like that and it continues to come back. Thank you. ",52,1761431359.0,34,MechanicAdvice,1761507151,2025-10-25 22:29:19,2025-10-26 19:32:31,"corvoswsattano (Score: 65): She needs to have that battery warrantied it appears to be leaking from the terminals

classicvincent (Score: 29): Make sure the alternator isn’t overcharging, a failed voltage regulator that’s overcharging the battery will cook the juice out and greatly accelerate corrosion on the terminals and on the car itself. Check charging voltage at idle and have someone hold the throttle at about 2000 rpm and see what the voltage rises to. If you’re getting over 14.8v at higher rpms you found your problem."
1og4icf,Engine coolant leak 2020 Subaru outback,"We went to two different car mechanics (including the Subaru dealership) but couldn't find anything wrong with it. Should I worry about it, I have to fill it once per month. ",1,1761431240.0,6,MechanicAdvice,1761507151,2025-10-25 22:27:20,2025-10-26 19:32:31,"bingbong1976 (Score: 1): Is coolant hitting ground?

Sleepy_red_lab (Score: 1): That is a lot of coolant to be losing. I would be worried. There is a seal somewhere that has most likely gone internal if you are not seeing or smelling anything around the engine bay. Do you smell a sweet smell from the exhaust at start up or after driving? Did they do a cooling system pressure test?"
1og4gti,"So my friend's 2.4l 2011 Nissan Altima has bad strut mounts, I can get him some from rock Auto for $20 a piece and have a guy replace the old ones for $160, or I can get him some quick struts for $80 a piece and do it as a favor cause it's easy. What would be better?",Also which stut mounts or quick struts should I get?  Thanks.  ,15,1761431118.0,34,MechanicAdvice,1761507151,2025-10-25 22:25:18,2025-10-26 19:32:31,"wiishopmusic (Score: 32): Quick struts are so much easier. You can still do the mounts if you have the right compressor tools but it’s not worth the hassle imo.

L0quence (Score: 13): Just buy the whole new strut assembly w springs and all and replace them. You’ll be pulling them out anyways to do the mounts"
1og4a0f,What is this and should smoke escape the two holes during a smoke test?,,2,1761430597.0,5,MechanicAdvice,1761507151,2025-10-25 22:16:37,2025-10-26 19:32:31,"dmcanall59 (Score: 5): Evap charcoal canister, it supposed to store fuel vapors.

Ericsanborn1992 (Score: 5): Looks like an evap vent valve"
1og3xq3,"HELP 1993 MR2 Base, No compression","So I’m working on this 2.2L 1993 MR2 base, the car was running fine until one day it wasn’t.
Then some mechanics took it all apart, and I had to put it all back together.
Exhaust manifold, snapped bolts. Distributor.

Anyways I got it to start with a new coolant temperature sensor. It was running rough but  I was like okay that’s good. At least it’s running.

So I put the exhaust stuff back on, start it, it runs rough, then I try to put it in drive, and it stalls out and it won’t start again..

I had spark, I had fuel, air, but no start, just cranks over.

All cylinders have zero compression, I did a leak down test on all of them.. none of them hold pressure and I can’t locate where the leak is.. any hints?

Would a blown head gasket cause them all to hold ZERO, and I mean absolutely ZERO pressure?

I don’t think it’s the valves they wouldn’t all fail at the same time?
And a blown head gasket.. to take out all 4 cylinders would be strange.. any help?",1,1761429661.0,4,MechanicAdvice,1761507151,2025-10-25 22:01:01,2025-10-26 19:32:31,"ShoemakerMicah (Score: 1): That’s catastrophic damage. I’d start my removing the cylinder head. It should be obvious from there. It’s definitely not just a head gasket.

RudbeckiaIS (Score: 1): It's out of timing. Badly out of timing I may add. 

Redo engine timing and test copmpression again: if I remember correctly these 5S-FE engine are no-interference meaning they will survive even a broken timing belt. Not as indestructible as their smaller 3S-FE siblings due to the balance gear but almost so."
1og3wzw,Replaced front brakes and rotors 2011 RAV4- everything look ok?,Are the pad clips facing the right direction?,1,1761429614.0,8,MechanicAdvice,1761507151,2025-10-25 22:00:14,2025-10-26 19:32:31,"hermes_2 (Score: 2): Looks good to me, as for the clips, I always take them off one at a time and put the new ones on one at a time so that I always ensure they go on right with no mistakes.

No_Range_9748 (Score: 1): How does everything in your wheel well look so clean lol. Your caliper looks new"
1og3ub9,Need Advice for a Seized Brake Drum,04 Dodge Neon that has been sitting for 2 years. The rear brakes seized up. I was able to loosen the left rear by driving the car back and forth and spraying some WD40 inside the drum. The right rear is still seized. I cannot get an acetylene torch to the car. Any other ideas for loosening this stubborn drum?,1,1761429416.0,2,MechanicAdvice,1761507151,2025-10-25 21:56:56,2025-10-26 19:32:31,"Realistic-March-5679 (Score: 1): Just make sure you have the parking brake off first. Next make sure the adjuster wheel is completely retracted. If neither help break the bleeder free and let any pressure free, then pull the drum and once you’re done bleed the brakes."
1og3tg2,What’s causing this leak?,"Just noticed this today, looks like a brownish fluid. Car is a 2017 Volkswagen Tiguan. ",1,1761429351.0,3,MechanicAdvice,1761507151,2025-10-25 21:55:51,2025-10-26 19:32:31,"Cosmic___Charlie (Score: 1): Can you get a better video more up too the boot in the video? Could possibly be an axle seal or blown power steering rack. Cant see anything needed to tell in this video.

Traditional_Ad_1360 (Score: 1): Looks like a transaxle seal, that is where tranny fluid comes from around those parts."
1og3e67,Very Bad Audi A3 MPG ( 18 MPG ),"Back Story to my car.

I have a 2016 Audi A3 Etron (65 Plate)

It has 75,000 miles and when scanning, no fault codes have came up.

I did a full service (spark plugs, oil filter, air filter, oil) and overnight my range dropped from around 270 miles on a full tank of petrol to 130 miles.

This has been going on since since December.

I have taken it to countless garages and none of them can find the problem, i have changed the spark plugs again recently from NGK to Bosch. But still no help.

I have tried different fuel stations, premium fuel etc. No success.

Any idea on what could be done for this?

(Pics are attached)",1,1761428240.0,5,MechanicAdvice,1761507151,2025-10-25 21:37:20,2025-10-26 19:32:31,RealMadLadStalin (Score: 1): Is it idling or feel differently ? To have your mpg cut in half overnight means that your car is running insanely rich
1og3cod,Scanner question,"My 2001 Chevy Silverado got this code. I’m wondering what the $10 generic means on it. 
",2,1761428129.0,4,MechanicAdvice,1761507151,2025-10-25 21:35:29,2025-10-26 19:32:31,"240x6 (Score: 3): it means you have to pay chevy $10… sorry bro.

lol jk, $10 is for mode 10 which is a diagnostic term for reading active codes. generic just means you are using generic OBD which is just basic stuff like reading and erasing codes. (advanced has capability of sending commands like testing actuators, initialization procedures, abs bleeding, etc…)

im-not-a-fakebot (Score: 2): You’d have to look at the manual but typically it refers to the scanner mode. Usually $01 and $10 means generic diagnostic mode"
1og37af,Broken aux jack in port,,1,1761427745.0,3,MechanicAdvice,1761507151,2025-10-25 21:29:05,2025-10-26 19:32:31,"240x6 (Score: 1): use a drill and a bolt extractor to pull it out, get it to twist first though. but it looks like you’ve damaged it enough so maybe just get a new head unit. from the looks of what i can see (no offense), this car doesn’t seem too expensive so i bet a new head unit or even a used one wouldn’t be too pricy.

superminingbros (Score: 1): I feel bad for your girl, you miss waaaay too much!"
1og36wq,This will not reconnect! Any advice?,"I recently tried to replace my old fuel pump however, the fuel hose will not re-attach. The old pump has the same diameter as the new pump. ",2,1761427718.0,12,MechanicAdvice,1761507151,2025-10-25 21:28:38,2025-10-26 19:32:31,"foxjohnc87 (Score: 5): You have the two lines reversed. Swap them and they'll go on just fine.

Desperate-Oven-6182 (Score: 3): It looks like the lines may be switched around"
1og317b,what is this???,"2000 chevy silverado 1500, 5.3 engine. trucks leaking coolant from this. what is it?? i looked up the water pump and this isn’t a part of it. i know it probably sounds stupid but i’m scrambling for help😭 i looked up inlet tube too and nothing matches it. ",2,1761427302.0,3,MechanicAdvice,1761507151,2025-10-25 21:21:42,2025-10-26 19:32:31,"Ravenblack67 (Score: 1): The metal part is called an elbow or coupler.

fuckyounazeem (Score: 1): thank you for the comments but i found it! turns out it’s my water pump lol but i appreciate your insight!"
1og2ycm,Battery or starter,Total novice here.  My 2020 Subaru forester won't start. I tried to jump the battery but that isn't solving it. Does it sound like I need a new battery or a new starter?,4,1761427101.0,8,MechanicAdvice,1761507151,2025-10-25 21:18:21,2025-10-26 19:32:31,"Alpinab9 (Score: 7): That does not look like a good spot for the ground on the jumper cable.

spamcritic (Score: 4): Just use the battery terminals for boosting, and go right on the posts."
1og2sx7,Is my clutch broken,"My car stopped working on the road the other day, and I haven’t gotten it to start since. The clutch broke a little bit ago, don’t know if the mech installed it wrong? Or was thinking it could be the ignition switch since I’ve had problems with turning the keys as well. Hopping for advice before I tow it back to mechanic :) thanks.",2,1761426717.0,8,MechanicAdvice,1761507151,2025-10-25 21:11:57,2025-10-26 19:32:31,"truthsmiles (Score: 3): Maybe the clutch pedal switch needs adjusted?

Smokin77 (Score: 2): First thing I see is the 20 lbs of playing cards on the key. Would start with clutch switch, I'd lighten up your ring dude.could be your ig switch"
1og2od3,How urgent is this? Quote attached,"Took my recently bought used 2008 Honda Jazz (1st Gen Manual with 238,000km on it) for 4k aud. Had a rattling sound that mechanic said was brakes and a leak that needed the oil sump rethreaded. They also said there was a crack in the control arm/bushings? and that this needed to be replaced. How urgent is this? ",3,1761426393.0,4,MechanicAdvice,1761507151,2025-10-25 21:06:33,2025-10-26 19:32:31,"RickMN (Score: 3): When the rubber starts to tear away from the outer collar or the inner spindle, it's time to plan for replacement. That's what's happening in your first few pics. See [this article](https://ricksfreeautorepairadvice.com/cracked-control-arm-bushings-how-urgent-is-the-fix/) and scroll to the pics of good versus bad bushings"
1og2mal,Identifying a part,"This is on my 2014 mustang, it was pretty rotted away and broke right off when I was messing with it. It’s behind my rear wheel on both sides. ",1,1761426246.0,2,MechanicAdvice,1761507151,2025-10-25 21:04:06,2025-10-26 19:32:31,ClosedL00p (Score: 2): Bump stop
1og2fuy,2014 Jetta wagon still pulls to the right after an alignment,"Local NTB shop told me they tried to get the steering wheel back to sitting as straight as possible. And that they also couldn't find any way to adjust the camber?
This sheet they gave me makes it look like they actually made the adjustments worse than it started.
I still have to hold the wheel to the side the same amount to continue straight.
Is this right? 
Do I just go back and have a different tech do it since they offered a 3 month warranty?",0,1761425803.0,4,MechanicAdvice,1761507151,2025-10-25 20:56:43,2025-10-26 19:32:31,"thelvmechanicII (Score: 5): Yea... I wouldn't have let that leave my shop. Take it back and ask why it wasn't test driven and done correctly. Look at the steer ahead, both toe angles are to the right. Someone wasn't doing their job that day.
Some vehicles, do not come with a way from to adjust camber from Factory. Camber bolts or adjustable arms are available aftermarket.

Alpinab9 (Score: 3): The description is ""pulls"" and that is completely different than the steering wheel not being level while driving straight. All of the numbers look acceptable, with the exception of steer ahead. The total toe of 16 is good. They are supposed to use a level tool to get the wheel level and then a lock tool to keep the steering wheel in place, then adjust the front toe to get the steer ahead centerd at 0. This is alignment 101 and a very easy correction. A road test after to verify the wheel is level while driving straight on a flat road... if good, it is done and ready for the customer. Note: I think no adjustments were done in the rear and if you paid for a 4 way alignment, they did not do their job."
