id,title,selftext,score,created_utc,num_comments,subreddit,scraping_time_utc,created_datetime_utc,scraping_datetime_utc,top_comments
1or9zwh,New piston oil control rings protrude more than old,"Background:

I’ve got an Audi A3 1.6 (2001) and just bought new piston rings. I ordered them based on the VIN (part number 06B198151A), and went with MAHLE 030 77 N0, which should be compatible. The old oil control ring was a 3-piece design, but the new one is a 2-piece, which I know is a more modern design, so I don’t think that’s the issue.

Question:

The thing is, the new oil rings is noticeably bigger and stick out more from the piston. Is that normal (just a newer design), or is it a problem? 
Important: In the pics, I pushed the oil ring to one side as much as possible to show the difference clearly, making the difference looks a bit extreme. ",1,1762558597.0,2,AskMechanics,1762630414,2025-11-07 23:36:37,2025-11-08 19:33:34,"Nada_Chance (Score: 1): One the old oil ring is worn, and likely has less tension than new, and as long as the new oil rings are free/not binding, I wouldn't give it another thought.

Minute_Inside4219 (Score: 1): I mean dose it compress enough to go in your cylinder if you ordered parts based on vin 100% should be fine compare with another site sure but if it fits it ships ok I shouldn’t say that but still just double check with another place new rings will always seem bigger than old just make sure they sent correct parts and you didn’t order wrong if both check out i would install it"
1or9wg4,Does anyone know how to take this off?,,2,1762558342.0,12,AskMechanics,1762630414,2025-11-07 23:32:22,2025-11-08 19:33:34,"Traditional-Fox4196 (Score: 5): WD40

Exotic_Pause7686 (Score: 4): Goo gone for sure"
1or9sto,Washing Concrete,"Any tips on getting fluids (oil, trans, coolant. Etc) out of concrete? Special remedies? We try to keep the absorption sand close by but it’s not always quick enough, thanks in advance ",1,1762558082.0,2,AskMechanics,1762630414,2025-11-07 23:28:02,2025-11-08 19:33:34,glenclitman (Score: 1): Muriatic acid
1or9gku,2013 Mazda3,"Hey all, I recently purchased a new (to me) mazda, and I've been having some doubts about it lately. I'm just not sure if I am just being paranoid because its a different engine than my last car, or if there is something genuinely wrong with it. If anyone could give me some advice I would greatly appreciate it!

Sorry for moving the phone around so much, I wanted to pass the mic over the whole engine area.",1,1762557230.0,2,AskMechanics,1762630414,2025-11-07 23:13:50,2025-11-08 19:33:34,"jackstinky (Score: 1): 2013 Mazda3 iTouring with 99000 miles, if that helps."
1or9ffs,I just had my windshield replaced and 24 hours later I get this strange noise when I turn left. About 6 seconds into the video.,"I took everything out of my car and checked every nook and cranny. This is not a loose object in the cabin or trunk space. Did they leave a clip or tool somewhere I can't see? Or, any other idea? 

Here's another video with some visual for reference of where in the turn it happens. 

https://imgur.com/a/34C7i4U",0,1762557151.0,4,AskMechanics,1762630414,2025-11-07 23:12:31,2025-11-08 19:33:34,"Brewer1056 (Score: 1): Forgot to mention': 2013 Honda Pilot LX, V6, 105k miles.

Early-Energy-962 (Score: 1): You may need to calibrate the gps antennae with new windshield setting."
1or8s7i,Is this oil residue and engine noise something to be concerned about?,"Hey guys so I have a 2010 Suzuki Swift EZ (not sport model) which has the 1.5L M15A engine. Recently when I’ve been driving somewhat hard (nothing too crazy just when I decide to go above 3.5k ish) when the car stops I smell what I think is oil and there is obviously oil residue on the block (as you can see in the video), also there is a very faint white smoke that you can only really see if you put a flashlight up to it. Is this something I should be worried about? I have never seen oil puddles on the ground from my car and my oil levels are not decreasing on the dipstick at a noticeable rate. Also, is this engine noise fine or is there something wrong I swear after driving a bit hard it sounds a bit different like in the video. Any advice is much appreciated, thank you for your time ",4,1762555564.0,2,AskMechanics,1762630414,2025-11-07 22:46:04,2025-11-08 19:33:34,"billydakidd420 (Score: 2): Im no expert when it comes to oil leaks. However, judging from your video it appears you have a valve cover gasket leak. Oil is seeping out slowly. 

The rough idle/engine noise issue could also be due to the valve cover. The spark plugs have seals as well to prevent oil from leaking down into the spark plug wells. If oil is leaking into your spark plug wells, your going to end up with misfires which could explain the engine noise. 

Not saying that will fix your problem 100%, but you definitely need a new valve cover gasket and spark plug tube seals. May solve your issue tho."
1or8ibx,I Do Not Understand This Noise!,"So there is this ""TUG"" noise when you move slowly (1st video) which doesnt sound like that when youre driving at normal speeds, it just sounds like a patch of contact with the brakes.

I suppose you already suspect things like the disk not being straight and you can see the state of the brakes.

But what i dont underatnd is what does that have to do with suspension?

The reasin i ask is because the noise completely disappears when you accelerate or slow down (with brakes or engine brake, noise disappears either way). The noise is there when the balance is neutral, basicaly. It's the reason why i cant reproduce the noise if i lift the car. Taking away weight (accelerate) or adding it (slow down) makes the noise go away.

But there is this high pitched nosie that seems localized (so like the tug) and that seems to be coming from the brake but i dont unserstand why that would make the nosie disappear.

Can anyone explain how a noise that seems to be coming from contact between a moving component and a fixed one would disappear if the suspension moves?

I also noticed a tiny bit of loose when i turn the axel from side to side, is that normal? 

",1,1762554882.0,6,AskMechanics,1762630414,2025-11-07 22:34:42,2025-11-08 19:33:34,"KazAraiya (Score: 1): Sepcification, it's possible that play i feel when i turn the opposite side is because of an old bearing. What yiu see in thevideo is the righr side, i had the left side replaced recently because it was noisy, but the right side isnt noisy at all, aside if course frim the noise which totaly disappears when even slightly accelerating or slowing down (it takes more slowing down to hearthe sound face but only takes a tiny bit if acceleration for it to disappear).


Please help with this, i need to have some idea of what it is before going back to the mechanics or at least know that my wheel isnt about to come off.

ManQu69 (Score: 1): First part sounds like a part collapsed bearing, perhaps a wheel bearing, the second sounds like a bit of flaky rust on the disc. Further investigation might be required as the second noise might be caused by the first"
1or8i51,I need to know how difficult doing a timing chain on a 2013 Dodge Avenger would be at home,"Title says it oh. I'm a mechanic I've done timing before on several different other vehicles but I've always done it at work on a lift. I have a 2013 Dodge Avenger with a 2.4 l engine. I'm running on 237,944 Miles and I feel like a timing chain would probably be a good idea to replace currently there are no noises I don't feel it needs it yet but it probably needs it because I believe it's the original. I have a cherry picker I have jack stands I've got good floor jack and most importantly I do have experience just not with this particular vehicle. How hard is this going to be to do at home? I do have a garage as well. I just do not have a car lift obviously. Do you think this is a weekend job? Or should I take a few days off work just in case? I do have a four year old so this is going to be an on and off job not just get it done kind of thing.

And before anybody says anything about it yes the car runs amazing still there's nothing else wrong with it I've already replaced everything that needed to be fixed on it and to me it's definitely worth the time effort and cost to do it at home at least. I do love my car so I just want to keep it running as good as it is currently if not better.",1,1762554869.0,8,AskMechanics,1762630414,2025-11-07 22:34:29,2025-11-08 19:33:34,Trogasarus (Score: 1): [charm.li](http://charm.li) has the procedure
1or8hyk,Can I still drive truck with no freon with new compressor?,My truck has a locked up ac compressor i want to replace it with a new one and than wait til next year to put freon in it. Will it mess anything up with the pulley turning with no freon? Its a 1997 f150. Thanks for any help.,0,1762554859.0,5,AskMechanics,1762630414,2025-11-07 22:34:19,2025-11-08 19:33:34,"ShortBus_Sheriff (Score: 3): No it shouldn’t run if it has no charge even if you run the defroster. You can always unplug it if your worried

FallNice3836 (Score: 2): Yup unplug the clutch or remove the relay. It will turn on with defrost on some trucks."
1or8fsk,What is this belt supposed to be on?,"99 Toyota Camry - V6 - 260k Miles

I noticed my car was smelling funny. I took a look and saw this belt hanging off. My power steering pump broke over a year ago and I haven't bothered to replace it, is this the belt for the power steering pump? My car is running, so I'm assuming it's not to anything vital to the engine. 

Is this a big deal to run without? I think the belt is rubbing the other belt, making the funny smell",0,1762554717.0,14,AskMechanics,1762630414,2025-11-07 22:31:57,2025-11-08 19:33:34,"Cockatiel-of-France (Score: 2): Bruh

Austrian_empire_ball (Score: 2): It’s extremely vital to your car don’t drive until this belt is properly placed. Google a picture for a diagram of how the belt goes and put it back exactly how the picture says."
1or8019,"Need Help, What is happening to my car","Legit just randomly started smoking, smoke also came out of the right tire side.

Drove it again for a test run and smoke came out later and now engine wont fully turn off

car is a honda acord 2006?

edit: we had to remove the battery becuase the car engine just wouldn't turn off by turning the key",2,1762553662.0,13,AskMechanics,1762630414,2025-11-07 22:14:22,2025-11-08 19:33:34,"Poshtulio (Score: 3): Check your fluid levels, something is either steaming or burning

the_crx (Score: 1): Did it overheat?  Most likely lost well your coolant. Someone has been playing with that car already it seems."
1or7uq1,CV boot issue,"Passenger side inner CV boot on my 2012 Hyundai Santa Fe (V6) needs attention I happen to see this today looking under car. The original clamp actually cut through the boot’s sealing lip, and I’ve got a bit of grease coming out. Looks like the boot will need to be replaced, not just reclamped. What would cost of this repair be? Also have temporary fix. ",1,1762553302.0,2,AskMechanics,1762630414,2025-11-07 22:08:22,2025-11-08 19:33:34,"Kind_Lake_3850 (Score: 1): 290 labor at my shop.

My local parts store could get you one the part for 124.99 

My shop has a 20% markup. Most  local shops put a 40% markup 

Hope that helps :)"
1or7u96,Toyota OEM Automatic Transmission filter vs aftermarket?,"I have a 2004 Automatic Toyota RAV4 with 270000 miles on it, it is my daily commuter. I want to drain and refill the transmission fluid and change the filter as well. I don't know when or if these services were ever done on the car (it has been in the family for almost a decade now and I have only been driving it recently, so not sure if dad ever did it). I was wondering If I should use the OEM parts (filter + Oring + gasket for pan) or aftermarket. The OEM total will be around $120 while the aftermarket total would likely be <$60. What do you think? and how about the ATF fluid?",1,1762553268.0,4,AskMechanics,1762630414,2025-11-07 22:07:48,2025-11-08 19:33:34,"Chumsicle (Score: 1): I believe the ""filter"" on the WS AT is more of a mesh strainer than an actual filter."
1or7nyr,CV Axle Leaking?,"My wife was complaining of her 2019 Honda Odyssey brakes squeaking. She also said she noticed the squeaking sound when she turned her wheel. I took the tire off to investigate the brakes. Brake pads look good at 8mm. I did what looks like a leak from somewhere on the front passenger side. 

I shared it with my friend who was a mechanic in his past. He said it looks like a CV axle leak. Do you all agree? Is there a way to diagnose thats the issue? And if so, is this a DIY issue or something to take into the shop?",1,1762552847.0,2,AskMechanics,1762630414,2025-11-07 22:00:47,2025-11-08 19:33:34,"RickMN (Score: 2): Just example the pleats in the CV boots. If the boots are cracked and the grease has flung out, it's time for new axle shafts. Few shops will reboot a CV joint once it has flung out the grease because there's usually already wear going on in the joint."
1or7k7r,Is this the dealer trying to upsell me or is this a real problem?,"The mechanic is suggesting I need a new radiator, thermostat, water pump, and various hose parts due to evidence of this coolant residue (both blue and yellow)- which they flushed and refilled themselves in July. Before it was never an issue. The car runs fine, temperature is fine, and there no signs of leaking fluid underneath the vehicle.

Car is 2013 Honda CRV with about 70,000 miles. They’re asking for $2400 for this service!",1,1762552604.0,5,AskMechanics,1762630414,2025-11-07 21:56:44,2025-11-08 19:33:34,"Substantial_Drag_884 (Score: 3): Definitely needs a radiator, and that housing. Probably also the metal pipe under the intake (I can see the rust starting in the pic, they are normally worse near the starter). Nothing seems suspicious from the pics and without seeing the rest

Bored_Dad_Bod (Score: 3): Run it till it leaks. But start saving money now. When the radiator goes, it will likely be all at once, not a slow leak."
1or7eh5,"Was I overcharged? Service on 2003 Jeep TJ Wrangler in Vancouver, BC.","I'm based in Vancouver, BC. The vehicle in question is a 2003 Jeep TJ Wrangler, automatic, 163km.

Paid $236 for a mobile come out to check my Jeep, which had been sitting in my garage for over a year. It had previous issues with parasitic draw. I told him this. I just wanted it fixed and serviced and ready to go. He made a bunch of guarantees and told me it would all be done for $1,900.

Fine. I paid $170 to tow it to his shop. Then, costs eventually ballooned to $2,200 for extra parts and repairs he ""forgot"" to include. Then one day, he called out of the blue and said that all 4 tires needed to be replaced for $1700, which was not mentioned at the diagnostic. I declined and took the vehicle back when he was done with it.

Lo and behold, 2 days later, it wouldn't start. He quoted me another $1400 to investigate the parasitic drain. Said automotive electrical work was $250/hour, but he'd cut me a deal for $200/hour and it would take 7 hours. After my partner informed him that it was unacceptable that he took our money to service everything but didn't address the primary issue, he ghosted us.

All in, I'm nearly $3,000 out and I don't have a functioning car.

My question is, I've since spoken to other mechanics and gotten different quotes and am coming to the conclusion that he was far overcharging me for the services rendered as well. Other mechanics are also quoting $160/hour for automotive electrical investigation.

I've screenshotted the original invoice below. Did I get taken for a ride?

https://preview.redd.it/rca2t98vnwzf1.png?width=800&format=png&auto=webp&s=98d76328ce010d2c45369c24706109c989d79d98",0,1762552208.0,11,AskMechanics,1762630414,2025-11-07 21:50:08,2025-11-08 19:33:34,"auto_medics (Score: 2): I don’t see anything on the invoice that would fix a parasitic draw

BassComprehensive199 (Score: 1): Old cars can be money pits. It's hard to say if the mechanic was i ntentially ripping you off or not. He might have found more and more problems as he worked on it. I think he should have done a better diagnostic to start. It is always good to get at least two quotes if you can. Some mechanics do not do good diagnoses."
1or71ur,Pool of oil in spark plug tubes,"I went to change my plugs on my 2010 Mercury Milan Hybrid because it's recommended at 180k, which my car is just south of. I was greeted with spark plugs completely drowned in oil. All four were like this. After taking these photos, I noticed the dried up, sludgy oil around the coils as well. 

I change my oil every 3,000 miles and my oil levels are not currently low. 

What's the most likely culprit causing this, and how serious is it?",1,1762551361.0,10,AskMechanics,1762630414,2025-11-07 21:36:01,2025-11-08 19:33:34,"Astral_Gnome (Score: 1): Piston rings

auto_medics (Score: 1): Oil above the spark plugs could be failed valve cover gaskets/grommets. Oil below spark plugs (in the combustion chamber) would be failed piston rings."
1or71tq,Long term car storage checklist,"I will be gone for ~8 months and I have an old Prius C. I want to prepare my car for long term storage. Is this correct?

* [Jack stands to in case tire becomes flat](https://i.imgur.com/sqbvpNS.png) 
* Cayenne pepper in hood bay to prevent mouse
* Fuel stabilizer
* Parked in garage



Am I missing anything else? Thank you in advance.",1,1762551359.0,2,AskMechanics,1762630414,2025-11-07 21:35:59,2025-11-08 19:33:34,auto_medics (Score: 1): Battery maintainer
1or6rxc,Would you avoid this 100%,"https://preview.redd.it/mduqzoc4kwzf1.png?width=1003&format=png&auto=webp&s=f81cacd6f6a068594f962bedab616ffd9a21a227

2014 GMC Terrian 156 K miles.",1,1762550703.0,2,AskMechanics,1762630414,2025-11-07 21:25:03,2025-11-08 19:33:34,auto_medics (Score: 1): Get a pre purchase inspection. Have that area checked inside and out. Check body seams and underneath.
1or6mw7,Any ideas how to get this bolt out will be appreciated,"Trying to replace my valve cover gasket but the bolt in the tightest spot had been stripped (not terribly but bad enough that i cant get it off). I walked away befote I made it worse, any suggestions will be appreciated. ",1,1762550382.0,4,AskMechanics,1762630414,2025-11-07 21:19:42,2025-11-08 19:33:34,"stinkyprolapse (Score: 2): Could always try a closed ended wrench. Might take a while, but it'll work is my guess

InternationalHermit (Score: 2): They make pass through sockets and ratchets specifically for such cases I believe."
1or6k26,What’s with the musical note?,Noticed this sticker is on a transmission mount. What is the musical note about? Don’t recall seeing this on other parts.,1,1762550194.0,4,AskMechanics,1762630414,2025-11-07 21:16:34,2025-11-08 19:33:34,RubiksCube9x9 (Score: 2): It's used in GM factories for easy part identification/grabbing. At least that's what people said on the last few posts I've seen about this. They also put symbols on packaging for a lot of parts.
1or6891,Brake Booster issues,"Hey there,

Lost brakes in my 94 Honda Prelude, not entirely just very soft pedal and brake action only at the very end of the pedal motion.

Ordered a new brake booster, cause I saw mine had significant leaks from the master cylinder. Ordered a new one of those too. 

eBay seller sent me the wrong part first. Then sent me a brake booster for an accord. So I went to rock auto. 

They sent me a “remanufactured” booster that was rusty and had a broken seal out of the box. Figured I might as well put it on and see what happens.

Engine off brakes work, engine on booster hisses and pedal can be pushed to the floor without any resistance.

My question here is the problem actually the brake booster? I don’t have too much doubt that this booster is also broken, it looks to be in about the same condition as mine before I took it out. 

I checked for other sources of vacuum leak, but it is clearly hissing from right where it goes through the firewall.

Just wondering if there’s some obvious solution I’m missing and this booster is actually fine just rusty. 

Thanks. That video is it hissing. Just hisses when the pedal is depressed. 
",1,1762549413.0,4,AskMechanics,1762630414,2025-11-07 21:03:33,2025-11-08 19:33:34,"flappy-boi (Score: 1): I should add. I have the booster lines just blocked off right now so I can drive the car. Brakes work great, just heavy. So I don’t think it’s something that’s not a booster problem, but hey educate me if I’m wrong.

EF_BOI (Score: 1): Definitely sound like you have an air leak in your booster. Try this, if you turn the car off ignition off, pump the brakes be after a few pumps they should stay hard to depress, if the feel spongy still or slowly moves down then you need a new brake booster"
1or6843,Help identifying and filling my old floor jack with oil,"Super beat up and old floor jack that I would rather fix than get rid of but I can't seem to find a place to fill it with jack oil like newer ones. I assume that little nipple is for grease but I could be wrong? Also, any help dating it or finding out how many tons it is or any sort of brand?",2,1762549405.0,7,AskMechanics,1762630414,2025-11-07 21:03:25,2025-11-08 19:33:34,"_ROBIN_SAGE_ (Score: 3): It will have a fill point somewhere on the cylinder body itself. Clean it off, #1.

HeadBunch1209 (Score: 2): there is going to be a fill somewhere on the piston body"
1or5uqg,Hey what's this rubber strip that covers the outside of the window slot called?,,1,1762548545.0,6,AskMechanics,1762630414,2025-11-07 20:49:05,2025-11-08 19:33:34,"dds2525 (Score: 3): Weather strip

OGjohnnyskullface (Score: 1): Window molding, or drip molding sometimes."
1or5e4q,Why the efflorescence on the thing that holds the battery in place? What can I do about it? Thank you.,,1,1762547443.0,13,AskMechanics,1762630414,2025-11-07 20:30:43,2025-11-08 19:33:34,"boafish (Score: 11): Leaking battery. Neutralize acid, replace battery.

Almost_Wholsome (Score: 6): It’s battery acid, and you can lick it, but that would be seriously unhealthy and I would strongly advise against it."
1or4peq,Hey so i’m not a mechanic but i don’t think it’s supposed to be like this,As the video shows one side is tightened and the other is loose and seems to be missing some sort of rubber piece that cushions? I’m not quite mechanically savvy so I was hoping I could get a response here,5,1762545846.0,12,AskMechanics,1762630414,2025-11-07 20:04:06,2025-11-08 19:33:34,"Jdude1 (Score: 3): Your clearly not a videographer either good lord I’m going to be sick.

gentile3 (Score: 3): The rubber bushing is gone... it should have one just like at the top... it's the sway bar end link...needs replaced


Terminology change... thanks!"
1or4mid,Looking at this 240sx online,"Been looking at this 240sx online recently that’s been sitting for a couple of months, odometer reads 54,xxx. I can’t really tell if I should avoid it or not from the photos the poster has given me. Can anyone give any advice? Seller says undercarriage is all well as it’s been garage kept all of its life. (Yes the dash is cooked)",2,1762545670.0,16,AskMechanics,1762630414,2025-11-07 20:01:10,2025-11-08 19:33:34,"shiftdown (Score: 2): Looks nice. clean. what are they asking for it?

Sir_Bird_Law (Score: 2): That damage does not happen in 6 months.

S13 paint (okay 14s also) was garbage but this thing has spent years uncovered outside for the paint to be in that poor shape. Look at the seat belt receivers and the window cranks. Those things don't bleach that quickly. 

A very clean SOHC auto with good paint is worth* 8.5K. This car is not that. It's a decent $4500 IF the underside is infact rust free and the unibody rails aren't absolutely smashed. Keep in mind though that S13 coupe sunroof seals are no longer available and with the sun damage that roof has, the seal is absolutely fucked as well. Sun roofs are not an easy thing to deal with when they go bad



*I get it, bunch of dudes paid $500 for clean S13s in 2006 and still think they should be available for that same price. That's not how the market sits today.

EDIT: On second look that appears to be an aftermarket sunroof. Run far far away."
