id,title,selftext,score,created_utc,num_comments,subreddit,scraping_time_utc,created_datetime_utc,scraping_datetime_utc,top_comments
1ofpctf,Looking for a book,"Hello everyone!

Im a filmmaker developing a series for kids where we explain all the mechanical components that make up a car. I basically would like to follow the mechanical design challenges through time and structure the series this way. For example the evolution of the bearing or the invention of the differential etc.

So I was hoping there would be a nice book about these mechanical marvels, but I get lost in the millions of books that focus on aesthetics or historic timelines. Is there a nice book somewhere about the mechanics of a car that puts these inventions in historic context? You’re also welcome to pitch mechanical components that definitely need to be in the series.

",1,1761392283.0,2,MechanicAdvice,1761507151,2025-10-25 11:38:03,2025-10-26 19:32:31,"decoparts (Score: 1): As you said, they seem to all mostly focus on styling or sociology.

If you are trying to focus on the mechanical aspects you might want to pick a few topics and find engineering text books about those specific subjects that were published in a few key time periods for each.

If this is for a kids film I don't think you will need a super high level of technical detail.

I'd suggest:

Transmissions- manual transmissions and the introduction of the synchro into common use, the introduction of the automatic,  the introduction and common use of the CVT, and the phase out of transmissions in EVs

Differentials- overview, introduction of the limited slip differential, a look at AWD

Carburators to mechanical fuel injection to throttle body injection to MPI systems, ending in direct injection into the cylinder instead of above the valves

Bearings and oil, from Babbitt type to modern

Leaded gas and how it helped the engines of the time but was bad in all kinds of other ways

Tires from inner tube to bias ply to radial

The rise of computer technology and complexity, sensing, and how it helps safety

I'm sure there's a bunch of other fascinating tangents

Edit to add- valves, from valve in block to ohv to ohc, rotary engines, 2-stroke vs 4-stroke vs diesel"
1ofozgg,L67 problem,"What has happened is 2 of my spark plugs gap got squashed shut after giving it a bit on the freeway and lost almost all power, it sounded like it was gurgling fuel, I pulled over, cleaned and regapped the plugs on the the spot and it was ok for about a day until I bought 6 new plugs pre gapped to spec and replaced them all. That's when the exhaust started popping, barely turning over and running rough. I put the old plugs back in and same thing. 

Could this be a timing issue?? It's a 2003 holden vy 1tonner with a l67 and memcal based ecu.

Note, a week prior I installed a 460lph fuel pump and high voltage coil packs (6.4k OHM winding resistance)",1,1761390966.0,3,MechanicAdvice,1761507151,2025-10-25 11:16:06,2025-10-26 19:32:31,GhostlyConnection (Score: 2): I think the first place to start is figuring out what caused the spark plugs to contact the piston. Timing usually hits valves not plugs. Crank bearings or rod bearings can cause extended travel in the pistons stroke. What’s the odometer at?
1ofos81,Long crank,Any know what could be happening here? It starts up but just takes a couple cranks. Changed the spark plugs and ignition coils,1,1761390236.0,2,MechanicAdvice,1761507151,2025-10-25 11:03:56,2025-10-26 19:32:31,Extreme-Quarter7620 (Score: 1): 08 Honda Civic ex
1ofojuq,Safe to put jack stand here ?,"Hi everyone ! My jack is not lifting high enough when I lift on the jack point under the front, so the driver side I can only lift my stand by one level, on the passenger side I cannot even lift it. Could I jack on the pinch welds and put the jacks on this long metal thing ? 

I Believe the chassis is a unibody so I have no idea if it's the same as a traditional chassis. 

It's a Corolla E120 European model, I've searched for videos online on how to put the car in jack stands, but I would like to lift the whole front, but the videos tutorials use the central point on which my jack does not lift high enough

Thanks for your advices ! ",1,1761389394.0,13,MechanicAdvice,1761507151,2025-10-25 10:49:54,2025-10-26 19:32:31,"frostyholes (Score: 4): I live in the rust belt and pinch welds are often a bad idea lifting there (yes I know that’s the recommended point) due to rust and corrosion so I often use this point and have no issues. But I am lifting there with a flat rubber topped pad on a lift.

Sweaty_Assignment_69 (Score: 3): It *should* be fine. Just leave your jack jacked as well just in case."
1ofo9mu,BMW E46 330i hesitates and stalls when warm,"Hi all,

  
I recently bought a 2000 BMW E46 330i (manual transmission) and only managed to drive it for about an hour and a half before it started having issues.

  
The car starts perfectly and drives mostly fine whilst the engine is cold, although there's a very slight hesitation when accelerating (noticeable, but nothing major)

However, once the engine warms up, the throttle response becomes noticeably delayed (I estimate a couple hundred milliseconds but it feels like it takes half a second or more). If I press the accelerator quickly, the RPMs drop sharply and the engine sometimes stalls. It still starts fine when warm, but the throttle behaviour changes completely.

  
If I ease onto the throttle very gently (and slip the clutch a bit) I can drive it somewhat normally. But if I try to take off quickly in first gear, the RPMs drop and the car either bunnyhops or stalls. It's getting a bit embarrassing in traffic because it takes a few extra seconds than it should just to get moving from a stop plus there's a lot of revving.

  
The same thing happens if I lift off the gas completely and then get back on it quickly - like when trying to rev-match or accelerate hard. The engine bogs down badly before recovering. Testing this in neutral shows the RPMs dipping to \~400 before recovering and revving ""normally"" again. I have also noticed the oil-light popping up on my dash around this time or right after turning the car back on when it stalls (I assume the low RPMs is causing weak oil pressure?)

I haven't had a chance to do any proper diagnostics yet, and I can't take it to a mechanic for another couple of weeks. I'm hoping to get some advice or ideas on what could be causing this issue. I suspect the MAF sensor or a vacuum leak but that might just be wishful thinking.

I bought the car from an older gentleman who claimed it had been regularly maintained and that he'd owned it for three to four years. After the purchase, I discovered he'd actually only owned it for about three to four months. Because of that, I can't really trust any of the information he gave me about the car (i.e maintenance or how well it drove during his ownership)

The car drove ""fine"" for the first couple of days after I bought it. It had also been on a long drive of around 250km before the sale, and the issue wasn't present when I first got it. I believe it was raining at the time that this issue first popped up...

Sorry if this explanation is a bit messy. I really appreciate any help or suggestions. Thanks!

TLDR: Car goes \*brrr-**stall**\* instead of \*brrrrrrr\* when I press the accelerator.",1,1761388317.0,5,MechanicAdvice,1761507151,2025-10-25 10:31:57,2025-10-26 19:32:31,"Mawibe01 (Score: 1): I should also say that I haven't seen a CEL....

RudbeckiaIS (Score: 1): First read the codes, then plot live data using INPA, especially fuel trims. 

I strongly suspect you have an air leak into the engine that gets really noticeable when the engine gets warm: the M54 is a very reliable engine but it's extremely prone to all sorts of leaks. Dipstick tube, VANOS solenoid seals, injector o-rings... you name it. 

But, again, only a scan using INPA will tell what's going on with that engine. 

PS: check the ""older gentleman"" has not pulled the light bulb from the check engine light. You wouldn't be the first and won't be the last to be scammed this way."
1ofnjj2,Potential spun bearing???,"My truck an 03 ford f150 4wd with the 4.6 triton just started making this noise yesterday, it doesn’t get louder when I drive down the street  but it almost sounds like a knocking ticking noise if you listen to the video… how cooked am I?",1,1761385557.0,2,MechanicAdvice,1761507151,2025-10-25 09:45:57,2025-10-26 19:32:31,MoneyWisdom (Score: 1): Harmonic balancer
1ofniqt,17' Impreza Dash and Infotainment turning off and on when driving,"Hey everyone! I have a 2017 Impreza (G5 MY17 2.0i Premium Hatchback 5dr CVT 7sp AWD 2.0i) and for the past few months I've been having issues with my dash and infotainment system shutting off and turning back on whilst driving.

The issue was intermittent at first, but now seems to be happening every drive or at least every 2nd drive, and I've also noticed it's started affecting the power steering as well which is concerning. When the issue is happening, if I pull over and turn the engine off, the car appears to lose all power and can't be turned back on for a few minutes. I've also noticed that when the issue starts happening, it can be replicated most of the time by accelerating as seen in the video.

I've taken it to a couple mechanics and specialists who've told me they can't find anything wrong with it and that my battery looks fine...any ideas as to what it could be would be greatly appreciated!",1,1761385475.0,2,MechanicAdvice,1761507151,2025-10-25 09:44:35,2025-10-26 19:32:31,Apprehensive_Time555 (Score: 2): Check your grounds and fuses but honestly the screen part of it could failing maybe just need a new unit installed 🤷🏾‍♂️😏
1ofncqc,Can anyone identify this part on a 2002 Isuzu TF Rodeo?,"Had some work done on the engine and this part was disconnected,",1,1761384800.0,3,MechanicAdvice,1761507151,2025-10-25 09:33:20,2025-10-26 19:32:31,FrenchOldMechanic (Score: 3): Canister (stores gasoline vapors)
1ofnazq,Wifes car is making a weird noise running idle - Missing oil cap the issue?,Wife complaining her car is broken. Lifted up the hood and the oil cap is missing would this be the reason the engine seems to be pulsating?,2,1761384612.0,10,MechanicAdvice,1761507151,2025-10-25 09:30:12,2025-10-26 19:32:31,"NervousAd596 (Score: 5): Yes, definitely the oil cap. Modern cars use very high crankcase vacuum for multiple reasons I won’t get into, but basically you’re sucking unmetered air into the engine through the giant crankcase leak from the missing oil cap, like a vacuum leak. Replace it, should be fine.

OldGrimMechanic (Score: 3): Wow put a cap on that, any condensation will mix with with your oil, you will lose the velocity of your car's oil, and it  will cause friction and frothing too."
1ofn9t9,Need advice,"Hey there guys, first time car owner of a bmw 320i e46 2004 an I checked the oil cap after two weeks of purchase from a car yard an discovered this, I’ve posted this video to other bmw groups and the majority aren’t too worried, some have suggested using marvels mystery oil to clean and repair it but wanted to check an get more concrete options as I’m worried, stuck my finger in it an it came back sooty black an a little oil ",3,1761384483.0,3,MechanicAdvice,1761507151,2025-10-25 09:28:03,2025-10-26 19:32:31,"74M4N_69 (Score: 1): Negative on the additive bro 👎 unless absolutely necessary like its so sludged the pickup screen is blocking up 😬. 
You're better off just changing the oil and filter more often than normal for a while then going back to regular intervals once it's looking better 👍.
Engine oils already have detergent additives to help remove impurities and combustion deposits.
I find most older cars that haven't had the best service history don't always like having the more harsh oil flush treatments done and often get side effects like damage to seals and rubber gaskets 🤷‍♂️

Sayvian (Score: 1): Marvels mystery fluid is great stuff"
1ofn9bp,difficulty replacing headlight bulb on 2006 corolla,"Hi all

I'm trying to replace the driver side low beam headlight bulb on my 2006 toyota corolla conquest, but I'm struggling with it. I looked at a bunch of youtube videos for 2000s corollas but they all have a completely different bulb and fitting to my car.

I've attached some photos of the fitting and the cord that supplies the power. When I gave my car specifications to an auto shop today they sold me an H7 bulb.

Any help would be massively appreciated as I'm pretty clueless when it comes to car maintenance.

Thanks!",1,1761384431.0,2,MechanicAdvice,1761507151,2025-10-25 09:27:11,2025-10-26 19:32:31,"BobbyWizzard (Score: 1): They sold you the wrong bulb. Should be a SYLVANIA 9006 or similar if different manufacturer. 

Also, it appears you have quite a bit of bulb grease in that wiring harness. Too much can prevent or hinder an electrical connection."
1ofml56,HELP ME FIND OUT WHAT THIS NOISE IS PLEASE,Started making it after my last drive coming from front of car and happens at idle. If gas is applied the squeaking/screeching gets faster and higher pitches,1,1761381882.0,3,MechanicAdvice,1761507151,2025-10-25 08:44:42,2025-10-26 19:32:31,"CulturalPainter8741 (Score: 2): Take a bare of soap and hold it on the belt while the car is running and see if it stops squeaking no need to take the belt off

donegal1983 (Score: 1): Take the belt off and see if noise stops. Has to be a squeaky pulley or bearings there somewhere"
1ofm4gt,What’s wrong here?,"Please can you help me figure out why is there oil residue outside of the cover? 

Car : Honda CRV 2007 
",2,1761380059.0,7,MechanicAdvice,1761507151,2025-10-25 08:14:19,2025-10-26 19:32:31,"RudbeckiaIS (Score: 1): Oil was spilled while filling and went everywere or the rocker cover gasket is in need of replacement. They aren't mutually exclusive.

Clean that crud and if you find more oil just replace the gasket: it's an easy job on these engines."
1oflpea,Alignment after air ride delete?,"2019 RAM that just came out of warranty last year, had endless air ride issues for 5 years and compressor went out again for the 3rd time about 3 weeks ago. Ordered a Bilstien 5100 delete kit and the dealer installed it today. Also had a bad front wheel bearing so replaced both hubs and both CV axles since those are known issues as well.

Curious if I should get an alignment after that much work on the front end?",1,1761378401.0,2,MechanicAdvice,1761507151,2025-10-25 07:46:41,2025-10-26 19:32:31,"River_2675 (Score: 2): You've changed multiple properties of your suspension and steering

While in theory you wouldn't need a alignment, tires are one of the most expensive things

So, alignment recommended"
1oflhrd,Do I have to replace the throttle body gasket when cleaning it?,"I’m planning to clean my throttle body and wondering if I should replace the gasket.
I bought an Ajusa one, is it okay to use it, or is it better to reuse the old OEM gasket?
Even if the old one looks fine, should I replace it with the Ajusa to be on the safe side?

My car is a 2016 Mazda 3 2.0L with 76K miles.",1,1761377549.0,2,MechanicAdvice,1761507151,2025-10-25 07:32:29,2025-10-26 19:32:31,Grand_Possibility_69 (Score: 1): If you're cleaning the throttle body without removing it then obviously you don't need to replace the gasket. If you are removing it it's best to replace the gasket but depending on gasket type and luck you might be just fine re-using the old one.
1oflfg3,‘69 Buick reviera - not running,"Had to unplug her to remove a regulator out of passenger side. Engine cranks but won’t start, clicking sound but I’m pretty sure battery’s ok. Don’t think it’s fuel or air. 430 engine Any thoughts?
",2,1761377294.0,4,MechanicAdvice,1761507151,2025-10-25 07:28:14,2025-10-26 19:32:31,"FrenchOldMechanic (Score: 1): Your Buick won't start since you disconnected your battery but it turns on the starter, is that correct?"
1ofl4yq,2011 Toyota Corolla steering wheel not returning to the center after turning; alignment?,"My steering wheel doesn’t return to center after making a right turn — I have to manually bring it back. Could this be related to the vehicle’s alignment? From what I understand, only the toe can be adjusted on a 2011 Toyota Corolla. Is the issue likely caused by the caster angle? Should I have a mechanic take a look at this?
",2,1761376163.0,10,MechanicAdvice,1761507151,2025-10-25 07:09:23,2025-10-26 19:32:31,"River_2675 (Score: 2): Left front tire is at 3.3 degrees caster, that will compound that problem

The castor needs to be set to the middle of the bar or have a negative of the center of the bar reading for the wheel to want to snap back to center

And it has to be equal on both sides"
1og6cg2,2001 Ford Mustang Taillights won’t turn off?,"Just like the title says, my taillights won’t turn off, even with the keys out of the ignition. I pulled and replaced the fuse, to no avail - Is it the switch itself? Please help 🙏🏻",10,1761436418.0,11,CarTalk,1761507151,2025-10-25 23:53:38,2025-10-26 19:32:31,"thebigaaron (Score: 30): That’s the brake lights that are on, not the taillights. You’ve got a faulty brake light switch. It might just need to be adjusted, or it’s failed and needs to be replaced. Get it fixed soon, you don’t want to drive without brake lights.

Therex1282 (Score: 2): Yes like thebigaaron said. Look under the brake pedal where it goes further under the dash or where it mounts. Look for some like black module with wires attaches to it. I forgot exactly how to do it but there is like an adjustment or screw you can move to adjust it. you will have to press the pedal down and let it come up and see what that metal brake bar is pushing. Should be an easy fix. Very normal tools you might need. Maybe just pliers and a screwdriver. I had this happen one time to my van.

Longjumping-Log1591 (Score: 1): Take a hammer and smash the lightbulbs , don't let them drain your battery"
1og5ddq,My Truck Won’t Run,"I’ve got a 2003 v6 manual Tundra. After I drive for maybe an hour at least and usually on the highway doing at least 50-80mph, if I shut off the engine and leave it for 10 or so minutes and then I try to start it again the engine won’t run. It will turn over all day and sometimes I can get it going if I do some clutch/accelerator shenanigans but usually not. No check engine, no weird noises, it just refuses to run. But then if I let it sit for say at least 45 to an hour it will start up no problem. I’m not sure if it happens every time but I’ve had it happen twice now in the last 2 weeks. I’ve had it happen before but that was probably a year ago now and I figure she was just acting up. I’ve put in a new battery, coils, spark plugs since it happened a year ago but that was for different reasons than this. Any ideas?",5,1761433635.0,4,CarTalk,1761507151,2025-10-25 23:07:15,2025-10-26 19:32:31,"bronxboater (Score: 5): Next time it happens try loosening the gas cap & see if that helps. Fuel system could be vapor locked.

1sixxpac (Score: 2): First off congratulations on owning a Toyota! 
Tho a wild guess I will say purge valve is causing flooding. 
DO not hit it with a parts cannon! When in doubt pay a professional to tell you what the REAL issue is."
1og56y5,Help me with this problem!,Car need a jump. 2008 jeep grand Cherokee ,0,1761433144.0,2,CarTalk,1761507151,2025-10-25 22:59:04,2025-10-26 19:32:31,ParticularFar8574 (Score: 5): How can we help you with the fact that you bought a Chrysler product?
1og4ik5,Sway Bar Links out of alignment?,"Just replaced control arms, tie rods, steering rack, sway bar links, and struts on 2004 Subaru Outback 3.0. After about a month, I heard a bunch of creeking and found that sway bar links on passenger side was snapped. 

Per manual, I can tighten to spec with car on jacks. However, just read that it’s common to tighten when vehicle is on the ground so things are in natural alignment. 

I just replaced both sway bar links and this is how they’re aligning while on the ground. Have yet to torque to spec. Does this look normal? 

Sway bar is able to rotate freely and is not bound by over tightened mounts. 

Thanks for the help!!",9,1761431256.0,9,CarTalk,1761507151,2025-10-25 22:27:36,2025-10-26 19:32:31,"moomooicow (Score: 34): Mounting pockets on aftermarket control arms probably not welded into correct position for proper link angle. Welcome to parts in 2025 :(

ridebmx833 (Score: 28): I think you probably got control arms for the 2.5, maybe the H6 3.0 has different control arms. Upgraded engine models typically have beefier suspension components

smedema (Score: 10): If you put on aftermarket control arms? If so I would compare them to what you took off if they were OEM you took off. Aftermarket parts are often crap and do not align with OEM parts. That mount on the control arm does look wonky."
1og38wk,Pulled distributor out without marking. What next?,"Hello

I have a 2001 Chevy Astro that I bought as a project. It's my car project car and I'm learning as I go. 

I had to remove the upper intake manifold, and the distributor was in the way. I pulled it out without marking the cap or anything. 

What do I do now to reinstall it properly? Did I just f myself? ",3,1761427862.0,11,CarTalk,1761507151,2025-10-25 21:31:02,2025-10-26 19:32:31,"C-C-X-V-I (Score: 23): You get to learn to set Top Dead Center.

rexfaktor (Score: 7): On the Vortec engines, you do a rough distributor drop using the TDC mark, but then you have to set the ""CMP retard"" to plus or minus 2 degrees, normally with a scanner.  Too far off and it will turn on check engine light with code P1345.

smthngeneric (Score: 4): It's not hard at all but some people make it sound way harder than it actually is. I rarely ever mark anything before pulling the distributor because it only take a few minutes to set it again. Look up a video on YouTube. Seeing it is a lot easier than trying to understand what people are trying to say through text (especially since half the current comments are wrong). It's the same process for anything with a distributor so just find a nice clear video most likely for a smallblock and go for it."
1og2kme,"As a remote worker who drives once or twice a week, should I wait for the brake sensor light? It's a C300",,1,1761426128.0,5,CarTalk,1761507151,2025-10-25 21:02:08,2025-10-26 19:32:31,"Tomytom99 (Score: 3): I'd just get it done and have it be over with. If you and your mechanic think the rotors are doing alright, you can get away with a pad slap.

No telling how long you'll wait once the light comes on.

Busy_Application_27 (Score: 2): Also was told I have about 10% life left on the pads

Bootybootybootie (Score: 2): Looks to be about 2mm left on that inner pad. The wear sensor wasn't on that side. The other side with the wear sensor might have more life left. They are just saying it is possible that the pad may wear out and be metal to metal before the sensor trips. If the rotors are in good condition you could get away with just new pads but if you let it get down to the metal you will need new rotors. If your next service is in 10k miles I would not wait that long."
1og2dwp,How bad does this look?,"Left front half shaft, image taken by mechanic because my car is in for a trembling steering wheel and severe leftward pull. How bad is this? Can I wait on this at all in this state? Turns are getting rather difficult, but I do not hear clicking. 

I'm supposed to be making a nearly 700 mile trip soon so should I get this fixed before? 

Car is a 2012 nissan versa if relevant.",2,1761425668.0,4,CarTalk,1761507151,2025-10-25 20:54:28,2025-10-26 19:32:31,"-NOT_A_MECHANIC- (Score: 2): It still looks like grease and it’s not all over the place, so I doubt that’s old or large enough to cause the axle to fail. Should it be replaced yes. But I doubt that’s the cause of your issues. Vibration and pull sounds like damaged/worn suspension and/or alignment.

--Someday-- (Score: 1): My dad had a trembling steering wheel while he was pressing the brakes. Ppl told him its cuz of his rotors. He put on new ones and there was no change. He eventually replaced a half shaft and the trembling decreased by a lot. I don't want to miss guide you. It might not be the problem in your case. Just sharing some experience. I have a little trembling in my steering wheel while braking aswell, but my car is old, i am new to cars and i see the rare break pads don't align too well with the rotors."
