id,title,selftext,score,created_utc,num_comments,subreddit,scraping_time_utc,created_datetime_utc,scraping_datetime_utc,top_comments
1o7fbvn,Motor 2011 DODGE CHARGER 3.6 BUSTED,So my son busted his motor driving it through a 2 foot puddle of water and now there’s a hole in the bottom of the motor. My options I’m not quite sure of. Should I buy a new motor from the junkyard that comes with the warranty or take my mechanic with me and buy one off Facebook or should I just scrap the car for parts and buy a used car from the auction please help me.,1,1760544714.0,2,MechanicAdvice,1760643270,2025-10-15 16:11:54,2025-10-16 19:34:30,"Laqota (Score: 1): It comes down to a few questions.


1. Do you even like this vehicle? The seats.. The cab.. or the outside? Or do you just drive it as its all you have.
2. Did it ever get up and go and satisfy you with the power that it had?


If any is no. I would honestly just sell it and buy a used car with what I make from scrap and a little bit of pocket lint.


Next time make sure your son doesnt drive his vehicle through puddles, or go slow over puddles. Especially if it doesnt have the stock intake piping (and not all that cold air intake modding shiz) Water is not compressible. A piston tried to compress the water, bent the rod, and bent it enough for it to smack a hole in the side of the block."
1o7fa3v,Sanity check please,"This is the clutch lever from a new to me 99' Micra/March. 

The clutch is heavy to return, and after checking the cable that doesn't look like the issue(to my dumbass) 

So my next idea is to clean all this up and grease it. Still no joy? Replace the lever and the return spring.

  
If not I think it might be the clutch itself but il burn that bridge when I get to it.

  
Is this a good way to step by step the issue or am I being an extra dumbass and I cant see it? ",3,1760544603.0,5,MechanicAdvice,1760643270,2025-10-15 16:10:03,2025-10-16 19:34:30,Laqota (Score: 1): Throwout bearing? (Sorry)
1o7f83o,Mazda 3 2.0 skyactive automatic transmission problems,"Hi everyone!

I have a mazda 3 2018 with 220k km, it s a 2.0 skyactive 165hp automatic transmission.

Until 3 weeks ago ( around 1500 km ago ) it was the smoothest car when changing gears. But I went on some racing with it, not something crazy, but pushing it to the limits on the highway for 10-15 km, and since then, my gearbox it s horror. 1 out of 4 time when changing gears it s very rough. I thought that after some 100 km or so it will come back normal, but it s just getting worse.

Do you have any idea what can it be? And how can I fix it?

I drove it on sport on that day and pretty aggressive, I hope I didn t ruin it. Thank you",1,1760544472.0,4,MechanicAdvice,1760643270,2025-10-15 16:07:52,2025-10-16 19:34:30,"Ok-Structure8223 (Score: 2): Probably your shifter solenoid or the main valve body is the problem..you have to take at the transmission specialist for automatic then if ever you can buy a rebuilding kit to fix the problem..

wormwormo (Score: 1): Check your fluid.  In fact. Manual recommends fluid change every 30k miles."
1o7f82w,2018 Honda pilot. What is falling off?,"Heard it dragging, I am around 50 mi from home.  Is it safe to pull off and drive home (to a shop)",1,1760544471.0,15,MechanicAdvice,1760643270,2025-10-15 16:07:51,2025-10-16 19:34:30,"tigerowwwl (Score: 11): Heat shield for your exhaust, yes safe to pull off

Aggravating-Rip-6557 (Score: 4): My understanding is the only point in those is to keep tall dry grass from catching fire when you drive over it from the exhaust heat. I wouldn't bother to get it fixed."
1o7ewb8,Any ideas?,"During an oil change I noticed what seems to be trans fluid under this bottom piece bolted
up and on the exterior in the second picture. Could it be old residue? ",2,1760543755.0,2,MechanicAdvice,1760643270,2025-10-15 15:55:55,2025-10-16 19:34:30,"Valuable_Stretch_592 (Score: 1): Probably a small leak, wind is blowing it on the trans pan, check behind the engine for leak, if noting is visible above bell housing probably rear main seal"
1o7emjn,Is this mid pipe normal?,"Lifted my Mazda to install rear sway bar today and found out my previous owner had this weird mid pipe installed. Is this normal? Why does it looks like imploded?
I believe this is the 2nd cat no?",804,1760543148.0,147,MechanicAdvice,1760643270,2025-10-15 15:45:48,2025-10-16 19:34:30,"TrueLegolas (Score: 904): It has so much torque it twisted exhaust 🤣

justabucketofwater (Score: 638): It was glowing red hot then you hit a puddle. I’ve seen this happen on a motorcycle double walled exhaust header, it literally collapsed the inside tube"
1o7ebsi,2021 Kia Seltos,I have a 2021 Kia seltos 2.0 that showed a code for a crankshaft position sensor. Replaced the sensor and it won’t turn over ,1,1760542486.0,6,MechanicAdvice,1760643270,2025-10-15 15:34:46,2025-10-16 19:34:30,"QwopperFlopper (Score: 1): New sensor bad?

Ok-Structure8223 (Score: 1): Better check ignition coil and spark plug if there's a good power or not.."
1o7eaxf,Codes need advice ASAP,"Car: Chevrolet Silverado 2015 15000 

Car shook when accelerated and got flashing check engine light. checked code  (P0307) O'Reilly's suggestion was to change spark plugs and wires. Did it and still doing the same thing. Checked again this time said the same code but now to change some $400 solenoid. Checked online and a suggestion said to switch ignition coil and check codes, so I switched cylinder 7 and 3 ignition coil went to check at two places (O'Reilly's and AutoZone) both gave me the same code (P0300) and both suggested to clean fuel injectors. What should I do?",1,1760542430.0,4,MechanicAdvice,1760643270,2025-10-15 15:33:50,2025-10-16 19:34:30,"QwopperFlopper (Score: 1): Stop listening to the cashiers at autozone

Duckyboy72 (Score: 1): I'm leaving this post for anyone having this problem. I ended up resetting the codes by disconnecting the battery. And the new code turned into a p0303. Which ment it was the ignition coil. Truck stopped shaking and engine light stayed off"
1o7eamr,07 Honda CRV horrible acceleration sound,"Does anyone know what this could be? Had one person say a cv joint and the other say a misfire perhaps. I would like a few more inputs please. Anything advice on what it might be helps , the car is my family's livelihood. 🙏🏽 the car is good on engine oil and transmission fluid. Something did leaked out when we parked it. Thanks in advance ",1,1760542412.0,2,MechanicAdvice,1760643270,2025-10-15 15:33:32,2025-10-16 19:34:30,"QwopperFlopper (Score: 2): Whatever it is it’s totally fucked lol. I have never heard a car make that noise before. 

I would crawl under and check the CV axle to start seeing as it’s making noise when you accelerate"
1o7e5e2,Is this bad CV joint noise?,,1,1760542092.0,3,MechanicAdvice,1760643270,2025-10-15 15:28:12,2025-10-16 19:34:30,QwopperFlopper (Score: 1): Get under it and look?
1o7e0ow,Solar charger for a 2004 Ford F-350,"I have a stock 2004 Ford  F-350.   I want to plug in a solar panel to the cigarette lighter to keep the battery charged when the truck sits.  I have the regular cigarette lighter on the dash and the plug near the floor.  I read that some plugs turn off after a certain amount of time.   Should I plug the solar panel in the top plug or the bottom plug?  If I plug it in the bottom one, do I need to turn on any of the switches?

  
",1,1760541807.0,2,MechanicAdvice,1760643270,2025-10-15 15:23:27,2025-10-16 19:34:30,"Rebeldesuave (Score: 1): I have a feeling yours stays lit when with the truck not running 

Newer vehicles have the power ports on only when the engine is on. 

You can test yours easily enough."
1o7dz3w,Plastic clips in engine bay removal help,"Hi

Bare with me it's my first time trying to fix something on my car.

Attempting to replace the headlights for the first time on my 06 Lexus is250. Encountered these retention clips. From what I see online most people have the ones that can just be pryed up with a flat head screwdriver. 

I've tried unscrewing them but most of them just seem to just spin indefinitely or just stripped as it's presumably 20 year old plastic.

If I understand right I should be able to unscrew them a bit and just pull them out right? 

Failing that do I just break the clips and replace them with push ones?",1,1760541711.0,10,MechanicAdvice,1760643270,2025-10-15 15:21:51,2025-10-16 19:34:30,"Nearby_Knowledge8014 (Score: 7): I’m going to give you the best advice you will ever get:  Those plastic screws are a test put in by the manufacturer. If you can’t remove those plastic screws, then you have no business doing anything underneath those plastic panels.

Protholl (Score: 3): The correct tool is the red handled one on the left

https://preview.redd.it/c185qhmlpavf1.png?width=474&format=png&auto=webp&s=19737d6a6d1c1d61f164c1edc7acb24f75e22e2d"
1o7dyps,Just got new tires. Is it normal to have this much gap between hubcap and tires? Almost looks like it's not pushed all the way in. Should I ask them to reinstall?,,1,1760541689.0,12,MechanicAdvice,1760643270,2025-10-15 15:21:29,2025-10-16 19:34:30,"makatakz (Score: 8): If you go back to the shop, you'll just look like a complete idiot. You don't have hubcaps, you have aluminum wheels. Center caps on the wheels look like they're properly seated.

Odd-Concept-6505 (Score: 4): If the gap is consistent all around every wheel, looks good. 

I almost fell for the ""my hubcap"" until noticing full visibility to caliper and rotor thru the spokes!"
1o7dnoe,Just got to work and heard a squeaking noise coming from my right hood area,"05 Chevy Silverado 1500 V6 

Noticed leaking from bottom , water pump ? Radiator cap ? Was not over heating 
any help would be great because I’m currently at work and parked lol I can take additional photos if need be to help , appreciate subs like this 
",0,1760541018.0,6,MechanicAdvice,1760643270,2025-10-15 15:10:18,2025-10-16 19:34:30,"ihit18today (Score: 2): most likely water pump, when it cools down, take the cap off and check if its low or not, if it is add water, and idle the vehicle while following the source of the leak, might also be something else but im not there, you are."
1o7djuf,Wheel bearing advice,Looking to buy wheel bearing and front steering spindle/ steering knuckle for 2016 Subaru forester and looking for advice on which brand will be most ideal for each of those. Need quick response as I need them by tomorrow night. ,2,1760540784.0,2,MechanicAdvice,1760643270,2025-10-15 15:06:24,2025-10-16 19:34:30,"Greengiant304 (Score: 1): NTN is the OE on the wheel bearings for that vehicle. Look for an NTN hub assembly or their aftermarket product line, BCA Bearings (WE61907), for the best quality bearing, made in the USA at their Elgin, IL plant. For the knuckle, I would go with Dorman. 

You can get by with cheaper options, but I wouldn't if I was planning to keep the car long term."
1o7dd5a,Does this sound like a bad sway bar link?,"This 2012 Mercedes-Benz C-Class 3.5L V6 has over 170,000 miles and has been making a clunking noise for more than three years. The noise is clearly coming from the front passenger side, which I confirmed by pressing down on that side. I have already replaced the front lower forward control arm and the strut mount along with the bearing. However, the noise still persists, and I have spent over $2,000 trying to fix it, yet it is worse than ever.

Could this noise be coming from the sway bar link or the control arms? Unfortunately, I do not have the tools at home to inspect it myself, so I would need to take it to a mechanic. They have suggested that it could be either the control arms or the sway bar link. I do not want to spend another $700 or more only to have the noise remain.

Please share your experience if you have encountered a similar issue. Thank you.",1,1760540396.0,3,MechanicAdvice,1760643270,2025-10-15 14:59:56,2025-10-16 19:34:30,"Expensive-Ad5384 (Score: 2): The thing with suspension work is if you replace a bad part on one side, you should really replace that part on both sides.  If it is your thrust arms or control arm, it’s probably $600-700 in parts if you buy lemforder, and if you buy the parts yourself.  Most shops won’t put on customer bought parts, and if they do, they only warranty their work.  

MB will be way more and cheaper parts won’t last long and it’ll need to be redone.  You should have a shop look at it.  

Sway bar end links are super easy to replace.  Thrust arms or control arm is not necessarily hard, just time consuming and you need the right tools. 

My gut tells me that you will get a quote somewhere between $500 and $1700 depending on what they want to replace.  

You will also need to get a front end alignment after parts are changed.


It almost sounds as if they tightened the control arm with the front end suspended vs tightening the bolt to spec when the hub was lifted or at ride height.  

Sounds like the bushing is not happy and will need to be replaced sooner than later. 

The control arm bushing bolt should be torqued when the wheels are at ride height and under load of the car.

Rebeldesuave (Score: 1): Add the sway bar to the list of suspects. 

Take the car to another shop and get a second opinion. 

Someone experienced in suspension diagnosis can tell you what the deal is after a test drive.

I'm sorry about the expense but older cars develop suspension issues and they can be pricey no matter what the make or model is."
1o7dbya,New noise alert !! No idea what it is.,Got this random noise sounds like a rattling of some kind. Could use some help identifying the noise. Thanks and take care 👍🏽,1,1760540318.0,3,MechanicAdvice,1760643270,2025-10-15 14:58:38,2025-10-16 19:34:30,"DueDiscipline4972 (Score: 2): Honestly bud, could be a lot. Sounds like a loose plate, could be around your grill, could be the oil cooler is just loose lol could be a lot bub. I’d just start walking around it shaking shit til you find it."
1o7d8p7,08 Honda Accord 2.4 automatic transmission triple drain and fill vs flush?,I purchased a lower mileage (137k) 08 Honda Accord salvage vehicle and want to get the most life out of it as I can. I don't know if the previous owners have used the proper ATF so I would like to change the fluid out. When I worked as a technician I regularly used the BG A/T flush machine which connected to the A/T cooler lines and ran off of the transmission pump to exchange the fluid. I have been price shopping for a flush but am being told Honda does not recommend flushes but does recommend a triple drain and fill (averaging a cost of $500). I can perform a triple drain and fill myself in the driveway so my question is would the triple drain and fill be sufficient or should I find a repair facility who would perform the flush?,1,1760540119.0,4,MechanicAdvice,1760643270,2025-10-15 14:55:19,2025-10-16 19:34:30,"c25a1guy (Score: 3): Just do the 3x drain and fill with a little test drive on between each service. I've been using Idemitsu Type H-Plus in my personal vehicles as of late with no issues (considering Idemitsu manufacturers the DW-1 fluid for Honda).

Edit: on these, there is a serviceable in-line transmission filter that you can change out on the back side of the case above the axle. I've never had to change one out due to a drivability concern before during my time at the Honda and Acura dealerships. Usually the hoses going in and out of it dry rot first and it develops a leak. You may do with that information as you wish.

micknick0000 (Score: 3): I wouldn't do anything more than a single drain and fill then repeat in 30,000 miles."
1o7d1ke,DRY DIPSTICK???,"2014 corvette stingray z51

on a throwaway since this is too stupid for my main. I’ve been driving my corvette for about a month with varying degrees of load. Lately it threw 2 low oil pressure warnings that go away. Checking the oil reservoir revealed to me that I have been driving with ALMOST NO OIL (estimated I only have like 1.5 quarts of oil out of the 9.8 limit) for the last month and I’ve been pushing the car in varying degrees. I’ve since filled up the oil and checked dtc which had nothing but stuff that’s related to the car being catless. Does this motor sound alright at idle or do you guys think I cracked or blew something?",2,1760539662.0,7,MechanicAdvice,1760643270,2025-10-15 14:47:42,2025-10-16 19:34:30,"QwopperFlopper (Score: 2): I mean the engine sounds terrible. No idea what you could have done. If you were in fact 8 quarts low on oil, every bearing in the engine is probably pretty fried at this point and I would start saving for a long block

whaletacochamp (Score: 2): You just need a longer dipstick /s

8 quarts of oil doesn't just disappear, so you're either burning a fuck ton or leaking a fuck ton, both should be pretty obvious now that you've refilled it."
1o7cce2,Too rusted too fix?,"Took out the front suspension struts of a 2013 Renault Captur to replace the springs.

Found the top nut like this. It has a 6mm allen key and a 18mm nut.

Due to the glorious design it’s basically been collecting water for all its life. The threads are terrible and there is no way to put heat to it because of the rubber bushing around it. Also, don’t see a way to take a spanner and a bar to it without stripping the inner allen that prevents the piston from turning. If there’s a way to put an impact on it?

Any tips, or is it time for new struts? 


",1,1760538088.0,10,MechanicAdvice,1760643270,2025-10-15 14:21:28,2025-10-16 19:34:30,"connella08 (Score: 2): the inside allen key doesn't look to be in bad shape. I live in New England (USA) and see this level of rust on the regular. my advice to you would be to get the new strut just in case, soak this in penetrating fluid, and try to just blast it off with an impact gun first before you do anything else. worst case scenario, you already have the new strut if you need it. best case scenario, the nut comes free with little to no issue.

Yosser-68 (Score: 2): Drop the whole strut, clean the threads up as best you can and get the Impact gun on it, remember to take tension off the springs with clamps. You can grip the very top of piston shaft with mole grips if it’s spinning. If the hex is chewed up a splined bit chapped in and a ring spanner on nut. Good luck"
1o7c85u,Where do these rings belong ?,"2008, g35s, Infiniti. Removed tail end of transmission case to replace sensor. Are these sealing rings? Also should I do gasket maker around the two cases mate",1,1760537820.0,4,MechanicAdvice,1760643270,2025-10-15 14:17:00,2025-10-16 19:34:30,"lampministrator (Score: 1): That is a shaft seal .. It presses into the case where the shaft comes through.  Once they have been used, like all gaskets, they should be replaced."
1o7c5yq,Saab 900 update: Still no clutch after bleeding the slave cylinder,"I don't know if I'm doing something wrong, but even now that no air bubbles come out of the slave cylinder, I still have no clutch pressure at all.

My method to bleed the system is: clear hose on the bleeder valve that goes to the reservoir, I pump the clutch for like five minutes with the bleeder closed, I jam the pedal down with a stick and open the bleeder.
Sometimes, with the hose full of fluid, I also pump the clutch with he bleeder open hoping to make some fluid come in the slave cylinder from the top too.

I've been doing this for hours, no air comes out anymore, and fhe clutch still doesn't work😫

Any ideas?",1,1760537678.0,2,MechanicAdvice,1760643270,2025-10-15 14:14:38,2025-10-16 19:34:30,Placebo_8647 (Score: 1): is the slave cylinder moving?  have you removed the plastic cover so you can see the slave and the pressure plate?
1o7c4cr,2013 Ford Edge 3.5L timing cover help.,"Are there any secrets to getting the power steering pump bolts lose from the timing cover? If I remove just the two bolts threaded into the timing cover is that enough to get the cover off.  Is there any specific tools to get the 10mm bolts free. They seem near impossible to reach.  Also, aside from the engine mount, is there anything else that must be removed to pull the cover up and out of the narrow slot?",1,1760537573.0,3,MechanicAdvice,1760643270,2025-10-15 14:12:53,2025-10-16 19:34:30,JWines13 (Score: 1): use a long extension with a wobbly socket to reach up to get the bolts on the pump. you will need to completely removed the bolts from the timing cover portion of the p/s pump and the back one you can loosen enough to slide the pump off of the alignment dowels and pivot it away. no need to remove the lines from the pump and loose all the fluid. cant remember exactly but the ac line might be in the way that runs along the frame rail. a floor jack under the front of the engine to lift the engine as far as possible without damaging the axle shaft will help in wiggling the cover out and back in
1o7c477,My Lexus been making noises when cold starting it and when driving it makes whinnying noises. Does anybody know what it can be ?,,15,1760537562.0,12,MechanicAdvice,1760643270,2025-10-15 14:12:42,2025-10-16 19:34:30,"connella08 (Score: 14): does it change pitch when you turn the steering wheel? it almost sounds like a power steering pump whine when the fluid level gets low.

eyi526 (Score: 3): Which model and trim?"
1o7bzum,Engine Temp Gauge keeps dropping below ideal temp. (This is after 30 minutes of driving),"Hi guys bit of a strange one. The engine Temp on my 2015 VW caddy is struggling to get to/maintain ideal temp.  It will reach it but if im in  at some traffic lights it will drop to around 10 o clock. Its a very new issue so I'm hoping to catch what's causing it early. 

I have coolant in the reservoir, I was just wondering if anyone has a better idea on what's causing this. 
Thanks in advance guys. ",0,1760537275.0,6,MechanicAdvice,1760643270,2025-10-15 14:07:55,2025-10-16 19:34:30,"creep_nu (Score: 3): Did it get up to temp during the summer, but now that it's cooling down doesn't really get up to temp?  My wagon was doing the same...thermostat fixed it.  coolant temp sensors are also dodgy on these engines(assuming 2.0 TDI given the 5k redline like mine?), so might be worthwhile to have a shop do the diagnosis and rule that out.

Note, not a mechanic, just own the car and went through a similar issue and relaying that information.  This is not a diagnosis

ShiggitySwiggity (Score: 2): Sounds like a bad thermostat.  If it's not that, it's probably a bad temperature sensor.  

Neither are difficult or expensive to replace."
1o7bopm,2010 lexus is250,"Monday morning it was colder than usual on my way to work and the check engine light came on. After work I took it to oreillys to scan for a code and it just kept reading ""collecting vehicle information"" forver, didn't do anything after unplugging and re plugging so I left but when I started my car up after that the light was off",1,1760536548.0,2,MechanicAdvice,1760643270,2025-10-15 13:55:48,2025-10-16 19:34:30,Navigator8521 (Score: 1): Make sure the battery is grounded properly.
1o7ra1c,What should I do about this dent?,"Not sure how this happened, probably within the last few days, but not sure if it was from my car neighbor in my garage or while I was out grocery shopping briefly. Seems like a pretty aggressive dent so I’m not sure how hard something must have hit it. My deductible for insurance is 500 so I’m not sure if it’s worth going down that route, but PDR likely isn’t possible since the paints cracked.",7,1760572432.0,8,CarTalk,1760643270,2025-10-15 23:53:52,2025-10-16 19:34:30,"welldonez (Score: 3): Ig-nore or new-door

HardcorePooka (Score: 2): Pdr definitely isn't possible. The frame of the door is bent so it will take some work to fix it. Most body shops will give a quick estimate for you. If it's way over $500 go through insurance. If it's near or less than $500 pay out of pocket.

someonevk (Score: 1): I hate dealing with the deductible, but it might be worth it.  That is probably above a $2k repair.  While it could be repaired they will likely replace the door.  Having two different lines to reshape is a lot of body work for a super common door.  The replacement door will need to be painted and then blended into the surrounding panels.  All that will add up."
