id,title,selftext,score,created_utc,num_comments,subreddit,scraping_time_utc,created_datetime_utc,scraping_datetime_utc,top_comments
1o4k9iw,2014 Corolla ac not working,So it seems this compressor doesn’t have a clutch so I can’t tell if the compressor is damaged. But this car has been in a flood before so I am wondering if the internals of the compressor are corroded and I will have to change the whole compressor,1,1760259683.0,6,AskMechanics,1760383989,2025-10-12 09:01:23,2025-10-13 19:33:09,"Galopigos (Score: 2): Unless the lines were off and the system was open during the floods there is no way for water to get into it. Instead I would start by using a gauge set to see what the pressures are. Then either hunt down the leak or figure out what electronics are involved and see if those are damaged. That is far more likely than the compressor being bad.

persona_non_grata_1 (Score: 1): The compressor is variable displacement or a scroll setup. There is an ac amplifier on those cars that controls HVAC. The only way you can tell if the compressor is doing anything is with gauges. If I suspect a bad compressor I have a tool at work that allows me to change the duty cycle on the compressor and see how it reacts by looking at pressures. Kinda complicated to diagnose in a DIY setting but not undoable. Also those units dont like not having refrigerant in them. Thats usually what kills them  - before replacing find the leak if there is one."
1o4jh70,Mechanic said cracking on the outer he said get alignment and rotatin awd 31k miles.,How long do you think tires will last i know cracking isnt good. Should i just get a new set  in like 10k then get alignment and rotation or should i just cough it up for these oems.,0,1760256657.0,5,AskMechanics,1760383989,2025-10-12 08:10:57,2025-10-13 19:33:09,"AdHopeful7365 (Score: 2): If it is known that the camber is off, prioritize getting alignment done, and start shopping for new tires.  These are on their way out, yes, but don’t appear to be shot.

There’s no point in investing in new tires, knowing that the alignment is off. However long you might put off getting the alignment done you’re just going to chew up your new tires.

moomooicow (Score: 2): Replace your tires. This post is lacking details, and hard to understand."
1o4j7jw,Strange noise!,Hi knowledgable mechanics! Any idea of this noise? Will be taking to garage but always like a second opinion. Thanks! 2017 Fiesta,1,1760255655.0,2,AskMechanics,1760383989,2025-10-12 07:54:15,2025-10-13 19:33:09,iambeanies (Score: 1): Did someone leave a ratchet back there
1o4j4uu,Do drive belts crack again?,"I remember something like 10 years ago people started making drive belts out of some aramid compound or EPDM and they wouldn't show cracks anymore, rather you measure with a wear guage. 
Recently at the shop, I've noticed an odd influx of fairly new cars with moderate to severe cracking on drive belts again. Im assuming this is due to manufacturing costs, but does anyone have more info about it?",1,1760255358.0,7,AskMechanics,1760383989,2025-10-12 07:49:18,2025-10-13 19:33:09,"NightKnown405 (Score: 2): The belts do not crack like the neoprene ones of the past. But they definitely wear and need replaced from time to time. The way to tell if a belt needs to be replaced is either by using a tool that fits in-between the teeth on the belt. If the tool sticks out the belt still has life, but if it fits all the way in below the tops of the teeth it's time for a new one. 

The other way is a lot of belt tensioners have marks cast into them as wear indicators. As the sides of the belt teeth wear, the belt sits lower in all of the pulleys. The lower the belt sits, the smaller the diameter of the circle that it is passing through so that makes the belt look like it got longer/stretched.

I_-AM-ARNAV (Score: 1): I don't have much info on this, but yeah now it's more to do with just change after 4 years or so."
1o4ix3s,"Am I crazy, or did someone glue this connector?","I was feeling bad because I couldn’t get this CHT connector disconnected, but now I think this is just completely fused together? Or glued together?

I’m just trying to be a good car owner. I was given this car with 185k miles on it. I bought the Haynes manual and decided to check the spark plugs, but when I removed the coils, the spark plugs were submerged in big pools of oil.

Do a little YouTubing, and decide the valve cover gasket needs to be replaced. No big deal, just gotta disconnect everything, remove the cover, replace the gasket, and then maybe my engine won’t have so much oil all over the place.

Ended up spending another two hours on this, first trying to disconnect the CHT sensor, and then trying to clean up the pieces before the shards dropped into the cylinders.

I cannot remove this gray piece from the black piece. If they weren’t different colors, I’d think they were one piece of plastic.

What’s Reddit’s opinion? Did I have a better option? Where do I go from here? The car is running again with no checks engine lights, but I don’t feel great about the state of the connector. (The spark plugs were fine, btw. Maybe .05mm off, but otherwise looked good.)",1,1760254510.0,8,AskMechanics,1760383989,2025-10-12 07:35:10,2025-10-13 19:33:09,"None (Score: 1): Looks like it was broken at one time or another especially with those miles and someone glued it back together. I don't know on your vehicle but it's highly possible that you can get a replacement connector with wiring and splice connectors. I found it for another reddit user for his 2007 Lexus and it was at AutoZone and Amazon.

Federal_Sympathy4667 (Score: 1): Seen connectors being epoxied from factory, not sure why besides tampering maybe or issues of connectors coming lose, often it is a solvable epoxi they use in those cases."
1o4iof3,"2018 Toyota Corolla SE AC Dies After 5 Mins at Idle/Low Speed, Works Perfectly on Highway. Why?","I hope to have provided as much details as needed below.
I will be grateful if anyone could find the issue causing this. Thanks!

So I recently hit a significant pothole on the highway (adaptive cruise control is now throwing an ""unavailable"" warning, but that's a secondary issue for now). The day after the impact, my A/C changed its behavior drastically.

The Symptoms:

1. At Idle / Low Speed: The A/C blows cool air perfectly for about five minutes. After that, the cold air suddenly stops, and it continuously blows ambient air.
2. To get cold air back at idle: I have to turn the A/C system off for a few minutes, then turn it back on, which restarts the 5-minute cold cycle.
3. Cooling fan starts when AC is turned on and keeps spinning fast for 5 minutes then enters low speed mode. Bear in mind that before I hit that pothole the cooling fan would cycle on and off when at idle and the AC would cool properly and consistently.
4. Now whenever I switch the AC on when idling the RPMs drop below 500 for a split second then stabilize.

This problem doesn’t happen when I'm driving at highway speeds. The A/C blows continuously cold and strong on the highway.

Here's the things I did when the issue arose the next day:

• Checked refrigerant level and it's good
•Checked my coolant level. It's good
• Checked all fuses in the cabin and the engine bay fuse box and they are good and not blown
• Checked all relays and they're good. I even switched the compressor magnetic clutch relay with the horn one to make sure it's not faulty and both are good
• I sprayed my condenser and radiator grills with a solution of warm water/soap and vinegar in case the condenser was clogged with road debris and bugs then I rinsed everything thoroughly. Clean as a whistle
•I changed my battery for a brand new one and tested voltage. (12.63V when car is completely off then 13.66V when car is on with all accessories on including high beams and AC)
•I visually checked AC lines for any bending or looseness in case the pothole impact did comprise them. Nothing. They're intact.





",1,1760253565.0,9,AskMechanics,1760383989,2025-10-12 07:19:25,2025-10-13 19:33:09,"Country_bloke100 (Score: 2): Haven't done much work on ACs but it won't be a fuse. If it was a blown fuse or relay it would just not have power at all.

Fluids won't help either, just not relevant. 

The AC system is pressurized, so if you where out of gas you just wouldn't have cold air. It's not like it can just ""settle"" when you turn it off and on again.

I think it's the condenser fan being faulty (so your only getting cool air when the condenser can operate off the serpentine belt)

HangryPixies (Score: 2): Not reading all that.

If it doesn’t work when not moving and does when moving the first thing you should check is the condenser fan(s). They should kick on when stationary any time the AC is engaged.  

Highway speeds acts like the fan passing air over the condenser so it can shed the heat it pulls from the cabin."
1o4i1jb,head gasket diagnosis - pressure test results,"Certified YouTube diy technician here asking for diagnostic help to confirm a leaking head gasket. 

2000 Ford ranger 3.0, 2wd, auto trans, 89,000 miles 

Symptoms: (see Imgur for photos) https://imgur.com/gallery/head-gasket-diagnosis-sVXGT5j

1. Overheated today. Very shortly after starting and driving for less than 2 minutes. Scorching hot upper rad hose. 


2. Drained coolant and it’s brown and less than 0.5 gallons came out(I flushed it myself 1 yr and 10k miles ago and it takes ~2 gallons IIRC). Also replaced radiator cap at that time 

3. Minor abnormalities on the bottom of the oil fill cap (condensation). 

4. Tons of gunk under radiator cap

5. Pressure test results. All cylinders read between 120-150psi except for one which was around 90psi. Video included of me running the test for the second time on that cylinder after verifying a good seal between the gauge and the block. 

This truck does have one of the radiator/trans coolant combos but the transmission fluid stick looks normal. 


This is 100% either a cracked head or blown head gasket, right? 

Wanting to make sure before I start tearing apart the block in my garage.

Thanks in advance!
",1,1760251164.0,2,AskMechanics,1760383989,2025-10-12 06:39:24,2025-10-13 19:33:09,kdilly16 (Score: 1): IMGUR https://imgur.com/gallery/head-gasket-diagnosis-sVXGT5j
1o4hvkg,My car is leaking something…,My car is leaking something. Seems like oil but not sure. Also when I’m driving for a while I can feel like a burnt smell. It does not smoke but I can feel the smell coming out. I already checked the oil level and is good. The oil transmission in a little black but I don’t believe is that. Any other thing I should check ,1,1760250540.0,5,AskMechanics,1760383989,2025-10-12 06:29:00,2025-10-13 19:33:09,"SamCamJaik1 (Score: 2): That could either be oil the spilled when the oil change was done, or your valve cover is leaking a bit. Or both.

None (Score: 1): It appears to be engine oil, either old spillage because the filler is on an angle or the valve cover gasket is old and brittle and starting to seep. Your smelling oil that is burning off the manifold, it doesn't always show smoke"
1o4hlph,Am I being ripped off?,My mechanic told me to change the drive belt. I did change it but it seems it still good enough for miles. Am I being ripped off here?,103,1760249514.0,118,AskMechanics,1760383989,2025-10-12 06:11:54,2025-10-13 19:33:09,"la_mecanique (Score: 140): Modern drive belts often dont show wear. The questions should be, how old is the belt, has it been exposed to something out of the ordinary, or is some other accessory being replaced and this being replaced also as a matter of good practice.

lerekt123 (Score: 65): You gotta understand that sometimes old belts might not look old, but a mechanic will everytime look bad if hes wrong and you get stranded.

So many mechanics play it safe, if there is nothing in the service book, and if going by that the interval is more than exceeded, they will recommend a belt just like they recommend spark plugs if there is a good chance they are old but dont give any problems yet.

Also modern belt materials will not show their age like they did 30 years ago. When they are done they can just snap.

Also storing used belts around to be used again is unwise."
1o4g3xz,Can someone help me find this filter ? it,Need a replacement of this filter it’s a K&N but can’t seem to find anything online. ,1,1760244162.0,4,AskMechanics,1760383989,2025-10-12 04:42:42,2025-10-13 19:33:09,"Clockwork54 (Score: 1): consider getting a cleaning kit instead unless their is a literal hole in the side of it canadian tire if your in canada sells a k&N cleaning kit

GotEHM9 (Score: 1): Closest one I found to it. Looks like an RU model  [Link](https://www.autozone.com/intake-system/custom-air-filter/p/k-n-ru-0960-specialty-air-filter/93425_0_0)

Edit: [This one](https://ebay.us/m/EJgSCf) looks like yours"
1o4fqov,Just bought a ‘17 MDX with 81k miles. Should I get the extended warranty for $3k?,"I just bought a used ‘17 MDX in great condition from a local Acura dealership. They’re offering a 5yr/80k mile warranty bumper to bumper for $3000. Should I take it? Do I save the money for the few repairs I’ll probably face over the next 5 years?

For context, this is a second car for around town. I doubt it will get over 5000 miles per year. ",0,1760242884.0,15,AskMechanics,1760383989,2025-10-12 04:21:24,2025-10-13 19:33:09,"SensitiveWarning4 (Score: 3): What is the deductible?   So it till take it to 161k?  If so it’s a great deal

geof2001 (Score: 3): 80k from the time of purchase or 80k on the current odometer reading.  Ask specifics. Sounds like a rip off imo"
1o4fa2s,CVT transmissions,Why are CVT transmissions so bad? I hear a lot about trying to avoid vehicles with CVT transmissions but never really understood why ,0,1760241365.0,12,AskMechanics,1760383989,2025-10-12 03:56:05,2025-10-13 19:33:09,"Wild_Ad4599 (Score: 4): Because they need regular (about every 30k miles) drain and fill service, and people don’t ever do it or when they do ask a tech about it, the tech will tell them not to, or that it’s bad for the transmission. 

It’s the same for conventional automatics as well but they don’t require service as often and they tend to fail slower, unlike a CVT which has a catastrophic failure with no redundancy (the chain/belt.

I_-AM-ARNAV (Score: 4): So people don't maintain them as needed. And when they die they're like yo wtf?"
1o4f0qe,MTF Fluid smells burnt when draining,"I decided to drain and refill my transmission fluid on my 7th gen civic as preventative maintenance. I’ve only done just over 30,000 miles since my last drain, but it’s been about 2 years and I get an occasional grind in 2nd gear. When I drained the fluid it was clear as Honda MTF fluid is, not dirty at all, but it smelt very burnt. The smell was potent as hell, and it freaked me out thinking there is something wrong with my transmission. I replaced it with GM synchromesh to see if that prevents my occasional 2nd gear grind, but why would it smell burnt while as water? Is this normal with transmission fluid, or does it mean a potential issue is going to present itself in the future? ",2,1760240499.0,4,AskMechanics,1760383989,2025-10-12 03:41:39,2025-10-13 19:33:09,"FallNice3836 (Score: 2): Ya it can smell awful. Even gear oil can smell like it was overheated. 

Don’t stress it, even if there was an issue the only thing you can do is replace the fluid and you already did it.

DodoDacobrakai (Score: 2): Gear oil is always stank"
1o4dxxg,What ton jackstand for a class 8 semi,I just need on jackstand to hold the passenger side steer up. What ton jackstand do I need?,3,1760237034.0,7,AskMechanics,1760383989,2025-10-12 02:43:54,2025-10-13 19:33:09,"awesomeperson882 (Score: 2): What’s the actual weight of the truck? A pair of 10-ton stands would probably do you just fine for the steer axle (would be rated to hold 40,000lbs across the 2 stands). 

I work on school buses right now, they weight in at 33,000 total weight (give or take a few thousand depending on the model and year) and when we put em up for safeties and take all the wheels off, we do 2 10-tons in the front and either 2 10-tons under the rear axle, or 2 15-ton frame stands under the frame at the very back.

awesomeperson882 (Score: 1): What’s the actual weight of the truck? A pair of 10-ton stands would probably do you just fine for the steer axle (would be rated to hold 40,000lbs across the 2 stands)."
1o4dki1,What’s on my spark plug?,"It’s silvery and shiny. 98 forester with an ej22 motor. Engine runs good for 340k miles, hoping it’s metal from the engine but I’m not sure what else it would be, maybe poorly applied anti seizing? Appreciate the help.",1,1760235874.0,5,AskMechanics,1760383989,2025-10-12 02:24:34,2025-10-13 19:33:09,"photovoltaicgod (Score: 1): Crystallization from ethanol gas

photovoltaicgod (Score: 1): Try a compression check could be indifferent compression?"
1o4di6p,Are these clips on right? Ram 1500 2019,"I can’t seem to get the pads in any other way, they just seem a bit off but the pads aren’t moving and they’re in there snug",2,1760235676.0,10,AskMechanics,1760383989,2025-10-12 02:21:16,2025-10-13 19:33:09,"-NOT_A_MECHANIC- (Score: 3): Yup. That said, They need to be able to move freely. With the caliper bracket off the knuckle, you should be able to push the pads back and forth freely - especially since greased. If you can’t, you need to file down the bracket."
1o4daku,Take mechanic's 2 step GDI cleaning or just use some Techron?,So title pretty much says it all. I have a 70k mile 2022 Tiguan that just got a quote for its 80k maintenance. Included was the 2 step GDI fuel and induction cleaning for $128. Is this worth doing at this mileage or is using some techron complete every few thousand miles pretty much fine right now? Thank you in advance for the advice!,1,1760235011.0,13,AskMechanics,1760383989,2025-10-12 02:10:11,2025-10-13 19:33:09,"My-Real-Account-78 (Score: 5): GDI means the cleaner never touches the backside of the intake valves. At 70k miles you need mechanical cleaning with walnut shells. There are some ""top end"" cleaners that slowly get introduced through a vacuum hose in the intake manifold but I think those are best used as a regular maintenance item to help prevent carbon buildup and they're not good at removing large deposits of existing.

HedgehogOpening8220 (Score: 2): Those injection cleaners dont work on carbon fouled valves. Best bet would be to do a walnut blaster cleaning."
1o4d48a,2020 Toyota Corolla in limp mode after jump start - several errors on dash - any advice?,"My battery died while in a Costco parking lot. I called a jump start service and the guy jumped the battery so the car starts now. But after the jump, I get all these messages on my dashboard and it won't go faster than 15 mph (apparently this is called ""limp mode"").

Error messages on dash:

\- Parking brake malfunction  
\- Brake hold malfunction  
\- Check engine  
\- Secondary collision brake system malfunction  
\- Pre-collision system malfunction

I inquires with chatGPT, grok, copilot, etc. and they tell me stuff like use an ODB-II scanner, reset the battery, replace the battery, etc. etc. but I am not very car savvy or good with my hands.

Is there a to solve this quickly by doing a couple of quick checks to figure out the issue and determine whether I can handle it myself? Or should I just have it towed to a mechanic?

Also if anybody knows of a good car shop in the North Austin area, I'm all ears.",1,1760234471.0,2,AskMechanics,1760383989,2025-10-12 02:01:11,2025-10-13 19:33:09,"bpsmicro (Score: 2): Are you still on the original battery? You're probably due for a replacement. Typical lifespan is about 4'ish years, give or take (some get more, some less).  
At the very least, I'd have it tested, but if it were me, I'd swap out a 5-year-old battery and be done with it.  
If you're lucky, having the battery disconnected for the time it'll take to swap it out will clear the codes, and you're done. If not, you'll need a decent OBD2 gizmo to clear them."
1o4czil,Damage to sons car,"My son was in a wreck yesterday and is car is not drivable. Can anyone tell me what wr may looking at repair wise? You cannot tell from the pics, but the tire is tilted as well. Thanks in advance!",51,1760234071.0,23,AskMechanics,1760383989,2025-10-12 01:54:31,2025-10-13 19:33:09,"logatronics (Score: 42): Mechanics here: ""Looks like an older car. Probably totaled.""    
     
Me: ""That is only from 2008. That thing is brand new and only...17 years old......crap.""

aFreeScotland (Score: 40): I can tell the tire is tilted from the pics. It's likely totalled"
1o4cu4k,Why ?,It’s 2016 ford edge  battery spewing smoke smells like something it’s dead what could be the cause that make the battery do that and is it even safe to drive it like that I don’t think it is. I told her not to drive it.,12,1760233608.0,30,AskMechanics,1760383989,2025-10-12 01:46:48,2025-10-13 19:33:09,"supersonicelephant (Score: 15): Sounds like it has a bad/shorted cell, get a new battery

One-Airline-1341 (Score: 10): Replace battery it's cracked probably or shorted internally maybe."
1o4cp13,What is this part that snapped off on the driver side front tire?,Was told it’s not that serious but I’d still like to fix it as soon as possible. Can anyone tell me the name of it?,2,1760233181.0,6,AskMechanics,1760383989,2025-10-12 01:39:41,2025-10-13 19:33:09,"shiestyblue (Score: 8): Front sway bar end link, they are pretty cheap and easy.

firelephant (Score: 2): Blue tooth sway bar link"
1o4ckfb,Oil filter complaint,"Not my picture, but I’ve got a 2017 Pilot where the oil filter is right over the control arm like this. What do yall do to keep oil from pouring onto the arm? Makes a big ole mess. Or do you care enough to?",1,1760232784.0,14,AskMechanics,1760383989,2025-10-12 01:33:04,2025-10-13 19:33:09,"Hazlitt_Sigma (Score: 2): When I worked on cars, floor mats. Fold it up and stick it in there under the filter and direct it at the drain catch. 

If you do it right, no big mess. 

If you do it wrong, maybe bigger mess.

-NOT_A_MECHANIC- (Score: 2): That’s the neat part, you don’t. Hondas suck in that regard. Wipe it down after and now it has rust prevention…"
1o4cgs3,Brake Pad Inspection,"Hi everyone. I’ll keep this short and simple, but I could use some help. I just got some brake pads in the mail, but it looked like they were just thrown in the box and has damage to them now. This is the only one that’s damaged, is this still usable? Or is it safer to not use them? ",1,1760232481.0,3,AskMechanics,1760383989,2025-10-12 01:28:01,2025-10-13 19:33:09,Hot-Answer-4662 (Score: 2): Its fine
1o4ce3s,Broken ignition coil connector clip after replacing spark plugs — can I use zip ties?,"After replacing my spark plugs (Hyundai Elantra GT 2014), a couple ignition coil connector clips broke. They still fit but don’t click in place. Can I secure them with zip ties, or will heat/vibration cause issues? What’s the best quick fix?

https://preview.redd.it/nqnzp8q22luf1.png?width=1124&format=png&auto=webp&s=6503ee50caed35e986953d56d673af007781f6a6

",1,1760232254.0,4,AskMechanics,1760383989,2025-10-12 01:24:14,2025-10-13 19:33:09,"-NOT_A_MECHANIC- (Score: 2): A couple? One’s a mistake, a couple and you’re doing it wrong. Sufficiently tightened zip ties will work. In the future use more care, or - if the harness will allow you to, just take the coil out with the connector still on.

None (Score: 2): A ziptie should be just fine, in the future that gray clip is supposed to come out before you can depress the black clip to release it. You'll be fine with the zipties but be a little more careful in the future ( if you keep it that long)"
1o4c8zy,Dumbest Question,"Alright mechanics, I’ve got one of the dumbest questions of all time (likely).

My girlfriend despises that my fuel cap uses a button inside to pop open, as she’s used to her car having the spring on the fuel door itself to access the cap.

Is there any way at all to add this onto a vehicle? I doubt it without doing some shoddy Home Depot type work, but she’s asked me enough times that it’s worth at least looking into 😅 thanks for any pointers or truths. ",1,1760231830.0,8,AskMechanics,1760383989,2025-10-12 01:17:10,2025-10-13 19:33:09,"Comprehensive-Bet56 (Score: 6): Run

shiestyblue (Score: 2): Had a 04 Altima that had this, i can’t remember exactly but I think I either bent the mechanism that locks the cap so I can just open/close it. Or there’s a door latch looking thing you could cut off, can’t remember what I did exactly"
1o4by6a,Fuel leaking through underbody?,"The vehicle is a 2024 Volkswagen 1.5 TSI…. the damp area has a strong smell of fuel.. could it be a fuel line leak? Will it be covered under the warranty? (Car is 1 year and 4 months old, and has done 19,000km)",1,1760230909.0,2,AskMechanics,1760383989,2025-10-12 01:01:49,2025-10-13 19:33:09,GOLDINATORyt (Score: 2): It will be covered under warrantee.
