id,title,selftext,score,created_utc,num_comments,subreddit,scraping_time_utc,created_datetime_utc,scraping_datetime_utc,top_comments
1nwk6re,Missing keys need new ones,"I have 2002 kia rio and need keys to sell it, the problem is there is no auto-locksmiths around me, and the dealership is 2 hours away. Is there any way to get it started to drive it to the dealership as the keys are chipped so i have got to bring them there, any help is appreciated, thanks.",0,1759449590.0,4,MechanicAdvice,1759519967,2025-10-02 23:59:50,2025-10-03 19:32:47,keep_username (Score: 2): It does not have transponder keys.
1nwk0yk,At my wits end... HELP!,"2015 Mazda CX-9 Grand Touring 3.7

Battery light is on.
It was on for a couple weeks.
Then the dash lit up and we started chugging, so we stopped at Advanced Auto. They tested the battery on their big tester and readings were all over, so easy fix. 
Battery light back on halfway home.

They also checked the alternator. It passed. Went to Autozone the next day. Alternator passed again.
Took it to Midas. 
Alternator running 1/2 volt low.
Replaced alternator and serpentine belt.
Battery light back on 5 days later.
Alt 14.1
Battery 12.6

Checked fuses at some point in there, left headlight fuse was bad. It hasn't burned out since being replaced.

Bro in law brought fancy $10k computer.
Cleared codes - Battery light next day. 
TPS sensor code.
Replaced throttle body with TPS.

Battery light off.
3 weeks later... battery light back on. 

Bro in law is bring the computer back tomorrow.

Any advice is greatly appreciated.",1,1759449154.0,4,MechanicAdvice,1759519967,2025-10-02 23:52:34,2025-10-03 19:32:47,"Useful-Ad-1550 (Score: 3): Maybe some corrosion on the cables or a ground wire or cabling issue. Some reason voltage not making it back to the battery from the alternator since it should match the voltage being generated by the alternator at the posts when running.  Clean the terminals and post as well as checking the ground connection to the chassis and cleaning with wire brush or other.

Also check the cabling or wiring from the alternator to the battery.

No-Care6289 (Score: 2): Time for some voltage drop testing on all the major grounds and powers"
1nwk0cd,Dust boots ripping just over two years with only daily driving commute to work and back 10miles a day,,1,1759449109.0,8,MechanicAdvice,1759519967,2025-10-02 23:51:49,2025-10-03 19:32:47,"stewport5 (Score: 1): Should they be replaced?

ingram2197 (Score: 1): You could replace just the boot… but you might as well replace the whole thing."
1nwjs7h,"Looking at buying a 2018 Honda accord Sport 1.5T for 15,500-16,000 w/ 109k miles. Are they reliable?",,1,1759448483.0,4,MechanicAdvice,1759519967,2025-10-02 23:41:23,2025-10-03 19:32:47,"wormwormo (Score: 1): $17k for a 6 digit mileage vehicle?

Massive-Friend4728 (Score: 1): The 1.5t is known for having problems try to find a 2.0t or a hybrid accord as those usually have less problems."
1nwjpcl,Need help identifying a part pls,I have a 2007 4.6 v8 f150 with a radiator leak coming from a rubber seal from a hard line on the top right side of the radiator (looking from the front into engine bay). I think it’s an ac like or trans cooler line but tbh I don’t know. Can someone help me identify this seal or line so I can replace this seal? Thanks in advance. ,1,1759448264.0,5,MechanicAdvice,1759519967,2025-10-02 23:37:44,2025-10-03 19:32:47,"Vic_Pirelli (Score: 1): It's a transmission fluid cooler pipe.

Is it leaking coolant or transmission fluid?

The is an o-ring inside the fitting where the pipe inserts.  This o-ring will fail and leak leak transmission fluid.  You'll need a 3/8"" disconnect tool to remove the pipe.  Dorman sells a pack of the replacement o-rings, or you can replace the whole fitting.

There is another o-ring on the threads where the fitting screws into the radiator.  It actually goes into the transmission fluid cooler in the radiator.  If that o-ring fails it would leak coolant, but it's also possible there are micro cracks in the plastic at the fitting leaking coolant as well.  You can remove the fitting with a socket. 

You'll need to disassemble the pipe and fitting to find the real source of the leak.  At least you won't loose a lot of coolant or transmission fluid since it's close to the top.

You will most likely need to replace the radiator if it's leaking coolant at that fitting."
1nwjjli,"Exhaust leak in catalytic converter, should I pay to replace it + exhaust manifold?","Before I go into details, I'm new to driving/cars and I'm trying to learn as much as possible about my car, especially since it got pretty messed up in the last week lol.

Ive been driving a ford 2012 escape and its been great until I hit a rock on a dirt road last week. It ended up crushing a hole into my front exhaust pipe and breaking the O2 sensor. I just got that fixed at the mechanic but as they were putting in a new pipe they noticed that the impact of the rock shifted the position of the catalytic converter and created a crack somewhere (I think the cat) for exhaust to leak out. The cars a lot louder now when it starts up but the guy says as the engine/metal warms up, itll fill the crack up and the car will be good to go. But another guy told me you might want to avoid idling so my car doesnt fill up with gas soo I'm not sure which guy to believe. 

The initial cost was $650, but to completely fix it (cat and manifold) its another $1600. So in my eyes that's crazy and I'm not sure if I want to pay that.

But I'm wondering how bad this damage really is for the car, does it contribute to overheating, misfires, etc and is it worth it to get it fixed? Also is there a short term solution I can try to get me through the winter? The winters are really tough where I'm at and I just want to make sure I can reliably get from place to place. I dont know really anything about cars so any info would be sweet.  
",1,1759447815.0,2,MechanicAdvice,1759519967,2025-10-02 23:30:15,2025-10-03 19:32:47,"Pavo9 (Score: 1): Not a mechanic but the catalytic converter catalyzes harmful chemicals into water, nitrogen, and co2. If there's a crack, these chemicals could leak out and make you fail an emissions test. I can't think of another way it would damage your engine as the gas that would leak out is already exhaust. You can always take it to another mechanic, possibly someone who can weld, to fix it."
1nwjchy,How to choose- wheel bearing,"Going to replace rear wheel bearing on my 2014 accord.   

Which brand would you recommend?

",24,1759447287.0,70,MechanicAdvice,1759519967,2025-10-02 23:21:27,2025-10-03 19:32:47,"Ok-Horse5950 (Score: 70): Timken or SKF, would be my two choices. 

Elegant-Ninja6384 (Score: 30): Wow - thanks for all the quick responses.  By committee I am going with Timken."
1nwj5a4,"Tie rod from hell. Cannot get it to release. Tried hammering, heating, and the extractor tool with no luck. Any advice?",,224,1759446764.0,236,MechanicAdvice,1759519967,2025-10-02 23:12:44,2025-10-03 19:32:47,"WyoPlays (Score: 537): https://preview.redd.it/3ges88vxassf1.jpeg?width=2252&format=pjpg&auto=webp&s=2a8ca1f10ecbdecfff6bd3ea8313e7271498c7f7

Update: Walked away for a few minutes and the thing popped off with pressure on it from the removal tool.

I guess a watched pot never boils or something stupid like that.

DisgruntledEngineerX (Score: 64): Put the jack under the stud and jack it up then hit the knuckle with a sledge hammer repeatedly."
1nwj0km,Need help finding the right castle nut.,"I opered a part and it came with the wrong castle nut. The manufacturer (A Premium) says they don't sell the castle nut separately. I went around to auto stores but they all say they don't have any big enough. Threads fit but not long enough. I can't get an alignment done unless I get them. I ordered ones from Rock Auto for $4 on the off chance they will fit. But just in case where can I find these.

Pictures included.
And yes, my rotor is being replace along with the caliper that is stuck causing the scrapes you see in the picture.

Car is: 2006 Hyundai Sonata GLS 3.3L V6",1,1759446421.0,4,MechanicAdvice,1759519967,2025-10-02 23:07:01,2025-10-03 19:32:47,"dastardlydeeded (Score: 2): Go to a local junk yard and pull one from another car.

hazard2k (Score: 2): It looks like the threads are right, so if you can't find a match maybe you can use some washers under it until it lines up with the cotter pin"
1nwivz3,Repair shop says Head Gasket is shot,2003 Mitsubishi Montero Limited. Have white smoke coming out under hood after driving a distance about 8-10 minutes. Did coolant pressure test and Constantly loosing pressure. No smoke in exhaust or milky green slime in oil. Also has an oil leak. He says it’s not worth it to fix. I have another 15 months till I’m set up to get a new car loan. How costly? How much time do I have if I drive short distances before engine fails?  Any advice is much appreciated. ,1,1759446089.0,6,MechanicAdvice,1759519967,2025-10-02 23:01:29,2025-10-03 19:32:47,"Odd-Association-2210 (Score: 1): How much time is purely up to how lucky you are. It can be tomorrow or it can be a year until your engine goes boom. I had a lady who drove on a blown headgasket for a year and a half (about 15000 miles) She just lived with the misfire.

Dazzling-Past6270 (Score: 1): Was it a coolant pressure test?  
If yes, where is the coolant going?
Head gaskets often leak coolant into a combustion chamber but that would cause white smoke / steam out the tailpipe.  Steam in the engine compartment could be a leaky hose or radiator.  So try to figure out where the coolant is going. Again i am assuming the cooling system is where you are loosing pressure.  At this point there really isn’t sufficient information to help diagnose the problem or to provide much help regarding the solution.  In the event that the head is leaking coolant into the engine compartment; I would try adding a good block seal type coolant stop leak as a temporary fix."
1nwiql6,"Steering gear shipped with what looks like power steering fluid. Manual calls for ATF +4. Should I try to drain the steering gear, or is it OK to just fill the rest of the way with ATF +4?",2017 Jeep Compass 2.4 L DOC MK,1,1759445702.0,3,MechanicAdvice,1759519967,2025-10-02 22:55:02,2025-10-03 19:32:47,Max-Payd (Score: 1): Just drain and fill it with the correct fluid. Otherwise you'll be doubting yourself the entire time
1nwihdi,What is this?,I dropped the transmission pan on my 2003 Dodge B1500 van with a 318 and a 46RE transmission to change fluid and filter and found these metal pieces stuck to the magnet. What are they? ,1,1759445038.0,9,MechanicAdvice,1759519967,2025-10-02 22:43:58,2025-10-03 19:32:47,"jimmyjlf (Score: 2): Looks like a snap ring/lock ring. Don't drive it

Nice_Mousse334 (Score: 2): looks like what’s left of a snap ring"
1nwi25q,Best aftermarket motor mounts?,"My 2006 corolla needs motor mounts pretty badly I’ve been putting it off. Toyota wants $1,000 for 4 mounts on a $4,000 car I can’t swing that. I’ve been pricing around eBay and found some oem in the box mounts for around $600 ish total. The question is there a good aftermarket brand I can try instead? I’m a mechanic I hate using aftermarket stuff I really do but swinging that much money on my daily just doesn’t make much sense. Any advice is appreciated thanks! ",1,1759443933.0,5,MechanicAdvice,1759519967,2025-10-02 22:25:33,2025-10-03 19:32:47,"svtxrn (Score: 2): Only oem

MycoComa (Score: 1): Rock Auto has several [complete kits](https://www.rockauto.com/en/catalog/toyota,2006,corolla,1.8l+l4,1432846,engine,motor+mount+kit,11844) for under $200"
1nwi0hm,Is she cooked ? Need advice if I should find a new van ?,"Have lost some performance on engine, the turbo is boosting, there is some blow by on the diesel engine (video) Transit van is 2016 and almost 290,000 km",6,1759443816.0,12,MechanicAdvice,1759519967,2025-10-02 22:23:36,2025-10-03 19:32:47,"Persified (Score: 4): If by cooked you mean HOT then yeah it looks pretty fuckin hot

Inmyelement__ (Score: 3): Have you checked the pcv valve and did an oil change?"
1nwhzvu,What's this sound during startup?,"My 2005 f150 occasionally is making a horrible noise when I start it, before running / idling as normal. Video with audio attached. Any help diagnosing would be appreciated. ",2,1759443776.0,3,MechanicAdvice,1759519967,2025-10-02 22:22:56,2025-10-03 19:32:47,"fallout76sucks1 (Score: 2): Probably loose timing chain, would I be correct to assume its a 5.4?"
1nwhy4x,Why no ticking?,"When I touch the first three boots I can feel the tick ticking of a working ignition mechanism.  This fourth one though, I don’t feel anything.  Just feels dead.  What gives?",2,1759443657.0,17,MechanicAdvice,1759519967,2025-10-02 22:20:57,2025-10-03 19:32:47,"Specialist-Sense-689 (Score: 4): Coils don't tick. Injectors do.

Mystik989 (Score: 1): Spark plug in fourth cylinder has oil on it- cleaned it as best as I could and still no ticking.  

P.s- no codes, no misfire"
1nwhxza,Where do i put my car oil after an oil change?,"After changing the oil, where do i put the old oil? ",1,1759443647.0,14,MechanicAdvice,1759519967,2025-10-02 22:20:47,2025-10-03 19:32:47,"No-Care6289 (Score: 4): You can put it back in the container. The new oil came in and then look up where to dispose of it in your town or city.

striykker (Score: 3): Some municipal dumps have a waste oil collection. Call your local dump and ask where."
1nwhuob,Did I overpay?,I have a 2006 Ford Ranger. I had the following work done. Im wondering if its a fair price or too high? Im located in Austin Texas. ,1,1759443421.0,4,MechanicAdvice,1759519967,2025-10-02 22:17:01,2025-10-03 19:32:47,"chinkysweat (Score: 2): Maybe on the evap canister you couldve done yourself. I live in Austin too and this is pretty decent pricing hopefully they did good work, did you get the mileage on that used differential?

armankordi (Score: 1): That's pretty spot on for a diff replacement. They have to remove the entire rear suspension to replace it especially on a solid axle truck."
1nwhshs,Best oil for CR-V Gen 1 (Mineral or Synthetic),"I recently took over my late father’s CR-V Gen 1, and I want to keep and maintain this car because of the memories attached to it. I’ve mostly driven modern cars before, so this will be my first PMS on an older vehicle.

My mechanic strongly recommends using mineral oil, saying synthetic could cause sludge buildup or even issues with the piston rings on high-mileage engines. At the same time, I’ve read that some owners still prefer semi or full synthetic for better protection.

So I wanted to check with fellow CR-V owners here:

Do you stick with mineral/conventional oil?

Has anyone run full synthetic long-term on a high-mileage Gen 1 without problems?

What brands/grades do you personally recommend?


Thanks in advance! Just want to keep this old workhorse running smooth.",1,1759443276.0,4,MechanicAdvice,1759519967,2025-10-02 22:14:36,2025-10-03 19:32:47,"armankordi (Score: 3): Your mechanic is insane. 

I had a 97' CRV, and my 90' civic has a CRV engine swapped into it (1998) Both get 5w-30, full synth high mileage from Walmart. (both engines had 75k miles)  


I own/have owned several pre-2001 Hondas (mostly civics) and have used full synthetic on all of them. Anything under 150k, full synth 5w-30, anything over 200k got 10w-30 full synth high mileage. I pulled apart my 1990 civic's original engine and the internals were (relatively) clean even with 284k on them. Compression was 185psi on all 4 cylinders as well. (head gasket is what took it out; pre-95 Honda engines used an inferior head gasket design)"
1nwhkac,Stupidity,"Hello, this is about the stupidest thing I have ever dealt with. I bought a battery in the middle of winter last year that was 50CC larger than my car calls for and it’s not holding a charge. Now Walmart is declining the warranty because of this. I bought an “EverStart 34 Plus” 
I’m gonna go back in tomorrow. But I wanna make sure I tell them the magical vehicle they need to hear that takes this size/CCA",11,1759442720.0,21,MechanicAdvice,1759519967,2025-10-02 22:05:20,2025-10-03 19:32:47,"dastardlydeeded (Score: 14): I would raise hell and say ""this is what you sold me. I can't help if you handed me the wrong one."" 

This will probably work.

armankordi (Score: 7): If it's a group 34 battery(and not a 34F or 34insertletterhere) just look up a list of vehicles that use Group 34 batteries and tell them that.  
I.E Jeep Wrangler (JK models), Liberty, Toyota Tacoma (2nd and 3rd generations)"
1nwhcwl,Fuel smell well in idle on my 2002 Honda Accord EX,I just got this 2002 honda accord ex and when it is sitting in idle you get a strong fuel smell. Well driving it goes away any advice looked up issues and some say fuel injectors and or fuel rail? What replacement parts do you guys prefer? Looking for options to fix and replace parts. ,1,1759442240.0,3,MechanicAdvice,1759519967,2025-10-02 21:57:20,2025-10-03 19:32:47,ottomanOG (Score: 1): I had that for me it was a exhaust leak at the manifold or flex pipe area
1nwh9os,can anyone tell me where the date code is on this?,,2,1759442018.0,4,MechanicAdvice,1759519967,2025-10-02 21:53:38,2025-10-03 19:32:47,"xMebesx (Score: 2): S020P


Feb 2020

JesseKFK (Score: 1): Check the sides of the top"
1nwh8mw,Is it the alternator? 2007 mustang v6 4.0 275k miles,"I have excess corrosion on my negative terminal,an increasingly shaky start, battery died with 1 day of non use with a new battery, Bluetooth randomly disconnects, no ac I need to check the voltage but am not sure how to do that for anything other than the battery.
I should point out the only reason I'm asking is because I don't know if I'm just looking surface deep and if there's another solution I'm overlooking so if there's another option like a parasitic draw and even then I have no idea how to find the right 1",1,1759441946.0,4,MechanicAdvice,1759519967,2025-10-02 21:52:26,2025-10-03 19:32:47,"Rebeldesuave (Score: 1): So you installed a new battery and it died in less than a day? 

Did you have your alternator and charging system checked?

Ravenblack67 (Score: 1): I suspect the alternator.  Check the wiring from the alternator to the battery and verify no damage.   You may need a charging system check.  If you have a multimeter and battery charger, charge the battery and look for 12.6 volts engine off.  Start the car and look for 14 volts or so."
1nwh7pv,Vehicle Maintenance Frequently,"So I work from home 3 days a week and goes into the office once a week (I work four 10s) and my work is a 2 minute drive away from my house, so I really don’t drive my car that much. 

I drive a 2013 Toyota RAV4 that I inherited from my dad. Since I don’t go into work that often, I hit the 5k miles mark for a car maintenance every 1.5 years or so. Went to my 95k mile maintenance today and the guy told me I should be coming for a maintenance every 6 months regardless of whether I reach 5k miles or not. Is this true or are they trying to scam me :D 

They also said a whole list of stuff that they recommend I do for my service appointment today that’ll total out to be about $900, and I told them to just do the oil change and rotation today, and I will look at their other suggestions before making a decision for further maintenance. I know some of it are really easy stuff I can just do at home like cabin and air filter. So I will post them in the comments when I get the paperwork later and if yall can tell me whether some of them are easy shit I can just buy from O’ Riley’s to change myself lol 

Thanks! ",2,1759441884.0,8,MechanicAdvice,1759519967,2025-10-02 21:51:24,2025-10-03 19:32:47,"Shot-Rope9510 (Score: 4): Once a year is probably fine, but I wouldn't stretch it past that. If your normal work commute/errand running doesn't do it, just make sure you have at least one time a week where you're getting the car up to regular operating temperature but if it already does you're golden. A sitting vehicle gathers moisture and it doesn't sound like it's sitting for more than a few days at a time so you may be fine. I would not recommend waiting 1.5 years for the next oil change, though. 

Shops don't make money telling you your car is 100%, they upsell to make money and simple maintenance items are big money makers. They charge a premium price for items that take seconds to minutes to do. You can absolutely do the air filters and wipers and stuff like that on your own

daquariusx (Score: 3): I’m not a mechanic and I would say that 6 months is overkill. I think a yearly basis would be fine. I would also get a second opinion on the $900 of work they want done. Sounds like they’re hungry."
1nwh1a8,Airbag bolt not coming out,"Car is a 2004 g35 sedan. Im replacing the clock spring and the right bolt came out fine but the left stripped (it’s a weird security torx bolt so i had to use an extractor socket) and it snapped. The bolt is fully loose and free spinning but it isn’t coming out so I’m assuming whatever was holding the bolt in place broke but I’m not sure.
I cant drill it out because the bolt spins along with the drill bit and i cant really pry it out as I’m trying to preserve the surrounding plastic trim. any ideas?
",2,1759441467.0,3,MechanicAdvice,1759519967,2025-10-02 21:44:27,2025-10-03 19:32:47,"Unhappy_Income_7846 (Score: 2): Woah woah woah buddy their sensitive calm down ;)

swaz0onee (Score: 1): Thought about using long nose pliers at all ?"
1nwgs4n,2011 Chrysler 200 Coolant leak from Radiator,"So bear with me, I don’t know much about cars or terminology. My car is leaking coolant and it just started a few hours ago. It’s dripping about 2 drops per second. I saw exactly where the leak was coming from and I even had my dad look at it. At first he thought it was one of the hose clamps. Ruled that one out they’re just fine. Then he thought it was the hose itself but ruled that one out too. My dad (who is not a mechanic but has some basic knowledge) said he thinks the thing holding the radiator cap and neck is cracked and that’s where the coolant is leaking from? Or something like that? It’s where the 2 clamps meet. I’m taking it in tomorrow to get fixed but I just wanna know around how much I should be paying for that? And also since he didn’t know the right name for it does anyone know what it’s called? ",1,1759440863.0,4,MechanicAdvice,1759519967,2025-10-02 21:34:23,2025-10-03 19:32:47,"First-Oil-1428 (Score: 1): Oh I didn’t know I could add pictures! Here’s a pic of it

https://preview.redd.it/qpwdepv4qrsf1.jpeg?width=4032&format=pjpg&auto=webp&s=0bdc2306ccddbdfbf5f6ad784eab4cdd40e1e62f

CollegeHustle3_US (Score: 1): Looks like the leak is coming from the plastic neck where the radiator hose connects  super common failure point on Chrysler 200s. Unfortunately, if that part is cracked, the fix is usually replacing the whole radiator since the neck is molded into it.

Price-wise, a shop might charge anywhere from **$400–$700** parts + labor depending on where you are. If you buy the radiator yourself, the part alone is often **$120–$200**. Labor is what bumps it up.

Good news is it’s a straightforward repair, so if your shop is quoting way higher than that, get a second opinion."
1nwgoj1,P0420 code after replacing head gasket.,"Hey guys, so I had this abs code and the codes on the scanner pictured come up after this car overheated and I took it to the shop they replaced the head gasket, milled the heads, and put a new timing belt. Anyways I called them and told them about the code and they said it’s nothing major and most cars can be driven for years with this code without any issue. 

A mechanic I know in town immediately said he could have it diagnosed right now and replace the catalytic converter this weekend for $1,100-$1,200 this weekend. 

How common is it for this code to appear after all of this work has been done? ",1,1759440629.0,4,MechanicAdvice,1759519967,2025-10-02 21:30:29,2025-10-03 19:32:47,"Past-Attorney-8197 (Score: 1): was coolant going into the cylinder and being combusted? if so yes, youve damaged your cat in the process, or it  just went with age. Technician A) IS CORRECT - lots of old cars are rockin around with the ol p0420 with no big deal. 

  
if you feel you want to part ways with 1100-1200 to clear the light, that sounds reasonable, cats are expensive.

  
if you can live with it, save your money. clearly you lived with the abs codes before lol"
1nwgo3u,Should the flanges on the exhaust system be movable?,"(2009 Ford Escape V6 4WD)

Why does the top flange appear to be fixed on the pipe but the bottom one doesn't? Is it possible that the top flange is also movable? Because mine is, don't look corroded, and I want to know if it's normal or not

(This is an eBay photo I used as a demonstration)",1,1759440602.0,3,MechanicAdvice,1759519967,2025-10-02 21:30:02,2025-10-03 19:32:47,"kyden (Score: 1): They’re opposite sides of the flanges.  The top part has the donut gasket, the other side of that moves.  The reverse is on the bottom.

MunchamaSnatch (Score: 1): Yes, they are supposed to be detached"
