id,title,selftext,score,created_utc,num_comments,subreddit,scraping_time_utc,created_datetime_utc,scraping_datetime_utc,top_comments
1ndhpg0,Safest way to do a heater core flush?,"1984 sedan Deville, 4.1.

Want to avoid causing any damage. Basically getting no heat at all, has been getting worse over the past few years. ",2,1757518923.0,4,MechanicAdvice,1757619180,2025-09-10 15:42:03,2025-09-11 19:33:00,"TheTow (Score: 5): Id probably start by taking the 2 hoses off the heater core, and find 2 lengths of hose that fit and clamp em on and fill the heater core with CLR for a bit of time with hoses elevated so it will stay in the core. Then just flush it with water for a while from a hose. They make hose adapters to fit it

Realistic-March-5679 (Score: 1): Typically it’s a back-flush unless your service manual says something else. Take both hoses off the heater core, put a length of hose from the inlet to a bucket and a hose to the outlet. Turn the hose on and let it go until it’s clear. If it’s really bad and a new heater core isn’t available I’ve had coworkers take out the heat core, fill it with distilled water and coolant flush chemicals and put it in a vibratory cleaner. I’ve never personally done it but the old guys swear by it…of course they’ve been working together for over 20 years and have had a couple restoration projects in just the five years I’ve been there. So I’m confident enough to mention their technique."
1ndh5br,I pulled off my rear view mirror,"I just got a 2025 Subaru Crosstrek over the past summer and for some reasons, yesterday I decided to pull at the rearview mirror a little too hard and I can’t get the thing on.
I’ve attached pictures, it seems attached by some sort of metal clamp to a washer type thing. 
I have an appointment at Subaru to fix it but I’m hoping the solution could be easier than a long drive and a big chunk of change. 

Thank you",1,1757517698.0,2,MechanicAdvice,1757619180,2025-09-10 15:21:38,2025-09-11 19:33:00,Evening-Bluebird-989 (Score: 2): It click back into place however lots of force required just don’t smash your windscreen
1ndgu60,"Toyota Techs, why am I not certified?","I’ve done all of the maintenance requirements, right? They’re basic, and I got them done quickly. But it says “on track”. Why? My boss says I need to wait for it to update, but I’m not sure. I’ve already waited a little while, it kind of seems like there’s more that needs to be done. It doesn’t say there’s any tenure for maintenance right?",1,1757517016.0,5,MechanicAdvice,1757619180,2025-09-10 15:10:16,2025-09-11 19:33:00,"micknick0000 (Score: 6): https://preview.redd.it/cyskb8fqscof1.png?width=327&format=png&auto=webp&s=d07277f92cc819e43a7794dcd85ebe42ea749dd2

This would be my guess...

Roldan_Rondo (Score: 1): You can call/email your regional MDT (your master techs should have their contact info) and they can expedite the process but the cert levels are updated quarterly. About every 90 days"
1ndgt0x,Are you kidding me? Drivable? Repairable?,"Bought this car for 700 quid, 2 years ago and fixed it up for a daily. No issues recently until this silly goose.

Replaced my upstream o2 sensor around 6 months ago and it came with a 3m cable, as opposed to a 1m one. My car is a Mini cooper, thus small, so, I just coiled it up and zip tied the cable in place.

Whelp my bodge DIY has failed me as the zip ties snapped and sent my o2 cable right into the radiator fan. Fan seems fine, no issues at all but the o2 cable is mangled. No issues with the car... yet. It is only the o2 cable that is damaged, not the car's wiring harness.

Can I still drive around, whilst I wait for a new o2 sensor? a good 3 wires have been severed and are already wrapped with electrical tape.  Or do you think this is repairable w/ soldering?

Edit: Mini Cooper R56 2007, 96k miles. N12 engine.",1,1757516947.0,4,MechanicAdvice,1757619180,2025-09-10 15:09:07,2025-09-11 19:33:00,"micknick0000 (Score: 2): I'd get some weatherproof butt connectors and cut out the damaged sections/excess length...

Just match up your wire colors.

rp55395 (Score: 2): I would use uninsulted butt connectors and marine grade heat shrink. It makes a slightly less bulky repair than the insulated ones. Either way you can significantly reduce the length of the harness and eliminate the roll and zip tie failure waiting to happen…again."
1ndgppr,"2011 Nissan Versa with 126,000 miles. Worth repairing “minor oil leaks” that we didn’t notice? Pics included","We took it in for something else minor. They marked it as “yellow”, (green, yellow, red rating) and he stated it’s a “minor oil leak”

We’ve noticed zero oil dripping, never had low oil- just using this car for short trips  until it’s not worth it anymore 

If fixed:
Replace oil pan gasket (lower) -$200.25
Replace engine valve cover gasket set - $365.27

Total $565.27. 

Is it bad I’m debating not fixing this?

[pics they took and estimate](https://imgur.com/a/osB1TdE)",1,1757516739.0,4,MechanicAdvice,1757619180,2025-09-10 15:05:39,2025-09-11 19:33:00,"Rebeldesuave (Score: 1): Only you can decide if those leaks are worth fixing. 

If you are content topping off oil and are determined to drive this car until the wheels fall off then that's fine. 

If you wind up selling the car you should disclose this to the buyer and tweak your price accordingly. 

Just my thoughts.

Rebeldesuave (Score: 1): Monitor your oil consumption and too off if needed. If you're adding a quart every 1000 miles or less that engine may be tired indeed."
1ndgpa6,Blower motor replacement part,Confused. I know I need to remove the plastic cover but.. how? Watching a YouTube video and the new one I have seems to be missing more than the plastic cover. And I can’t figure out how to remove the cover on the old one. 2006 Honda pilot ,2,1757516712.0,2,MechanicAdvice,1757619180,2025-09-10 15:05:12,2025-09-11 19:33:00,Extrayuhgurt (Score: 1): Just realized it’s the wrong part 🫡 new one is for rear
1ndgnek,"Sonido clack al acelerar tras frenar, que puede ser?","I’m hearing a pop/click noise when accelerating from a stop after i brake. It just makes one pop after the first takoff if you keep accelerating it doesent make it anymore. If you accelerate very gently or brake very gently it doesent do it. Its a Toyota auris hybrid 80000km. All bushings look Good and axles too. I think its the same chasis as the prius gen 3.

Escucho este ruido al acelerar desde parado después de frenar. Suena un clack como si algo se reposicionara. Después de chequear todo no se ve ninguna anomalía.",2,1757516596.0,3,MechanicAdvice,1757619180,2025-09-10 15:03:16,2025-09-11 19:33:00,"SandMountain5228 (Score: 1): I have another vídeo but i dont know to Edit the post

SandMountain5228 (Score: 1): https://youtube.com/shorts/RzeUOL9L63M?si=hvSaEbir-3oi6AFX other vídeo of the noise"
1ndgm6s,"GX 460 Brand new transmission shudder, milkshake damage","200K mile 2012 GX 460, transmission was on its way out. Learned from GX people that these did not come with transmission coolers, many don't change ATF, and they die. Don't know how the PO treated it, but it was slipping all the time, so I ordered a Lexus remanned transmission and had a mechanic put it in. The second time I drove it - on about mile 40 - it shuddered badly on a low-throttle shift from 3rd to 4th. I parked it, intending to do a drain and fill, suspecting the guy had not put enough ATF in. But the level wasn't the problem; a strawberry milkshake came out. PO had replaced the radiator 4 yrs/45K miles ago (date and mileage sharpied on it, thanks dude), but maybe he used a crappy amazon brand. All I can figure is that the new trans had a higher line pressure and ruptured a weak weld in the radiator?

I replaced the radiator and pumped all the ATF out, until it was only new fluid coming out. Took about 12 quarts. Topped it off, ran it for 50 miles, dropped the pan, replaced the filter, topped it off. There was a very small amount of pink in the bottom of the pan, maybe enough to fill the cap of a coke bottle. The magnets left black streaks on the towel, no sparklies or dirt in the fluid.

It still shudders at low-throttle gear changes, especially 3-4. Shifts great if I'm stepping on it, or if I completely let off the throttle.

I don't know transmissions very well. Did the glycol/water ruin clutches? Or did they ruin the TC somehow? is it possible that another few hundred miles of good ATF will clean out whatever pockets of contamination are still in there, or is this 50 mile transmission dead? I can't stand the thought of buying another new one...If I took it out myself, should I just replace the clutches, or just the TC, or both? I think the new trans had a 12 month warranty but I assume it wouldn't cover a radiator contamination like this.

Lots of questions, thank you to the wise transmission people out there.

Photos from the internet/I was too mad to take pics of the strawberry milkshake. It looked just like that though.

https://preview.redd.it/ueqtmfk4rcof1.png?width=1854&format=png&auto=webp&s=cbbe99fb4ed6502e70ca1cc776eab5465dea6877

https://preview.redd.it/3dwd90d6rcof1.png?width=2460&format=png&auto=webp&s=2b737f54be1a48adc35a23e0c993c53b9f6505ac

",1,1757516526.0,2,MechanicAdvice,1757619180,2025-09-10 15:02:06,2025-09-11 19:33:00,"slammick (Score: 1): I don’t have any advice for you but this is brutal - and such an awful chain of events.  Could happen to anyone

I hate aftermarket radiators!"
1ndgkur,"First time changing coolant on my 2016 Accord EX – old coolant was green with residue, new blue coolant looks green?","I’m changing the coolant myself for the first time on my 2016 Honda Accord EX (2.4L), and I ran into something a bit confusing. When I drained the old coolant, it came out green with some residues in it.

I bought genuine Honda blue coolant to replace it, but after pouring it in, it seems to have a green tint? I’m not sure if I’m seeing things, or if it’s reacting with whatever was left in the system.
Is this normal? Should I be worried that the coolant changed color? Did I miss a step when flushing? ",2,1757516450.0,5,MechanicAdvice,1757619180,2025-09-10 15:00:50,2025-09-11 19:33:00,"osh1738 (Score: 2): it’s gonna mix with the coolant that is in the engine block. if you want to fully drain the coolant, leave the engine running while you drain it, but make sure you attach a non-spill funnel when you’re adding fresh coolant so it doesn’t run dry. You can also fill it with water first until it runs dry if you want to be 100% sure you got all the green coolant out

No_Wishbone_799 (Score: 2): Better flush that system!!"
1ndgitc,"Car died while driving, ran after jump but had to be over 2k rpms","My 2005 dodge neon srt 4 died while driving to work the other day. It showed the abs, battery, and airbag light on the dash whenever I was going slow. I noticed it started to stall at idle but it didn't died until about 5 minutes later. No crank and my hazards completely went off after about 4 minutes of waiting for a jump.

I was able to jump start it but by the time I started driving it again(30 seconds), it started sputtering and trying to stall. I was able to make it to work by keeping the RPMs above 2k the whole time because anytime it would be under, the dash lights would pop back up and it would start to stall at idle. 

I bought the current battery in January and replaced the alternator in April. I'm thinking it is the alternator because the battery tested good the day prior. 

Any suggestions on what it might be? If it is the alternator, what brand would you suggest I buy?(Current one was a 150A one from autozone)",0,1757516326.0,3,MechanicAdvice,1757619180,2025-09-10 14:58:46,2025-09-11 19:33:00,"Nada_Chance (Score: 2): Have the alternator tested and all connections examined, as it sounds like you aren't charging the battery when the engine is running. The stock alternator should be fine, what was the warranty on the one you had put in though???"
1ndgc5t,Adjusting e break on honda element,"2011 honda element LX 2.4L, 4 cylinder.  
This is my first time doing rear breaks and I have no idea how to tell if im doing the e break properly. It doesnt seem to make a difference when I turn the cog up or down(i tried turning it a ton in both directions and doesnt seem to make a difference at all). The rotor is extremely hard to turn no mater what...",1,1757515897.0,24,MechanicAdvice,1757619180,2025-09-10 14:51:37,2025-09-11 19:33:00,"Repulsive_Vanilla383 (Score: 9): If you watch close the rotor makes the first quarter inch spin in both directions freely.
If it was the parking brake there wouldn't be that quarter inch of free movement.
I'm willing to bet all of that resistance is just from the AWD drivetrain and not the e-brake at all.

eagleace21 (Score: 3): \*brake

And also I hope you have jack stands in addition to that floor jack holding things up"
1ndfp20,Universal coolant okay for Audi Q3?,"Friend took her Audi Q3 to Valvoline since the ""coolant low"" warning came on. It's a 2024 model only had it a couple years. The guys at Valvoline told her universal coolant can be used and they already put it in. 

Is that true? Should she be worried?

Everywhere I see online is not to mix and to only use Audi manufacturer coolant

Thanks! ",1,1757514405.0,7,MechanicAdvice,1757619180,2025-09-10 14:26:45,2025-09-11 19:33:00,"LongStoryShrt (Score: 3): It does not have to have the 4 rings on it, but it does need to be G13 compliant.  There is one called Pentosin E that is G13.  Its quite a bit cheaper than Audi brand...but there is no ""universal"" coolant.  I'm not sure what chemical mix you have in there now.

connella08 (Score: 4): I would take it back and tell them that universal coolant is not VW/Audi approved and now they need to flush the entire cooling system and fill it with approved coolant free of charge."
1ndflpl,2 new seals later...,"Fitted brand new seals to this old Draper trolley jack. Still leaking, fitted another brand new seal. Still leaking. Any advice?

",1,1757514184.0,5,MechanicAdvice,1757619180,2025-09-10 14:23:04,2025-09-11 19:33:00,"LegitimateAddress414 (Score: 2): If it's dirty,  the oil will keep leaking. Make sure the seal area is completely clean. I'd also clean the strut. Also, put some oil on the seal before installing.

connella08 (Score: 2): is there any pitting, grooving, or damage of any kind to the shaft of the piston? can't seal a low point."
1ndfl9q,Car wont give gas when starting,"My car wont give gas when starting, after idling for around a minute or 2 it can, also an orange light will turn on if i try to give gas. Does anyone have any idea what it could be?
Its an Opel Corsa B 2000 1.2i 16V (65 Hp)",1,1757514156.0,2,MechanicAdvice,1757619180,2025-09-10 14:22:36,2025-09-11 19:33:00,"Whole-Morning9277 (Score: 1): Throttle/fuel sensor issues, sending your car into limp mode"
1ndfjq8,Car wont start. Any idea what it might be? Audi A6 C6 4F 2L TDI 2008,,3,1757514058.0,18,MechanicAdvice,1757619180,2025-09-10 14:20:58,2025-09-11 19:33:00,"Gregory_Kalfkin (Score: 1): Any check engine lights and if so are you able to get the code?

connella08 (Score: 1): almost sounds like maybe a fuel pressure issue. cycle the key on and off a bunch to see if the fuel pump primes. if it starts and runs longer, then its probably fuel. also, scan the ECU for codes. you should have something pending at the very least."
1ndffod,Head warped,"Hey guys just pulling my 5.0 ford Windsor apart for a head gasket, I checked the heads for straightness with a ruler and could fit a 0.002 feeler gauge in the gap, is this too much? Will I need to get them skimmed? Thanks in advance guys",1,1757513800.0,3,MechanicAdvice,1757619180,2025-09-10 14:16:40,2025-09-11 19:33:00,"Realistic-March-5679 (Score: 2): This you’ll need your service manual for, there should be an acceptable range. In my experience that’s fine on every head I’ve ever done, but if you want to be sure you just need to compare to the specification.

Budpalumbo (Score: 1): Have it checked at a shop or machinist with a precision straight edge.  They are usually ground to within .0002.  the cheaper ones to .001.  a ruler isn't good enough."
1ndfdpb,any idea what is the reason for this noise,"does anyone know what could be causing this noise from around the middle of the dashboard, it sounds louder than it really is but it’s constant even when parked",2,1757513677.0,2,MechanicAdvice,1757619180,2025-09-10 14:14:37,2025-09-11 19:33:00,"y_zass (Score: 2): Blend door actuator. Check your different heat settings, see if it stops. You'll be able to figure out which one is the problem."
1ndfb2b,New rotor grinding noise?,"I replaced my brake rotors last night due to shaking under normal or heavy braking, it was just time for new ones. I took my car for a test drive after to make sure all was well and I can hear a noise at low speeds like the pads are still lightly touching the new rotors. Anyone know why this is and how to fix it? The rotors are brand new and the pads are only a year old. Any advice is greatly appreciated. ",1,1757513507.0,12,MechanicAdvice,1757619180,2025-09-10 14:11:47,2025-09-11 19:33:00,"Read_And_Roam (Score: 3): That’s actually pretty normal after swapping rotors. Brand-new rotors and “seasoned” pads don’t always mate perfectly right away, so you’ll usually hear some light scraping or grinding until they bed in. It’s basically the pad material smoothing itself onto the new rotor surface.

As long as it’s not a loud metal-on-metal grind or pulling the car around, it should go away after a bit of driving (a few dozen miles). A proper bedding procedure (several moderate stops from ~40–50 mph, letting the brakes cool in between) helps a lot.

I’d just keep an ear on it. If the sound gets worse, you feel vibration, or it’s still there after a couple hundred miles, then I’d pop the wheels back off to make sure nothing’s misaligned or a dust shield isn’t rubbing. But what you’re describing sounds like the usual break-in noise.

NeoAndersonReoloaded (Score: 2): Sounds like a sticky caliper which wrapped the rotors. Now doing same things. Get a infrared gun and see what ones hot. Or put hand on rim after short drive. Clean and lube caliper thats stuck or by new one."
1ndf2tx,Car stutters forward and back when braking. I've replaced pads/rotors and it persists. What next?,"1996 Lincoln Town Car has had this for a while. When braking, the car will move forward and back as if I'm pulsating the brake pedal. Gets worse the harder I brake. If I do a few hard stops, the issue lessens for a few miles before returning. I replaced my rear pads/rotors and the issue came back within 100 miles.

I'm guessing this has something to do with my rear brakes (as bad front brakes would cause the car to shudder side to side). At this point I'm thinking I have a bad caliper(s) or the mounting surface for the rotor is not true/flat. Any advice?",1,1757512989.0,7,MechanicAdvice,1757619180,2025-09-10 14:03:09,2025-09-11 19:33:00,"A925D (Score: 1): most of the time warped rotors / drums are up in the front.

Ok_Measurement4019 (Score: 1): I would say look more closely at your front. If you are convinced it is the rear remove the caliper and pads and clamp the brake lines closed. Go for a drive and see if it persists."
1ndf1aa,2012 Mini Cooper running loud possible exhaust issue...,"I have a 2012 Mini Cooper 2 door hard top. It has been running louder recently, seemingly coming from the exhaust. Sounds like maybe there could be a hole somewhere in the exhaust, looked yesterday but wasn't able to be very thorough. I haven't noticed any performance issue with it, but I can really tell the difference when I am accelerating, but just starting it up/idling it sounded louder as well. Anyone have any recommendations on how to maybe diagnose this the best way? Just crawling under with a flashlight the best I can do? 

Any help at all is very appreciated, would really like to try and repair this myself if possible. Thanks.",1,1757512893.0,3,MechanicAdvice,1757619180,2025-09-10 14:01:33,2025-09-11 19:33:00,"RudbeckiaIS (Score: 1): First thing check the SAP (Secondary Air Pump) check valve hasn't failed and is not allowing exhaust gases to backflow. The check valve is relatively cheap but eventually it will lad to a SAP failure and that's big money.

If the SAP is fine, check the welding at the catalytic converters (both front and rear). If the welds are just starting to split they may be welded back, otherwise you will need new catalytic converter(s),"
1ndeq5e,Does this frame for the rear tail lights trigger a bad ground/short?,It’s a 2009 corolla le. Back lights stopped working while the car was on,1,1757512148.0,3,MechanicAdvice,1757619180,2025-09-10 13:49:08,2025-09-11 19:33:00,"Level_Restaurant8247 (Score: 1): Huh?

Nada_Chance (Score: 1): Doesn't appear to BUT, you could test the resistance to ground with a VOM (Volt/Ohm meter) yourself to be sure. Should read nearly zero ohms resistance between the terminal and bare metal nearby."
1ndeonv,"My dad’s 2010 F-15 randomly makes a rumbling noise/feeling almost like I’m driving on rumble strips, I’ve checked the wheel bearings but is there a common issue that causes that?",,1,1757512047.0,9,MechanicAdvice,1757619180,2025-09-10 13:47:27,2025-09-11 19:33:00,"VeritasLuxMea (Score: 6): Well its an F-15 so you probably shouldn't be driving it on the road.

chiang01 (Score: 4): should be in r/aviation"
1ndehlj,"Thought it was wheel bearing at first but it looks like the tie rod moves with it, any hints? BMW e46",,1,1757511579.0,3,MechanicAdvice,1757619180,2025-09-10 13:39:39,2025-09-11 19:33:00,"Sophias_dad (Score: 3): Bad tie rod, either inner, outer, or probably both. It doesn't look like the tie rod is moving as much as the wheel, so the outer is suspect. The tie rod itself appears to be moving, so the inner is suspect. (the inner tie rod end also has a ball-joint-ish thing hidden by the steering rack boot)

[edit:] upon a rewatch I think its just the outer tie rod end.

Nada_Chance (Score: 1): I agree with Sophias\_dad on the outer tie rod, get your head behind there and watch the connection while you wiggle the tire."
1ndeesq,What Preventative maintenance do I need to do during an engine swap?,"As the title states, I'm in the process of replacing the K24 on my 2012 Honda Civic Si. One of the exhaust valves took a vacation into the combustion chamber. I've got the motor out, and I'm going to do the water pump, valve cover and oil pan seals, the rear main seal, new transmission parts (flywheel and clutch)...

Should I do motor mounts too while I've got it out? Car has 130k miles on it.They seem to be in good shape, not sure how long they typically last. 
Anything else I'm missing that is good preventative maintenance practice? Thanks in advance. ",2,1757511388.0,10,MechanicAdvice,1757619180,2025-09-10 13:36:28,2025-09-11 19:33:00,"randomredditers (Score: 3): I would do timing components while its out too, cant hurt to do mounts but just depends how hard it will be to do later on with the engine in

1uglybastard (Score: 2): Of the top of my head, check timing, all vacuum lines, front and rear main seals, all coolant/heater lines, valve cover gasket, fuel lines, timing belt if applicable, spark plugs, and water pump.

I heard aftermarket motor mounts for Hondas are trash and to go with OEM. From my experience with aftermarket mounts, this has proved true several times."
1ndedeh,Any Advice will help please car will not crank,"I have this 09 Chevy Cobalt that will not crank I changed the starter checked the alternator and battery its all good, what should my next step be? I don’t have a lot of money so I can’t pay for a diagnostic any advice would be appreciated thank you.",1,1757511290.0,11,MechanicAdvice,1757619180,2025-09-10 13:34:50,2025-09-11 19:33:00,"Late-Stage-Dad (Score: 2): Check your starter fuse.

https://preview.redd.it/taru62peccof1.png?width=960&format=png&auto=webp&s=add2a962963880a32cce8393575b1d13df2483bc

Pretty-Ebb5339 (Score: 2): Diag money is cheaper than parts cannon money."
1nde02x,Timing concerns,So I watched Chris fix video on timing and he has it set to the TDC mark and this video and manual shows to set timing on the red mark? Which one do I do and what’s the difference? ,2,1757510339.0,10,MechanicAdvice,1757619180,2025-09-10 13:18:59,2025-09-11 19:33:00,"Budpalumbo (Score: 3): I would look up the procedure in my manuals, but without the year make and model, can't.

FWIW, I would go by the manual instructions before a youtuber, no matter the reputation.

Ok_Initiative2666 (Score: 1): Set on red mark"
1nddruk,2015 Dodge Charger SXT Engine Noise,"What could this ticking noise be? It happens on start up and when parked with the engine on.

It has 85k miles and is maintained according to the owners manual.",1,1757509766.0,6,MechanicAdvice,1757619180,2025-09-10 13:09:26,2025-09-11 19:33:00,"Have_To_Make_It_Work (Score: 2): Valvetrain noise, could be lifters or the cam phasers. Change the oil and see if it improves."
1nd3bf7,Does anyone have any idea what this sound could be coming from just from watching this video? **recently changed out tension pulley**,,1,1757473880.0,1,MechanicAdvice,1757619180,2025-09-10 03:11:20,2025-09-11 19:33:00,Alpinab9 (Score: 1): Rattle?.... remove the belt and check.... also turn off the HVAC.
