id,title,selftext,score,created_utc,num_comments,subreddit,scraping_time_utc,created_datetime_utc,scraping_datetime_utc,top_comments
1nw5uc4,What should I do? I’m getting conflicting answers about my car,"Last month I took my car (2009 Toyota Camry LE, 2.4L engine) to one of those quick lube places to get an oil change. I know they can be sketchy sometimes, but I have limited options being in an extremely small town (3,000 people), since my local mechanic doesn’t do oil changes (and we don’t have many mechanics in my town to begin with) and they’ve always had good reviews online, fair prices, and have done good work without trying to tack on unnecessary extra charges. So, I guess what I’m trying to say is I trust them. But, anyway, when I took my car in, they did their usual inspection and got my oil changed as usual. Whenever you bring the car in to get worked on by them, they email you a condition report after. It said my right front wheel bearing needs replaced because it was moving excessively, my left front axle needs replaced, as well as my front lower motor mount. They also sent me a video, which I’ve included in the post. 

So, I asked how bad things were and if my car was drivable, and they said it was fine for now but when it starts making noise, that’s when you know things are bad. They also recommend I replace things in order of wheel bearing, axle, and then motor mount. But, they don’t do that type of work there, so I took it back to my local mechanic that usually does the work on my car. However, he was confused why I was bringing in my car to get the wheel bearing replaced when it was fine. He asked me where my car was making noise, and I said it wasn’t making noise to me, I was just told that it needed to be replaced for excessive movement. But, according to him, 
 both the wheel bearings AND the motor mounts were fine, it was just both of the axles that needed to be replaced. So, in the end, that is what I did. 

I then told this story to my boyfriend’s friend, who is a diesel mechanic but has worked on cars, and he said to him, from the video that the quick lube shop sent, it looks like the motor mount is pretty bad. 🙃 At this point, I just don’t know what to do. I know nothing about cars and I’m getting 3 different answers from 3 different people. So I was hoping maybe you all here could give me some advice. I’m worried about driving my car long distances if I need to replace more stuff, but I’m also worried about getting scammed out of my money. Although, I don’t know why the quick lube shop would tell me something is broken for money when they don’t do that kind of work anyways. Please help!!! ",1,1759416491.0,16,MechanicAdvice,1759519967,2025-10-02 14:48:11,2025-10-03 19:32:47,"Dependent-Pie8708 (Score: 2): As per video, the engine mount obviously went bad. Its not THAT urgent but should be replaced sooner the better. 

Wheel bearing we cant tell but once you start to feel any kind of vibration, hearing a grinding noose or any other unfamiliar sound comming from vehicle, you should go explain and get it checked.

If car goes fine, drives fine, sounds and feels fine then its probably fine for now lul

arcticchains (Score: 2): Well that is at the very least a motor mount 😅 but your bearing and axle are bigger concerns that we cannot address here. Look at the condition of your axle and axle boots and see if your wheel spins freely or makes any weird noises while jacked up and in neutral."
1nw5r6x,Break pads need replacing?,"I have zero clue how to draw any conclusions from this pic. The mechanic says the following:

Driver side brake pads: 2 mm  
Passenger side brake pads: 2 mm

That being said, every time I visit this garage, I feel like they upsell me on services/maintenance I don't need.

Just pull the trigger or hold off?

Edit - Car in question is a 2018 Mazda 3 Sport",1,1759416296.0,2,MechanicAdvice,1759519967,2025-10-02 14:44:56,2025-10-03 19:32:47,"Several_Situation887 (Score: 2): That picture is nearly worthless to tell what kind of shape your brakes are in.

It does look like the caliper piston is pushed out quite a ways which would indicate worn pads that probably should be changed, but they should have taken better pictures that actually show how much material is left on the pads.

I think I would take it to a different shop to get a second opinion. See if they come up with similar recommendations and prices.

I don't continue to frequent shops that are obviously trying to upsell me. There are plenty of shops that treat their customers as they would want to be treated."
1nw5qvr,How do I remove this hose so I can replace it?,"Just as I was pulling up to my street, smoke is billowing out of the car and dinging at me that the engine is way too hot. All coolant is gone and dumped out. Behind the engine a t connector is eroded and part of the plastic is snapped off inside the tubing. So I got both the left and right taken off, but I cant for the life of me get the top removed. Either the tube or the connector. How do I remove it?",1,1759416276.0,5,MechanicAdvice,1759519967,2025-10-02 14:44:36,2025-10-03 19:32:47,"Usual_Awareness_7985 (Score: 3): It’s part of the T you need to pull it off the end with the clamp. New part will come with new hose

Sophias_dad (Score: 2): Make/model/year/engine would help, but its probably a good squeeze on opposite sides of the connector(I think). As a temporary measure to get a better look, disconnect the other end of the hose(to the heater core) and get it all out of the engine bay."
1nw5ps2,DIY Repair Guides In The UK,"I’m after a repair guide for my XC70. For previous cars I used Haynes Manuals (the printed version) and was quite impressed with it. 
I ordered Haynes Autofix for the XC70 (since they never made a printed one for this car), and it is no where near as good as I was expecting. The content is so generic, doesn’t include hardly any vehicle specific information, and the photos have been replaced with useless diagrams. 

What manuals/repair guides would you recommend to me? Preferably a printed one, or something that avoids a subscription. 

Cheers! ",1,1759416207.0,2,MechanicAdvice,1759519967,2025-10-02 14:43:27,2025-10-03 19:32:47,"Accurate_Doughnut411 (Score: 1): install workshop manual 13 usd

[https://www.workshopcarmanuals.uk/product/volvo-vida-all-models-workshop-repair-manual-download](https://www.workshopcarmanuals.uk/product/volvo-vida-all-models-workshop-repair-manual-download)"
1nw5bir,Brake pad hardware clip is rubbing on outer diameter of rotor,"Noticed a grinding noise from the front end so I took a look, and noticed the brake hardware clip is rubbing on the outside of the rotor. 

What does everyone suggest I do? I was going to change the clips, but I can’t find just the clips anywhere, my only thought it buy new pads.

Also, how bad is it if I just leave it as is, would it damage the rotor?",1,1759415289.0,5,MechanicAdvice,1759519967,2025-10-02 14:28:09,2025-10-03 19:32:47,"mjikbus (Score: 1): Stick a screwdriver in there and pry it away from the rotor

mjikbus (Score: 1): It doesn't look like it's all the way up onto the caliper bracket work it from one end to the other from one side of the rotor to the other and push that back up to where it's supposed to be"
1nw57r1,Snapped the brake pipe by accident. Will I have to bleed just this brake when replacing or all 4 brakes? (1999 Honda CRV AWD),‘99 CRV AWD if that matters? Thanks! ,5,1759415038.0,13,MechanicAdvice,1759519967,2025-10-02 14:23:58,2025-10-03 19:32:47,"Wrenchandbench (Score: 30): Technically, you only need to bleed out the one caliper, but by bleeding out all 4 you can flush old fluid out of the calipers and help extend their serviceable life.

thefaradayjoker (Score: 1): On a Honda.  in the factory service manual, they tell you to bleed the brakes in the reverse order. Front first."
1nw56vk,What is causing this?,I have a 2018 honda civic EX-T the engine type is a 1.5 liter turbocharged 4 cylinder ,1,1759414979.0,2,MechanicAdvice,1759519967,2025-10-02 14:22:59,2025-10-03 19:32:47,NewImprovedPenguin_R (Score: 1): Flashing lights like such in my experience is usually a grounding issue. Ensure your battery is healthy and check your electrical grounds and connections.
1nw55xk,P0430 code,"I have an older Honda odyssey. It keeps throwing the 0430 code. I’ve replaced a catallitic converter in an Acura max before but I lived in an inspection state. Now I do not. I just keep clearing the code and ignoring it. Other than possible gas mileage issues, is there a reason I would need to go ahead and replace this part? I’m not a mechanic by any stretch but I do my own work as I hate paying for mechanics. I just don’t really want to spend the $200 for the part and the giant chunk of time if gas mileage is the only thing this is going to help with. ",1,1759414920.0,2,MechanicAdvice,1759519967,2025-10-02 14:22:00,2025-10-03 19:32:47,"SlowDownToGoDown (Score: 1): Have you ever changed an O2 sensor?  

Look under your car at the ""downstream"" O2 sensors (aft of your catalytic converters).  If you have clearance for them to stick out more, get [these anti-foulers](https://www.autozone.com/ignition-tune-up-and-routine-maintenance/spark-plug-non-fouler/p/dorman-help-m18-1-5-steel-non-fouler/1349827_0_0), and install them in between the exhaust bung and the O2 sensors.  

It doesn't fix anything, it can just get your CEL to turn off, so if something else bad triggers it, you'll know it."
1nw51zs,Is it ok to drive still!,Heard some rattling and found out this rusted and came off. Mazda 3 2010 ,1,1759414668.0,13,MechanicAdvice,1759519967,2025-10-02 14:17:48,2025-10-03 19:32:47,"AdeptnessShoddy9317 (Score: 3): Looks like the mount broke around the mounting bolts. Is says it would be still be safe to drive locally, I'd limit it though and take it easy. No sharp corners or quick turning or highway's. Best to get this fixed in the next few days. If this one is bad the other is probably close. Also when doing shocks it's recommended to replace both sides, so you'll be looking at 2 new rear shocks. Usually not bad it your handy. Shouldn't take that long for a shop to replace them either.

asbestoswasframed (Score: 2): Strut mount broke.  Dangerous? Meh.

It's something you should correct sooner rather than later."
1nw4sqe,Clicking Sound near belt,Hi guys I’m attaching a video of my 2007 Honda CRV. Wondered if anyone could confirm what this sound likely is? Thank you so much ,2,1759414075.0,4,MechanicAdvice,1759519967,2025-10-02 14:07:55,2025-10-03 19:32:47,"Outrageous_Reply4685 (Score: 1): I just put in a k24a, I reused my tensioner, PS, and Alternator. Sounds just like that. My power steering is also vibrating while it makes the noise. It was leaking everywhere before I changed the O ring"
1nwjybv,Exhaust valvetronic,Hey guys I bought a car with really loud exhaust and was wondering if I can have a reverse valvetronic system installed. I would like the exhaust you can physically see like the tip of the exhaust to be the loud ones and the quiet exhaust to be hidden. I would like to be able to switch between the two.,0,1759448955.0,2,CarTalk,1759519967,2025-10-02 23:49:15,2025-10-03 19:32:47,"nickskater09 (Score: 3): You’re going to be doing something custom, find a local fabricator that does exhausts and talk to them (and not just some random muffler shop that crush or wrinkle bends with junk welds).

HtmlHonda (Score: 2): You could probably do it using an electric cutout, the hard part is finding a spot to tuck a muffler under the car. You'll have to cut a section of exhaust out, install the cutout and weld a muffler on the other side. To quiet it down, it's going to have to be a pretty good sized muffler."
1nwim37,Nitrous,Can I use 6 degree iridium spark plugs for a 100 or 75 nitrous shot gas project?,1,1759445377.0,1,CarTalk,1759519967,2025-10-02 22:49:37,2025-10-03 19:32:47,IDislikemostofyouOK (Score: 1): Idiot
1nwils1,How trustworthy is rock auto,Had to buy some parts from there because autozone up charges for no reason. Just wanted to know if they are a solid brand?,23,1759445355.0,100,CarTalk,1759519967,2025-10-02 22:49:15,2025-10-03 19:32:47,"Chumsicle (Score: 164): The toolbox covered in magnets says 'yes'

Fun_Variation_7077 (Score: 98): Roughly as trustworthy as brick and mortar stores. Exponentially more trustworthy than that godforsaken website that starts with the letter A.

technikal (Score: 44): Been using them for well over a decade now. No issues."
1nwi45h,Scuff on sidewall,"I just got new tires literally yesterday and today I hit a curb while parking. I don't know if this is serious or will I be fine. Please don't judge, I'm a new driver.",2,1759444077.0,4,CarTalk,1759519967,2025-10-02 22:27:57,2025-10-03 19:32:47,"glizzytwister (Score: 1): That's just the rim guard, it's fine.

No_One_2_You (Score: 1): Umm brake dust?

No_One_2_You (Score: 1): Umm brake dust?"
1nwi1t9,Importing from Japan,"1st time inquiry experience for importing a vehicle from Japan. Got an estimate from a local broker. 
Not quite sure what some things on the itemized list are such as RORO? Why is there a broker/fee for total Japan expenses and a separate broker fee for total USA cost? If anyone could kindly share their experience I would appreciate it. Is this also typical broker fee? Thank you for your time. ",29,1759443909.0,14,CarTalk,1759519967,2025-10-02 22:25:09,2025-10-03 19:32:47,"nalyd01 (Score: 37): RORO = roll on roll off, the type of vehicle shipping that is brining your car from Japan to HI.

glizzytwister (Score: 28): RORO means it's going on a dedicated car carrier, not being stuffed in a shipping container. Roll on roll off.

The Japanese itemized list is for the fees that are applicable to Japan, the US itemized list for fees applicable to the US, like the broker fee, import duties, etc.

mmussen (Score: 17): Your Japan broker fee is the guy in Japan that buys the car, does the paperwork and gets everything set up to ship. 


The broker on this side is the guy dealing with US customs, doing the paperwork to make the car legal etc... 


RoRo is roll on roll off - its the term used for car transport. The car will be rolled onto a transport ship, and rolled off. Instead of say stuffed in a container and craned onto a ship "
1nwh4dk,Led bulbs with mini projectors - discussion,"For quite some time, I've been thinking of upgrading the lights on my 2005 E91.   
Standard LEDs are out of the question due to reflector housing, as my goal is not to blind the oncoming traffic.  
Last year, I stumbled upon LEDs that simulate the position and the beam pattern of the standard Halogen bulb, however, I wasn't satisfied with the result as the light output was somewhat weak and while being whiter than the Halogens, the light intensity was not at satisfying level.  
  
The latest thing I stumbled upon is the LED bulb with a built-in projector. There are many YT videos covering the topic, as well as opinions of people who bought them, so I thought we could have a topic for that here (there might be one already, but I wasn't able to find it).

Aaaanyway, has anyone had any experience with the said projector LEDs, was there any interference with the radio (as with a lot of LED bulbs out there), what's the life span, and are you satisfied with the results?",0,1759441663.0,10,CarTalk,1759519967,2025-10-02 21:47:43,2025-10-03 19:32:47,"djembeing (Score: 2): I am satisfied.

$25, bi-led projector, Motorcycle fog lights. 

Old VW Jetta has terrible headlights. 

Put these in the lower bumper.

Aim so horizontal cutoff is just below other cars windows.

Satisfied with output and pattern. Would be better mounted higher (closer to factory headlight height)

Mild Pop sound when I turn the lights off with the radio still on and engine off. No Pop while driving and switching lights. ( sub and lights are direct to battery )
No interface.



[Zmoon Motorcycle LED Driving Fog... https://www.amazon.com/dp/B08GS4QTZN?ref=ppx_pop_mob_ap_share](http://Zmoon Motorcycle LED Driving Fog... https://www.amazon.com/dp/B08GS4QTZN?ref=ppx_pop_mob_ap_share)

I was looking at ""CoLight LED"". Plug and play on some vehicles.

pancrudo (Score: 1): I've never heard of bulbs mimicking the cut off. If you're looking for more outpour you may want to look into xenon or bi-xenon lights. For the sake of costs, I would avoid the ACL lights because those typically require a bunch of programming and are expensive as shit.

Not sure how handy you are with cars, but you could also keep an eye out on cars going through your local junkyards and cut the price down significantly. 

I've been eyeballing 1 series lights for a friend because OEM lights start around 700 a side, and aftermarket ones are about 500 a pair.... But junkyard, 140 a pair"
1nwglsq,need advice on where to shop for a headlight... please help me !!  2008 chevy aveo5 hatchback,"this is the first time ive ever had to buy something on my own or look something major.

i own an 2008 chevy aveo5 hatchback, the right side (passenger) headlight is totally busted. im so scared i dont know what to trust and a good reliable place to buy. i called a salvage yard as per the advice of someone i work with... and its too far for me to go. they arent even sure they have the part.

im looking for the entire assembly for the headlight. 

im just a first time girl trying my best, i never had anyone to genuinely guide me in this stuff so i dont wanna buy something wrong... i think this is also important to know???

Composite; OEM #96540254; Partslink #GM2503241

im just rlly scared i need this car and cannot afford anything pricey please offer any advice and help ",0,1759440446.0,4,CarTalk,1759519967,2025-10-02 21:27:26,2025-10-03 19:32:47,"prairie-man (Score: 2): visit this site:  [https://car-part.com](https://car-part.com)

fill in the online form and the site will produce a nationwide list of auto salvage yards that have the headlight assembly you are searching for.  The list will be sorted by proximity to the zip code you provide.    

When you find a salvage yard near you - call them at the number listed to confirm they still have what you want and to confirm the cost.     

They are not very good responding to emails - just call them.

Lkn4it (Score: 1): Rockauto.com has it."
1nwgkeo,Hit and Run,"Hey guys, a friend of mines car was hit while we were at an event and we would like your guys opinion on how to fix this. The left rear tire was pushed forward. It seems like they were drunk and the were pulling forward and hit the car but they didn’t leave a note or anything. We made a police report and their insurance won’t really cover it because they just moved to California and their insurance doesn’t cover out of state coverage. We talked to a couple of mechanics and they’ve said that the cost will be more than what the cars worth. Now money is tight and I’m wondering if we can someone how find a way to pull it back without expensive equipment. The car is a 2008 ford focus. Also the rear left wheel that got hit doesn’t have an axel which is why I’m thinking this idea will work. Thanks.",0,1759440351.0,2,CarTalk,1759519967,2025-10-02 21:25:51,2025-10-03 19:32:47,"disturbedrailroader (Score: 2): Your idea will not work without a lot of reinforcement. Simply pulling it back into position will further weaken the metal structures that hold everything in place. This is why the mechanics you've talked to say it's not worth it. Your friend is gonna need to accept that their car is done for. 

corporaterebel (Score: 1): Pictures help. 

But just be aware that HALF of all collisions in LA are hit and run.  

This is just how it works."
1nwgbbx,Hit and Run,"Hey guys, a friend of mines car was hit while we were at an event and we would like your guys opinion on how to fix this. The left rear tire was pushed forward. It seems like they were drunk and the were pulling forward and hit the car but they didn’t leave a note or anything. We made a police report and their insurance won’t really cover it because they just moved to California and their insurance doesn’t cover out of state coverage. We talked to a couple of mechanics and they’ve said that the cost will be more than what the cars worth. Now money is tight and I’m wondering if we can someone how find a way to pull it back without expensive equipment. The car is a 2008 ford focus. Also the rear left wheel that got hit doesn’t have an axel which is why I’m thinking this idea will work. Thanks.",1,1759439764.0,1,CarTalk,1759519967,2025-10-02 21:16:04,2025-10-03 19:32:47,"Donny_Z28 (Score: 1): You can’t pull it back, any suspension parts on that side that aren’t already broken are now heavily fatigued from bending and will likely break if you found a way to pull them back. You need to replace all the damaged suspension components on that side to make it safely roadworthy again."
1nwetck,"Friend cleaned some corrosion off their battery terminals, now their vehicle is having all sorts of electrical problems","A couple of days ago, my friend saw corrosion build up on his truck's battery, no issues though, and decided to clean it off. Now today, he is saying his truck is having a lot of electrical problems. When he turns on his truck, his left and right signal is just in a constant on state, no blinking, just on. When he turns the a/c dials, the signal for his brights turns on. When he turns on his lights, he can't shift gears. He can turn them off then on and it'll let him shift once, but then will lock up again. Not sure what's happening here

Ford f150, 2004-2006",0,1759436456.0,32,CarTalk,1759519967,2025-10-02 20:20:56,2025-10-03 19:32:47,"Brosufstalin (Score: 9): How did they clean this corrosion off?

bobroberts1954 (Score: 5): I don't see any logical connect. He should check that his battery terminals are really tight, he shouldn't be able to turn them on the post.

Only thing I can think is some programming got scrambled from loosing power. He didn't try to hook them up backwards or short the battery for a second, maybe sparking off a tool, did he?

Background-Head-5541 (Score: 5): Those symptoms seem like something got wet and is causing a short. Body control module maybe?"
1nwd8a2,Car squeaking when I put it in 1st gear,2006 scion xb. Very faint squeak from when I put it in first. Any ideas on what this could be? ,1,1759432912.0,5,CarTalk,1759519967,2025-10-02 19:21:52,2025-10-03 19:32:47,"Paninisnadwich (Score: 1): It sounds like it is coming from the inside front of the car. Help very much wanted

RVR-SEA (Score: 1): 1st Gen Scion xb

Weaponizedllama (Score: 1): Can't hear anything in the video thats concerning. It could possibly be the leather thats surrounds the gear stick"
1nwbrp2,Where to buy good tail lights,"I cracked my driver side tail light on my civic 22 hatchback, if I buy directly from Honda it’ll be like $400, does anyone know any reputable dealers that I can buy it from for cheaper? I’m willing to buy it for around $200  ",0,1759429637.0,12,CarTalk,1759519967,2025-10-02 18:27:17,2025-10-03 19:32:47,"Lacktastic (Score: 8): Ebay, local salvage yards, if going aftermarket look for CAPA certified parts. 

You will need to remove the rear bumper to replace it.

Mission-Ideal4474 (Score: 6): ebay, car parts.com, junk yard

FearlessTomatillo911 (Score: 4): [https://www.car-part.com/](https://www.car-part.com/)"
1nw9wu8,diagnosing advice?,"Hi, i have recently purchased a 2013 Mini Countryman Diesel Auto around 3 weeks ago. 

On two occasions since buying, it has gone into limp mode for around 5 seconds when moving off from being stationary (once at a roundabout, and once at a junction). The revs won’t go past 1, for around 5 seconds, and then the car seems to resolve it self… almost like it needs to “catch up”… car doesn’t require turning on/off. On both occasions, the diesel has been low (not sure if this is a relevant factor but worth noting) 

I had AA out to look at the car, and they found 14 error codes - but nothing relating to the transmission. I don’t believe it to be a transmission error as the car otherwise drives fine and has no fault when moving into park or reverse etc.

Can anyone help with diagnosing the car, local garages don’t want to touch it with it being under a warranty company. I am tempted to take the car back to the garage for them to repair it however i am slightly reluctant as the garage is 1 hour 30 mins away from me and i’m not sure i trust them all too well after this encounter 😔",2,1759425554.0,2,CarTalk,1759519967,2025-10-02 17:19:14,2025-10-03 19:32:47,"myotheraccount2018 (Score: 2): Not a mechanic, but seems like you have a pressure leak somewhere in the engine leading to the slew of codes.

God_must_die (Score: 1): ."
