id,title,selftext,score,created_utc,num_comments,subreddit,scraping_time_utc,created_datetime_utc,scraping_datetime_utc,top_comments
1njf5yg,Rough estimate of repair cost?,2016 odyssey 136000 miles. started jerking between 25-40 mph this morning it would only do it once then once i hit 45-50 it stops. Hooked up my obd scanner and got this code has anyone dealt with this or know what exactly needs to be done and rough estimate of how much it’ll be ?,1,1758120425.0,6,MechanicAdvice,1758224065,2025-09-17 14:47:05,2025-09-18 19:34:25,"Zyb_Vindi (Score: 1): Need to check circuit for that transmission switch. Could be the wiring to the switch, an internal transmission problem, or a problem with the module interpreting the data. Further diagnosis is necessary. Expect to pay an hour of initial diag."
1njf3w7,"More of a rant, but what’s the rationale behind this insane quote?","My parents have an 07 TSX that recently failed inspection due to an exhaust leak. The y-pipe cracked, but the exhaust system is otherwise in decent condition. None of the metal is getting thin or rusted through, hardware is still serviceable. They took it to their local mechanic to get the leak fixed, and they wanted $2600 to replace the whole cat back exhaust system. Who in their right mind would pay that? Why would they even attempt to try and sell this as a service? It just feels so scummy that they were probably hoping that they could leverage a failed inspection to force a customer that doesn’t know any better. 

Side note: they also conducted a “free” multi-point inspection and tried to sell them on a new front LCA since the bushing was getting tired. Also for $2500 lol. Who would pay $5000+ in repairs on a car that’s worth $4500 on a good day??

I told my parents to deny the service, and I took their TSX to a custom exhaust shop. These guys were so awesome - it was funny seeing their old 170k mile TSX next to a Jaguar E-type, but they took my walk-in appointment, charged us $250 to cut out and weld in a new y-pipe within an hour. I’m so relieved that I was able to save my parents money, but also so angry that the other shop tried to rip them off.

Guess I’m trying to understand what’s going on with the first shop. They’re a locally franchised shop, but not a dealership. I would understand a dealership charging huge prices for a new OEM exhaust, but why does an independent shop charge so much too?",16,1758120299.0,46,MechanicAdvice,1758224065,2025-09-17 14:44:59,2025-09-18 19:34:25,"nickynicky666 (Score: 50): First shop can’t weld, so their solution is to replace the whole exhaust. Don’t want to pay that? Then you go somewhere else, which you did, as you should. To them, if you paid 2600, great, if you don’t, then it’s not like they lose any business they could have gotten

Trevors-Axiom- (Score: 12): Not everyone can cut and weld exhaust piping, especially a Y. He gave you a quote for a repair he was capable of doing. A transmission shop can rebuild a transmission, but if you take it to Midas they are gonna recommend a replacement trans because they aren’t capable.  Same gist, It’s all in where you take it."
1njewwu,How bad is this?,2001 Mercury Grand Marquis ,6,1758119859.0,4,MechanicAdvice,1758224065,2025-09-17 14:37:39,2025-09-18 19:34:25,"JWines13 (Score: 5): its just a plastic cover on the threaded hub but since you have electric fans the threads are not needed. its the same water pump used in trucks with a mechanical fan attached there

micknick0000 (Score: 2): If I remember correctly, that's just a plastic *cap*...

You should be alright."
1njet3g,Anyone know why there is no place to grease these and where I can find replacement,Trying to fix for a friend usually don’t mess with suspension lifts it’s an 09 f150 brand is icon vehicle dynamics also has icon coil over with a serial number,1,1758119615.0,13,MechanicAdvice,1758224065,2025-09-17 14:33:35,2025-09-18 19:34:25,"micknick0000 (Score: 3): Because they're not greaseable.

[Replacement parts](https://iconvehicledynamics.com/accessory/11260/icon%2Daccessories%2Dicon%2Divd%2Duniball%2Dupper%2Dcontrol%2Darm%2Dservice%2Dkit%2Dw%2Dretaining%2Drings/)

memphisric901 (Score: 1): And I’m talking about the upper ball joints and or control arms.has about 3 inch lift"
1njersz,P0101 code,"2016 Nissan Sentra sv

So I get this code once or twice a month and it always seems to clear itself. Google tells me it is an issue with the MAF sensor. I don't experience rough idling or stalling , there are no smells ( Google also says in rare cases it could be the cat converter ). It seemingly always happens when I hit high speeds , or take off from a red light with an extra heavy foot. Never happens otherwise ( I drive like an old man ). The sensor is like 2 years old, so I doubt it's that. Any other ideas what it could be when it only specifically comes on during acceleration or high speed? Any info appreciated, thanks for your time. 

Edit: forgot to add, I do have mild struggling during acceleration at times ",1,1758119531.0,5,MechanicAdvice,1758224065,2025-09-17 14:32:11,2025-09-18 19:34:25,"Rebeldesuave (Score: 2): Don't be too quick to rule out that sensor. MAF sensors especially aftermarket ones can fail or flake out before their time. 

Make sure it's good before you rule it out.

Rebeldesuave (Score: 1): What was the code? If you have a code reader use it to list out all the codes you get and post them here"
1njeikn,Is this normal ?,2016 dodge challenger hellcat 6.2,6,1758118935.0,5,MechanicAdvice,1758224065,2025-09-17 14:22:15,2025-09-18 19:34:25,"Maleficent_Worker116 (Score: 13): Generally not recommended to move that by hand when it’s still connected

Have_To_Make_It_Work (Score: 8): Its drive by wire. computer sees wide open throttle and turns on the fuel pump briefly. You hear the fuel going through the rail and past the regulator back into the tank."
1nje8wv,Can I replace rotors without replacing brake pads?,"I have a '04 Chevy Silverado that definitely needs new rotors (rusted and pulsates when braking), and I'm trying to figure out if I NEED to replace the brake pads too.

For context: I just had new rear brake pads put on last year in September, and I when I looked at the front brake pads, they still have plenty of life left on them. I just want to make sure that I won't wear down/dig into the new rotors if I replace only rotors and not brake pads.

So will replacing the rotors but not the brake pads cause damage to the new rotors? TIA.",1,1758118305.0,3,MechanicAdvice,1758224065,2025-09-17 14:11:45,2025-09-18 19:34:25,"o5blue8 (Score: 1): You can get a good set of pads for less than $50 and it will reset the life of the brakes.

Can you?   Yes.  You can also not replace the rotors.  Should you?   No.  The pulsating is also hitting the pads.  You have no idea if the pad material is damaged underneath or not.

FearlessPresent2927 (Score: 1): Don’t re use pads. All damage that’s on the rotors is mirrored on the pads.

You can change pads alone because rotors aren’t as easily damaged as pads are"
1njdu6l,Truck randomly refuses to start. Months long issue.,"2000 Chevy Silverado 1500 5.3 V8

Truck has been having an issue where on random mornings it will refuse to start. After coming back from work, sometimes it’ll start and sometimes it won’t. 

In the video, I found out that TBC fuse was blown and the previous owner had jumped the fuse with a copper wire connecting the fuse pins. After replacing the fuse, the no start problem stopped for about two weeks. 
Then it came back

Truck wouldn’t start in the parking lot at work, checked more fuses and found the RAP #1 fuse was blown as well. Jumped the battery, went home and replaced the fuse, and the problem stopped again. 

In time, I noticed that with heavy bumps, the red battery light would come on the dash for about 3 seconds and then stop. As the days went it became more frequent. Now the security light comes on solid all the time as well.
After about a month from the last no start, it’s happened again. ",1,1758117330.0,2,MechanicAdvice,1758224065,2025-09-17 13:55:30,2025-09-18 19:34:25,Due-Mix3539 (Score: 1): Sounds like a bad/loose ground based on what youre saying.
1njegj1,Dacia stepway UK,"OK so bear with me whilst I have good knowledge of cars this one's new on me 


So we've got the abs light, the cars heart monitor. A feather duster which sometimes flashes and sometimes stays solid and the drift light on. 

They are not always on. When they are the brakes work fine! When they aren't they don't. You apply pressure and it the pedal fights back with limited braking.

I've replaced th3 battery, alternator works fine. 

Anyone experienced thus or suggest places to start looking ",1,1758118803.0,9,MechanicAdvice,1758224065,2025-09-17 14:20:03,2025-09-18 19:34:25,"BoxxBodySprings (Score: 2): the abs sensors or wheel speed sensors are bad or going bad.

20tonni (Score: 2): If you had good knowledge of cars first thing you should’ve thought of is to get it scanned?"
1njef5o,Question regarding closing a business,"Good Morning,

For all you shop owners, what is the usual protocol if/when you choose to close your business (for whatever reasons) ?

I've been blessed to have had 2 indy mechanics over the last 20 years.  The person I've been using for about 5 years shut his business down a month ago -- I just found out last night through a Google search.  He hadn't responded to a couple of texts over the past 3 weeks.

  
Then a 2nd question.  How is the state of business right now?  I had figured it was a balance between people being broke, but also an aging fleet of vehicles that are being held on to longer.  I honestly thought a good indy was probably quite busy right now.

Appreciate it.

  
",0,1758118714.0,2,MechanicAdvice,1758224065,2025-09-17 14:18:34,2025-09-18 19:34:25,"micknick0000 (Score: 1): >what is the usual protocol if/when you choose to close your business

Sell what you don't want to keep and close the doors....

>  
 How is the state of business right now?

The economy is retracting - people are holding onto vehicles longer, but they're also holding onto their money as well. 

>  
honestly thought a good indy was probably quite busy right now

You only know what you've seen looking in from the outside on a very limited basis and your interactions with that business.

Just because your mechanic was a good mechanic that doesn't mean they were a good businessperson. 

Or maybe they lost their lease. Maybe the had family issues and are having to relocate. Unless you know that individually personally, there are infinite reasons they could be closing their business."
1njt8yy,2012 Nissan Rogue strange noise,"My car started making this noise when I accelerate it almost makes the sound of a go-kart or dirt bike, it started about 2 weeks ago and I took it to two different mechanics and they both didn't know what it was. One suggested it might be a transmission problem but I put a new transmission in it a couple years ago so I thought that would be a stretch any help would be great thanks",1,1758153186.0,3,CarTalk,1758224065,2025-09-17 23:53:06,2025-09-18 19:34:25,"TeamEdward2020 (Score: 1): Had the same noise but much quieter in my 2011, never did find what it was but I'd bet there's someone out there who knows off the rip. These things have tons and tons of repeatable failures.

britdd (Score: 1): Its a nissan with a dreaded CVT. It doesn't matter if you replaced it 2 weeks ago or 2 years ago. Could still fail anytime. You could do a tranny fluid change and see if it helps."
1njssgm,Aixam city 50,,0,1758151937.0,1,CarTalk,1758224065,2025-09-17 23:32:17,2025-09-18 19:34:25,_BEER_ (Score: 1): enjoy it man! my best friend had one of those and it was a lot of fun just hooning around.
1njrs6k,Back of 2023 durango uhaul question,Alright guys so i not too long ago asked about all the things i needed to hitch a trailer but this is the back of my durango. Uhaul said i needed all the ither things in the pictures attatched ,1,1758149298.0,10,CarTalk,1758224065,2025-09-17 22:48:18,2025-09-18 19:34:25,"BobColorado (Score: 5): You have the receiver assembly and the wiring.  All you need is the part to go into the receiver and the right size ball.

pornofuell (Score: 2): You really dont i had a 2015 JGC (jeep grand cherokee) v6 btw and i went to autozone spent 70$ on a tow hitch that felt about right. Hooked her up an towed a car on a uhaul dolly.. you dont need that that hitch in the 3rd photo its built into the suv..

New_Molasses_4314 (Score: 1): You’ll need a hitch ball a tongue and the pin, you shouldn’t need another pin socket, it looks like there might be one mounted into your car on the left side? But also shouldn’t be any need for another tow hitch"
1njrd4j,Help me find this front splitter/lip,I want it on my Renault Clio mk1 1994,0,1758148252.0,1,CarTalk,1758224065,2025-09-17 22:30:52,2025-09-18 19:34:25,Budget-Position5348 (Score: 2): Well the rest of the image couldn't hurt
1njpje6,One headlight is brighter than the other,"I have a MK4 Golf 2003. And i recently noticed that the passenger side headlight is dimmer, like all of the bulbs are not as strong as the ones on the drivers side. What can i do, what can i check for the problems.",4,1758143751.0,11,CarTalk,1758224065,2025-09-17 21:15:51,2025-09-18 19:34:25,"InternationalGap3908 (Score: 5): Yea that’s about 80% of every VW I’ve seen from that era. I wouldn’t sweat it but if you figure it out let me know. These types of electrical gremlins is what has kept me away from VWs my whole life. I like the look of them but man… there inability to master the simple stuff always kept me from buying one.

Ok-Communication1149 (Score: 4): You can replace both bulbs and align them. If that doesn't work you might have an electrical issue

HuumanDriftWood (Score: 2): Check grounds for corrosion etc."
1njmiwm,Messed up changing my brakes for first time. Question about how to proceed. TIA!,"A while ago I tried changing my (*Acura TL 2008*) own brakes with my BIL‘s help (we had some idea of how to do it, but neither of us are car guys, I was just too broke to take the car in). After putting it all back together, the brake pedal wouldn’t pump, so no brakes. As far as I understand we didn’t bleed the line properly (or air got into the system?). I guess at this point I see multiple options, I’m just not sure how big of a problem I have at my hands here. I could as option A have a (unreliable) friend come help me bleed them again, I’m just worried about it not fixing the issue and in the end still requiring option B? Option B would be having my mechanic buddy tow me and do it at his garage, I’m just worried about how much it will cost possibly. Or do you guys think I should just get a brake bleed kit for less than $100 and just try it myself?

Edit: I hope it doesn’t read as me trying to ask for cost! I’m just wondering what my best route would be out of the three options",8,1758136695.0,39,CarTalk,1758224065,2025-09-17 19:18:15,2025-09-18 19:34:25,"wiggo666 (Score: 25): What all did you do during the brake job

Aggravating-Task6428 (Score: 12): Hold up. Did you change the calipers or just the rotors and pads? 
Calipers should rarely need changing unless you've burned through the entire brake pad and obliterated the caliper piston.

TonyDRFT (Score: 4): If you replaced the calipers, are your bleeding nipples at the top, or the bottom of the caliper?"
1njlqe8,Car shut off while on the highway,"So here's the thing. We own a shitty 2010 Nissan Versa hatchback. The splash shields on the front tires have since tore off. It stormed yesterday and the roads were pretty much flooded, so we had no choice but to drive through the puddles, despite doing my best to avoid them. Anyway, today it wasn't raining. I drove to the next city over for my Living Kidney Donor appointment, but on my way back the car suddenly shut off on the highway and now it won't start. It cranks, so it's definitely not a battery or alternator issue, and it's not a Mass Airflow Sensor issue. I'm thinking it's not getting any fuel. I would like to hear thoughts on what it could be.",4,1758134919.0,6,CarTalk,1758224065,2025-09-17 18:48:39,2025-09-18 19:34:25,"MapleSurpy (Score: 3): Cranking with no start can be about 57 different issues. 

Fuel pump, about 4 different sensors, electrical issues, water damage from the puddle, engine failure, etc.

Ok-Blueberry-3739 (Score: 1): Same thing happened to me. Car was sputtering while driving and car smelled like fuel as well. Turned out my fuel pump went bad. Nothing $260 can’t fix.

QuantityNo9540 (Score: 1): Splash shields are important! I got all of them replaced at once from Wally world online actually for like $50! Random shutoffs on the highway might be cam/crank shaft sensors. If you have access to a code reader it might give you an idea of where to look."
1njlhtx,Odd tire damage,"Hi peeps, I walked outside to this damage on the center of my tire.

Kuhmo Ecsta PS91, 260TW summer tire, CA car, DOT 2422. 

I’ve only had these for 6k miles. Recently rotated at 5k. Installed them at the start of the year.

Is this a defect or just a result of my cambered setup (-2.5° square, track car/autox/daily)?",25,1758134378.0,22,CarTalk,1758224065,2025-09-17 18:39:38,2025-09-18 19:34:25,"MarcusAurelius0 (Score: 61): That tire is nearly shot, what you have there makes it totally shot.

260 treadwear plus regular track time, what did you expect?

MEE97B (Score: 3): Yeah the track time probably caused this, should it have caused this? Fuck no.

I had a full track day on some cheap good ride sport rs, 200 treadwear, and came out the other end with far better condition tyres. FWD tuned Mazdaspeed Axela. Only obvious wear was on the corners of the tyres/ribs, which were a bit rounder, but that's what you want the tyre to be doing. Drove another 10k KMs on them and they've still got life.

I'd expect far more from kuhmo, that's fully delaminating, which if both sides were moulded at the same temp/time it shouldn't have 'dried' in 2 separate parts.

I'd consider that a tyre failure more than bad use cases.

And no, 2.5° of camber is not going to cause that. Typical cars have around the 1.5° mark, and performance cars often come STOCK with 2.5°

LackingFunction (Score: 7): This is totally from camber for being a track car. Most people flip their tires around after a track day. 

I had to flip mine after a few times, and I don’t have any camber adjustment, only toe. Your camber makes it much more pronounced."
1njkwz0,Weird peeling on hood of my car…do I need to get this fixed?,,0,1758133086.0,2,CarTalk,1758224065,2025-09-17 18:18:06,2025-09-18 19:34:25,"MapleSurpy (Score: 3): > do I need to get this fixed?

It's not going to cause mechanical issues, just look ugly and eventually POSSIBLY turn into rust...a few years down the line. 

If you don't care how it looks, there's zero reason to fix it. They'll have to sand down, repaint and recoat the entire hood. Depending on year/make/model/location it's probably at LEAST a $600 job.

Apart_Mud_3869 (Score: 3): That’s just the clear coat coming off not a biggie I have a car from 92 and a 2005 and they are both like that all it does is make it not look as good until it rains then I looks new"
1njkqor,Wheel noise.,Evening all. My sister’s horrible Nissan Juke has suddenly started making this noise? Should she put it in the bin or is it a simple fix? Thanks all. ,3,1758132697.0,13,CarTalk,1758224065,2025-09-17 18:11:37,2025-09-18 19:34:25,"MapleSurpy (Score: 7): In my professional opinion, it sounds like your sister probably ran something over and it hit the brake shield, which caused it to press into the rotor. 

If the shield is just bent, you can literally just bend it back out with a screwdriver and call it a day. It could also be brake related, but I'd bet at least $7 it's the shield.

Real_Mokola (Score: 4): Maybe a stone stuck in the brakes? Get some speed on those tires and do a strong braking

Edit: Also the screeching noise sounds like something is rubbing against something, the wobbliness of the sounds tells it's structurally not too solid. Might want to check if the brake shields are the source of that noise, they cost like 30$ and for the most part are not even that necessary.

Both-Leading3407 (Score: 1): I would check for bearing issue by putting the tire in on the jack as if you are changing the tire.  and think of a Plus + sign.  Put you hands at the top and bottom and try to get the tire to shake up and down.  Then do the same thing at the 9 and 3 position.  If it shakes back and forth it's a bearing if it is stiff and doesn't move then it's the Brake dust shield.  Remove the tire and turn the inner wheel as if the tire is on it and locate where the dust shield is making contact with the rotor.  bend the shield out of the way of the rotor and replace the tire and tighten the lugs snuggly."
1njjkjc,Did I just yeet my power steering pump?,Changing coolant and draining the power steering fluid on my 2011 crv with 157k miles at the same time. I was ready to start the car to let air escape after refilling coolant so I did and as soon as the car turned on I heard whining. So I went to the front of the car looking around not sure what was wrong and it took me all of about 30 seconds before I realized I hadn’t refilled the power steering fluid. This is what I get for doing two things at once. I turned the car off and filled it then when I cut the car on the level drained a bit. Filled it some more now the whining is gone level is good. Anyways would this have ruined my pump? Thanks. ,7,1758130180.0,7,CarTalk,1758224065,2025-09-17 17:29:40,2025-09-18 19:34:25,"SendLGaM (Score: 11): It didn't do the bearings any good but if the whining is gone and the power steering is otherwise working properly  you should be fine.

minesweep0r (Score: 4): You're fine. People drive around with empty reservoirs.

BallerFromTheHoller (Score: 3): Power steering pumps are somehow immune to this type of abuse, generally. I’ve ruined gear pumps in a hydraulic system in seconds by doing this but PS pumps just seem to take it and move on. 

Bottom line, if you filled it up and it still feels like you have power steering, you should be fine."
1njig52,Replacing this coolant line. Anything to look out for? '17 MB GLS450,,0,1758127711.0,1,CarTalk,1758224065,2025-09-17 16:48:31,2025-09-18 19:34:25,adams551 (Score: 1): I've never replaced a coolant line. I'm not going to disconnect this then not be able to reattach am I?
1njh5nz,Can I repair this trim piece that has corrosion/burn/stain mark?,"My self dimming mirror broke and leaked fluid onto my shift trim and now there are stains/burn marks (visible above the window button and top of shift panel). Can this be cleaned or repaired, or is a new trim panel need to be installed?",1,1758124889.0,4,CarTalk,1758224065,2025-09-17 16:01:29,2025-09-18 19:34:25,"Tractorguy69 (Score: 1): If you’re talking about the yellow plastic looking area just above the center bolt on the left side that is the ‘chrome’ layer completely lifted from the plastic and it cannot be effectively repaired. If it’s a matter of cost and you’re play with a good enough solution you could get a chrome plastic model paint and paint it over but it almost certainly won’t give a seamless or perfect match.

ahj3939 (Score: 1): I might be tempted to attempt a refinish. The black trim is still sold but they are $342 MSRP. The silver part is NLA. Of course you should NEVER pay MSRP, that would run about $285 at my dealer with discount.

I replaced the black part on my non-M and it was closer to $50, and it went NLA soon after.

In either case I would remove the console as to not risk damage to the other parts: https://www.reddit.com/r/ManualTransmissions/comments/1fsjcvw/what_do_i_drive/"
1njh0cc,Best first project car for moddinf,"I've done maintenance on my daily and mild mods like exhaust, intake, etc but I want to get into actually modding cars what's the best one for modding I literally do not care I've been looking at G37/35s, q50s, 350/370s, BMWs the 90s to 2010s, civics and older mustangs and Corvettes, single cab trucks, any and all cars I've thought about getting I keep flip flopping from one to another what do you think is the best for making fast and fun budget is about 5k (I'm willing to do almost any work on it) ",0,1758124569.0,3,CarTalk,1758224065,2025-09-17 15:56:09,2025-09-18 19:34:25,"Insertsociallife (Score: 2): As much as I want to say Miata, it's hard to make them fast. 

S2000 maybe? C5 Corvette if you want more speed?

daquariusx (Score: 2): 05-09 mustang

Super_Low3189 (Score: 1): 2g DSM. Cheaper, easy to work on and have tons and tons of fun ways to make them fast."
1njgwcd,Is this rim repairable?,,1,1758124314.0,1,CarTalk,1758224065,2025-09-17 15:51:54,2025-09-18 19:34:25,"Pukit (Score: 3): Depending on where you are. In the UK you can get cracked alloy rims welded. I did a load for BMW owners over the years. I say in the UK, as when I moved to Aus I found its illegal over there. 

Google alloy wheel rim crack repair and you’ll find people."
