id,title,selftext,score,created_utc,num_comments,subreddit,scraping_time_utc,created_datetime_utc,scraping_datetime_utc,top_comments
1njtdds,2018 Dodge Journey catalytic converter,"So my engine light came on a week ago and I had a test ran. PO420. Guy gave me the stuff to put in my tank, said it would be a hit or miss but worth a shot. Did it, now a week later engine light is back on. Went back to see what’s up, same issue. PO420. Guy tells me I need to get a new catalytic converter. Thing is, I bought this car just over 10 months ago, it now has 90k miles on it, when I bought it, it was at 74k.. meaning, they sold it to me with 6k miles left under federal emissions warranty. Now, I’m out of warranty and need a new converter on a car I’ve had for 10 months. How do I handle this with them cause I absolutely do not want to pay full price for this. Also, here’s a pic of my exhaust. If anyone wants to chime in on how bad it is based on the photo, go ahead. I’m clueless here. ",1,1758153538.0,6,MechanicAdvice,1758224065,2025-09-17 23:58:58,2025-09-18 19:34:25,"Ultimagic5 (Score: 1): That's a muffler 

The cat is right after the exhaust manifold(s) and you can't tell by looking at it, the code is evidence of how bad it is.

Troy-Dilitant (Score: 1): The picture offers no clues of anything. It looks pretty normal.

There are a number of possibilities for P0420:

Leaded fuel was used where unleaded was called for (unlikely) 

A damaged or failed oxygen / O2 sensor 

Downstream oxygen sensor (HO2S) wiring damaged or connected improperly 

The engine coolant temperature sensor is not working properly 

Damaged or leaking exhaust manifold / catalytic converter / muffler / exhaust pipe 

Failed or underperforming catalytic converter (likely) 

Retarded spark timing (unlikely in modern computer managed engines)

The oxygen sensors in front and behind the converter are reporting too similar of readings 

Leaking fuel injector or high fuel pressure 

Cylinder misfire 

Oil contamination

(Read more at: https://www.obd-codes.com/p0420
Copyright OBD-Codes.com)

I personally think it more likely to be the O2 sensor(s) if they haven't ruled it out by diagnostics. 

You can get aftermarket/universal convertors and have an exhaust shop weld it in; but they have a very poor reputation for lasting long.

You'll have to pay whichever is the problem if it was purchased ""as-is""."
1njsu9z,What is this noise,Any guesses on this noise im hearing? To me it sounds like some type of metal on metal rubbing. Nothing feels different when I drive. 2015 Ford F-150,2,1758152076.0,4,MechanicAdvice,1758224065,2025-09-17 23:34:36,2025-09-18 19:34:25,ZookeepergameGlad975 (Score: 1): Your truck. Hope this helps 🙂👍
1njsrdk,"1995 Eagle Talon leaking coolant from this spot. where is this coming from? can I seal it somehow, or what will I need to replace if not?",,1,1758151854.0,3,MechanicAdvice,1758224065,2025-09-17 23:30:54,2025-09-18 19:34:25,GearedCam (Score: 2): Is that the bottom of the timing belt cover?  If so it's probably the water pump.
1njsq4w,What wrong with my car,Drove over slightly flooded street 2-3 inches max nothing serious just wanted to make a big splash so my speed was up….noticed my Camry would this rattling/creaking sound when idling in drive every so often . No problems with vehicle besides sound ,2,1758151763.0,5,MechanicAdvice,1758224065,2025-09-17 23:29:23,2025-09-18 19:34:25,"Shehab86 (Score: 2): Could be something got lose

jb__001 (Score: 2): Take it in to a mechanic just to be sure, but it sounds like your engine could be damaged. If it was 2-3 inches of water your engine would not be damaged from that but if it made a big splash it was probably more than 3 inches. It also could just be something loose rattling against the frame of the car or something but you’re gonna have to get under the car or have someone get under it to figure it out."
1njsnqt,Uneven rear brake wear Ram1500,"Noticed a grinding and swishing noise from the rear, checked it today and I have this uneven wear on justbthe driver side. Pins slide okay, could use some lube but far from stuck. Think the caliper needs to be cleaned/relubed? ",1,1758151576.0,6,MechanicAdvice,1758224065,2025-09-17 23:26:16,2025-09-18 19:34:25,"NPSolid (Score: 2): Check the slide pins make sure they slide nice and easy. If one is getting stuck it can cause this.

Hefty_Club4498 (Score: 2): I'm willing to bet that the pads don't slide freely.  Clean the caliper brackets, and lube the ends of the pads where they slide.  Clean and lube the caliper pins as well.  Provided the caliper boots look decent and the pistons compress without great effort, you should be fine.  I see this often on trucks more frequently than cars given the larger size brake pads."
1njsby8,TPMS issue,,1,1758150704.0,3,MechanicAdvice,1758224065,2025-09-17 23:11:44,2025-09-18 19:34:25,"BoxxBodySprings (Score: 1): Typically, when the sensors are first installed they should have a self program mode that when you drive for a few mins, the system picks up on the sensor and the dask error light goes out. The other issue is, is the sensors the correct one and the correct frequency.. or does it have multiple frequencies"
1njs5pm,I already replaced catalytic converter. Why am I still getting the P0 420 code?,I have slow acceleration when in first gear as well ,0,1758150253.0,88,MechanicAdvice,1758224065,2025-09-17 23:04:13,2025-09-18 19:34:25,"Zainzyy (Score: 39): You installed a low quality cat.

Alpinab9 (Score: 10): Year, make, model, engine, please. Replaced with what part? Slow acceleration in 1st... is this a manual transmission. Is it generally underpowered in all gears. Is this recent?"
1njs4b1,Would greatly appreciate if someone could tell me what happened here or what this issue is,2005 Honda accord,1,1758150150.0,8,MechanicAdvice,1758224065,2025-09-17 23:02:30,2025-09-18 19:34:25,"xMebesx (Score: 3): CV joint missing/broken

Jimmy543o (Score: 2): CV axle took a shit. Lucky it didn’t take out the oil filter in the process. You need a new CV axle. Might want to check the other side also."
1njs03b,Metal-on-metal scraping,Anyone have any idea on what this sound is? I was thinking something with the rotors but Im no professional and wanted to see if any of you had a strong opinion on it,1,1758149856.0,2,MechanicAdvice,1758224065,2025-09-17 22:57:36,2025-09-18 19:34:25,dogma9999 (Score: 1): It’s definitely the dust shield behind the rotor. Its the rotor turning and contacting the dust ccover that makes the sound. Just a simple pull it back will fix it
1njrte7,Blown Head Gasket??,Is this a blown head gasket? I did a combustion leak test. it's not super yellow so I'm assuming this is a small leak or crack in the head gasket? ,2,1758149384.0,3,MechanicAdvice,1758224065,2025-09-17 22:49:44,2025-09-18 19:34:25,"pizzabooty (Score: 2): Thats an indication of exhaust gas in the coolant. Could be a head gasket, crack in the block, or a damaged cylinder head. Other symptoms and diagnostics will give you the answer, its hard to say from this alone.

ziksy9 (Score: 1): You generally need to remove some coolant so it doesn't get pushed up during the test.

Either way if it's turning green, there's probably a head gasket leak/crack.

Do another test to confirm and move on to a leak down test if you have the ability."
1njrrz6,Turning a regular car into an autonomous car,"Is it possible to turn a regular 2006 Honda civic into some sort of autonomous car? Meaning can someone steer, brake or accelerate your car while you are driving it? Making you accelerate faster than you think you are, steer your car if you are veering over to another lane etc?  ",0,1758149283.0,12,MechanicAdvice,1758224065,2025-09-17 22:48:03,2025-09-18 19:34:25,"Ravenblack67 (Score: 3): no

lonerwolf85 (Score: 2): That's what a traffic ed car is."
1njrl7y,Strange noise coming from wheel?,,1,1758148813.0,3,MechanicAdvice,1758224065,2025-09-17 22:40:13,2025-09-18 19:34:25,TryImaginingDragons (Score: 1): That sounds like it’s coming from your engine
1njr3dt,Alternator belt," Hello all, I drive a Suzuki swift 2007 petrol car.
Today while driving, the belt cut off and the battery displayed on the dashboard. I was able to move it away from the motorway and park it safely. The alternator belt has cut off but what I also noticed was the coolant was draining very fast. Is it that the alternator belt also works as a water pump or maybe the gasket is blown? 

Just want to know so I can inform the mechanic because majority of them keep charging me for different things that isn’t the issue ",1,1758147572.0,8,MechanicAdvice,1758224065,2025-09-17 22:19:32,2025-09-18 19:34:25,"DanielZrb (Score: 1): This may not answer your question directly but if the belt tore off the pulleys then your alternator will no longer spin which caused the battery light. As for your coolant draining that's separate but definitely could've been the cause of the belt blowing off. Do you think your water pump blew up?? What could've happened for a coolant leak and a torn pully? Damn

Civil-Fan-3586 (Score: 1): Alternator belt often drives coolant pump as well. In your case the pump died, that's why it dropped the belt "
1njr20c,First time changing a battery terminal and just want opinions on how bad this looks and if i'll be good to drive around with it for a couple weeks because it's just temporary! is this safe enough to go around town for a few weeks?,,114,1758147474.0,64,MechanicAdvice,1758224065,2025-09-17 22:17:54,2025-09-18 19:34:25,"XNN7 (Score: 227): Good enough to be permanent.

Hefty_Club4498 (Score: 78): As long as it's tight, it's fine.  I see worse things everyday."
1njqxwf,Car not starting after changed battery,"Put a brand new battery to this 2013 Honda accord 3 days ago after it would not start/lights dimming on start up. Car started up and has ran fine to and from work for the last 3 days after putting in the new battery, today this happened when trying to leave work. 

Any thoughts or suggestions? ",2,1758147191.0,8,MechanicAdvice,1758224065,2025-09-17 22:13:11,2025-09-18 19:34:25,"Unable_Feedback7338 (Score: 3): Check your battery connections, and then alternator with a charge test, I think autozone or one of those places do it for free, maybe an independent shop will too, if you can get it started or towed in

Super-Interaction-46 (Score: 2): Your battery is out of juice. You already gotten a new battery and it's still dying on you. That's pointing to a failing alternator not capable of recharging your battery.  Your old battery probably was still good but since your alternator was going bad, it wasn't charging it properly and had you thinking it's a car battery if you didn't get it tested out whether the battery was still good or not."
1njqxtd,Is this a good quote for my 2007 F-150 2 door?,I’m in Miami if that helps. Thanks!,1,1758147185.0,4,MechanicAdvice,1758224065,2025-09-17 22:13:05,2025-09-18 19:34:25,jackofnone2025 (Score: 1): It’s good if you are happy!  I can do that for about $400
1njqxjz,Am I cooked,,3,1758147169.0,4,MechanicAdvice,1758224065,2025-09-17 22:12:49,2025-09-18 19:34:25,"Ok_Initiative2666 (Score: 5): You need to clean those mating surfaces better

ranoutofusernames22 (Score: 2): With putting like that you do have a good chance of developing a head gasket leak. A machine shop can deck it but you need to compensate for the lost material, as it will slightly increase your compression."
1njqw5f,Squeaking; maybe brakes?,"I have an old 2007 Chevy Avalanche. The wheel area makes 2 different kinds of squeaking noises. One wind breaking, which I’m sure is just because I need new brake pads but the second is when I’m driving without my foot on the break, that is the quieter squeak in the video. Is that just a stuck brake pad that slowly grinding down? Would a brake repair shop be able to diagnose this?
",1,1758147072.0,3,MechanicAdvice,1758224065,2025-09-17 22:11:12,2025-09-18 19:34:25,TryImaginingDragons (Score: 1): Have you checked the pads? It sounds like that one is gone.
1njqqd8,"Help plz identifying reason why behind rotor wall is doing this. Im replacing rotors and pads very soon, is it the calipers that would cause this?",The top of the inside rotor wall where the rivet looking things are in sunken down in one spot on front rotors only.    What do you think is wrong? ,1,1758146684.0,16,MechanicAdvice,1758224065,2025-09-17 22:04:44,2025-09-18 19:34:25,"JRS___ (Score: 3): it's a balancing cut. carry on.

_Blumpkinpie_ohmy_ (Score: 1): Sorry mod. Its a jeep grand cherokee laredo 2015, getting ready to buy new rotors and pads for front and rear. Making sure Im not missing something."
1njqpgu,Whats this brown sludge on my battery,"My battery light came on while idling. I turned it off and back on and it went away. Started driving again and randomly all of my lights flashed for a second but didn't have any issues so i kept drivong. As im turning i lose my power steering so i pull over again and i look under the hood to find this. Never seen it before and i am beyond confused. 
Wouldn't let me post picture so its in comments ",1,1758146618.0,2,MechanicAdvice,1758224065,2025-09-17 22:03:38,2025-09-18 19:34:25,Competitive-Effort11 (Score: 1): https://preview.redd.it/pj9469p1tspf1.jpeg?width=2316&format=pjpg&auto=webp&s=8ba9429597e8af84fbb182824620884adefe5d7d
1njqkjv,What causes my wheel and floor to rattle?,,2,1758146296.0,4,MechanicAdvice,1758224065,2025-09-17 21:58:16,2025-09-18 19:34:25,421jms (Score: 1): Potential options are a wheel severely out of balance or a worn out suspension part
1njqk45,2012 Camry. Can someone help identify this wire?  Connector broke.,,1,1758146265.0,9,MechanicAdvice,1758224065,2025-09-17 21:57:45,2025-09-18 19:34:25,"421jms (Score: 3): According to this post it’s your oil pressure sensor



https://www.reddit.com/r/MechanicAdvice/comments/13385j3/what_is_the_name_of_this_sensor_on_my_2012_25l/

xMebesx (Score: 2): Is that under the intake manifold? Looks like the knock sensor.


Edit: I just looked up the part, it's not the knock sensor."
1njqftr,"Chat, am I cooked?","I’ve had this ‘86 GMC S15 for a year. The previous owner let me know there was an oil leak, I top it off every week or so. My car will smoke sometimes, I’m assuming when the oil drips somewhere hot (lol). I don’t have the funds to diagnose where the leak is coming from, but here’s some photos:",1,1758145964.0,2,MechanicAdvice,1758224065,2025-09-17 21:52:44,2025-09-18 19:34:25,Ok-Pilot5307 (Score: 2): I think you'll be fine if you fix it sooner than later but I recommend spraying degreaser all over the sides of the motor and then look for the leak it'll make it wayyy easier
1njq902,Honda CRV 2011,"Car battery died, got it jumped it started then stopped right after. Now can’t get it to go again. New battery, new fuel pump, all spark plugs, relays, and fuses good! Any ideas? ",1,1758145490.0,2,MechanicAdvice,1758224065,2025-09-17 21:44:50,2025-09-18 19:34:25,"p0thetic (Score: 1): Could be your starter, happened to me. Now I don’t have heavy keys when I drive, just happens to be wear and tear, Toyota Camry 2005"
1njq5he,Blue smoke out exhaust,"I own a 91 RS Camaro with a 305 TBI, and at almost every time the engine starts up, a bunch of blue smoke comes out the exhause and then if I rev or accelerate fast after turning the car on, more will come out, I'm not losing much oil at all according to the dipstick, any idea on what this could be?",1,1758145254.0,2,MechanicAdvice,1758224065,2025-09-17 21:40:54,2025-09-18 19:34:25,warrior_poet95834 (Score: 3): Smoky startups are usually the result of valve stem seals. It’s not a huge job and you can probably get somebody to help you do it yourself and it’s not expensive so before you invest a lot of money in a 305 you might consider it. Do a leak down test first and see if you’ve got other issues.
1njpyli,Evap leak testing on a 2019 Hyundai Sonata,My friend's car has an evap leak somewhere and I would like to know if any of you have used a mityvac vacuum/pressure pump and soapy water to diagnose it? I dont really want to buy a smoke machine and the leak isnt super obvious.,1,1758144786.0,3,MechanicAdvice,1758224065,2025-09-17 21:33:06,2025-09-18 19:34:25,PPVSteve (Score: 2): Sure you can use Air pressure.  No more than say about 10 psi and plug it in at the purge valve to eliminate that valve.
1njpwu3,Clicking noise when hitting wheel at 9 and 3,"Car is a 06 bmw rwd.


When removing the rear wheels last night and hitting the rubber to free the wheel from the hub, I got a clicking noise when hitting at 9 and 3. Away bar links looked good and didn’t have play when moving them. Sometimes this noise happens when I go over a crazy bump in the road?

Ideas? ",1,1758144666.0,2,MechanicAdvice,1758224065,2025-09-17 21:31:06,2025-09-18 19:34:25,Agreeable_Flight4264 (Score: 1): Also no play on the wheel
1njpppb,Does this crankshaft pulley (?) need to be replaced?,,1,1758144179.0,10,MechanicAdvice,1758224065,2025-09-17 21:22:59,2025-09-18 19:34:25,"wirey3 (Score: 2): What makes you think that's necessary

Also, look up a belt routing diagram to confirm which pulley you're talking about"
1njpfel,2015 Accord Struggling to Start,"battery died a couple days ago, got jump started and took it to Oreilly’s where it was tested and in “good condition”.  did not test alternator at the time as I walked the battery to my nearby shop

Battery is 3.5 years old, probably been used about 3 years

After the jump start, Oreilly’s visit where they offered to charge it for a half hour, I drove it around a couple days with no issues.  

This morning, this happened.  Not super obvious, but there’s a notable stutter and seems like lack of power to start it up.  Seems far less drastic from when the battery was dead, and also doesn’t sound like the starter failure when I had to replace that about ~1yr ago

Any ideas as to if it’s just the battery? Alternator?",1,1758143485.0,4,MechanicAdvice,1758224065,2025-09-17 21:11:25,2025-09-18 19:34:25,"GakeeeYT (Score: 2): I think you're worrying too much, my 2016 does the same on the oem starter and has for years"
1njpf54,How necessary is brake cleaner?,seen this deal and wondering if I should buy the break cleaner.. is 3 too many? should I just buy one or is none good enough? ,0,1758143467.0,12,MechanicAdvice,1758224065,2025-09-17 21:11:07,2025-09-18 19:34:25,"grizzdoog (Score: 10): If you are installing new rotors I consider it necessary to clean the rotors off before use since they are coated with protection oil.  One can is usually enough. Is that what you mean by “how necessary is brake cleaner?”

No_Mathematician3158 (Score: 3): Brake cleaner is great to have extra around. I always enjoy a good brake clean deal."
1njp8y8,"What is this noise, it's driving me nuts. Do i need a new alternator?",Why is it so loud? Alternator bearing going bad?,7,1758143061.0,4,MechanicAdvice,1758224065,2025-09-17 21:04:21,2025-09-18 19:34:25,"heyu526 (Score: 2): Use a mechanic’s stethoscope to localize the noise

blindalbertan (Score: 1): If you can then just pull the belt off and spin the pulley by hand, if it’s noisy then that’s it, if it’s smooth and steady then it’s something else. Sounds like a bad bearing but hard to say"
1njp8pc,Mechanic says I should replace control arm bushings. Are they right?,"I've got an '09 Honda Fit, it's got about 70,000 miles on it. I don't believe the control arm bushings have ever been replaced (got it used 5 years ago so not 100% sure). I know essentially nothing about cars, just looking for general advice (am I driving a death trap? Is this something I can wait a year or three? is the mechanic trying to rip me off?). Pretty expensive service, so yeah, just want to know what I'm looking at. Thanks so much!",1,1758143044.0,20,MechanicAdvice,1758224065,2025-09-17 21:04:04,2025-09-18 19:34:25,"heyu526 (Score: 6): 
Yes

DryAsk367 (Score: 3): Replace whole control arm both sides and alignment"
1njp4op,REPAIR ESTIMATE ADVICE:,"car needs rack n pinion, front exhaust flex joint, right outer tie rod. 

$1750 

on a 2003 toyota camry

is the price fair for work needed to be done? ",0,1758142787.0,2,MechanicAdvice,1758224065,2025-09-17 20:59:47,2025-09-18 19:34:25,"Unfair-Oven8363 (Score: 1): A steering rack is a pain in the butt to replace and the part isn't cheap.  I'm not surprised at the quote, but I'm not sure if it's a fair price.  I haven't had this professionally done before."
1njp2x7,"HELP!!! 2017 Chevy Silverado 5.4L V8, sudden high RPM & MPH when driving",,2,1758142667.0,4,MechanicAdvice,1758224065,2025-09-17 20:57:47,2025-09-18 19:34:25,fallout76sucks1 (Score: 1): Are you hitting the gas and that happens? I suspect rpm is normal if you are and either youre slipping tires or faulty wheel speed sensor
1njp2xm,I messed up,"Hey guys, I was in the process of replacing my head gasket for my prius. Disconnected all the plugs and connectors on my wiring harness to clear the engine for the cylinder head removal. While I was removing hoses, I totally forgot to drain the coolant. One hose that I disconnected sprayed all over the engine bay with my connectors unplugged. 

I know I messed up big time. I immediately wiped everything off with my shop towel.

I'm worried all that coolant residue after evaporating will mess up my connectors pins and what not.

What can I do here? Any help is appreciated. Thanks!",1,1758142668.0,8,MechanicAdvice,1758224065,2025-09-17 20:57:48,2025-09-18 19:34:25,"Motor-Read539 (Score: 2): If your really worried spray the connectors with some contact cleaner.

JrStu (Score: 1): Get WD40 contact cleaner."
1njp2c3,Is this a reasonable estimate and diagnostics for overheating problem? 99 Pathfinder LE,I recently bought a 99 Pathfinder LE. It seemed straight when I went to check it out but a couple days after buying it realized it wanted to overheat with the AC on. I'm certainly not a professional mechanic but do most of my own car work and have never taken a car to a shop for work so I'm a bit naive in that world. Been out of town on work and haven't had much time to check out this problem so decided to just take it to a shop and see what they can do. They charged $160 for diagnostics and came up with it needing a radiator and thermostat. To me it seems that they didn't investigate the problem very thoroughly and just blamed it on debris blocking the radiator with one blurry photo. The estimate of just under $1k for a thermostat and radiator also seems crazy to me especially not knowing if that is the true problem. Again I'm naive when it comes to mechanic shops. Am I crazy for thinking this is way too expensive with no guarantee of being the solution?,1,1758142628.0,11,MechanicAdvice,1758224065,2025-09-17 20:57:08,2025-09-18 19:34:25,"NeitherHelicopter993 (Score: 1): Yep. Perfect.

Which-Confidence-215 (Score: 1): Yeah bend over and take it like a man"
1njp0ke,Sway bar link 2005 lexus es330,How do i remove this sway bar link. I'm not able to fit my braker bar.,1,1758142510.0,5,MechanicAdvice,1758224065,2025-09-17 20:55:10,2025-09-18 19:34:25,"RepresentativeArt129 (Score: 1): https://preview.redd.it/syzstf7rmspf1.jpeg?width=2252&format=pjpg&auto=webp&s=0a4b350ff48fb2854c5b5af0e2f25d9f9df33587

ka36 (Score: 1): Are you replacing both sides? If you disconnect the top of the other link you can rotate the sway bar upwards and get all the room you need"
1njoyu3,Passenger side brake pads wearing slightly faster than driver side,"Hey all,

I've noticed something when changing the rear pads on my 2015 VW Jetta, the two pads on the passenger side are worn maybe 10-20% more than the pair on the driver's side.

I checked the front pads and even tho I could only see the outter pad without taking the wheel off, it's the same. Passenger side is worn more than the driver side.

What would be causing this? Is it something I should be concerned about? The car seems to stop fine but I'm worried that I'm driving around a ticking time bomb.",2,1758142396.0,2,MechanicAdvice,1758224065,2025-09-17 20:53:16,2025-09-18 19:34:25,RickMN (Score: 1): The passenger side always wears more than the driver's side in the U.S. due to road crown and the inner pad always wears slightly faster than the outer pad.
1njowec,Need help novice broke bolt honda power washer,Hi guys as the title says I’m a novice and need some help and recommendations what i would need to remove this 6m broken bolt from my power washer it’s a honda gvc 160 honda engine on the power washer.  Is there any chance i can remove this if so what tools would i need to buy tia ,1,1758142237.0,5,MechanicAdvice,1758224065,2025-09-17 20:50:37,2025-09-18 19:34:25,"LWschool (Score: 3): You drill it out, and use an extractor set. Look on amazon or most local auto places will have a set."
1njovox,Hi guys I’m dumb - manual transfer case,"I’ve got a 06 Silverado with manual transmission and transfer case. This is more of an anxiety rant than a request for help! 

Had my foot on the clutch, trans in 1st, stopped in my driveway. I dropped my phone and didn’t realize I knocked the transfer case selector to N when I picked it up. 

I let go of the clutch and lean into the gas, and, naturally, I don’t go anywhere. I realize my error, and, with the clutch pressed, I pull the selector back to 2hi. 

*CRUNCH*

I had left the transmission in gear, and I guess there was a little clutch drag that kept the output shaft spinning even with the clutch disengaged. Oops. 

Now I’m going to spend the next week anxiously listening for new transmission noises. Very unhappy. End rant. ",1,1758142192.0,2,MechanicAdvice,1758224065,2025-09-17 20:49:52,2025-09-18 19:34:25,Sea_End9676 (Score: 1): It'll be fine.
