id,title,selftext,score,created_utc,num_comments,subreddit,scraping_time_utc,created_datetime_utc,scraping_datetime_utc,top_comments
1mht8vt,Question about cracks on tire,"I just noticed my front right tire has a couple cracks on it. I can see the tires will need to be replaced soon regardless, but I wanted to ask how urgent it is given those cracks? Thanks for your help and advise!",0,1754349957.0,4,CarTalk,1754422792,2025-08-04 23:25:57,2025-08-05 19:39:52,"NASA1967 (Score: 2): I would replace those as soon as you can and avoid the freeway or speeds near it.

Opposite_Opening_689 (Score: 1): I’d replace them

Sakic10 (Score: 1): Those are from rubbing against something."
1mhs6sw,What can I do to my car as a beginner?,"I’ve got a pretty crappy 2004 Toyota Camry LE that I awoke from the dead and have now been driving the crap out of. I really want to get into working on cars, but I’m not exactly made of money. Nearly all mods that I’ve heard people mention to me would use up half the money in my bank account. Is there anything I can do that won’t cost too much just as a gateway to get started with working on my car? Oil, battery, and brake pads were all changed before I even started driving, but I had a friend doing it so it doesn’t really feel the same. I really just want to get my foot in the door with working on my car in some way. I’ll accept and look into any serious advice given 🙏 ",5,1754347259.0,30,CarTalk,1754422792,2025-08-04 22:40:59,2025-08-05 19:39:52,"antevans245 (Score: 9): See what maintainance it needs before anything else. Check your air filters and change spark plugs if it needs it. Jack up each wheel and shake it down for any play. Check your fluids too. Make sure they all look clean and aren't low

Creeping-Death-333 (Score: 7): Camry and mods are not two words that should be in the same sentence. It’s a shit box economy car. Just learn to do basic maintenance on her. That’s all you need to do right now

gzetski (Score: 13): Slam into the back of a bus so you can learn how to replace the front bumper, grill, radiator. Doing burnouts with the steering wheel turned all the way left will introduce you to CV axles as well."
1mhrdcx,Pros and Cons of owning,"this beast! debating if should i buy or not lol 
",39,1754345279.0,112,CarTalk,1754422792,2025-08-04 22:07:59,2025-08-05 19:39:52,"Right_Hour (Score: 187): I own an actual ex-Marines Humvee (M1043) and can’t think of any pros of owning one. Nope, none whatsoever. Even for off-roading I enjoy my old LR Defender way more.

SomewhatLargeChuck (Score: 44): As a former valet that used to have to park shit like this in a city: NOOOOOOO

LifeWithAdd (Score: 105): Does it get good gas mileage - No






Does it go fast - No





Is it quiet and comfortable - No




Is it affordable to repair - No




Does it fit down the off road trails - No 






Will everyone think you’re a douche - Yes






Do I still kinda want one - Yes! 







Really though a Land Cruiser would be an infinitely better buy."
1mhqc20,I need some help finding Three spoke rimsw,"Basically I’m looking to get a fresh pair of 3 spoke rims for my FC RX-7 what comes to mind for you guys I can only think of the Rota HM3s I am based in Europe so preferably available in Europe without having to fork over 5K
Thank you in advance (I honestly don’t know what flair I needed for this)",1,1754342850.0,4,CarTalk,1754422792,2025-08-04 21:27:30,2025-08-05 19:39:52,BIZLfoRIZL (Score: 1): Some Advan SA3 or SA3R would look great.
1mho59l,Gap in the sliding pin on brake caliper,"Changed my pads and the caliper has these gaps on both the upper and lower sliding pin, other side went on much closer. Anything to be worried about? The pin is still tightened all the way.",2,1754337894.0,5,CarTalk,1754422792,2025-08-04 20:04:54,2025-08-05 19:39:52,"RentonZero (Score: 2): This is fine

NiceWeaknee (Score: 2): Looks like ""ATE"" style brake caliper, the pin is supposed to look like that.

sd_slate (Score: 2): The boot got pushed in as you screwed in the guide pin. You can try to squeeze it up over the ridge it's caught on or just forget about it."
1mhnp9i,What do I do?,"I was working and where I had to go has no space really for me to turn when pulling out. Today, as I was pulling out of my spot and I tried to be careful cause I could hit my client’s grandmother’s car next to me. I heard something when I turned and I parked. The grandmother’s sister and neighbor ran quick to it. They signaled for me to just keep driving and it’s okay. I pulled down my window and asked if I hit anything and they said it’s okay we will fix it and asked if I was okay. I said i was fine and i’m more worried about if i hit the little garden fence and they just kept saying it’s all good we got it. I drove away but i can’t stop thinking about it and if it’s bad or not. Everyone said it was okay but i feel like it’s not. I don’t know if i should’ve done more. 

Edit: I texted the grandmother to let her know what happened and to let me know if i damaged anything.",0,1754336892.0,3,CarTalk,1754422792,2025-08-04 19:48:12,2025-08-05 19:39:52,"Mission_Feeling_3328 (Score: 1): should i contact to let the grandmother know?

zoomzoomsoup (Score: 0): if they told you you’re good, then it’s good but id feel the same way honestly 😭 the part about being careful not to hit the car next to you is real too that’s why i always back in bc there’s no way im getting my truck back out of the space if i pull in and someone parks too close to me lol but yeah you could always stop by and ask them if they need help but it seems like they were just nice and didn’t want you to worry about it and it probably wasn’t as bad as you thought if they were telling you it’s okay don’t stress it!"
1mhnedm,Black paint on headlights removal.,"So, my boyfriend just bought this old car, and it was from a bit of a sketchy area, so of course they painted over the headlights in Black. does anybody know the best way to easily remove it without fogging up the headlights? ",0,1754336223.0,2,CarTalk,1754422792,2025-08-04 19:37:03,2025-08-05 19:39:52,cty_hntr (Score: 4): Headlight polishing kit.
1mhmzbe,Oil spill or leak new to owning a car,"Hi everyone this is my first car ford police interceptor sedan. I got it about a month ago and pretty much got an oil change immediately.  I also got it inspected by ford dealership before purchasing it and they said it was in good shape apart from a small leak that I shouldn’t even worry about (showed me a picture and it was basically just wet underneath no drips). In a month of owning it I’ve driven about 500-700km and oil life went down 88% which I think is normal. However today I just did a 200km trip and I opened my hood to find a wet spot near my fill cap.

Not sure if it’s when the mechanic filled up my engine oil or something worse.

If anyone has an idea let me know. It would be greatly appreciated! Gracias!!",1,1754335286.0,24,CarTalk,1754422792,2025-08-04 19:21:26,2025-08-05 19:39:52,"Tomytom99 (Score: 12): Seeing that the oil is on top of the valve cover, I'm inclined to say it's just a spill. Just wipe it up with a paper towel or a rag and see if more oil comes back over the next few days/weeks.

ZealousidealFun2268 (Score: 2): It’s either a spill or a leaky oil cap.

Thick_Winter9132 (Score: 2): Could be leaking from that pcv valve right there next to the oil cap or could be a leak good news is this are famous for leaking and easy to take out and put a new one in "
1mhlqu1,Rough idle on cold start up,"I bought this car around November last year, it's a 2013 Mk7 golf 1.4 tsi. It has around 82k on it and the service book shows it's been looked after, serviced yearly including 4-5 of the services done at a VW dealer. The owner also serviced it prior to selling. 

Since purchasing it, I have noticed that the car, only on its first start up from cold, will idle rough when I do anything that adds any sort of load to the car. Pressing the clutch, turning the steering, turning on the AC. It will only do it once, after that it runs perfectly fine. It only lasts 4-5 seconds but you can feel the car shaking during this. After that, when the cars warm, no issues. If I let the car warm up and then do anything, no issues. 

It's just strange because there are no issues whilst driving apart from very very minor engine shakes as the cars idling, just the engine running. I'm probably being abit harsh on it but I can feeling the engine running compared to my brother's Mk7, again a 1.4tsi but it's an auto. 

Any ideas what this could be? Thank you",4,1754332584.0,5,CarTalk,1754422792,2025-08-04 18:36:24,2025-08-05 19:39:52,"MuslimSinner69 (Score: 2): I have a similar situation with a petrol car of mine. I wonder what it can be?

oggiej (Score: 1): Leaking injector"
1mhl1si,Is this what a Freon leak looks like?,"I'm tracking down a potential leak in my 2010 Honda Civic (which is causing intermittent compressor clutch shutdown). I recently had a brand new compressor put in, and the only place I've found some dye with a UV light is where the new compressor attaches - but I've never looked for leaks before and I can't tell if this is a serious leak or not. Maybe it's just leftover dripping from installation?

I also noticed that when I untwisted the caps on the H and L valves, they hissed like opening a soda. This would lead me to believe that my valve cores (which are stock) are leaking?

The leak could also be in the evaporator core, and I'm considering renting a sniffer to test that.",37,1754331091.0,16,CarTalk,1754422792,2025-08-04 18:11:31,2025-08-05 19:39:52,"Little-Choice-9936 (Score: 24): there are schrader valves under the caps that will need replacing. take it to an a/c shop where they have sniffers to detect leaks, then vacuum it out and recharge the system

Mortimer452 (Score: 2): The pics you have shown could easily be leftover from the compressor installation.  I would get the area as clean as you can first, check with blacklight to make sure no dye is visible, then add more dye to the system (if it doesn't already have any).  Maybe take a few reference photos under blacklight so you have a good before/after.

If the caps are hissing when you remove, that shouldn't happen, definitely sounds like a bad valve core.

Ordinary_Plate_6425 (Score: 2): If it's hissing when removing the caps, start there."
1mhkbai,"2015 WRX - Zero boost, car sounds like it’s supercharged. No CEL popping up","Does anyone know what could be attributing to this Hiss/windup sound?

Did some work on the car recently, I cleaned the valves and TB, everything felt great at first cleanest, strongest pulls I’ve had since owning it. About 15 miles in, I started losing boost and heard a weird noise. Boost dropped from around 13PSI down to peaking at 7PSI, then eventually heard a loud pop.

I assumed it was the intercooler boot (it’s happened before), but after checking everything no leaks, no boots popped off, and everything looks cleaner and more secure than before. Reflashed the ECU thinking it could be tuning-related, but the issue remains. No check engine light either, which makes troubleshooting more frustrating.

All sensors have been plugged in and there is no boost leaks. I feel like this is ECU driven as I’m hard stuck at -1.8 PSI of boost no matter how hard I pull.

The car idles fine, my AP is showing nothing abnormal with my AFR/ AF learning.",14,1754329542.0,32,CarTalk,1754422792,2025-08-04 17:45:42,2025-08-05 19:39:52,"nnabat1000 (Score: 27): Sometimes you can get hidden boost leaks have you smoke tested the car? It could also be that your turbo went caput check the turbine for play

eatsomepizzamaybe (Score: 20): Your turbo is cooked

HeavyDutyForks (Score: 7): If you take the piping off, can you spin the turbine wheel by hand on the turbo?

That does not sound good..."
1mhk9cu,Can anyone id this (vintage?) OMP wheel?,,0,1754329427.0,2,CarTalk,1754422792,2025-08-04 17:43:47,2025-08-05 19:39:52,"Najgi021 (Score: 1): Have you tried Googles picture search?

Little-Choice-9936 (Score: 1): cant say offhand, but google shows a bunch of them, 300-900$ depending on details"
1mhiuy1,BUYING A CAR NEED HELP,"i want a car thats Cheap, reliable, and looks good.

i want to Delete the muffler and get a downpipe 

i dont know to much about cars

my budget is 8000
",0,1754326413.0,5,CarTalk,1754422792,2025-08-04 16:53:33,2025-08-05 19:39:52,"misterrF (Score: 9): No. Don’t do this. I mean the cheap and reliable part yes, but don’t delete the muffler and start doing mods. You’ll destroy reliability and resale and annoy the ever living hell out of everyone within a mile radius. Just get a decent reliable car and teach yourself basic maintenance.

NewoMadness (Score: 4): > ""i want to delete the muffler and get a downpipe""

...

> ""i dont know anything about cars""


just buy a honda civic, op

Beautiful_Month_4109 (Score: 3): Depending on the jurisdiction you are driving in, a missing muffler can buy you a ticket for excess noise.  Don't be that guy."
1mhiupk,Safe or not?,Safe to drive on and put vulcanising cement on it or buy new tires? ,1,1754326398.0,6,CarTalk,1754422792,2025-08-04 16:53:18,2025-08-05 19:39:52,"No-Raisin-6469 (Score: 2): Strength comes from the inner wires and fibers, not the rubber. You're good.

Like someone said, glue it back if it bothers you.
Rubber cement or rubberized super glue would work.

I have this at home, but it's pricey.
https://a.co/d/ejZ0biV

Niedra_ID (Score: 1): When you peel it with fingers are the wires visible? If they are they will rust and blow after time... If not your good

Aleikumselam (Score: 0): replace thetire. it is notsafe."
1mhgqtf,My dad said goodbye to his 07 prius,"he had a 2007 prius for some time i forget if it was 3 or 4 battery changes the battery price got to 12,000$ so we said just get a new car we found a 2013 Toyota Highlander with around 90k miles on it so were good the prius well be going somewhere we bought the highlander on carguru or something like that glad are car ain't ugly no more",0,1754321712.0,13,CarTalk,1754422792,2025-08-04 15:35:12,2025-08-05 19:39:52,"ahj3939 (Score: 10): There's no way he's gone through 3 or 4 hybrid battery changes on a 2007 prius. Or if he has it was a junk aftermarket unit.

The 12v battery is odd an expensive but nowhere hear 12,000 USD.

Newprophet (Score: 1): Three or four 12v batteries?"
1mhgd90,I made a slideshow of cars but they keep getting more expensive.,"Go Check It Out

[https://docs.google.com/presentation/d/1UdAGtZhhG1m4dh152Puvnt3f\_0NV4lv3QhIHptB-LnU/edit?slide=id.p#slide=id.p](https://docs.google.com/presentation/d/1UdAGtZhhG1m4dh152Puvnt3f_0NV4lv3QhIHptB-LnU/edit?slide=id.p#slide=id.p)",0,1754320882.0,6,CarTalk,1754422792,2025-08-04 15:21:22,2025-08-05 19:39:52,"jamesitos (Score: 3): You need to doublecheck the facts.
Golf, 150hp, 0-100 in 4 seconds?

_clever_reference_ (Score: 2): The dollar sign goes in front."
1mhcsv9,Car squealing noise,"Last month my car started making this squealing noise on the right side. At first it was on and off but just started being more constant. It stops when I hit the breaks and gets louder the faster I go and going up hill. It’s a 2021 Nissan Sentra, I only have 40,000 miles and I got my breaks done last October if that’s important at all. I will be bringing it in hopefully next week but wanted to have an idea on what it may be before hand. Any ideas? ",12,1754312462.0,1,CarTalk,1754422792,2025-08-04 13:01:02,2025-08-05 19:39:52,Marcineelloo69 (Score: 4): sounds like an accessory belt tensioner pulley
1mhbu0f,Tire,"Is this safe for drive?
",0,1754309865.0,5,CarTalk,1754422792,2025-08-04 12:17:45,2025-08-05 19:39:52,"Substantial_Rock6847 (Score: 2): It's completely fine if you can't see the nylon threads if you pull on the rubber

NotAPreppie (Score: 1): Its fine, but it kind of looks like your tires might be dry rotted."
1mhb97y,What does this sound mean on start up?,"Hi, had my car jump started last night after not driving it for 2 months, I then drove it for 45 minutes down a 110km highway with no stop lights so figured that would be enough to charge the battery. This morning and this afternoon sounded the same, getting a bit anxious to drive it as I’m worried I’ll be stranded somewhere. ",0,1754308172.0,18,CarTalk,1754422792,2025-08-04 11:49:32,2025-08-05 19:39:52,"Longjumping-Log1591 (Score: 5): Your battery is on its last day. Do you have a eulogy prepared?

Creeping-Death-333 (Score: 3): All I can hear is your keys rattling and you starting the car. I don’t hear anything weird. Your video is really short too, so there’s no frame of reference.

Krilitane1 (Score: 2): What sound? The engine?"
1mhayxc,Paint Chip,Anyone have any recommendations on what I should do to fix this paint chip/scrape? Would it be okay to just tolerate it or would damage perhaps get worse? It’s a Tesla Model 3. Got it in August and already had front bumper fully repainted to someone’s cart hitting it 😒,1,1754307279.0,1,CarTalk,1754422792,2025-08-04 11:34:39,2025-08-05 19:39:52,"You2Row (Score: 1): If you want it to look good, the respray is the only way. Touch up paints and other shenanigans are not worth the price imo."
1mh6x46,Is this repairable through DIY?,"Looking to repair my front bumper through DIY methods without spending hundreds on a paint job or replacement. Is it repairable or should I just forget about it? Anything to make it look less beat. Oh, and ignore my headlights I’m fixing those too.",3,1754292249.0,4,CarTalk,1754422792,2025-08-04 07:24:09,2025-08-05 19:39:52,"Cool_Lemon_8862 (Score: 2): you're way better off price wise to just get one from the junkyard. these aren't limited production cars, there's probably tens at any given junkyard.

chibicascade2 (Score: 2): Do you want it to be correct or close enough? You could get close enough with a spray can of matching paint and a can of clear coat.

Mysterious_Donut_802 (Score: 1): How much did you buy this car for?"
1mh3vqj,Tried autocross for the first time—didn’t expect it to be that,"Finally gave autocross a shot this weekend at a track outside Vegas (SpeedVegas, for anyone nearby). I drive a lot but never really pushed a car like that before tight corners, quick braking, and the whole thing forces you to focus way more than I expected.  
  
I was in one of their cars, not mine, but it got me thinking: how much does regular autocross actually improve real-world driving skills? Felt like my reactions were sharper just on the drive home. Curious if others felt the same after getting into it.",26,1754281307.0,18,CarTalk,1754422792,2025-08-04 04:21:47,2025-08-05 19:39:52,"PoopsExcellence (Score: 49): I've spent many of my younger years with various autocross groups, and it really does improve your driving abilities in the real world. Specifically, it's about learning the limits of your car during extreme maneuvers. 


Someone swerves into your lane on the highway? Now you have some basic experience on how quickly you're able to dodge, plus the muscle memory to execute a quick chicane turn without over-correcting. 

sn0m0ns (Score: 22): Without a doubt autocross betters your driving skills. When I used to race there were a lot of Dodge Neons racing and they were winning. Obviously not because they're fast cars the drivers were just really good.

Guywithaquestionn (Score: 9): Totally agree autocross sharpens your awareness big time. I started doing local events a year ago and noticed my cornering and braking on regular roads got way smoother. It’s also a great way to understand your car’s limits without doing anything dumb on the street."
1mh1faa,Which live data PIDs are most useful for diagnosing engine issues?,"I was troubleshooting a car with rough idling and decided to check the live data on my scan tool. Watching the camshaft and crankshaft sensors in real-time (PID: CMP\_Signal and CKP\_Signal) made the issue clear. The crankshaft sensor was stable, but the camshaft sensor showed about a 120ms delay, which lined up perfectly with the idle fluctuation.

I also looked at:

MAF  – to check if airflow readings matched RPM.

STFT/LTFT – they were spiking higher than normal.

Ignition Timing Advance – fluctuating irregularly in sync with the rough idle.

Using these PIDs together helped pinpoint the cause quickly. I used an ad 600s for this, and it made monitoring all these parameters at once really simple. For those who do DIY diagnostics, which live data PIDs do you rely on most when chasing down engine problems?",14,1754273755.0,7,CarTalk,1754422792,2025-08-04 02:15:55,2025-08-05 19:39:52,"as67656 (Score: 2): Great breakdown. I usually keep an eye on O2 sensor voltages and coolant temp too, since they can point to fueling or sensor issues early on.

oxirlyas (Score: 1): I’ve found throttle position and RPM correlation useful too. If they’re out of sync, it often points to idle control or air intake issues.

MiserlyOutpost (Score: 1): Do you usually log data while driving or just monitor it at idle? I’ve had better luck spotting issues under load."
1mh0zg3,"I recently purchased an International Harvester S-162 and there is not a lot of information on these available. If anyone could determine the year, engine, or voltage of the truck that would be greatly appreciated",,8,1754272516.0,10,CarTalk,1754422792,2025-08-04 01:55:16,2025-08-05 19:39:52,"donethinkingofnames (Score: 5): If the ignition coil is still present, it might be labeled 6v or 12v.

banananas_are_sick24 (Score: 2): If I understand correctly, the S series was only produced in 1955 and 56, but most 55s have the 6 volt system and most 56s are the 12 volt. I haven’t a clue the other differences between them and this truck came without a battery so I have no idea what to put in it. I believe, as well, that these only came with the Silver Diamond 220 or Black Diamond 240 engines, but again, don’t know how to tell them apart. The pistons say 172413-R1 if that helps.

TheLimeyCanuck (Score: 2): Mater found his hood again!!!"
1mh0teh,JB weld on this cracked brake shoe?,"1996 ford explorer, just noticed I have these cracks when replacing brakes. I'm obviously going to replace too, but NAPAs closed. Just wondering if JB weld adhesive or something can be a temporary fix? As it stands now my pedal vibrates when pressing the breaks",0,1754272041.0,29,CarTalk,1754422792,2025-08-04 01:47:21,2025-08-05 19:39:52,"htmaxpower (Score: 29): … what?

By the time it cures the store will be open. 

No, don’t do this. For several reasons.

Ordinary_Plate_6425 (Score: 13): This has to be a joke

Jayypoc (Score: 7): that's the friction material of the brake shoe.. you can't glue it. at best it'll wear off instantly, at worst it'll make your shake way worse.

leave it alone and replace asap."
1mgzvi4,2012 Lancer Idle Issues,"Hello!!! I have a 2012 Lancer not an evo literally just a base one. In the mornings or after work basically anytime after she’s been sitting for a while, i’ll come to my first full stop since turning her on and she begins to shake heavily and her rpms rise from 800 falling back down to 500 this rise and fall continues until I press on the gas to go again. After pressing on the gas it takes her a second and it feel like she’s not moving and then all at once she makes a strong burst to go forward but from there she drives completely normal. Today I changed my engine air filter hoping that’ll solve something but I have no clue what else the issue may be please help😓",0,1754269294.0,2,CarTalk,1754422792,2025-08-04 01:01:34,2025-08-05 19:39:52,wellidotry (Score: 1): Unplug the mass air flow sensor and see if anything changes.
1mgz40y,Crickets in my Engine,"Sounds like a cricket chirping at random intervals, randomly between 4 and 10 seconds apart. Seems to be coming from the circled area in the picture, though my hearing isn't the best. I recently replaced the serpentine belt, idler pulley, and tensioner pulley because of similar but different noises. What's going on now?",2,1754267076.0,7,CarTalk,1754422792,2025-08-04 00:24:36,2025-08-05 19:39:52,"wellidotry (Score: 2): Under what conditions does it happen?


Turn off your A/C. 

Stache- (Score: 1): Take the belt off and spin the new idler pulley, tensionor pulley. You can spin other pulleys too."
1mhthuz,Trying to replace my car radio and I don’t know what anything means!,"I have a 2011 Hyundai Genesis sedan with a radio screen that doesn’t work. I did some research and eventually just called a car stereo store, and they said the only option was to replace with an oem radio. I found a replacement oem radio but it’s asking me to  verify the part fitment but I don’t know what any of the options mean. How do I know which one is the right fit? The radio currently installed has a CD player and AM/FM radio, and it allegedly has Bluetooth, MP3, satellite radio, and a backup camera. ",1,1754350588.0,19,carquestions,1754422792,2025-08-04 23:36:28,2025-08-05 19:39:52,"Big-Reflection-7759 (Score: 2): Okay, so let's start with what you actually want. In terms of radio, there are 2 types that people refer to, single DIN and double DIN. Single din is what most people think of a radio, and it is common as cheaper more low-key options. It is the standard small screen, volume knob, some have CD players but that's changing nowadays. Double din is the newer, full screen typed, where it might have maps and a touchscreen. Looking at pictures of your cars interior, it does look like a custom kit will be needed for a clean look, but these are generally not expensive and available online.

greengore94 (Score: 1): https://preview.redd.it/jw0igkfhi3hf1.jpeg?width=1206&format=pjpg&auto=webp&s=0b248f921ce2c14c847984a885983ad8186f9fe5

This is what it looks like in the donor car"
