id,title,selftext,score,created_utc,num_comments,subreddit,scraping_time_utc,created_datetime_utc,scraping_datetime_utc,top_comments
1nvt2mv,Mazda CX-30 2021,"Quick “Bang Bang” right before the gate begins to open.

Windshield was broken and replaced. But the car was not hit. (My son threw an object)

My wife says the sound started after the windshield was replaced.

I can’t figure out how it could be related.

Seems like I t only happens after the car has been at rest for a while. 

I tried to duplicate it 1 minute later and it did not repeat.

Likewise, my wife says it doesn’t make the sound “When it’s warm.”

I don’t see how it could be related to engine temperature.

Does this sound ring a bell?

",1,1759375583.0,3,AskMechanics,1759519967,2025-10-02 03:26:23,2025-10-03 19:32:47,"Cereal-Killer541 (Score: 1): Id look at the latch, it sounds like it may be sticking and hanging.

877GlassGuy (Score: 1): Glass tech here from 877 Glass Guy in Aberdeen. Can't be sure from the recording but it doesn't seem like it's windshield-related. A sound that loud is probably the latch-- have you traced the sound back to an general location on the back of the car? Not sure how the temperature is related (might just be coincidence?), it could just be that the sound stops because the latch has been engaged and it settles after it's been parked.   
  
If you want to check if it's windshield-related, you can check the trim, clips, and rubber seals around the windshield for any loose spots. A quick visit back to the shop for a post-installation inspection usually fixes it before it becomes annoying or damaging. If it started after they worked on it they should take a look."
1nvsyr6,California smog check after issue repaired?,"2012 Mazda 3.  Failed smog check because a vapor cannister solenoid thing.  I replaced the two sile kids myself and the check engine code went away as verified by my BlueDriver obd2 scanner.  Went to get smog test and the guy said I wouldn't pass and I need to drive it around more especially at high speeds and let it rev down without braking.  So, I did that, and then found out I can do a smog test on my BlueDriver scanner.  Ran the test and passed everything.  Is this app legit?  I'm in a time pinch to get this smog test done but don't want to take it again unless I'm confident I will pass.  Thoughts?",3,1759375246.0,6,AskMechanics,1759519967,2025-10-02 03:20:46,2025-10-03 19:32:47,"WhatveIdone2dsrvthis (Score: 4): If he told you to drive it some more, it probably didn't have all the monitoring ready. Based on your images, it looks like everything is set now.

PPVSteve (Score: 2): The instructions he gave you were for the Catalyst or egr monitor.  When were these screen shots taken before your smog or after?"
1nvry9v,"mobile mech quoted $380 (parts and labor), is that reasonable?",for a o2 sensor replacement for both downstream and upstream. (2011 Camry se I4),0,1759372232.0,9,AskMechanics,1759519967,2025-10-02 02:30:32,2025-10-03 19:32:47,"IfIWntdHmmrCalnUrSis (Score: 2): 2.4L or 2.5L? Parts and labor? Yes that's reasonable.

JUST MAKE SURE THEY INSTALL DENSO PARTS!!

Lope_F (Score: 1): Pretty reasonable, O2 sensors can get pricey especially if its OEM. For a Toyota, I only recommend Denso for Toyota, but since it's a mobile mechanic, they are probably using Oreily or Autozone parts which is usually NTK, Walker or Bosch. Just double check"
1nvrpwy,Where does this look like it is ?,Just recently got a new muffler and had to get hangars welded on. Now I get out after a 2 min drive and see oil leaking and I can’t tell where from. Could this have anything to do with the work that was just done?,1,1759371565.0,6,AskMechanics,1759519967,2025-10-02 02:19:25,2025-10-03 19:32:47,"gilbertriley (Score: 1): 2008 Chevy impala LS 3.5L V6

Humorouscrustacean (Score: 1): Are you sure you see oil leaking or is it black sooty water? That black spot is an exhaust leak. If it's dripping from that then it's water from the exhaust and either you needed more exhaust work than you got or they screwed up your new hangers."
1nvro67,Why won’t dealerships hire me,"I just graduated high school June of this year, I’m trying to become a automotive technician but no dealership takes me. Can anyone tell me what I’m doing wrong and what is wrong with my resume and what I should change. I welcome all criticism and anyone who does help I really appreciate.",65,1759371426.0,121,AskMechanics,1759519967,2025-10-02 02:17:06,2025-10-03 19:32:47,"Character-Outcome156 (Score: 118): Sometimes you just have to know someone to get through the door. Maybe start off at a mom and pop shop.

AdventurousShip6736 (Score: 62): Try a more concise resume that doesn’t tell a story but lists the things they want to see. 
Don’t talk about the school aspect. Focus on the jobs you did, starting with them hardest one in a bullet point fashion.
Don’t focus on the clients or students, parents etc; focus on the fact that you did xyz job and were able to get referrals from satisfied customers. 
I’m willing to bet that if you word your resume appropriately, and format it in a more concise and easy to read format, you’ll get the position you’re looking for."
1nvrmys,Quality Bi-Directional OBD Diagnostic Tool,"Hi,

Am looking for a quality, bi-directional OBD Diagnostic tool. I'm not a professional mechanic, so I likely don't need a professional grade, multi thousand dollar unit.  I'm just a retired engineer who likes working on his own cars. My skill level maxes out at: pulling engines/transmissions in garage...though I'm getting a bit old for those shenanigans! 

I have a Porsche, Audi, Lexus and Toyota. So something that plays nice with all of these. Some of the functions I'd like: electronic parking brake (EPB) winding, ABS/brake bleeding, new battery coding, etc...the usual stuff you run into doing maintenance and repairs.

Is there a unit you can recommend without breaking the bank? 

Thanks for you input",1,1759371336.0,5,AskMechanics,1759519967,2025-10-02 02:15:36,2025-10-03 19:32:47,"Patrol-007 (Score: 1): Too little info. Vehicles have been made for decades, worldwide, with regional differences, software differences, trims etc etc etc "
1nvrm65,F150 5.0 is this the normal typewriter tick or something else ?,"Getting a loud tick that at first seemed like the normal 5.0 typewriter noise but seems to be getting louder and is especially noticeable on cold start. Once it’s been running the sounds almost gone. 

2013 f150 5.0 with 190k km. 

Should I get it looked at? ",1,1759371274.0,2,AskMechanics,1759519967,2025-10-02 02:14:34,2025-10-03 19:32:47,North-Spring7269 (Score: 1): I do believe that is nothing to worry about
1nvr88b,What could cause this to happen? Or is it just a bad battery?,"Driving a Honda Shuttle Petrol. Car showed some signs of a dying battery this morning during the morning start. 

Cabin LED lights were very dim, almost off and the car sounded it had trouble starting the engine.

Dropped by the workshop to have it replaced and was shocked to see it smoking and slightly bloated.

I'm wondering if it's just a bad battery or could there be some other underlying issues that is causing the battery to smoke like that.",1,1759370208.0,3,AskMechanics,1759519967,2025-10-02 01:56:48,2025-10-03 19:32:47,"Sienile (Score: 1): Internally shorted. Don't leave it next to anything flammable. Don't light a match/lighter or spark anything near it. Could burst into flames.

Themac2005 (Score: 1): I had this happen with my car and turns my alternator was overcharging at 20+ volts. Maybe give that a check just in case so you don't waste money on more batteries."
1nvr235,Is my CV axle cracked?,I went to the mechanic to fix a separate issue on my 2012 Nissan Altima and during their inspection they found that my passenger CV axle was cracked. I just had the wheel bearing on that wheel replaced 2-3 months ago at a different place (today’s place also did an inspection 2-3 months ago) they didn’t notice anything wrong. I’ve attached the picture they gave me but I don’t see any cracks and I haven’t had any issues while driving. Is it really cracked? And if so is it as urgent as they’re claiming?,1,1759369723.0,3,AskMechanics,1759519967,2025-10-02 01:48:43,2025-10-03 19:32:47,"None (Score: 2): Is the CV axle cracked? Unlikely. Is the CV axle boot cracked? I think so, you should get it changed before you need a new axle.

Sienile (Score: 1): The grease was from a busted axle boot, but that axle looks clean. Could be the break is on the other side or that's from a previous axle."
1nvqwtc,Front Jack / Stand Location,"What is the correct front jack/stand location to do brakes?

2007 dodge nitro 4x4

Anything here look alarming outside of being an 18 year old rust belt car?

",1,1759369303.0,2,AskMechanics,1759519967,2025-10-02 01:41:43,2025-10-03 19:32:47,LWschool (Score: 1): Jack stand locations are in your owners manual or you can google images of it for most cars. Those cross members should be fine though.
1nvqvip,06 Ford Five Hundred front end rattling noise.,"I have an 06 Ford Five Hundred and it is in need of new shocks. I asked my mechanic to take a look at it and see if anything else might be affected because I hear rattling noise when I drive on not so smooth road.  I wanted him to check the control arm bushings, ball joints, strut mounts, etc.  His recommendation is to take it for an alignment to see what issues arise.

If I take it for alignment, will it show other issues?  The car drives fine, doesn't veer off to one side, doesn't shake, I don't feel like the tires are worn.  Just wondering the best way to figure out what the rattling noise is about.  When I drive on smooth road I don't hear it. Only on bumpy or wavy road.",1,1759369204.0,7,AskMechanics,1759519967,2025-10-02 01:40:04,2025-10-03 19:32:47,"LWschool (Score: 2): Front end rattling is just really difficult to diagnose, usually. And thing is, often, when you replace one thing, it’s new solid-nature means the other flexible components flex more. 

On a car this age I wouldn’t be crazy to do a big front end rebuild. 

That’s a lot of work, though - or expensive. 

Do you have any sense of when/why/how the rattling occurs, other than road smoothness?"
1nvqlv5,What is this??,"Went to the shop to get my front/rear suspension replaced.  The next day I found this on my driver's seat.  It's rubber and appears to be some sort of bushing, but for what?  This was my work vehicle and has been making rattling noises from the rear suspension for about 6 months now before I decided to get it fixed.  After fixing, there is still a bit of rattling but 90% better than what it was, shop saying it might be the body mounts.  Could they have not installed this bushing with the suspension, which is now causing the rattling?",1,1759368451.0,3,AskMechanics,1759519967,2025-10-02 01:27:31,2025-10-03 19:32:47,"mjenness (Score: 1): I drive a 2014 Dodge Caravan (sorry, can't figure out how to edit original post)

greasemonkeycoot (Score: 1): I am guessing but either a motor mount, exhaust, or bearing mount."
1nvqdvj,exessive camber,"recently purchased a 1995 lexus ls400 and replced the toe, trailing and lower control arms with megan racing adjustable arms and have massive negative camber. the car was like this before i changed the arms and the last guys had the car slammed. could anyone help me?",1,1759367825.0,3,AskMechanics,1759519967,2025-10-02 01:17:05,2025-10-03 19:32:47,"LWschool (Score: 1): This sub doesn’t know a ton about aftermarket usually, I would not have advised this route of modification in the first place because you don’t know everything that’s been modified. You’re working on someone else’s project. 

why can’t you adjust the camber if you got aftermarket adjustable suspension? My only real assumption is that there’s a part you didn’t account for (either OEM or last-guy-aftermarket) which is not compatible with the parts you installed. I just don’t have enough info to think anything else."
1nvq2hh,2013 Tiguan SE 4 cylinder - cylinders misfiring,"Hi all! Was accelerating on the freeway (65-75 mph) the other day when suddenly my car started shaking when accelerating. It’s fine when coasting but when at a stop light, etc it feels like it’s resisting stalling out even though it’s an automatic.

I replaced all 4 spark plugs and no change.

Codes P0300, P0301, P0303, and P0299 all came up. I took this video if anyone can suggest or point me in the right direction?",1,1759366944.0,5,AskMechanics,1759519967,2025-10-02 01:02:24,2025-10-03 19:32:47,"Humorouscrustacean (Score: 2): P0299 is turbo underboost. I'd visually check for any leaks from the air hoses to or from the turbo, the intercooler, and any other related components, and if there's nothing obvious to you then you should take it to a mechanic. You might need a new turbo and that's a big item you don't want to just load up into the parts cannon."
1nvpvd5,Is there such a thing as tires rotting from the inside?,"My wife said that when she was younger her dad bought her a set of used tires on rims that looked to be in good shape, and when they took them to a mechanic to have them installed they told them that they wouldn't. They said the tires were rotting from the inside, and they wouldn't give them the tires back because they were unsafe to drive on. 

Is this possible? ",1,1759366401.0,7,AskMechanics,1759519967,2025-10-02 00:53:21,2025-10-03 19:32:47,"blur911sc (Score: 4): More likely driven while low  on air, which can look fine from the outside but will be coming apart and scary on the inside.

Longjumping_Line_256 (Score: 3): They can but its like a vary long process, well out outside of its usable life. Though if the tire was driven on when flat even for a short distance, that can shew up the inside and make it look like its rotting in a way which is most likely the case."
1nvpv10,Are these reasonable prices,,0,1759366373.0,18,AskMechanics,1759519967,2025-10-02 00:52:53,2025-10-03 19:32:47,"eweyda (Score: 6): I'd literally do it all by myself. Probably by some form of lift for that price. All the tools. Junk yard, eBay, or rock auto the parts.

A89704 (Score: 4): What kind of car? A mclaren? $2k for rear brakes and rotors is insane, and the O2 sensors are $100 each - maybe. Is this a dealership price? if so go to a local shop with decent reviews - should be way cheaper."
1nvpslg,"2015 Ford Fiesta Zetec – Alternator only showing 11V, what does this mean for the battery?","Hi all,

I’ve got a 2015 Ford Fiesta Zetec. The alternator is only putting out 11 volts instead of the usual ~14, so the battery hasn’t been charging properly. The car is in the garage now for testing on both the alternator and the battery.

My questions are:
	•	If an alternator runs low like this, can it damage or kill the battery even if the battery isn’t that old?
	•	What’s the typical cost range for alternator replacement on a Fiesta (parts + labour)?
	•	Is it common for both the alternator and battery to need replacing at the same time, or usually just the alternator?

Thanks in advance for any advice.
",1,1759366184.0,2,AskMechanics,1759519967,2025-10-02 00:49:44,2025-10-03 19:32:47,"Humorouscrustacean (Score: 1): Yeah it could damage the battery. It also might not. Only way to find out is to get it fully charged and load test the battery.

No one can answer your question about price without knowing your area. 

Typically the battery and alternator do not need to be done at the same time but batteries can be fickle beasts so anything is possible."
1nvprlo,It's this normal engine sounds,"Hey, just wondering if these are normal engine sounds. It's a Nissan Sentra S with 130K km on it. Should I be concerned or is this normal engine wear sounds with time.",1,1759366103.0,2,AskMechanics,1759519967,2025-10-02 00:48:23,2025-10-03 19:32:47,Humorouscrustacean (Score: 1): I think that sounds pretty normal. It's pretty tough to tell from a video as I'm not entirely familiar with that engine or your engine specifically.
1nvppyh,Electrical issues,"Trying to get a 1968 Olds (455) started. Currently have an electrical issue checking for assistance. 

For starters, the engine was cranking then suddenly lost all electric power. 

Now when you reconnect the battery, lights come on, turn the key a click and all lights out/ power loss. Took off the ignition and did some testing 

There is continuity between IGN (ignition?) and acc and from IGN to BAT when the key is on. 

When you turn the key to start it switches to IGN and SOL (starter solenoid?). Still have power between IGN and bat too. 

Key +, key- and ground all never have continuity. Should there be power between these at anytime?

Next places to check? Help would be awesome! ",1,1759365970.0,2,AskMechanics,1759519967,2025-10-02 00:46:10,2025-10-03 19:32:47,"LWschool (Score: 1): I’d recommend finding an OEM shop manual or something. I work on old bikes and the wiring and circuitry of these relays is often entirely model specific (though I have no idea, in this specific case). The manuals have step by step diagnostics for every circuit and relay in the vehicle and helps immensely with these older vehicles."
1nvpp1y,"ABS, Brake, Steering and Traction control lights","All four of those lights came on at once, but the car runs fine, I just took it to mechanic in my area for a diagnostic and was told that the wheel speed sensors that I put on are low quality. Then gave it back with all the lights on 🤦 how do I fix this? Does the sensor thing sound right?",2,1759365898.0,4,AskMechanics,1759519967,2025-10-02 00:44:58,2025-10-03 19:32:47,"CockbagSpink (Score: 1): Car is 2016 accord sport if it matters, my husband already replaced the wheel speed sensors and the lights went off but then came back on after about 70 miles. The answer is better quality sensors?

little_ezra_ (Score: 1): Did anything get reset to learn the sensors?"
1nvp9ox,I’ve never seen something this severe before. What is going on here?,,9,1759364664.0,20,AskMechanics,1759519967,2025-10-02 00:24:24,2025-10-03 19:32:47,"agravain (Score: 15): its called dog tracking

Sienile (Score: 9): https://preview.redd.it/ch1o7839hlsf1.jpeg?width=862&format=pjpg&auto=webp&s=cf2c832bfb425f4b11ff7ea6c969e2e5bb2c5f31"
1nvp83v,"Is it possible to wear out new rotors, pads, suspensions, bushings, etc within a year just by hard acceleration and braking in a way that isn't gradual or too hard","For example, the car is a 2017 Toyota Kluger and my driving style is hard acceleration to quickly match the speed of other cars while also braking not gradually or too hard at sets of traffic lights.  This is my driving style and helps to get me sooner where I want to go.  


Will slotted rotors/ rotors with holes help extend the life of my pads and rotors and reduce warping?

Can this driving style damage brake calipers?

Does this also affect the gearbox/AT and differential?

",0,1759364541.0,15,AskMechanics,1759519967,2025-10-02 00:22:21,2025-10-03 19:32:47,"None (Score: 10): You're not getting anywhere quicker by beating the crap out of your car.  .  yes,  you're destroying your vehicle by beating the crap out of it  Slotted rotors?? lmfao. Just grow up. Drive responsibly

Inspirice (Score: 9): Lol slotted and drilled rotors eat brake pads more like a cheese grater."
1nvp176,Can anyone help identify this part? In the trunk of a 2013 Nissan Sentra SR,"This is a view from the back of the car inside the trunk. I accidentally ripped out the 2 wires going into this mystery part. 

Everything in the back end still seems to work: lights, brake lights, turn signals, rear defrost. 

The only problem I notice is that the ""key"" light dashboard warning is now on, which usually means the key fob battery is low. I changed the fob battery, but the dash light is still on. The car still locks, unlocks, pops the trunk, and starts perfectly. I'm not even 100% sure the key dash light is related to this part.

The only writing i see on this part is ""ED H120831"" but I'm not finding anything online. ",3,1759364011.0,7,AskMechanics,1759519967,2025-10-02 00:13:31,2025-10-03 19:32:47,"McSmelly (Score: 3): Thank you guys so much! 

In case anyone else has this issue, the Nissan part number for the antenna assembly for a 2013 Sentra seems to be 285E4-C990A.

It's listed at $131.24 right now, so I think I'll look at aftermarket solutions (or I'll get a soldering iron).

Thanks again!!

84cricket19 (Score: 2): I believe the box is the antenna for the key fob. Smart key fob module. Part of anti theft system."
1nvp052,Am I cooked,"So I’ve had my 2005 Honda civic lx 2dr manual for about 5-6 months. It was my dad’s to start with in which he bought it from a private seller. The engine ended up going bad after about a year of driving. He got it replaced by his mechanic (who is usually pretty good at getting things done). The mechanic put a 2004 civic engine in. Not sure if the year makes a difference. Anyway I have no idea where the engine came from so not sure if it’s a complete junk of an engine. I didn’t really start driving it more regularly till maybe 3-4 months ago. After the first oil change, maybe a few weeks after, I checked and seen that oil was not the color it should be (photo included). have also noticed that it keeps burning up oil and there is black residue on the bumper (photo included) which I googled and seen it was from fuel burning. Also on cold start it sounds almost like it wants to bog and the entire car shakes and then idles out. This has just started happening more recently.I think that it may be running too rich and the mechanic didn’t tune the engine when he put it in. I have no way of asking said mechanic bc he moved. If it is a tuning issue how fixable is it and what am I looking at. If it’s something more serious let me know how cooked I am.",3,1759363929.0,3,AskMechanics,1759519967,2025-10-02 00:12:09,2025-10-03 19:32:47,"geebeaner69 (Score: 2): Black soot build up back there is a strong indicator of oil consumption. It could be caused by worn piston rings, worn/scored cylinder walls or leaking valve guides.

Mrpandacorn2002 (Score: 1): Nah your raw….but seriously that is an issue"
1nvozmt,Valvoline revved engine with no oil,"I have a 2007 5.7 V8 tundra 81,000 mi on it. Been changing my own oil for a decade and on a whim decided to use a coupon at Valvoline. They told me to start my car and rev the engine to 2000 RPMs, as soon as I started the truck I noticed that my oil gauge read empty and asked if they were sure there was oil in it. It the lady said it was just cause the cap was off and to please rev my engine. Immediate ticking noise and you could tell the engine was dry. I shut the car off right away and told them to make sure there was oil in the f****** engine. They were very apologetic, gave the oil change for free, but I'm worried about long-term damage. The ticking noise went away immediately as soon as there was oil in the truck, it probably ran for about 15-20 seconds with no oil in it and was revved to 2,000 RPMs for maybe 2 seconds. Engine sounds good now, do you think they messed up the lifetime of my engine though? ",1,1759363889.0,7,AskMechanics,1759519967,2025-10-02 00:11:29,2025-10-03 19:32:47,"Maximum_Budget_4035 (Score: 5): Odds are no major damage, running dry for that short of a time frame is negligent at best. I wouldn't sweat it

Mysterious-Gur-3034 (Score: 2): I love that the first two posts are saying the exact opposite information... ha! 
That is every mechanical question a nutshell."
1nvoqjp,Need a steering box replaced on my 2014 Ford Focus. Is $3700 a fair price?,"Title basically covers it. That's the price a Ford dealership is quoting me, and I don't have a lot of trust in the Ford dealerships I've dealt with. I have a guy I'm asking tomorrow that I trust way more, just not sure if this work will even be done by many mechanics outside of a Ford dealership. ",0,1759363215.0,8,AskMechanics,1759519967,2025-10-02 00:00:15,2025-10-03 19:32:47,"Seaborgium (Score: 1): In New England if it helps. Not a car guy. The mechanic I brought it to before fixed a couple other things, suggested I check with the dealership for recalls because he thought it was crazy the steering box was in such bad shape internally. No recalls, no warranty, so I'll be out of pocket. Seems pretty steep, but maybe it's par for the course? I've completely lost steering so taking it somewhere, the $3700 is the only quote I've gotten.

Partly want to know if the quote fair, and partly want to know if my suspicion about my local Ford dealerships is correct or not.

Further context, one dealership near me charges a mandatory $250 diagnostic fee for bringing it in. They returned my car last time with the front plastic fender hanging down. Curious if they're gouging too, and if so how much.

None (Score: 1): It's a 2014. Take it to a reputable independent shop.  3700 is fair at a dealer.  It will be less elsewhere"
1nwi7es,2007 MDX front doors stuck closed,have a 2007 mdx took the exterior door handle off to wrap the door and now the door won’t open using the interior handle. door panel is off so i can get to the door latch but when trying to manually push down the latch from inside the door it still won’t open. i was able to get the exterior door handle back on to see if i could open it but that didn’t work either. any suggestions on what i could do to get the door open?,1,1759444309.0,1,AutoMechanics,1759519967,2025-10-02 22:31:49,2025-10-03 19:32:47,"Ok_Initiative2666 (Score: 1): You probably have something wrong with the lock itself and you have to break something to get to it. You can try a slim jim to see if you fish for the rod to the inside latch and tug on it, or open your inner panel door trim… or s locksmith"
