id,title,selftext,score,created_utc,num_comments,subreddit,scraping_time_utc,created_datetime_utc,scraping_datetime_utc,top_comments
1o7ydk4,CVT shrudders,"I bought Nissan Pathfinder 2014 Hybrid, it had only 1 liter of CVT oil which was very old as well, car was running smooth, no issue whatsoever so ever. I took it to reputable garage, they drained the CVT oil completely and then added 4 litre of NS3 oil. Since then, car shrudders (very minimal) at lower gears. Like if you are driving 45-50KMs , it jerked for in total 8 times during low gears and sometime high gear, i researched and it says that CVT need relearning because it was driving on low oil, also it needs 5.5 litres of oil since it was completely drained out. And it takes 3-5 days usually to get back to normal driving, any advise is welcomed. ",0,1760594241.0,4,AskMechanics,1760729627,2025-10-16 05:57:21,2025-10-17 19:33:47,"River_2675 (Score: 1): reset your transmission perameters

top up the fluid to the correct level

if the transmission still studders then you need a new transmission

GarnellPMushti (Score: 1): How do i reset transmission parameters?"
1o7xluf,"2019 Ford Escape, 1.5L ecoboost","Hello community, first time posting here.

I have an escape currently at the dealership, after hearing a knock. Couple days later, they inform me that the bottom skirt of a piston has broke off and damaged the engine block. I will attach the photos the dealership sent me. 

The engine only has around 94,000 miles on it, if that information helps.

Due to this, they said the engine has to be replaced. I was quoted essentially 12 thousand USD for full engine replacement. That is something I cannot afford, but there is someone at my job that is a very skilled mechanic guy who, supposedly, has done engine swaps before. Currently, I'm waiting on more information from them. Before I make any decisions, I thought I would ask a few questions here.

Would it be worth it to have someone re-sleeve the cylinders and new pistons? It might be enough to save the block, it's a car that is paid off. 

I can't really ask if an engine swap is ideal as I'm still waiting on more information, but up to how much would be an okay amount before I give up on it?

If it isn't, should I just drive it until it gives out completely then get a new vehicle?

I apologize for the slight rambling, I'm just heartbroken since it's the first vehicle I ever fully paid off. I had expected it to last longer than it has. ",1,1760591423.0,2,AskMechanics,1760729627,2025-10-16 05:10:23,2025-10-17 19:33:47,"Far_Relationship427 (Score: 1): Apologies, 89 thousand miles. I am on mobile so I'm not sure how to edit."
1o7x3mu,guys i don’t wanna be stuck. help 😂,Car is overheating and smoking. is it safe to assume coolant hose? ,1,1760589686.0,10,AskMechanics,1760729627,2025-10-16 04:41:26,2025-10-17 19:33:47,"arcticchains (Score: 1): https://preview.redd.it/r0662aqamevf1.jpeg?width=1179&format=pjpg&auto=webp&s=81bbc0e8a2ba8d4bf28466855fb93d422b264746

Yes that is safe to assume. How far are you from home? If you're further than outside your neighborhood you'd be best to get a tow.

pauliefishing (Score: 1): Yes, it looks like you can do it yourself almost looks like that part could be eliminated and put the hose directly on the heater core nipple"
1o7wv3f,Tranny main seal keeps going,"Hi. I have a 2013 Ford Escape, 220,000kms
Backstory; last year a mechanic saw ""tiny metal peices"" in transmission fluid and said my transmission would probably go, so after said mechanic test drove it and said it was otherwise in good shape, I had a brand new Transmission built and put in at a cost of $6000. 
3 months later main seal leaking and had to be replaced (under warranty).
Now, 6 months later main seal has gone again. The transmission shop is again replacing it under warranty ( thank goodness). The Transmission guy said there must be a pressure in the engine that keeps blowing the main seal, but no more ideas because he is ""not an engine guy"".
Does anybody have any suggestions as to what could be going on please?
As a single disabled Mom and Grandma, my car is very important to me. 
Sidenote: last month I took the car in for an oil change to random mechanic. When he was done I noticed drips of oil underneath my car in the parking lot. Guy said it was no big deal he was ""just messy"". Got home and Car dripping oil all over my parking spot. When I took it back to him he put it up on the hoist and showed me that it was coming from the main seal, which is how I found out that it needed replacing again.
I don't like to think this but is there anything that oil guy could've done during the oil change to damage the main seal? Or was it  a coincidence that it started leaking when he finished the oil change?
Any advice or suggestions will be really appreciated.
Thank-you

",1,1760588880.0,4,AskMechanics,1760729627,2025-10-16 04:28:00,2025-10-17 19:33:47,pauliefishing (Score: 1): I would say transmission bushing is bad or torque converter has a groove or something on. It also could be loose bolts at flywheel or a broken flywheel hard to say without looking at it.
1o7wuap,Car not recognising key,"I have a 2007 Mazda 3 and my dad bought a new key fob, when he did it he put the key from the old one in the new one, but the battery was wrong so for a few days I just used my spare key. Now that we have the right battery I went to use the other key and it won’t start the car. The key fob works, it locks and unlocks fine but when I try to turn the key in the ignition to start it, it won’t work. It can turn for accessories and on but it won’t start it. 

I tried cleaning the key, it doesn’t look bend or damaged at all it was working perfectly fine in the old fob. The spare key still works so I’ve just been using that. ",2,1760588802.0,3,AskMechanics,1760729627,2025-10-16 04:26:42,2025-10-17 19:33:47,kyden (Score: 1): He didn’t transfer over the immobilizer chip.
1o7wfhc,95 Tahoe automatic transmission,"Shifted in reverse and heard a loud snap or something, then it stopped moving in reverse started roaring and not moving but will move just fine in drive, then when I put it in park it’ll click like 5 or 6 times before stopping. At some point it didn’t even go in park at all. I’ve never had this happen before.",1,1760587418.0,2,AskMechanics,1760729627,2025-10-16 04:03:38,2025-10-17 19:33:47,pauliefishing (Score: 1): Check your bushings on the transmission cable or the cable itself could be defective or broken. Don’t know if it’s a one or two piece cable my 04 is a two piece.
1o7w96c,Old car road trip,"Hello, I have a Jeep Wrangler 2002 TJ and I need to use it at 4am today to commute 250miles (4 hours) to another city for work. The car is around 150k miles and I've been using it daily. I have some concerns about the transmission but I must go on this trip would taking a break every hour help or driving along service roads at 40 instead be better although it'll make the trip longer ? It's essential for me to go and during fuel ups I'll let the car cool down. Please help me late night mechanics. ",6,1760586871.0,12,AskMechanics,1760729627,2025-10-16 03:54:31,2025-10-17 19:33:47,"TruthTeller067 (Score: 2): Cool down? You didn't mention what is wrong with the car.

Over heating?

Is it leaking fluid?

Thermostat maybe needs replacing?

Maybe just needs a flush, and new fluid?

This would require bleeding it as well.

Maybe it just needs to be bled?

Hard to give advice when you're not clear about the issue.

WarmObjective6445 (Score: 1): I have an '09 wrangler with 165K on it that I drive daily and also take on 4-5 hour road trips 4 or 5 times a year. I an a maintenance junkie so I replace things as soon as needed or before. It doesn't matter how old a jeep is only how well it is maintained."
1o7w1sn,Is there any job in the industry that i can get at 16?,Im 16 and in auto tech and id like to get experience while also getting some money. It doesn’t have to be the best paying job but id like some income.,0,1760586215.0,3,AskMechanics,1760729627,2025-10-16 03:43:35,2025-10-17 19:33:47,"Desperate-Score3949 (Score: 1): It is going to be dependent on your region. Some places hired ""detailers"" at 16, where I was 10 years ago.

Extra_Programmer_970 (Score: 1): Check with the school counselor. Voc-ed usually has jobs through local dealers"
1o7vmbs,Should I be worried,I noticed a small and I mean a small puddle of transmission fluid on the ground after I drive and then when it sits for a while it doesn’t drip ,4,1760584872.0,8,AskMechanics,1760729627,2025-10-16 03:21:12,2025-10-17 19:33:47,"Kumirkohr (Score: 1): It’s not ideal, that’s for sure. Did you recently have the pan resealed or the transmission serviced?"
1o7vhhu,Drain plug cracked and dumped all of my oil a few days after Dealer oil change.,"I don't make posts very often, but am hoping I can get some guidance on how to make sure I'm not getting screwed over. I appreciate any advise on how I should handle this with the dealer from a mechanics perspective. I have a 2023 Hyundai Sonata SEL, the 2.5L 8 speed auto, with around 21k miles on it. I have kept up with the manufacture's recommended oil change schedule up to this point and had no engine related issues before the oil change. Apologies about my photo quality. My phone's OIS is broken from motorcycle vibrations. 

I took my car in for an oil change Friday Oct 10th, drove it for 30miles or so without issues, then saw the low oil pressure light on Monday morning after I had remote started my car. It had been running for 5-10 minutes.  There was no oil on the dipstick and a gallons worth of oil on the ground. The shop rag I wiped the dipstick with was still clean. I called the dealership, had it towed in, and they looked it over. Apparently, the drain plug had cracked. After they looked my car over, replaced the drain plug and refilled it, it's been running fine, but I'm concerned of future issues. In addition to that I asked them to come clean up the oil spill on my driveway. After their first cleaning there's still a gnarly driveway stain. 

I'm not looking to dox the dealership or anything, but what can should I be telling the dealership to correct my driveway and overall fix their mistake? 

",108,1760584455.0,42,AskMechanics,1760729627,2025-10-16 03:14:15,2025-10-17 19:33:47,"tcrispy (Score: 122): ""the drain plug cracked"" -- Translation: ""the tech either overtightened the drain plug so much it cracked the sealing washer or left the plug loose, and we don't want to own up to our mistake."" Drain plugs don't just ""crack"". Honestly there's not too much more you can do at this point, as they did fix their mistake. The only other thing you can do is take the car to another shop to lift it up and make sure everything is good.

Just_a_lil_Fish (Score: 17): Call them again and tell them you aren't satisfied with the cleaning they did. If they refuse to come back and fix it then you will probably have to pay someone out of pocket then sue the dealership for that cost. 

I'm not a lawyer though. If you want legal advice you should contact one."
1o7usyb,VW Passat shaking sometimes randomly during acceleration and EPC light comes on.,Anyone know what might be the problem? I have a 2018 VW Passat. It’s been my first car for 3 years now and It has been having this problem on and off for a couple years now. It’s so random. It seems to be something with electronics but I don’t have enough money to get a 130$ diagnostic plus whatever the repair is. Any help would be great. ,1,1760582391.0,2,AskMechanics,1760729627,2025-10-16 02:39:51,2025-10-17 19:33:47,"DueLet1388 (Score: 1): You need to get the code ready at least. Throttle body problems are very common in these so that would be my first guess, but without diagnostics or even knowing the fault it's just a blind guess"
1o7upwg,Help fixing courtesy light wiring in 2013 subaru brz.,"I wanted to swap an old light out in my door for an LED because my driver's side courtesy light has not worked since I bought my car. Long story short, the driver's side door wiring harness is missing the wire leading to the courtesy light (the entire E2 wire). Looking closely at the wiring, it doesn't look like the E2 wire was ever there to begin with; i.e., there is no cut wire or any sort of bandage visible. I'm wondering if I can add a wire or if it would be safer to buy an OEM Limited trim harness and wait on that?

I suspect my car had been in some accident before I purchased it, and that the previous owner hired someone to fix the door. I think the new wire harness might be for a premium trim

https://preview.redd.it/6zndyjaxydvf1.jpg?width=4032&format=pjpg&auto=webp&s=c8a57da880dc42ee6e3583924555f91ad612bd12

[Showing where the courtesy light wire should be](https://preview.redd.it/1kgz07tyydvf1.jpg?width=3024&format=pjpg&auto=webp&s=455d5910c0a77a6133fd2ce23c715a8d09a63684)

[showing that the light works on the passenger side](https://preview.redd.it/j2qttl03zdvf1.jpg?width=4032&format=pjpg&auto=webp&s=3e52f25da9142279587ab2b81ebdc9a55d312fa4)",1,1760582139.0,2,AskMechanics,1760729627,2025-10-16 02:35:39,2025-10-17 19:33:47,DueLet1388 (Score: 1): It would be easiest to get the correct door harness and put that in. If you can get the right connector pins you could crimp those to wires but you would have to get a diagram and connect them to where they're supposed to be in the door connector and buy a new connector for the light.
1o7uoba,Lower shock bolt not aligning with  shock bushing?,,1,1760582008.0,11,AskMechanics,1760729627,2025-10-16 02:33:28,2025-10-17 19:33:47,"No_Seaworthiness5683 (Score: 3): Jack the hub up more. Remove sway bar link if it’s going you a hard time.

Then to reinstall sway bar link if you can’t, get the other side hub jacked up and manipulate it all. It will line up

Monst3r_Live (Score: 2): Pull down on the shock."
1o7ui8b,2000 Camry 4cyl check engine light,"Hey, my 2000 Camry recently threw a check engine light. I know it’s for the Evap system and I already changed the gas cap since it was old, but the check engine light is still there. Any suggestions?",1,1760581500.0,4,AskMechanics,1760729627,2025-10-16 02:25:00,2025-10-17 19:33:47,"DueLet1388 (Score: 1): The p0446 specifies it's an issue with the vent. Most likely it's stuck open or closed. Could be a restricted hose or charcoal canister. The way to test this is to electrically control the vent(with a scan tool or jumper wires) and using airflow to check for restrictions.

right415 (Score: 1): What made you think a gas cap would fix it? I would look into that P0446 code and your vent solenoid. IIRC on that vintage of Toyota the generic P0440 ""Evap system malfunction "" code often accompanies other specific Evap codes which direct you to the actual problem. Vent solenoid is easy to change and $26 on rockauto. They crack and leak often. It's been a while since I've been in the Toyota game. Hope this helps"
1o7ua4s,Are aftermarket steel wheels supposed to fit as snug as OEMs?,"I'm getting dedicated winter rims + tires.
I found what is supposed to be an absolute match, and I bought one to test. 
I have a 2017 Chevy Bolt.
[This is what I intend to buy.](https://www.carid.com/rt-wheels/17-steel-wheel-5-lug-x47505-black-2282991096.html)

When I put it on to try it out, there seems to be much more play than the OEMs, while the center bore supposedly matches at 56.6 mm, it's not exactly snug on it. Also the holes for the lugs are much bigger than the actual threads. When I clamp it all down it's fine (guessing because of the cone shape of the lug nuts), but how can I guarantee that it's even centered, or that this won't create pressure that's not meant to be on the threads or lug nuts?
",0,1760580848.0,3,AskMechanics,1760729627,2025-10-16 02:14:08,2025-10-17 19:33:47,"cormack_gv (Score: 1): What matters is the bolt pattern.  The hole in the center is irrelevant, so long as it is big enough."
1o7u1jz,Squeaking sound,I have a 2007 Toyota Corolla and it’s making this weird squeaky sound coming from the front passenger side any ideas of what it may be??,1,1760580164.0,2,AskMechanics,1760729627,2025-10-16 02:02:44,2025-10-17 19:33:47,TT_Xyooj8 (Score: 1): Could be your blower motor. Good way to test it is by blasting the fan and see if the squeaky noise gets louder and quiet when turning off the fan.
1o7tyv9,Is it my battery or no?,"I bought a used car. It started fine. It had a nut come off on a starter terminal. I threw a lock washer and a nut on it. 
Now unless I have a jumper cables from another battery connected, it’s completely 100% dead. That’d be my battery correct?",2,1760579956.0,14,AskMechanics,1760729627,2025-10-16 01:59:16,2025-10-17 19:33:47,"Comprehensive-Bet56 (Score: 1): Completely dead, no dash lights before a jump?  Or weak lights?  What's the voltage of the battery?"
1o7ti7d,Should I take it off and retighten it?,"So this is my Chevy impala 2005 3.4. This is my first car it had a blown head gasket, got that fixed. But this part is the coolant bypass pipe I don’t know if I didn’t fully tighten it but there is a bit of a gap as you cab see its not fully down flat, could it possibly leak from there ?",2,1760578644.0,4,AskMechanics,1760729627,2025-10-16 01:37:24,2025-10-17 19:33:47,"Radiant_Street_5448 (Score: 5): Yes it can and will, take it off and tube out clean the inner rim with some scotchbrite and then brake clean and shop towel, then youre going to want a new oring if theres one on and do the same process on the pipe for cleaning just on the outside sealing surface.

pauliefishing (Score: 2): They probably put the wrong O-ring on it. Make sure you grease it and it’s clean before you put it in."
1o7sp5h,Unknown Thumping Noise During Sharp Right Turns,"The car in question is a 2016 Toyota Corolla with 176,000 miles. I think this Corolla is the “L” trim ( manual transmission and very bare bones). Nearly all miles are highway driving along straight portions of interstate. When making quick sharp right turns with the front suspension loaded, the car makes a thumping sound, which I recorded in the attached video. I have taken it to 2 different mechanics and taken the wheel off myself, but cannot figure out the root cause. Please let me know if you have any ideas.",1,1760576365.0,4,AskMechanics,1760729627,2025-10-16 00:59:25,2025-10-17 19:33:47,"ConstantMango672 (Score: 2):  Outer cv joint, just replace the whole axle. Not that bad of a fix"
1o7s83r,2016 Golf R automatic,"Hi!

I’m pretty new to cars, I’m only involved because my husband is into them. Today I had a big scare with this car and I’m looking for some possible insight or thoughts on diagnosing it?

For some background, about 2-3 months ago, my husband and I bought this car from a used car dealer. The 2016 Golf R is automatic and had 133k miles on it (I know, I heard that’s bad for a euro car, but we bought it anyways). The exterior isn’t completely stock as the previous owner tweaked a few things to make it appear slightly sportier. We also have a guess that the previous owner messed with things mechanically by tuning it. None of that is for sure though.

Today I was heading to the butcher and as I almost got there a beeping alert went off and showed up on the dash. It read “12.6v battery not charging. Stop vehicle!” So I pulled over and stopped. My husband, on the phone, thought that meant the alternator was starting to go bad and that I would be fine to continue to the store to get what we needed and then go to an oreilys to confirm if it was the alternator going bad. The oreilys man confirmed that the alternator was cooked and we would need to replace it. I asked him if I would be fine making the 25 minute drive home and he said absolutely since the battery still has some juice. I forgot to mention, the battery tested good/healthy but needed charge as it was at 56% confirming the bad alternator suspicion. Once the car started again to go home, the alert from before popped up again.

I got on the interstate heading home and about 10 minutes into the drive the rpm meter stick waved over to the right hitting the red line (8000rpm) and then stayed there until I pulled over. I also noticed off to the right where it tells me what gear I’m in was jumping from D6 to D4 and then D5 and more. Basically it was just jumping all over the place. Once I slowed the car down in the shoulder my steering wheel completely locked up. I hadn’t fully parked the car yet when this happened. Once I parked it started throwing all sorts of alerts at me. Tire pressure errors, airbag errors, every light that could be lit up slowly started lighting up. I got multiple back to back errors saying “Error. Electrical system. Stop!”,  brake malfunction, steering system malfunction and more. My parking brake was put on for me and so was auto hold (not sure what that is). Anytime I touched the wheel to try and move it to the left or right it would yell at me again with the beeping and tell me to stop the car. My traction control turned off and I think that’s it that I can remember. The dashboard started getting dimmer and flickering but the car never completely died as the lights would still turn on once the door opened. I eventually quickly just turned the whole car off on the side of the interstate.

I know it’s probably the alternator but can it cause all of that stuff to happen? Or it is just because Volkswagens have a ton of sensors and if one thing goes it all goes kinda thing. Idk, but this was easily added to the top 10 scariest nights of my life.",1,1760574997.0,2,AskMechanics,1760729627,2025-10-16 00:36:37,2025-10-17 19:33:47,"MaybeVladimirPutinJr (Score: 1): Old cars didn't have many electronic systems so when you lost electrical power the car would just die. New cars have a ton of electrical systems that are very voltage dependent. When the battery voltage starts to drop everything can go haywire. That car has electric power steering which definitely doesn't like losing power.


You probably didn't do any serious damage, when you replace the alternator and possibly the battery the codes should go away. "
1o7s7ru,I drained my transmission fluid on my ‘21 Subaru Crosstrek,"I am an idiot. I went to do an oil change on my car (this is the second time I would’ve done it) and idk why, but I decided to drain my transmission instead of the oil. I was reading online that Subaru made it more of a “screw you bring it to a dealer” thing in the past few years. I know there’s some pump I need to refill it and the . It’s sitting on ramps right now. I haven’t touched it since I did this (for obvious reasons). But i don’t know exactly what to get for this. And as for the bolt on the side where you refill the transmission, it’s a super jam packed fit so i was wondering if a regular (but long) flat wrench (idk what they’re actually called) would work best? I’m just sitting here rethinking my life choice bro, like i guess I’ll never forget how to change my oil ever again on this car. But man i just wish i used my brain before I did this my god.  Any help is appreciated. 
Also if it matters, I drained roughly 4 quarts maybe a little less.
There’s also no way I’m towing my car to the Subaru dealer. Especially the one near me. They are terrible. 

Edit: for a little comedic relief I guess, I was laying there thinking “wow my oil isn’t even that black” and then I also thought “hmm that engine oil has a strange smell to it” haha my god what a day. ",6,1760574971.0,8,AskMechanics,1760729627,2025-10-16 00:36:11,2025-10-17 19:33:47,"DueLet1388 (Score: 4): Well good news, now you get to change your trans fluid! Look up a video and make sure you get the right fluid, these are CVTs and generic transmission fluid will destroy them. There is a fill plug on top behind the engine and a check plug on the side of the transmission. You pump fluid into the fill plug until it flows out of the check plug, then you get the transmission hot and repeat the process. You will need a fluid pump, 8mm hex socket, and some way to gauge fluid temperature(this is generally done with a scan tool, but some YouTuber might have a diy method)

voucher420 (Score: 3): Congratulations! You can start at jiffy lube immediately!

Edit: you didn’t let the customer drive off, we’re going to redact that offer. 

Find a good reviewed local shop to tow it to after making a few calls."
1o7s5mj,Insane Oil Pressure Specs,"I purchased a 1998 Chevy (hardly running but dirt cheap) and spent a couple months getting it in good shape.
Last issue - low oil pressure with an occasional flashing lamp light. I ran some flush, replaced the pressure switch, and wound up replacing the pump as well. Nothing had any affect, not even running slightly thicker oil (debatable I know but I tried).
In the end I found a free copy of the service manual online, and the idle oil pressure minimum spec says 6psi. I'm no mechanic but that blew my mind. Also perfectly explained why the engine never even ran rough to begin with. I've only ever dipped down to 8psi too according to the dash/a second gauge so does that mean I don't really even have any issue?? And if anyone knows WHY the spec is so low that would be some cool knowledge to have. 

Tldr: Spent ages trying to figure out why oil pressure seemed insanely low only for the spec to be 6psi at 1k rpm. ",1,1760574802.0,3,AskMechanics,1760729627,2025-10-16 00:33:22,2025-10-17 19:33:47,pauliefishing (Score: 1): What size engine is it? 98 Chevy what
