id,title,selftext,score,created_utc,num_comments,subreddit,scraping_time_utc,created_datetime_utc,scraping_datetime_utc,top_comments
1o7rb1v,I feel like they are just trying to scam me. 2017 Volvo s90 T6,,1,1760572503.0,5,MechanicAdvice,1760643270,2025-10-15 23:55:03,2025-10-16 19:34:30,RickMN (Score: 1): Just to confirm... how many miles on this and have the spark plugs been replaced?
1o7rapf,Is this what a bad engine would do?,,2,1760572477.0,16,MechanicAdvice,1760643270,2025-10-15 23:54:37,2025-10-16 19:34:30,"jerrycoles1 (Score: 46): It’s not what a good engine would do

QwopperFlopper (Score: 11): Piston rings aren’t doing so hot. It’s common for a little but of pressure to come up thru the head but that seems excessive"
1o7r9y2,Sudden clicking/knocking noise,"For context, I was driving down the interstate and I had eventually sped up to about 85 miles an hour going downhill when all of a sudden a loud clicking/knocking noise started in the front of my car. I immediately took my foot off the gas and the noise blown away, and I haven’t heard it again since while driving, sounds like it was coming more from the driver side versus the passenger side. For additional context as to why I think it’s suspension related, my car had been making a squeaking noise whenever driving over bumps at all, but it is no longer making that noise after this had happened. Any ideas as I don’t see anything offer first glance around the suspension that looks wrong.",1,1760572426.0,2,MechanicAdvice,1760643270,2025-10-15 23:53:46,2025-10-16 19:34:30,"Ok-Escape5017 (Score: 1): Forgot to add, 2015 Honda CRZ"
1o7r5ev,21 Honda Civic feels floaty after wheel hub replacement.,"Sorry in advance if this is long.

A few months (maybe 3-4) I got a new set of tirs put on at which point the guy said one of my wheel studs was broken. 
Took it to a shop a couple weeks later, where they replaced the entire wheel hub assembly. 

Fast forward to last week and as I'm turning into my driveway I hear a very loud metal to metal clank sound and the remaining three feet I drove in produced a horrible grinding sound from the front left wheel (the same wheel that had the hub assembly replaced).

Had it towed back to the shop the next day. When my husband talked to the guy on the phone he made a comment about the right wheel hub being replaced but then quickly corrected himself.

They kept the car until the next day, and then claimed it was a rock in between the brake and rotor. I have had that happen before, it was not that.

Nonetheless, we got the car back and it actually felt like it was driving smoother than before. However, now whenever I'm driving on a curved freeway entrance, it feels like I'm about to spin out even if I'm going relatively slowly.

I'm taking the car to a different place to have it checked out, but I'm curious if anyone has any ideas what could cause this potentially. Mainly on account of its been raining for a few days so I fully expect for whoever I deal with to tell me it was the wet roads so I would like to at least be able to point them in a general direction.",1,1760572094.0,4,MechanicAdvice,1760643270,2025-10-15 23:48:14,2025-10-16 19:34:30,"QwopperFlopper (Score: 1): Are the lug nuts tight on the wheel? If you have a jack (you should somewhere in the car) you or your husband should jack the wheel up, give it a good shake. See if anything feels loose"
1o7r4cg,Engine won’t start,My truck (2011 Chevy Silverado V8 5.3L) won’t start and it just sounds like a stutter when I turn the key. Could it be an ignition issue?,1,1760572015.0,4,MechanicAdvice,1760643270,2025-10-15 23:46:55,2025-10-16 19:34:30,"Unknown32122 (Score: 1): At the least make sure there is oil in it. I would hope it’s something dumb like the alternator/starter, fuel pump or spark plugs. It could also be your battery or ignition coils.. there’s no way to really tell off hand.

How old is your battery?"
1o7r2k3,What can I fix on my own?,"Just had an oil change at Jiffy Lune for my 2002 Chevy Tracker (2.5L, 6 cyl, 4WD). They explained that I had pretty bad leaks throughout my engine (please see picture). I did some googling and rough estimates on repairs could be north of $5k. The vehicle is hardly worth $1k (if that)! I don’t have much experience doing any sort of work on cars (for example, in the past I’ve changed oil, batteries, fuses and filters, etc.). Is there any chance that I could do some of this on my own? What would be the priorities to get fixed first? Thank you in advance for any guidance!",1,1760571890.0,11,MechanicAdvice,1760643270,2025-10-15 23:44:50,2025-10-16 19:34:30,"QwopperFlopper (Score: 1): Do you have tools, any experience?

That_Raisin_836 (Score: 1): Bring that list to another shop and have them check them out, a lot of that stuff you can do at home, worth a second opinion"
1o7qzks,Help please! Weird noise. Sounds like scraping metal.. thank you sm,,1,1760571676.0,7,MechanicAdvice,1760643270,2025-10-15 23:41:16,2025-10-16 19:34:30,QwopperFlopper (Score: 1): What are you doing when it happens?
1o7qyac,Need help finding this vacuum line end . Where does it go,,1,1760571589.0,3,MechanicAdvice,1760643270,2025-10-15 23:39:49,2025-10-16 19:34:30,"Present-Ad-6509 (Score: 1): Do your vents inside switch looks like may go to a/c look at fire wall

Upbeat-Thought6849 (Score: 1): Sorry guys it’s 1997 dodge Dakota with the 3.9 v6"
1o7qvbs,im a begginer and i need a good cheap OBD2 scanner,"Im looking for a OBD2 scanner that i can use on my families car but mainly a 2015 Dodge Journey with some problems too it and one that has no extra fees to it

and My budget is $200 and under plz help",1,1760571377.0,8,MechanicAdvice,1760643270,2025-10-15 23:36:17,2025-10-16 19:34:30,"127-0-0-1_Chef (Score: 1): Try looking into this

https://a.co/d/8HpOrVh

RichardSober (Score: 1): Stellantis cars have good aftermarket scanners: AlfaOBD, DiagFCA, JScan. All 3 are $100 or lower, depending on cables you buy."
1o7qnbu,Intermittent misfires,"2003 Nissan Altima Base. Bought the car and after a few weeks it started misfiring. Took it to the mechanic, he said he replaced one coil (This is what he said to the best of my understanding and memory) and it stopped. No misfires for a few weeks, then it started again. Both times it started & progressively got worse (longer, more often.) What’s the deal? 

I’m pretty sure I need a new cat regardless (I have a code for it and have tried cat cleaner,) and I am very very broke so i will continue driving on it. When the misfires happen i let off the gas until it stops. Just wondering what you guys are thinking, and if i’m likely in for a lot or not. I will be going to the mechanic soon but I am a college student and it is so hard to fit into my schedule. ",1,1760570791.0,2,MechanicAdvice,1760643270,2025-10-15 23:26:31,2025-10-16 19:34:30,hikingsticks (Score: 1): Buy a cheap choice reader from amazon so you can see what codes are there and which cylinder(s) are misfiring.
1o7qn5j,"F-350 sometimes dies while driving, can be revived by a finger’s touch to the battery",,1,1760570779.0,6,MechanicAdvice,1760643270,2025-10-15 23:26:19,2025-10-16 19:34:30,"Worldly_While9186 (Score: 1): A touch to the battery terminals making a better connection because it keeps getting loose and losing contact ?  My guess is replace the battery terminal connector thing

Skynet_lives (Score: 1): Just to be clear, if you don’t touch the battery the truck won’t start? Also can you touch the battery anywhere or does it have to be on a terminal? Which terminal if so? 

Sounds like a bad terminal, or power/ground wire in the area of the battery."
1o7qmlq,Free/loose play crankshaft,"Nissan Sentra 2012 when im cranking the crankshaft by hand it has compression then suddenly goes loose, been on this for a month i dont know what it is.",1,1760570739.0,2,MechanicAdvice,1760643270,2025-10-15 23:25:39,2025-10-16 19:34:30,"Vengeance1020 (Score: 1): Compression and leak down tests will give you better answers, I would start there. And if it passes a compression test doesn't mean it'll pass leak down"
1o7qmjh,Does this estimate seem reasonable?,"My car is a 2016 VW Jetta automatic with the 1.4l engine and 142k miles. After taking it in for an oil change, I just was dropped this bombshell of a repair estimate. Can I please get some advice if this is a reasonable cost. ",1,1760570734.0,4,MechanicAdvice,1760643270,2025-10-15 23:25:34,2025-10-16 19:34:30,"Late-Stage-Dad (Score: 6): I think it’s hilarious they charge $24.95 for a “free tire rotation”.

Skynet_lives (Score: 1): Anytime the shop doesn’t split the labor and parts on the estimate (or tell you what parts they are using) decline, leave, and find another shop. "
1o7qj5m,"Car intermittently doesn't start, battery terminal correlation","My car intermittently does not start.  Re-seating or wiggling the connector onto the positive battery terminal fixes it.  When the battery was last replaced, the top of the bolt that holds down the battery ""clamp/bar"" broke off.  The bottom part is soldered, as far as I can tell from using my flashlight on the underside, so I wasn't sure how to remedy this.  Duct tape has been holding it down somewhat securely for a bit.

Looking for opinions on my hypothesis, which is that the connection must be getting jostled/loosened by the battery not being clamped down tight.  What is a short-term solution for getting the battery secure, and what is the long-term solution?

Other details: lots of battery acid was built up on the positive battery connector when the battery was replaced, I got it all off with a brush.  The connector still looks like it's had better days.  Could the electrical connection be weakened by the worn down connector end (sorry if my best-guess terminology for all these components doesn't make sense)",1,1760570491.0,8,MechanicAdvice,1760643270,2025-10-15 23:21:31,2025-10-16 19:34:30,"TheBigYellowCar (Score: 2): That positive terminal looks jacked up. The bottom is all wonky. Go to a parts store and get a replacement. 

As for the hold down, the tray that the battery sits in has an eyelet on both sides. The vertical rod is U-shaped at the bottom, threaded at the top. You hook the bottom of the rod into the eyelet, place the top bar over the threaded portion, and secure with a bolt. You should be able to get a new rod as well at a parts store."
1o7qgdt,"What is this peace and how much would it be to replace? 2015 Nissan Sentra, 1.8l","Car started being extremely loud when pushing the gas while I was at a red light. The sound seems to be coming through here. It's between my catalytic converter and the rest of my muffler. 
Is this something that can be welded, does the whole thing have to be replaced?",1,1760570292.0,8,MechanicAdvice,1760643270,2025-10-15 23:18:12,2025-10-16 19:34:30,"JWBananas (Score: 2): Is it just me or does that look like a previous (but failing) repair attempt?


Drive across the railroad tracks and find the most run-down un-busy muffler shop you can find. Bonus points if they don't look like they're even in business anymore. Bring cash. Ask them to cut that section out and weld in a replacement.


A more bougie shop will just want to replace it.

Carolina-Hurricanes1 (Score: 1): ☮️"
1o7qftg,Anybody know why my radiator look like this ?,,2,1760570250.0,2,MechanicAdvice,1760643270,2025-10-15 23:17:30,2025-10-16 19:34:30,"civil-ten-eight (Score: 1): Looks like you took a dump in your anti freeze

Tokarev490 (Score: 1): Rust in the coolant, by itself not a huge issue but definitely isn’t good. You can try flushing the system with distilled water until it’s clear, but if the rust is set in it may not come totally clear. I’ve used the chemical flush products a few times and they do seem to help a good bit, if you’re concerned about it I’d do that. Theres plenty of direct walkthrough videos on YouTube that can tell you every step for a coolant flush."
1o7qf0r,Faulty sensor,"Hey there, i drive a ford focus 1.6 diesel 2016. The tyre sensor light came off a few months ago in the dashboard, but i left it off. And today a sign showed up on the screen, saying faulty tyre sensor, service needed and then went away amd showed up again. Light has been on for the last few months, but this is the first time and actual Sign appeared. How could this affect my car? besides not knowing if the tyres are faulty",1,1760570193.0,2,MechanicAdvice,1760643270,2025-10-15 23:16:33,2025-10-16 19:34:30,"hikingsticks (Score: 1): Annoying warnings mainly. It's generally the battery in the sensor going flat. Just buy a new set of 4 online, you can usually get them for under $5 each."
1o7q72y,Suspension Problem,"I have a Honda CRV 2002. When driving, there is a loud rattling noise, especially at higher speeds and when going over bumps. I do not have a lot of car suspension knowledge. I want to get this fixed and I think it is the struts, but I don't want to throw a lot of money into the suspension only to have it not fix the problem. I attached a video, if anyone knows what this is or anything about it, any help would be much appreciated",1,1760569612.0,2,MechanicAdvice,1760643270,2025-10-15 23:06:52,2025-10-16 19:34:30,nullvoid88 (Score: 1): Just a hunch... do a quick check to be sure all your lugs are tight.
1o7q6yf,Does anybody know the replacement process for oil cooler on 2013 Kia optima EX,I got all the hoses removed from a significant leak im dealing with. Once the hoses got removed just like some of you mentioned the nipples on the oil cooler were basically dust and snapped right off. I now need to replace the oil cooler as well. Does anybody know what the process is for doing that on these cars? Any diagrams? Also what about the threaded bolt I’ve read about that the oil filter threads on - when replacing the cooler do you have to get a new threaded rod as well or can you reuse the old one?,1,1760569603.0,3,MechanicAdvice,1760643270,2025-10-15 23:06:43,2025-10-16 19:34:30,"Fine_Flounder8359 (Score: 1): The oil filter covers the bolt you need to take off the oil filter screws onto it you will need a 12 mm Allen to lossen it

civil-ten-eight (Score: 1): 🔥"
1o7q5zy,Do i fix my 2011 Nissan Maxima or do I scrap it and finance a new car?,"Hello. This is my current situation. I own a 2011 Nissan Maxima, I bought it from a family member.  The car was sitting in a garage for about 5 or 6 years before I bought it for $5500. Ive been driving it for a year and a half, there's about 140,000 miles on it. Since the initial purchase, i've had to spend like $2000 in maintenance and repairs. 

Recently, ive been having some issues. I took it to the shop. My air compressor unit's clutch is apparently about to break off. That needs to be replaced, my belt and tensioner needs to be replaced, and there is an antifreeze leak around my water pump area. 

The repairs are about $1000. My Carfax said my car's value was about $1500. I have no clue what to do. I love this car. Its old but it has been decent to me. Should I finance a new one and put a car payment on top of college and insurance costs, or should i bite the bullet and get my current one fixed?",1,1760569532.0,7,MechanicAdvice,1760643270,2025-10-15 23:05:32,2025-10-16 19:34:30,"Trogasarus (Score: 2): Can you find another car that is the same cost for around 1k that may or may not need work?

Sometimes its best to keep it running well enough, to save for something else.

Herbisretired (Score: 1): If you bought another used car there is a very good chance that it would need to have some work done to it. You know the car that you presently own and the type of repairs aren't that uncommon and I would repair it."
1o7q5ph,Starting/Ignition Issues Diagnosis,"I’m trying to help a buddy get his car starting and running normally. It’s a 2008 Pontiac Grand Prix Base with the 3.8 non supercharged V6, and let me say he’s one of my best friends but he has run this car into the ground. 

The issue he’s been having with it seems to be rather complex. First he was having trouble starting the car, so I replaced the alternator and battery with parts from the junkyard (reman battery and used alternator) and that seemed to fix the problem for a few weeks but now he’s having trouble starting it again. Usually it will start with his jump box but it misfires and I notice the lights seem to be flickering when it runs. So I went back to the junkyard and pulled a new ignition module and two of the three coils (I should have just got all three but I was being cheap). When I took off his old ones I noticed they had definitely been changed before with non OEM parts. So anyways after I did that and triple checked I had the spark plug wires in the correct order I jumped it again with the jump box and barely got out of the parking lot before it died again. My friend said that had happened before and he had to jump the car on the side of the road which is terrifying. So I plugged in the OBDII box and got a P0300 misfire code, so I tried swapping over the only old coil I had installed which was 1 and 4 and swapped it with the coil that was 3 and 6, and now I’m just waiting for the jumpbox to charge back up so we can start it again. Like I said we’re just barely scraping the surface on all the work that needs to be done to this POS but he needs something to drive to work. Any help would be greatly appreciated. Once I get this issue fixed he’s going to need motor mounts, wheel bearings and probably more suspension too, I haven’t gotten around to that yet.",1,1760569512.0,2,MechanicAdvice,1760643270,2025-10-15 23:05:12,2025-10-16 19:34:30,"hikingsticks (Score: 1): You need diagnostic equipment rather than just replacing things randomly. Start with a multimeter. What voltage is the battery at when fully charged? Voltage when cranking? Charging system voltage with lights, internal fan etc loading it?
Voltage drop across the usual places?

Do you have good plugs installed? Good spark? Correct timing? Sensor readings make sense?"
1o7q5ic,Windshield wipers jump,"Hi, I have a 2021 MB GLA250. Bought new wipers from Mercedes and installed them correctly. Last rainstorm the wipers (specially the smaller one) tends to jump/skip specially when it almost comes down all the way. The larger wiper does it but not as much. I hit the washer fluid and it helped for a few moments before it went back to skipping. Any advice on how to fix this?",1,1760569497.0,3,MechanicAdvice,1760643270,2025-10-15 23:04:57,2025-10-16 19:34:30,hikingsticks (Score: 1): Try articulating the wiper arms a few times with some wd40 to work it into the hinge.
1o7q39u,Car isn’t starting,I’ve got a bmw e60 525d and whenever I click the push to start button it won’t crank/turnover at all but this metal arm does move forward and then back. I’m unsure what might be causing the car not to start because I know it’s not fuses or the battery after checking both. Anyone here got any idea what might be the issue?,1,1760569338.0,4,MechanicAdvice,1760643270,2025-10-15 23:02:18,2025-10-16 19:34:30,"seattle_lite90 (Score: 1): It’s likely your starter if you have good battery voltage, also unlikely but possibly starter relay

shitflinger2000 (Score: 1): That’s your turbocharger wastegate actuator rod. Not responsible for turning your engine over. Look at the starter."
1o7prpp,Hydro locked Engine need help. What do I do in this situation??2007 dodge 2500 gas.,,2,1760568607.0,2,MechanicAdvice,1760643270,2025-10-15 22:50:07,2025-10-16 19:34:30,"Alpinab9 (Score: 2): Remove the spark plugs and drain the oil. Spray some penetrating oil in the plug holes. Try to rotate the crank pulley with a ratchet or wrench. Sometimes trying to spin counter clockwise a bit first, then switch to clockwise. If it makes it 2 full revolutions you should be safe to try the starter."
1o7po5c,Rear lights not working,"Hello I have a Honda CRV 2002. At night time the running tail lights are off, and I have to use the hazard switch to alert other drivers of my presence. When I tap the brakes the lights come on, however when driving the lights are off. I've tried finding the solution to this. Any help would be much appreciated",1,1760568370.0,2,MechanicAdvice,1760643270,2025-10-15 22:46:10,2025-10-16 19:34:30,"hikingsticks (Score: 1): You need a multimeter, test for voltage and ground at the housing."
1o7pmqr,Can someone Help explain this to me+ extra question below (my boyfriends alignment),"I also wanna know why they said he’d need to get adjustable upper front control arms, not just new oem ones, when his aren’t bad and they said that just changing the ball joints wouldn’t matter (we don’t think the ball joints are bad atleast from visual inspection + there is no play or noise coming from them) (they said the rear is red because we need new adjustable toe cam bolts) (I feel like I’m being a paranoid girlfriend because we recently got an alignment that was similar in results to this and they didn’t say anything we also got an inspection on his car done and they said nothing was really wrong)",2,1760568276.0,7,MechanicAdvice,1760643270,2025-10-15 22:44:36,2025-10-16 19:34:30,"WhoIsMike4774 (Score: 1): In laymen terms, not every measurement is adjustable on every car.   They adjusted what they could and recommended the parts required to get the rest in the green.

Khalizle (Score: 1): My guess is the centric bolt for the rear toe is seized in the bushing. Fairly common on Nissans. I’ve had to cut out a few bolts. That’s my best guess for the rear toe. For the front, if it’s stock then it should be able to get into spec. If it can’t then something could be bent out of shape. The front struts could be worn out to the point the front ride height is an inch or two lower than it should be. I don’t believe the Z has camber adjustment so that’s my guess. Leaning toward low ride height in the front or too high of ride height in the rear. 🤷🏾‍♂️ tough to say for sure."
1o7pjg5,What can I do if Ford is charging me $1250 for a part I said I didn’t want going in if there’s an issue with the transmission…the part went in and now they’re saying the transmission is dead.,"Any advice is appreciated! My car (2012 ford escape hybrid) started going idle once hitting 20 mph. I took it to a regular mechanic a couple weeks ago who said the problem was with part of the hybrid system and therefore it had to go to Ford to fix. I took it to ford, they said the issue was that the hybrid inverter coolant pump was inoperative so that would be what’s causing the issue. They also said there was a suspected transmission leak, and to run a diagnosis would be $200.
I said I did not want to invest a ton of money into this car, so we should do the transmission leak diagnosis first, as I had no interest in doing other work if the transmission was out. They back pedaled and said the main issue was the coolant pump. Ok, I approved the pump.
Now a week later they’re saying they put the pump in, the car is still doing the same thing, and the issue is the transmission…which is $18k but they also don’t even make it anymore. They said the car is “toast”.

Do I have any options here? I am so beyond frustrated I explicitly told them I did not want to do this if there was a problem with the transmission, now I still owe $1250 for this pump that did nothing.",1,1760568050.0,4,MechanicAdvice,1760643270,2025-10-15 22:40:50,2025-10-16 19:34:30,"SexySexerton (Score: 1): Did you approve the pump or no?

wormwormo (Score: 1): If you ok the work on the phone they record everything these days."
1o7pc9h,Baaad Breaks,"Hey yall i have a question, so i have to drive 2hrs to another city and 2 hrs back to where i live. My left break is scraping my break rotor like kinda engraving it. i would OBVIOUSLY get it fixed asap if i had money but i just need to know what to do and what can happen from it scraping so much. i own a 2017 Nissan Altima. ",1,1760567548.0,4,MechanicAdvice,1760643270,2025-10-15 22:32:28,2025-10-16 19:34:30,"Wise-Plate-9218 (Score: 1): The steel backplate of the worn brake pad will tear up your rotor, cutting grooves into it until the caliper piston finally catches and is jerked out of alignment, leaking brake fluid and allowing air to enter the brake lines. Then your brake pedal gets very mushy and ineffective and you lose stopping power, potentially while driving down the road at a good rate of speed.


Assuming you manage to roll to a stop or feather your parking brake to stop, you're looking at new brake rotors, pads, and calipers, alongside more brake fluid and bleeding the air out of the lines, at a minimum.

eagleace21 (Score: 1): Dont drive it, if you are that far metal on metal you are just going to make things more expensive to fix, that and you are an accident looking for a place to happen."
1o7pbx7,Are these fuel trims at idle normal?,It’s a 98 civic ex with a d16y8 engine ,5,1760567524.0,13,MechanicAdvice,1760643270,2025-10-15 22:32:04,2025-10-16 19:34:30,"Careless-Economics-4 (Score: 3): Little on the lean side, but pretty normal anything below 10% is good

asakadelis (Score: 2): bank 1 is running slightly leaner than bank 2 but if its running ok you should be fine."
1o7padg,catless downpipe vs catting my oem downpipe.,"On the edge of either punching out my primary oem cat and doing a fooler on the primary sensor, or just doing a catless downpipe, is there any difference between the two besides look and maybe sound? 

Also any advice if it could hurt the engine without a tune?",0,1760567410.0,15,MechanicAdvice,1760643270,2025-10-15 22:30:10,2025-10-16 19:34:30,"Big_footed_hobbit (Score: 5): I hate driving behind a catless vehicle.

TwistedKestrel (Score: 5): The difference between the two is destroying a $3000 OEM catalytic convertor"
