id,title,selftext,score,created_utc,num_comments,subreddit,scraping_time_utc,created_datetime_utc,scraping_datetime_utc,top_comments
1our9cn,Help! Intermittent AC Issue,"Hi everyone! I'm making this post out of desperation as I've been dealing with an AC issue in my car in South Florida for a year and a half and I'm totally at my breaking point. Any ideas of what the problem could possibly be would be greatly appreciated!!

I have a 2016 Mini Cooper S (F56) with a B48 engine and an intermittent AC issue that does not throw any codes. The problem started not long after I bought it. The AC randomly cuts out to the point where I can spend most, if not all of my drive without cold air. However, when it works, it's absolutely ice cold and blows strong.

It cuts out unpredictably and doesn't seem to be affected by outside temperature. I used to think it happened more on hotter days but I think I just notice it more on those days because it definitely cuts out on cooler days as well.

I have a Launch diagnostic tablet and have noticed that the compressor clutch reads as engaged when working, and disengaged when not working.  The pressures are all within normal range for operating and not operating respectively. This is alongside hearing the clutch engage/disengage when the tablet readings change.  

The accurate readings, in combination with no codes leads me to believe something may be commanding the compressor to turn off when it shouldn't be. 

I have also noticed that when my AC cuts out, the fan speed sometimes reduces but not always. I can press the max AC button and it will blow full strength, just not cold.

Here is what I have done/replaced so far:

- All fuses checked
- AC lines have been flushed and recharged to the correct pressures multiple times
- Replaced integrated supply control module
- Replaced blower motor resistor
- Replaced blend door actuators
- Replaced compressor
- Replaced IHKA module (however, this was not coded to my vehicle so I cleared the fault on my tablet every time I started the car but the issue persisted; not sure if the frequency of cutting out changed)

I've taken it to three different shops to no avail. Most recently, a BMW tuning shop told me they think it's the hard-coded freezing temp for the evap condenser, and that the system it's attempting to thaw. They said that it's a common issue on F-Series BMWs (2008-2018) but they haven't seen it on F-Series Mini's (2014-2024). They said the fix is to program the freezing temp to a lower temperature. 

I'm not confident that this is the issue though, because my AC more often than not doesn't work upon starting my car (or even 10+ minutes afterwards), even if it has been sitting all day. It turning off and turning back on is completely random as far as I can tell.

I love this car and would love to continue to drive it but I also don't want to keep pouring money into a solutionless problem and I feel like I'm at a dead end. Thank you for your help!!",1,1762909209.0,5,AskMechanics,1763062547,2025-11-12 01:00:09,2025-11-13 19:35:47,"No_Sorbet_1266 (Score: 1): When you say you replaced the compressor, did you replace the entire compressor unit or just the compressor itself and reused the pulley/clutch mechanism? I had the exact same issue, not on a mini cooper, but it was just bad clutch.

Deeponeperfectmornin (Score: 1): >I have a Launch diagnostic tablet and have noticed that the compressor clutch reads as engaged when working, and disengaged when not working. The pressures are all within normal range for operating and not operating respectively. This is alongside hearing the clutch engage/disengage when the tablet readings change

Live data is everything as already mentioned below

It's doubtful you'd hear the clutch engaging and disengaging when driving at speed

Is the above information from live data?

If the above information isn't from live data - Have you driven the car with a test lamp wired from inside the cabin to the compressor -ive and +ive supply? - Compressor body could be -ive"
1our28f,Need help identifying parts,,1,1762908669.0,2,AskMechanics,1763062547,2025-11-12 00:51:09,2025-11-13 19:35:47,Beeblebrox237 (Score: 1): There's a good chance that a BMW/Mini specialist knows what's wrong but throwing parts at the car based on what someone on the internet tells you from fault codes is not without risk. I suspect that if you can't find an answer from someone familiar with these cars online that you're better off finding a local specialist and paying for diag.
1our1cw,Can anyone help????,"I have a stripped/seized caliper pin that I could really use help with. I’ve changed all my brakes excepted this one. Tried everything locking pliers, heat, and can’t get it off",1,1762908603.0,9,AskMechanics,1763062547,2025-11-12 00:50:03,2025-11-13 19:35:47,"longhairPapaBear (Score: 2): Remove the other pin and swing the caliper over. You'll be able to drive it out with a flat punch .

Downtown-Cloud3425 (Score: 1): 2020 Nissan Altima S"
1ouqxji,Car only starts on second start attempt,"This is a 2019 Kia Soul, 2.0 Liter engine.  
  
The first time I go to drive for the day, when I first turn the ignition the car doesn't seem to want to even try to start, then on the second attempt can start the car if I put my foot on the gas.  If I don't put my foot on the gas, it continues to not start.  If I put my foot on the gas on the first attempt, it never starts either.

This only occurs if the car has been sitting for 24 hours or so, If it doesn't sit long it fires right up.  Like a full day at work when I come out 8 hours later it starts up.

I've cleaned the battery terminals and the intake air filter. There are no codes and seem to have zero issues while running / no drop in power.

To me it feels like there is a drop in fuel pressure or something overnight?",0,1762908323.0,7,AskMechanics,1763062547,2025-11-12 00:45:23,2025-11-13 19:35:47,"SpiderOnYourNeck (Score: 1): Yeah looks like batter good. Turnnon without cranking, wait, turn off, do another time, crank it at the third. If car is starting good, pump or fuel delivery issue.

Nada_Chance (Score: 1): Try turn key to on and then wait till the fuel pump stops whining, then turn the key to start. If that ""solves"" the no start issue, the fuel system is bleeding pressure off and you need to figure out whether an injector is leaking down, or the fuel pump check valve is bad."
1ouqx06,What needs to be replaced?,"Help please. I'm a bit nervous about my exhaust system now. These are a few pictures underneath a 2014 Ford E-350 Super Duty that I purchased recently. I took these while under it removing a nut from a bolted in seat that I wanted out. These rusted pieces stuck out to me the most, hence the pics. Just wanted some relative advice before going to the mechanic tomorrow so I know what to expect. Thanks in advance.",0,1762908286.0,3,AskMechanics,1763062547,2025-11-12 00:44:46,2025-11-13 19:35:47,"boostedride12 (Score: 1): The first picture the hole is to let water out of muffler to prevent it rusting from inside out. The third pics a shock cover rusted. Not crucial to driving

No_Bike8657 (Score: 1): New exhaust and new shocks"
1ouquj3,Are these checklists actually performed as written?,"I’ve always wondered about this.  When I take my car in for service and I get these little report cards back….do the technicians *really* inspect all of these things?  I mean, I hope they do.  But I also have a hard time picturing a crazy-busy service tech going through and meticulously examining each and every thing on this list.  Particularly at a dealership service department. 

Also, apparently my brake linings have gained 1mm since November of last year.  A miracle! 😹",1,1762908096.0,3,AskMechanics,1763062547,2025-11-12 00:41:36,2025-11-13 19:35:47,"-NOT_A_MECHANIC- (Score: 3): Depends on the person. I know people that give it a once over, and I know people that are anal.

TheFaultyRecoil (Score: 3): A couple of shops ago, I was a fleet mechanic. I seen my old fleet manager falsely on more than 75% of the fleet when the time for the DOT inspections came around. If he did check anything, it were the clearance lights, head lights, tail lights, and mud flaps since those are the things that’ll get someone pulled over. He’d assume everything else was fine. I kept my mouth shut out of fear of retaliation, and was in the process of finding the next gig. It was a small poorly ran company, plagued by nepotism and cutting corners. I refuse to assume the competence of any technician after working there."
1ouqqve,It’s got into an accident,My radiator may be broken. Can I drive 25 minutes home?,1,1762907824.0,2,AskMechanics,1763062547,2025-11-12 00:37:04,2025-11-13 19:35:47,"IOI-65536 (Score: 2): It depends on what ""broken"" means.  I've had a radiator crack at the fill valve and it could go several weeks before it lost enough fluid to be a problem.  On the other hand if it's broken such that coolant can't flow at all you likely have seconds to minutes (like 3, not 25) before the engine overheats even at idle."
1ouqkd1,How do you tighten the control arm bushings?,"I’m installing skunk 2 adjustable control arms and I know you have to have the suspension under load before tightening the bushings but there’s zero room to do that. 

It’s a 93 Integra ",1,1762907343.0,4,AskMechanics,1763062547,2025-11-12 00:29:03,2025-11-13 19:35:47,84FSP (Score: 1): You can put it under load with wheels off by dropping the hubs onto wood blocks or jack stands.  Gives you freedom to access.
1ouqj7t,Should I get it fixed or just let it go and get a new windshield down the road,"This happened today so it hasn’t gotten worse or spread, it was just a big ol rock",7,1762907257.0,32,AskMechanics,1763062547,2025-11-12 00:27:37,2025-11-13 19:35:47,"84FSP (Score: 6): Often insurance will fix free.  Give a call and ask, much easier than dealing with a whole new windshield.

-NOT_A_MECHANIC- (Score: 2): That’s beyond fixing. Best you can do is slow it down"
1ouqgo8,Drain plug washer. wrong one?,"Hi. I'm doing my first oil change. I get the drain plug out, and I'm taking the gasket/washer out and I notice that it's different to the one I got from advance auto parts. They sold me an aluminum one that is thinner and didn't have the rubber as the other does. 

It's this the wrong gasket? 
Should I use the old one? 

In the pictures first you see the old one and then the new one compared to the old one",2,1762907064.0,6,AskMechanics,1763062547,2025-11-12 00:24:24,2025-11-13 19:35:47,"-NOT_A_MECHANIC- (Score: 6): Looks like what’s left of a rubber and metal gasket. Remove it with a sharp pick or flathead, use a new  aluminum crush gasket, carry on. Make sure none remains on the pan mating surface. That plug head is looking a bit rounded, may want to replace that. What is this a honda?

cormack_gv (Score: 1): Looks like there are two washers.  Take off any extras."
1ouq9pd,What would cause a cigar lighter to heat up super slowly?,"The cigar lighter in one of my cars takes forever to get hot. I dont think its just the way the car is, it even says in the manual it should only take 5-7 seconds before it pops up and is ready to use. Mine takes at least 30 seconds to get red hot and never pops up on its own like its supposed to. I checked and I am getting 12v at the socket, and there isnt any ash or anything stuck to the coil on the lighter itself. 

The car is a 1978 chrysler cordoba as if that matters, my other cars are also from the same era and all heat up quickly and pop up when does as expected, so this isnt an old age issue. This is the only car ive had that has this issue with, usually the lighters work great or not at all. ",1,1762906553.0,4,AskMechanics,1763062547,2025-11-12 00:15:53,2025-11-13 19:35:47,"cty_hntr (Score: 2): As part of troubleshooting, have you tried swapping the lighter plug?  The heating element is in the plug.   When you push in the plug, it completes an electric circuit which heats up the coil.  If other plugs work in the socket, then it points to a defective lighter plug.  If other plugs take the same slow time to pop, then investigate the socket further.

Ravenblack67 (Score: 1): The coil is wearing out.  I serviced my fathers 76 Cordoba He was a smoker and the lighter was a big deal."
1ouq6la,Why does this wire say “do not remove?”,"Just had a starter put in by a mechanic about a month ago. It went out so I warrantied it. I don’t like wiring so my question is, can I just remove the old wire from the terminal and connect it to my new starter since the starter is still really new? Why is it that they say not to remove that wire? I was wondering if it says that because they strongly recommend replacing it, but I can’t imagine why it’s a big deal. What I want to do is just remove the new wire from the new starter and connect the old one to it. Is it because if you try to torque that bolt, it will rotate the terminal part of the starter? I haven’t made any moves yet but I’m wondering if it’s a big deal. I’m already pretty short on wire and it would save me a lot of time and effort.",1054,1762906325.0,129,AskMechanics,1763062547,2025-11-12 00:12:05,2025-11-13 19:35:47,"Chesterrumble (Score: 585): Some fords had bad connectors at the end of the power cable so the new starter comes with a replacement.

Educational-Log-7259 (Score: 60): I forgot to add it’s a 1995 ford econoline 150 5.0 with about 89k miles."
1ovgbc2,What the heck is this? A battery issue or...?,,3,1762978923.0,1,AutoMechanics,1763062547,2025-11-12 20:22:03,2025-11-13 19:35:47,mrhicks55 (Score: 1): Looks like it. if you know anybody with jumper cables try to jump it see if it helps if it does it's a battery most likely
1ovb542,What's the smallest air impact wrench/driver you know of,"So, after I did a water pump and thermostat job on a 2007 Saturn Ion-2 2.2, I was wondering how easier it would have been with one of those ""compact"" ones. This job was probably the most difficult one I've done so far as a DIYer. I spent maybe 36 hours nonstop. Honestly, a lot of time went to researching things like things like ""can I use aluminum putty to piece back together the plastic part of a coolant temperature sensor?"" Or ""how the hell am I supposed to reach these three bolts I can't even see!?"" amongst other stuff, but the tight spaces I had to deal with made me wanna cry blood tears and drink them 😭 

I have to go back in there because I reused a gasket on the thermostat housing looks to be rectangular but the one that comes with gasket kit I used is circular and was supposed to be the replacement but since it wasn't rectangular I assumed I had to purchase that gasket separately. I found out later that this wasn't the case, and I should have used that gasket. Also, I have to replace the sensor I broke. I mean, everything seems to be good. No leaks, and the sensor seems to be working and ok from what's showing on the dash and on my scanner tool app. Would you leave it be?

So, is there a super small air impact driver available. I've never owned one, so I can't give dimensions or an example. What's the smallest you guys ever used or know of

Thanks",1,1762967766.0,1,AutoMechanics,1763062547,2025-11-12 17:16:06,2025-11-13 19:35:47,fishin_man100 (Score: 1): There are air ratchets and also battery powered ones that can get into narrow areas. I have a 1/4” air ratchet and I’ve seen battery powered ones the same size.
1our0e0,06 silverado,"I have a 2006 silverado 1500, it keeps stalling at idle and while driving.  Have changed fuel pump, evap solenoid and purge valve. It's not throwing any codes any ideas?",2,1762908528.0,1,AutoMechanics,1763062547,2025-11-12 00:48:48,2025-11-13 19:35:47,"traineex (Score: 1): U plugged in a scan tool? Cel might be disabled/bad

U use gm genuine fuel pump? Test psi? Test wiring to pump?

Weak, failing, bad new pump, some wiring faults, all of these wont throw a code. Check for air box blockages, critters chewing shit up"
1ovlv68,Cruise control & brake lights,"Daft question sorry!

When driving using cruise control and you reduce your speed using the cruise control function, do your cars brake lights come on?

Otherwise how would the cars behind know that your slowing down?

Edit: Big thanks for all the very helpful replies, and I now have a much better understanding of my new cars cruise control function :-)",45,1762991846.0,37,CartalkUK,1763062547,2025-11-12 23:57:26,2025-11-13 19:35:47,"Princ3Ch4rming (Score: 71): Depends.

If it’s active cruise control, in which the car maintains speed based upon the cars in front, generally yes.

If you’re reducing speed by clicking it down manually by X mph, it depends on how fast the deceleration is.  If the car can’t slow down with engine braking alone, it might put brake (and therefore lights) on.  If you’re dropping, say, 70-68mph, it’ll just reduce throttle.

Slight-Message-7331 (Score: 16): I would also add, if it’s an EV with regenerative braking, the car will be programmed to turn the brake lights on if the deceleration is above a certain rate even without touching the brake pedal.  

That applies to normal driving and cruise control.  If you are just manually reducing the target speed, then no, the deceleration rate wont be high enough to engage regenerative braking and activate the lights, however if it is active cruise control and it is responding to a vehicle in front, then yes, the brake lights will come on.

I can’t say this is exactly the same for every EV, but it’s how my 2 month old one works and I understand this is fairly typical.

WeaponsGradeWeasel (Score: 11): Depends. 

If it's cruise control with braking, or active/adaptive/radar cruise, then yes, if you're slowing enough for it to need to brake."
1ovlr1y,GMC problems,My 2019 GMC Terrain keeps popping up with these errors after I have stopped my vehicle. As soon as I accelerate after stopping then it says “service brake assist”.  My infotainment screen randomly goes black when I reverse after starting my car. What could the issue be? ,0,1762991553.0,1,CartalkUK,1763062547,2025-11-12 23:52:33,2025-11-13 19:35:47,Vladimir_Chrootin (Score: 2): GMC vehicles aren't sold in the UK; I doubt you'll be able to get a solution in this sub.
1ovkw6b,"Car hit while parked wing mirror completely broken,what are the costs of this?car is a mk7 golf",,0,1762989403.0,1,CartalkUK,1763062547,2025-11-12 23:16:43,2025-11-13 19:35:47,"AnythingSilent7005 (Score: 1): about £60 for a new wingmirror on ebay unpainted, 80 painted i think"
1ovkej2,Mg midget,How stupid am I considering an mg midget to own as a second car in Scotland without access to a garage. I've always wanted a classic but I've no garage or shed etc to keep the inevitable rain off it! Will it dissolve in the car park? Anyone else do similar? Cheers,0,1762988235.0,13,CartalkUK,1763062547,2025-11-12 22:57:15,2025-11-13 19:35:47,"worldly_refuse (Score: 4): Yes it will dissolve.  Source - used to look after a friend's.

georgepearl_04 (Score: 2): Bit daft, they do like to rust and Scotland has a terrible climate for it. You could get a decent full body cover like a carcoon, but in a shared carpark it may get vandalized

ciaoqueen (Score: 2): What about an older TVR or Lotus? They’re both fibreglass on steel frames. If the frame has been correctly treated it should give a fair bit of protection."
1ovkbvk,Best All Rounder for ~£10k,"I return once again looking for any diamonds in the rough. 

I have a Skoda Octavia VRs Estate at the moment - it’s a manual, done 167k miles and is finally giving up the ghost. 

I paid £3.5k for it, it’s had a new battery, service, and more recently, the DPF cleaned, all at a cost. 

The piston rings have now gone, so it needs a rebuild, at a cost of £2k I can’t be bothered with sinking more money into a cheap car. 

I’m looking for something along similar lines, if all else fails I’m probably just going to get another Octavia, just a newer one. 

However, is there anything I’m missing? Ideally something with CarPlay, or the ability to add CarPlay, heated seats, and abit of ‘go’, even better if it has the looks to go with it. 

Been looking at the rest of the MQB platform, as well as 330d’s, C250’s, but nothing has really jumped out as a ‘wow I need to buy this now’. 

Budget is around £10k, will add more for something that’s worth a little extra, mainly for lower miles etc. ",0,1762988057.0,3,CartalkUK,1763062547,2025-11-12 22:54:17,2025-11-13 19:35:47,"H17TDX (Score: 3): 320d auto estate 16-17plate can pick them up under 10k , probs the best daily all rounder I’ve owned p.s I’m a car trader so owned a good few cars"
1ovkac0,7 seater MPV advice,"We currently drive a Skoda Roomster, with two tall teens in the back. Boot space is great but when we go away for uk holiday even with a roof box we really struggle for space (especially when camping). The kids are very squished in. Also when visiting relatives it would be good to be able to drive them places too, so we’ve started looking at 7 seaters.

Have up to £10k to spend. We currently do around 10,000 miles per year. Our Roomster has done 111,000 in total since 2010.

Ideally I’d like the back row to be big enough for adults to sit if needed, but also those seats to fold completely flat (not having to take them out). So we could drive to a place with a large boot full of luggage, empty car then put seats up.

We currently driving an automatic which I prefer, but are manuals cheaper and/or more reliable?

Should I get petrol or diesel? Thanks in advance",1,1762987944.0,14,CartalkUK,1763062547,2025-11-12 22:52:24,2025-11-13 19:35:47,"Cdoooos (Score: 6): Ford s max or galaxy for a manual option don't get the auto powershit. Or if you want an auto probably get a vw sharan/ whatever the seat equivalent is. For 10k you won't get any suvs that are decent or actually work

OrdinaryAncient3573 (Score: 3): Very few 7 seaters have proper seats in the back. You could get a three row van with windows, a Galaxy, or a Ssangyong Turismo. The Turismo is cheap for what you get. Rear bench doesn't fold flat, just the back folds down, but it has a huge boot even with them up - it's a massive car - and with the rear bench folded you could house a small family back there. 

Alternatively, buy a bigger roof box and keep what you have. With the money you save you can easily afford to pay for some Ubers for relatives when you visit them.

West_Category_4634 (Score: 3): An old XC90?"
1ovjmzn,UK . Does this cx5 look legit ?,"Is this a good buy ? Is it top spec or not ? Its  25 ..... what do you think?.
What discount do you think I could get , thanks 
",0,1762986398.0,21,CartalkUK,1763062547,2025-11-12 22:26:38,2025-11-13 19:35:47,"Obese_Hooters (Score: 12): To answer your OP title does it look legit, yes, yes it does...at least one of the other questions you asked can be googled.

sandsanta (Score: 6): Don’t think it’s top spec. I have a Mazda 6 with the top spec and it only comes with an automatic transmission. So I don’t think a manual transmission will be a top spec for Mazda

LiamoLuo (Score: 3): Takumi is the top trim, this is the trim below. Still a super well equipped car. You can google the differences easily to see if anything missing matters to you."
1ovjm2j,Car Size,[https://xkcd.com/3167/](https://xkcd.com/3167/),597,1762986338.0,179,CartalkUK,1763062547,2025-11-12 22:25:38,2025-11-13 19:35:47,"Royal_Turnover6332 (Score: 42): I find the Hyundai Ioniq 5 a strange one, it’s well-proportioned and often talked about as a hatchback or even an electric hot hatch in N form. Then I saw one for the first time parked next to a Golf Mk8… they’re huge! Made the Golf look like a toy.

Still looks good in photos.

wordshavenomeanings (Score: 162): The VW T Cross scores much lower for safety than a VW Golf.

SUVs Just give the illusion of safety.

Devrij68 (Score: 48): Honestly most people with an SUV actually need an estate.

Bring back the sports wagons!"
1ovj7ty,Skoda rapid 2019. Yay or nay for reliability?,"Hi guys

Got a test ride with the Skoda Rapid 1.2 2019 tomorrow. I'm looking for a reliable car with low maintenance costs. Does this car sound like a good idea then? Hoping to get some good feedback from (previous) users. 

Cant find proper tests on this cars reliability, except for chatgpt making up random numbers😂

Link: https://www.wealer.nl/voorraad/skoda-rapid-spaceback-spaceback-10-tsi-greentech-clever-2019-handgeschakeld-benzine-45913383

Please let me know.",0,1762985441.0,1,CartalkUK,1763062547,2025-11-12 22:10:41,2025-11-13 19:35:47,"Miserable-Potato7706 (Score: 1): The link is to a 1.0 tsi?

Either way on this mileage I don’t think there’s much to worry about. 

Personally I think the 1.6 TDi it the best engine the Rapid comes with though"
1oviupu,2025 MG HS,"Considering buying a 74 plate HS (2025 spec). Anyone got one of the new spec cars? Any feedback I should be aware of?

They seem incredibly good value for the amount of car you’re getting, test drove one earlier today and felt lovely to drive!

The price almost seems too good to be true!",0,1762984630.0,2,CartalkUK,1763062547,2025-11-12 21:57:10,2025-11-13 19:35:47,"MerakiBridge (Score: 3): Well, if you like it then go ahead and buy it. Personally, I’ll be staying away from this Chinese trash.

raut1606 (Score: 1): Can you DM even i am planning to buy same"
