id,title,selftext,score,created_utc,num_comments,subreddit,scraping_time_utc,created_datetime_utc,scraping_datetime_utc,top_comments
1ofoz4e,What is causing this sound from my exhaust?,2014 3.7 Mustang. Just got the 02 sensors replaced. This would occasionally happen before the replacement as well. ,1,1761390934.0,10,mechanic,1761507151,2025-10-25 11:15:34,2025-10-26 19:32:31,"DanielTako (Score: 1): It also causes a foul gunpowder like smell inside the cabin when this occurs.

Terreboo (Score: 1): That’s a misfire, more than one by the sounds of it. Unless you have a ghost cam."
1ofo0a5,How to get into the industry?,"Hello, I don't need help with a car but I do need help. I've been trying to get into the industry for I little over a month now. I've talked to dealerships put in application after application and have gotten no where. I have some personal experience from working on my car but nothing professional. I can't afford to go to school. Is there any other way? How did any of y'all get into the industry? ",2,1761387338.0,8,mechanic,1761507151,2025-10-25 10:15:38,2025-10-26 19:32:31,"66NickS (Score: 2): With no professional experience, you start at the bottom. Lot attendant/porter, car wash, lube tech, tire changer, etc. and not as a mechanic/technician.  Not every dealer hires for this role (at a previous employer we only outside hired experienced techs, entry level techs had to come from elsewhere within the org).

You’re also coming into the end of the year. Business may slow down and there won’t be open roles. 

You might need to check with different shops to get your foot in the door with this industry.

MickieAndCompany (Score: 1): In this day and age, you're unfortunately not going to get hired as a tech without some formal education. You might be able to get a job doing oil changes, and then work your way up, but they'll still require you to get an education. An employer should work with you on scheduling around classes, and many in the U.S. may offer some type of tuition assistance.

There's so much more to auto repair these days than just changing parts. ~~Anyone~~, OK, plenty of people can do that. Being a successful tech means making a comfortable living while being an asset to your employer. You'll need diagnostic and troubleshooting skills, and to understand all the various systems on a vehicle, how they work, and more importantly, how they work together. When it comes time to select a school, be careful with the trade schools. There's some good ones, but there's also some shady ones. Honestly, an associate's degree from a local community college will likely be less expensive than a trade school, but a trade school might be faster. Maybe look at doing some community college courses at night.

And as you start collecting tools, remember, a tool box is just a place to store your tools, and you'll upgrade a few times before you finally get to a size you need. Buy a cheap one for your first box. You won't have it very long, and the money saved will be better spent on quality tools."
1oflzhe,2001 Camry high pitched whistle sound when pushing the car pass 3000 RPMs,"So basically i bought a 2001 Camry a month ago and after and oil change and running the car a little for days it started making a whistle noise i just bought this car engine sounded healthy since the beginning it was after i sent it to the mechanic to change the oil and replace spark plugs that it started to have a little valve tick when accelerating and when i floor it that pitchy whistle, something that i notice is that my car doesn’t have the resonator but before it wouldn’t make that sound even tho it didn’t had it, i am not sure if it was tapped off or something before i heard this could be a reason so i will try to tape it off and then put a cap into it see if it fixes it i have a video of the exact sound of the engine:

https://youtu.be/oCQDnU3j8rU?si=q0b7KsM6QSIOQWLI",1,1761379519.0,4,mechanic,1761507151,2025-10-25 08:05:19,2025-10-26 19:32:31,"Icy_East_2162 (Score: 1): Possibly the alternator over-run clutch , 
Other possibilities - a bearing on the alternator or water pump or pulleys or tensioner, an air/ vacuum leak ,or an exhaust leak or even an exhaust restriction, I'm leaning more towards the over- run clutch

Eatadagofbicks (Score: 1): Will it do it if you rev it to 3000 in Park? Or only when driving it?

I would check all intake ducting before the throttle plate. 

Check for vacuum leaks

You could also temporarily block off the tailpipe while idling to cause pressure to build up in the exhaust and see if that whistle sounds happens."
1ofk5gx,"Car starts, runs for a minute or two, stalls and wont start until its sat for another couple of minutes.","1998 Holden VS Statesman Series ll 3.8L Ecotec V6

This problem started one day when i went to pull out of a parking lot and it started jerking forward in drive, luckily i was still able to drive home. The next day the problem persisted, this time stalling in park after the AC was left on for a while. The problem has now gotten to the point where it stalls even when not under load and stalls above idle rpms aswell. Have replaced the Idle Air Control valve and has not solved the issue. Right now im suspecting an issue with fuel delivery or maybe a crank angle sensor (though it stalls even when not hot) but I need some advice before i go out buying parts. 

I dont have any tools like fuel pressure gauges or multimeters to check fuel pressure or wire voltages. ",1,1761372493.0,2,mechanic,1761507151,2025-10-25 06:08:13,2025-10-26 19:32:31,"Fun_Push7168 (Score: 1): If the tach display is steady and not doing any jumping I'd suspect the DFI module.

That said there's not much anyone is gonna be able to really tell you without any diag tools."
1ofi5qr,HELP!! Is this PCV breather hose seated properly?,"I just replaced my air intake hose in my 2012 Honda Civic EX 1.8L and from every video I’ve watched it seems like they get that PCV in deeper but I just physically cannot put it in further. (I also fixed the clamp after I took this pic I know it wasn’t on right). My car has been cranking more/stalling after a few seconds. Sometimes it won’t catch at all. The air filter was extremely clogged I replaced it along with the intake hose bc there was a rip (which could’ve been from my partner yanking on the air filter box so I have no idea if it was there before the stalling or not). I cleaned the throttle body and EGR valve. I went to start it after all of this and now it stalls but with a thud so I’m hoping it’s just a result of the PCV not being fully seated. I took it to an auto repair shop before this and they replaced the Crankshaft sensor bc the check emission light has been on and off for over 2 years now. The code was P0335. I think this is a separate issue of the stalling but the check emission light is also still on after the sensor replacement, maybe it just takes time to clear? I had a diagnostic scanner put to it over 2 years ago when the light first came on and was told it was nothing to worry about, unless something has progressed. Auto repair shop couldn’t tell me what was wrong after the sensor replacement and then I had a mobile mechanic come look at it and he said he believed it was carbon buildup, clogged Cat, or maybe even needs a new O2 sensor. He said he heard the fuel pump as well. That’s what led me to the carbon cleaning and then intake hose replacement. Any advice would be appreciated. ",1,1761365451.0,3,mechanic,1761507151,2025-10-25 04:10:51,2025-10-26 19:32:31,"drmotoauto (Score: 1): Pcv looks like it will be OK. 
Have yiu had fuel pressure tested? Have you scanned it again recently?"
1ofhwn0,Truck is making weird noise,"Make and model: 2007 Ford F150 XLT triton 
Engine: 4.5 L V8 gasoline engine 

My truck has been making a strange noise that I can’t quite pinpoint. It sounds like it could be coming from either the belt or the radiator fan. I drove it about 2.5 hours last weekend to go camping, and near the end of the drive, I noticed the noise starting — though it was fairly quiet at that point.

Later that evening, when I started the truck again, the noise was noticeably louder. I checked the coolant level and found the reservoir completely empty. I accidentally refilled it with the coolant I use for my Honda, but I drained it right away, replaced it with the correct coolant, and bled the system properly.

After that, the noise did quiet down a bit. However, I’ve noticed that it’s still louder when I start the truck or when I turn left or right, and it’s not as bad when I’m driving straight.

Any help or assistance is appreciated! Please let me know if you need more information!
 ",1,1761364606.0,6,mechanic,1761507151,2025-10-25 03:56:46,2025-10-26 19:32:31,"RogerZero5OH (Score: 2): Take the belt off, see if it's still making that noise. Check the bearings on pulleys (doesn't sound like one, but maybe) or the water pump is shot. In my personal experience with an old F150, the alternator made a similar noise before it locked in place.

SkRThatOneDude (Score: 1): Sounds like a water pump bearing maybe. If your specific water pump has a weep hole, it's an early warning for pump failure."
1ofgezd,Question about fuel tanks and pumps,"I changed a fuel pump over a couple of weeks ago and have still been wondering what stops short circuits from happening inside and causing ignition/explosion.

The pump assembly has a wire going downwards that plugs directly into the pump, which sits surrounded by a plastic bubble, but is not entirely sealed from the bottom and the top is open. Kind of like a tall donut. There is a bucket shaped clip that holds up a rubber disc into the bottom of the pump base but the disc is not entirely round and would not stop fuel from coming up.

From this I'm just wondering if low level currented wire meeting with petrol fluid is not really a hazard, cause surely it's possible for fuel to slosh around a bit and have drops land in the top and go in the small 2mmx2mm squares of the plug where the wire connectors sit. Is this just not an issue? Let alone fuel rising up quickly from the bottom during incline driving, around the pump body and getting in where the wires are? It also seems that tanks have a mid-level-floor with a hole in it to reduce sloshing and also the pump sits partially down through the hole and relatively deep in the fuel. What if a few drops landed in multiple plug holts and 'connected' them, I would have thought that would definitely be a problem - or maybe just almost impossible to happen, a 1 in 500 million type incident.

One of those questions that probably has an obvious and assumed answer and not easily gettable from attempting to use search engines.",1,1761359747.0,7,mechanic,1761507151,2025-10-25 02:35:47,2025-10-26 19:32:31,"Joker741776 (Score: 1): The plugs usually have a rubber seal that helps assure alignment and keeps The actual contacts dry.

Icy_East_2162 (Score: 1): Vibration ,Moisture / water in fuel which causes corrosion,,MY OPINION these connections should be soldered and sealed with a water proof membrane ,resin or such"
1offd9o,Is this because of dirty carb?,"Took bike out for a run probably a week prior and seemed fine, came back a week later it was having problems turning on I finally got it to start and the rpm started dipping down and making a nasty noise, I thought maybe warm it up a little so I did, than it just started doing it constantly so I shut it off and put her away. I’m thinking it’s a very dirty air intake system mixed with a clogged up carb, is it this or could I have dug myself a hole with a bunch of problems.",3,1761356513.0,13,mechanic,1761507151,2025-10-25 01:41:53,2025-10-26 19:32:31,"Firm_Grapefruit_868 (Score: 3): It’s a Honda 2005 cbr600f4

NuclearHateLizard (Score: 3): Absolutely could be. How's the exhaust? Seem to be running excessively lean or rich?"
1offar6,Book time,"looking to see if anyone has a guess on book time to replace ONE wheel stud on a 2014 honda crv. thanks in advance
",2,1761356314.0,2,mechanic,1761507151,2025-10-25 01:38:34,2025-10-26 19:32:31,lFrylock (Score: 2): 0.5 max
1off7xh,Oem used car parts,Hi I have a 2005 ford mustang gt and I’m looking for a windshield motor replacement I saw it on a website https://oemusedautoparts1.com but wasn’t sure if it’s legit? Any recommendations or thoughts on anyone who’s bought from here before? Or should I just take my chances with eBay ,1,1761356077.0,3,mechanic,1761507151,2025-10-25 01:34:37,2025-10-26 19:32:31,nueroticalyme (Score: 1): Car-part.com gives you a list of most junkyards nationwide. You can search by vehicle and part.
1ofeb3z,2004 Honda Accord hiccups and has trouble code P0420,"Can anyone help me figure this out I live in CA where in order to register a vehicle you have to pass a smog test. I’m trying to see if it’s an easy fix or if I should get a mechanic to check out the car. Is it salvageable or should I scrap it? 
Apologies for the quality and shakiness of the video but I wanted to show what was happening",1,1761353317.0,2,mechanic,1761507151,2025-10-25 00:48:37,2025-10-26 19:32:31,GreenSorbet95 (Score: 1): Catalyst efficiency code. You need to take it to a mechanic to find out what's causing it
1ofdij8,95 Viper,This is the sending unit out a 95 viper that we are guessing still had the original factory gas in it. Car only has 55 miles on it and the fuel system is shot. Dropping the tank was sooo much fun. Why buy the car if your not going to enjoy or if your trying to keep its value then why not maintain it ?,10,1761350951.0,5,mechanic,1761507151,2025-10-25 00:09:11,2025-10-26 19:32:31,"MinorComprehension (Score: 2): ""it's more of an investment if it's original!"" taken to a bit of an extreme?  🤣

One thing I enjoy about being an automotive enthusiast is the stories that go along with vehicles. Memories, experiences, that sort of thing.

We also have our own reasons for what we do. One would assume that someone who had bought a vehicle 30 years ago for potential investment value would also have an understanding of general automotive mechanics, and would have done storage-prep activities like draining the gas or at least adding stabilizer, just keep a gallon or two in the tank, and drive it every so often.

I would guess there's more of a story here. Perhaps someone fell ill, perhaps got hidden in the midst of some angry divorce and never returned to, something like that. 

But I feel you, cars are meant to be driven!

IntroductionSalty229 (Score: 2): Actually he owns  a conglomerate of dealerships  and several different versions of this car (I think there are 6) 
I guess I would call him a collector, he has quite the collection from what I hear."
1og5x2k,"Damaged lift points on my 2010 Honda CR-V, how much do I expect to fix this?","Took my 2010 Honda CR-V to change tires, but the shop said the lift points are damaged and they can’t lift the car. The mechanic claimed fixing it could cost $3,000–$4,000 and suggested selling it instead since it’s old. Does that repair cost sound right?",0,1761435189.0,6,StupidCarQuestions,1761507151,2025-10-25 23:33:09,2025-10-26 19:32:31,"dmarve (Score: 2): Sounds like pure laziness to me

It takes no effort to put a jack under the diff or axle to jack it up enough to swap a tire

RedditBeginAgain (Score: 2): Just go to a different shop. It's not great that the lift points are crushed but nobody is going to fix them.

GundamArashi (Score: 2): Unless it’s rusted to the point of holes, anywhere on the pinch weld should be fine to lift it from when it’s the entire car. Naturally this is assuming whoever is doing the work places the lift pads so that everything is stable and balanced. If the factory points are lower/higher than the rest of the pinch weld they should have adapters that allow them to reach it without damaging other parts of the body. 

I’ve done it multiple times when someone has installed aftermarket stuff that blocks the factory points. My favorite is Transit vans with the goofy side step, there’s a couple of spots deeper in that are safe to lift from. Gotta get the tall adapters to not hit the body with the lift arms. 


For cost, they’re giving the “I don’t want to do it” price."
1ofw7jb,Hail Proof Car Cover,"Hey everyone,

I’m a high school student working on a project to redesign the classic car cover — specifically one that’s hailproof but also looks good. Most car covers today are just gray tarps that protect from dust or sun, but I’m trying to figure out if people actually care about how these things look or if it’s purely about function.

If you’ve got a minute, could you answer these quick questions?

What kind of car do you drive? (make/model/year)

Do you usually park outdoors or in a garage?

How much would style, design, or personalization influence whether you’d buy (or not buy) a car cover?

What price would feel fair or reasonable for a durable, hailproof car cover?

I’m trying to understand if there’s a real market for a car cover that not only protects your car from hail but actually looks good doing it. Any thoughts, honest opinions, or even rants are super helpful.

Thanks in advance!",1,1761410555.0,1,StupidCarQuestions,1761507151,2025-10-25 16:42:35,2025-10-26 19:32:31,MarcusAurelius0 (Score: 1): If you want to corner the market figure out how to offer a car cover that wont grind dust and grit into the paint so you dont have to wash the car before covering.
1ofrole,Brake Clean and Adjust Service,,1,1761399242.0,1,StupidCarQuestions,1761507151,2025-10-25 13:34:02,2025-10-26 19:32:31,Impressive_Assist219 (Score: 1): Never. We'll maybe if it's hardly driven it might be a good idea to lube a couple points but still no. Nevermind.
1ofkby3,Is Engine bay washing safe?,"This is my engine bay on a car I just recently bought, is it safe to get a engine bay washing from a detailer or is it not safe? (I’m new with cars so prob a stupid question)",56,1761373157.0,91,StupidCarQuestions,1761507151,2025-10-25 06:19:17,2025-10-26 19:32:31,"MrFastFox666 (Score: 27): Not stupid. If anything it's a bit of a can of worms, controversial topic. You'll get a ton of different responses.

In my experience, I've never had issues. I don't use a pressure washer tho, just a hose and engine degreaser, and some brushes. With that being said, it's been on relatively new cars under 10 years old, not sure how well an older car with old seals might hold up. 

Ultimately, cleaning an engine bay serves very little purpose, so it's up to you to decide if cleaning it is worth any potential risks.

D-Laz (Score: 7): Crisfix has a good video on how to do it.

DeanyyBoyy93 (Score: 5): Hey as long as you aren't putting a hose fullblast at your alternator, intake or battery you'll be fine. 


I use a degreaser and some brushes to agitate them rinse it off. Repeat in stubborn areas. 


There are benefits other than it looking nice. Its much nicer to work on a clean engine plus any leaks are easy to find and diagnose :) "
1ofhb3u,Real or Scam?,Trying to find these side skirts and grille but I’m pretty sure the only websites I can find are either scams or out of stock(I drive an 07) anybody know where I can find these in the exact same color,0,1761362633.0,5,StupidCarQuestions,1761507151,2025-10-25 03:23:53,2025-10-26 19:32:31,"noahbrooksofficial (Score: 2): Why would you want this regardless of if it’s real or not?

stelvy40 (Score: 2): F that grille. Side skirts could be useful, my rocker panels are starting to rust on my 08

mattrubano (Score: 1): just google the site.... I googled...  is 3dcarbon a legit website?  
[https://www.zoominfo.com/c/3dcarbon/196756018](https://www.zoominfo.com/c/3dcarbon/196756018)"
1ofgt44,Planning to buy a used car that's priced at $6500 and i also live in Texas. Im wondering how much with taxes and other fees is the final price gonna be?,For more context im buying the car from a used car dealership and in the website It doesn't say how much like the fees will be and stuff so im just trying to figure it out. ,0,1761361009.0,2,StupidCarQuestions,1761507151,2025-10-25 02:56:49,2025-10-26 19:32:31,"Cheeko914 (Score: 2): Just ask them. No one here can tell you.

TX-Pete (Score: 1): They’ll find a way to get another $1500 in there at least."
1ofex8n,Does anybody know what type of cord is this?,It was found in my glove box and according the manual should be an AUX connection. This car is a Mercedes-Benz B200 2011 if that helps. ,192,1761355171.0,336,StupidCarQuestions,1761507151,2025-10-25 01:19:31,2025-10-26 19:32:31,"bstr3k (Score: 288): Oh my god, we have reached that age where young people don’t know this connector….

It is the old style connector for the iPhone and iPods. It came out before lightning

midnight_to_midnight (Score: 45): I wonder how many things I own that are older than OP.

simpletransgirl (Score: 31): W..wait.. we've reached THAT age? Oh God.."
1og6bxi,Are these ebay parts fake?,"Seller claims original parts but this sticker is fishy, I’m trying to buy a throttle body from him, how do i know if is real? Can you guys help me? The first picture is just another product he has…

 ",1,1761436376.0,9,AskMechanics,1761507151,2025-10-25 23:52:56,2025-10-26 19:32:31,"BAKE440 (Score: 1): Google the part number on the box it doesn't come up to a throttle body.  I would also expect to see a toyota marking or casting on that part somewhere.  Looks kinda generic to me

https://preview.redd.it/quaj09ihocxf1.jpeg?width=1440&format=pjpg&auto=webp&s=8db26d93a3b2352019d0c714ef0a594132b942fd

RubiksCube9x9 (Score: 1): I found the listing, and I don't believe it's real. They are selling supposedly a new in box Toyota throttle body for $70 that Toyota themselves still sells on their parts website for $320 (on sale but MSRP is $442) currently. A genuine seller wouldn't lowball themselves that much. Additionally, they have a negative feedback saying they are a scammer. If it's too good to be true, it usually is.

If you want to save a bit of money just get the Aisin brand one off Rockauto. It's $220. Aisin is an OE supplier for Toyota anyways."
1og69zf,Car making terrible noise when starting up,"I replaced my starter because the old one was bad and this is the sound I hear when trying to start the car. The new starter is a Denso.

It’s a 2013 Honda Civic SI",1,1761436214.0,6,AskMechanics,1761507151,2025-10-25 23:50:14,2025-10-26 19:32:31,No_Assistant_9347 (Score: 1): Engine may have seized.
1og5rqm,2007 Chevy Impala 3.9 at 123k miles. How does it look?,,1,1761434771.0,6,AskMechanics,1761507151,2025-10-25 23:26:11,2025-10-26 19:32:31,"Ok_Taro5800 (Score: 2): Is this a single

Kumirkohr (Score: 1): Looks fantastic"
1og5inm,Replacing FUSES all at once,"so I own a 2006 Grand Jeep Cherokee Larado. I recently had to replace the fuse for the cigarette lighter. looking at the fuse box under the dash console, I found myself asking the question.. would it be good or bad to replace every fuse with a new one. is it a case of Don't fix it up it ain't broken? or would I possibly clean up some minor occasional electrical issues I have (nothing major). how about the fuses in the engine compartment?",1,1761434056.0,8,AskMechanics,1761507151,2025-10-25 23:14:16,2025-10-26 19:32:31,"WTFpe0ple (Score: 4): A fuse is nothing but a flat piece of wire that has been narrowed to a specification to only allow so much current thru it before it melts in to. So it either works or it's blown. There is no in-between

Predictable-Past-912 (Score: 5): [Hey! TP, leave them fuses alone!](https://youtu.be/bZwxTX2pWmw?si=mjWqeTxENfc2JHTe&t=174)

Really, they will be fine."
1og590y,Getting a pro inspection after DIY service,"will an independent mechanic be fine with doing a ""inspection only"" service if I perform the donkey work myself (oil change, rotors/pads, flushes,sparks,etc)?

My hope is that I can get an inspection invoice I can use to keep my service history legitimate, since I'd still be getting more difficult inspections done anyway (I.e suspension,etc)

I don't know if this is a common enough practice. Or if it would seem suspicious/strange to a pro.

Thanks",1,1761433290.0,5,AskMechanics,1761507151,2025-10-25 23:01:30,2025-10-26 19:32:31,"Ravenblack67 (Score: 3): Ask a shop and they will do exactly what you ask.

questfornewlearning (Score: 1): what are you talking about??"
1og5627,Spark Plug Coil Connector Tabs,"2006 Camry 2.4L 4cyl. Changed the plugs on the car. Realized after I was reinstalling the coil connectors that the locking tabs had broken off. Will this be a concern that I should get replaced asap? There’s the plastic engine cover that sits over the top of the connectors which I’m hoping applies just enough pressure to keep the connectors from slipping out. 

Any fixes besides having to cut and replace the connector itself?

1st pic - broken tab
2nd pic - ok tab
3rd pic - sad, lonely tabs",1,1761433071.0,2,AskMechanics,1761507151,2025-10-25 22:57:51,2025-10-26 19:32:31,"Sqweee173 (Score: 1): Use a zip tie to keep it in place. They can back out with engine vibration. Just replace the connectors,.they are cheap enough from the dealer"
