id,title,selftext,score,created_utc,num_comments,subreddit,scraping_time_utc,created_datetime_utc,scraping_datetime_utc,top_comments
1oqfzc1,What is happening here??,"2013 Ford explorer base 2wd .
Left a puddle under drivers side after sitting for half hour
No power steering fluid (electric)
Trans is full, no leaks.
Brake fluid full
No leaks or wet spots in engine bay, or underside.
Only in the passenger wheels wells. Mostly in the front. A bit in the back. Can't tell where this is coming from. Help meeeeee",3,1762475414.0,32,AskMechanics,1762630414,2025-11-07 00:30:14,2025-11-08 19:33:34,"Outrageous-Context78 (Score: 2): Did you check your coolant reservoir? Coolant hoses?

aahowehp (Score: 2): Windshield washer?"
1oqfn3r,URGENT: help with battery?,Trying to put an adapter for a nipple on a terminal that deems to be a screw in terminal. Is this legal? Will it work?,1,1762474534.0,4,AskMechanics,1762630414,2025-11-07 00:15:34,2025-11-08 19:33:34,"tomhalejr (Score: 3): You are trying to put a 26R in a vehicle that requires a 78. Not only a top post in place of a side terminal, but the polarity is wrong.

Next-Woodpecker-4745 (Score: 1): Legal? Yeah it will work. But there are better ways. They make terminal adapters that go from side post to top."
1oqfmel,Can be fixed or no ?,"Oil and coolant leaking out through here .  Can this be fixed and what is it ? 

In the video thAts waters . Just needed to see where it was leaking from ",1,1762474486.0,8,AskMechanics,1762630414,2025-11-07 00:14:46,2025-11-08 19:33:34,"a88mstanggt (Score: 2): Yes it can be fixed. The coolant is coming from the water outlet. Most likely it cracked because it’s plastic. If there’s oil there it’s either coming from the valve cover or just doing oil changes and not cleaning after because the filter housing is right there.

Lovergurl25 (Score: 1): 2016 Chevy Cruze limited . 150,000"
1oqfk9n,2019 Ford Fusion stuck jack,"I may be stupid but the middle part of the bolt to take out of the jack is stuck, maybe it’s too tight or there’s some other way, I don’t know
",1,1762474333.0,3,AskMechanics,1762630414,2025-11-07 00:12:13,2025-11-08 19:33:34,"NickRMX6 (Score: 2): DIYer advice: that nut is too stuck/tight to unscrew with your fingers? You could use a wrench on the nut, for added leverage. Or slip a screwdriver in there for leverage. Or tap the edges with a hammer. Or have you tried that? If so, put some penetrating oil on the threads.

acejavelin69 (Score: 2): Turn the wingnut off... if you can't get it loose, notice it looks like a nut at the base in the center, put a wrench on it. There is no ""trick"" until you can get it loose.  [https://www.youtube.com/watch?v=3RyU7yHv\_Rk](https://www.youtube.com/watch?v=3RyU7yHv_Rk)"
1oqfk2m,Need help on what the problem could be,"This typewriter sound started a bit ago and Im curious to see what it is before I take to a shop to get it checked out, to see how detrimental it is or not. I only hear the noise from inside. I have a Honda accord 2009 LX",1,1762474319.0,3,AskMechanics,1762630414,2025-11-07 00:11:59,2025-11-08 19:33:34,"TheSammySavage (Score: 1): One of your HVAC Actuators is most likely failing. Try switching from fresh air to recirculation. See if the noise changes or it doesn’t work. And do the same to the rest. Raise and lower your temperatures both driver and passenger separately an then lastly change your mode from floor, face, window, etc.  

You have one actuator that controls the fresh air inlet and recirc. Then you have a separate drivers and passengers temp mix motor. Then you have a mode motor.

Big-Mechanic-2112 (Score: 1): Door blend actuator"
1or6w1c,What should I do?,"2002 mustang GT. So I have a few questions. First off I’m pretty sure the automatic transmission is messing up too. Whenever I am around 35-55 mph, my car feels like it’s being stopped. Almost like when you don’t let out the clutch all the way when you’re taking off. It only does that when it’s in high rpm or I give it some gas. I took it in and otw my check engine light flashed for like a minute then was solid. I took it in and they said this at first. I let them get more time on the car and they said the purge valve and all 02 sensors needed to be replaced and it would be 1,692 before taxes. It doesn’t look hard to change those but I feel like there is more wrong with the car. Can anyone help me diagnose it from the description I gave plus the obd scan. Second question is, is it worth to fix up or should i just sell the car😭. I don’t wanna part ways but I don’t have the money to keep putting into this car. Please any advice or input is greatly appreciated.",4,1762550978.0,3,AutoMechanics,1762630414,2025-11-07 21:29:38,2025-11-08 19:33:34,"bspeadenn (Score: 1): Well it looks like you have a few issues. Not all of the O2 sensors need replaced necessarily unless they have proof I’m not seeing, you only have faults for 1. That sensor could also be the cause of the catalyst fault code. That’s a big COULD, as the catalyst fault code is the other bank of the engine. However I’m also seeing what appear to be ABS fault codes, which is an entirely separate problem. It’s just a lot of fault codes and it would very helpful to have the Freeze Frame data from each fault to see when they were last active / initially set. It looks like you have multiple issues in different systems to be honest.

None (Score: 0): [deleted]"
1oqxe3d,Orange drip,An orange-ish liquid dripping from car. Thought it was too orange to be oil but maybe I'm wrong. Anybody have ideas? ,2,1762529301.0,2,AutoMechanics,1762630414,2025-11-07 15:28:21,2025-11-08 19:33:34,"National_Repair227 (Score: 1): That looks like antifreeze have the cooling system checked ASAP so it doesn't overheat.

Icy_East_2162 (Score: 1): Might be coolant ,thoe it looks more like transmission fluid or Power steer fluid leak"
1orad8m,Anyone used Glenside Logistics Limited?,They're offering repossessed cars with low milage for low costs but ask for payment upfront. Red flag?,1,1762559569.0,2,CartalkUK,1762630414,2025-11-07 23:52:49,2025-11-08 19:33:34,"StarX2401 (Score: 2): It's a classic deposit scam, transport companies don't sell cars. They will ask you for a deposit then run off with the money, and there is nothing you can do to get the money back as the scammers are usually located in West Africa (Nigeria, Cameroon)"
1ora49p,Car update got new brakes and tires fitted today much more response,My previous discs were warped so there was shaking at 40+mph on braking this sorted it out professionally fitted ,10,1762558914.0,6,CartalkUK,1762630414,2025-11-07 23:41:54,2025-11-08 19:33:34,"wouldz (Score: 7): Nice to see someone not cheaping out on tyres.

wahballs88 (Score: 8): Tyres*

Friendly_Egg4174 (Score: 1): Good tires and good discs make all the difference"
1or9aax,Parkside tools for a DIY newbie?,"Went into Ye olde LIDL and got blindsided with the Parkside tools on offer. I grabbed an impact wrench for £50, 1/2"" drive torque wrench 40-210Nm for £15, bunch of screwdrivers and a cross wrench, which in hindsight I don't need with the impact wrench. 

Are these decent/accurate for the price or should I return and get something better? I have been buying tools in anticipation of buying a car. So far I've only bought Halfords advanced stuff as it's on offer. ",1,1762556804.0,12,CartalkUK,1762630414,2025-11-07 23:06:44,2025-11-08 19:33:34,"mentaljobbymonster (Score: 10): Buy cheap and then if you break it, buy expensive. You've proven that you use the tool enough to justify buying the expensive version. 

The only time I break this rule is if it's something that holds weight up, pressure in, fire away etc. Then you spend the cash the first time as there may not be a second time

FlyingFrogMan (Score: 3): I’d probably go with it now you’ve got it, I personally have dewalt cordless tools mostly, hand tools from Halfords but a lot of people swear by  milwaukee. It’s mostly the cost of the batteries for cordless tools that means people stick with one brand. The big brands are obviously more expensive.

Id always recommend a big socket set and a torque wrench from Halfords which will do 95% of the things you want and then extra tools will make things easier. You will need some specific things too (calliper rewind kits etc) If you’re into working on cars then its always useful to have some sacrificial tools which tend to be the ones you’ve just upgraded, screwdrivers for prying etc. generally the more tools the more options

SP4x (Score: 2): I've been very impressed with Parkside tools, used both power and hand tools extensively in two house renovations and numerous car jobs and they're still going.

I've got Snap-On, old-school Draper, Wera, Halfords Pro and the Parkside gear holds up well with the rest of the gang."
1or924b,Mad Paints colour match pens,"Hi guys, I'm looking to touch up some small dings & scuffs on a car I have just bought & Come across ""Mad Paints"" who offer colour matched touch up pens to your car based on registration.

Has anyone used these before & how good / accurate are their products?",3,1762556243.0,1,CartalkUK,1762630414,2025-11-07 22:57:23,2025-11-08 19:33:34,"OrdinaryAncient3573 (Score: 2): There are hundreds of places that can do paint mixing to match the paint code of your car. They'd have to be really incompetent to fuck it up. It'll never match exactly, though, since it'll be the original colour, not the slightly different colour your car has gone through exposure to sunlight."
1or8xtu,"Why have 4, when you can have 6",Never thought I’d see a 6x6 car in uk but this definitely surprised me. ,452,1762555948.0,141,CartalkUK,1762630414,2025-11-07 22:52:28,2025-11-08 19:33:34,"thedummyman (Score: 231): All that space in the back and they still need a roof box!!

Neat-Possibility6504 (Score: 116): Utterly pointless in the uk and I suspect actually harder to drive here... but it's pretty cool.

BigFluff_LittleFluff (Score: 36): My inner 6 year old loves it.

My adult brain goes ""God, think of the fuel consumption."""
1or8t04,insurance,"19 year old been driving for 6 months have a quotemehappy black box (worst one ever) looking at non black box quotes which are 50£ cheaper a month and as all my mates are at uni cant drive to any of them becuase with qmh black box u can only drive 6 trips a day for 1 hour, do i cancel it and change to a non black box policy?",0,1762555620.0,6,CartalkUK,1762630414,2025-11-07 22:47:00,2025-11-08 19:33:34,"Lewis-fsfs-offt (Score: 2): The way I look at it is what’s the point in having a car and maintaining it if you can’t use it to do what you want when you, that’s the whole point is freedom of transport when and where you want. I would personally cancel and get a different policy, specially if it ends up 50 cheaper a mo th that’s a good saving"
1or8n9u,Need advice PCP vs lease,"My 2010 X1 is nearing 200k miles and likely its end. I’m single, have a stable income and over £100k in savings. I prefer SUVs for the seating position and want features like a sunroof, head-up display, and a reliable engine. Should I buy, lease, or go for PCP/HP? Looking for SUV recommendations. ",0,1762555217.0,8,CartalkUK,1762630414,2025-11-07 22:40:17,2025-11-08 19:33:34,"CranberryCheese1997 (Score: 4): Given you said you have stable income and savings over £100k, it's fair to assume money isn't much of an issue.

Therefore I'd say it depends how often you want to change your car. If you want a new car every year or two, leasing will probably work out cheaper as new cars depreciate in value so quickly anyway. But if you're not gonna change cars often, then I'd say it comes down to whether you want the experience of a brand new car and take the financial hit, or buy a car that's almost new with only a few thousand miles on the clock but with a significant discount compared to brand new. I really don't see the point of financing the car if you can easily afford one outright. You're paying interest for 0 reasons. I'm no car or financial expert though, so take what I say with a pinch of salt.

Famous_Tie8714 (Score: 3): Are you confident you can make more money through investments than you would pay out in interest on a car finance agreement?  If not then why are you not just looking to pay cash?  Unless it's a 0% deal, taking finance when you don't need to is almost always just giving the bank money for no reason.

Wraithei (Score: 1): Based on savings, if you can afford to avoid PCP / Leasing I probably would.
If you're willing to use some of your money, I'd look at picking up something second hand near new as it would be a much better value, alternatively assuming you have a excellent credit rating I would suggest a personal loan over PCP or Leasing as the car would actually be yours.  Again would advise against buying new & if you are wanting something new, looking at models a year or 2 old as they'll be much better value.

I bought a brand new car on PCP about a decade ago and it became a mess, one of my worst financial decisions, granted I was in nowhere near as comfortable a position as you seem to be."
1or89nr,My bois. Codenames: Problem 1 and Problem 2,,1,1762554303.0,18,CartalkUK,1762630414,2025-11-07 22:25:03,2025-11-08 19:33:34,"Independent-Bed-4644 (Score: 1): Never a truer word spoken.

Flyawaymoss9747 (Score: 1): How is the fiesta a problem?

_Bluestar_Bus_Soton_ (Score: 1): Turbo Diesel 👍"
1or86dc,"A3, A4, Q3 or T roc golf? (Petrol, 1.4/1.5 engines)","Looking on getting a new car, budget is around 18k. (selling my car for around 5k/4k)

Want a car thats fun to drive, not too expensive on maintenance, safe & will also last me for another 10 years.
I have a baby on the way which i have to factor in.

going for 35k mileage & below.
Would like an 18+ plate.
Had my eyes set on the newer model A3 as I think it looks like a massive step up to the older before 2020 models.

currently drive a 12 plate fiesta, I was driving it on tiny country roads in the dark whilst on the way back from Alton Towers.
which made me realise it’s not ideal for road trips!
nearly crashed due to skidding in the rain too.
so those are a few reasons why i’d like an upgrade.

Would love to hear everyone opinions/facts on them all & compare them!

cheers",0,1762554075.0,10,CartalkUK,1762630414,2025-11-07 22:21:15,2025-11-08 19:33:34,"legonerd63 (Score: 5): Skidding in the rain is likely shit tyres.

BeardOfKratos1989 (Score: 2): I’d recommend skipping the A3 and Golf and opting for something with a larger boot. As a current Golf owner with two kids, I can say the pram takes up nearly all the space, leaving very little room for shopping or luggage. If you’re planning to keep the car for the next decade — and especially if your family might grow — the extra space will make a big difference.

cocoro-jp (Score: 1): At this budget, I would be looking into A4 or even A6 saloon (2.0 engine) from 2020."
1or81ln,What do you think about the post-facelift Mazda 3 (2012–2013) in terms of rust?,"Hey everyone,

I’m considering buying a post-facelift Mazda 3 (around 2012–2013) and wanted to hear real-world feedback about rust.

I know earlier Mazdas had issues with corrosion, especially in salty-road climates.  
How is the facelift version holding up?

* Did Mazda improve rust protection by then?
* Any specific areas to watch out for?
* If you own one, how bad is it after \~10+ years?

Would appreciate any experiences or advice!

Thanks!",1,1762553763.0,2,CartalkUK,1762630414,2025-11-07 22:16:03,2025-11-08 19:33:34,"LateToTheParty013 (Score: 1): Find some on autotrader and check mot historys for them if others dont give good answers

Apex999 (Score: 1): Wasn't that the new model rather than the facelift?"
1or7z25,Obd scanner,"Hi, I’m wondering if anyone can help, I am looking for a scanner to check fault codes.

Issue is my CCC is currently frozen and not working, but I’m wanting to get a reader that I can use on my phone. 

Does anyone have any suggestions I’m quite new to this so apologies ",1,1762553599.0,3,CartalkUK,1762630414,2025-11-07 22:13:19,2025-11-08 19:33:34,"rolledone (Score: 2): Autel ap200, approx 45/50 quid and highly recommend.

loosebolts (Score: 2): What car? By CCC I assume you’re talking BMW?

If so, BimmerLink is an amazing tool for BMW, pair it with a Bluetooth LE OBD reader such as the vgate icar and you’ll be laughing."
1or7it1,Is third party insurance in the wrong,"I had a no fault car accident, I went through the third party insurance and didn’t claim on my own policy. I only informed my insurance of the situation.

The third party provided a repair for my vehicle and a courtesy vehicle for me to use in the meantime until my vehicle is repaired.

The garage repairing my vehicle has called me and told me that the car is almost complete and want me to collect it however they are waiting on a passenger side mirror to arrive from Germany, this is estimated to take a month however there is no guarantee and they don’t know exactly how long it can take. I told them I don’t wish to collect the car until the repair is completed as I want it finished and I have a courtesy car to use.

The insurance company have now decided to terminate the courtesy vehicle because my car is roadworthy as the car has a mirror but it doesn’t fold as it did before the accident and they don’t want to pay for the courtesy due to the delayed part.

They said I have no choice and must return the courtesy vehicle and use my car. Is this true and do I have any rights to refuse this decision regarding this matter? I don’t want my car until it’s fully repaired especially because the accident is not my fault.",0,1762552506.0,11,CartalkUK,1762630414,2025-11-07 21:55:06,2025-11-08 19:33:34,"No_University4765 (Score: 5): Because it is roadworthy? 

My cars missing a trim on the rear bumper from and insurance claim , they’ll put your old (probably undamaged) mirror on the car and call it in

Get a grip

wouldz (Score: 4): People like the OP are one of the reasons why our insurance premiums are so high.

Continuing to use a courtesy car that costs hundreds of pounds a day because they don't want to wait for a mirror to arrive before driving their car again 🤣

Electronic_Laugh_760 (Score: 4): You will be using a very expensive courtesy vehicle for a month or longer. 

You have a duty to keep costs low."
1or78am,How worried should I be about corroded subframe on a 20yr old Jaguar?,"So I've been lusting over a Jaguar XK for a while now. Saw a clean one recently, low miles, bodywork and interior in reasonably good condition. However the rear subframe has significant amount of corrosion on it. 

The car has clean MOT history which never mentioned any issues regarding any bodywork corrosion. 

Now I get it a 20yr car will have a degree of steel corrosion but it is pretty flaky looking from a peek underneath the car.

Is this something that can be fixed with a bit of cleaning and rust protection or am I looking to factor in the cost of a new subframe here? Do they even make new subframes for these cars anymore? Should I walk away from a potential money pit or it's not too big a deal and can use it as a bargaining chip to lower the asking price?

Thanks for all the advice! ",1,1762551790.0,1,CartalkUK,1762630414,2025-11-07 21:43:10,2025-11-08 19:33:34,ciaoqueen (Score: 1): The reason there’s no corrosion elsewhere is because only the subframes are steel. Worth a closer look as if it’s only surface then you can apply something like Lanogard.
1or75fv,Engine oil top up,"I have my 2008 Renault Twingo 1.2 tce booked for a service in a couple of weeks and need to do about 500 miles until then.

My oil level has dipped the below the minimum so I want to top up enough to safely get me to the oil change.

The car was serviced by the previous owner and the invoice doesn’t say what type was used and the user manual offers a couple of recommendations from 10w40 to 0w30.

My question is if 0w30 was put in at the last service and I put a litre of 10w40 is that likely to cause an issue?

Thinking the wrong oil is better than no oil?",1,1762551600.0,1,CartalkUK,1762630414,2025-11-07 21:40:00,2025-11-08 19:33:34,"PurpWippleM3 (Score: 3): 500mi on the wrong oil is definitely preferable to 500mi with no oil.

I wouldn't worry too much personally. For a couple of weeks it should be fine."
1or6me7,Cheap Jag XJ £1500 Special!,"I posted this earlier but it got deleted for some reason. I picked this up earlier today. Cost me all of £1500. Just about 117k miles. Everything works! It’s been very well looked after with folders and folders of history and info from various clubs. New, original receipt in the history, £51k. That was back in 2003. It’s an amazing spec, tv screens in headrests, electric blinds, sat nav, heated seats all round, heated steering wheel. It’s also on air suspension. I said earlier it might be a mistake. Time will tell. I will try and keep it updated as I go on. Just filled with premium fuel, hoping it at least makes use of that tank! ",86,1762550351.0,45,CartalkUK,1762630414,2025-11-07 21:19:11,2025-11-08 19:33:34,"mcmillanuk (Score: 41): ‘Filled with premium’ is the optimism we want to see!

DeanyyBoyy93 (Score: 12): That is a fucking boat, the size of the thing🤣🤣


Hope it treats you well

SeaRoad4079 (Score: 9): Nice. You are now a member of the manly barge club. We will dispatch your driving gloves in the post."
1or6kfn,Lexus LFA trackday,Does anyone know of a Lexus LFA trackday / driving experience? I've always kept my eye open for one but had no luck. Anyone? UK,1,1762550219.0,1,CartalkUK,1762630414,2025-11-07 21:16:59,2025-11-08 19:33:34,hachi2JZ (Score: 3): Only 4 LFAs in the UK so I'd sincerely doubt it
1or6b9p,Advice please? Got a used car that passed MOT — turns out it shouldn’t have. Help!,"Hi everyone, I could use some advice.

I bought a second-hand Peugeot 2008 (2017 reg) back in June from a big dealership/garage. They gave me all the paperwork showing it had recently had an MOT and some work done.

A couple of months later (in August), I found out there actually wasn’t a valid MOT when I bought it. I took it back to the dealership, and they did an MOT on the spot. It felt a bit rushed, but I assumed (naively) that everything was fine — the car passed with no advisories.

Fast forward to this week (November) and I noticed the exhaust was hanging at a weird angle and the car was losing power during acceleration, so I took it back to the same garage. They sent me a video from under the car and I was shocked — the exhaust had completely snapped off because it was rusted through.

They’ve quoted me £800 for a replacement and repair.

I feel like the dealership should pay for this. Surely the rust would have been there back in August when they did the MOT — and even when they first sold me the car? It seems like they sold me a car and then passed its MOT knowing there was already a serious issue developing.

I’m quite new to driving and owning a car, so I’m not sure what my rights are in this situation.
Do I have a case to ask them to cover the cost of repairs?",0,1762549610.0,5,CartalkUK,1762630414,2025-11-07 21:06:50,2025-11-08 19:33:34,"LeaderOk5438 (Score: 4): £800 to replace an exhaust / fix a bracket? 

Someone’s having your pants down 😅

OrdinaryAncient3573 (Score: 1): Yes.

[https://www.citizensadvice.org.uk/consumer/buying-or-repairing-a-car/problems-with-a-used-car/](https://www.citizensadvice.org.uk/consumer/buying-or-repairing-a-car/problems-with-a-used-car/)

Independent-Bed-4644 (Score: 1): The exhaust could have been covered up behind the shields, You look under most cars now and you can’t see shit. MOT tester is not allowed to remove anything on the test. They should however put it right for you. They have to prove it was ok when they sold it, they put the mot on it and they would say that proves it was ok when it left. As they wouldn’t pass it if it was a fail, they wouldn’t drop themselves in it. Hard to prove, they could say you’ve gone at speed over a speed bump and caught it. If you are getting no where with them don’t pay £800 to fix it, take it elsewhere."
1or621n,I got smoked by a tdi ka (literally),Fair play to this bloke. A first gen Ka with what I assume is a tdi swap (why would you swap it with any other diesel ffs). Got a good mouthful of exhaust soot from the lights and the thing did move a bit. Never seen a build like it so I’ve got nothing but respect even as a diesel hater. ,0,1762549027.0,7,CartalkUK,1762630414,2025-11-07 20:57:07,2025-11-08 19:33:34,"Plumb121 (Score: 2): I had a MK2 Caddy and did the AHU swap. Had it mapped as well and smoked pretty much most things off the lights as long as it was dry.

davus_maximus (Score: 1): You think someone out a VAG TDI in a Ford Ka?

No way. Maybe a Fiat JTD. Far superior engine!"
1or4ncv,Lost on Choices,"Hi everyone, first post. Currently have a Peugeot 208 and had it over a year now as my first car. Want to upgrade to a small suv but I’ve got too many options in my head I can’t seem to choose.

Also I don’t know if staying at a 1L suv like a TDI or TSI would be ideal or going to a 1.2/1.4

My current options are:
Audi Q2
Kia Stonic
Hyundai Kona
Mg ZS
Peugeot 2008
SEAT Arona
Toyota CHR
Volkswagen TRoc

Even considered a Q3 and a CX-3 at some point
",2,1762545718.0,2,CartalkUK,1762630414,2025-11-07 20:01:58,2025-11-08 19:33:34,jooosh8696 (Score: 1): What do you need it for/budget?
1or4ewn,Driving Test Mistake,,0,1762545199.0,2,CartalkUK,1762630414,2025-11-07 19:53:19,2025-11-08 19:33:34,OkAcanthaceae3476 (Score: 4): AI slop has now reached the driver training sector.
