id,title,selftext,score,created_utc,num_comments,subreddit,scraping_time_utc,created_datetime_utc,scraping_datetime_utc,top_comments
1oraj1p,Turned on my truck without closing the oil cap.,"I was changing my oil on my 05 ranger and after I finished I turned on the car for about 3 minutes before I realized I hadn’t closed the oil cap. None of the oil spit out but there was a smell in the air of burned oil, it wasn’t overwhelming but it was noticiable.
I havent ran the car in the road yet.
How bad is this mistake? ",0,1762559997.0,17,MechanicAdvice,1762630414,2025-11-07 23:59:57,2025-11-08 19:33:34,"cormack_gv (Score: 21): Put the cap on.  No harm done.

Repulsive_Fly5174 (Score: 6): Probably just a little splash that hit the exhaust manifold. Put the cap on and send it."
1oracr9,Buick Lucerne Starting problems,"I've been having problems starting my car recently. It's a 2011 Buick Lucerne with a 3.9L V6 engine. I recently replaced both the battery and alternator, and it ran fine for a couple weeks. Now it's not starting the first time I turn the key whenever I try to start the car, but has been consistently starting the second time I turn it. It does this whether the engine is hot or cold and I'm worried it will get worse. Does anyone know what this could be?",1,1762559535.0,4,MechanicAdvice,1762630414,2025-11-07 23:52:15,2025-11-08 19:33:34,Equal-Fee5757 (Score: 1): Could be hitting a dead spot in the starter itself. Second time you try it is making a good enough connection.
1oracj0,Axle Repair Advice,"I went to go for a car servicing basically just an oil change and then they called me to upsale on things like windshield wipers, cabin filter, etc. and then they mentioned that I needed my CV axle replaced and I'll need an alignment I was a little weary because I haven't noticed any signs driving. After parts and labor I was quoted just a little over $1000. I inspected my self and didn't see anything the only think I saw was grease coming from the sway bay link. What do y'all think about the condition of this? And what's the work involved.

2017 Lexus ES 350",1,1762559517.0,5,MechanicAdvice,1762630414,2025-11-07 23:51:57,2025-11-08 19:33:34,"x_ceej (Score: 2): If you didn’t see anything, just replace the link.

None (Score: 1): [deleted]"
1ora9ul,Broke mounting bolt on camshaft sensors just the head threads sticking out,I’m moving to California in 2 weeks and on a really tight budget and need to drive this car there accident broke the heads of the bolts of the camshaft will jb weld work to keep it installed until I get to California and get it fixed,1,1762559323.0,3,MechanicAdvice,1762630414,2025-11-07 23:48:43,2025-11-08 19:33:34,Sophias_dad (Score: 1): Take the sensor back off and use vice grips to grab the remains of the bolt and back it out. Get new bolt.
1ora675,Why is my engine smoking??,D,2,1762559054.0,9,MechanicAdvice,1762630414,2025-11-07 23:44:14,2025-11-08 19:33:34,"PrimaryAgreeable8103 (Score: 3): Depends on the smell. Most likely valve cover gasket gone bad causing oil leak

Heavenxhill (Score: 2): If that is a chevy cruze i just worked on one similar to that, it was smoking right there behind the heat shield, apparently it was the oil cooler leaking

Edit; looking back on photos the one i worked on was not the same as this one. But still worth looking into.
I would take the heat shield off after it cools down to see if i can see any leaks"
1ora4zh,2015 Kia Soul timing belt jumped,"Bought a used Kia Soul a few months ago and the engine recently stalled on the highway. Had towed to a mechanic who told me the timing belt jumped but they weren't sure about the internal damage. They sent it to a dealership mechanic who will perform a diagnostic on it. They said there was an oil leak, which probably caused it to break down.

The engine turns over and reaches about 2,000 rpm before entering limp mode.",1,1762558967.0,2,MechanicAdvice,1762630414,2025-11-07 23:42:47,2025-11-08 19:33:34,Mcmikemc1 (Score: 2): It was sent to the dealership mechanic for a diag? You’ll just need to wait and see the results at this point
1ora4vs,Oil change or Flush,"2006 4cyl Toyota RAV4 150k

Engine oil dirty 500 miles after last oil change. Should I just change it again or should I consider an engine flush? ",1,1762558959.0,2,MechanicAdvice,1762630414,2025-11-07 23:42:39,2025-11-08 19:33:34,"cormack_gv (Score: 1): How do you determine that it is ""dirty""?  Suggest you ignore that."
1or9sqx,Tightest bolt ever. Breaker bar not working,Which way to twist?  Front passenger,501,1762558076.0,378,MechanicAdvice,1762630414,2025-11-07 23:27:56,2025-11-08 19:33:34,"orangutanDOTorg (Score: 379): Any bolt that has been on a long time and especially if it’s seen heat or weather cycles and is not coming off with reasonable force you want to break with pulses, either with an impact or you can use a ratchet and just keep thumping it hard with your palm. If it’s rusty or full of junk you can use penetrating oil or rust eater but you still want pulses. Just using a longer lever like Archimedes and your next post will be asking how to extract a broken bolt. We should make a sticky about this. It’s probably the most posted thing I see between the how to and how to fix.

Maleficent-Fix4750 (Score: 254): Bolt is rusted into the knuckle.  A 1/2” impact gun might get it loose."
1or9ols,Car making hissing sound from below.,"Hello, I am experiencing a problem with my car Opel Corsa 2007 1.3 cdti diesel. Here are the details:

* When I turn on the engine, I hear a strong hissing sound coming below the car. The hissing sound remains only when the engine is running. If the engine is turned off, then the hissing sound also goes away.
* When I press the brake pedal, I hear an air-leak type noise and the brake pedal feel a bit hard. Not smooth as before.
* The car does not accelerate and feels weak. The brake distance is also longer.

It seems like there may be a vacuum leak or an issue with the brake booster, but I would like to hear everyone’s thoughts and opinions about it.",1,1762557794.0,5,MechanicAdvice,1762630414,2025-11-07 23:23:14,2025-11-08 19:33:34,"Sophias_dad (Score: 1): There's a vacuum leak. Either the hose to the brake booster has failed/disconnected or the booster itself has a leak.

The hissing sound is air being let into the intake manifold in an uncontrolled manner. The fuel injection system doesn't know about this excess air, so the engine is running super lean, leading to poor performance. Chances are good that the excess air is actually only getting to a few cylinders, or the engine might not run at all."
1or9lqo,No heat in 1999 civic - what else could it be?,,1,1762557589.0,1,MechanicAdvice,1762630414,2025-11-07 23:19:49,2025-11-08 19:33:34,"balsa61 (Score: 1): Check your coolant level and make sure that it's getting to your heat exchanger. 

If that's okay, then the heater core may be the problem."
1or9fuz,1993 Mercedes 600Sl won’t start after battery replacement,"Hey all,

Last sunday i started and drove around my 1993 Sl600 with basically no issues. On thursday i tried to start it and the battery was completly dead, and wouldn’t hold a charge. After i replaced the battery everything seemed fine, all lights turned on, i could hear the fuel pump priming, but when i turned the engine over it just wouldn’t start. I suspect there to be no spark, but the only thing I have checked so far are the fuses.

Has anyone else had an issue like this or any advice?",1,1762557181.0,5,MechanicAdvice,1762630414,2025-11-07 23:13:01,2025-11-08 19:33:34,"CreasyBearl (Score: 0): Its a Mercedes,its designed to leave you stranded."
1or9fs3,Should I drive if my car has bad wheel bearing?,"So my car has been really loud these last few days, and from what I gathered it seems to fit the description of a bad wheel bearing (I’m not a mechanic but I think that’s what it is, I can describe the noise if anyone is curious). 

I only have my appointment with the garage on Wednesday. I can walk to work this weekend but I have university Monday Tuesday and I have to drive 100miles (150km) each day. Would I be able to drive if I kept a reasonable speed and try to drive gently (if it makes any difference) ?

Let me know what you guys think, thanks 
Edit: just realised make of the car is needed, it’s a fabia Skoda from 2019",1,1762557175.0,8,MechanicAdvice,1762630414,2025-11-07 23:12:55,2025-11-08 19:33:34,"Balls_of_satan (Score: 4): If it’s as bad as it makes that much noise then no, you should not drive it. The same thing that makes noise makes heat. If driving 150km it will definitely fail in the middle of the road with more things broken than before. It will probably be cheaper to get a taxi.

blindpilot02 (Score: 3): Separation of the wheel bearing can happen at any time. When you hear noise from the bearing that means it’s generating lots of friction heat too. The tire can fall off, you lose steering and crash."
1or9cfr,Does this spark plug looks burnt??,,2,1762556952.0,31,MechanicAdvice,1762630414,2025-11-07 23:09:12,2025-11-08 19:33:34,"ThanksALotBud (Score: 41): Looks nearly brand new

kenmohler (Score: 17): It looks new."
1or9cb3,What’s going on with my car. this noise gets really bad when i go over 40?,"i know i have an oil leak, and my heat shield is knocked loose. i’m worried i need to take it in. ",1,1762556941.0,8,MechanicAdvice,1762630414,2025-11-07 23:09:01,2025-11-08 19:33:34,"Rednex04 (Score: 1): Wheel bearing?

Tough-Dot4997 (Score: 1): Its a 2004 subaru outback"
1or99jg,is my engine salvageable?,"i have a b18b1 that i bought from my younger brother who overheated the engine and his mobile mechanic said that one of the head bolt threads had a heli coil that failed. 

Questions:

Should and can i remove the block & head and take it to a machine shop to fix ?

or

Should i try to find another b18b1 for an over all swap?

I appreciate any help at all! thanks.  ",8,1762556753.0,12,MechanicAdvice,1762630414,2025-11-07 23:05:53,2025-11-08 19:33:34,"semianondom101 (Score: 11): A block and head built by a GOOD machine shop will always be better than a used motor. If you've got the money and will, get it repaired. There will never be more of these motors than there are now.

VegetableAd4016 (Score: 4): I would at least look for another engine, in the mean time you could compression test, pressure test and pull the head"
1or95xs,Rusted fuel line,2005 impala. Fuel filter is clearly original and should be replaced. What should I expect doing this job?,1,1762556505.0,5,MechanicAdvice,1762630414,2025-11-07 23:01:45,2025-11-08 19:33:34,"waynep712222 (Score: 2): soak in WD40 for several hours..

 2 wrenches .. one on the nut on the filter and a flare nut wrench on the tube nut.  flare nut wrenches have 5 flats.. 2 partial flats.. 

 if you have a autozone nearby.. ask for GP Sorensen 800-9214 and 800-9215. those are like 6 bucks a box..  i never recall which is the larger size.  the boxes contain bag of 10 orings the proper size for fuel hose connections on GM fuel injected cars."
1or8xcd,How to disable seatbelt chime w205?,,1,1762555914.0,2,MechanicAdvice,1762630414,2025-11-07 22:51:54,2025-11-08 19:33:34,balsa61 (Score: 0): Simple - put on your seatbelt!
1or8w75,2013 G37 Transmission Issues,"I have a 2013 Infiniti G37 coupe that has 135k miles on. I have owned it since 79k miles. The transmission recently started shifting at irregular times and it shifts longer and rougher. There is also a mild lag in acceleration. I just had the thermostat and a cracked coolant hose replaced a few weeks ago but I doubt that is related.

I have heard very conflicting opinions on whether or not I should get a transmission flush, especially since there is no easy way to check the fluid without pulling the plug. I have no idea if the car has ever had one prior to my ownership, all I know is that I haven’t changed the fluid. 

Should I get a transmission flush or what should I do?

Thanks in advance.",1,1762555837.0,4,MechanicAdvice,1762630414,2025-11-07 22:50:37,2025-11-08 19:33:34,txcancmi (Score: 2): Drain and refill the ATF. Do not perform any type of flush. Replace the transmission filter if it is a serviceable item. Repeat every \~25k miles.
1or8uc6,confused,"Got this car for dirt cheap because owner wanted an excuse to upgrade car. Wheel is tilted after a previous accident it looks like camber lol. I took the wheel off and everything looked decent so i torqued the wheels back down and it looked straight again, but after a drive around the block it was back to being slanted. Is it maybe the hub? the control arm and other stuff looked fine i’m just confused. ",1,1762555711.0,5,MechanicAdvice,1762630414,2025-11-07 22:48:31,2025-11-08 19:33:34,"Tesex01 (Score: 2): Did you drive it? Maybe it just have absurd runout? Either way. It happens under load. So grab some long enough pry bard and put some load on stuff. Should give you rough idea what is loose

txcancmi (Score: 1): Checking alignment by eye is generally worthless. Take it to a shop and have them do a four wheel alignment check. You may have worn suspension parts, which can be found by trying to move things, sometimes aided by a pry bar for leverage."
1or8ry0,Is this a new muffler?,"26) Rem/Repl Muffler & pipe w/o chrome tip $497.57 OE 
27) Muffler & pipe gasket $46.56 OE
28) Converter & pipe rear bolt $6.56 OE
29) Converter & pipe spring rear $14.60 OE

Are the specifics on the estimate. 
Before and after pics attached.
The new muffler is super brown even more so than the old one with the bent tip.
",0,1762555545.0,24,MechanicAdvice,1762630414,2025-11-07 22:45:45,2025-11-08 19:33:34,"XxWh1teFoXx45 (Score: 3): Its brown from them welding on it. It is a new muffler.

ecleptik (Score: 2): It's new...parts can sit in a warehouse for years and still be considered ""new"". Humidity alone can rust raw metal...its going to be ok.

 There is nothing to be worried about. It's ""rusting"" in that area first because the area around the weld is considered the heat affected zone, which alters the composition of the metal some and will begin rusting first. It's more discolored from the heat than it is rust, I don't really see any rust"
1or8hl7,"Stalling mid turns, breaking and idle, rpms going insane","I have a 2000 Jaguar S-Type 3.0L V6 Duratec engine, it’s my first car I ever bought and recently it’s been having the issue of just turning off whenever I break for too long at a stop light or whenever I slow down to make a turn, it has 81,000 miles on it so I don’t suspect it’s the engine itself.",1,1762554836.0,3,MechanicAdvice,1762630414,2025-11-07 22:33:56,2025-11-08 19:33:34,"volgarixon (Score: 2): (Total guess) Could be some sort of vac leak, failing airflow sensor or similar, but problems when turning makes it sound like power steering or related pulleys make it have power loss, maybe failing item in the belt driven set, more details needed. Could also be bad fuel, water in the diesel?"
1or8fy9,Stalling mid turn whenever breaking and rpm’s going crazy,"I have a Jaguar S-Type 3.0L V6 Duratec engine, it’s my first car I ever bought and recently it’s been having the issue of just turning off whenever I break for too long at a stop light or whenever I slow down to make a turn, it has 81,000 miles on it so I don’t suspect it’s the engine itself.",0,1762554728.0,6,MechanicAdvice,1762630414,2025-11-07 22:32:08,2025-11-08 19:33:34,"Slvrdgr (Score: 2): Lol if you got jag money, take it to a shop qualified to work on it and take care of it right. These are not that cars to cheap out on and try to DIY."
1or8e6x,What's the best way to get my '76 G10 Van rekeyed?,"I had the keys to my old boogie van (1976 Chevy G10) stolen a month or so ago. The ignition key, door key and gas cap key were all on the one ring and I (like an idiot) never had a second set made after I inherited it. 

I've contacted so many locksmiths in town, and almost no one does automotive. Especially something that old. So far I've only found one place, and he's been too busy to help me out.

Anyone have suggestions? Would it make more sense to have it towed somewhere and have the ignition replaced/doors re-keyed? Would a regular mechanic shop be able to help me with this, or should I look for someone who specializes in classic cars? Or am I better off focussing on the locksmith route?

Any help would be HUGELY appreciated. I'm at my wit's end.",4,1762554612.0,2,MechanicAdvice,1762630414,2025-11-07 22:30:12,2025-11-08 19:33:34,"waynep712222 (Score: 2): 76 models could have a dashboard ignition lock cylinder or a steering column lock cylinder.. 

 without a key.. i would rather be doing the steering column lock cylinder.. you have to pull the steering wheel, the steering lock plate.. slide the turn signal switch upward to get at the hidden slot to push the toe nail shaped clip to release the ignition lock cylinder.. 

 the dash mounted ignition switch kinda requires that the ignition lock cylinder and the ignition switch be replaced..

 https://www.rockauto.com/en/catalog/chevrolet,1976,g10,5.7l+350cid+v8,1043334,ignition,ignition+lock+cylinder,10041

 the front doors use a short tail piece lock...  the side and rear doors use a long ...https://www.rockauto.com/en/catalog/chevrolet,1976,g10,5.7l+350cid+v8,1043334,body+&+lamp+assembly,door+lock+cylinder,10007

 so now you have 3 different keys.. 

 most auto repair shops can do the ignition and front door lock swap.. 

 there are 3 way marine brass fuel control valves that can be installed.. this is an expensive one i have seen them for less.

 https://www.westmarine.com/moeller-3-8inch-fnpt-3-way-fuel-valve-brass-9398926.html.  this can be installed thru the floor under or behind the front seat..  cutting off fuel supply to the engine. and nobody knows its there unless you tell them.. 

  are you in los angeles ca.."
1or8bxk,Is it ready for a replacement?,"Came off of a 2007 Subaru Outback 5MT.  New they call for .325, needs replaced is .275, currently at .302. It looks close to the rivets though, should I be worried about this? ",17,1762554455.0,56,MechanicAdvice,1762630414,2025-11-07 22:27:35,2025-11-08 19:33:34,"FK_Tyranny (Score: 158): Considering you have it removed, you might as well replace it now, no matter what its measurements are.

insincereengineer76 (Score: 25): I mean a new clutch is about $200. I'd say it's a small enough investment to just do it anyway if you have it off"
1or7zy7,Replaced water pump now im overheating and not getting hot air,,1,1762553656.0,3,MechanicAdvice,1762630414,2025-11-07 22:14:16,2025-11-08 19:33:34,"kickassjay (Score: 1): Sounds like a airlock

Chopninja (Score: 1): Need to bleed the air out the coolant lines better, park on an incline and do it. If that doesn’t work might have to  have a shop do it."
1or7yj2,CV Axle Leaking?,,1,1762553564.0,3,MechanicAdvice,1762630414,2025-11-07 22:12:44,2025-11-08 19:33:34,"A925D (Score: 1): Yeah the CV axle boot is torn.

Sophias_dad (Score: 1): Yep... definitely CV boot failure. Its potentially DIY, but check the youtubes for the method and see if its looking like something you can do. Its definitely on the advanced-end of DIY, due to the axle nut and potential level of suspension disassembly.

Replace the entire axle(but not the intermediate shaft), don't try to save money just doing the boot. You don't know how long its been running with water/dirt/no-grease in it."
1or7s30,Help with battery,Recently switched out my battery and replaced it with a new one. Problem is everything is connected but i am not getting any power. Car was working perfectly fine until I swapped out battery. Only thing i can think of it is I lost a bolt but i replaced with one I had laying around and fit perfectly but yet no power. Thanks for help in advance !,3,1762553119.0,11,MechanicAdvice,1762630414,2025-11-07 22:05:19,2025-11-08 19:33:34,"peequi (Score: 2): Do you have a multimeter? If not see if you can borrow one from a neighbor.

Radiant_Street_5448 (Score: 2): Terminals tight too? if you can see your starter easily look for a melted exposed wire thats your solenoid connection."
1or7pe3,"Toronto mechanic tells me it’s CAD$4-5,000 to repair before this can be safety’d. Should I get a second opinion?","TORONTO ONTARIO
I’ve received this through the AutoServer App Report. 
I don’t have any other report or certificate number. 
Just the invoice. 
Yes I’ve been reading the MTO pdf on safety inspection standards ( : 
",1,1762552940.0,25,MechanicAdvice,1762630414,2025-11-07 22:02:20,2025-11-08 19:33:34,"KingArthur_III (Score: 18): This thing is a rolling death trap. For you AND everyone else. It would be one thing if it was minor rust damage, but that is NOT minor. I dont think a second opinion at another shop would be any different. Fix it properly, or scrap it.

JohnnyRC_007 (Score: 6): The rust is pretty bad."
1or7nal,I think my mechanic mistakenly gave me a battery that doesn’t fit my Subaru’s start/stop function requirements.,"I have a 2022 crosstrek with the auto start stop function. When I got my oil change, my mechanic tested my battery and said it was running at 200/600 and recommended that I change my battery at the next appointment. 

So I called and made an appointment, did some reading on the type of battery it should have, and I let them know to put an AGM or EGM in it because of the start stop, I figured they would already know that but I called to give them a heads up just in case they had to order a special one. 

As I was paying, I noticed on my bill that they gave me “Diehard Silver”. I looked it up when I got home, and it said it wasn’t recommended for my start stop function. At the shop, twice I asked if the battery I was getting was a good fit for my car. So that’s why I’m thinking maybe they accidentally gave me the wrong one. It’s a diehard silver lead-acid with a two year warranty and it was $315 for everything labour included. (Canada)

They are closed over the weekend but should I call Monday and ask for them to change it out? I’m hoping I didn’t get someone else’s battery by mistake. 

Am I ok to drive it this weekend? Will it hurt anything? If I call and they say it’s fine for my start/stop function, should I buy a different battery anyway or is it not a huge deal?",1,1762552808.0,21,MechanicAdvice,1762630414,2025-11-07 22:00:08,2025-11-08 19:33:34,"brinx182 (Score: 3): Call then and let them know that it should have an agm for start/stop functions. Agm's are a bit more expensive, but they should be willing to change it out for an agm without issue if you pay the difference.
Running a flooded lead acid instead shouldn't be problematic and won't cause damage, but the charging system is designed around am agm's specific needs, and a flooded lead acid battery won't last as long

RickMN (Score: 2): Yeah, if you had an AGM or EFB, you have to replace it with same. Running a flooded battery in a car built for AGM or EFB will cause the flooded battery to fail within 6 months. AGM batteries require a different charging protocol that charges the battery at a lower voltage. That will cause your flooded battery to be constantly discharged and overworked."
