id,title,selftext,score,created_utc,num_comments,subreddit,scraping_time_utc,created_datetime_utc,scraping_datetime_utc,top_comments
1mzb2p2,What are my options with this alternator?,"The vehicle is a ‘99 (90s body) GM Yukon SLT with a 5.7L vortec engine. The past week or so when starting the engine it was a bit hesitant but started up, until yesterday when it died on me while out running errands. Got it jumped, went to an O’Reillys and they scanned the alternator and battery (pictures included) and determined the alternator has a bad voltage regulator and has been messing up the battery as well. I pulled the alternator (a Delphi Automotive Systems) and found a part number (15750871N 130A I believe, also pictured) and I’m thinking it might be the original one(?). This car also has under 200K miles FTR, and it previously had a second auxiliary car battery hooked up to it in the bay that ran extra grill guard lights while turned off, but that was removed many years ago. 

My primary question is should I look at getting the current Delphi alternator rebuilt locally and reinstall it, or would it be better to buy a new or remanned alternator? And if I should buy one instead, what places do y’all recommend and what brands do y’all recommend for this vehicle/engine? I’ve been reading about O’Reillys $179 Ultima but am not finding good reviews on it. The Delphi I haven’t found a lot on but people seem to consider it reliable. I am also on a bit of a budget here. 

(Second to last picture is alternator test, and last picture is battery test.)",1,1756078478.0,1,MechanicAdvice,1756150330,2025-08-24 23:34:38,2025-08-25 19:32:10,"abroadreachtravel (Score: 1): I have had good luck with local rebuilders.   They tend to use better quality parts.   Most places will clean it up, replace what’s broken / worn and send you on your way.  

Parts store alternators are hit or miss."
1mzblqj,Can’t seem to find a protective sleeve for this particular lug nut key.,"Hex Size: 3/4"" & 13/16"" Dual Hex 6 splines. Would love if someone can refer me to a link. This particular lug nut key scratches my rims pretty bad sometimes. ",0,1756079899.0,3,MechanicAdvice,1756150330,2025-08-24 23:58:19,2025-08-25 19:32:10,"Budpalumbo (Score: 1): Wrap it with tape.

Those are the thinnest lug sockets I've used.  If you're scratching a wheel you need to be more patient.

nawfy85 (Score: 1): I thought about using heat shrink on mine

Traditional-Day-7698 (Score: 1): heat shrink"
1mzbk5m,What locks do i need to order?,,1,1756079777.0,2,MechanicAdvice,1756150330,2025-08-24 23:56:17,2025-08-25 19:32:10,lilbarky (Score: 1): Off of a 2009 silverado 1500 reg cab
1mzbj6r,"2001 Pt Cruiser, what’s wrong and how do I fix this??",The car bubbles when I turn it off and today the check engine light came on. It got loud and when I accelerate the RPMs go up. The check engine light code was p0700. What’s wrong and how do I fix this?? I need my car to get to work. ,1,1756079703.0,4,MechanicAdvice,1756150330,2025-08-24 23:55:03,2025-08-25 19:32:10,"BaekReddit (Score: 1): That code is a nonspecific transmission code. So would need more looking into. Probably need a shop scanner to see the codes in the TCM, it is just letting you know that there is a problem in the transmission to set the CEL. As for the bubbling I'm not sure. Definitely want to replace that boot but only bubbling I've heard from a car was the coolant/ water boiling when too hot.

Gunk_Olgidar (Score: 1): Replace that torn rubber intake hose, clear codes.  Retest.

P0700 is a general transmission control issue (TCU error).  Separate issue from the torn intake hose."
1mzbeaq,Weird sound when a/c is on but goes away when clutch is pressed,Help,1,1756079343.0,5,MechanicAdvice,1756150330,2025-08-24 23:49:03,2025-08-25 19:32:10,"DayHot2168 (Score: 1): NB Miata?

Hit the clutch fork arm where it meets the slave cylinder push rod with some grease.

My NA did this too. 

I have also randomly heard this sound despite the AC being new and chose to ignore it. Hasn't been back as of recently. Sometimes these cars make noises."
1mzba84,"Cost of a transmission swap, roughly?","How much would a reasonable price be to swap a rebuilt trans out with the old trans. I have a 2011 Toyota Tacoma automatic, 4×4 2.7 liter. Just trying to get a good idea on how much more I need to save
",1,1756079044.0,6,MechanicAdvice,1756150330,2025-08-24 23:44:04,2025-08-25 19:32:10,"Ok-Scratch727 (Score: 1): $800

Ravenblack67 (Score: 1): I would call a transmission shop and get a quote."
1mzb7ul,How would you?,How would you go about fixing these codes yourself? 2013 Camry,1,1756078865.0,2,MechanicAdvice,1756150330,2025-08-24 23:41:05,2025-08-25 19:32:10,"dxrey65 (Score: 1): For the first one I'd pull the purge valve and bench test it; disconnected they should be sealed so you see if you can blow through it, and if you can it's no good. Also check the seal on the fuel cap, it should be supple and clean.

For the second you rule out exhaust leaks, and probably fix the purge issue and reset the code. If there's no exhaust leaks and the only code that comes back is a P0420 you'd need to replace the catalytic converters."
1mzb5bz,92’ Miata misfire,"So I bought a 1992 Miata 1.6L and after a week of ownership I got a pretty gnarly misfire, so I pulled the spark plugs and noticed some oil in the spark plug wells. So I ended up replacing the valve cover gasket to fix the oil leak issue in the spark plug wells. I also got new plugs and wires and when I started it back up same issue, so I pulled each plug wire individually and put a plug in it and I have spark on all 4 wires.
   So my next thing was to compression test and make sure I didn’t have bad pistons and I have 180 compression on all 4 cylinders so I ruled that out and moved on to fuel and started pulling injector plugs and when I pulled injector plugs on cylinder 4 and 3 it still ran the same so I figured those 2 injectors were bad and causing the misfire so to check them I unplugged them and took the spark plugs out and cranked and fuel would spray out of cylinder 4 so I knew that injector was stuck open and I assume injector 3 was clogged so I pulled them out and cleaned them thoroughly and put them back in and tested and cylinder 4 was no longer stuck open so I put everything back started it up and still same misfire and when I unplugged injector 3 and 4 it still ran the same. 
   So before I spend the money on new injectors does anyone have any idea what the issue could be? Any feedback is greatly appreciated, thank you.",1,1756078676.0,2,MechanicAdvice,1756150330,2025-08-24 23:37:56,2025-08-25 19:32:10,"Mundane-Reality3336 (Score: 1): I dunno, sounds like you almost have this figured out. Maybe check the fuel pump(s) to be sure you are getting enough fuel? Otherwise injectors sound a safe bet"
1mzazko,Help with a ground wire,,1,1756078244.0,3,MechanicAdvice,1756150330,2025-08-24 23:30:44,2025-08-25 19:32:10,"ChEeSeNeEdLes (Score: 1): 2018 5.7L Durango. My bad!

No-Chance-8308 (Score: 1): That depends. One end goes to the cylinder head on the driver’s side and the other end goes to the rear of the passenger side wheel well area. It’s a little difficult to describe, but search and you will find."
1mzated,advice on this loud noise for my 2016 Ford mustang,"Hey, I'm coming here looking for advice on this issue with my 2016 Ford Mustang. I’ve had a clunking sound when going over uneven roads for about a month now. Very recently, I’ve had the struts, brake pads, and rotors replaced. I thought it could be a sway bar link or ball joints, but when visually inspecting them and teetering around, everything looked good. While trying to wiggle the whee,  it makes this loud noise on the left to right test. Looking for advice as to what this could be ",1,1756077793.0,7,MechanicAdvice,1756150330,2025-08-24 23:23:13,2025-08-25 19:32:10,"NZXT_FUEGO (Score: 1): judging by the wheel moves like that its probably your wheel bearing

da_bubs (Score: 1): Just to confirm, no noise or movement with your hands shaking the wheel at 12 and 6?

Did the noise start when you had work done?  I'd guess so.ething was left a bit loose.  Check all the relevant bolts for your brakes and struts, or whatever else was worked on.

You can also have a friend feel for the noise by lightly touching different pieces as you shake the wheel.  A clunk like that will be able to be felt.  It might help lead you to the source."
1mzarjo,"Both new front air struts + control arms, still clunking noise when steering - losing my mind","Hey everyone,

I really need some help here because I’m losing my mind with my CLS (W219) front suspension.

The issue: •	There’s a loud clack/clunk when turning the steering wheel all the way. •	I thought it was the bushing on the lower control arm → replaced it, noise stayed. •	Replaced the entire lower control arm → noise stayed. •	Installed new air struts (both sides, brand new) → noise still there. •	So at this point, both sides have new struts AND new control arms, yet the clunking persists.

I’ll upload a short video so you can hear the sound clearly.

Has anyone else experienced this? Could it be related to mounting/torque procedure, or are there known issues with certain aftermarket struts? Any help to decode this problem would be hugely appreciated 🙏

Thanks in advance!",5,1756077657.0,18,MechanicAdvice,1756150330,2025-08-24 23:20:57,2025-08-25 19:32:10,"o5blue8 (Score: 3): Looks like the strut is binding.  You can see it pops and the lower bolt is snapping.  Is that the origination point of the noise?

rebuil86 (Score: 4): the joint at the center of the screen which is clearly moving, is not new. what exactly is new in addition to the struts?  
The joint in the middle is the clear failure.  
I thnk you had someone replace the upper control arms didnt you. they scammed you. its the lower arms, the ones which are clearly old in this video and still covered in road grime with a faulty joint"
1mzaof9,Car is out of battery after getting a brand new one,"I just got my car’s battery replaced. My last battery was very old, so it was expected it would die. Now one day later, the battery is dead again. I never drove the car. What’s going on?",1,1756077431.0,5,MechanicAdvice,1756150330,2025-08-24 23:17:11,2025-08-25 19:32:10,"Ok-Scratch727 (Score: 1): Make sure the terminals are not loose also if you have a multimeter check for voltage with the car on you should be close to 14v if it’s not at 14v and it’s around 12.6-12.8 or lower you need an new alternator first I’ll check the terminals you probably left one loose

lethalnd12345 (Score: 1): Did you test the alternator?"
1mzannz,Can I raise my drivers seat?,"I have a decent commute to/from work and I live having the windows down when weather permits. The problem is to put my elbow on the door it is just an inch or so from being fully comfortable. So I want to raise my seat up by that much.

The seats all manual, no fancy stuff whatsoever. I was thinking some metal spacers or a fat stack of washers and longer bolts should fix this issue. 

Is this something I can just do? Would there be any safety/inspection issues going forward if I did this?",0,1756077375.0,11,MechanicAdvice,1756150330,2025-08-24 23:16:15,2025-08-25 19:32:10,"NewrytStarcommander (Score: 1): The problem with the 1973 Super Beetle is that the front seat mount is a pedestal welded to the pan.  You can put washers under the two rear mounts but that will pitch the seat forward, there's no easy way to raise the front.  We have no idea of course what car you have so your guess is as good as the internet's on this one.

mango10977 (Score: 1): Couldn't you just add a pad on top of the seat?

You could also use a booster seat. I seen a guy who was 5 ft x used it when they were driving those big trucks, and the seat doesn't go up."
1mzambp,Vw rabbit 2008 noise + smell,"I recently started hearing this noise (deeper belt sounding) and these past couple days a battery smell has also started from the engine, is my alternator cooked??
I can send extra videos with more angles if needed.",1,1756077278.0,2,MechanicAdvice,1756150330,2025-08-24 23:14:38,2025-08-25 19:32:10,Sword_Shield- (Score: 1): I should mention that earlier I had the AC on max which might be why the alternator is releasing a smell
1mzalj2,Please help me with my dodge charger !,"Anyone know how I can save my ole girl, I went through some deep water one night while it was storming out and it shut off in the water, assuming I flooded it, I pushed it out the water and to the side and left it for the night, the next morning I had tried to start it but it wouldn’t turn over, probably cause of the water inside the engine, def went up in my intake, I put some starter fluid in the intake got it to start and this is what it sounds like now, it will turn over regularly now after a couple days, no water inside my oil, is it done for?",78,1756077220.0,156,MechanicAdvice,1756150330,2025-08-24 23:13:40,2025-08-25 19:32:10,"pleirbag (Score: 413): Simple fix man. First drain the oil, then pull the plugs. Next step remove engine. And install a new one.

Notmuchmatters (Score: 210): That is done"
1mzakt2,Help me diagnose this noise,"This is a new to me 1976 Honda XL250. She’s rough around the edges but starts easily every time and runs just fine (I drove it 50km back home with no issues). There’s a lot of work i’m going to do it but just want some opinions so I can order parts efficiently. This tick is most prominent when it’s cold, gets significantly better when warm but still present. Is it in desperate need of valve adjustments? Is it chain tension? Or is it perhaps partially blocked oil channels in the head? 

I know these engines are known somewhat for this noise (being a single cylinder and all), but to me this is too loud. Just looking for advice.

TIA

P.S. I know it’s a POS, but I got it real cheap with the sole intention of teaching my gf how to drive. ",1,1756077164.0,5,MechanicAdvice,1756150330,2025-08-24 23:12:44,2025-08-25 19:32:10,"N0rthofnoth1ng (Score: 1): Well it has gas in it, I'll tell you that, also might be the chain. Have you consulted the Honda forums?

inflatableje5us (Score: 1): it kind of sounds like a exhaust leak.  could be the head gasket leaking a bit when its cold as well.  i also hear some bottom end noises but i believe these have roller bearings on the mains so could just be them being noisy.   
easy way to find a leak is to hold a match/lighter/candle where surfaces meet in a garage/place with no wind and see where it gets blown out."
1mzagt7,Suspension damage after hitting curb (2010 Nissan Versa Hatchback 1.8L),"I was driving at around 30 MPH when I hit a curb, I went out to check and my wheel was completely destroyed. The wheel well lining was also mangled. I managed to change the wheel and drove home but it did not sound pretty at all. The wheel was.smaller than the rest and I had to keep the steering wheel at a 4 o'clock position to keep it straight and there was wobbling when accelerating but stopped at around 25 mph. When I got home, the wheel was.super hot to the touch, I couldn't keep my hand on it for more than maybe 3 seconds. It made hella weird noises turning and a bunch of ""Skrrt"" sounds as well. What parts do I need to buy to rebuild it? Upon inspection, the strut tower is touching the wall towards the back, and when I bought a new wheel, and left, I straight up just couldn't steer to the right. The wheel touches the frame when turning all the way to the right. There is more space to the right of the wheel than the left, which leads me to obviously believe that the suspension is bent. ALSO the sway bar end link was touching the axle, but was removed by my dad. ",1,1756076882.0,5,MechanicAdvice,1756150330,2025-08-24 23:08:02,2025-08-25 19:32:10,"RickMN (Score: 1): The average 30-mph curb kiss winds up bending the tie rod and control arm at a minimum. It can also bend the strut and even the steering knuckle. Based on your description, this would be almost a $2,000 repair at a shop.

BaekReddit (Score: 1): This is almost impossible to tell you without being able to see the car. Sounds like serious damage if the strut is touching the fender liner. Does the top of the strut mount look bent? Not on the strut but the frame? I'd say at minimum, strut, controls arms, sway bar link, probably tie rods, ball joints. One of those things you really need to see in person to diagnose."
1mzagq8,Wet/worn out metal hinge sound when turning wheel. Dealer can’t replicate….,"2020 Lexus RC-F 2urgse. At 70k miles

Roast me for the title if you’d like… I’m just having a hard time describing this sound.

Started happening not too long ago. The sound only happens when turning the wheel to the right in a quick motion at very low speeds. When it happens, I can feel a “humming” vibration in the wheel…. I’m bad at describing things, I know.

It doesn’t happen every time so the dealer “can’t replicate” the issue 🙃. Still under warranty but I’m not even sure what this is or if it’d be covered. Any help anyone can provide would be greatly appreciated!
",3,1756076876.0,3,MechanicAdvice,1756150330,2025-08-24 23:07:56,2025-08-25 19:32:10,Opening-Influence526 (Score: 1): Probably dried out ball joints
1mza79i,2014 Infiniti QX60… P0420 and P0430 code,"Son’s car stopped accelerating the other day.   Noticed P0420 and 0430 codes.   Could clogged catalytic converter prevent car from accelerating at all?    In drive, it will only go up to 1500 rpms and seems a bit sluggish while barely inching along.    Park or neutral it will go up to 6000 rpms without seeming sluggish. 

Note. Transmission was replaced 8 months ago 

Thank you for any advice ",1,1756076218.0,2,MechanicAdvice,1756150330,2025-08-24 22:56:58,2025-08-25 19:32:10,"BaekReddit (Score: 1): A clogged cat can definitely cause sluggish acceleration. If it is having trouble getting the air out, then it will definitely have a problem getting air in. Easiest way to test for me is to use a IR thermometer, and check temp at the inlet and outlet. If the inlet is way way hotter, then it is likely a clogged cat. Can also bang the cat with a hammer (not so much to damage it) but if that knocks something loose and it starts driving better then bingo."
1mza68u,Can i put motorcycle oil in my 2010 Hyundai Tucson,"Basically my engine makes a sound whenever its one, its sounds like something hitting something inside the engine. I have a few car savvy friends that have told me its the cylinder hitting the gasket? Im not too informed on cars so i don’t know what that means. My girlfriends dad suggested i use thicker oil. So far ive gone to 5w20, but still the sound is present. Would motor oil work? My car has over 150 000 km on it. ",1,1756076142.0,2,MechanicAdvice,1756150330,2025-08-24 22:55:42,2025-08-25 19:32:10,"BaekReddit (Score: 1): If you want to try a thicker oil you can just use thicker regular car oil. I'd be careful with motorcycle oil as sometimes they have additives specifically for motorcycles. I'd start by buying a bottle of lucas and seeing if that helps. Diesel oil is also preferable to motorcycle oil. 5w20 sounds about spec for that car. I'd try going up to 10w-30 before motorcycle oil. Also, it is not hitting the gasket. Likely piston slap or valve train noise. But with noise like that, it is just putting a bandaid on a broken arm."
1mza4nb,Can holes in my cold air intake air filter cause a fluctuating idle?,"Question in title. I’ve had a fluctuating idle ever since I had my aftermarket charge pipes installed. 

I’ve performed a smoke test recently and found a vacuum leak. The connector to my turbo inlet pipe was not fully seated and the other end of that hose was missing an o-ring. No other leaks appear to be present. 

I’ve fixed both leaks but the idle still seems to wanna fluctuate sometimes. That’s when I noticed two little holes in my cold air intake filter. Can this cause a vacuum leak? The next thing I’m thinking of looking at is my MAF sensor. I’ve heard I can unplug the MAF and if the issue goes away, it’s either a leak or the MAF itself that needs replacing. ",1,1756076026.0,3,MechanicAdvice,1756150330,2025-08-24 22:53:46,2025-08-25 19:32:10,nimbleVaguerant (Score: 1): I assume you're referring to the engine air filter?   A hole by itself isn't gonna cause idle issues.  The contaminates that get stuck to your MAF sensor can cause issues.
1mza4ef,Professional techs/mechs: anyone of you ever leave a job without giving a two weeks notice?,"To make a long story short, I made an unprofessional fool of myself in my workplace group chat last night expressing concerns and issues that some of the lower-tiered and less tenured techs have been experiencing. I was going to put my two weeks in on Monday to leave dealership life and go Indy but now I’m thinking I just show up and dip without further explanation. I’ve been in this field for almost 10 years with over a year at my current position and have never had a crash out like this. What do you guys think? ",1,1756076009.0,11,MechanicAdvice,1756150330,2025-08-24 22:53:29,2025-08-25 19:32:10,"Hyundaitech00 (Score: 3): A shop doesn’t give me 2 weeks notice to fire me, fuck that. I haven’t put two weeks in for years, don’t care, once I quit I won’t go back to a place. 

BaekReddit (Score: 2): Yeah, I mean what can they do. If you like the people there, it is always courteous to give notice, but if they're mistreating you then fuck em'. There has been a tech shortage for a while now. They will miss you more than you miss them."
1mza3s2,Has this car been in an accident?,"As title says, I took the photos both sides of this metal rail (i dont know what its called). They are underneath the plastic cover under the car so a bit hard to take very close up photos. It is a Lexus RX 350 2020.

Seeing as how they look almost identical, I don’t think there were impact, but just for my peace of mind. Can anyone confirm this is normal? 

TIA
",1,1756075964.0,6,MechanicAdvice,1756150330,2025-08-24 22:52:44,2025-08-25 19:32:10,"BaekReddit (Score: 1): To me, that doesn't look normal, but don't have any experience on that model of car specifically. If it is your car or one you're looking to buy then just take the hit and buy the carfax. If a crash caused that it would almost certainly be reported to insurance.

codlong111 (Score: 1): I’m in Australia, and PPSR states that it is not written off."
1mz9uc7,"Steering wheel shakes while I drive, bumpy ride","I've been having issues with my steering wheel shaking or vibrating while I drive it really only happens in slow speeds I jacked up my car and noticed the wheel moved really easily I took a video and saw that the axle moves with it, would this be an axle issue or ball joint issue?",3,1756075301.0,7,MechanicAdvice,1756150330,2025-08-24 22:41:41,2025-08-25 19:32:10,"Dinoishere72 (Score: 7): Wheel bearing has left the chat

Yooper8077 (Score: 2): Wheel bearing."
1mz9u4a,Why does my triton run like crap with this plugged in?,"I unplugged it when changing out plugs on driver side and I forgot to plug it in but when I plugged it in while it was running the thing made my triton run like shit, misfiring and stuff but when I unplug it, the motor clears up but it shakes for some reason. What is it and can I leave it unplugged",0,1756075286.0,7,MechanicAdvice,1756150330,2025-08-24 22:41:26,2025-08-25 19:32:10,"Sophias_dad (Score: 3): Looks like an EGR valve. At idle it shouldn't be active. The control valve for that valve might be defective(stuck on).

There are two effects from unplugging that if it is stuck on... one is that the EGR valve will close(which is the correct state at idle) and the other is that the vacuum line you just unplugged will be supplying fresh air to the intake manifold and changing the mixture.  At the very least, you should plug the line so you don't have a vacuum/air leak.

Rebeldesuave (Score: 2): EGR stuff can go bad. The parts aren't super cheap but they should be relatively cheap and not too difficult to install. 

What year and model truck?"
1mz9pbe,Not sure what to do here lol,"Currently trying to install a quick release on my 04 TL and both torx screws for the airbag were stripped. tried using an extractor set and they wouldnt budge, one side i have drilled out the middle, i believe if i just keep drilling that side the head while gradually increasing sizes i will eventually just be able to chisel the head off. now the issue is the other side has a drill bit broken off and stuck in it and has me rethinking my life 🤣. any ideas would be greatly appreciated, i dont have access to air unless i tow it to the shop i work at but am trying to avoid that. even deploying the airbag and being able to access the center bolt would work, just not sure how i would go about safely deploying an airbag while being in my car lol  ",1,1756074944.0,9,MechanicAdvice,1756150330,2025-08-24 22:35:44,2025-08-25 19:32:10,"Rebeldesuave (Score: 3): On many cars airbags are attached to the wheel via clips and not screws. 

So this seems extreme to me.

None (Score: 3): [deleted]"
1mz9l8k,Ford,,1,1756074661.0,3,MechanicAdvice,1756150330,2025-08-24 22:31:01,2025-08-25 19:32:10,DayHot2168 (Score: 1): Ford
