id,title,selftext,score,created_utc,num_comments,subreddit,scraping_time_utc,created_datetime_utc,scraping_datetime_utc,top_comments
1nq7sal,Cylinder 4 misfire,"Ok so I’m at my wits end right now. I have a 2000 Buick lesabre, and a few days ago it started having a miss on cylinder 4 (according to the code reader at least). I’ve swapped out the ignition coils and all 6 spark plugs, and it’s still missing and idling at like 500 rpm’s and sounds like if a diesel got dropped on its head as a baby. What else could possibly be causing the misfire? I’m running out of money and ideas

EDIT: As of right now the car has 86k miles on it",2,1758809348.0,4,MechanicAdvice,1758915136,2025-09-25 14:09:08,2025-09-26 19:32:16,"Several_Situation887 (Score: 2): Misfires are not always ignition problems.

Misfires can be fuel related, too. EX: A bad or clogged injector, or line.

Misfires can be caused by mechanical issues within the engine. EX: A valve that is no longer opening and closing properly.

You can try swapping the fuel injector from #4 to a different cylinder, and see if the problem moves with it.

If the problem stays on number 4, and you're sure that the new plugs and coils are working properly, then you probably need to be looking at the cylinder health.

A leak-down test would be the easiest way to determine if you have a physical issue that needs addressing.

ApartmentKindly4352 (Score: 1): Run a compression test on cyl4 also make sure you are getting spark out of the coil, these had ignition control module issues too"
1nq7q1l,Loose bolt under the rear of mazda 3,2012 mazda 3 sedan . Have this loose bolt. Does anyone know what's it connected to? Or what kind of bolt this is. It started out loose but I think it's fell out now. ,5,1758809195.0,6,MechanicAdvice,1758915136,2025-09-25 14:06:35,2025-09-26 19:32:16,"Bluetex110 (Score: 4): Looks like your stabilizer /rear sway bar thats loose now

madmax435 (Score: 2): sway bar link, just tighten it down, should either be a 12mm or 14mm"
1nq7g8s,2013 Kia optima,"What is this metal rod hanging down? It moves back and forth and I don't notice anything different when I drive, it's near the passenger rear ",1,1758808557.0,3,MechanicAdvice,1758915136,2025-09-25 13:55:57,2025-09-26 19:32:16,rosstechnic (Score: 1): suspension level sensor?
1nq7e4y,Car Leaking Oil After Oil Change (Mini Cooper S 2015),,1,1758808413.0,2,MechanicAdvice,1758915136,2025-09-25 13:53:33,2025-09-26 19:32:16,minijtp (Score: 1): Make sure you didn’t double gasket the oil filter
1nq784l,Hose just…detached?,"I was changing out my spark plugs and this hose just….detached? Thought I had to simply detach it back but…..I’ll show yall.. can yall tell me what the hose is for? The other end attaches to a nozzle in the back chasis and what looks to be oil coming out? 
I have a 2005 F-150 5.4L",1,1758808004.0,17,MechanicAdvice,1758915136,2025-09-25 13:46:44,2025-09-26 19:32:16,"chairshot125 (Score: 1): That's your PCV hose. It attaches on to that metal pipe coming out of your valve cover. I can see it under your coil wire

Bluetex110 (Score: 1): Did you check your coolant level? Looks like this is the Hose that goes to your thermostat

Once the Thermostat opens the coolant will circulate through that into the heater matrix"
1nq71te,2011 RAV4 keeps failing,,1,1758807570.0,9,MechanicAdvice,1758915136,2025-09-25 13:39:30,2025-09-26 19:32:16,Bluetex110 (Score: 1): Did all the lights on the dash go out while turning the key and did the starter click?
1nqm8ls,tyre cut,"I just noticed this small cut in the tyre, does it need replacing or is it fine?
",3,1758843576.0,4,CarTalk,1758915136,2025-09-25 23:39:36,2025-09-26 19:32:16,"Inner-Pineapple4894 (Score: 1): If you don’t see and metal wires you should be fine. But your tires do look low on threads

dmarve (Score: 1): Look at your rim!

That chunk missing from your tire (and rim for that matter) was self inflicted"
1nqlw5h,Scuffed my car trying to get into a parking spot. Can I fix this myself??,,0,1758842633.0,20,CarTalk,1758915136,2025-09-25 23:23:53,2025-09-26 19:32:16,"seamus_mc (Score: 23): Nope. Unless you work in a body shop.  But if you did, you wouldn’t be here.

Strange-Audience-717 (Score: 10): If you did this trying to park, I wouldn’t suggest trying to fix it yourself.

None (Score: 2): [deleted]"
1nql9eh,Oil Change at Fruitridge Firestone,"Can someone who knows about cars please tell me… does this look like my oil was just changed. I showed the manager and he doubled down saying that yes it was just a “hard read”. Let me know guys
",1,1758840950.0,4,CarTalk,1758915136,2025-09-25 22:55:50,2025-09-26 19:32:16,"dudreddit (Score: 3): Its a hard read from here as well.  If you have no oil between the low and high marks, don't drive it.  Have them add oil until it is.

Tony-cums (Score: 1): I enjoy how you don’t wipe it before inserting for a read. That helps. 

That oil looks fine.

Rainflurry (Score: 1): Yes, it appears that the oil was just changed."
1nqkc5j,Do my tires need to be replaced,"Hi, 

I've never replaced my tires and it's been 7 years. Just wondering if y'all can tell by looking at them as I don't know much about cars

Thanks",0,1758838563.0,12,CarTalk,1758915136,2025-09-25 22:16:03,2025-09-26 19:32:16,"ColonelAngis (Score: 7): Usually with KIAs you’re supposed to change the engine before changing the tires

chandleya (Score: 13): At least one has been driven nearly flat. Strike one. None of them seem to match. Strike two. None of them have more than the minimum tread remaining. Strike three.

mr_lab_rat (Score: 1): Yes"
1nqj9sa,Should I get a new car?,"I have this white 2008 Honda civic, and my mom got it as her first car then passed it down to me when I got my license. It’s gotten me everywhere and I love how familiar it is to me. It’s gotten 458577 km on it though, the volume knob doesn’t really work (it just goes in random volumes regardless of where you turn), the a/c doesn’t work, the headlight is gone, the battery dies every 5 or so months and I’ve dinged the poor girl up a few times. BUT it still gets me to work and back and wherever I need to go without issue at most. I’ve been thinking if I should get a new car or not, and when others think it’s the right time to get a new car?",0,1758835937.0,4,CarTalk,1758915136,2025-09-25 21:32:17,2025-09-26 19:32:16,"Jochacho (Score: 2): Depends on if you want a payment or not. Used car prices are insane right now and you’ll be paying 7-10k for a car that doesn’t have the problems you already listed. 

The things you have wrong aren’t that expensive to fix compared to a car payment after 6 months. If it’s still getting you to work, maybe start putting away “a payment” like you have a new car. So when this one dies you have a down payment and you’re already used to the hit to the wallet, besides the jump in insurance costs. 

New cars are also MUCH more expensive to put tires on. I could tire my old Honda for $500. Now it’s 1100+ for my newer CRV. 

First-County-4667 (Score: 2): Keep it and fix the problems

Crash__Pandacoot (Score: 1): Generally the standard “when should I get a new car” litmus test is when the car cost more to repair then it would cost to buy a car as good or better. The issues that you state aren’t necessarily big issues. I’d take the car in to get a quote on the work needed & with that you’d have a much better idea of if it’s worth it or not to get another car. If you decide to get another car before you do so, make the payment to yourself in a saving account for 6 months or so to find out how easy it is for you to make the payment & then that gives you savings for a bigger down payment."
1nqilpe,Power steering stiff after fluid flush?,"'01 Lexus LS430, I had my mechanic fully flush my power steering system due to a whining that had started last week which had improved when I had suctioned out some of the old fluid and replaced it a few times. However, the steering has become rather heavy now after the full flush and had become noticeably heavier each time I had removed old fluid, what could be the issue? Do I need to just drive the car for a few days and hope it improves?",2,1758834269.0,3,CarTalk,1758915136,2025-09-25 21:04:29,2025-09-26 19:32:16,"bootheels (Score: 2): Have you checked the power steering fluid level?  Perhaps they didn't bleed sufficiently and the fluid level dropped.  I would return to the shop if the issue continues

dudreddit (Score: 1): It sounds like the new fluid may have improved the PS performance.

Bellashotzi (Score: 1): You said it was whining before the flush. I would say the rack or the pump was going bad and the new fluid was a band-aid."
1nqikyp,Intake manifold,Doing a intake manifold for a 2000 grand marquis. Do I need to dab rtv on the corners of the gasket when installing ,1,1758834216.0,4,CarTalk,1758915136,2025-09-25 21:03:36,2025-09-26 19:32:16,BophadeseNuts (Score: 1): What manifold did you buy?
1nqh94b,Help! Chemical (maybe mold) smell from car is making ME smell bad - bad window seals involved?,"Here's my mystery: Started 2-3 weeks ago, people told me I smell like chemicals. Took me a week to figure out it's coming from my car, not my clothes/laundry/house. The stench is sticking to me.

And my car situation:

* Window seals are shot - windows won't roll down without getting stuck on deteriorating rubber, leaving glue residue on glass
* Windows have been closed for MONTHS due to this issue (have been too strapped to fix at this time)
* NO visible water intrusion in cabin, roof, anywhere.
* Already changed cabin air filter (helped slightly but smell persists)
* No visible signs of mold/damage anywhere I can see

Could mold be growing inside the door panels or other hidden areas due to the bad seals, even without visible water damage? The chemical or mold smell (I can't figure out what) is strong enough that it's transferring to my clothes/body after driving.

**Questions:**

1. Can deteriorating window seals cause mold growth in hidden areas even without obvious leaks?
2. What are other possible sources of chemical smells I should check?
3. Should I be looking inside door panels somehow?
4. Any DIY ways to locate the source before taking it to a shop?

The smell is definitely coming from the car and it's potent enough to make me reek after a commute. Any ideas what could be causing this and where to look?",1,1758831122.0,5,CarTalk,1758915136,2025-09-25 20:12:02,2025-09-26 19:32:16,"raetwo (Score: 1): 1. Yes.
2. It's probably the failing seals. Your car is now effectively outside.
3. Yes.

CTSwampyankee (Score: 1): How nice is the vehicle? That will probably determine how invasive you’re going to get.

Check the  carpet pad.   shove your hand  and see if it’s a science project. Go check out the area below your heater blower motor  if there’s carpet below it check that area.

Spray the whole thing down with odoban  consider getting an ozone machine. 

You could probably spend a few bucks and get some new seals depending on the vehicle model

BeautyIsTheBeast383 (Score: 1): Mold doesn’t smell like chemicals.  What kind of smell is it?

Look for debris stuck to exhaust pipe or fluid leaks running onto exhaust pipes.  Unseated light bulb sockets burn plastic.


If your HVAC is always set to recirculate, smells coming off of you will build up in the car."
1nqfew2,Does this tyre need replacing - is this dry rot?,"This is the only tyre like this (back right), the rest have no such cracks. Tyre wear isn't an issue but I'm concerned about the cracks particularly because they're on the side wall? ",3,1758826861.0,7,CarTalk,1758915136,2025-09-25 19:01:01,2025-09-26 19:32:16,"MapleSurpy (Score: 4): That tire is absolutely fucked with dry rot. Replace it.

guitars_and_trains (Score: 2): Yup. That there is a fucked tire. Change it asap.

NotAPreppie (Score: 1): I would. Your bravery may vary."
1nqefcz,Should I repair my vehicle or buy a new one?,"I have a 2010 Hyundai Accent that I've owned for four years now. It has about 148K miles on it, purchased at around 136K miles. I've kept up with oil changes and basic preventative maintenance. In the past year, I've replaced the battery, alternator, starter, serpentine belt, spark plugs, air filter, crankshaft sensor, and camshaft sensor. 

Earlier this year, my car randomly died one day in the parking lot of my job. It had previously been working fine, but suddenly wouldn't start even when we attempted to jump it off. I also remember my brake being incredibly stiff. My mom even called out a mobile mechanic to give it a look, but they didn't do much of anything and it still didn't work. Miraculously, after about 3 days, it started up and has been working without any issues up until about a month ago. I had driven 50 miles that day and didn't notice anything out of the ordinary. Next thing I know, I'm rolling up to a busy intersection ACTIVELY pressing the gas to accelerate forward. All of a sudden, my car stopped accelerating. Instead, it began to roll backwards. I immediately turned on my hazard lights and braked to avoid rolling into the car behind me. Now, I did notice that when I lost acceleration, I also lost all tension in the gas pedal (Not sure if it's worth noting!). I also lost power steering and my brake became stiff. Thankfully, someone stopped and helped me roll my car into the parking lot right next to where I broke down. He was truly an angel in disguise. I ended up getting my car towed back to my house the next day. 

My boyfriend has tried scanning it for codes and has replaced several parts as mentioned earlier in this post. It's been a month now and we still don't know what's wrong with it. I've considered towing it to a shop or trying to find a mobile mechanic, but at this point, I'm not too sure anyone will be able to diagnose the problem, let alone get it resolved. 

I'm beginning to consider just buying a new car because I need reliable transportation and I don't want to waste money on a 15 year old car if it's going to continue to be problematic. 

Any tips or thoughts would be GREATLY appreciated. TIA. ",0,1758824587.0,7,CarTalk,1758915136,2025-09-25 18:23:07,2025-09-26 19:32:16,"Desperate-Score3949 (Score: 6): You need a mechanic to diagnose the issue instead of just throwing parts at it hoping a part will fixing it. 

Your car has 148k on it, and being you only put 12k on it over the course of 4 years, I personally wouldn't spend money on anything else unless you really need something else such as a bigger car.

lunaticmagnet (Score: 1): brakes and power steering rely on a running engine for power.  it sounds like your car stalled, those are just symptoms and unrelated to why it shut off in the first place.
your car doesnt have a lot of miles on it for the age, it's probably worth fixing if it's not rusty and otherwise in good shape.  it could be something simple to fix.

Rainflurry (Score: 1): You lost tension on the gas pedal when the engine shut off because this vehicle has an electronic throttle and, when the engine shuts off, the electronic throttle plate is no longer under power, so it has less resistance.  

Was the crankshaft position sensor replaced because you had the same issue with the engine shutting off, and thought you would throw a new CPS at it?  Did you replace it, or did a shop replace it?  I would definitely double-check to make sure it's connected and the bolt that holds it in place is still tight.  There are a couple of decent YouTube videos that show you where it's at.  The CPS is a common issue with these vehicles."
1nqe4ee,"Car engine wont start, lighting up with warning issues, it’s not the battery or the key-start button proximity. Help please!",,0,1758823885.0,12,CarTalk,1758915136,2025-09-25 18:11:25,2025-09-26 19:32:16,"thepukingdwarf (Score: 9): How do you know it's not the battery? What happens (like what do you hear/see) when you try to start it? Have someone jumpstart you if you can and see if anything changes.

moomooicow (Score: 7): Test for acceptable battery power first

Captain-Korpie (Score: 1): 2020 Nissan Sentra, had some front radar issues previously, but car worked fine without cruise control."
1nqdy3h,2017 Hyundai Sonata Premium 2.4L - NEED EXHAUST ADVICE,,0,1758823478.0,23,CarTalk,1758915136,2025-09-25 18:04:38,2025-09-26 19:32:16,"glenn_rodgers (Score: 12): Anything you do to it is gonna make it sound like a fart cannon.

TroyFerris13 (Score: 4): Keep it stock

kograkthestrong (Score: 2): Like an aftermarket? Cherry bomb vortex. Loud enough on start up and when gunning it but pretty damn quiet when your cruising. 


Whatever you do don't straight pipe it."
1nqbapk,What would yall pay for this ? What is it worth,,34,1758817464.0,68,CarTalk,1758915136,2025-09-25 16:24:24,2025-09-26 19:32:16,"AdhesiveTeflon1 (Score: 59): An unmolested, stock, 115k mile NA Miata with no visible rust, no visible clear coat fade in the pictures, and all the panels in one color?  I'd say that's worth the list price easily.  Usually at this point all NA Miata have been molested by the drifter or stance crowds with four different color body panels.

Edit: and that's right on-par with bringatrailer pricing.

Emotional-Swim-808 (Score: 14): Well i found one in my country that the same color almost same year and the same mileage and it went for 12.5k

TheAwkwardBanana (Score: 7): That's been for sale for a while even though the price is okay. I'd be skeptical. Offer $4500-ish cause that seems fair."
1nqaft7,How bad is it ?,,0,1758815508.0,1,CarTalk,1758915136,2025-09-25 15:51:48,2025-09-26 19:32:16,"10PlyTP (Score: 2): It's just going to be loud until you get it replaced.  As long as the hangers on the pipe don't fail, nothing should fall off."
1nq9yqw,How dangerous is it driving with this in my tire?,Thank you,47,1758814405.0,21,CarTalk,1758915136,2025-09-25 15:33:25,2025-09-26 19:32:16,"senorpickle420_ (Score: 28): Sidewalls don’t have metal belts as some users are suggesting, they are fabric reinforced instead. A sidewall  is usually only about 5mm thick. I can see you’re on a 195 wide tire meaning it’s a passenger vehicle tyre so yeah you’re probably down to about 2mm of sidewall at the damaged spot. If you hit a curb or a piece of debris in that spot it’s done for.

big_bubba68 (Score: 20): Do not listen to these people talking about wires/metal. This is the sidewall of the tire. There are no wires in the side wall of this or most tires. That being said it all depends how deep the gouge is. I’d leave it but most tire shops wouldn’t. Worked at a tire shop for 2 years. Let them look if you’re truly worried.

Wild-Stock6034 (Score: 22): If you dont see metal it can be fine. If you see metal water can get to it and make it rust making it weaker and that is bad. So look very close."
1nq9vsn,DONT KNOW WHAT TO DO!,"Contexts-1st I would like to start by saying I have a 2008 Dodge caravan I purchased originally for $4000 back in 2022 I believe I spent another thousand dollars getting everything repaired and right so $5000 total it lasted me a good two years I would say or leading up to this point it always was having some electrical issues that I was able to ignore but I could no longer ignore it as my van stopped starting. so I bring it to the nearest auto mechanic shop to where I live because how the heck am I supposed to go back-and-forth from the repair shop while my car is broken right so I take it in they give me a laundry list of problems are anticipated, however. I asked the mechanic if it was worth repairing because I could take the money and turn around and put it on a down payment on a loan for something new n he said interest rates are so high your better off repairing the van so $3000 to repair the car so I take a loan out to repair my van per the mechanics advice they fix it what felt like overnight and it was running again. I went and picked it up. Ran my credit up $3000 and was on my Merry way.two weeks go by and now my brake pedal goes to the floor. I bring it back to the same shop. They tell me my brakes, blah blah blah that sounded reasonable to me that the brakes would need to be done. However, this was gonna cost me 1100 more dollars I didn’t really have the money but I need a car in order to work. I am a single parent, single income family just me and my daughter so $4000 is a huge hit for me to take because two more weeks went by and now my engine is smoking. It’s currently back at the mechanic, but I have no more money. My credit is now not in the shape it once was for me to get a loan on a different car and now I am just stuck here with no car no way to get to work and just feel completely defeated. I understand that my van is old and probably needs these repairs and that’s the risk I take in driving a used vehicle. I understand all of that I don’t really want to hear that right now because I feel like the mechanic should’ve advised me to not repair my van in the first place if this was going to be the case. I wish I could get my money back and go back in time. I’m at a complete loss they want $800 more just to get it to start so that would be a grand total of 4900. I am not going to make the third repair because I feel like repair you know I will be $10,000 in the hole if that’s even possible I don’t know what to do. I have no car no money and no way to make money what do I do? I want to Sue these mechanics and get SOME of my money back.but I doubt thats even an option or dispute the charges on my credit card even though they say they made certain repairs. My van still doesn’t run.! I’m so frustrated n feel taken advantage of by these mechanics I mean, is there anything I can do? Any advice anyone has to offer anyway I can even get a fraction of my money back out of $4100 that I’ve already spent.or am I just screwed n out 4100 I spent on my van that’s ultimately going probably to the junk yard after 4100 I’ll b LUCKY to scrap it for 410 😭 dead inside like why do I even try I hate it here I swear it makes me wanna say oh yeah I’m a mechanic n rip ppl off gir thousands n thousands is just unfathomable it’s a scam ",0,1758814219.0,4,CarTalk,1758915136,2025-09-25 15:30:19,2025-09-26 19:32:16,"letigre87 (Score: 5): Dude, you bought a 2008 Chrysler product *deeeepppp* into its maintenance cycle and you're upset with a guy whose job it is to fix stuff told you to fix stuff.

Do you honestly think your budget is going to allow for a car that doesn't need brakes, coolant system, suspension repairs? Anything you look at is going to be into its maintenance cycle and then you'd end up with a loan and a credit card bill.

_clever_reference_ (Score: 2): Paragraphs help if you want people to read your shit.

Gloomy_Following3416 (Score: 1): Youtube exists, fix it yourself if it's such a scam"
1nq8m6d,Oil Change Intervals --  SHOCKING RESULTS!,"Suggested automotive oil change intervals are always listed as so many miles or so much time - whichever comes first.  As someone who has retired and no longer drives as much, I always reach the time limit first. Most time limits are set at around 12 months. I know they say that because short trips don't allow the oil to warm up and burn off moisture, but that's not why I don't put on very many miles. I just don't take it out but once a week, if that, and when I do drive it I **NEVER** do short trips that don't allow the engine to completely warm up!

So here's what I recently did.  I drove my 2000 Ranger with Mobile 1 15,000 oil for **SEVEN YEARS** and 6,000 miles. I recently changed it and sent a sample of the old oil to an oil testing lab. When the lab results came back they were **100 PERCENT PERFECT** \--  no issues found at all.

So that tells me if you never take super short trips that don't allow the engine to fully warm up, you can ignore the time interval recommendations.",188,1758811309.0,133,CarTalk,1758915136,2025-09-25 14:41:49,2025-09-26 19:32:16,"Bigwhtdckn8 (Score: 70): Modern fully synthetic oils have fewer impurities and therefore shouldn't degrade in the same way as conventional oils in the past.

The advice has not been updated since those oils were used.

For most people,  me included the 12 month interval makes sense if you're having your annual MOT or equivalent done at the same time, and do enough short journeys to have put some wear and tear on the oil.

Background-Head-5541 (Score: 101): Interesting anecdote. Would be nice to see the test results. But one oil analysis does not identify any changing trends. 

If it works for you, carry on

NCSUGrad2012 (Score: 18): Every automotive enthusiast seems to treat oil like it’s a fragile commodity.  However, my last car I sold got it changed about every 10k and I still get service alerts for it. It’s currently at 305k"
1nq6sgl,Buying Used Car with Viper Remote Start Installed,"Hey all, I'm about to purchase a used car with 1 owner that installed a Viper Remote Start system back in 2016. The key FOB is model ""7816V,"" but I can't seem to find any indication of what system is actually installed in the vehicle. I am mostly curious if the installed Viper system would be SmartStart compatible (able to sync the remote start to the Viper app). If anyone has any idea how I could verify that (if even possible without tearing apart the car), that would be SO helpful, thanks!",2,1758806935.0,4,CarTalk,1758915136,2025-09-25 13:28:55,2025-09-26 19:32:16,letigre87 (Score: 1): Look under the dash in the driver area for the module.
