id,title,selftext,score,created_utc,num_comments,subreddit,scraping_time_utc,created_datetime_utc,scraping_datetime_utc,top_comments
1op5dax,Won’t shift out of reverse,"Car is a 2010 Kia forte 5-speed manual with 63,000 miles on it. Just bought it a few days ago. All of a sudden it won’t let me shift out of or into reverse. When I try to shift it into reverse it makes a grinding sound, and the shifter straight up won’t shift out of reverse unless I’ve stalled the car. Same with first gear, it won’t let me shift into it unless I’ve stalled the car. Other gears seem to shift just fine and it is driving okay otherwise. Any help would be appreciated",1,1762355318.0,11,MechanicAdvice,1762457787,2025-11-05 15:08:38,2025-11-06 19:36:27,"Odd-Concept-6505 (Score: 5): I suspect the transmission may be fine but your clutch is not fully disengaging. Jacking up both drive wheels (front for you) may help debug, if you have jack stands, with wheels free to turn mid air. Block off the rear wheels!

Reverse gear probably has not much left (or designed originally?) for synchros so reverse might be the early warning signal for clutch travel problem. Since there's no adjustment on hydraulic clutch vs cable or linkage driven clutch, you should try bleeding the clutch AND looking at the action and condition of the slave cylinder if you can ..slave probably sits low exposed to road water,salt etc (easy to see on pickup trucks, not easy on front wheel drive transverse engines).

But last time my slave cylinder rusted and started getting stuck, it was sticking in the DISengaged position, opposite of wondering if your slave just doesn't want to fully do its full travel while you are applying fluid pressure with pedal down.

DIY vs pro inspection/debug decision for you.

Tesex01 (Score: 1): Honestly. Makes no sense. 

If it is clutch not disengaging engine. Then no gears would go in.

If it is gearbox (synchronizers) you should be able to put it in gear after waiting few seconds for gearbox to stop spinning.

Try with engine off. If it works that way. Then try pressing clutch all the way, wait 5-10 seconds and then try shifting into the first gear. Or shift into any gear that goes in and then into first without lifting the clutch.

I guess first gear synchronizer is shot. Otherwise there is no physical possibility for input shaft to spin only first gear and not others"
1op5aza,Belt tensioner veloster 2013,"Hi, I have a question for an expert in mechanic. Does the veloster 2013 have belt tensioner ? Cuz my mechanic said I need new one and Hyundai said the 1.6 engine does not have a belt tensioner, help please ",1,1762355173.0,3,MechanicAdvice,1762457787,2025-11-05 15:06:13,2025-11-06 19:36:27,"Tesex01 (Score: 1): Can't you simply look under the hood? Or Google it yourself?

NickRMX6 (Score: 1): DIYer advice: see the pictures from Litens, ACDelco, and Gates, on the Rockauto website: [https://www.rockauto.com/en/catalog/hyundai,2013,veloster,1.6l+l4,3000988,belt+drive,idler+pulley,6956](https://www.rockauto.com/en/catalog/hyundai,2013,veloster,1.6l+l4,3000988,belt+drive,idler+pulley,6956)

It calls it an ""idler pulley"", but the hardware that comes with it is a tensioner."
1op4zcv,screw from a knitting machine wont budge,"SUPER need help ! :( i'm trying to clean the insides of my knitting machine (im following a yt vid) but these screws just wont budge!!! i have slathered it in wd40 for an hour but to no avail. i've read some advices from previous posts here but i cant apply heat (as this is made from plastic) or use another tool as a hammer (the screws are inside). 

im 100% sure that im turning it the right way (counter clockwise) and im also using the right screwdriver. ",1,1762354439.0,8,MechanicAdvice,1762457787,2025-11-05 14:53:59,2025-11-06 19:36:27,"AcceptableMinute9999 (Score: 1): I can't tell from the picture what kind of screw it is. Can you tell is it a Phillips head or is it a torx head?

Carllllll (Score: 1): You're using a Philips 1 head?  Put solid pressure down so it doesn't skip and give it a nice quick turn, the torque on this screw can't be more than 1nm.  WD40 won't do anything for you here and instead is probably making it more difficult to get proper grip."
1op4qbb,Caliper dust cover tear question,"I accidentally tore the boot cover on the piston of the caliper. I have a new part ordered but I won’t be able to put it on for at least a week, at which point I’ll have added 1k plus on my car. Is this manageable for a week? I don’t care about the extra work of putting this on, taking it off and repeating the process, I just need to know if my car won’t hate me for a week. No other holes or anything",1,1762353844.0,2,MechanicAdvice,1762457787,2025-11-05 14:44:04,2025-11-06 19:36:27,"RickMN (Score: 2): A week? Yeah, no problem"
1op47wz,Best way to repair muffler shield,"This exhaust shield rattles and make an awful noise what’s the best way to go about fixing this

Also how does somthing like this even happen lol",1,1762352633.0,4,MechanicAdvice,1762457787,2025-11-05 14:23:53,2025-11-06 19:36:27,"abat6294 (Score: 3): Remove it entirely. Cut it off if you need to

Equana (Score: 2): That muffler hanger on the right is about to rust apart. Might wanna look into that.

A really large hose clamp can secure that heat shield if you don't want to just tear it off."
1op47fu,"Would you run this and if not, any idea what's wrong?","2007 Volvo b5452t2, just replaced timing belt, water pump, idler and tensioner (Gates kit) and now the belt rides (imo) too far towards the block, even a millimeter or so over the cam gears. Engine runs fine and everything is fine, belt is not moving around with engine running. Tried with the old idler since it's easy to take off, compared it with the new one and noticed that the Gates idler is 0.5mm smaller measuring from where it meets the block. Belt still rides exactly the same with either idler. ",1,1762352603.0,2,MechanicAdvice,1762457787,2025-11-05 14:23:23,2025-11-06 19:36:27,TheFredCain (Score: 2): Shouldn't be an issue at all since the idler is designed to run in the middle of its motion range anyway.
1op3zko,I’ve been bleeding my clutch for over a week,"I have a 1998 civic that I put a motor in. I found out the master cylinder started leaking on it. I replaced that, bled it but it still feels like the pedal is dead sometimes and you have to pump it multiple times to get it into gears. I replaced the slaved too, same result after bleeding it probably way too many times. However, sometimes when you bleed it it’s fine for about a day, then it starts all over again. I feel like there’s still air, but I’m also noticing that the fluid keeps turning black even though I’ve had the fluid ran out who knows how many times. Could the rubber part of the line be deteriorating from the inside out and causing all of this?",2,1762352083.0,6,MechanicAdvice,1762457787,2025-11-05 14:14:43,2025-11-06 19:36:27,"NeilFoCash (Score: 1): They have a stainless steel line from the master to the slave.  They are like $20 dollars.

drmotoauto (Score: 1): Sounds like you might have a leak still.  I know it's hard to clean after bleeding so many times. 
Clutch and brake have separate reservoirs?"
1op3xwp,Car stutters after maintenance,"About a week ago I changed the sparks, fuel filter and oil & oil filter on my mk5 fiesta.

I'm noticing a stutter in the engine when trying to accelerate, speeding up much slower and jerking the car.

My guess would be its bubbles in the fuel line from the new fuel filter but id like to know for sure (or as sure as I can from reddit)

So, anyone know what this is?",1,1762351969.0,2,MechanicAdvice,1762457787,2025-11-05 14:12:49,2025-11-06 19:36:27,"Bluetex110 (Score: 2): I would check the coils and if they sit properly.

Unless you have a leak in the fuel line this shouldn't cause any problems, air bubble are usually gone after the first start as it's no closed system"
1op3wur,Worried about first time working as a car mechanic,"I’m a skinny guy and am only just starting to work out. I am worried about the heavy lifting because I just had helped with my dads truck. Most of it is decent and fine, but when it came to lifting, that’s where I really  started to struggle. I’m curious if they’re going to fire me because I’m not able to do it as well.",2,1762351895.0,5,MechanicAdvice,1762457787,2025-11-05 14:11:35,2025-11-06 19:36:27,"wpmason (Score: 2): Tires are about the worst you’ll encounter on a regular basis. 

Lower the vehicle so you don’t have to lift that much.

Bluetex110 (Score: 2): If you can lift a tyre you should be fine, for anything that's heavier you usually have tools to lift."
1op3lhd,2017 Ford Escape 100k Service,"After my last oil change, the shop recommended a $480 100k-mile service consisting of

* filter swaps
* new spark plugs
* coolant swap

My question is, **what do you recommend be serviced at 100k miles on an Escape?** I have seen others recommend the serp belt and various other things. I have a new transmission as of about 90k miles, so I am not worried about the fluid. Looking to put together a good list so I can see what I can DIY and what I need a pro to do.",1,1762351146.0,4,MechanicAdvice,1762457787,2025-11-05 13:59:06,2025-11-06 19:36:27,awqsed10 (Score: 1): Price maybe a bit high but all of those are normal maintenance and due now.
1op3jg1,Oil Burnming issue,"hello all,

just a quick question what tests can be done to identify the cause of excessive oil burning?

 

I have recently had an issue with this, and Arnold Clark are saying i need a new engine but haven’t diagnosed what has happened in their diagnostic report. I’m arguing that they should have carried out some sort of check or test to determine the root cause other than i burnt 2l over 200 miles.

  
DS3 - 45K miles - 1.2 Puretech - Petrol ",1,1762351005.0,12,MechanicAdvice,1762457787,2025-11-05 13:56:45,2025-11-06 19:36:27,"Equana (Score: 1): Compression test, leakdown test, oil consumption tests... depending on what type of engine is in the completely unknown car with unknown mileage.

TheFredCain (Score: 1): If it's really 2L per 200mi there is no need for you to spend any more money diagnosing that engine.  I'm sure they visually inspected it and didn't see any obvious leak that large (and it WOULD be obvious.)  That only leads to the need for a complete rebuild or a new/used engine.  If you want them to do a bunch of tests first, that's just going to cost you some more labor and still be the same outcome.  In this case they were saving you money by stopping the tests."
1op3h0t,Power steering fluid failure?,"1995 Jeep Wrangler YJ 4.0 AMC 242 i6 4L

(I have been very sick the past few days and have not had the time to locate the origins of the leak yet)

I just had my Jeep into a speciality Jeep shop a few weeks ago where they did extensive work to get my Jeep back in good shape. One of the things they did was replace my steering column.

A few days ago I was driving and smelled something like newly laid tar. Then I see in my mirror the liquid as I drive. I pull over and then see this all over my drivers side engine bay/etc. I clean up as much as I possibly can from underneath the jeep and let my mechanic know. They seem to be in agreement and said to tow it to them.

I do 90% of the work on my own jeep, but I’ve been so busy with work I haven’t had time.

Before I take it back to this mechanic, I’m curious to gather opinions on the situation. My reservoir was hanging unbolted in the engine bay. I’m unsure if this failure occurred because of the work they did to my Jeep or just freak timing since it’s a 30 year old vehicle and the more you mess with it, the more things start to fail.

I’m tempted to do this work myself when I have some free time. But this is my only vehicle which makes it more difficult.

If this was also a failure on the mechanic, then I might try to see how they can work with me on this. Not to mention, a few days after getting it back, my rear driver wheel almost flew off because they didn’t torque the lugs down… the one specialist drove out to me immediately to fix the situation and apologised profusely. I want(ed) to give them a second chance because they’re overall a great jeep speciality shop… but after this newest issue I’m having second thoughts.

",2,1762350838.0,3,MechanicAdvice,1762457787,2025-11-05 13:53:58,2025-11-06 19:36:27,jeepintx (Score: 2): The shop forgot to bolt it back on. It would have been in the way for them to change the steering column. It tipped over and drained all the fluid out. They should cover the tow cost.
1op3c75,I have a quick question regarding my 2006 Chrysler Pacifica 3.5 Touring,"Hi everyone,

  
I have a question regarding my car.  My car would not start, so my husband replaced the starter, the alternator, and the TIPM, he took the battery to AutoZone and they said it was dead, he is getting a new one on Friday, my question is, will this solve the problem and if it does not start with a new battery, what else could be the problem, the whole electrical system is now brand new",2,1762350497.0,7,MechanicAdvice,1762457787,2025-11-05 13:48:17,2025-11-06 19:36:27,"Valuable_Stretch_592 (Score: 3): Could be wiring, sensors, or bad grounds. Throwing parts is an expensive way to fix things. Might work but may not, that’s what technicians get payed to diagnose the problem.

Valuable_Stretch_592 (Score: 2): I probably would have done the battery first"
1op3bjk,SILICONE RTV QUESTION,,1,1762350455.0,2,MechanicAdvice,1762457787,2025-11-05 13:47:35,2025-11-06 19:36:27,"RickMN (Score: 1): Permatex sells RTV that cures in an hour or less. If getting it running quickly is your goal, use Permatex The Right Stuff. It cures in 90 mins. This[ article](https://ricksfreeautorepairadvice.com/understanding-rtv-drying-times/) lists all the curing times."
1op3bgn,"Need advice on choosing a timing chain (Volkswagen Tiguan 2010, 2.0 TFSI)","Which brand is truly reliable for my engine (2.0 TFSI, CCTA/CBFA)?
Preferably something available in Canada (Amazon, RockAuto, eBay, or PartsAvatar) and under 600 CAD.

I’m looking for a timing chain that will last long and won’t cause issues.
I’d really appreciate it if you could share some links or personal experience on which brand/manufacturer has proven to be the most reliable.",1,1762350450.0,1,MechanicAdvice,1762457787,2025-11-05 13:47:30,2025-11-06 19:36:27,"connella08 (Score: 1): The factory chain used by VW is manufactured by 2 manufacturers. either Febi or IWIS. are you looking for the whole kit? I personally buy all of my VW/Audi parts from either ECSTuning or FCPEuro. FCP has a thing called the ""OE Academy"" where it shows you the difference between OE and OEM. Its very informational and very useful."
1op37n4,Engine ticking?,"Hi all, can anyone guess what this ticking is coming from? It's a kia cerato 2019, It was serviced about 5 months ago. 
No lights (including engine light) is on, oil is a little low...
Any advice would be awesome☺️",2,1762350183.0,8,MechanicAdvice,1762457787,2025-11-05 13:43:03,2025-11-06 19:36:27,"TheAmazing_OMEGA (Score: 2): Sounds pretty normal for a kia 4cyl, the clicking is probably the direct injectors

Ok_Interaction3016 (Score: 2): Fuel pump / injector noise. Normal sound for that engine"
1op37at,Engine and cabin air filters,"Hello all,

I have to replace the engine and cabin air filters for a Infiniti qx50 2022. Is there specific brands you would recommend for someone that has asthma ? Also we live in central Florida (not sure if that matters)

Thanks ",1,1762350161.0,3,MechanicAdvice,1762457787,2025-11-05 13:42:41,2025-11-06 19:36:27,"GhostIsAlwaysThere (Score: 1): If your 2022 is anything like the 2017. As far as cabin filter. Get the best possible one. I say this because changing the cabin filter is a pain in the ass. 

As far as engine air filter, no reason to go cheap there. It’s your damn engine!!!

Buy the Nissan, buy the filter made specifically for the car unless someone can prove that another is actually equivalent, better AND cheaper. I mean prove by, not the guy at the parts store. Someone who is extremely knowledgeable about engine and cars and the such. Too many people have lax opinions and good enough is not always good."
1op2axo,Is my harmonic balancer bad?,I was changing out my belt on my wrangler and was checking all the pulleys. All of them seemed good and tight while engine was off but noticed the harmonic balancer looked wobbly while engine is running but is tight when i try moving it when engine is off. Is it normal? Should i just replace it? Any advice would be appreciated!,5,1762347918.0,16,MechanicAdvice,1762457787,2025-11-05 13:05:18,2025-11-06 19:36:27,"bigtony8978 (Score: 4): Looks bad to me

Maleficent_Worker116 (Score: 2): It has a rubber coupler in the middle. See how the center part is spinning smooth and vibration free? The middle part is the rubber, which dampens the vibrations to the outer ring. If you’re worried, check the rubber. It seems fine."
1op24s1,How difficult is this service?,"'22 Lexus IS300

Moved and no longer close to a dealership (an hour away).  Did my 30 month service (was just an oil change) at a local Toyota. 

 Is anything on this 36 month list difficult and would recommend Lexus dealership or is everything basic and any should be able to do it?

Mostly worried about the brake fluid and all the inspections. Engine, cabin filters, key fob battery I can do myself.  

https://preview.redd.it/b6cdrkxvrfzf1.jpg?width=1080&format=pjpg&auto=webp&s=327fc83f581af76b503ba8e33a7cc0071ec69078

",0,1762347486.0,2,MechanicAdvice,1762457787,2025-11-05 12:58:06,2025-11-06 19:36:27,"Evening_Horse_6246 (Score: 1): Did you read the list???

If you did and still question your abilities to inspect and adjust a floor mat,  stay home and never leave your house."
1op1wmi,Vacuum leak?,"Hi everyone, bmw e32 730i has a subtle wavy idle. It goes a bit up and a bit down when car not fully hot yet - ie does so for quite a long time when you just start the car, never had this problem with other cars. I was wondering if it could be a vacuum leak or something else? Car has thermostat stuck open since old owner and i was wondering if it could have been related with the engine temperature as I am going to do a full maintenance - new thermostat opening at 80º celcius - new fuel filter - new fuel pump relay - new coolant temperature sensor - new water pump (although not quite sure if i will be able to do it myself) - new expension tank cap at 1.4 bar - and new MAF. What's your opinion on this?",2,1762346859.0,4,MechanicAdvice,1762457787,2025-11-05 12:47:39,2025-11-06 19:36:27,Budpalumbo (Score: 1): Why are you loading the parts cannon and throwing all that stuff on?  Spending money on parts that aren't bad isn't good maintenance.  Get the cooling system operating at the temp it should and check for a vacuum leak.
1op1tn0,Car won't start,"Honda Civic 2012. The past two weeks, I've had problems starting the car, it doesn't always happen, but maybe once a week. This morning, it won't start at all.I kept trying to start it for the first few tries, I heard the cranking sound, and after 8-9 tries, I don't hear anything. What could be the issue",1,1762346638.0,3,MechanicAdvice,1762457787,2025-11-05 12:43:58,2025-11-06 19:36:27,"CJPrinter (Score: 1): Could be a weak battery.

skier3717 (Score: 1): Bad starter relay."
1op1jh5,Copper washers for a drain plug,"Hello, I'm looking to change the differential oil on my car, but I only have copper washers. Are these okay to use or do I need a specific kind of washer?

Edit: The car is a Mazda mx5 from 1998",1,1762345827.0,3,MechanicAdvice,1762457787,2025-11-05 12:30:27,2025-11-06 19:36:27,"Odd-Concept-6505 (Score: 2): Copper sounds good, nice and soft, even on brake caliper hose connection most folks re use the original copper washer because when retightening.... assuming surface is clean and relatively smooth,...a good copper washer will re-form itself a little as needed. And a caliper connection needs to hold brake fluid pressure!

There's no significant pressure in a differential (but you should look on top of yours for a breather, those get clogged..maybe only exist on old fashioned rear axle diff..the breather keeps warm air expansion pressure from building up, preventing diff oil from forcing itself thru axle seals.)"
1op1gk9,Is the sound coming from alternator or engine ?,"There’s grouling kinda noise from the bay 
One mech said it could be engine bearing another said it’s alternator bearing 

What’s your opinion pls ",2,1762345591.0,8,MechanicAdvice,1762457787,2025-11-05 12:26:31,2025-11-06 19:36:27,"Different_Algae4918 (Score: 2): Corolla 2008 1.6 Auto - new oil btw

ComfortablyBalanced (Score: 1): I'm not a mechanic but I'm not sure what they meant by ""engine bearing"" and since your alternator is very easy to work on any mechanic worth their salt could find out whether its bearing is toast or not."
1op175n,13 Ford F150 - bad cylinder head,"My husbands 13 F150 3.5L eco boost has been misfiring, loss of power, rough idle. We did a compression test(which passed) and cylinder leak test and found that one or both exhaust valves are leaking on one side, only holding 10% pressure. Now we’re looking into the cost of replacing the head on that side. Truck has higher miles, over 160k, but is in otherwise good condition. From my research it’s recommended to do both heads, but also much more expensive to do both. My question is - does it make sense to only do one side or if already you’re paying the labor to do one, is it better we do both heads? ",2,1762344814.0,3,MechanicAdvice,1762457787,2025-11-05 12:13:34,2025-11-06 19:36:27,"captianpaulie (Score: 1): That like changing one sock yeah yeah you don’t have to change both socks, but are you gonna leave the old one on the 1 foot? Yes if you’re going to all that work, it makes no sense. Not to replace both head gaskets and do valve jobs or replace the heads.

connella08 (Score: 1): I guess it all depends on how ""good"" the other head is. if they both have 160K on them, then chances are they have the same wear too. usually this is caused by worn valve guides. If you only do one now, you might have to do the other 10k miles from now and you will have to pay for the labor all over again. at least when they have the engine open to do one side, its going to be considerably less labor to do the other side while you are there. Usually I'm on the side of ""if it ain't broke, don't fix it"" but this might be one of those rare exceptions."
1op131m,Crank no start (photo for reference),I have a audi a4 2011 tfsi quattro. Put the key in lights fuel pump an radio all work just no crank have tried starter relay all fuses battery everything works as should any opinions on what could be the problem ? Car is stationary as-well ,1,1762344475.0,3,MechanicAdvice,1762457787,2025-11-05 12:07:55,2025-11-06 19:36:27,A925D (Score: 1): You tried jumping it?
1op0sdt,Do my headlights need to be polished or clean from inside? Or both? Polo 2010,Trying to clean the car as much as possible in order to sell it.,1,1762343566.0,18,MechanicAdvice,1762457787,2025-11-05 11:52:46,2025-11-06 19:36:27,"averagemaleuser86 (Score: 2): It looks like the lenses have already started ""crazing"" which isn't repairable. Crazing is tiny cracking in the lense. Once this happenens theres no real fix. If they were just faded you could do a restoration kit. To get these clear again you're gonna need to replace the assemblies. If you do and dont want this to happen again, go to a local tint shop and ask if they do PPF on headlights.

Eurotrashable (Score: 2): Outside.  Turtle wax restorer.  Cheap and easy."
1op0n4l,2006 Corolla. How to check Transmission Fluid Level,Neighbor has 2006 Toyota Corolla. Rough shifting experienced. Checked under the hood and can’t find a dip stick for transmission level. Am I missing something?,1,1762343077.0,2,MechanicAdvice,1762457787,2025-11-05 11:44:37,2025-11-06 19:36:27,Mountain_Schedule_40 (Score: 1): https://www.carcarekiosk.com/video/2006_Toyota_Corolla_S_1.8L_4_Cyl./transmission_fluid/check_fluid_level
