id,title,selftext,score,created_utc,num_comments,subreddit,scraping_time_utc,created_datetime_utc,scraping_datetime_utc,top_comments
1o52o45,Did I mess up?,"I have a 2021 Alfa Romeo Stelvio Ti and I needed tires. I have the 20 inch wheels (the tires that came with the car are 255/45r/20). I could’ve gotten away with replacing the front set and just followed up a few months from now with the back, but I found a set of used 4 Continental Cross Contact LX Sport tires at a tire shop for $300 total, install included. The tires have about 80% tread life left so I immediately jumped on it, thinking about how Continental is a well known and heavily used brand. The tires look beautiful and the ride quality is amazing, but after looking at reviews on tirerack I’m second guessing the purchase. A lot of the reviews mention complaints about hydroplaning in puddles and heavy rain, and slightly below average performance in snow and ice. They also mention these tires don’t generally last past 25k miles. I live in New Jersey so I’m a little concerned. I live in an urban area and drive about 5 miles a day on average. My son is on a traveling soccer team and we will be driving to NC, VA, and MD starting in January and throughout the spring just to name a few. I thought I was getting ahead by getting these tires before Winter and all the traveling we’ll be doing but now I’m not quite sure.",0,1760307876.0,1,CarTalk,1760383989,2025-10-12 22:24:36,2025-10-13 19:33:09,"Happy_Pitch8673 (Score: 1): Hard lesson learned… do research before purchase. Not a good tire in rain or snow. Replace if possible, prepare for lack of traction in inclement weather"
1o51s97,08 Durango alternator,Can anyone point me to some good videos or resources on how to change the alternator? Any help is useful ,2,1760305634.0,2,CarTalk,1760383989,2025-10-12 21:47:14,2025-10-13 19:33:09,TyburnCross (Score: 1): [first result when googling “2008 Durango alternator replacement”](https://youtu.be/DKfSn_5Xbcc?si=lkz1fWtvcr8z63Dx)
1o50vmc,Just got a 2010 Lexus Ls600h and this popped up …any advise,,5,1760303407.0,3,CarTalk,1760383989,2025-10-12 21:10:07,2025-10-13 19:33:09,"Glad-Pair-5204 (Score: 17): Someone cleared the faults so that you can drive it home and see them for yourself.

rosscO66 (Score: 1): You can turn the PCS off

Hairy_Photograph1384 (Score: 1): My advice is to take photos closer to the subject "
1o4zyik,Cars in Paris,Do I need to say anymore ?,1,1760301254.0,1,CarTalk,1760383989,2025-10-12 20:34:14,2025-10-13 19:33:09,"Consistent-Annual268 (Score: 6): Actually yes, this is CarTalk so you kinda do need to say more. 

This belongs more in r/spotted."
1o4zw6z,Anyone any ideas what this noise is??,"2013 Ford Fiesta ST. 60,000 miles.

This noise happens every time upon startup but only if the engines cold. Once the revs drop it goes away completely and never happens when driving or anything. Its coming from the front of the car so maybe something to do with the engine but there's no other symptoms. Just a noise. It's reasonably loud.

(Cheeky exhaust noise beforehand)",12,1760301106.0,13,CarTalk,1760383989,2025-10-12 20:31:46,2025-10-13 19:33:09,"squarebody8675 (Score: 6): Heat shield rattle

MangeLeBebe (Score: 6): Def sounds like an exhaust heat shield to me. 

Nice FiST!

Apprehensive-Wind646 (Score: 2): pay attention to how it operates normally and watch for sound but I find a lot of cars can make funky sounds that don't mean too much when starting on cold mornings or starting in mornings in general. usually if you can not replicate a sound under normal operating conditions there ain't much to worry about. unless it gets super loud or screechy or something ahha"
1o4xsff,Back Seat removal,"I have a 2024 Nissan kicks. I’d like to remove my back seat entirely. From what I gather, the first step is to pull up the lower cushion by releasing two clips on each side. However I can’t find these clips for the life of me. Any videos I’ve found, everyone just seems to pull the seats up magically. I have to be missing something. Please help, my puppies would greatly appreciate the extra room. ",1,1760296228.0,1,CarTalk,1760383989,2025-10-12 19:10:28,2025-10-13 19:33:09,"Mountain-Ad2190 (Score: 1): Never mind, figured it out. I just wasn’t pulling with enough confidence! One side slightly tore so I used a flat head to pop up one side."
1o4w4lx,What’s wrong with my tire?,"Did some autocross today for the first time. After one of my runs I seen this. I’m assuming the tire was just flexing during a turn but I’m not sure. It wipes off and there doesn’t seem to be damaged, just curious.",59,1760292391.0,32,CarTalk,1760383989,2025-10-12 18:06:31,2025-10-13 19:33:09,"Mother-Compote-2062 (Score: 33): Bonus points for AutoX in a Cadillac. CTS-V?

cat_prophecy (Score: 62): When you apply full lock to the steering, it will cause the bottom of the tire to have positive camber. So it will roll over on the sidewall on hard turns.

thanatossassin (Score: 33): Dude, a long time ago this happened to a Silverado my dad had rented. He had overloaded it with drywall and when we got home, we had very similar marks on the tires. They were longer though, similar spots on the outside like yours, but then straight lines from each spot pointed towards the center. The sidewalls were also larger than your tires, so there's that, but they also just cleaned right off, and no could ever really explain what happened. 

Very curious if any tire shop guys have an idea of what's going on."
1o4uddg,Toyota Yaris 2008 making weird noises,"It sounds like it’s coming from my engine and its like a really intense rattling sound. when my dad popped the hood he also noticed a small corner piece of the engine shell was missing and looked like it cracked off somehow so he was thinking a small piece is in my engine or something. Also I want to go on a road trip with my car also i just dont wanna get stranded if its a major cause of concern.
I do plan on taking it to the mechanic but i need my car for work so I just want to know how much of a concern it is.",1,1760288397.0,2,CarTalk,1760383989,2025-10-12 16:59:57,2025-10-13 19:33:09,"theBarneyBus (Score: 2): It could be anything from a loose engine cover (not a big deal) to rod knock (very big deal). How should we tell?

A video would go a long way in helping diagnose it."
1o4taz3,Exhaust broke,"Hey everyone!

I am currently in need of a quick cheap repair for this temporarily. I have come across people talking about get a couple coke cans, and stainless steel c clamps just temporarily. My mechanic, who’s also a friend of mine, can give me a good price for this so I just need the car to make a 2 1/2 hour drive and that would happen end of the week. I wouldn’t drive my car until I need to do the drive anyways. 

I’ll bite the bullet and get the repair done in town where I am if absolutely needed but was hoping a temp fix would suffice. ",0,1760285943.0,4,CarTalk,1760383989,2025-10-12 16:19:03,2025-10-13 19:33:09,"wiseoracle (Score: 1): If you got the clamps then yeah some cans could be used temporarily. Otherwise letting it hang won’t be a big deal. Just don’t run the car inside the garage as it would be bad to breathe in.

Can’t imagine it costing more than 100-200 to have an exhaust shop weld it up"
1o4t310,Brake Pad and rotor question,"Today the front left tire started grinding as I drove. Got out and noticeable brake dust on that wheel more than others. First time ever replacing brakes for me but going to do it myself. 

I’ve searched this issue on this forum already and it seems the caliper may be stuck? My question is, when I buy pads and rotors and put them on, I know part of the process seems to be using the brake caliper compressor tool to push those back in? Is that going to be enough to fix the issue? Probably no need to buy new caliper too right?

",1,1760285431.0,2,CarTalk,1760383989,2025-10-12 16:10:31,2025-10-13 19:33:09,"QuickSilver86 (Score: 1): YouTube, patience, get pads that include hardware, and do 1 side at a time so you can see how it's supposed to look.

tc6x6 (Score: 1): 1. Before you remove the caliper, stick a pry bar or a long-handled screwdriver between the rotor and the outer pad and use it as a lever to retract the caliper. It's a lot easier than using a C-clamp.

2. After you remove the caliper, replace the lugs (hand tight) to hold the rotor in place. Then give the rotor a spin and visually verify that it's not warped by looking at it from the narrow side.

3. After you reinstall the wheel and hand-tighten the lugs, apply the brakes, then give the wheel a spin. If it sounds or feels like a pad is dragging then you need to replace or rebuild the caliper."
1o4sal2,Polish scratches,"Hey, i’m trying to get rid of some scratches with DA polisher, now i have introduced these swivel marks. I’m using auto finesse one step polish.
",10,1760283601.0,5,CarTalk,1760383989,2025-10-12 15:40:01,2025-10-13 19:33:09,"VestWin (Score: 31): I thought a man from Poland did it

wiseoracle (Score: 8): What pad are you using? What rpm? How many passes perpendicular and vertically? How much pressure are you putting down?

It’s all light swirling which will be easy to fix so no worry

YackReacher (Score: 1): Oil veil!"
1o4rjpj,Hit my car on a guard rail how should i go about fixing it?,"Should i take it to a shop or try to fix it myself, what should i use if so",4,1760281847.0,34,CarTalk,1760383989,2025-10-12 15:10:47,2025-10-13 19:33:09,"rogueop (Score: 32): >what should i use if so

If you need it to look nice, take it to a shop and eat the cost (it will be significant).

  
If you don't, you might just want to live with it.

RYDSLO (Score: 27): This will be thousands of dollars. If you're coming here with these types of questions, any attempt you do to DIY will only make it worse. Your only options are to take it to a shop/call your insurance or ignore it.

agravain (Score: 6): you creased across body lines and down multiple panels. unless you are a skilled body repair person with access to a body shop,that's not really DIY.


take it to several body shops around you for estimates."
1o4r0um,Does anybody have advice to get this mysterious liquid off my car?,I was driving on the highway & a truck with a small black thing attached squirted all over my car. I have no idea what it was & best guess is possibly oil or paint. I tried scrubbing with soap and a bristle brush then tried a steam cleaner. I don’t know if the car wash would help. It came off my windshield when fresh and on the way to work at the time it happened.,138,1760280604.0,146,CarTalk,1760383989,2025-10-12 14:50:04,2025-10-13 19:33:09,"StingMachine (Score: 312): That looks like it’s probably tar. You need to take it to a detail shop, and probably the sooner the better. Some sort of goo gone or thinner will probably be required, and then the paint will need to be protected again. This many spots I would let an equipped shop handle. Might actually result in an insurance claim at this level.

secondrat (Score: 52): Bug and Tar remover.  Or pay a pro.

lysergicaaron (Score: 48): Looks like asphalt sealer. I work with asphalt everyday and it gets all over my truck. I use gasoline on a rag and it comes off. I’d say use it at your own risk though. A safer option is to get the premixed cans of 2 cycle mixed gasoline as it is less harsh and still gets it off. Just definitely rinse your car down with water after you scrub off with the gasoline to avoid any damage to the paint."
1o4qzkk,What is this?,"Just looking at things on this 1998 Honda Civic. I know some things about cars, but not all. ",12,1760280518.0,3,CarTalk,1760383989,2025-10-12 14:48:38,2025-10-13 19:33:09,"GR1ML0C51 (Score: 3): That's the suck & squirt side.

Self_pierce_bear (Score: 2): The bottom pipe is your air intake, pipe from filter to throttle body, then the thing with the spring above it is your throttle body and the main part is your intake plenum. The long bar to the right is your fuel rail."
1o4oyk5,Brake discs,"When I brake there are short squeaking noises. Is this due to the rust on the brake disc? If yes, what helps?",0,1760275377.0,4,CarTalk,1760383989,2025-10-12 13:22:57,2025-10-13 19:33:09,"throws4k (Score: 4): Inside the pads are fine metal wires in the last few mm of pad before it wears out. They are called squealers in my country, their job is to tell you when your brakes are almost worn out. The pictures don't show the pad clearly enough, or it may be even another pad. 

Second option.. the brakes are new and haven't been set in yet they can also squeal. 

Third option.. Hard braking can leave uneven wear causing the pulsing noises.

agravain (Score: 3): the one pad in your picture is pretty low, do if the other three are that low, its pads and rotors time.

tc6x6 (Score: 2): Those pads look pretty thin, so the squealing noise you're hearing is probably the wear indicators telling you that it's time to replace the pads."
1o4mvn2,Is it ok to drive this car,"Hey guys, I was wondering if this car would be ok to drive around the city.
I will not tow anything nor carry anything in the back and i will be using it only to get to work and back.
Max speed I’ll go is 80kmh

Do yall think it’s ok?

Only serious answers please and I need opinions from people who have had similar experiences.

I’m currently low on funds and cannot afford anything else at the moment.",9,1760269310.0,42,CarTalk,1760383989,2025-10-12 11:41:50,2025-10-13 19:33:09,"Suitable_Team_9215 (Score: 25): I’ve seen much worse, but unfortunately, it is not safe. Any hole is too many holes. It could be repaired, but it might not be worth the cost. If it looks like that there, there’s probably worse spots. I would have a good mechanic look it over entirely and give you a quote on the repair.

thejabkills01 (Score: 7): Run it,Honestly, there are way worse cars out there. My buddy? He’s still rocking just one brake! Yup, watch out, he’s basically driving a rolling death trap with style!

Tony-cums (Score: 8): As long as you don’t care about your safety or anyone else’s. Sure."
1o4lehn,What to focus on? (Learning),"Hello, I am a car lady and I really want to improve my knowledge of how to repair and modify cars. I have basic knowledge, and i know pretty much all of my maintenance stuff. Change tires, oil, break fluid, changing headlights, headlight bulbs, refilling coolant, basic electronics, oil filters, etc etc. And I know the basics of how an engine, brakes, and transmission work. (My father was a mechanic, so i picked up on things.) My main thing is I’m getting to the point where I’m gonna buy my dream car (2005 Mitsubishi Lancer Evo Manual.) But the last thing I want is to get it, and fuck it up while trying to repair or mod it. So, I ask, what should I do now before I get it? Just hit the books and study? I don’t really have the extra cash to toss at a shitbox while I wait for my savings to be enough for the Evo, so the only hands-on experience i could probably get would be a class. I eventually want to be able to at least KNOW how to fix any issue with my car on my own, given time and money of course.",2,1760264072.0,1,CarTalk,1760383989,2025-10-12 10:14:32,2025-10-13 19:33:09,"taintsauce (Score: 1): I'd say the big thing is figuring out how to diagnose before going all parts-cannon on the car. Its stupid easy to get into a place where you're throwing things at the wall to see what sticks. 


That takes time and experience.


 A class wouldn't hurt if you're unsure in that area. Your local community college may have something on the cheap if you're unsure of your abilities. You can also do it piece-meal and have things diagnosed at a shop then figure out the repair process to DIY (this is how my wife and I handle things out of our range). You get to learn both how the failure shows up and with some digging, how to fix it.  I'm sure you can find an official shop manual online  somewhere - that'll give all the procedures and torque specs and such. "
1o4kvnx,"Scratched my car on a metal(?) fence. How do I fix this? Winter is approaching, so I have been told I should wait before repainting the scratched areas.","i have been told i can use ""primer for car"" on the scracthes to prevent rust, since its getting quite cold and the roads will be salted soon, and there will soon be snowy. Is this a good idea? a good plan?  
And then when its becomming warmer again, ill repaint the scracthed areas?",0,1760262096.0,12,CarTalk,1760383989,2025-10-12 09:41:36,2025-10-13 19:33:09,"MookieFlav (Score: 3): If you're going to fix it, fix it now. If you're not, then primer it to stop the immediate rust from forming. But note that primer isn't intended to be exposed to the elements, especially for along time, and it'll probably make it harder to paint properly in the spring or whenever you get around to it in the future

Fun-Chef623 (Score: 2): It looks like someone's already painted that fender before.

OS420B (Score: 2): Some primers are hydroscopic, meaning they attract water into it. Because of this, primer should be sealed before it's left to the elements.

No you should not primer and then wait to paint. If you want to redo it in the future, clean and paint it now quickly, and sand it down in the future again and paint it properly."
1o4gf96,I sat in this car as a kid can anyone help find what kind of car this is, Thanks if you can find it know it’s not much to go on ,407,1760245262.0,123,CarTalk,1760383989,2025-10-12 05:01:02,2025-10-13 19:33:09,"bloomincape (Score: 508): Roush sticker on the windscreen my guess is a early new generation of mustang like 2010 era (I’m an Aussie, maybe an American can chime in that would know these models better)

TheDutchTexan (Score: 243): First gen S197 Mustang, 2005-2009.

Source: I own one and the steering wheel is a dead giveaway. Mine isn't a Roush though.

BondGoldBond007 (Score: 140): Based on the windshield banner, steering wheel, and seats - Mustang Roush Edition"
1o4fxjd,Mercedes Benz CPO (165 point or 49 point??),"I am interested in purchasing a CPO 2025 GLC300. The vehicle was first registered in Feb 2025 and has only 4800 miles on it. The dealership provided me the MB CPO Inspection and Certification Report and the report only lists 49 points in the checklist, instead of the full 165 points. The cover page of the report mentions “For Vehicles less than 15 Months old with less than 18000 miles”. The MBUSA website also mentioned that the active warranties include remaining original manufacturer warranty + 1 Yr CPO Limited Warranty; but the 49 points report is bothering me.

So is the vehicle truly Mercedes-Benz Certified?",1,1760243542.0,1,CarTalk,1760383989,2025-10-12 04:32:22,2025-10-13 19:33:09,ToshPointNo (Score: 1): Don't get a Mercedes unless you like paying mechanics.
1o4b997,My friends ej9 civic,Straight piped and turbocharged vtec ,2,1760228849.0,1,CarTalk,1760383989,2025-10-12 00:27:29,2025-10-13 19:33:09,JazzEXH (Score: 2): good stuff
1o4b8ug,Car stolen and located but in garage and key fob won’t work,"!!!HELP HELP HELP!!!

My car was stolen from my buisness in broad daylight and yes I’m dumb and was running late to work so I stupidly left the keys in the car, unlocked, and my purse in the car with my wallet too. I tracked the car and it says it’s in an apartment garage, the cops drove by but there’s nothing they can do without probable cause. So we gave them the spare key and it isn’t responding to the key fab. Is there something these thieves could’ve done to affect the car from reacting to my fab now? Also what other advice can you give me on what to do to get it back because it’s a 2022 Range Rover so they knew to steal it I’m guessing because the mirrors fold in only when it’s locked. ",0,1760228815.0,12,CarTalk,1760383989,2025-10-12 00:26:55,2025-10-13 19:33:09,"robbobster (Score: 23): They disconnected the battery

Longjumping-Log1591 (Score: 10): Hire a tow truck, contact management, get yo car

thanatossassin (Score: 7): GPS tracker saying MY STOLEN CAR IS RIGHT HERE isn't probable fucking cause?  Jfc, have them bring a K-9 unit and dump a bag of weed in front of the garage when no one is looking."
1o4wqoh,How much would it cost to fix this rocker panel,After jacking up my car over 100 times I finally fucked up. Let the jack down in the front jack point and didn’t pull the jack stand far enough away from the driver side door. Didn’t notice til it was too late. 2015 civic si. Idk if insurance will cover this or not considering I’m a dumbass. ,5,1760293815.0,13,carquestions,1760383989,2025-10-12 18:30:15,2025-10-13 19:33:09,"KeldyPlays (Score: 6): https://preview.redd.it/o6bds45k6quf1.jpeg?width=935&format=pjpg&auto=webp&s=9a10b1a0e9fd4124b55b7dd6f6a573337eb94b5f

Wild_Ad4599 (Score: 3): More than it’s worth, $2500 or so. 

If it really bothers you, slap some bondo on there and sand it down and then try to match the paint."
1o4sxnw,Can anyone tell me what could be a problem?,Took car in for a throwout bearing and pilot bearing replacement anf now in have this,0,1760285087.0,7,carquestions,1760383989,2025-10-12 16:04:47,2025-10-13 19:33:09,"Vaderiv (Score: 2): They messed something up. Hopefully, someone who knows about Hondas can give you an idea exactly what it is. I only work on BMWs, and the shifter is totally different. Yours is hooked to the trans with cables. Everything I have worked on was hooked directly to the transmission. Good luck. I hate shops like that. They rip off people. A few weeks ago, a customer was telling me about their truck and showed me the estimate. She took it in for a small oil leak, and the vehicle is in pretty good condition. They gave her a $6000 estimate. It was ridiculous; they were triple charging for labor and had lots of stuff she didn't need. I sent her to a shop that I have been working well with for close to 30 years. They fixed everything it needed for $450. Sounds like you went to one of those crappy shops. Hopefully, they will rectify it. People like that give the rest of us a bad name.

Odd-Concept-6505 (Score: 2): On the bright side , there's no question they messed up something (have to remove transmission..or at least separate engine from it...to get at clutch and bearing...)"
1o4oj9o,Cant find any wireing digrams (2017 lincoln continental),im trying to tap into the ignition wire on my 2017 licoln continental but I can't find a wireing digram and with there being 6 wires idk how to go about it. if anyone has a good resource or knows id appreciated it so much. im trying to install my subwoofer before Monday lol,1,1760274235.0,3,carquestions,1760383989,2025-10-12 13:03:55,2025-10-13 19:33:09,"Remarkable_Dot1444 (Score: 1): You're looking for an ignition on wire, grab a meter and go find it. 

Windshield wipers, cig lighter, lighting in your car or ignition wire off your head unit. 

Learn how to use a meter.

IneptAdvisor (Score: 1): Not ignition wire, ignition trigger wire. Ground your test light and poke wires until you find a wire that has power ONLY with key in the ON position without the engine running. That’s your remote wire for the amp."
1o4mq2b,How much is the panel damage worth?,"Car hit me and trying to get a figure for the panel damage, I’ve priced the mirrors but I’m not sure about the panel damage",1,1760268791.0,4,carquestions,1760383989,2025-10-12 11:33:11,2025-10-13 19:33:09,"RustyRich (Score: 1): It’s a 2013 fiesta Mk7.5

Infamous-Plenty8082 (Score: 1): happened to me, I handed it in, and said, take the cheapest mirror without folding. 100$ for labor and mirror"
1o4ejvx,Why cant this F truck pass emissions? It fails for readiness no matter what I do (please read),"2014 Chevrolet silverado 1500 4x4 -
I bought this truck 4-5 months ago, the engine, the transmission, basically everything's been replaced before I bought it. I go to get emissions on it and it fails for readiness, i drove and drove 4,500 miles since I got it and no matter what I do (drive cycle the get to 50 and coast to a stop) everything it always fails for readiness. 2 mechanic shops said they have no clue.
Im out of options, definitely need help any ideas?
",0,1760238986.0,47,carquestions,1760383989,2025-10-12 03:16:26,2025-10-13 19:33:09,"zrad603 (Score: 8): which readiness monitor isn't getting set?  

some can even fail for something as stupid as a problem with the Air Conditioner.

CurrentlyatBDC (Score: 5): It’s tuned, monitors disabled."
1o4dwx8,"370, issue with keyfob","have 2020 370z that I recently bought used, but for some reason car isn’t registering any buttons from key fob, I have to manually insert the key to get the car up and running.

Can’t open / close door either, anyone had a similar issue?

I ordered new fobs and got them programmed, same issue",1,1760236945.0,2,carquestions,1760383989,2025-10-12 02:42:25,2025-10-13 19:33:09,"Remarkable-Junket655 (Score: 1): The remote keyless entry receiver and the BCM are the parts responsible for all those functions. 

Its also quite possible that there is some aftermarket device, phone charger etc emitting interference that is preventing the key signals from being detected."
1o4dtqi,How fast do y’all drive on the highway in the rain? Everyone around me drives recklessly 75+,From my observation Im the only one who has a fear of hydro planing… drivers typically drive extremely slow and sluggish on a dry bright sunny day. But once it starts raining cats and dogs everyone drives like they lost there minds. What have y’all experienced am I on to something?,0,1760236667.0,28,carquestions,1760383989,2025-10-12 02:37:47,2025-10-13 19:33:09,"Material_Web202 (Score: 7): Buy good tires and if ur scared sit in right lane

Beanmachine314 (Score: 5): Just because you can't drive the speed limit in the rain doesn't mean everyone else has to slow down."
