id,title,selftext,score,created_utc,num_comments,subreddit,scraping_time_utc,created_datetime_utc,scraping_datetime_utc,top_comments
1ozjplc,"Posting this to get some honest mechanic opinions about what happened to my 2001 Jeep Grand Cherokee (4.0L, 42RE, ~133k miles).","I’m looking for some honest mechanic advice about what happened to my 2001 Jeep Grand Cherokee (4.0L, 42RE, \~133k miles).

Before all of this, the Jeep actually ran fine. The only issue I had was a small coolant leak — I had to add a little coolant every 100-150 miles, but the vehicle ran smooth.

I took it to a shop to diagnose the coolant loss. They said it was a cracked radiator so I had that replaced. When I picked it up the mechanic mentioned he struggled getting the transmission cooler lines off the old radiator, but said everything was back together properly.

Shortly after that radiator job, I noticed I was suddenly losing transmission fluid. I brought it back, and that’s when the shop told me the transmission pan gasket was “broken.” This didn’t make much sense to me because I had a fluid + filter + new gasket done about a month earlier at a different shop. To fix the leak, they performed a full transmission service: new fluid, new filter, and a new gasket.  The shop owner mentioned he was using a brand of transmission fluid called Eneos. When I asked him to confirm that was ATF+4, which is what the Jeep requires, he said yes.

Immediately after *this* transmission service, everything went downhill fast. Around 40 miles later the TRANS OVER TEMP light came on, the O/D OFF light came on, I could feel slipping, the ATF smelled burnt. I turned the engine off and had it towed to the shop.

When they dropped the pan again, there were shiny metal flakes in it. They said reverse was no longer working..

The explanations from the shop changed multiple times while I was waiting. First, they told me the transmission was not overheating, it was actually the engine, even though the TRANS OVER TEMP light literally came on. Then it seemed like they started deflecting.  First, they said it might be a bad radiator cap. Then they started saying it was caused by the transfer case, which makes no sense at all.

While waiting, I Googled the Eneos transmission fluid and found out that they don't even make ATF+4.  When I asked the owner to show me what he put in, he showed me a picture on the computer of ""Eneos ECO ATF Plus"".  When I told him that can't go in my Jeep, he said ""oh sorry I confused your vehicle with another, we actually used Valvoline ATF+4....""

They also claimed my transmission had “half a quart of fluid” before their service, which doesn’t make sense because the Jeep was driving fine.

What I’m trying to figure out from people who know these transmissions:

– Does a pattern of **immediate** overheating, O/D OFF, burnt ATF, sudden reverse failure, and shiny metal flakes line up with a service error — like a mis-seated filter, wrong fluid, or pump aeration?  
– Could the mechanic struggling with the cooler lines or doing a makeshift fix during the radiator job cause these issues later?

The shop records their bays, so I’ve requested the video to verify what fluid was actually used.

I’m trying to figure out whether this was just terrible luck with an old transmission, or whether the service itself triggered the failure. Any honest insight — especially from anyone familiar with the 42RE — would be hugely appreciated.",1,1763394439.0,4,mechanic,1763494543,2025-11-17 15:47:19,2025-11-18 19:35:43,"PPGkruzer (Score: 1): How does this part not answer your question? I see it as someone filling your engine with washer fluid and then saying oops about that, you still need a brand new engine: ""While waiting, I Googled the Eneos transmission fluid and found out that they don't even make ATF+4. When I asked the owner to show me what he put in, he showed me a picture on the computer of ""Eneos ECO ATF Plus"". When I told him that can't go in my Jeep, he said ""oh sorry I confused your vehicle with another, we actually used Valvoline ATF+4...."" "".


You got to document all this stuff. Draft a couple paragraphs of words explaining exactly what happened start to finish <- that's 98% of your affidavit of facts.

3RDGENX (Score: 1): From the info you've given I believe the initial trans fluid leak was caused by the radiator replacement. Then they tell you it's the trans pan gasket to get you to pay them again instead of standing behind their work. And after putting in the wrong trans fluid it destroyed your transmission. Thinking they could tell you it wasn't their fault and get you to pay AGAIN is crazy. They must think you're stupid. Hopefully an auto transmission person will reply with the technical info you need to prove negligence on their part but a fluid analysis would show what combination of fluid was used. Good luck."
1ozj1py,Where can I find just this part that connects the motor to the whole assembly,,0,1763392881.0,40,mechanic,1763494543,2025-11-17 15:21:21,2025-11-18 19:35:43,"3579 (Score: 21): You can't, this is how it's been done forever. You have to buy the whole linkage.

Pimp_Daddy_Patty (Score: 9): Scrap yard."
1ozgq7h,Restrictor plate removal from Nissan Juke CVT,The problem can be seen in the video. A guy recommended that i remove restrictor plate and the problem will go away. Chatgpt suggests the same but it also says cvt will act more aggressive. Any suggestions ? And also does restrictor plate stays on the hose that leaves the cvt and goes to the radiator ? Chatgpt also said that it is there.,0,1763387280.0,21,mechanic,1763494543,2025-11-17 13:48:00,2025-11-18 19:35:43,"Guero-Chulo (Score: 14): Didn’t you post this 2 days ago.

Everyone told you that it was the CVT transmission yet you are looking for a quick fix.

ColoradoCyclist (Score: 4): Someone must be messing with you. It’s not going to fix this problem."
1ozfadf,"2021 f150 3.5l Ecoboost, 66k miles, 4WD","
The area I live has extremely expensive dealerships for mechanic work. I’m hoping someone here would know what this rattle is. It occurs when accelerating, usually between 4th and 6th gear. When I take my foot off the accelerator during the rattle it is still present. Sometimes this is accompanied by a loss of pro power onboard, sometimes my 4x4 will not turn on as well, and then the last few days I’ve had some sluggish acceleration going uphill. It’s been going on for a week but today has been worse and the check engine light came on. I’ve maintained this vehicle with maintenance every 5k miles throughout its life. 
",7,1763383458.0,7,mechanic,1763494543,2025-11-17 12:44:18,2025-11-18 19:35:43,"Longjumping-Drink186 (Score: 1): Not a mechanic, but a prior 05 f1shitty owner (Ford lost my business for life with that truck. And it was ONLY Ford I ever had the displeasure of owning). 45k miles, went straight to auction. Ford itself didn't want it back, and I got slammed with $7k in the negative. Never the fuck ever again. 

The problem isn't you bought a truck, it's you bought into the WRONG truck/brand. 

Ford makes majority of its money from bullshit repairs and warranty bullshit, not via sales. I know this, cus my own mother works for a Ford actually, (first ever domestic dealership she's worked for in over 30 yrs being in automotive finance). She WORKS for them, and will never ever own one, any model. 

So, I am unsure exactly what might be wrong. But you need to dump it. Just do yourself a favor. Before it puts you further in a hole, and you are forced to keep, cus you're trying to get your 'moneys worth' out of it. It will never happen. 

Fords track record is so bad, that even IF it's cared for, good condition, etc. Their resale value TANKS! you lost $10k+ it's original worth, in just the first 3 yrs of ownership. Regardless of miles, condition. 

I'd tell ya, don't bother with domestic at all. They're all trash. (They are, even if people don't want to admit it). They're what keep our mechanics in business.  That and foreign like bmw, Mercedes, land rover. Etc. 

They're also not most sold, they're the most RESOLD trucks in America. So don't give into their bullshit hype either. 

100% ask any actual mechanic on this sub, what brand they work on the most. 100% it'll be domestics, predominantly Fords. 

They're built to break on purpose. Cus it's how they make their money. Dead serious and you can look it up. They are literally outsold in All Categories including their trucks, by EVERYONE else. Even fellow domestic competition. (They bunch up the entire f-series into overall truck sales, then claim most sold. Not a particular model on its own.) 

I don't even understand how they even still sell, especially when they recall MILLIONS, every single fucking year. When are people ever gonna learn? Patriotism shouldn't cost you your hard earned money, to repair shit that shouldn't be a problem to begin with. 


Honestly, an early 2000s, tundra will outlive your truck. And that's pretty fucking sad.

Edit: not a truck, though truck based. I replaced that factory piece of shit, with an 07 Toyota 4runner (base model, 2wd, v6 (as they also came with a V8 as an option. Not just any V8, but the best gas V8 ever made).) that at the time, had 112k miles. Today, it's over 190k. I've had it 10 yrs. Most EXPENSIVE need in all this time, was tires. Bruh, the SUV is almost 20yrs old! Almost 200k miles, and tires are the most expensive thing I had to worry about in 10yrs?! so why the FUCK is your practically new truck, with not even 70k on it, giving you potentially expensive issues? Cus it's a Ford product, that's why.

Oh, and in my ownership, it's never seen a dealership after purchase. And very very few mechanics. As I don't trust the majority  of em. It's only ever been in the shop, cus of my inability to do it myself. Outside of that, it never sees one.

ronalda62 (Score: 1): First I would have someone read the codes to see what's going on there, it may be all related.
Is it a standard Ecoboost or a Powerboost?"
1ozetfk,What are those weird pauses from the exhaust?,"It’s my great granddad‘s 77 F250 that he had sitting in the woods for 20 years. It has a 351m that starts and runs fine, just smokes and the weird noise from the exhaust.",1,1763382034.0,4,mechanic,1763494543,2025-11-17 12:20:34,2025-11-18 19:35:43,"375InStroke (Score: 8): The firing order has two pulses on the same bank causing that. It goes LRLLRLRR

REDDITSHITLORD (Score: 3): lol... A 1970s American V8 has a slight miss at idle? Oh, you don't say! 

I mean it honestly probably started doing that by the '80s. Nothing to worry about. fresh plugs and ignition wiring might clear it up. But it alsommight just have a touch low compression on one cylinder, and off-idle it builds enough pressure to run smooth.

All things considered it sounds pretty good.  Send it!"
1oz8prs,"should i buy this 05 lexus is300 (3.0-liter, straight-six, 2JZ-GE)","(engine may be wrong but i know the car is stock)
i have been looking for a is300 for around 2 years now and i’ve been looking for one with relatively low mileage and good maintenance. i’m a first time buyer and i want to make sure my first car doesn’t shit on me and i think i finally found a good one. i found it on market place and here is the listing.

92,500 miles.

Holds a clean title

Timing belt service was done at 81k miles in November 2021. 

Recent service includes all 4 struts, front right and left control arms, ignition coils and spark plugs. 

Engine is very sound and good

does have scratches and wear on the leather which has been covered with vinyl. 

Front door lock actuators must be manually operated with key. 

Recent smog certificate. No check engine lights, no leaks. 

Registration paid till October 2026. $10,000 or best offer

on paper it sounds good but when i went to check it out with my friend who owns a 01 is300 he said that its burning oil and power steering is leaking. it has also been in a accident since right fender and rear bumper is changed but car fax that was given says it was minor. the guy is willing to sell it to me for 9k and the car is getting a lot of offers so i wanna know if i should let it go or if i should buy.",3,1763359445.0,6,mechanic,1763494543,2025-11-17 06:04:05,2025-11-18 19:35:43,"chairshot125 (Score: 1): Hard pass. /s What's the seller's info? If you're into those things, it's a pretty solid motor. Really low mileage. Very high resale value. The engine itself is worth a lot.

Icy_East_2162 (Score: 1): I think it's priced reasonably,  The question is,  IS IT BURNING OIL , Does it blow blue smoke ,Have a close look at inside the exhaust tail pipe ,If it's greyish colour ,Not oily black , 
If your keen ,put the squeeze on ,Flash the cash ,8k 
see if Mr piggy takes a bite lol,They can bring 10 to 20 K in top condition"
1oz3tww,"Honda Accord 2002 5 speed manual, what’s causing this rattle like noise when switching gears and accelerating?",,1,1763344519.0,5,mechanic,1763494543,2025-11-17 01:55:19,2025-11-18 19:35:43,"SteveInCol (Score: 1): Sounds like wind noise. Are the windows down or up?

SteveInCol (Score: 1): Do you have anything on the roof such as a luggage rack or anything else that could be loose? Is the hood latching properly?"
1ozwbgz,Will these jeep wheels fit on a 2004 Toyota highlander?,Not sure what year the wheels are but this is common 5 lug pattern on most modern cars? ,0,1763422889.0,5,StupidCarQuestions,1763494543,2025-11-17 23:41:29,2025-11-18 19:35:43,"Aromatic-Scratch3481 (Score: 4): Step one find out the bolt pattern of both wheels. Google. If the bolt patterns work move to step 2

Step two. Find out each wheels size and offset. Also Google wheel offset calculator. Also tire/wheel size calculator. Just go get an idea.

If all that matches up, somehow, you probably still have to put the car high up enough in the air safely and spin the wheel to be sure it doesn't hit the brake caliper, or rub etc.

The toyota bolt pattern is 5x114.3 in  so says Google AI.

Edit. 

No. Google lens says the bolt pattern for those wheels is 5x127.

Also like, it's 2025. Google has ai I'm pretty sure you can just ask that

Iceyn1pples (Score: 2): You need to look up those Jeep rims bolt pattern and offset and compare those to your 2004 Highlander.

boinger (Score: 2): It depends...Jeeps have various bolt patterns.

Yours are 5x4.5 -- Jeeps _can_ have 5x4.5 or 5x5 or 5x5.5 (though...the 5x5.5 are the old spec...it's unlikely to be those)"
1ozt9xc,Is this something odd from my car and mechanic or nothing,"After moving my car back from a spot I don’t always park I noticed these right next to where my passenger front tire would be. Broken zip tie and impression from the zip tie seen on the cardboard pieces. Rolled up, and compressed. Looks like pieces of a brake pad box maybe? Could just be trash from the road but odd to be all bunched together with that broken zip tie. I got work done that was messed up and had to bring my car back for them to fix the rotor. So I’m not sure if I’m just in my head or not; looking for insight, thanks.",0,1763415599.0,13,StupidCarQuestions,1763494543,2025-11-17 21:39:59,2025-11-18 19:35:43,"CooduhWRX (Score: 3): idk did you run something over lol

BlazedJerry (Score: 3): That’s just trash from some brake pads

Living_Variation_578 (Score: 1): Not unless your car has been baling behind your back."
1oz8mag,Auto shop,"I’ll try to make this short and simple 
I have a 2011 bmw 328i, car is in absolute shambles I know this, I took it to a shop and they said I need my spark plugs changed, cool
I got them fixed and turns out had a huge oil leak in that area they changed them out but was like this isn’t drivable anymore long story short I’m wondering if I should just take this hit I paid $720 for that but wish if this was the end result I would’ve never done it 
I’ve somehow driven the car for years and up until I take it to get fixed now I don’t even have the car anymore it’s still at the shop. I’m asking because ChatGPT is saying I should do some talking and pretty much get a refund of some sort or take it to an attorney general or wtv.",1,1763359141.0,1,StupidCarQuestions,1763494543,2025-11-17 05:59:01,2025-11-18 19:35:43,"EuroCanadian2 (Score: 1): If it needed spark plugs, and you agreed to have them changed, and they did the job, I really don't think you are entitled to a refund.  

It sounds like it needs a lot of other work too.  Which is not surprising for a 15 year old BMW. I wouldn't call a lawyer unless you want to spend even more on lawyer fees than fixing your car.  

Oil leaks are common in BMWs this age.  I assume the shop spotted it when they were changing in the spark plugs.  AFAIK, one of the common leaks is from the oil filter housing. If not repaired, the oil drips into the alternator and ruins that as well.  Another common problem is that plastic parts in the cooling system get brittle with age, then crack and leak.  If you keep driving with this problem, the engine overheats due to lack of coolant and can be damaged internally."
1ozje2f,Why are there no good ODB2 Reader Programms?,"Hello, so basically i am really interested in reading out the error codes from my BMW. I have a Laptop and an OBD2 to ENET Cable. But there really is no good free software i think. The only things i could find are like ISTA+ and others, which in really are cracked licensed  software. And why are there no open source programs?",8,1763393690.0,14,CarHacking,1763494543,2025-11-17 15:34:50,2025-11-18 19:35:43,"JEFFSSSEI (Score: 9): Mainly because basic OBDII is universal/open, but once you get beyond that to vehicle specific codes etc.  scan tool companies have to enter a licensing agreement with each vehicle manufacturer for access to that additional data/information etc.  that is why you pay more for scan only tools that have specific manufacturer support, and also why you won't find one that has bi-directional capability that doesn't have an annual subscription/update/upgrade cost.

half-t (Score: 7): There is no open source software because it's very specific to the OEM. And this information is not publicly available. So, why should I waste my time on such a project if the workshops buy the OEM diagnosis system?

CailNlippers (Score: 3): The simplest, free option for just reading codes would be BimmerLink, it's an android app that works with a multitude of adapters.
There's a paid version as well that lets you dive in at almost dealership level."
1ozi1hg,Recommended tools for CAN bus analysis & injection?,"“Hey everyone, I’m new to CAN hacking and preparing for a mobility hackathon. Right now I’m using ICSim and SavvyCAN on Kali. Which tools do you personally find most useful or most common for real CAN analysis and frame injection? SavvyCAN, can-utils, python-can, or something else? Would love your recommendations!”",4,1763390523.0,5,CarHacking,1763494543,2025-11-17 14:42:03,2025-11-18 19:35:43,"Usedtissue_Gaming (Score: 3): Are ""real"" enterprise grade tools in the budget? VECTOR is the industry standard, and VN1630A's can be equipped with 4 channels + I/o. I find CAPL scripting to be pretty intuitive.

nickfromstatefarm (Score: 3): Initial sniffing/handy interface: Peak USB FD w/ SavvyCAN

Eventually once my hardware is in the vehicle I use a virtual adapter to use my own hardware as a permanently installed CAN interface with SavvyCAN (via USB or WiFi).

For debugging bus errors and load testing, PCan-View

robotlasagna (Score: 2): I built my own like 20 years ago using the peak API."
1ozbwrz,Anyone tried reverse engineering Hyundai/Kia GDS?,"On my car, the CAN bus only has the ECM and the OBD port connected to it. Other modules communicate with scan tools over K-Line, which requires manufacturer-specific scan tools.

Has anyone tried reverse engineering the Hyundai/Kia scan tools, such as the GDS VCI? I don't have access to these where I live.

I'm mainly interested in PCM data such as the transmission oil temperature.

(This wiring diagram is for a Kia Picanto and likely applies to the Hyundai i10 I as well)",10,1763371718.0,1,CarHacking,1763494543,2025-11-17 09:28:38,2025-11-18 19:35:43,"examen1996 (Score: 1): Check comma.ai / openpilot, they did a lot of work reverse engineering Hyundai/kia vehicles "
1ozwpy1,"Low oil pressure light in the morning upon startup, turned off car immediately. Tried turning it on in the evening, cranks but doesn’t start. Any ideas? Video attached","2006 polo 9N, refently replaced sparkplugs and ignition coils. Car started, gave red oil light, turned off and won’t start up again.

How serious is this? ",1,1763423915.0,9,AskMechanics,1763494543,2025-11-17 23:58:35,2025-11-18 19:35:43,"Any-Progress-4673 (Score: 2): Very serious. Do you have oil in it?

RedFlaggWaving (Score: 1): Pretty serious. Check your oil level. 
When was the last time the oil and filter were changed?"
1ozwkfv,What’s this sound like it could be?,"There’s a screeching metallic sound like an old gate or swingset when I turn to the right and creep forwards slowly, I also hear a similar sound sometimes not as loud at normal speeds going straight (2011 Ford fusion sel 2.5l)",1,1763423526.0,6,AskMechanics,1763494543,2025-11-17 23:52:06,2025-11-18 19:35:43,Icy_Tomato8317 (Score: 1): Seems like it only happens in drive as well
1ozwib0,What’s this noise from?,"Squeaking noise that happens after I let off the gas, sometimes right away sometimes a few seconds after. 
Video was at highway speeds. 
Haven’t really noticed at lower speeds.",3,1763423374.0,3,AskMechanics,1763494543,2025-11-17 23:49:34,2025-11-18 19:35:43,"bigbenjamino64 (Score: 1): Don’t know how to edit the post. It’s a 2023 Mazda cx-50

SAFODA16 (Score: 1): Sounds like a metalic sound. Maybe is your gas pedal's spring?"
1ozwgq7,"Boys, am I cooked?","Just did a water pump and thermostat replacement on my 2010 Toyota Corolla 1.8L and although I was fine on temps for my drive to and from work, at the last moment my temps started to climb, but not to red. I lost heat in my heater momentarily. Ive just replaced the radiator cap, but when checking my oil I noticed this thin white strip that almost looks bubbly. Is my head gasket cooked?",1,1763423260.0,7,AskMechanics,1763494543,2025-11-17 23:47:40,2025-11-18 19:35:43,"E_Blue_2048 (Score: 3): I see nothing in the video. Would you take a picture?

Nervous_Lynx1946 (Score: 1): My reservoir isn't milky, neither is my gas cap. Only the small part on the dipstick."
1ozw2sl,Ford futura 2002,There is a rattle sound coming from under my car. It seems this is loose. How difficult is it to fix myself and is there any issues I have to look out for? ,1,1763422262.0,3,AskMechanics,1763494543,2025-11-17 23:31:02,2025-11-18 19:35:43,DisabledVet13 (Score: 1): Looks like heat shield for cat. Take it to a muffler shop.
1ozw1tz,And warn worn strut mounts cause this?,2015 Audi A3 Quattro have about 15 to 20K on these tires only happening on the front. Less than 1 year old ,1,1763422199.0,18,AskMechanics,1763494543,2025-11-17 23:29:59,2025-11-18 19:35:43,"SpicyCurryO_O (Score: 2): Possibly yes, but also taking corners fast and is the tire by any chance a Bridgestone?

ramank93 (Score: 1): Fairly new tires. Bought them this year and installed this year. Balance mounted four-wheel alignment. Was running the recommended 41 psi as per the door jamb reduced it to 35 and it seemed to help a little bit. I think my strut mounts are worn, creeks and clunks around bumps and corners occasionally, 

I do drive with a fairly heavy foot but rarely brake traction"
1ozuw4t,Estimate Repair Cost?,"Hi Everyone,

I was an idiot today and side swiped a pillar with my car (Toyota Grand Highlander XLE, Hybrid).

I reached out to an auto repair shop and they estimated the cost would be ~7.2k (estimation in last pic). 

Does this estimation seem reasonable for the amount of damage? ",0,1763419367.0,3,AskMechanics,1763494543,2025-11-17 22:42:47,2025-11-18 19:35:43,"swissnavy69 (Score: 1): Get another estimate.... Also if you have insurance who cares?

FallNice3836 (Score: 1): Yup but we’re not auto body we are mechanics."
1ozuusf,Is this white smoke normal in cold weather?? Or head gasket issues? I checked oil and oil cap it looks normal,,1,1763419276.0,11,AskMechanics,1763494543,2025-11-17 22:41:16,2025-11-18 19:35:43,"Spaced_rat (Score: 1): It can be condensation inside the exhaust.  Are you losing coolant?

Life-Influence-1109 (Score: 1): Totally normal……
It’s that time of the year…."
1ozutpz,"New Gear Pattern, 4.56 Ford 8.8, whining on coast side at all speeds.","I installed a new set of gears in a Ford 8.8 axle. And I can’t seem to get the gear pattern right. Pinion preload is set to 25 inch/lbs, which is within Ford spec. The backlash is at .010 inches. I thought pinion depth was correct but it howls like crazy on the coast side of the gear at all speeds. The numbers on the pinion from the manufacturer seem completely illegible and it previously had .041 inches of depth shim.

Any input is helpful and appreciated. I’ve only assembled a few diffs and I was fortunate enough to have them go together perfectly with no noise so I didn’t really have to learn how to troubleshoot if the assembly was poor. ",2,1763419209.0,4,AskMechanics,1763494543,2025-11-17 22:40:09,2025-11-18 19:35:43,"geekolojust (Score: 2): Grease works, but I would go for some gear marking compound."
